Secrecy of Flynn intercepts complicates response to judge's order,www.msnbc.com,msnbc.com,06-01-2019,2019,6,http://www.msnbc.com/rachel-maddow/watch/secrecy-of-flynn-intercepts-complicates-response-to-judge-s-order-60710981968,"Devlin Barrett, national security reporter for the Washington Post, talks with Rachel Maddow about the secret nature of the phone intercepts that serve as part of the basis of the evidence against disgraced Trump NSA Michael Flynn, and why that complicates the prosecutors' response to the judge's order to make them public. June 1, 2019"
Late reprieve spares Missouri from zero legal access to abortion,www.msnbc.com,msnbc.com,06-01-2019,2019,6,http://www.msnbc.com/rachel-maddow/watch/late-reprieve-spares-missouri-from-zero-legal-access-to-abortion-60712005844,"M'Evie Mead, director of Planned Parenthood Advocates in Missouri, talks with Rachel Maddow about a judge's temporary order allowing Missouri's last abortion-providing clinic to remain in operation pending another ruling next week, and the broader fight to prevent Missouri Republicans from making Missouri the first U.S. state with zero legal access to abortion. June 1, 2019"
Jon Meacham on Trump's wild week: Our public life has become a bar fight,www.msnbc.com,msnbc.com,06-01-2019,2019,6,http://www.msnbc.com/11th-hour/watch/jon-meacham-on-trump-s-wild-week-our-public-life-has-become-a-bar-fight-60714053766,"Pulitzer-prize winning presidential historian walks us through the impeachment fight in the wake of Robert Mueller's comments on his investigation and Trump's subsequent reaction. June 1, 2019"
"Disney, Netflix consider boycotting Georgia over abortion ban",www.msnbc.com,msnbc.com,06-02-2019,2019,6,http://www.msnbc.com/am-joy/watch/disney-netflix-consider-boycotting-georgia-over-abortion-ban-60740165989,"Disney is on a fast-growing list of entertainment companies threatening to pull film and television projects out of Georgia if the state’s highly-controversial abortion law goes into effect. Joy Reid and her panel discuss how a boycott could drastically alter Georgia’s economic landscape. June 1, 2019"
"“The Black Godfather” documentary explores the life of influencer, Clarence Avant",www.msnbc.com,msnbc.com,06-02-2019,2019,6,http://www.msnbc.com/politicsnation/watch/-the-black-godfather-documentary-explores-the-life-of-influencer-clarence-avant-60741701762,"Clarence Avant, nicknamed “The Godfather of Black Music” had an indelible mark on the careers of countless artists for more than half a century. June 1, 2019"
Deceased G.O.P strategist played role in push for Census Citizenship Question,www.msnbc.com,msnbc.com,06-02-2019,2019,6,http://www.msnbc.com/politicsnation/watch/deceased-g-o-p-strategist-played-role-in-push-for-census-citizenship-question-60742725675,"The 2020 Census Citizenship question originated with a deceased republican GOP Strategist, Thomas Hofeller, who designed it to harm democrats and minorities at the ballot box, according to the New York Times. June 1, 2019"
"Columnist: Mueller should directly state his thoughts on obstruction, impeachment",www.msnbc.com,msnbc.com,06-02-2019,2019,6,http://www.msnbc.com/kendis-gibson/watch/columnist-mueller-should-directly-state-his-thoughts-on-obstruction-impeachment-60743749626,"MSNBC’s Kendis Gibson discusses the issue of impeachment with the New York Times’ Peter Baker and Michelle Goldberg. Since Mueller won’t make any direct statements about what he thinks, Baker said, both Democrats and Republicans are “drawing what they want out of this.” Goldberg says she thinks Mueller needs to be more direct, and he needs to testify before Congress, as much as he doesn’t want to. June 1, 2019"
"Former US Attorney and NYT Correspondent discuss Flynn, Mueller",www.msnbc.com,msnbc.com,06-02-2019,2019,6,http://www.msnbc.com/kendis-gibson/watch/former-us-attorney-and-nyt-correspondent-discuss-flynn-mueller-60743749602,"MSNBC’s Kendis Gibson discusses the Flynn tapes and the Mueller report with a panel. Former US Attorney Barbara McQuade commented on the Justice Department’s rejection of a judge’s order to release transcripts of Michael Flynn’s conversations with the Russian ambassador, saying that when a judge orders you to produce something, “the expectation is that you’ll produce it.” About Mueller’s statement this week, New York Times Washington Correspondent Charlie Savage said Mueller is “leaving a trail of breadcrumbs” to a conclusion, but maddeningly won’t say directly what he means. June 1, 2019"
2020 candidates at California Democrats' Convention in San Francisco,www.msnbc.com,msnbc.com,06-02-2019,2019,6,http://www.msnbc.com/kendis-gibson/watch/2020-candidates-at-california-democrats-convention-in-san-francisco-60742725942,"MSNBC’s Kendis Gibson discusses the California Democrats’ State Convention. MSNBC Senior Politics Editor Beth Fouhy says California will be a key state in the 2020 election because it’s so populous – and because it’s been a bulwark of anti-Trump resistance. Daniella Gibbs Leger, Executive Vice President of Communications and Strategy for the Center for American Progress, commented on candidate Joe Biden’s absence from the event. He may just be riding on the coattails of his name recognition, she said, but in the future will have to engage with people at the same level as the other candidates. June 1, 2019"
Trump maintains strong approval ratings with GOP ahead of 2020,www.msnbc.com,"March 6, 2019",06-02-2019,2019,6,https://www.msnbc.com/hardball/watch/trump-maintains-strong-approval-ratings-with-gop-ahead-of-2020-1452689987559,Morning Joe The president does not care about the law: Rep. Hill 
Democrats’ Trump impeachment attempt could be based on Watergate,www.msnbc.com,msnbc.com,06-03-2019,2019,6,http://www.msnbc.com/am-joy/watch/democrats-trump-impeachment-attempt-could-be-based-on-watergate-60770373787,"During the Watergate era, Republicans voted to impeach a Republican president when Democrats were able to create a bipartisan coalition to impeach Richard Nixon. Joy Reid and her panel discuss what Democrats of today could learn from that seminal political moment. June 2, 2019"
Netflix series ‘When They See Us’ depicts Central Park Five case,www.msnbc.com,msnbc.com,06-03-2019,2019,6,http://www.msnbc.com/am-joy/watch/netflix-series-when-they-see-us-depicts-central-park-five-case-60769349923,"‘When They See Us’ is a powerful new Netflix series about the wrongful conviction of five black and Latino teenagers commonly referred to as the Central Park Five, developed by writer, director and producer Ava DuVernay. Rashad Robinson of Color of Change joins Joy Reid to discuss how examining the past can inspire citizens today to work towards reforming the American criminal justice system. June 2, 2019"
Protester grabs mic from Kamala Harris in harrowing security lapse,www.msnbc.com,msnbc.com,06-03-2019,2019,6,http://www.msnbc.com/am-joy/watch/protester-grabs-mic-from-kamala-harris-in-harrowing-security-lapse-60770373836,"A protester grabbed a microphone from Sen. Kamala Harris at an event on Saturday, causing many to question the security needed for Democratic candidates and the treatment by society of women and people of color. Joy Reid and her panel discuss. June 2, 2019"
Where are the congressional hearings on Puerto Rico?,www.msnbc.com,"Sept. 14, 2018",06-03-2019,2019,6,https://www.msnbc.com/all-in/watch/where-are-the-congressional-hearings-on-puerto-rico-1320087619657,Morning Joe DNC chair defends decision to cap debate at 20 
Televangelist who refuses to fly commercial with 'demons' calls for day of prayer for Trump,www.msnbc.com,"June 2, 2019",06-03-2019,2019,6,https://www.msnbc.com/am-joy/watch/televangelist-who-refuses-to-fly-commercial-with-demons-calls-for-national-day-of-prayer-for-trump-60767301683,AM Joy Protester grabs mic from Kamala Harris in harrowing security lapse 
LGBT life in small towns highlighted in 'State of Pride',www.msnbc.com,msnbc.com,06-03-2019,2019,6,http://www.msnbc.com/morning-joe/watch/lgbt-life-in-small-towns-highlighted-in-state-of-pride-61143109601,"June is Pride Month, and Raymond Braun, host of the new documentary 'State of Pride,' joins Morning Joe to discuss the country 50 years after the Stonewall Riots. June 3, 2019"
Did Bill Barr exploit Mueller’s quiet approach to the job?,www.msnbc.com,msnbc.com,06-03-2019,2019,6,http://www.msnbc.com/the-beat-with-ari/watch/did-bill-barr-exploit-mueller-s-quiet-approach-to-the-job-61146693568,"Mueller allies and former federal prosecutors Glenn Kirschner and John Flannery debate Mueller’s methods June 3, 2019"
"Monday's Campaign Round-Up, 6.3.19 | MSNBC",www.msnbc.com,Steve Benen,06-03-2019,2019,6,http://www.msnbc.com/rachel-maddow-show/mondays-campaign-round-6319,"By Steve Benen Today’s installment of campaign-related news items from across the country.
* With California hosting a massive presidential primary early next year, 14 presidential hopefuls attended the California Democratic Party’s convention over the weekend. It was, by all accounts, a rather raucous affair.
* At a Fox News town-hall event last week, Sen. Kirsten Gillibrand (D-N.Y.) said, “We want women to have a seat at the table.” Host Chris Wallace asked the presidential candidate, “What about men?” to which the New York Democrat replied , “They’re already there – do you not know?”
* Mayor Pete Buttigieg, a prominent Democratic presidential contender, has begun fleshing out his plan to overhaul the U.S. Supreme Court. Under his vision, the high court would have 15 members: five justices affiliated with Democrats, five affiliated with Republicans, and five chosen by the other 10.
* In case there were lingering doubts, Maryland Gov. Larry Hogan (R) ruled out the possibility of a 2020 presidential campaign over the weekend. Hogan had considered taking on Donald Trump in a Republican primary.
* On a related note, former Ohio Gov. John Kasich (R) late last week also said there’s “ no path ” for him to defeat his party’s president in 2020.
* In one of this year’s most closely watched contests, Kentucky Gov. Matt Bevin (R) is one of the nation’s most unpopular governors, but he may win re-election anyway because he’s a Republican.
* In Montana last week, the conservative Senate Leadership Fund, a super PAC that helps Republican candidates for the U.S. Senate, launched a new ad attacking Gov. Steve Bullock (D). That wouldn’t be especially notable except for the fact that Bullock is running for president, not the Senate, though the SLF apparently isn’t convinced about his 2020 electoral plans.
 "
Mueller’s final warning to the American public,www.msnbc.com,msnbc.com,06-03-2019,2019,6,http://www.msnbc.com/the-beat-with-ari/watch/mueller-s-final-warning-to-the-american-public-61146693549,"The threat from Vladimir Putin’s Russia that Mueller says “deserves the attention of every American” June 3, 2019"
Watch: how Mueller's predecessors confronted presidents,www.msnbc.com,msnbc.com,06-03-2019,2019,6,http://www.msnbc.com/the-beat-with-ari/watch/watch-how-mueller-s-predecessors-confronted-presidents-61144645944,"Ari Melber reveals how prosecutors before Mueller publicly confronted presidents under investigation– in sharp contrast into the Special Counsel probe into Trump. Rarely seen archival footage reveals how Mueller could have spoken out long before the investigation ended. June 3, 2019"
"Asked about Russian interference, Kushner offers discouraging answer | MSNBC",www.msnbc.com,Steve Benen,06-03-2019,2019,6,http://www.msnbc.com/rachel-maddow-show/asked-about-russian-interference-kushner-offers-discouraging-answer,"By Steve Benen White House senior advisor Jared Kushner doesn’t do many interviews, so those who’ve wondered about his role in a variety of stories – including the Russia scandal – have generally been left wanting.
It made it all the more notable when he sat down with Axios’ Jonathan Swan for an interview that aired last night on HBO. Kushner’s futile defense of Donald Trump’s racism has generated plenty of headlines, and for good reason . But the back and forth on Russia was every bit as important, if not more so.
SWAN: On June 8, 2016, you were sent an email with an offer of help for the Trump campaign from the Russian government.
KUSHNER: I’m sorry? Which email are you talking about?
SWAN: The email from Rod Goldstone.
KUSHNER: Look, Jonathan –
SWAN: My question to you is why didn’t you pick up the phone and call the FBI? It was an email that said Russia, that said the Russian government was trying to help. Like, why didn’t you do that?
Though the presidential son-in-law clearly didn’t think so, it was a good question. Kushner did, after all, receive an email with a subject line that read, “FW: Russia - Clinton - private and confidential.”
He nevertheless spent the next minute downplaying the significance of the email and the infamous Trump Tower meeting he attended with Russian emissaries. He complained about how busy he was at the time (“Let me put you in my shoes at that time. OK, I’m running three companies, I’m helping run the campaign….”) and the about attitudes of “self-righteous” people who’ve played “Monday morning quarterback.”
It led to an important follow-up question: would Kushner call the FBI if Russia again offered assistance to the Trump campaign?
“I don’t know,” Kushner replied. “It’s hard to do hypotheticals.”
That’s certainly one way to look at it. Alternatively, it’s very easy to do hypotheticals when someone asks you how you’d respond to a foreign adversary offering illegal campaign assistance – for the second time.
But Kushner’s in a bit of a jam. If he said, “Of course I’d contact the FBI if it happened again,” then his 2016 actions would appear negligent. If Kushner said, “No, even now, I still wouldn’t contact the authorities,” he’d look worse.
So one of the most powerful officials in the White House was left with, “It’s hard to do hypotheticals.”
During a rather remarkable Senate hearing a few weeks ago, Sen. Chris Coons (D-Del.) asked Attorney General Bill Barr: “Going forward, what if a foreign adversary … offers a presidential candidate dirt on a competitor in 2020? Do you agree with me the campaign should immediately contact the FBI?”
It took a little effort, but the president’s AG eventually said yes . So what is it, exactly, that Kushner is unsure about?
 , FBI , Russia , Scandals and White House"
Dem Senator Debunks Trump AG Bill Barr’s 'TV' Strategy,www.msnbc.com,msnbc.com,06-03-2019,2019,6,http://www.msnbc.com/the-beat-with-ari/watch/dem-senator-debunks-trump-ag-bill-barr-s-tv-strategy-61147717564,"Connecticut Senator Richard Blumenthal rips Attorney General Bill Barr for his misleading comments on “Good Morning America.” Sen. Blumenthal also weighs in on the impeachment debate, saying he understands why some may feel Speaker Nancy Pelosi’s approach to impeachment may be moving too slowly. June 3, 2019"
Impeachment Debate Breaks Out: Can't Let Trump 'Commit Crimes',www.msnbc.com,msnbc.com,06-03-2019,2019,6,http://www.msnbc.com/the-beat-with-ari/watch/impeachment-debate-breaks-out-can-t-let-trump-commit-crimes-61146181512,"A spirited impeachment debate breaks out on “The Beat” with Former federal prosecutor Paul Butler, The Root’s Jason Johnson and former Republican House lawyer Sophia Nelson. Nelson saying Mueller laid out “serious high crimes and misdemeanors” and “Congress has to do its duty and must do its job” and start an impeachment inquiry now. Johnson agrees saying it’s time to impeach and stop “dancing around” the problem that you can’t indict a sitting President. Butler disagrees noting Pelosi is a “master politician” and if the endgame is getting Trump out, “impeachment might interfere” with that. June 3, 2019"
Hassett on trade talks: We have our eyes on the prize,www.msnbc.com,msnbc.com,06-04-2019,2019,6,http://www.msnbc.com/ali-velshi/watch/hassett-on-trade-talks-we-have-our-eyes-on-the-prize-61182533535,"Kevin Hassett, outgoing chair of the Council of Economic Advisers, joins Ali Velshi to talk about his decision to leave the administration as well as the impact of the trade wars. June 3, 2019"
"Monday's Mini-Report, 6.3.19 | MSNBC",www.msnbc.com,Steve Benen,06-04-2019,2019,6,http://www.msnbc.com/rachel-maddow-show/mondays-mini-report-6319,"By Steve Benen Today’s edition of quick hits:
* It’s about time : “Congress is finally shipping President Donald Trump a $19.1 billion disaster aid bill, a measure stalled for months by infighting, misjudgment, and a presidential feud with Democrats.”
* Not what the White House was hoping for: “The Supreme Court on Monday rejected a request from the Trump administration to speed up its consideration of the future of DACA, the federal program that has allowed 700,000 young people – known as Dreamers – to avoid deportation.”
* Newly relevant in light of Friday afternoon’s mass shooting: “A Virginia bill designed to ban sales of large-capacity magazines similar to those used by the Virginia Beach gunman died in committee in January on a party-line vote.”
* Hmm : “China and Mexico both signaled a willingness to negotiate with Washington over escalating trade issues, while the Trump administration took to the airwaves to defend its use of tariffs to gain concessions from trading partners.”
* This should be interesting: “House Democrats announced Monday they’ll hold a hearing next week focused on the Mueller report and ‘presidential obstruction.’”
* Notable White House Departure #1 : “President Donald Trump announced on Saturday that a member of his legal team, Emmet Flood, will leave his post later this month after helping him handle the investigation into Russian interference in the 2016 election campaign.”
* Notable White House Departure #2 : “Kevin Hassett … is stepping down as chairman of the White House Council of Economic Advisers, Trump said Sunday night.”
* Illinois : “A bill that establishes a ‘fundamental right’ for women to get an abortion in Illinois cleared the state Senate late Friday night, sending the sweeping measure to Gov. J.B. Pritzker, who already has signaled his support.”
* Australia? “The Trump administration considered imposing tariffs on imports from Australia last week, but decided against the move amid fierce opposition from military officials and the State Department, according to several people familiar with the discussions.”
* In related news : “The Trump administration announced on Friday that it was stripping India of a special status that exempts billions of dollars of its products from American tariffs, part of a deepening clash over India’s protections for its market.”
* Ethanol : “The Trump administration said Friday that it has lifted a summertime ban on the use of E15, a gasoline blend made of 15 percent ethanol. The move is designed to help corn and soybean farmers harmed by President Trump’s decision to impose tariffs.”
* I don’t know why he keeps saying stuff like this : “Rep. Duncan Hunter, R-Calif., is currently awaiting trial for misusing over $250,000 of federal campaign funds for personal use. But this hasn’t stopped him from stirring the pot further. In an interview with Barstool Sports’ Zero Blog Thirty podcast, Hunter said while serving as a Marine field artillery officer in Iraq, his unit had ‘killed probably hundreds of civilians, if not scores, if not hundreds of civilians’ and ‘probably women and children.’”
Anything to add? Consider this an open thread.
 "
Full Quigley: Impeachment 'most important decision' Pelosi will make in this term,www.msnbc.com,msnbc.com,06-04-2019,2019,6,http://www.msnbc.com/mtp-daily/watch/full-quigley-impeachment-most-important-decision-pelosi-will-make-in-this-term-61187653666,"Rep. Mike Quigley (D-Ill.) joins MTP Daily to discuss the push for Trump’s impeachment heating up. June 3, 2019"
"Expert: U.S., U.K. relationship is in worse shape",www.msnbc.com,msnbc.com,06-04-2019,2019,6,http://www.msnbc.com/ali-velshi/watch/expert-u-s-u-k-relationship-is-in-worse-shape-61180485897,"Thomas Wright, Senior Fellow at the Brookings Institution, joins Ali Velshi to discuss how Trump has intervened in the U.K.’s domestic policies and how it’s affected the country. June 3, 2019"
How American diplomacy has changed under Donald Trump,www.msnbc.com,msnbc.com,06-04-2019,2019,6,http://www.msnbc.com/katy-tur/watch/how-american-diplomacy-has-changed-under-donald-trump-61174853717,"NBC's Kasie Hunt looks back at how Donald Trump's rhetoric has changed expectations for the acceptable level of civility between America and its allies. June 3, 2019"
How strong is the special relationship between America and the UK?,www.msnbc.com,msnbc.com,06-04-2019,2019,6,http://www.msnbc.com/katy-tur/watch/how-strong-is-the-special-relationship-between-america-and-the-uk-61162053936,"Ahead of President Trump's trip to the UK, he bashed Meghan Markle as ""nasty,"" and picked a fight with the mayor of London on Twitter, however now that he's arrived overseas, Trump's tone has changed. June 3, 2019"
Are Trump's hardball negotiation tactics working?,www.msnbc.com,msnbc.com,06-04-2019,2019,6,http://www.msnbc.com/katy-tur/watch/are-trump-s-hardball-negotiation-tactics-working-61173829842,"When negotiating with foreign countries, the Trump administration is known for its pressure tactics-- from talks with North Korea to the trade war with China, and now ultimatums for Mexico-- but how effective are those strategies? NBC's Keir Simmons, the Washington Post's David Nakamura and the former Supreme Allied Commander at NATO James Stavridis discuss with NBC's Kasie Hunt. June 3, 2019"
Rep. Clyburn says Democrats will eventually move to impeach President Trump,www.msnbc.com,msnbc.com,06-04-2019,2019,6,http://www.msnbc.com/katy-tur/watch/rep-clyburn-says-democrats-will-eventually-move-to-impeach-president-trump-61165125573,"The third most powerful Democrat, House Majority Whip Jim Clyburn suggested that impeaching Donald Trump would happen eventually. Former Congressman Joseph Crowley and Politico's Anna Palmer join Kasie Hunt to discuss. June 3, 2019"
Full Delaney: 'Don't think' there should be donor standard for Democratic debate,www.msnbc.com,msnbc.com,06-04-2019,2019,6,http://www.msnbc.com/mtp-daily/watch/full-delaney-don-t-think-there-should-be-donor-standard-for-democratic-debate-61190725728,"Democratic presidential candidate former Rep. John Delaney joins MTP Daily to discuss getting booed for saying Medicare for All is “not good policy” and his path to the nomination. June 3, 2019"
‘It was a scary moment:’ Karine Jean-Pierre reacts to protestor rushing stage at Kamala Harris event,www.msnbc.com,msnbc.com,06-04-2019,2019,6,http://www.msnbc.com/deadline-white-house/watch/-it-was-a-scary-moment-karine-jean-pierre-reacts-to-protestor-rushing-stage-at-kamala-harris-event-61189701649,"MoveOn’s Karine Jean-Pierre speaks out for the first time about her experience when a protestor rushed the stage and grabbed the mic from Sen. Kamala Harris during a MoveOn event June 3, 2019"
Kushner on Middle East peace plan: ‘I’m not here to be trusted’,www.msnbc.com,msnbc.com,06-04-2019,2019,6,http://www.msnbc.com/deadline-white-house/watch/kushner-on-middle-east-peace-plan-i-m-not-here-to-be-trusted-61190725700,"Former Chief of Staff at the CIA and Department of Defense Jeremy Bash, NYT’s Jim Rutenberg, former Undersecretary of State for Public Diplomacy Rick Stengel, GOP strategist Rick Wilson, and MoveOn’s Karine Jean-Pierre on Jared Kushner’s role in the White House and his relationship with the president June 3, 2019"
Pageantry and a Power Struggle: Inside Trump's tumultuous first day of U.K. visit,www.msnbc.com,msnbc.com,06-04-2019,2019,6,http://www.msnbc.com/deadline-white-house/watch/pageantry-and-a-power-struggle-inside-trump-s-tumultuous-first-day-of-u-k-visit-61190725693,"NBC’s Keir Simmons, AP’s Jonathan Lemire, Former Chief of Staff at the CIA and Department of Defense Jeremy Bash, former Undersecretary of State for Public Diplomacy Rick Stengel, and MoveOn’s Karine Jean-Pierre on the dynamics at Trump’s official visit to the UK after he insulted a member of the royal family and the Mayor of London right before his arrival June 3, 2019"
Jared Kushner finally faces the press. It doesn't go well.,www.msnbc.com,msnbc.com,06-04-2019,2019,6,http://www.msnbc.com/deadline-white-house/watch/jared-kushner-finally-faces-the-press-it-doesn-t-go-well-61191237589,"Former Chief of Staff at the CIA and Department of Defense Jeremy Bash, NYT’s Jim Rutenberg, former Undersecretary of State for Public Diplomacy Rick Stengel, GOP strategist Rick Wilson, and MoveOn’s Karine Jean-Pierre on Jared Kushner’s interview with Axios where he struggles to answer questions about Trump’s birtherism campaign and how he would handle things if Russia contacted him promising dirt on an opponent again June 3, 2019"
Gold rush in California for 2020 Democrats,www.msnbc.com,msnbc.com,06-04-2019,2019,6,http://www.msnbc.com/mtp-daily/watch/gold-rush-in-california-for-2020-democrats-61190725615,"Tonight in 2020 Vision: Steve Kornacki is at the big board to break down the importance of California in deciding the next Democratic presidential nominee. June 3, 2019"
