title, publication, authors, date, year, month, url, content
MSNBC's Ari Melber: Mueller 'Brought a Book to a Twitter Fight',www.msnbc.com,msnbc.com,05-31-2019,2019,5,http://www.msnbc.com/the-beat-with-ari/watch/msnbc-s-ari-melber-mueller-brought-a-book-to-a-twitter-fight-60584005557,"Reacting to Robert Mueller’s remarks on the Russia probe, MSNBC Chief Legal Correspondent Ari Melber says Mueller’s restrained nature and insistence on following every rule to the letter of the law made it seem like he “brought a book to a Twitter fight.” Presidential historian Jon Meacham said Trump and Barr “brought a gun” to a “knife-fight,” further highlighting the difference in tactics between the President’s team and Mueller. May 30, 2019"
"Israeli Amb. to UN on new vote, political chaos in Israel",www.msnbc.com,msnbc.com,05-31-2019,2019,5,http://www.msnbc.com/ali-velshi/watch/israeli-amb-to-un-on-new-vote-political-chaos-in-israel-60583493582,"Ali Velshi talks with Israeli Ambassador to the United Nations Danny Danon about Israeli Prime Minister Benjamin Netanyahu’s failure to form a new coalition government, and what it could mean for U.S. peace efforts in the region. May 30, 2019"
Roy Moore considering another Senate run,www.msnbc.com,msnbc.com,05-31-2019,2019,5,http://www.msnbc.com/katy-tur/watch/roy-moore-considering-another-senate-run-60581957601,"Roy Moore is deciding whether he will run for an Alabama Senate seat again, after losing a 2017 special election in which multiple allegations of sexual misconduct were made against him. This time, however, he would be running without the support of President Trump. May 30, 2019"
White House considering plan to block Central American migrants from U.S.,www.msnbc.com,msnbc.com,05-31-2019,2019,5,http://www.msnbc.com/katy-tur/watch/white-house-considering-plan-to-block-central-american-migrants-from-u-s-60576325519,"Politico reports that the White House is considering an immigration proposal that essentially blocks Central American migrants from entering the United States. Politico's Anita Kumar and NBC's Julia Ainsley discuss the implications of the potential plan with Kasie Hunt. May 30, 2019"
Rep. Hakeem Jeffries responds to Democratic calls for impeachment after hearing from Robert Mueller,www.msnbc.com,msnbc.com,05-31-2019,2019,5,http://www.msnbc.com/katy-tur/watch/rep-hakeem-jeffries-responds-to-democratic-calls-for-impeachment-after-hearing-from-robert-mueller-60575813517,"New York Congressman Hakeem Jeffries, chair of the House Democratic caucus, joins NBC's Kasie Hunt to answer today's big question. May 30, 2019"
"Thursday's Mini-Report, 5.30.19 | MSNBC",www.msnbc.com,Steve Benen,05-31-2019,2019,5,http://www.msnbc.com/rachel-maddow-show/thursdays-mini-report-53019,"By Steve Benen Today’s edition of quick hits:
* This time , it was freshman Rep. John Rose’s (R-Tenn.) fault: “House conservatives blocked a bipartisan $19.1 billion disaster aid bill for the third time Thursday, once again thwarting Democrats’ efforts to pass the long-delayed legislation that is supported by President Trump.”
* This new policy takes effect immediately: “New Hampshire is the latest state to repeal its death penalty, as the state Senate had enough votes to override Gov. Chris Sununu’s veto…. The 16-8 vote Thursday was the necessary two-thirds majority to override. The House narrowly voted last week to override Sununu’s veto.”
* Real political drama in Israel : “Benjamin Netanyahu failed to form a ruling coalition late Wednesday night, becoming the first elected prime minister in Israeli history to stumble in forging a working government.”
* Gov. John Bel Edwards (D), who’s up for re-election this year, is prepared to sign this : “The Louisiana House of Representatives passed an abortion ban on a 79-23 vote Wednesday that would prohibit women from terminating a pregnancy once a fetal heartbeat has been detected.”
* This story is just getting started: “Federal prosecutors in Washington, D.C., this week sent subpoenas to Mar-a-Lago, President Donald Trump’s private club in Palm Beach, and Trump Victory, a political fundraising committee, demanding they turn over all records relating to Republican Party donor Li ‘Cindy’ Yang and several of her associates and companies, the Miami Herald has learned.”
* Russia : “The Trump administration believes Russia has restarted very low-yield nuclear tests, officials said on Wednesday in a finding that could be used to renew in earnest the arms race between Moscow and Washington.”
* A year is a long time : “The Pentagon press corps has chafed for months at what reporters see as a sharp decline in access to information, including limited access to officials during trips. Celebrities such as Kiss rocker Gene Simmons and actor Gerard Butler have showed up in the briefing room, but Friday will be a year since the Pentagon held an on-camera briefing with any department spokesperson.”
* An FDA moving in the wrong direction : “Sen. Dick Durbin (D-Ill.) charged in an unusually sharp attack Wednesday that acting FDA Commissioner Ned Sharpless seemed to have ‘no intention’ of addressing youth e-cigarette use, which his predecessor deemed a public health epidemic.”
* King strikes again : “Rep. Steve King, who earlier this year was condemned by his congressional peers for favorable comments about white supremacy, argued Tuesday that presuming all cultures are equal devalues the Founding Fathers.”
* Cochran : “Seven-term Republican Sen. Thad Cochran, who used seniority to steer billions of dollars to his home state of Mississippi, has died. He was 81.”
Anything to add? Consider this an open thread.
Explore: The MaddowBlog"
Full Dean: There has been a 'shift' among constituents over impeachment,www.msnbc.com,msnbc.com,05-31-2019,2019,5,http://www.msnbc.com/mtp-daily/watch/full-dean-there-has-been-a-shift-among-constituents-over-impeachment-60586565820,"Rep. Madeleine Dean (D-Penn.) said a constituent asked about impeachment within the first three questions she answered during a recent town hall. May 30, 2019"
The collapse of a con,www.msnbc.com,msnbc.com,05-31-2019,2019,5,http://www.msnbc.com/deadline-white-house/watch/the-collapse-of-a-con-60590661957,"WaPo’s Philip Rucker, Axios’ Alexi McCammond, NYT’s Nick Confessore, former Deputy Assistant AG Harry Litman, and former Assistant Director at the FBI Frank Figliuzzi on Trump lashing out at Robert Mueller after his public statement and calling impeachment a “dirty, filthy, disgusting word.” May 30, 2019"
Some 2020 candidates turn up the volume on their cries for impeachment,www.msnbc.com,msnbc.com,05-31-2019,2019,5,http://www.msnbc.com/deadline-white-house/watch/some-2020-candidates-turn-up-the-volume-on-their-cries-for-impeachment-60591685837,"Axios’ Alexi McCammond, NYT’s Nick Confessore, former George W. Bush White House aide Elise Jordan, and Real Clear Politics’ A.B. Stoddard on the 2020 Democratic hopefuls’ response to Mueller’s “non-exoneration” of the president and their growing support for impeachment May 30, 2019"
‘Dishonor starts at the top:’ White House’s request to block McCain’s name on warship,www.msnbc.com,msnbc.com,05-31-2019,2019,5,http://www.msnbc.com/deadline-white-house/watch/-dishonor-starts-at-the-top-white-house-s-request-to-block-mccain-s-name-on-warship-60591685833,"Axios’ Alexi McCammond, NYT’s Nick Confessore, former George W. Bush White House aide Elise Jordan, and Real Clear Politics’ A.B. Stoddard on reporting that Trump’s administration requested the U.S. Navy move its warship named for Senator McCain “out of sight” for Trump’s visit to Japan May 30, 2019"
"Energy Department is calling natural gas ""freedom gas""",www.msnbc.com,msnbc.com,05-31-2019,2019,5,http://www.msnbc.com/mtp-daily/watch/energy-department-is-calling-natural-gas-freedom-gas-60591685770,"According to a Department of Energy undersecretary, ""increasing export capacity ... is critical to spreading freedom gas throughout the world."" May 30, 2019"
Trump essentially agrees with one of the central conclusions of Mueller’s report in morning tweet,www.msnbc.com,msnbc.com,05-31-2019,2019,5,http://www.msnbc.com/deadline-white-house/watch/trump-essentially-agrees-with-one-of-the-central-conclusions-of-mueller-s-report-in-morning-tweet-60591685826,"Axios’ Alexi McCammond, NYT’s Nick Confessore, former Deputy Assistant AG Harry Litman, and former Assistant Director at the FBI Frank Figliuzzi on Trump tweeting that Russia helped get him elected, but then walking it back a short time later May 30, 2019"
Do the Special Counsel regulations need to be updated?,www.msnbc.com,"May 30, 2019",05-31-2019,2019,5,https://www.msnbc.com/ali-velshi/watch/do-the-special-counsel-regulations-need-to-be-updated-60585029602,"MTP Daily Energy Department is calling natural gas ""freedom gas"" "
Mitch McConnell says he’d fill Supreme Court vacancy in 2020,www.msnbc.com,msnbc.com,05-31-2019,2019,5,http://www.msnbc.com/hardball/watch/mitch-mcconnell-says-he-d-fill-supreme-court-vacancy-in-2020-60596805754,"If a court vacancy occurs in 2020 and Trump nominates someone to fill it, McConnell will move for the senate to confirm the appointment. Chris says, “It is this kind of cheap politics and brazen partisanship that makes the word ‘politician’ so sleazy.” May 31, 2019"
Watch Trump AG Barr get Busted for Upstaging Mueller,www.msnbc.com,msnbc.com,05-31-2019,2019,5,http://www.msnbc.com/the-beat-with-ari/watch/watch-trump-ag-barr-get-busted-for-upstaging-mueller-60596805642,"Trump Attorney General Bill Barr gives new TV interview muddying Mueller’s careful explanation about why DOJ rules prohibit indicting a sitting president. May 30, 2019"
Robert De Niro Deploys SNL Powers against Trump,www.msnbc.com,msnbc.com,05-31-2019,2019,5,http://www.msnbc.com/the-beat-with-ari/watch/robert-de-niro-deploys-snl-powers-against-trump-60597317573,"Filmmaker and political activist Rob Reiner speaks out about his new video, which he made with Robert De Niro, designed to raise awareness of Mueller’s findings. May 30, 2019"
Inside Team Trump’s Plot to Whitewash Mueller’s Historic Report,www.msnbc.com,msnbc.com,05-31-2019,2019,5,http://www.msnbc.com/the-beat-with-ari/watch/inside-team-trump-s-plot-to-whitewash-mueller-s-historic-report-60596293537,"A day after Mueller’s first public comments, Trump lays bare his strategy to undercut Mueller’s findings. May 30, 2019"
Anchor to 2020 Dem: What are you so Afraid of?,www.msnbc.com,msnbc.com,05-31-2019,2019,5,http://www.msnbc.com/the-beat-with-ari/watch/anchor-to-2020-dem-what-are-you-so-afraid-of-60597317526,"Former Colorado Governor and 2020 Democratic Candidate John Hickenlooper joins The Beat for a conversation about impeachment, the fight over Roe v Wade, and more. May 30, 2019"
Politico: Roy Moore hits back at Trump on Senate run,www.msnbc.com,msnbc.com,05-31-2019,2019,5,http://www.msnbc.com/hardball/watch/politico-roy-moore-hits-back-at-trump-on-senate-run-60595781932,"In an interview with Politico, Moore shot back at Trump saying, ""The president doesn't control who votes for the United States Senate in Alabama. People in Alabama are smarter than that. They elect the senator from Alabama, not from Washington, D.C."" May 30, 2019"
Republicans silent on impeachment after Mueller statement,www.msnbc.com,msnbc.com,05-31-2019,2019,5,http://www.msnbc.com/hardball/watch/republicans-silent-on-impeachment-after-mueller-statement-60595781871,"For all the talk about what Democrats will do in the wake of Special Counsel Robert Mueller's public comments, we haven't heard much from Republicans. May 30, 2019"
Eric Swalwell: Trump a ‘guilty person trying to clean up’ after Mueller statement,www.msnbc.com,msnbc.com,05-31-2019,2019,5,http://www.msnbc.com/hardball/watch/eric-swalwell-trump-a-guilty-person-trying-to-clean-up-after-mueller-statement-60595269801,"On Wednesday, Mueller said that the evidence he gathered does not clear the President of criminal obstruction. The President fired back the next day. May 30, 2019"
Missouri could be first state without abortion clinic,www.msnbc.com,msnbc.com,05-31-2019,2019,5,http://www.msnbc.com/all-in/watch/missouri-could-be-first-state-without-abortion-clinic-60600901527,"Regulators are refusing to renew the license of Missouri's last abortion clinic, which could cease providing those services this week. May 31, 2019"
"Congratulations, you now own a condo in Trump Tower!",www.msnbc.com,msnbc.com,05-31-2019,2019,5,http://www.msnbc.com/all-in/watch/congratulations-you-now-own-a-condo-in-trump-tower-60598853775,"The good news: Paul Manafort's Trump Tower condo has officially been forfeited to the U.S. government, which means we, the people own it. The bad news: Trump Tower units aren't selling like they used to. May 31, 2019"
"Mueller warned Russia will meddle in 2020, but Trump isn't listening",www.msnbc.com,msnbc.com,05-31-2019,2019,5,http://www.msnbc.com/11th-hour/watch/mueller-warned-russia-will-meddle-in-2020-but-trump-isn-t-listening-60603973653,"The Trump administration continues to be dismissive of the warnings about Russia's continued interference in our political process ahead of the 2020 election. Michael McFaul and Malcolm Nance discuss. May 31, 2019"
Trump says you can't impeach him because 'there was no crime',www.msnbc.com,msnbc.com,05-31-2019,2019,5,http://www.msnbc.com/11th-hour/watch/trump-says-you-can-t-impeach-him-because-there-was-no-crime-60602437913,"Trump argued that he can't be impeached because he didn't commit a crime and the courts wouldn't let it happen. But will House Dems proceed? We talk to Anita Kumar and Jeremy Peters. May 31, 2019"
Jeff Daniels: ‘we can't go on like this’,www.msnbc.com,msnbc.com,05-31-2019,2019,5,http://www.msnbc.com/the-last-word/watch/jeff-daniels-we-can-t-go-on-like-this-60602949723,"Emmy award winning actor Jeff Daniels explains to Lawrence O'Donnell what Americans can learn from Atticus Finch in the age of Trump. May 31, 2019"
"Attacking Mueller, Trump admits Russia helped elect him before taking it back",www.msnbc.com,msnbc.com,05-31-2019,2019,5,http://www.msnbc.com/11th-hour/watch/attacking-mueller-trump-admits-russia-helped-elect-him-before-taking-it-back-60602949677,"One day after Mueller spoke at DOJ, Trump went on the attack after admitting on Twitter Russia helped him get elected. He also called impeach a 'disgusting' word speaking to reporters. Joyce Vance, A.B. Stoddard, and Sam Stein discuss. May 31, 2019"
Rep. Katie Porter faces constituents and impeachment questions,www.msnbc.com,msnbc.com,05-31-2019,2019,5,http://www.msnbc.com/the-last-word/watch/rep-katie-porter-faces-constituents-and-impeachment-questions-60601413820,"Fresh off a town hall with her constituents in California, Democratic Rep. Katie Porter talks with Lawrence about her feelings on impeaching president Trump and what her constituents think of her performance in Washington. May 31, 2019"
New calls for impeachment may point to groundswell in Congress,www.msnbc.com,msnbc.com,05-31-2019,2019,5,http://www.msnbc.com/rachel-maddow/watch/new-calls-for-impeachment-may-point-to-groundswell-in-congress-60607045798,"Rachel Maddow and Lawrence O'Donnell discuss the growing number of members of Congress coming out publicly in favor of beginning impeachment proceedings against Donald Trump, and the possibility that House Speaker Nancy Pelosi is more on top of the situation than she is getting credit for. May 31, 2019"
High stakes stoke energy of Democratic activism,www.msnbc.com,msnbc.com,05-31-2019,2019,5,http://www.msnbc.com/rachel-maddow/watch/high-stakes-stoke-energy-of-democratic-activism-60605509770,"Valerie Jarrett, former senior advisor to President Barack Obama, talks with Rachel Maddow about the findings of Robert Mueller's Trump-Russia investigation and lessons from the Obama era for dealing with Trump Republicans. May 31, 2019"
Republican disregard for democratic norms didn't start with Trump,www.msnbc.com,msnbc.com,05-31-2019,2019,5,http://www.msnbc.com/rachel-maddow/watch/republican-disregard-for-democratic-norms-didn-t-start-with-trump-60602437959,"Rachel Maddow points out that Republicans were already engaged in hyper-partisan behavior against President Barack Obama, before that hyper-partisanship became couched in blind allegiance to Donald Trump's destruction of democratic standards of conduct. May 31, 2019"
"AOC, Ted Cruz team up to stop the revolving door",www.msnbc.com,"May 31, 2019",05-31-2019,2019,5,https://www.msnbc.com/morning-joe/watch/aoc-ted-cruz-team-up-to-stop-the-revolving-door-60624965966,"Morning Joe AOC, Ted Cruz team up to stop the revolving door "
Why Trump's ongoing confusion about China and trade matters | MSNBC,www.msnbc.com,Steve Benen,05-31-2019,2019,5,http://www.msnbc.com/rachel-maddow-show/why-trumps-ongoing-confusion-about-china-and-trade-matters,"File photo taken in November 2017 shows U.S. President Donald Trump (and Chinese President Xi Jinping attending a welcome ceremony in Beijing. Kyodo via AP Images Why Trump’s ongoing confusion about China and trade matters 05/31/19 09:20 AM By Steve Benen During a brief Q&A with reporters yesterday, Donald Trump fielded a question about trade talks with China, which the president responded to in a familiar way :
“China would love to make a deal with us. We had a deal, and they broke the deal. I think, if they had to do again, they wouldn’t have done what they did. We’re taking in billions of dollars in tariffs. China is subsidizing products. So the United States taxpayer is paying for very little of it.”
Earlier this week, Trump made a very similar argument during a press conference in Tokyo, while standing alongside Japanese Prime Minister Abe Shinzo.
“You know, foolishly, some people said that the American taxpayer is paying the tariffs of China. No, no, no – it’s not that way. They’re paying a small percentage, but our country is taking in billions and billions of dollars…. I don’t believe that China can continue to pay these, really, hundreds of billions of dollars in tariffs. I don’t believe they can do that.”
At this point, we could talk about the simple fact that Trump has reality backwards . We could also talk about the latest Monmouth University poll that suggested the American public has a better grasp of the basic details than their president.
We could even have a chat about Trump’s willful ignorance and his decision to deliberately ignore reality, even when his own White House team tries to educate the president about his own agenda.
But as important as these angles are, I’m principally concerned with the practical effects of Trump’s ongoing and persistent confusion.
By all accounts, the American president is absolutely convinced that his tariffs policy is forcing China to pay us billions of dollars, which Trump believes gives him leverage in trade talks. After all, in the Republican’s mind, Beijing will yield any day now, unwilling to keep pumping billions into the American treasury.
That leverage exists only in Trump’s imagination, making it that much more dangerous – for the economy, for U.S. consumers, for everyone affected by international economic conditions – when the White House pursues a policy built on a foundation of ignorance.
Complicating matters is that Trump, falsely convinced that his tariffs on China are working wonders, is now poised to impose new tariffs on Mexico , unaware of the impact this will have on his own country.
Pointing and laughing at the American president’s unsettling limitations is easy, but there’s nothing comedic about the real-world effects of Trump’s nonsense.
Explore: The MaddowBlog , China , Donald Trump , Mexico and Trade The highest hurdle for the AOC/Cruz bill... Trump admin looks for 'fresh thinking' on... More Like This Best of MSNBC "
Trump admin looks for 'fresh thinking' on international human rights | MSNBC,www.msnbc.com,,05-31-2019,2019,5,http://www.msnbc.com/rachel-maddow-show/trump-admin-looks-fresh-thinking-international-human-rights?utm_source=dlvr.it&utm_medium=twitter,"Spokesperson Heather Nauert (L) speaks as U.S. Secretary of State Mike Pompeo dialogues with reporters in his plane while flying from Panama to Mexico, October 18, 2018. Brendan Smialowski/Pool via REUTERS Trump admin looks for ‘fresh thinking’ on international human rights 05/31/19 10:16 AM By Steve Benen As things stand, the U.S. State Department already has a bureau that focuses on human rights. It’s called the Bureau of Democracy, Human Rights, and Labor , and it’s led by an undersecretary for civilian security, democracy, and human rights. This system has been in place since 1977 and it’s never been especially controversial.
Politico reported yesterday, however, that the Trump administration wants a separate human rights panel, which will apparently be expected to look at the issue in a different way.
The Trump administration plans to launch a new panel to offer “fresh thinking” on international human rights and “natural law,” a move some activists fear is aimed at narrowing protections for women and members of the LGBT community.
The new body, to be called the Commission on Unalienable Rights, will advise Secretary of State Mike Pompeo, according to a notice the State Department quietly published Thursday on the Federal Register.
According to the State Department’s notice, this new commission “will provide fresh thinking about human rights discourse where such discourse has departed from our nation’s founding principles of natural law and natural rights.”
At face value, the idea of introducing “fresh thinking” may seem relatively benign. After all, there’s nothing inherently wrong with challenging preconceived ideas and thinking anew about old debates.
But it’s nevertheless hard to have confidence in Trump administration initiatives like these, especially given how little this president and his team have cared about human rights since taking office.
For one thing, there’s been no meaningful explanation of why the State Department needs two bureaus to work on the same issue. David Kramer, who served as the assistant secretary of State for human rights in the Bush/Cheney administration, told Politico he’s glad to see Team Trump take an interest in the issue, but he’s “not sure what this commission is supposed to do that the human rights bureau doesn’t already do.”
For another, there’s even less clarity on the direction the new Commission on Unalienable Rights is supposed to take. The administration apparently believes the current “discourse” on human rights has “departed from our nation’s founding principles.”
Such as?
And then, of course, there was the reference to “natural law,” which is a phrase the far-right has been known to use to dismiss the rights of women and the LGBTQ community.
Rep. Tom Malinowski (D-N.J.), who led the State Department’s human rights bureau through much of Barack Obama’s second term, added , “I don’t think this is the advisory committee for expanding rights.”
Given everything we know, it’s tough to disagree.
Explore: The MaddowBlog , Human rights and State Department Why Trump's ongoing confusion about China... More Like This Best of MSNBC "
Trump associates call for Mueller to testify,www.msnbc.com,"May 31, 2019",06-01-2019,2019,6,https://www.msnbc.com/deadline-white-house/watch/trump-associates-call-for-mueller-to-testify-60683333961,Hardball Daily Beast: Trump wants Mueller to testify in hopes of grilling 
Voters convinced House Democrat to support impeachment,www.msnbc.com,msnbc.com,06-01-2019,2019,6,http://www.msnbc.com/all-in/watch/voters-convinced-house-democrat-to-support-impeachment-60709957622,"Rep. Bennie Thompson says he came out in favor of an impeachment inquiry only after talking to voters in his district. June 1, 2019"
Could overturning Roe go beyond rolling back abortion rights?,www.msnbc.com,msnbc.com,06-01-2019,2019,6,http://www.msnbc.com/the-last-word/watch/could-overturning-roe-go-beyond-rolling-back-abortion-rights-60711493984,"As more and more states pass increasingly restrictive bans on abortion, the issue appears poised for the Supreme Court—and it could affect more than just women’s rights. SCOTUS expert Jeffrey Rosen discusses with Ali Velshi. June 1, 2019"
Trump adviser says Mexico would pay for new tariffs. He's wrong. You would.,www.msnbc.com,msnbc.com,06-01-2019,2019,6,http://www.msnbc.com/11th-hour/watch/trump-adviser-says-mexico-would-pay-for-new-tariffs-he-s-wrong-you-would-60712517822,"Catching markets and DC by surprise, Trump threatened Mexico with new tariffs. And despite what the administration says, consumers would foot the bill. Is it just an empty threat meant to whip up his supporters on immigration? Jonathan Allen and Ali Velshi discuss. June 1, 2019"
What Trump attorney's voicemail to Flynn's lawyer reveals about Mueller probe,www.msnbc.com,msnbc.com,06-01-2019,2019,6,http://www.msnbc.com/11th-hour/watch/what-trump-attorney-s-voicemail-to-flynn-s-lawyer-reveals-about-mueller-probe-60712005883,"In November of 2017, Trump attorney John Dowd left a cryptic voicemail for the lawyer of Trump's fmr. National Security Adviser. Elliot Williams gives his take. June 1, 2019"
