The Most Expensive Object Lost on the Titanic,www.thedailybeast.com,Allison McNearney,04-13-2019,2019,4,https://www.thedailybeast.com/the-most-expensive-object-lost-on-the-titanic-merry-joseph-blondels-la-circassienne-au-bain?source=articles&amp;via=rss,"The Most Expensive Object Lost on the Titanic The Daily Beast 6 hrs ago By Allison McNearney < PREVIOUS SLIDE SLIDE 1 of 4 NEXT SLIDE > Loss of White Star Line's Olympic-class RMS Titanic which struck an iceberg on 12 April 1912 on her maiden voyage from Southampton to New York. Titanic's lifeboats on their way to the Carpathia. More than 1,500 lives lost. Disaster. As the doomed Titanic began its final countdown before disappearing under the sea 107 years ago Monday, there was a last gasp of activity on the deck.
These scenes have become well known thanks to big screen adaptations of the disaster: the rush to load the few remaining life boats with women and children, the brave musicians who took up their instruments for one last concert, the tilt of the deck as the ship began to tip into the ocean.
Mauritz Håkan Björnström-Steffansson knew these final moments all too well—he experienced them first hand. His life was saved at the last minute by a frantic leap into a nearby lifeboat as the Titanic began to sink, but 1,517 passengers and crew were not so lucky. Nor was his prized possession, an oil painting by the renowned 19th-century French painter Merry-Joseph Blondel.
“La Circassienne au Bain,” also known in its early days as “Une Baigneuse,” made its debut at the Paris Salon of 1814 just as Blondel’s career was beginning to take off, though it took a few years before the critics warmed up to his bathing Circassian woman.
But in 1912, it reached its pinnacle of fame when it became the most expensive piece of property buried with the Ship of Dreams, at least according to the claims filed.
Starting in the late-17th century, the annual Paris Salon was the place for artists to exhibit their work in France. The state-sponsored Salons were where new artists were discovered, where established artists solidified their reputations, and where the public was invited to join in the cultural conversation.
Blondel would eventually become one of France’s esteemed neoclassical painters. Throughout his long career, he was the recipient of public art commissions that continue to decorate some of the most important buildings in France including the Louvre and the Palace of Versailles; he was awarded some of the top honors of his day, namely the Prix de Rome in 1803 (courtesy of Louis XVIII) and the Légion d’Honneur two decades later (with thanks to Charles X); and he was named to prestigious academic positions.
But early in his career in 1814, he was surely delighted when four of his works were accepted for exhibition in the Louvre rooms at the annual Paris Salon. “La Circassienne au Bain” was among them.
Initially, the historical loss of this work on the Titanic was near total. Not only did the actual painting perish at sea, but there was little information left behind as to what it once looked like—few descriptions existed and there were no reproductions or photographs of the original, only one engraving.
But in the early 2010s, an artist working under the pseudonym “John Parker” conductive extensive research on Blondel’s lost work and created a reproduction of “La Circassienne au Bain” that was auctioned off by Plymouth Auction Rooms in 2016 for £2,700. (The artist did not respond to an interview request sent via the auction house, which also declined to comment for this piece.)
Parker’s reproduction shows a classical setting of an open-air bath in which Blondel painted a nude Circassian woman stepping into the water with one foot, the other balanced behind her resulting in a figure arranged in the traditional Greek contrapposto style.
The woman’s emerald green robe is thrown over the short concrete wall behind her. She looks off to the side towards it as her arm extends out, both showing off her figure and in a gesture to remove the remaining transparent silk scarf that provides her with just a touch of modesty.
Despite her nudity, the woman’s hair remains in an elaborately braided updo and her ears are garnished with appropriately dazzling baubles. Lush trees and foliage hover beyond the open walls of the bath.
When Blondel showed this work in 1814, he had only been back in France for a few years after his stint studying art in Italy. Three years later, he would win a gold medal at the Salon, but in 1814, at least one of the four paintings, the one that was doomed to a watery grave a century later, did not receive overwhelming praise.
“His design and color lack truth and finesse, and we can say nothing in favor of this work, except that it is executed by a very skillful artist in practice,” French artist and art critic François Séraphin Delpech wrote of “La Circassienne au Bain” in his review of works at that year’s Salon.
Delpech’s pronouncement was representative of the critical response to the piece: “meh.” But that allegedly changed a few years later after Blondel’s star had risen higher. When the public took a shine to the nude bather, the critics decided it wasn’t so bad after all. If not his most famous work, “La Circassienne au Bain” became well regarded.
Fast forward nearly a century and hopscotch a few European countries north, and Mauritz Håkan Björnström-Steffansson enters the tragic story of “La Circassienne au Bain.”
In 1912, Björnström-Steffansson was the 28-year-old son of a Swedish pulp baron, and he was preparing to travel to the U.S. to further his studies. As was only natural for a prominent young lad in that year, he had secured passage on the inaugural voyage of the Titanic, the ship being hailed as the largest and grandest to ever sail the seas.
Before he left, Björnström-Steffansson purchased a masterpiece—the famed French painter Merry-Joseph Blondel’s early work “La Circassienne au Bain”—to take with him.
What drew him to this piece, what he paid for it, or why he decided to purchase it before traveling to America to start a new life is unknown. What is known is that when Björnström-Steffansson boarded the Titanic on a first-class ticket, the Blondel was with him.
During the early days of the voyage, Björnström-Steffansson fell in with a group of other first-class passengers including the English businessman Hugh Woolner. It is from the testimony of Woolner during a U.S. Congressional inquiry into the disaster that we know the details of what Björnström-Steffansson experienced on that fateful night.
On the evening of April 14, Woolner and Björnström-Steffansson were in the smoking room when the Titanic struck an iceberg. “We felt a sort of stopping, a sort of, not exactly shock, but a sort of slowing down; and then we sort of felt a rip that gave a sort of a slight twist to the whole room,” Woolner testified.
After retrieving life jackets from their respective quarters, Woolner said the two men met up back on deck and began assisting women and children into the lifeboats. They also came to the aid of First Officer Murdoch when a group of men tried to swarm one of the starboard-side boats.
When most of the boats had been filled and dispatched, the two friends decided to go to the A deck one story below to make sure all of the passengers had evacuated to higher quarters. Woolner said it was completely empty of people.
“It was absolutely deserted, and the electric lights along the ceiling of A deck were beginning to turn red, just a glow, a red sort of glow. So I said to Steffanson [sic]: ‘This is getting rather a tight corner. I do not like being inside these closed windows. Let us go out through the door at the end.’ And as we went out through the door the sea came in onto the deck at our feet.”
Woolner testified that they then went out onto the gunwale to prepare to dive into the ocean to escape being drowned in the enclosed A deck.
Once outside, they happened to notice that one of the last lifeboats was still being lowered into the water. There was a little bit of room left in the boat, so the men decided to make a jump for it. (The authors of On a Sea of Glass note that the duo probably knew that this boat was still making its way to the sea when they went downstairs, and also that jumping into it from below would be their only shot at survival.)
“[Björnström-Steffansson] jumped out and tumbled in head over heels into the bow, and I jumped too, and hit the gunwale with my chest, which had on this life preserver, of course and I sort of bounced off the gunwale and caught the gunwale with my fingers, and slipped off backwards.”
By the time they were both safely inside, the Titanic was rapidly sinking. The lifeboat was quickly paddled away from the doomed ship, and Woolner estimated they were about 150 yards out when the Titanic disappeared under the water. Both men were saved.
Nearly a year after the Titanic sank in the early hours of April 15, 1912, the New York Times reported that claims for more than $6 million had been filed against the White Star Line for loss of life, personal injury, and loss of property. In the later category, there were claims for jewelry, rare books, cars, a set of bagpipes, and a signed picture of Garibaldi.
But the most expensive claim of all was by Björnström-Steffansson who requested $100,000 (or the equivalent of over $2 million today) in compensation for the drowning of “La Circassienne au Bain.”
It’s unclear how much money Björnström-Steffansson received. In the end, White Star settled all of the claims for a total of only $664,000.
There was one bright spot for the Swedish businessman, who ended up making the U.S. his home.
Five years after the sinking of the Titanic, he married a woman who he was introduced to by a fellow Titanic passenger, one he and Woolner had helped to save. The Björnström-Steffanssons remained married for the rest of their long lives.
"
Three Veterans Die by Suicide in Five Days at Veterans Affairs Facilities,www.thedailybeast.com,msn.com,04-13-2019,2019,4,https://www.thedailybeast.com/three-veterans-die-by-suicide-in-five-days-at-veterans-affairs-facilities,The Trump administration has failed to spend millions of dollars allocated for suicide prevention.
Tom Arnold: My Trump Addiction Is Destroying My Career and I Don’t Care,www.thedailybeast.com,Davis Richardson,04-14-2019,2019,4,https://www.thedailybeast.com/tom-arnold-trump-addiction-destroying-my-career-and-i-dont-care,"The president’s most unlikely foe is angry, vulnerable, and very busy."
How Much Money Do Porn Stars Actually Make?,www.thedailybeast.com,Aurora Snow,04-14-2019,2019,4,https://www.thedailybeast.com/how-much-money-do-porn-stars-actually-make,"How Much Money Do Porn Stars Actually Get Paid for Sex Scenes? It’s not what you think. 04.13.19 10:33 PM ET Photo Illustration by Elizabeth Brockway/The Daily Beast
Ask a porn star about sex and you’ll be inundated with every dirty detail —unless you ask how much it pays. That’s when the conversation becomes awkward. When discussing pay rates, XXX performers are just like everyone else, and equally as private. Earnings are often exaggerated (the few performers willing to speak about rates inevitably claim to be on the higher end of the scale).
Twenty-six-year-old Ariana Marie recalls how little she knew about the pay structure when she first entered the industry, and how heavily she relied on her agent . Marie’s starting rate for a boy/girl scene was $1200, which is the higher end of today’s standard range. However, her booking agent’s 40-percent commission was not. Most XXX agents take a 10-20-percent commission, but a new performer wouldn’t automatically know that. “Anytime I was on set I started asking other girls, ‘How much does your agent take?’ They’d say 10 or 15 percent and then I started asking, ‘Well, why does mine take 40?’”
Marie’s next agent seemed a little better—at first. His cut was standard but it wasn’t long before they were haggling over her rates, which he called “too high.” Apparently, that agent was offering buddy deals. “The agent was friends with some of the companies and he’d lower my rate for them,” says Marie. “His excuse was, ‘You’ll work more,’ but I was already working a lot.”
With over a million combined social media followers, Marie’s elite fan base often justifies a company’s decision to pay more.
Mean Bitches CEO Glenn King doesn’t balk at paying a performer more than his standard company rate if the math makes sense. “It’s a business equation. If I’m going to pay someone $1200 instead of $1000 then I need to be relatively confident that I’m going to make an extra $200 off that scene, but the performer has to be popular. Does she have the fan base and following to justify paying her extra?” says King. “I look at her rankings, Twitter followers, Instagram. It’s not about the extra $200 that one time; if you’re shooting this performer in 8 scenes a month, it’s an extra $1600 a month. You have to come up with a viable rate.”
“What’s important now is social media engagement—a lot of girls get hired or don’t get hired by how many followers they have,” says porn super-agent Mark Spiegler. “Instagram is really big. That’s one of the pitfalls because Instagram has it out for adult performers.”
A number of social media platforms have been known to purge adult-oriented accounts , even if there’s nothing naughty posted. Due to the business impact, many porn stars preemptively create backup accounts. “Some agents or some girls (agents always blame it on the girls) will charge more money for IR [interracial]. We don’t do that unless it’s a first IR but that’s like a first anal or first anything else.”
Spiegler has a reputation for consistently booking his performers at above-average rates, which he was more than willing to specify. “The minimum boy/girl is a thousand dollars, minimum $1200 for anal but most are more than that and for DP [double penetration] our girls start at $1500 and go up,” says Spiegler. “We charge everyone the same. Some agents or some girls [agents always blame it on the girls] will charge more money for IR [interracial]. We don’t do that unless it’s a first IR but that’s like a first anal or first anything else.”
So what do porn stars actually get paid for sex?
According to conversations with various companies, agents and traditional porn stars, rates can be as unique as the performer, however industry standards do exist.
Female Performer Average Rates (one-time flat rate per scene, zero royalties):
Girl/Girl: $700-$800, Girl/Girl Anal: $900-$1100
Boy/Girl: $900-$1000, Boy/Girl Anal: $1100-$1200
Double or triple penetration: $1200-$2500
Threesomes, Foursomes & Orgies: base rate + $100-$200 per additional performer
Male Performer Average Rates (one- time flat rate per scene, zero royalties):
Newbies boy/girl (anal or non): $300-$500
Proven performers boy/girl (anal or non): $500-$1200
Threesomes, Foursomes & Orgies: base rate + $100-$300 (not always per performer)
Women entering the industry command higher rates as their first scenes are in demand. For men, it’s the opposite. Companies get nervous about hiring a new guy; wood problems are costly for the entire set, especially when locations are rented by the hour. So the rate for a reliable male performer has nearly doubled in the last 10 years (women’s rates have seen only a marginal increase).
“Standard rates for male performers are $300-$400, until you find your grounding. You work with the smaller companies to get your foot in the door but you can double that fairly fast within the year if you’re a solid performer,” says Isiah Maxwell, the reigning 2019 Xbiz Male Performer of the Year.
“I’ve been raising my rate consistently every year, but winning the Xbiz award legitimized my rate,” says Maxwell. “I don’t like to talk about my rate; I don’t want to have an ego conflict on set. No one’s going to tell you how much they make and show you their check after a scene, it’s a little ego-driven. You may deserve a certain rate but you gotta earn it as well.”
2018 Xbiz Girl/Girl Performer of the Year Darcie Dolce agrees, you have to earn it. “I put on a good scene. I come to set looking good, my skin looks good, and my nails aren’t all fucked up. I’m professional, on time, easy to work with, so I think I’m worth the money,” says Dolce. “With some girls, it’s like a Louis [Vuitton] bag: you’re just paying for the name not the purse.”
Dolce echoes the sentiments of virtually the entire industry when she says, “I’m not comfortable telling you my rate. Rates are private. It’s nobody’s business—unless they’re the agent or the ones paying.” READ THIS LIST"
