Veteran Intelligence Professionals (VIPS) Urge Trump to Avoid War Russia Over Venezuela,www.therussophile.org,Veteran Intelligence Professionals for Sanity,04-06-2019,2019,4,https://www.therussophile.org/veteran-intelligence-professionals-vips-urge-trump-to-avoid-war-russia-over-venezuela.html/,"This post was originally published on this site
VIPS warn that Trump’s policies regarding Venezuela appear to be on a slippery slope that could take us toward war in Venezuela and military confrontation with Russia.
***
FROM: Veteran Intelligence Professionals for Sanity (VIPS)
SUBJECT: Avoiding War with Russia over Venezuela
Mr. President:
Your Administration’s policies regarding Venezuela appear to be on a slippery slope that could take us toward war in Venezuela and military confrontation with Russia. As former intelligence officers and other national security practitioners with many decades of experience, we urge you not to let yourself be egged on into taking potentially catastrophic military action in response to civil unrest in Venezuela or Russian activities in the Western Hemisphere. With the recent arrival of two transport aircraft and enduring political support for the government of Venezuela, the Russians are far from crossing any “red line” emanating from the 1823 Monroe Doctrine.
Unfulfilled Objectives in Venezuela
Inside Venezuela, U.S. actions have failed to do more than plunge the country into deeper crisis, cause greater human suffering, and increase the prospects of violence on a national scale. President Maduro’s mishandling of the economy and authoritarian reactions to provocations are impossible to defend, but they result in part from the fact that he has been under siege since he was first elected in 2013 and has faced sanctions aimed ultimately at removing him from office. In our view, the advice you’ve received from your top advisors – Florida Senator Marco Rubio, National Security Advisor John Bolton, Special Representative Elliott Abrams, and Secretary of State Michael Pompeo – was and apparently continues to be wrong. Recognition of Venezuelan National Assembly President Juan Guaidó as “interim president” did not prompt the military to rise up against President Maduro. Neither did attacking the officer corps as merely corrupt opportunists and drug-traffickers enriched through loyalty to former President Chávez and Maduro, nor did repeatedly threatening them with harsher sanctions. Those actions reflected a fundamental misunderstanding about the Venezuelan military, which has never been free of corruption and political compromise but has also never been so totally isolated from the Venezuelan people that it hasn’t felt their suffering. U.S. policies incorrectly assumed that the officers – while probably fed up with Maduro’s shortcomings – would support Guaidó despite his faction’s commitment to dismantle Chavismo , which most officers believe brought historically necessary changes to the country, including enfranchisement of the poor.
Similarly, your Administration’s repeated hints at military intervention have been counterproductive to your regime-change objectives. Your policy and intelligence advisors were correct in interpreting the disparate polling data showing popular support for Guaidó as actually being support for the U.S. to extricate the country from its crisis – the National Assembly President was a political unknown until the United States and others recognized his claim to the Presidency – but your team showed a lack of understanding of Venezuelan nationalism. Venezuelans do not welcome the destruction that would be caused by U.S. military attack; they recall the death toll of Operation Just Cause, when the United States killed more than 3,000 Panamanians (by its own count) to remove one corrupt authoritarian, Manuel Noriega. Threats of invasion have pushed people to circle around Maduro, however reluctantly, not reject him. Your Administration’s strategy of punishing the Venezuelan people, including apparently knocking out their electricity, seems based on the false assumption that humanitarian crisis will prompt a coup to remove Maduro. In fact, the U.S. sanctions have allowed Maduro to shift blame from his own failings to U.S. malice – and it has left Guaidó, whom your advisors portray as the moral equivalent of our Founders, looking like a sell-out to Yankee imperialists at the cost of the Venezuelan people’s health and welfare and magnified civil disorder.
Lost Opportunity for Diplomacy
Senator Rubio, Mr. Bolton, Mr. Abrams, and Mr. Pompeo have also squandered a formidable moment to build on common values with allies in Latin America and Europe. Even though most Latin Americans find your aides’ public assertion that the Monroe Doctrine is alive and well to be insulting, the right-leaning Presidents of most of South and Central America rallied with you to support Guaidó’s self-proclamation. But Guaidó’s lack of leadership – he appears totally scripted by U.S. Government agencies – his inflexibility on negotiations, his open call for U.S. military intervention, and your own Administration’s dangling threat of war are rapidly alienating all but the most subservient to U.S. policy dictates. Negotiation proposals, such as those being developed by the International Contact Group, are gaining momentum.
Internationalizing the Conflict
National Security Advisor Bolton and others have sought to internationalize the Venezuela issue since before Guaidó’s proclamation. Bolton’s reference to a “Troika of Tyranny” in November – which he called “a triangle of terror stretching from Havana to Caracas to Managua” and “sordid cradle of communism in the Western Hemisphere”– was a veiled Cold War-era swipe at Russia and China. Mr. Bolton, Senator Rubio, and other advisors have made clear on numerous occasions that the overthrow of President Maduro would be just the first stage in efforts to eliminate the current governments of the “Troika” and “Communist influence” in the Western Hemisphere. They have repeatedly asserted that Cuban advisors have been crucial to the Maduro government’s survival without providing evidence. Indeed, the reportedly “hundreds” of Venezuelan military defectors, including many managed by U.S. agencies, have not provided even credible hearsay evidence that Cubans are doing more than providing routine assistance. In addition, the threats coming out of Washington have preempted any willingness that Cuba might have had to contribute to a regional solution to the Venezuelan crisis as it has in similar situations, such as Colombia’s recent peace process, the Angola peace process in 1989-90, and the Central American negotiations in the early 1990s.
Provocative Rhetoric about Russia
Most dangerous, however, are aggressive statements about Russia’s engagement with Venezuela. Russian oil companies, particular Rosneft, have long been in Venezuela – bailing out the Venezuelan petroleum company (PDVSA) as its mismanagement and falling oil prices have caused production and revenues to plummet. Most long-term observers believe Rosneft’s decisions, including throwing good money after bad, have been motivated by business calculations, without a particularly ideological objective. Your advisors’ rhetoric imposing an East-West spin on the issue presented President Putin and his advisors an opportunity to try to poke the United States in the eye – especially as Administration efforts to remove Maduro foundered and diplomatic support for Guaidó cracked. Maduro and Putin have not enjoyed particularly close personal relations in the past, and their shared strategic interests are few, but U.S. rhetoric and threats have given them common cause in tweaking us. A meeting in Rome between your special envoy, Elliot Abrams, and Russian Deputy Foreign Minister Sergei Ryabkov achieved nothing amid further U.S. sanctions against Venezuela and continued threats that “all options” were on the table.
Publicly available information is insufficient for us to know exactly what was aboard the two Russian aircraft that landed at Maiquetía last week – two months after your Administration publicly proclaimed its intention to remove Maduro – but precedent suggests Moscow had two main objectives. One, and probably primary, is to embarrass your Administration by defying your rhetoric, just to rub your nose in Moscow’s sovereign right to have the relations, including military liaison, with whomever it pleases. In this sense, Russian behavior resembles its intervention, at Bashar al-Assad’s request, in Syria. And it is not a far cry from Moscow’s reaction to the Western-supported coup in Kiev. Another objective, if press speculation about the Russian advisors and equipment aboard the aircraft is correct, would be to shore up Venezuela’s ability to warn of and respond to a U.S. military strike. Your Administration has publicly asserted that the Russians are helping repair S-300 surface-to-air missile systems, which have a purely defensive purpose. There is no evidence, not even circumstantial, that Russia has any offensive objectives in this relationship.
The U.S. reaction has suggested a much greater chance of military confrontation. Mr. Bolton “strongly caution[ed] actors external to the Western Hemisphere against deploying military assets to Venezuela, or elsewhere in the Hemisphere, with the intent of establishing or expanding military operations.” Without defining what activities he would object to, Mr. Bolton said, “We will consider such provocative actions as a direct threat to international peace and security in the region.” Your Special Representative said the “Russian presence” is “extremely pernicious.” Your Secretary of State said, “Russia’s got to leave Venezuela.” You said, “Russia has to get out” and reiterated that “all options are open”– including presumably forcing the Russians out militarily. And we note that Russia has not closed its embassy in Caracas as your Administration has.
Avoiding the Slippery Slope
As intelligence officers and security experts, we have given many years to protecting our nation from a host of threats, including from the Soviet Union. We also believe, however, that picking fights. including ousting governments, blocking negotiated settlements, and threatening other countries’ sovereign decision to pursue activities that do not threaten our national security – is rarely the wise way to go.
We repeat that we are not defending Maduro and his record, while at the same time pointing out that many of his troubles have been exacerbated by U.S. policies and efforts to oust him. We believe that due process and practical, realistic policies better protect our national interests than threats and confrontational rhetoric. It strains credulity to believe that your advisors picked this fight with President Maduro without realizing that Venezuela would seek help fixing its defensive capabilities.
Moreover and very seriously, rhetoric challenging Russia could all too easily lead to a much more consequential confrontation. Invoking the 1823 Monroe Doctrine is unhelpful. For Russia to provide assistance for purely defensive purposes to a country in which we seek to create regime change and threaten military attack would not be widely seen as violating the Monroe Doctrine or crossing a “red line.” We realize that some in the media are trying to egg you on into taking forceful action, perhaps even of a military nature, to punish Russia in any case. We urge you not to fall into this trap. This is not 19th century Latin America, and it is a far cry from the Cuba missile crisis of 1962. The best way to prevent dangerous miscalculation would be for you to speak directly with President Putin. Washington’s energies would be better spent clearing up differences, adjusting failed policies, and promoting a peaceful resolution in Venezuela.
For the Steering Group, Veteran Intelligence Professionals for Sanity
Fulton Armstrong , former National Intelligence Officer for Latin America & former National Security Council Director for Inter-American Affairs (ret.)
William Binney , former Technical Director, World Geopolitical & Military Analysis, NSA; co-founder, SIGINT Automation Research Center (ret.)
Marshall Carter-Tripp , Foreign Service Officer & former Division Director in the State Department Bureau of Intelligence and Research (ret.)
Bogdan Dzakovic , Former Team Leader of Federal Air Marshals and Red Team, FAA Security, (ret.) (associate VIPS)
Philip Giraldi , CIA, Operations Officer (ret.)
Mike Gravel, former Adjutant, top secret control officer, Communications Intelligence Service; special agent of the Counter Intelligence Corps and former United States Senator
Larry Johnson , former CIA Intelligence Officer & former State Department Counter-Terrorism Official, (ret.)
Michael S. Kearns, Captain, USAF (ret.); ex-Master SERE Instructor for Strategic Reconnaissance Operations (NSA/DIA) and Special Mission Units (JSOC)
John Kiriakou , former CIA Counterterrorism Officer and former Senior Investigator, Senate Foreign Relations Committee
Karen Kwiatkowski, former Lt. Col., US Air Force (ret.), at Office of Secretary of Defense watching the manufacture of lies on Iraq, 2001-2003
Clement J. Laniewski , LTC, U.S. Army (ret.)
Linda Lewis , WMD preparedness policy analyst, USDA (ret.)
Edward Loomis , NSA Cryptologic Computer Scientist (ret.)
David MacMichael , former Senior Estimates Officer, National Intelligence Council (ret.)
Ray McGovern , former US Army infantry/intelligence officer & CIA presidential briefer (ret.)
Elizabeth Murray , former Deputy National Intelligence Officer for the Near East & CIA political analyst (ret.)
Todd E. Pierce , MAJ, US Army Judge Advocate (ret.)
Coleen Rowley , FBI Special Agent and former Minneapolis Division Legal Counsel (ret.)
Peter Van Buren , U.S. Department of State, Foreign Service Officer (ret.) (associate VIPS)
Larry Wilkerson, Colonel, U.S. Army (ret.), former Chief of Staff for Secretary of State; Distinguished Visiting Professor, College of William and Mary
Sarah Wilton , Commander, U.S. Naval Reserve (ret.) and Defense Intelligence Agency (ret.)
Ann Wright , U.S. Army Reserve Colonel (ret) and former U.S. Diplomat who resigned in 2003 in opposition to the Iraq War
*
Note to readers: please click the share buttons below. Forward this article to your email lists. Crosspost on your blog site, internet forums. etc.
Featured image: A Hands Off Venezuela protest in London on January 28, 2018. (Socialist Appeal/Flickr).
from: https://www.globalresearch.ca/vips-urge-trump-avoid-war-venezuela/5673750"
Video: The Dissolution of NATO,www.therussophile.org,RT News,04-06-2019,2019,4,https://www.therussophile.org/video-the-dissolution-of-nato.html/,"This post was originally published on this site German lawmaker Alexander Neu lambasted NATO for conducting aggressive wars and raking up defense spending, suggesting Germany should quit its military command, and the bloc be dissolved altogether.
NATO’s 70th birthday is “not a reason to celebrate, but rather an occasion to finally rethink it, before it’s too late,” Neu wrote in Die Freiheitsliebe blog on Thursday.
The lawmaker from the opposition Left Party slammed the US-led military bloc as an organization that poses “significant security risk to the world” and “systematically violates international law.”
NATO revealed its true colors when it waged an “aggressive war” against Yugoslavia without the UN’s approval, and carried out numerous interventions, which claimed the lives of “countless victims,” Neu argued.
He pointed out that last year NATO’s member states spent more than $1 trillion on defense, which is far more than the defense budgets of its rivals, China and Russia, combined.
The imperialist competition and the fear of losing economic and ideological supremacy drive NATO towards more rearmament and confrontation.
In order to avoid global escalation, the lawmaker proposed that Germany should leave the alliance’s “military structures,” and then NATO itself should be dissolved and replaced by a new “collective security system,” which would include Russia.
Berlin’s contribution to NATO has caused a rift with Washington in recent years, as President Donald Trump repeatedly accused Germany, along with other EU nations, of not spending its “fair share” on the bloc’s collective security. German officials rebuked the criticism, but admitted the country won’t reach NATO’s spending target until 2024.
Founded in 1949, NATO was primarily seen as a bulwark against the Soviet Bloc during the Cold War. The alliance continued its existence after the Soviet Union collapsed, and expanded eastwards, despite vehement protests from Moscow.
[embedded content]
*
Note to readers: please click the share buttons below. Forward this article to your email lists. Crosspost on your blog site, internet forums. etc.
from: https://www.globalresearch.ca/video-the-dissolution-of-nato/5673757"
Trump Regime Considering Aggression against Venezuela?,www.therussophile.org,Stephen Lendman,04-06-2019,2019,4,https://www.therussophile.org/trump-regime-considering-aggression-against-venezuela.html/,"This post was originally published on this site
International law is clear and unequivocal. It’s automatically US constitutional law under the Supremacy Clause (Article VI, Clause 2) – pertaining to treaties, conventions, and other international agreements to which the US is a signatory.
According to the UN Charter and other international law, no nation may attack another for any reason except in self-defense if attacked or an attack is clearly imminent.
Even then, the Security Council alone may authorize military action by one nation against another – not the US president, Congress or courts.
Venezuela is at peace with its neighbors and all other nations, not at war or threatening any, obviously not the US – a country waging war on humanity at home and abroad.
For over two months, everything thrown at its legitimate government for regime change failed.
Is US military intervention coming? Will Britain, France and other NATO countries join a US “coalition of the willing” to rape and destroy Venezuela?
It’s the strategy used in the 1990s rape of Yugoslavia and in all post-9/11 wars of aggression against nations threatening no one.
In my view, it’s highly unlikely. The world community opposes it, notably EU, Latin, and Central American nations.
That said, the Trump regime pulled all its staff from Venezuela. A State Department alert advised US citizens in the country to leave.
On Friday, an unnamed Trump administration official said military intervention “is seriously (being) considered as events unfold”– because everything else tried so far failed, adding:
US tactics “continue to diminish due to Maduro’s recent actions. These tools are diminishing, which is leaving us with increased economic tools and increased economic pressure…and also a military option, which, as President Trump has said, is on the table.”
“The European community, the United States, and the Lima group have made it clear that the consequences of any harm that comes, or an arrest of Juan Guaido, would be devastating to Maduro.”
“It would be the worst and last mistake he makes, and, therefore, we are watching very closely.”
Trump and other regime hardliners earlier said they’re running out of nonmilitary options so belligerent intervention may come next.
Are these and similar comments meaningless bluster, aiming to pressure Venezuela’s military to switch sides? What hasn’t worked so far won’t likely ahead.
Convicted felon Elliott Abrams was appointed point man for regime change in Venezuela.
Dirty Central American wars he orchestrated in Nicaragua, Honduras and Guatemala were responsible for over 300,000 deaths, countless thousands more brutally tortured, and forced into exile.
In June 1986, an International Tribunal on Genocide in Central America called the period a time of intense violence – made in the USA by Abrams and his co-conspirators, saying:
Things “verg(ed) on a near total break-down of the state institutions and open warfare between state governments, competing rebel forces challenging state authorities and indigenous” peoples.
“In the course of resurgent violence, acts of genocide and ethnocide (were) committed against indigenous groups.”
Accusations “of state sponsored and rebel force sponsored genocide against indigenous peoples (were) repeatedly made throughout the course of” the decade, including massacres, torture, forced military service, land seizures, arbitrary arrests and imprisonments, population relocations, and attacks amounting to genocide under the UN Convention.
“That there is sufficient evidence to warrant the convening of a (genocide) tribunal goes without question.” Perhaps Abrams intends an encore of the above atrocities in Venezuela.
Is he plotting something similar in Venezuela, together with other Trump regime co-conspirators?
Along with more illegal sanctions, proxy and cyberwar war are most likely, the former with armed paramilitary thugs for involvement in violence creating chaos, the latter by attacks on Venezuelan infrastructure.
Direct military intervention would be high-risk, neighboring countries Colombia and Brazil especially hostile to the idea, concerned about possible millions of Venezuelans fleeing cross-border for safety.
Russia appears committed to help preserve and protect Venezuelan sovereignty. If US forces attack the Bolivarian Republic, will Putin intervene against Trump regime aggression similar to how he acted in Syria?
Will the US risk possible East/West confrontation over Venezuela?
In a same day article, I suggested Guaido’s arrest, detention, and prosecution for high crimes against the state is likely coming, adding:
Most likely what will follow is escalated US sanctions war, along with more Trump regime threats and establishment media rage. All of the above are coming anyway whether Guaido remains free or detained, awaiting trial – direct US military intervention highly unlikely despite regime threats otherwise.
Venezuela has a choice – going all out to preserve and protect its hemisphere’s best social democracy and sovereign independence or become a US vassal state, the country transformed into a fascist police state, its people terrorized into submission.
The choice is simple. Fundamental freedoms are too important to lose. They’re worth fighting for, no matter the risks.
Losing them to an imperial power means all hope is lost – which is no choice at all.
*
Note to readers: please click the share buttons below. Forward this article to your email lists. Crosspost on your blog site, internet forums. etc.
Award-winning author Stephen Lendman lives in Chicago. He can be reached at [email protected] . He is a Research Associate of the Centre for Research on Globalization (CRG)
His new book as editor and contributor is titled “Flashpoint in Ukraine: US Drive for Hegemony Risks WW III.”
Visit his blog site at sjlendman.blogspot.com .
Featured image is from teleSUR
from: https://www.globalresearch.ca/trump-regime-considering-aggression-venezuela/5673747"
