title, publication, authors, date, year, month, url, content
Logan Paul Sued Over Flat Earth Mockumentary by Guy Trying to Launch Himself Into Space on Homemade Rocket,www.thedailybeast.com,kelly.weill@thedailybeast.com (Kelly Weill),04-12-2019,2019,4,https://www.thedailybeast.com/logan-paul-sued-for-flat-earth-mockumentary-by-mad-mike-hughes,One is a YouTube celebrity. The other is an amateur astronaut trying to disprove millennia of science.
"Mark Riddell, Who Took Tests for Wealthy High Schoolers in College Scam, Pleads Guilty",www.thedailybeast.com,Pilar.Melendez@thedailybeast.com (Pilar Melendez),04-12-2019,2019,4,https://www.thedailybeast.com/test-taking-whiz-mark-riddell-pleads-guilty-in-college-admissions-scam,"ANOTHER ONE DOWN Mark Riddell, Who Took Tests for Wealthy High Schoolers in College Scam, Pleads Guilty Prosecutors allege that while William Singer crafted the college scam, Mark Riddell was the brains behind the operation. Now, both have pleaded guilty in the cheating scandal. 04.12.19 3:02 PM ET Getty
A former Florida prep-school administrator who posed as high-school students to take SAT and ACT tests as part of a nationwide college admissions scam pleaded guilty in Boston federal court Friday afternoon.
Mark Riddell, 36, pleaded guilty to conspiracy to commit mail fraud and conspiracy to commit money laundering in what investigators have called the “largest college admissions scam” ever prosecuted.
Prosecutors alleged over 50 parents paid admissions consultant William “Rick” Singer upwards of $25 million total to rig test scores, cheat on SAT exams, and bribe college coaches to secure their children spots at several elite universities. Many of the children were not aware of the scam.
While Singer is believed to be the engineer of the operation, prosecutors allege that Riddell was the brains—taking tests in students’ place or correcting answers after their tests were handed in.
“He was just a really smart guy,” Andrew Lelling, U.S. Attorney for the District of Massachusetts said at a March news conference announcing the charges from the FBI’s “Operation Varsity Blues.” “He didn’t have any side information about the correct answers. He was just smart enough to get a near-perfect score on the exam or to calibrate the score.”
Riddell, the former director of the IMG Academy, allegedly was paid $10,000 per test. That money was taken from “donations” parents made to Singer’s fake charity, Key Worldwide Foundation, which were also used to bribe Los Angeles and Houston test administrators to let Riddell pose as high-school students.
“I want to communicate to everyone that I am profoundly sorry for the damage I have done and grief I have caused those as a result of my needless actions. I understand how my actions contributed to a loss of trust in the college admissions process,” Riddell said in a statement last month , after the charges were announced.
According to the indictment, Riddell was not only able to ace the standardized tests, but he also made sure to get an appropriate exam score for each student so as not to raise the suspicion of test companies.
“Singer would discuss with parents what kind of score was impressive—but not too impressive,” Lelling said. “Then he would instruct Riddell to attempt to get that score, and he was just good enough to do it.”
Riddell helped the oldest daughter of Felicity Huffman, who allegedly paid $15,000 to have the 36-year-old correct her kid’s answers, giving her a 400-point bump. Huffman, 56, announced on Monday that she will plead guilty to bribery and fraud for her role in the scam.
“I am ashamed of the pain I have caused my daughter, my family, my friends, my colleagues and the educational community,” Huffman said in a Monday statement. “I want to apologize to them and, especially, I want to apologize to the students who work hard every day to get into college.”
Riddell, a Harvard graduate and failed tennis pro, has been working with authorities since February and agreed to the terms in a plea deal signed last month in exchange for his cooperation, “in the hope of obtaining leniency when he is sentenced,” the Massachusetts U.S. attorney’s office said.
“I will always regret the choices I made, but I also believe that the more than one thousand students I legitimately counseled, inspired, and helped reach their goals in my career will paint a more complete picture of the person I truly am,” Riddell said in the statement.
He now faces up to two decades in prison and a $250,000 fine, although prosecutors said Friday they are recommending 33 months for his July 18 sentencing hearing. His plea makes him the 18th person to plead guilty in the massive bribery scam."
Trump Wants to Bus Migrants to Sanctuary Cities. The Mayors There Are Fine With It.,www.thedailybeast.com,Scott.Bixby@thedailybeast.com (Scott Bixby) Sam.Brodey@thedailybeast.com (Sam Brodey),04-12-2019,2019,4,https://www.thedailybeast.com/trump-wants-to-bus-migrants-to-sanctuary-cities-the-mayors-there-are-fine-with-it,"Trump Wants to Bus Migrants to Sanctuary Cities. The Mayors There Are Fine With It. An elaborate attempt to troll liberal politicians seems to have hit a snag. 04.12.19 4:46 PM ET JIM WATSON
President Donald Trump may have assumed that his proposal to release undocumented immigrants into so-called “sanctuary cities” would back Democrats into a corner on the issue of immigration. But the local officials in those cities he’s targeting don’t seem to actually find the prospect all that foreboding.
Instead, when asked about the plan—which would entail busing migrants apprehended at the U.S.-Mexico border to be released in cities that do not cooperate with federal law enforcement to arrest undocumented immigrants—mayors of major cities, regional capitals and medium-sized towns told The Daily Beast said that they would welcome those currently being detained.
“The city would be prepared to welcome these immigrants just as we have embraced our immigrant communities for decades,” Philadelphia Mayor Jim Kenney told The Daily Beast in a statement. “This White House plan demonstrates the utter contempt that the Trump administration has for basic human dignity and the core values on which this nation was founded.”
“As a welcoming city, we would welcome these migrants with open arms, just as we welcomed Syrian refugees, just as we welcomed Puerto Ricans displaced by Hurricane Maria and just as we welcome Rohingya refugees fleeing genocide in Myanmar,” said Chicago Mayor Rahm Emanuel in a statement.
“I am proud that Cambridge is a sanctuary city,” Mayor Marc McGovern of Cambridge, Massachusetts, told The Daily Beast. “Trump is a schoolyard bully who tries to intimidate and threaten people. I’m not intimidated and if asylum seekers find their way to Cambridge, we’ll welcome them.”
The response to Trump’s proposal is almost certainly not what the president expected and reflects the vast gulf that is growing between the two parties on immigration policy. The president’s idea was presented as a threat meant to scare Democrats into admitting that they wouldn’t be as accommodating of immigrant communities as they have pledged to be.
“We’ll give ’em to the sanctuary cities, maybe, to take care of, if that’s the way they want it,” Trump said during an event originally intended to pitch U.S. companies on the deployment of 5G technology. “We are looking at the possibility, strongly looking at it, to be honest with you.”
“We’ll give them more people,” Trump continued. “We can give them an unlimited supply—let’s see if they have open arms.”
How serious the administration is about pushing the idea remains unclear. The White House originally denied that they were seriously considering busing undocumented immigrants and migrants detained at the border to sanctuary cities, saying it was “just a suggestion that was floated and rejected, which ended any further discussion.” But the president has since leaned into it, even tweeting that he was giving it “strong consideration.”
That gambit, experts say, is both logistically and legally dubious. And multiple mayors told The Daily Beast that it only makes the Trump administration’s immigration policy look incoherent.
“Like so many issues we are forced to talk about during this presidency, this isn’t a real idea or a real proposal, it’s just another scare tactic,” said San Francisco Mayor London Breed. The city, home to the congressional district currently held by House Speaker Nancy Pelosi, is specifically mentioned as a potential target of Trump’s policy. “Every time we talk about the president’s latest tweet… we aren’t talking about a path to citizenship for the over 10 million undocumented immigrants in our country.”
Some pointed out that the proposal would only exacerbate what the president has characterized as an immigration crisis.
“Humans are not pawns. This is not a game. These are people’s lives,” said Portland Mayor Ted Wheeler. “Portland will continue to protect its sanctuary status in accordance with Oregon law and the U.S. Constitution. We strongly denounce the cruel efforts of this administration to retaliate against sanctuary cities.”
Previous Trump administration threats to retaliate against sanctuary cities have not materialized into actual policy. Former Attorney General Jeff Sessions had vowed to withhold federal law enforcement grants from jurisdictions that declined to cooperate with ICE. But 29 of 30 municipalities that had received Sessions’ letters still ended up receiving those grants. Federal courts also sided with sanctuary cities after Trump issued an executive order restricting federal funding for such cities.
“It’s a sign of the president’s tremendous weakness as an executive and weakness as a leader, and of the degree to which he pales in comparison to all of his recent predecessors,” Mayor Daniel Drew of Middletown, Connecticut told The Daily Beast. “This threat is hollow and more than anything is a sign of the tremendous weakness of the Trump administration.”
In Coachella, the California desert town famous for its music festival, Mayor Steven Hernandez told The Daily Beast that the city already works with outside organizations to ensure that undocumented immigrants are able to integrate into the community. Were the administration to bus in migrants from the border, Hernandez said, the community would welcome them.
“We have already been working alongside partners to ensure that recently arrived families, women and children get the services they need to make their successful transition into America,” he said.
Democrats in Congress, meanwhile, were exasperated with the president’s latest immigration gambit, and said they stand willing to work on policy if the White House would quit with the posturing.
Rep. Ro Khanna, a California Democrat who represents part of San Jose, a sanctuary jurisdiction, called on Trump to propose “real solutions.”
“Most of the communities he believes people should be going to are ones who would believe in just processing and treating people humanely and having that process,” Khanna told The Daily Beast by phone. “Is he gonna pay for people to be flown in there? Is he going to be paying for judges? It’s just logistically infeasible.”
Rep. Jamie Raskin, a Democrat who represents Maryland’s Montgomery County, a jurisdiction ICE has called consistently not cooperative, said that the political conditions were actually ripe for negotiations with the White House and congressional Republicans.
“It’s unfortunate that the president is in such a dark and vindictive state of mind. I don’t know where he thinks that leads,” added Raskin. “He’s a day trader. He’ll be off on another idea tomorrow.”"
Scouted: Anthropologie Is Giving You an Extra 25% Off Virtually All Its Sale Items Today,www.thedailybeast.com,gideon.grudo@thedailybeast.com (Gideon Grudo),04-12-2019,2019,4,https://www.thedailybeast.com/anthropologie-sale-get-an-extra-25-off-sale-items,"Scouted By The Beast
There are more than 1,500 items on sale at Anthropologie right now — including clothing , shoes and accessories , and beauty and wellness products — and you can get an extra 25% off virtually all of them . The final and discounted price is applied at checkout. NEWSLETTERS Product recommendations that'll make your life better and tips to help you shop smarter. Subscribe By Clicking ""Subscribe"" you agree to have read the Terms of Use and Privacy Policy
Since the sale covers so many departments on sale, there’s something in here for everyone. Want to give your dining experience an upgrade? This 4-piece set of Daisy dinner plates is $19 right now (that’s 53% off). Heading into the bedroom, this washed Percale Betsy duvet cover is $83 (also 53% off). How about a springy Brittany Gingham blouse whose black and white style should go with virtually anything you pair with it. It’s going for $45 (54% off). Or how about getting functional with Anthropologie’s Wanderer Utility pants ? Also going for $45 (or 54% off), these have a relaxed fit and an adjustable tie belt.
Anthropologie’s stacked sale is a great opportunity to update some wardrobe essentials or step up kitchen and living room mainstays — check out your options before long as this sale likely won’t last long past the weekend.
Scouted is internet shopping with a pulse. Follow us on Twitter and sign up for our newsletter for even more recommendations and exclusive content. Please note that if you buy something featured in one of our posts, The Daily Beast may collect a share of sales. READ THIS LIST"
Google Deals New Blow to Alt-Right Social Network Gab,www.thedailybeast.com,William.Sommer@thedailybeast.com (Will Sommer),04-13-2019,2019,4,https://www.thedailybeast.com/google-deals-new-blow-to-alt-right-social-network-gab,"ONE STEP AT A TIME Google Deals New Blow to Alt-Right Social Network Gab Google and Mozilla have taken aim at Gab’s ‘Dissenter,’ an internet-wide comment section. 04.12.19 6:29 PM ET Photo Illustration by The Daily Beast
Google and Mozilla banned a browser extension made by the social network Gab on Thursday, dealing another blow to the racist alt-right’s favorite social platform .
The new bans target Dissenter , a browser extension created by Gab that adds a parallel comment section to any web page on the internet. The decision from the two tech companies makes it harder for people to add Dissenter to their browsers.
The extension allowed Gab commenters to avoid moderation on the website’s usual comment sections, leaving their posts instead on a separate overlay visible to anyone with the Dissenter plug-in installed in Google’s Chrome or Mozilla’s Firefox. As a result, Dissenter comments often featured the same discussions popular with Gab’s far-right user base: fervent support for Trump and Gamergate-style complaints over perceived “social justice warrior” infiltration of various video games and movies by liberals.
In a statement, a Mozilla spokesperson told The Daily Beast that Dissenter had violated Mozilla’s rules against hate speech.
“Mozilla does not endorse hate speech and we do not permit our platforms to be used to promote such content,” the statement reads.
Gab founder Andrew Torba said in a statement that Dissenter had been blocked by tech companies that “want to destroy free expression online.” In response to the bans that make it harder to install Dissenter on mainstream browsers, Torba claims that Gab will now be launching its own browser as well.
Google didn’t respond to a request for comment.
Mozilla and Google reportedly banned Dissenter ahead of a story from the Columbia Journalism Review about the browser extension. The Dissenter comment section on that CJR story quickly filled up with angry users who blamed the story’s authors for the bans.
Torba himself appeared in the Dissenter posts, denouncing one expert quoted in the story as “pure SOY”—a reference to the fringe belief that eating soy makes men feminine.
Gab has already lost the services of PayPal, GoDaddy, and a number of other tech companies after Pittsburgh synagogue shooting suspect Robert Bowers allegedly used the social network to announce his plans. In March, Torba claims, Gab was even kicked off the crowdfunding site that it had used to raise roughly $2 million.
Torba launched Dissenter in February in an attempt to create a “free speech comment section for the internet.” Gab claimed on Thursday that Dissenter has more than 85,000 users—although the platform’s user base figures have been repeatedly questioned by critics .
The bans from Google and Mozilla now put Dissenter’s user growth, whatever the actual figure is, in doubt. While Chrome and Firefox users can still install the extension through the Dissenter site, they have to go through a complicated, lengthy process that requires downloading Dissenter’s code and attempting to set it up themselves.
Before the bans, by contrast, Dissenter users could easily install it through Chrome or Mozilla add-on stores. "
Anatori Crypts: This Caucasus Ghost Town May Be the Creepiest Place on Earth,www.thedailybeast.com,msn.com,04-13-2019,2019,4,https://www.thedailybeast.com/anatori-crypts-this-caucasus-ghost-town-may-be-the-creepiest-place-on-earth?source=articles&via=rss&utm_source=dlvr.it&utm_medium=twitter,"Peek inside and you’ll be met with skulls, femurs, vertebrae, and teeth piled so high you can't see the floor. Something horrible happened here, and no one is quite sure what."
"He Stole the Gutenberg Bible, Then Became Porn’s Weirdest Star",www.thedailybeast.com,Aaron Skirboll,04-13-2019,2019,4,https://www.thedailybeast.com/vito-aras-stole-harvard-gutenberg-bible-transformed-into-porn-star-dr-infinity,The many lives of ‘Dr. Infinity.’
