Sanders’ ‘Berners’ Still Smoldering Over 2016,www.therussophile.org,William Holland,04-06-2019,2019,4,https://www.therussophile.org/sanders-berners-still-smoldering-over-2016.html/,"This post was originally published on this site
Democratic presidential candidate Sen. Bernie Sanders and his wife, Jane, arrive at a rally at Grand Park in Los Angeles in March. (Damian Dovarganes / AP)
IOWA CITY, Iowa—It was hard to miss Cheri Pichone’s excitement about Bernie Sanders’ second presidential run. She showed up to a recent Iowa rally decked out in Sanders gear, complete with a figurine of the Vermont senator and progressive icon.
But underneath her exuberance, the 36-year-old was still mad about the last Democratic primary, when Sanders’ bid for the presidency fell short to Hillary Clinton.
“They cheated,” she said, directing much of her anger at the Democratic National Committee. The party establishment, she lamented, was “actively working against us.”
Pichone voted for Green Party candidate Jill Stein in 2016 and said she may vote for a third party again if Sanders doesn’t clinch the nomination.
She’s emblematic of a persistent group of Sanders supporters who won’t let go of the slights — real and perceived — from the last campaign. The frustration is notable now that Sanders is a 2020 front-runner, raking in $18.2 million in the first quarter, downplaying concerns about DNC bias and highlighting his success in bringing the party around on liberal policies it once resisted.
Some establishment-aligned Democrats worry the party could lose in 2020 if lingering concerns about the last primary aren’t put to bed.
“It has the potential to escalate, and it has the potential to help re-elect Donald Trump,” said Mo Elleithee, a former spokesman for Clinton and the DNC.
The acrimony stems from a fiercely fought campaign and a sense among Sanders loyalists that party leaders privately favored Clinton. DNC leaders at the time scheduled fewer debates than Republicans and sometimes slated them for nights with low television viewership. Often opaque delegate allocation rules also contributed to a belief among some Sanders supporters that the primary was essentially rigged.
According to data from the Pew Research Center, the tension took a toll. About 81% of people who consistently supported Sanders during the primary season and were confirmed to have voted in the general election said they ultimately voted for Clinton, while 11% said they supported Stein or Libertarian nominee Gary Johnson, and 3% supported Trump.
In a closely contested election, those moves away from Clinton may have factored into the results.
Since the election, party leaders have sought to smooth things over with Sanders and his supporters. DNC Chairman Tom Perez is planning a robust debate schedule. The rules governing superdelegates — party insiders who overwhelmingly backed Clinton — have changed.
Sanders has publicly expressed confidence in the process this time around, but in terms that suggest he won’t soon forget 2016.
“In 2016, I think I will not shock anybody to suggest that the DNC was not quite evenhanded,” he said during a CNN town hall in February. “I think we have come a long way since then, and I fully expect to be treated quite as well as anybody else.”
In an interview Friday, Sanders campaign manager Faiz Shakir echoed that optimism.
“If you’re talking to anyone at the Democratic National Committee who’s there now, I’m sure they will tell you that their relationship with the Bernie Sanders campaign is great and that we are operating in good faith and we are talking to each other on an almost daily basis,” he said. “Anyone suggesting that there’s any kind of friction there is living in the past. They are living with some grudges that they are holding onto from a bygone time.”
Still, the campaign has made some moves that raise questions about whether resentments from 2016 will linger. Briahna Joy Gray, formerly a liberal journalist who voted for Stein, is Sanders’ national press secretary. Nina Turner, who called the DNC “dictatorial and pompous” in 2017, is one of his national campaign chairs.
And some of Sanders’ most loyal supporters in the crucial early voting states say they’re not ready to fully move on.
Nicholas Shaw, a 39-year-old from Concord, New Hampshire, spent his recent birthday watching Sanders speak. Like Pichone, he said he wouldn’t support the Democratic nominee if it’s anyone other than Sanders.
“If they steal it from him again, I’ll go independent or something other than that,” he said. “The Democratic Party’s on their last edge of me if they kind of try to screw him again.”
Even in South Carolina, where Sanders lost momentum after a 47-point drubbing from Clinton, some supporters are still smarting over a process they believe was rigged.
“Lost might be a stretch,” said Tom Amon, of Summerville, when asked how he felt about Sanders’ ability to perform better in South Carolina than he did in the 2016 primary. “It was stolen from him.”
___
Woodall reported from Manchester, New Hampshire, and Kinnard reported from North Charleston, South Carolina. Associated Press writer Juana Summers in Davenport, Iowa, contributed to this report."
"For American Jews, Trump Is Key Figure in Israeli Election",www.therussophile.org,DAVID CRARY The Associated Press,04-06-2019,2019,4,https://www.therussophile.org/for-american-jews-trump-is-key-figure-in-israeli-election.html/,"This post was originally published on this site
NEW YORK—Donald Trump isn’t on the ballot for Israel’s national election, yet he’s a dominant factor for many American Jews as they assess the high stakes of Tuesday’s balloting.
At its core, the election is a judgment on Prime Minister Benjamin Netanyahu, who has won the post four times but now faces corruption charges. In his battle for political survival, Netanyahu has aligned closely with Trump — a troubling tactic for the roughly 75% of American Jewish voters who lean Democratic.
“The world has come to understand that Netanyahu is essentially the political twin of Donald Trump,” said Jeremy Ben-Ami, president of the liberal pro-Israel group J Street. “Unlike his previous elections, there is a much deeper antagonism toward Netanyahu because of that close affiliation between him and Trump and the Republican Party.”
Netanyahu featured Trump in a recent campaign video, while Trump has made a series of policy moves viewed as strengthening Netanyahu in the eyes of Israeli voters, including relocating the U.S. Embassy to Jerusalem, withdrawing from the 2015 Iran nuclear deal and officially recognizing the Golan Heights as Israeli territory.
“It’s troubling,” said Halie Soifer, executive director of the Jewish Democratic Council of America. “The U.S.-Israel relationship should not be about any two leaders or any two parties. The American Jewish community wants the relationship to remain on a bipartisan basis.”
Though it leans Democratic overall, the American Jewish community — numbering 5.5 million to 6 million — is not monolithic. Most older Jews remain supportive of Israel’s current Middle East policies, as does the roughly 10% of the Jewish population that is Orthodox. Jewish billionaire casino mogul Sheldon Adelson has been a staunch financial supporter of Trump and the GOP.
Divisions among U.S. Jews have been exacerbated by recent allegations of anti-Semitism directed at the Democrats’ two Muslim American congresswomen — Ilhan Omar and Rashida Tlaib. Seizing on the controversy, Trump tweeted his support for a purported “Jexodus” movement that would encourage Jews to leave the Democratic Party.
“Republicans are waiting with open arms,” Trump tweeted on March 15.
Morton Klein, president of the conservative Zionist Organization of America, predicts such an exodus will take place because of the Democrats’ decision to avoid explicit condemnation of the congresswomen.
Ben-Ami scoffed at the notion, suggesting that Jexodus was a fantasy of pro-Trump operatives.
“I’ve yet to meet an actual Obama/Clinton voter who’s said publicly they’re switching to vote for Donald Trump,” he said. “This is not real. It’s completely made up.”
New York-based journalist Jane Eisner, former editor of The Forward, a Jewish newspaper, said many American Jews have “Netanyahu fatigue”— even some who supported him in past.
Among liberal Jews, Eisner said, there are strong worries that Netanyahu will push Israel’s government even further to the right if he wins, perhaps moving to annex some land in the occupied West Bank with confidence that the Trump administration will not object.
Morton Klein conceded that some Jews have grown weary of Netanyahu, but predicted he would prevail.
“People would be nervous if he’s not there,” Klein said.
Jack Rosen, president of the American Jewish Congress, said any surge in Netanyahu fatigue should not be interpreted as a weakening of American Jews’ support for Israeli.
“There is a sense of fatigue having one leader for 10 years,” Rosen said. “Just as we’ve had Clinton fatigue and Bush fatigue.”
Among liberal and centrist American Jews, dismay with Netanyahu extends beyond his alliance with Trump. Some say he’s been too harsh in his treatment of migrants, and they bemoan his backtracking on a promise to allow mixed-gender prayer at the Western Wall. Perhaps most disturbing has been Netanyahu’s alliance with an ultranationalist political party linked to a movement previously banned for anti-Arab racism and incitement.
That political alliance was assailed as “repugnant” by Eric Yoffie, a rabbi from Westfield, New Jersey, in a March 27 op-ed in the Israeli newspaper Haaretz. Yoffie also decried Netanyahu’s “excessive enthusiasm” for Trump.
“Cordial relations are essential,” wrote Yoffie, president emeritus of the Union for Reform Judaism. “But the sycophantic buddy movie that Bibi has produced with America’s unbalanced and unpredictable president is something else altogether … Bibi’s egregious and unnecessary embrace of everything Trump will cost Israel dearly.”
In Israel, a prevalent view, at least in pro-Netanyahu ranks, is that the prime minister’s friendship with Trump is paying unprecedented dividends. There is widespread sentiment that liberal American Jews, as a constituency, are dissipating due to intermarriage, and that the evangelical Christian community in the U.S. is a more dependable ally for Israel.
At last year’s ceremony in Jerusalem celebrating the relocation of the U.S. Embassy from Tel Aviv, evangelical Christian pastors allied with Trump delivered the opening and closing blessings.
Netanyahu’s main challenger in the election is Benny Gantz, a former military chief popular in Israel but with a relatively low profile in the United States. American Jews who dislike Netanyahu view Gantz as preferable, due in part to a less combative personality, but liberals note with frustration that the platform of Gantz’s Blue and White party makes no mention of Palestinian statehood, and says that Israel will maintain control of parts of the West Bank.
Emily Mayer of IfNotNow, a group of youthful American Jewish activists opposed to Israel’s treatment of Palestinians, is dismayed at how that issue has been marginalized in the Israeli election campaign.
“Regardless of the winner, the utter erasure of Palestinian humanity from this election cycle and the normalization of an undemocratic and immoral military occupation should alarm any Jew who cares about freedom and dignity of Israelis and Palestinians,” Mayer said in an email.
___"
Russian foreign minister slams Israel’s 'inadmissible' shelling of Syria,www.therussophile.org,Michael Sullivan,04-06-2019,2019,4,https://www.therussophile.org/russian-foreign-minister-slams-israels-inadmissible-shelling-of-syria.html/,"This post was originally published on this site
Russia’s foreign minister has slammed as “inadmissible” Israel’s airstrikes on Syria, underlining the need for respecting the sovereignty of the Arab country.
In an interview with Egypt’s al-Ahram newspaper on Saturday, Sergei Lavrov said Moscow’s stance on the inadmissibility of Israeli shelling of Syria’s territory has not changed.
“Our principled stance concerning shelling Syria’s territory has remained unchanged. We have always clearly expressed our attitude to that. We proceed from the need for strict respect for Syria’s sovereignty, independence and territorial integrity,” Lavrov said.
“We are opposed to turning the country’s territory into a scene of armed standoff between various regional players,” Lavrov said when asked to comment on remarks by some political analysts about softening Moscow’s stance on Israeli shelling of Syria.
The top Russian diplomat said, “During our contacts with all parties concerned, we highlight the importance of preventing an upsurge in tensions and the dangerous escalation of the situation in Syria, which are fraught with negative consequences for both neighboring countries and the Middle East region in general.”
He went on to say that Russia in cooperation with Iran and Turkey contributed to working to set up a de-escalation zone in Syria’s south and southwest.
“Now these areas are under the control of the Syrian government. Russian military police officers help maintain law and order there,” Lavrov said.
Israel began carrying out military strikes in Syria in 2013.
The Tel Aviv regime has recently increased its airstrikes in the Arab nation. Earlier in March, the Israeli regime launched the attacks on Shaykh Najjar industrial city located 10 km northeast of the city of Aleppo.
The Syrian government has on multiple occasions slammed the Israeli regime’s act of aggression and also warned about the “dangerous repercussions” of Israeli assaults on its territories. Israel is widely believed to have been providing weapons to anti-Damascus militants as well as medical treatment to Takfiri elements wounded in Syria inside the occupied Golan Heights.
Israel often claims that it conducts airstrikes targeting “Iranian assets” in Syria.
Damascus and Tehran have repeatedly rejected Israeli claims that Iran has military bases in Syria. Iran has been offering military advisory support to Syria at the request of the Damascus government, enabling its army to speed up its gains on various fronts against terror outfits.
Russia has also conducted aerial bombardment of terrorist positions.
In the past, the Syrian army has confiscated Israeli-made arms and military equipment from terrorists fighting the government forces. There are also reports that Tel Aviv has been treating the extremists wounded in Syria.
Read more:"
Turkey moving away from America’s sphere of influence: Analyst,www.therussophile.org,Michael Sullivan,04-06-2019,2019,4,https://www.therussophile.org/turkey-moving-away-from-americas-sphere-of-influence-analyst.html/,"This post was originally published on this site
Turkey has been moving away from America’s sphere of influence and improving its relationship with Russia, which was underscored by Turkey’s purchase of the Russian S-400 missile defense system despite US threats not to do so, says a political analyst in Virginia.
“There’s been tensions between the United States and Turkey in recent years over a number of issues pertaining to US policy in the Middle East,” said Keith Preston, chief editor of AttacktheSystem.com.
“American foreign policy has become increasingly hostile towards Russia in the last few years and the Turks do appear to view that as not being in their interest, in part because of their relatively close geographical proximity to Russia,” Preston told Press TV on Thursday.
President Recep Tayyip Erdogan on Friday vowed to go ahead with a deal to purchase Russian missiles despite Washington’s suspension of Turkey’s participation in a US jet program.
The US said on Monday it was halting all deliveries and joint work with Turkey on the F-35 fighter jet program if Ankara insisted on the deal.
Washington has suggested Turkey could opt for the US-produced Patriot missiles instead.
But Erdogan said although Ankara was keen to buy the US-produced missiles, “America was unfortunately not giving Patriots to us on the same terms” as Russia.
The row over the F-35 and the S-400 is the latest in a series of diplomatic disputes between Ankara and Washington.
Tensions have been escalating between the two NATO allies over issues including US support for Kurdish groups in Syria that Ankara says are responsible for terror attacks inside Turkey.
Washington and its NATO allies have strived to prevent the sophisticated Russian-built anti-aircraft weapon system from collecting information about the US-made all-weather stealth multirole warplanes, technically known as the Lockheed Martin F-35 fighters, just as they are gaining a foothold in Europe.
Erdogan has also slammed American officials for rejecting his requests to hand over Fethullah Gulen, a powerful opposition figure living in the US, whom Ankara accuses of having masterminded a coup attempt in July 2016.
from: http://www.presstv.ir/Detail/2019/04/06/592741/US-Russia-Turkey-sphere-of-influence-Keith-Preston"
"Leader pardons, commutes sentences of large number of prisoners",www.therussophile.org,Michael Sullivan,04-06-2019,2019,4,https://www.therussophile.org/leader-pardons-commutes-sentences-of-large-number-of-prisoners.html/,"This post was originally published on this site
Leader of the Islamic Revolution Ayatollah Seyyed Ali Khamenei has agreed to pardon or commute the sentences of a large number of Iranian prisoners.
Ayatollah Khamenei on Saturday agreed to a request by Iran’s Judiciary Chief Hojjatoleslam Ebrahim Raeisi to pardon or reduce the sentences of 1,117 eligible inmates.
Those granted “Islamic clemency” through the Leader’s approval had been convicted at the country’s court of common pleas and Islamic Revolution tribunals, the Judicial Organization of the Armed Forces, and the State Discretionary Punishment Organization.
Ayatollah Khamenei issued the approval on the occasion of Eid al-Mab’ath and the 40th anniversary of the Islamic Republic referendum.
The 27th day of the lunar Islamic month of Rajab marks the auspicious occasion of Eid al-Mab’ath, the anniversary of the divine revelation to the Prophet Mohammad (Peace Be Upon Him) to declare his Prophethood.
April 1 marks a historic referendum in which Iranians overwhelmingly voted for the establishment of an Islamic Republic following the overthrow of the monarchy of the US-backed Pahlavi regime.
In the two-day referendum held on March 30-31, 1979, more than 98.2 percent of eligible Iranians voted “yes” to the establishment of an Islamic Republic in the country.
from: http://www.presstv.ir/Detail/2019/04/06/592745/Khamenei-Leader-inmates-Eid-alMabath"
Make US troops leave Iraq as soon as possible: Ayatollah Khamenei,www.therussophile.org,Michael Sullivan,04-06-2019,2019,4,https://www.therussophile.org/make-us-troops-leave-iraq-as-soon-as-possible-ayatollah-khamenei.html/,"This post was originally published on this site
Leader of the Islamic Revolution Ayatollah Seyyed Ali Khamenei (R) meets Iraqi Prime Minister Adel Abdul-Mahdi in Tehran on April 6, 2019. (Photo by khamenei.ir)
Leader of the Islamic Revolution Ayatollah Seyyed Ali Khamenei says the Baghdad government should expel US forces from Iraq as soon as possible.
“Relations between the Islamic Republic of Iran and Iraq are beyond relations between two neighboring countries and the Iranian government and nation regard progress and prosperity of Iraq as beneficial to themselves,” the Leader said in a meeting with Iraqi Prime Minister Adel Abdul-Mahdi and his accompanying delegation in Tehran on Saturday.
“But despite their remarks, the Americans regard democracy and Iraq’s current political activists to their detriment and based on this, the Iraqi government should do something [to ensure] that American military troops leave Iraq as soon as possible,” Ayatollah Khamenei added.
The Leader emphasized that Iraq could turn into the Arab world’s most influential country thanks to its human capacities and rich underground resources.
The US and its stooges in the region oppose the current democratic process in Iraq and believe that it would be against their interests, the Leader stated.
Ayatollah Khamenei added that the Iraqi government, parliament and current political activists were not favored by the US and therefore it was hatching plots to eliminate them from the political scene of Iraq.
The Leader pointed to contradictory remarks and intentions of American and Saudi officials and said, “They funneled money, weapons and equipment to Daesh at a time that they [the terrorists] had occupied Mosul, and now that Iraq has overcome Daesh, they are expressing friendly words.”
The Leader hailed Abdul-Mahdi’s wise and prudent stance on regional issues, particularly the developments in Iraq, and said the Iraqi youths were among the country’s human capacities that passed the exam of the fight against Daesh terrorists in a good and admirable way and marked a historical event.
Ayatollah Khamenei added that scientists and elites were among Iraq’s other human capacities and said the US had killed many Iraqi scientists because it was aware of the significance of “this important asset.”
The Leader stressed the importance of maintaining full vigilance against the Daesh remnants “because they will once again embark on their crimes, if they feel a moment of weakness among the Iraqi government and nation.”
Ayatollah Khamenei said the presence of US troops in the region could harm the interests of any country which they had established a long presence there.
The Leader further said that the Iranian and Iraqi nations had common beliefs and cultural and historic bonds.
Iranian President Hassan Rouhani (L) participates in a meeting between Leader of the Islamic Revolution Ayatollah Seyyed Ali Khamenei (R) and Iraqi Prime Minister Adel Abdul-Mahdi in Tehran on April 6, 2019. (Photo by khamenei. ir)
During the meeting, which was also attended by Iranian President Hassan Rouhani, the Iraqi prime minister said the Iranian government and nation had always supported the Iraqis in difficult times, particularly in the fight against Daesh.
Abdul-Mahdi hailed his country’s relations with Iran and emphasized that Iraq would never join US sanctions against Tehran.
Speaking at a joint press conference with the Iraqi prime minister earlier in the day, Rouhani said Iran and Iraq were keen to expand their cooperation in the fight against terrorism and smuggling while seeking stronger ties in the power, gas and oil sectors.
“Border cooperation to fight terrorism, narcotics and smuggling will become stronger between the two countries,” Rouhani said.
from: http://www.presstv.ir/Detail/2019/04/06/592752/Khamenei-Adel-AbdulMahdi-Iran-Iraq-US-Rouhani"
