Project Venezuela Liquefied Natural Gas Terminal,www.sourcewatch.org,Lydiaplante,04-03-2019,2019,4,https://www.sourcewatch.org/index.php?title=Project_Venezuela_Liquefied_Natural_Gas_Terminal&diff=747538&oldid=747535,"Difference between revisions of ""Project Venezuela Liquefied Natural Gas Terminal"" From SourceWatch (Created page with ""{{Navbar-FossilTracker}}'''Project Venezuela Liquefied Natural Gas Terminal''' also known as the Cristobal Colon project or the PVLNG project, is a proposed LNG terminal in Ve..."") |width=400|height=300|type=normal|zoom=7}} + |width=400|height=300|type=normal|zoom=7}} *'''Parent: ''' Petroleos de Venezuela SA (PDVSA), Royal Dutch/Shell, ExxonMobil Corp., and Mitsubishi Corp. *'''Parent: ''' Petroleos de Venezuela SA (PDVSA), Royal Dutch/Shell, ExxonMobil Corp., and Mitsubishi Corp. *'''Status:''' Shelved Latest revision as of 16:02, 3 April 2019 This article is part of the Global Fossil Infrastructure Tracker, a project of Global Energy Monitor and the Center for Media and Democracy . Sub-articles:
Project Venezuela Liquefied Natural Gas Terminal also known as the Cristobal Colon project or the PVLNG project, is a proposed LNG terminal in Venezuela. It is presumed shelved, with no updates reported since 2000. [1] Contents Location Loading map... {""minzoom"":false,""maxzoom"":false,""mappingservice"":""googlemaps3"",""type"":""ROADMAP"",""types"":[""ROADMAP"",""SATELLITE"",""HYBRID"",""TERRAIN""],""width"":""400px"",""height"":""300px"",""centre"":false,""title"":"""",""label"":"""",""icon"":"""",""visitedicon"":"""",""lines"":[],""polygons"":[],""circles"":[],""rectangles"":[],""wmsoverlay"":false,""copycoords"":false,""static"":false,""zoom"":7,""layers"":[],""controls"":[""pan"",""zoom"",""type"",""scale"",""streetview""],""zoomstyle"":""DEFAULT"",""typestyle"":""DEFAULT"",""autoinfowindows"":false,""resizable"":false,""kmlrezoom"":false,""poi"":true,""markercluster"":false,""clustergridsize"":60,""clustermaxzoom"":20,""clusterzoomonclick"":true,""clusteraveragecenter"":true,""clusterminsize"":2,""tilt"":0,""imageoverlays"":[],""kml"":[],""gkml"":[],""fusiontables"":[],""searchmarkers"":"""",""enablefullscreen"":false,""locations"":[{""text"":""\u003Cb\u003E\u003Cdiv class=\""mw-parser-output\""\u003E\u003C/div\u003E\u003C/b\u003E\u003Chr /\u003E\u003Cdiv class=\""mw-parser-output\""\u003E\u003C/div\u003E"",""title"":"""",""link"":"""",""lat"":10.302279,""lon"":-63.331569 2,""icon"":""""}]} Project Details Parent: Petroleos de Venezuela SA (PDVSA), Royal Dutch/Shell, ExxonMobil Corp., and Mitsubishi Corp. Location: northeastern Venezuela
Note: mtpa = million tonnes per year; bcfd = billion cubic feet per day Background
In April of 2000, Venezuela's LNG export project was announced in a scaled-down version. Petroleos de Venezuela SA (PDVSA), Royal Dutch/Shell, ExxonMobil Corp., and Mitsubishi Corp. signed a memorandum of understanding to develop a $2 billion LNG project in northeastern Venezuela. The project will be known as Project Venezuela Liquefied Natural Gas (PVLNG) and will have a production capacity of about 4 million tonnes/ year.The venture is a downsized version of the so-called Cristobal Colon project, which involved the same four partners (but just Exxon Corp. prior to its acquisition of Mobil Corp.). That project called for an investment of more than $5 billion. [2] Articles and resources"
Venezuela Offshore LNG Terminal,www.sourcewatch.org,Lydiaplante,04-03-2019,2019,4,https://www.sourcewatch.org/index.php?title=Venezuela_Offshore_LNG_Terminal&diff=747540&oldid=0,"Difference between revisions of ""Venezuela Offshore LNG Terminal"" From SourceWatch (Created page with ""{{Navbar-FossilTracker}}'''Venezuela Offshore LNG Terminal''' is a proposed LNG terminal off the coast of Venezuela.<ref name= source1>[https://www.lngworldnews.com/rosneft-pd..."") (No difference) Latest revision as of 16:12, 3 April 2019 This article is part of the Global Fossil Infrastructure Tracker, a project of Global Energy Monitor and the Center for Media and Democracy . Sub-articles:
Venezuela Offshore LNG Terminal is a proposed LNG terminal off the coast of Venezuela. [1] Contents 4.4 External articles Location
The terminal will be located 2.5km offshore in the River Plate in the Punta Sayago area in western Montevideo. Loading map... {""minzoom"":false,""maxzoom"":false,""mappingservice"":""googlemaps3"",""type"":""ROADMAP"",""types"":[""ROADMAP"",""SATELLITE"",""HYBRID"",""TERRAIN""],""width"":""400px"",""height"":""300px"",""centre"":false,""title"":"""",""label"":"""",""icon"":"""",""visitedicon"":"""",""lines"":[],""polygons"":[],""circles"":[],""rectangles"":[],""wmsoverlay"":false,""copycoords"":false,""static"":false,""zoom"":7,""layers"":[],""controls"":[""pan"",""zoom"",""type"",""scale"",""streetview""],""zoomstyle"":""DEFAULT"",""typestyle"":""DEFAULT"",""autoinfowindows"":false,""resizable"":false,""kmlrezoom"":false,""poi"":true,""markercluster"":false,""clustergridsize"":60,""clustermaxzoom"":20,""clusterzoomonclick"":true,""clusteraveragecenter"":true,""clusterminsize"":2,""tilt"":0,""imageoverlays"":[],""kml"":[],""gkml"":[],""fusiontables"":[],""searchmarkers"":"""",""enablefullscreen"":false,""locations"":[{""text"":""\u003Cb\u003E\u003Cdiv class=\""mw-parser-output\""\u003E\u003C/div\u003E\u003C/b\u003E\u003Chr /\u003E\u003Cdiv class=\""mw-parser-output\""\u003E\u003C/div\u003E"",""title"":"""",""link"":"""",""lat"":10.784383 ,""lon"":-63.183185 ,""icon"":""""}]} Project Details Parent: Rosneft (50%), Petroleos de Venezuela SA (50%) Location: off the coast of Venezuela Coordinates: 10.784384, -63.183186 (approximate)
Note: mtpa = million tonnes per year; bcfd = billion cubic feet per day Background
A preliminary deal signed by Rosneft of Russia and Venezuelan PDVSA could lead to the development of an LNG export project. Under the recent heads of agreement for joint development of the offshore natural gas project in Venezuela, the two companies will establish a joint venture for implementation of the large-scale project for production, treatment and sale of natural gas at the offshore fields Patao, Mejillones and potentially Rio Caribe in Venezuela. Rosneft will be the operator of the joint venture with both companies holding a 50 percent stake. The agreement is the continuation of the memorandum the two companies signed in June of 2015 and will see the two companies performing the feasibility study of the project. It is expected that the production from the three fields could reach 25 million cubic meters per day providing the potential to develop an LNG export project in Venezuela. [1] Articles and resources References"
Chaozhou LNG Terminal,www.sourcewatch.org,James23,04-03-2019,2019,4,https://www.sourcewatch.org/index.php?title=Chaozhou_LNG_Terminal&diff=747539&oldid=727981,"Difference between revisions of ""Chaozhou LNG Terminal"" From SourceWatch }}'''Chaozhou LNG Terminal''' (华丰潮州LNG接收站) is a proposed LNG terminal in Guangdong, China. + }}'''Chaozhou LNG Terminal''' (华丰潮州LNG接收站) is a proposed LNG terminal in Guangdong, China. LNG terminals]][[Category: Fracking]][[Category: Major fossil projects]][[Category: Oil and gas infrastructure ]] [[Category: LNG terminals in China]] [[Category: LNG terminals in China]] − [[Category: Oil and gas infrastructure in China]] [[Category: Major fossil projects in China]] Latest revision as of 16:04, 3 April 2019 This article is part of the Global Fossil Infrastructure Tracker, a project of Global Energy Monitor and the Center for Media and Democracy . Sub-articles:"
Alabama ALEC Politicians,www.sourcewatch.org,Scott20,04-03-2019,2019,4,https://www.sourcewatch.org/index.php?title=Alabama_ALEC_Politicians&diff=747537&oldid=718547,"Difference between revisions of ""Alabama ALEC Politicians"" From SourceWatch (One intermediate revision by the same user not shown) Line 12: * Rep. Arnold Mooney (R-43)<ref name=""2018chairs""/> * Rep. Jim Carns (R-48) <ref name=""1995ALECSB"">American Legislative Exchange Council, ''Sourcebook'', annual organizational publication, 1995</ref> * Rep. Jim Carns (R-48) <ref name=""1995ALECSB"">American Legislative Exchange Council, ''Sourcebook'', annual organizational publication, 1995</ref> − * Rep. Terri Collins (R-8), [[ALEC State Chairmen|Alabama State Chair]]<ref name=""Decatur"">Mary Sell, [http://www.decaturdaily.com/news/local/article_53a8d0f6-b114-11e3-be30-0017a43b2370.html?_dc=17542409477.75543 Collins gets Alabama spot on conservative policy group], ''Decatur Daily'', March 21, 2014.</ref><ref name="" 2014chairs "">American Legislative Exchange Council, [http://www.alec.org/about-alec/state-chairmen/ State Chairs], organizational website, accessed March 25 </ref> + * Rep. Terri Collins (R-8), [[ALEC State Chairmen|Alabama State Chair]]<ref name=""Decatur"">Mary Sell, [http://www.decaturdaily.com/news/local/article_53a8d0f6-b114-11e3-be30-0017a43b2370.html?_dc=17542409477.75543 Collins gets Alabama spot on conservative policy group], ''Decatur Daily'', March 21, 2014.</ref><ref name="" 2018chairs "">American Legislative Exchange Council, [http://www.alec.org/about-alec/state-chairmen/ State Chairs], organizational website, accessed April 3 </ref> * Rep. Victor Gaston (R-100)<ref>Alabama House of Representatives, [http://www.legislature.state.al.us/house/representatives/housebios/hd100.html Representative Victor Gaston], government biography, accessed November 2, 2011</ref> * Rep. Victor Gaston (R-100)<ref>Alabama House of Representatives, [http://www.legislature.state.al.us/house/representatives/housebios/hd100.html Representative Victor Gaston], government biography, accessed November 2, 2011</ref> * Rep. Richard J. Lindsey (D-39) <ref name=""1995ALECSB""/> * Rep. Richard J. Lindsey (D-39) <ref name=""1995ALECSB""/> Line 21: ===Senate=== * Sen. Bill Hightower (R-35)<ref name=""Google_Letter"">American Legislative Exchange Council, [http://www.alec.org/wp-content/uploads/Letter-to-Google.pdf Letter to Google], organizational letter with legislative member signatories, September 24, 2014.</ref> * Sen. Bill Hightower (R-35)<ref name=""Google_Letter"">American Legislative Exchange Council, [http://www.alec.org/wp-content/uploads/Letter-to-Google.pdf Letter to Google], organizational letter with legislative member signatories, September 24, 2014.</ref> − * Sen. Greg Reed (R-5), [[ALEC State Chairmen|Alabama State Chair]]<ref name=""Decatur""/><ref name="" 2014chairs * Sen. Greg Reed (R-5), [[ALEC State Chairmen|Alabama State Chair]]<ref name=""Decatur""/><ref name="" 2018chairs ""/> * Sen. Jabo Waggoner (R-16)<ref>American Legislative Exchange Council, [http://alecwatch.org/members.PDF ALEC Leaders in the States], organizational site, archived by ""ALEC Watch"" in 2002, accessed November 2, 2011</ref> Majority Leader * Sen. Jabo Waggoner (R-16)<ref>American Legislative Exchange Council, [http://alecwatch.org/members.PDF ALEC Leaders in the States], organizational site, archived by ""ALEC Watch"" in 2002, accessed November 2, 2011</ref> Majority Leader * Sen. Cam Ward (R-14)<ref>Cam Ward, [http://www.camward.com/content/links%20 Links], politician's personal website, accessed November 2, 2011</ref> * Sen. Cam Ward (R-14)<ref>Cam Ward, [http://www.camward.com/content/links%20 Links], politician's personal website, accessed November 2, 2011</ref> Latest revision as of 16:02, 3 April 2019
Learn more about corporations VOTING to rewrite our laws. About ALEC ALEC is a corporate bill mill. It is not just a lobby or a front group; it is much more powerful than that. Through ALEC, corporations hand state legislators their wishlists to benefit their bottom line. Corporations fund almost all of ALEC's operations. They pay for a seat on ALEC task forces where corporate lobbyists and special interest reps vote with elected officials to approve “model” bills. Learn more at the Center for Media and Democracy's ALECexposed.org , and check out breaking news on our PRWatch.org site .
For a list of politicians with known ALEC ties, please see ALEC Politicians .
This is a partial list of Alabama politicians that are known to be involved in, or previously involved in, the American Legislative Exchange Council (ALEC). It is a partial list. (If you have additional names, please add them with a citation. The names in this original list were verified as of posting.)
Legislators who have cut ties with ALEC publicly are also listed here . Contents"
Project Venezuela Liquefied Natural Gas Terminal,www.sourcewatch.org,Lydiaplante,04-03-2019,2019,4,https://www.sourcewatch.org/index.php?title=Project_Venezuela_Liquefied_Natural_Gas_Terminal&diff=747535&oldid=0,"Difference between revisions of ""Project Venezuela Liquefied Natural Gas Terminal"" From SourceWatch (No difference) Revision as of 16:01, 3 April 2019 This article is part of the Global Fossil Infrastructure Tracker, a project of Global Energy Monitor and the Center for Media and Democracy . Sub-articles:
Project Venezuela Liquefied Natural Gas Terminal also known as the Cristobal Colon project or the PVLNG project, is a proposed LNG terminal in Venezuela. It is presumed shelved, with no updates reported since 2000. [1] Contents Location Loading map... {""minzoom"":false,""maxzoom"":false,""mappingservice"":""googlemaps3"",""type"":""ROADMAP"",""types"":[""ROADMAP"",""SATELLITE"",""HYBRID"",""TERRAIN""],""width"":""400px"",""height"":""300px"",""centre"":false,""title"":"""",""label"":"""",""icon"":"""",""visitedicon"":"""",""lines"":[],""polygons"":[],""circles"":[],""rectangles"":[],""wmsoverlay"":false,""copycoords"":false,""static"":false,""zoom"":7,""layers"":[],""controls"":[""pan"",""zoom"",""type"",""scale"",""streetview""],""zoomstyle"":""DEFAULT"",""typestyle"":""DEFAULT"",""autoinfowindows"":false,""resizable"":false,""kmlrezoom"":false,""poi"":true,""markercluster"":false,""clustergridsize"":60,""clustermaxzoom"":20,""clusterzoomonclick"":true,""clusteraveragecenter"":true,""clusterminsize"":2,""tilt"":0,""imageoverlays"":[],""kml"":[],""gkml"":[],""fusiontables"":[],""searchmarkers"":"""",""enablefullscreen"":false,""locations"":[{""text"":""\u003Cb\u003E\u003Cdiv class=\""mw-parser-output\""\u003E\u003C/div\u003E\u003C/b\u003E\u003Chr /\u003E\u003Cdiv class=\""mw-parser-output\""\u003E\u003C/div\u003E"",""title"":"""",""link"":"""",""lat"":10.715873 ,""lon"":-70.946804,""icon"":""""}]} Project Details Parent: Petroleos de Venezuela SA (PDVSA), Royal Dutch/Shell, ExxonMobil Corp., and Mitsubishi Corp. Location: northeastern Venezuela
Note: mtpa = million tonnes per year; bcfd = billion cubic feet per day Background
In April of 2000, Venezuela's LNG export project was announced in a scaled-down version. Petroleos de Venezuela SA (PDVSA), Royal Dutch/Shell, ExxonMobil Corp., and Mitsubishi Corp. signed a memorandum of understanding to develop a $2 billion LNG project in northeastern Venezuela. The project will be known as Project Venezuela Liquefied Natural Gas (PVLNG) and will have a production capacity of about 4 million tonnes/ year.The venture is a downsized version of the so-called Cristobal Colon project, which involved the same four partners (but just Exxon Corp. prior to its acquisition of Mobil Corp.). That project called for an investment of more than $5 billion. [2] Articles and resources"
Summit FLNG Terminal,www.sourcewatch.org,James23,04-03-2019,2019,4,https://www.sourcewatch.org/index.php?title=Summit_FLNG_Terminal&diff=747534&oldid=747524,"Difference between revisions of ""Summit FLNG Terminal"" From SourceWatch [[Category: Global Fossil Infrastructure Tracker]] [[Category: Global Fossil Infrastructure Tracker]] − ]] Latest revision as of 16:00, 3 April 2019 This article is part of the Global Fossil Infrastructure Tracker, a project of Global Energy Monitor and the Center for Media and Democracy . Sub-articles:
Summit FLNG Terminal is a proposed LNG terminal in Chittagong, Bangladesh. Contents Location Loading map... {""minzoom"":false,""maxzoom"":false,""mappingservice"":""googlemaps3"",""type"":""ROADMAP"",""types"":[""ROADMAP"",""SATELLITE"",""HYBRID"",""TERRAIN""],""width"":""400px"",""height"":""300px"",""centre"":false,""title"":"""",""label"":"""",""icon"":"""",""visitedicon"":"""",""lines"":[],""polygons"":[],""circles"":[],""rectangles"":[],""wmsoverlay"":false,""copycoords"":false,""static"":false,""zoom"":7,""layers"":[],""controls"":[""pan"",""zoom"",""type"",""scale"",""streetview""],""zoomstyle"":""DEFAULT"",""typestyle"":""DEFAULT"",""autoinfowindows"":false,""resizable"":false,""kmlrezoom"":false,""poi"":true,""markercluster"":false,""clustergridsize"":60,""clustermaxzoom"":20,""clusterzoomonclick"":true,""clusteraveragecenter"":true,""clusterminsize"":2,""tilt"":0,""imageoverlays"":[],""kml"":[],""gkml"":[],""fusiontables"":[],""searchmarkers"":"""",""enablefullscreen"":false,""locations"":[{""text"":""\u003Cb\u003E\u003Cdiv class=\""mw-parser-output\""\u003E\u003C/div\u003E\u003C/b\u003E\u003Chr /\u003E\u003Cdiv class=\""mw-parser-output\""\u003E\u003C/div\u003E"",""title"":"""",""link"":"""",""lat"":21.55 1,""lon"":91.95 3,""icon"":""""}]} Project Details Owner: Summit LNG Terminal Company Parent: Summit Group Location: Moheshkhali Island, Bay of Bengal, Cox's Bazar, Chittagong, Bangladesh Coordinates: 21.55, 91.95 (approximate) Capacity: 3.5 mtpa, 0.5 bcfd Status: Construction
Note: mtpa = million tonnes per year; bcfd = billion cubic feet per day Background
In January 2017 Summit Group signed an initial contract with Petrobangla to set up a liquefied natural gas terminal on Moheshkhali Island in Cox's Bazar, at a cost of about US$500 million. It would have capacity of 3.5 mtpa. Summit said it will develop the floating facilities in 18 months after signing the final contract. [1] [2]
In January 2019 Summit announced that it expected the terminal to begin operations in March 2019. [3] Articles and resources"
Moheshkhali FLNG Terminal (Excelerate),www.sourcewatch.org,James23,04-03-2019,2019,4,https://www.sourcewatch.org/index.php?title=Moheshkhali_FLNG_Terminal_(Excelerate)&diff=747533&oldid=747523,"Note: mtpa = million tonnes per year; bcfd = billion cubic feet per day Background
Moheshkhali Floating LNG Terminal is a proposed floating LNG terminal in Moheshkhali Island, Bangladesh. [1]
On July 18, 2016 Petrobangla signed a deal with Texas-based Excelerate Energy for construction of Bangladesh's first LNG terminal - a FSRU (floating, storage and re-gasification unit) - at Moheshkhali island in the Bay of Bengal. As of 2017 Excelerate is working on building the terminal, which will have handling capacity of up to 5 million tonnes per annum. [2]
Excelerate Energy expects to receive first LNG in 2018. [3]
In August 2018 the terminal entered commercial operation, becoming Bangladesh's first LNG import terminal. [4] Articles and resources"
Kutubdia LNG Terrminal (Petronet),www.sourcewatch.org,James23,04-03-2019,2019,4,https://www.sourcewatch.org/index.php?title=Kutubdia_LNG_Terrminal_(Petronet)&diff=747530&oldid=747520,"Note: mtpa = million tonnes per year; bcfd = billion cubic feet per day Background
Kutubdia LNG Terminal is a proposed LNG terminal in Chittagong, Bangladesh. [1]
In December 2016, Bangladesh government-owned Petrobangla signed an initial agreement with India government-owned Petronet to set up an LNG re-gasification terminal on Kutubdia island and a pipeline. The estimated cost is US$950 million. [2] [3]
Kutubdia LNG includes proposals to import LNG by barge and truck to off-grid customers in Bangladesh. [4]
In November 2018 the project was cancelled due to insufficient demand. [5] Articles and resources"
Matarbari LNG Terminal,www.sourcewatch.org,James23,04-03-2019,2019,4,https://www.sourcewatch.org/index.php?title=Matarbari_LNG_Terminal&diff=747532&oldid=747522,"Difference between revisions of ""Matarbari LNG Terminal"" From SourceWatch [[Category: Global Fossil Infrastructure Tracker]] [[Category: Global Fossil Infrastructure Tracker]] − ]] Latest revision as of 16:00, 3 April 2019 This article is part of the Global Fossil Infrastructure Tracker, a project of Global Energy Monitor and the Center for Media and Democracy . Sub-articles:
Matarbari LNG Terminal is a proposed LNG terminal in Matarbari, Cox's Bazar, Chittagong, Bangladesh. Contents Location Loading map... {""minzoom"":false,""maxzoom"":false,""mappingservice"":""googlemaps3"",""type"":""ROADMAP"",""types"":[""ROADMAP"",""SATELLITE"",""HYBRID"",""TERRAIN""],""width"":""400px"",""height"":""300px"",""centre"":false,""title"":"""",""label"":"""",""icon"":"""",""visitedicon"":"""",""lines"":[],""polygons"":[],""circles"":[],""rectangles"":[],""wmsoverlay"":false,""copycoords"":false,""static"":false,""zoom"":9,""layers"":[],""controls"":[""pan"",""zoom"",""type"",""scale"",""streetview""],""zoomstyle"":""DEFAULT"",""typestyle"":""DEFAULT"",""autoinfowindows"":false,""resizable"":false,""kmlrezoom"":false,""poi"":true,""markercluster"":false,""clustergridsize"":60,""clustermaxzoom"":20,""clusterzoomonclick"":true,""clusteraveragecenter"":true,""clusterminsize"":2,""tilt"":0,""imageoverlays"":[],""kml"":[],""gkml"":[],""fusiontables"":[],""searchmarkers"":"""",""enablefullscreen"":false,""locations"":[{""text"":""\u003Cb\u003E\u003Cdiv class=\""mw-parser-output\""\u003E\u003C/div\u003E\u003C/b\u003E\u003Chr /\u003E\u003Cdiv class=\""mw-parser-output\""\u003E\u003C/div\u003E"",""title"":"""",""link"":"""",""lat"":21.7271477,""lon"":91.8797371,""icon"":""""}]} Project Details Owner: Rupantarita Prakritik Gas Co Parent: Petrobangla Location: Matarbari, Cox's Bazar, Chittagong, Bangladesh Coordinates: 21.7271477, 91.8797371 (approximate)
Note: mtpa = million tonnes per year; bcfd = billion cubic feet per day Background
In January 2019 the Petrobangla subsidiary Rupantarita Prakritik Gas Co requested interest from potential terminal developers for a land-based LNG regasification terminal at Matarbari in the Cox’s Bazar district of southern Bangladesh. [1] In March 2019 the deadline for tendering bids for the project was extended by three months. [2] Articles and resources"
Kutubdia LNG Terminal (Reliance),www.sourcewatch.org,James23,04-03-2019,2019,4,https://www.sourcewatch.org/index.php?title=Kutubdia_LNG_Terminal_(Reliance)&diff=747531&oldid=747521,"Note: mtpa = million tonnes per year; bcfd = billion cubic feet per day Background
In December 2016 the Bangladesh government said it was set to announce the selection of India-based Reliance Power Ltd. to build a 500,000 Mcf/d floating storage and regasification unit and a 750 MW combined cycle power plant. [1]
In May 2017 Bangladesh approved Reliance Power's plan to build the gas plant, which will run on 110,000 Mcf/d of regasified imported LNG. Reliance Power is also engaged in a final round of negotiations on whether it will build a new floating, storage and regasification unit for LNG imports for the plant near Moheshkhali Island, or whether Petrobangla will supply regasified imported LNG via pipeline to the proposed power plant. [2]
In April 2017 it was reported that Reliance had signed an MoU with PetroBangla for setting up a 500-mmscfd LNG terminal at Kutubdia Island near Chittagong in Bangladesh. [3]
In September 2018 Bangladesh terminated talks with Reliance Power and cancelled the project due to insufficient demand. [4] Articles and resources"
