Florida mayor draws scrutiny after proposing 'Confederate Memorial Day',politomix.com,Rachel Frazin,04-06-2019,2019,4,https://politomix.com/the-hill/1498502/florida-mayor-draws-scrutiny-after-proposing-confederate-memorial-day/,"Florida mayor draws scrutiny after proposing 'Confederate Memorial Day' By Rachel Frazin Apr 6, 2019, 12:30 pm 19 pts A central Florida mayor has come under fire after he proposed a ""Confederate Memorial Day"" celebration later this month.Ocala Mayor Kent Guinn on Tuesday signed a proclamation making April 26 ""a time in which to ho..."
Former GOP Arizona State Rep: 'I Don't Like To Demonize' Child Sex Trafficking,politomix.com,Heather,04-06-2019,2019,4,https://politomix.com/crooks-and-liars/1498501/former-gop-arizona-state-rep-i-dont-like-to-demonize-child-sex-trafficking/,"Former GOP Arizona State Rep: 'I Don't Like To Demonize' Child Sex Trafficking By Heather Apr 6, 2019, 12:30 pm 20 pts Law enforcement should be investigating this man, not just the Arizona House of Representatives ethics committee. This report from AZ Central is beyond disturbing: David Stringer on child sex trafficking, 'I don't like to demonize it' Former Arizona Rep. David Stringer made disturbing comments about…"
Amal Clooney named UK media freedom envoy,www.urdupoint.com,,04-05-2019,2019,4,https://www.urdupoint.com/en/miscellaneous/amal-clooney-named-uk-media-freedom-envoy-587108.html,"Amal Clooney Named UK Media Freedom Envoy Mohammad Ali (@ChaudhryMAli88) 23 hours ago Fri 05th April 2019 | 09:00 PM
Dinard, France, April 5 (UrduPoint / Pakistan Point News - 5th Apr, 2019 ) :Prominent human rights lawyer Amal Clooney said it had ""never been more dangerous to report the news"" on Friday as she was appointed special envoy for media freedom by the British government .
Clooney has been tasked with heading a new panel of legal experts who will advise the British government on how to encourage other countries to promote transparency and protect media workers.
""We are here because it's never been more dangerous to report the news ,"" Clooney told a press conference on the sidelines of a G7 foreign ministers meeting in Dinard, northern France .
""According to the Committee for the Protection of Journalists, in the last five years, we've seen the highest number of journalists imprisoned since their records began over three decades ago,"" she added.
Clooney said her legal panel could propose reforms to repressive laws in countries and she raised the idea of sanctions that could be used on regimes ""that have abused journalists."" Her experience defending journalists in countries such a Egypt and Myanmar ""has shown me how easily vague laws and corrupt courts can be used to silence dissent and muzzle the media .""In December last year, Clooney blasted US President Donald Trump for giving a ""green light"" to regimes to persecute journalists through his anti-press rhetoric.
British Foreign Secretary Jeremy Hunt said Friday that ""democratic countries need to stand together to make it an international taboo of the highest order to order the arrest or detain journalists for doing their job ."""
Former South Carolina Senator Ernest 'Fritz' Hollings dies at 97,politomix.com,Reuters,04-06-2019,2019,4,https://politomix.com/reuters/1498503/former-south-carolina-senator-ernest-fritz-hollings-dies-at-97/,"Former South Carolina Senator Ernest 'Fritz' Hollings dies at 97 By Reuters Apr 6, 2019, 12:26 pm 23 pts Ernest ""Fritz"" Hollings, a sharp-tongued moderate Democrat with a booming voice and deep Southern drawl who advocated fiscal discipline in Washington during 38 years representing South Carolina in the U.S. Senate, died on Saturday at age 97."
Trump: Mueller Report Release 'Up to the Attorney General',politomix.com,Breitbart,04-06-2019,2019,4,https://politomix.com/breitbart/1498488/trump-mueller-report-release-up-to-the-attorney-general/,"Trump: Mueller Report Release 'Up to the Attorney General' By Breitbart Apr 6, 2019, 12:26 pm 24 pts During an interview broadcast on Saturday’s edition of the Fox News Channel’s “Fox & Friends,” President Trump stated that the release of the Mueller report is “up to the attorney general, whatever he wants to do.” Trump said, “[I]t’s really"
Top Afghan cricket players criticise change of captain,www.urdupoint.com,,04-05-2019,2019,4,https://www.urdupoint.com/en/miscellaneous/top-afghan-cricket-players-criticise-change-o-587107.html,"Top Afghan Cricket Players Criticise Change Of Captain Fahad Shabbir (@FahadShabbir) 23 hours ago Fri 05th April 2019 | 09:00 PM
Islamabad, April 5 (UrduPoint / Pakistan Point News - 5th Apr, 2019 ) : Afghanistan has named a new captain to lead the cricket team into the forthcoming World Cup -- a move that has not gone down well with some of the players.
The Afghanistan Cricket Board announced Gulbadin Naib would skipper the one-day side, Rashid Khan the Twenty20 team and Rahmat Shah the Test squad.
Naib replaces Asghar Afghan , and board chairman Azizullah Fazli said the changes were a ""long time investment and to compete in a better way"".
But less than two months before the start of the World Cup in England and Wales , the move was criticized on social media by some players.
Former captain Mohammad Nabi tweeted the decision was ""ill timed with World Cup just round the corner"", saying the team had ""gelled really well under Asghar"".
""Being a senior member of the side and having seen the rise of Afghanistan Cricket , I don't think it is the right time to change the captain,"" said Nabi, who led Afghanistan in their first World Cup campaign four years ago.
Rashid Khan, the new Twenty20 skipper also sounded off.
""With all the respect to the Selection Committee, I strongly disagree with the decision as it is irresponsible & bias,"" he tweeted.
""As we have @cricketworldcup in front of us, Captain #MAsgharAfghan should remain as our team Captain."" Afghanistan plays Australia in their opening match of the World Cup in Bristol on June 1.
They are regarded as dark horses having beaten both Sri Lanka and Bangladesh in the Asia Cup last year, as well as forcing a tie with eventual champions India . Facebook Twitter Google + Related Topics"
Trump to speak at Republican Jewish Coalition event in Las Vegas,politomix.com,CBS News,04-06-2019,2019,4,https://politomix.com/cbs-news/1498504/trump-to-speak-at-republican-jewish-coalition-event-in-las-vegas/,"Trump to speak at Republican Jewish Coalition event in Las Vegas By CBS News Apr 6, 2019, 12:24 pm 21 pts Trump's visit to Las Vegas comes after he toured a stretch of the border in California on Friday"
Kentucky lobbyists donate big to state political parties,politomix.com,"TOM LOFTUS, Courier Journal",04-06-2019,2019,4,https://politomix.com/washington-times/1498505/kentucky-lobbyists-donate-big-to-state-political-parties/,"Kentucky lobbyists donate big to state political parties By TOM LOFTUS, Courier Journal Apr 6, 2019, 12:20 pm 16 pts FRANKFORT, Ky. (AP) - State law forbids a lobbyist from giving to the campaigns of candidates for the Kentucky General Assembly. That way, lobbyists, whose job is to influence lawmaker decisions, can't sweeten things with a political donation. But lobbyists can give - and they give a lot - to ..."
Barack Obama warns progressives to avoid 'circular firing squad',politomix.com,Martin Pengelly,04-06-2019,2019,4,https://politomix.com/the-guardian/1498489/barack-obama-warns-progressives-to-avoid-circular-firing-squad/,"Barack Obama warns progressives to avoid 'circular firing squad' By Martin Pengelly Apr 6, 2019, 12:20 pm 25 pts Remarks come as Democrats battle for 2020 nomination Former president was addressing young Europeans in Germany Barack Obama warned on Saturday that US progressives risk creating a “circular firing squad” at a time when prospective presidential candidates are competing fiercely against each…"
Trump says he hasn’t read Mueller report but knows it fully clears him.,slate.com,Daniel Politi,04-06-2019,2019,4,https://slate.com/news-and-politics/2019/04/trump-hasnt-read-mueller-report.html,"In Speech to Republican Jews, Trump Refers to Netanyahu as “Your Prime Minister” President Trump was rage tweeting Saturday morning, going on a bit of a tweetstorm against special counsel Robert Mueller’s investigation and Democrats for insisting on seeing the full report of the probe. Trump started by acknowledging that he had not read the full Mueller report “yet” even though he has “ every right to do so .” He only knows there’s “no collusion” and that “our great A.G. … found No Obstruction.” The president went on to characterize Mueller’s team as a group of “Trump hating Dems” who were “given two years and $30 million, and they found No Collusion, No Obstruction.” Even so, “ the Democrats, no matter what we give them, will NEVER be satisfied .” I have not read the Mueller Report yet, even though I have every right to do so. Only know the conclusions, and on the big one, No Collusion. Likewise, recommendations made to our great A.G. who found No Obstruction. 13 Angry Trump hating Dems (later brought to 18) given two — Donald J. Trump (@realDonaldTrump) April 6, 2019 years and $30 million, and they found No Collusion, No Obstruction. But the Democrats, no matter what we give them, will NEVER be satisfied. A total waste of time. As @FrankLuntz has just stated, “Enough, America has had enough. What have you accomplished. Public is fed up.” — Donald J. Trump (@realDonaldTrump) April 6, 2019 Democrats in Congress have been trying to get a resolution passed that would declare the contents of the Mueller report to be of “overwhelming public interest.” But Republicans have blocked the resolution, which already passed the House of Representatives, five times . Yet as part of his tweetstorm Saturday, Trump sent a clear message that the whole endeavor was pointless because the investigation’s conclusions are already clear. Rather than seek to see the report, he wants to change the focus to take action and make sure another president doesn’t have to endure the same kind of investigation. “So the 13 Angry Democrats were investigating an event that never happened and that was in fact a made up Fraud,” Trump wrote . He then added : “This Russia Hoax must never happen to another President, and Law Enforcement must find out, HOW DID IT START? So, let’s get this straight! There was No Collusion and in fact the Phony Dossier was a Con Job that was paid for by Crooked Hillary and the DNC. So the 13 Angry Democrats were investigating an event that never happened and that was in fact a made up Fraud. I just fought back.... — Donald J. Trump (@realDonaldTrump) April 6, 2019 .... against something I knew never existed, Collusion with Russia (so ridiculous!) - No Obstruction. This Russia Hoax must never happen to another President, and Law Enforcement must find out, HOW DID IT START? — Donald J. Trump (@realDonaldTrump) April 6, 2019 Support our journalism
Help us continue covering the news and issues important to you—and get ad-free podcasts and bonus segments, members-only content, and other great benefits."
Who is Libyan National Army leader Khalifa Hifter?,politomix.com,Washington Post,04-06-2019,2019,4,https://politomix.com/washington-post/1498506/who-is-libyan-national-army-leader-khalifa-hifter/,"Who is Libyan National Army leader Khalifa Hifter? By Washington Post Apr 6, 2019, 12:19 pm 18 pts Once a commander in Moammar Gaddafi’s military, he joined the opposition and lived in exile in Virginia. Now he is moving his militia against the U.N.-backed government."
Shell hit with Dutch climate lawsuit,www.urdupoint.com,,04-05-2019,2019,4,https://www.urdupoint.com/en/miscellaneous/shell-hit-with-dutch-climate-lawsuit-587106.html,"Shell Hit With Dutch Climate Lawsuit Faizan Hashmi 23 hours ago Fri 05th April 2019 | 09:00 PM
The Hague, April 5 (UrduPoint / Pakistan Point News - 5th Apr, 2019 ) :Climate campaigners marched to Shell's headquarters in the Netherlands on Friday and handed the oil giant a lawsuit aimed at forcing it to meet targets in the Paris accord.
Dozens of chanting activists went to the Anglo-Dutch firm's base in The Hague , where they delivered a legal summons with a court date set for April 17.
""This is a unique case,"" Roger Cox, lawyer for Dutch climate group Milieudefensie, told AFP ""We are taking Shell to court because it's not keeping to the aims of the Paris climate agreements. This way we are trying to prevent huge damage."" The environmental groups say some 17,200 people have registered as co-complainants in the case, which Cox said would be the first of its kind.
Other groups involved in the case include ActionAid Netherlands , Both Ends, Fossielvrij NL, Greenpeace NL and Young Friends of the Earth NL.
In a summary of the 250-page document handed over to Shell, the groups said that under Dutch law Shell was unlawfully endangering peoples' lives by not acting to prevent global warming.
""Internal and external documents show that Shell has known about climate change at least since the 1950s and has been aware of its large-scale and serious consequences at least since 1986,"" it said.
""Although Shell knew, it has not taken any serious steps to minimise its share in climate change,"" the document added.
- 'Expose Shell' - Cox said that unlike previous cases which sought financial compensation for the effects of climate change, this one involves asking the judge to order Shell to ensure its activities have zero percent carbon dioxide emissions by 2050.
Shell is responsible for 1.7 percent of all greenhouse gas emissions between 1988-2015, according to a peer-reviewed study of the 100 most polluting companies released two years ago.
It is also among five oil and gas majors that have spent more than $1 billion on lobbying against climate legislation since the Paris deal.
Shell's plans for tackling climate change are ""not consistent with the Paris goals"", said Harjeet Singh, who heads up global climate activities at ActionAid.
""We need to expose Shell on this and in fact what it has been doing all this while is hiding and distorting facts and lobbying against climate policy,"" Singh told AFP.
Climate change is a pressing issue in the Netherlands , where at least a third of the country lies below sea level.
The Dutch government was ordered by a court last year to slash greenhouse gases by at least 25 percent by 2020 , following a legal challenge by another environmental group.
Thousands of Dutch students have rallied in Amsterdam and The Hague in recent weeks, urging the government to take action, with Dutch Prime Minister Mark Rutte meeting the group's leaders."
Donald Trump Drops ICE Nominee: 'We're Going in a Tougher Direction',politomix.com,Breitbart,04-06-2019,2019,4,https://politomix.com/breitbart/1498490/donald-trump-drops-ice-nominee-were-going-in-a-tougher-direction/,"Donald Trump Drops ICE Nominee: 'We're Going in a Tougher Direction' By Breitbart Apr 6, 2019, 12:14 pm 25 pts The border agencies need tougher leadership, President Donald Trump declared Friday as he dropped plans to appoint a long-time agency staffer to run the Immigration and Customs Enforcement agency (ICE)."
Big Dem names show little interest in Senate,politomix.com,Reid Wilson,04-06-2019,2019,4,https://politomix.com/the-hill/1498480/big-dem-names-show-little-interest-in-senate/,"Big Dem names show little interest in Senate By Reid Wilson Apr 6, 2019, 12:10 pm 29 pts Democrats have plenty of big names who could help them retake the Senate, but most of them aren't interested in running."
Azerbaijani Foreign Minister Says May Meet With Armenian Counterpart in Moscow Soon,www.urdupoint.com,,04-05-2019,2019,4,https://www.urdupoint.com/en/world/azerbaijani-foreign-minister-says-may-meet-wi-587105.html,"Azerbaijani Foreign Minister Says May Meet With Armenian Counterpart In Moscow Soon Sumaira FH 20 hours ago Fri 05th April 2019 | 09:00 PM
MOSCOW (UrduPoint News / Sputnik - 05th April, 2019) Azerbaijani Foreign Minister Elmar Mammadyarov said Friday that a meeting with his Armenian counterpart, Zohrab Mnatsakanyan, might be held in Moscow soon.
Mammadyarov and Russian Foreign Minister Sergey Lavrov met in Moscow earlier on Friday. The Azerbaijani foreign minister arrived in Russia to attend the Commonwealth of Independent States' (CIS) Foreign Ministers Council session.
""Our meeting with Sergey Viktorovich [Lavrov] was wonderful, as always. We discussed not only bilateral relations, but also conflict resolution . I think that in the very near future, we have already agreed that a meeting of the foreign ministers and the co-chairs of the OSCE Minsk Group will be announced. I think that Sergey Viktorovich will also participate,"" Mammadyarov said and noted that the next meeting on the Nagorno-Karabakh problem would ""most likely"" be held in Moscow .
Nagorno-Karabakh, a landlocked region in the South Caucasus with a predominantly Armenian population, proclaimed independence in 1991, which was followed by a bloody three-year war between Armenia and Azerbaijan . The region is officially viewed as an Azerbaijani territory. The pressure in the area continues, resulting in occasional violence. The latest escalation of tensions in the region happened in April 2016 .
The Organization for Security and Co-operation in Europe (OSCE) Minsk Group, which is co-chaired by Russia , the United States and France , was created back in 1992 to find a peaceful solution to the conflict in Nagorno-Karabakh.
In late March , Azerbaijani President Ilham Aliyev held his first official meeting with Armenian Prime Minister Nikol Pashinyan in the Austrian capital of Vienna to discuss the situation in Nagorno-Karabakh. Both sides commended the talks."
Sexual harassment complaints against Philadelphia cop show hurdles in holding police accountable,politomix.com,Casey Quinlan,04-06-2019,2019,4,https://politomix.com/thinkprogress/1498481/sexual-harassment-complaints-against-philadelphia-cop-show-hurdles-in-holding-police-accountable/,"Sexual harassment complaints against Philadelphia cop show hurdles in holding police accountable By Casey Quinlan Apr 6, 2019, 12:06 pm 24 pts A Philadelphia commander was recently tasked with oversight over the police department’s Special Victims Unit, despite a history of sexual harassment allegations against him. Five people have accused Inspector Anthony Washington of sexually harassing them, according to the Philadelphia Inquirer,…"
"Marshal Haftar Meets With UN Chief Guterres, Vows to Fight Until Tripoli Liberated",www.urdupoint.com,,04-05-2019,2019,4,https://www.urdupoint.com/en/world/marshal-haftar-meets-with-un-chief-guterres-587103.html,"Marshal Haftar Meets With UN Chief Guterres, Vows To Fight Until Tripoli Liberated Mohammad Ali (@ChaudhryMAli88) 23 hours ago Fri 05th April 2019 | 09:00 PM
CAIRO (UrduPoint News / Sputnik - 05th April, 2019) Commander of the Libyan National Army (LNA), Field Marshal Khalifa Haftar, told UN Secretary General Antonio Guterres on Friday that he would continue fighting against the militants controlling Tripoli until the full liberation of the city, the LNA reported.
Earlier in the day, UN Secretary-General Antonio Guterres and UN Special Representative for Libya Ghassan Salame arrived at Haftar's headquarters in the city of Ar Rajma, located in the east of Libya .
""The commander-in-chief, Marshal Khalifa Haftar, told UN Secretary-General Antonio Guterres that he would continue fighting until he freed Tripoli from militant groups that the city's residents are fed up with,"" the LNA said in a statement.
As a result of years-long civil conflict, there is no single central government in Libya , and the country's eastern and western parts are controlled by separate powers. The Tobruk-based parliament , elected in 2014 and backed by the LNA, governs the east of Libya , while the UN-supported interim Government of National Accord (GNA) controls Libya 's western parts from Tripoli .
On Thursday, Haftar ordered his troops to launch an offensive on Tripoli ."
