Watch Pete Buttigieg ask a question during Harball College tour in 2003,www.msnbc.com,msnbc.com,06-04-2019,2019,6,http://www.msnbc.com/hardball/watch/watch-pete-buttigieg-ask-a-question-during-harball-college-tour-in-2003-61200965743,"This isn’t Pete Buttigieg’s first time on Hardball. Back in 2003, Buttigieg asked Congressman Dick Gephardt a question during a Hardball College Tour event at Harvard. June 3, 2019"
Buttigieg agrees with establishing commission to study reparations: We are living in racist systems,www.msnbc.com,msnbc.com,06-04-2019,2019,6,http://www.msnbc.com/hardball/watch/buttigieg-agrees-with-establishing-commission-to-study-reparations-we-are-living-in-racist-systems-61207621732,"Mayor Pete Buttigieg answers a question in the Hardball Town Hall about whether he supports reparations. June 4, 2019"
Michael Wolff: ‘Trump is willing to destroy an institution’,www.msnbc.com,"June 4, 2019",06-04-2019,2019,6,https://www.msnbc.com/the-last-word/watch/michael-wolff-trump-is-willing-to-destroy-an-institution-61208645734,The Last Word Group delivers highlighted Mueller report to GOP Congress members 
"Buttigieg, Harris, and Biden hit Trump on the campaign trail",www.msnbc.com,msnbc.com,06-04-2019,2019,6,http://www.msnbc.com/11th-hour/watch/buttigieg-harris-and-biden-hit-trump-on-the-campaign-trail-61210693716,"The Democrats out on the 2020 campaign trail continued to make their cases and hit Trump while he left the country for a state visit to the United Kingdom. Rick Wilson and Laura Barrón-López talk about it all. June 4, 2019"
Migrant children face overcrowding at Border Patrol facilities,www.msnbc.com,msnbc.com,06-04-2019,2019,6,http://www.msnbc.com/morning-joe/watch/migrant-children-face-overcrowding-at-border-patrol-facilities-61233733654,"Migrant children are facing harsh conditions at the southern border as many shelters and border patrol facilities are reaching full capacity, forcing children to sleep on concrete benches or outside. June 4, 2019"
Trump discovers that Middle East peace isn't as easy as he thought | MSNBC,www.msnbc.com,Steve Benen,06-04-2019,2019,6,http://www.msnbc.com/rachel-maddow-show/trump-discovers-middle-east-peace-isnt-easy-he-thought,"By Steve Benen Just three months into his presidency, Donald Trump declared with confidence, “I want to see peace with Israel and the Palestinians. There is no reason there’s not peace between Israel and the Palestinians – none whatsoever.” As we discussed at the time, there are all kinds of things standing in the way of peace, though the president didn’t appear to recognize them.
He was, however, quite serious about the attitude. A month later, Trump boasted there’s a “very, very good chance” his administration would help strike a deal for Middle East peace. “It’s something, frankly, maybe not as difficult as people have thought over the years,” the president added.
As regular readers know , Trump assigned his young son-in-law, Jared Kushner, to oversee the White House’s efforts to reach an agreement between Palestinians and Israelis. Trump was certain he’d picked the right person for the job, saying of Kushner, “If you can’t produce peace in the Middle East, nobody can. OK. All my life I’ve been hearing that’s the toughest deal in the world to make. And I’ve seen it, but I have a feeling that Jared is going to do a great job.”
Yeah, about that …
Jared Kushner’s Middle East peace plan isn’t even out yet, but there are already intensifying calls to scrap the rollout – including from some Trump allies.
Prominent conservative and pro-Israel voices close to the White House are increasingly sharing their fears, which range from the possibility that the peace proposal could trigger violence to worries that its offerings could forever kill efforts to craft a two-state solution.
As the Politico report added, political turmoil and a fresh round of elections in Israel were likely to delay the White House’s gambit anyway, but some are nevertheless “going on the record to urge the Trump administration to set aside the plan indefinitely.”
Complicating matters, the Washington Post obtained a recording of Secretary of State Mike Pompeo speaking behind closed doors to a group of Jewish leaders last week, when the president’s chief diplomat “delivered a sobering assessment” of the plan’s prospects. Pompeo said “one might argue” that the blueprint is “unexecutable” and it might not “gain traction.”
Making matters slightly worse, the president suggested Pompeo may very well be right.
During a brief Q&A with reporters before leaving for the U.K., Trump was asked if he had any comment about Pompeo’s remarks. The secretary of State, the president replied , “may be right.”
As things stand, the White House, which has gone to great lengths to antagonize Palestinians, is expected to unveil its peace plan three weeks from today. While the details remain under wraps, multiple reports suggest Kushner’s blueprint is built on financial incentives for Palestinians, not a two-state solution.
As that plan starts to unravel – before its release – it’s worth pausing to question the wisdom of putting the process in the hands of a young presidential son-in-law with no experience in diplomacy or foreign policy, answering to a president with no interest in diplomacy or foreign policy.
Explore: The MaddowBlog , Diplomacy , Foreign Policy , Israel , Middle East , Palestine and White House"
'I cannot let this happen': Karine Jean-Pierre on blocking Sen. Harris,www.msnbc.com,msnbc.com,06-04-2019,2019,6,http://www.msnbc.com/morning-joe/watch/-i-cannot-let-this-happen-karine-jean-pierre-on-blocking-sen-harris-61230661805,"MoveOn's Karine Jean-Pierre discusses the moment when she blocked Sen. Kamala Harris from a male protester who jumped on the event stage Saturday at a San Francisco forum. June 4, 2019"
Joe: It is imperative to ignore Trump's ground noise,www.msnbc.com,msnbc.com,06-04-2019,2019,6,http://www.msnbc.com/morning-joe/watch/joe-it-is-imperative-to-ignore-trump-s-ground-noise-61231685626,"In his latest Washington Post column, Joe Scarborough encourages Americans when it comes to President Trump to 'Ignore the ground noise and search for the signal, instead.' June 4, 2019"
Watergate star witness to testify on Mueller report,www.msnbc.com,msnbc.com,06-04-2019,2019,6,http://www.msnbc.com/morning-joe/watch/watergate-star-witness-to-testify-on-mueller-report-61230149969,"The House Judiciary Committee will call Watergate star witness and former Nixon White House counsel John Dean to testify on the Mueller report. June 4, 2019"
Huge protests form as Trump meets with Theresa May,www.msnbc.com,msnbc.com,06-04-2019,2019,6,http://www.msnbc.com/morning-joe/watch/huge-protests-form-as-trump-meets-with-theresa-may-61230661563,"On the second day of his UK state visit, the president meets with departing British PM Theresa May at 10 Downing Street while protesters gather at Trafalgar Square and Parliament Square, where the Trump Baby blimp has been raised. June 4, 2019"
Joe remembers D-Day across the decades,www.msnbc.com,msnbc.com,06-04-2019,2019,6,http://www.msnbc.com/morning-joe/watch/joe-remembers-d-day-across-the-decades-61233733998,"This week in 1944, Allied forces in Europe launched the D-Day invasion, storming the beaches of Normandy in what became the final push to end the war. Joe Scarborough looks back at the history of D-Day. June 4, 2019"
"As House passes disaster-relief bill, Trump gets confused | MSNBC",www.msnbc.com,Steve Benen,06-04-2019,2019,6,http://www.msnbc.com/rachel-maddow-show/house-passes-disaster-relief-bill-trump-gets-confused,"By Steve Benen Congress’ disaster-relief package – traditionally the sort of thing that passed easily – was needlessly delayed for months. Donald Trump had some specific demands related to border funding and excluding aid for Puerto Rico ; Democrats balked; and so the bill languished.
Two weeks ago, however, the clouds parted. As regular readers know , Trump caved , clearing the way for final passage.
A small group of House Republicans managed to delay the bill for another week – it’s not at all clear why they bothered – but yesterday, the legislative process came to an end .
The House on Monday evening passed the Senate-approved $19 billion disaster aid measure that three conservative Republicans had taken turns blocking in separate votes over the past two weeks.
With the 354-58 vote, the bill will now be sent to President Donald Trump for his signature, which can be delivered via auto-pen while he’s on a state visit to the United Kingdom.
The final roll call is online here . Of the 58 members who voted against the relief package, all 58 were Republicans, though most of the GOP minority voted with Democrats.
Just minutes after the House vote, Donald Trump published a tweet that said , “House just passed the 19.1 Billion Dollar Disaster Aid Bill. Great, now we will get it done in the Senate!”
That’s not quite right.
As the president probably ought to know, after he retreated two weeks ago, the Senate took up the disaster-relief bill and passed it , 85 to 8.
The bill then went to the House, which passed the same measure yesterday afternoon, which means all it needs now is Trump’s signature.
The president deleted his confused tweet last night.
Explore: The MaddowBlog , Congress , Disaster Relief and Donald Trump"
Remember when Republicans were prepared to impeach Hillary Clinton? | MSNBC,www.msnbc.com,Steve Benen,06-04-2019,2019,6,http://www.msnbc.com/rachel-maddow-show/remember-when-republicans-were-prepared-impeach-hillary-clinton,"Presidential candidates Hillary Clinton and Donald Trump at the second presidential debate, Oct. 9, 2016. Photo by Mark Peterson/Redux for MSNBC Remember when Republicans were prepared to impeach Hillary Clinton? 06/04/19 09:20 AM  Updated 06/04/19 09:31 AM By Steve Benen On Nov. 8, 2016, Donald Trump unexpectedly won the U.S. presidential election. Just four days earlier, however, the Washington Post published this report on Republican plans to impeach Hillary Clinton, whom they expected to win.
Senior Republican lawmakers are openly discussing the prospect of impeaching Hillary Clinton should she win the presidency, a stark indication that partisan warfare over her tenure as secretary of state will not end on Election Day.
Chairmen of two congressional committees said in media interviews this week they believe Clinton committed impeachable offenses in setting up and using a private email server for official State Department business.
And a third senior Republican, the chairman of a House Judiciary subcommittee, told The Washington Post he is personally convinced Clinton should be impeached for influence peddling involving her family foundation.
The same morning that article ran, Rep. Michael McCaul (R-Texas), the then-chairman of the House Homeland Security Committee, told Fox News that he believed Hillary Clinton committed “ treason ” with her email protocols.
Two days before that, Senate House Homeland Security Committee Chairman Ron Johnson (R-Wis.) also suggested Clinton committed impeachable offenses. In reference to the Democrat’s email issues, the Wisconsin Republican said on Nov. 1, 2016, “I’m not a lawyer, but this is clearly written. I would say yes, high crime or misdemeanor.”
It was around this time that a National Review writer made the case that congressional Republicans should impeach Clinton before the election, while Rudy Giuliani reportedly “ guaranteed ” to an Iowa audience that Clinton, if elected, would be impeached within a year of taking office.
Less than a week later, Trump won, and the question of whether the Republican Congress would impeach Hillary Clinton or not became a moot point. But as the issue of presidential impeachment returns to the fore, it’s worth revisiting the standards GOP lawmakers set in the very recent past.
Three years ago, federal investigators examined Clinton’s email protocols and concluded that she broke no laws. Then-FBI Director James Comey concluded that the issue was not a close call .
“At the end of the day, the case itself was not a cliff-hanger; despite all the chest-beating by people no longer in government, there really wasn’t a prosecutable case,” Comey wrote in an internal memo.
In contrast, federal investigators examined Donald Trump’s alleged misconduct as part of the probe into the Russia scandal, and they uncovered evidence of, among other things, obstruction of justice.
The Republican’s allies are now feigning outrage at the very idea of presidential impeachment, but they espoused very different standards in the fall of 2016.
Explore: The MaddowBlog , Donald Trump , Hillary Clinton , Impeachment and Republicans As House passes disaster-relief bill,... Who voted for Rand Paul's radical budget... More Like This Best of MSNBC "
Jeh Johnson: I'm appalled by report of migrants held in vans,www.msnbc.com,msnbc.com,06-04-2019,2019,6,http://www.msnbc.com/morning-joe/watch/jeh-johnson-i-m-appalled-by-report-of-migrants-held-in-vans-61234757594,"Former DHS Secretary Jeh Johnson joins Morning Joe to discuss new NBC News reporting on migrant children stuck at border stations, sleeping on concrete, because of HHS overcrowding. June 4, 2019"
"During press conference with May, Trump says Brexit should and will happen",www.msnbc.com,msnbc.com,06-04-2019,2019,6,http://www.msnbc.com/hallie-jackson/watch/during-press-conference-with-may-trump-says-brexit-should-and-will-happen-61238341940,"At his press conference with British Prime Minister Theresa May, President Trump answered questions on Brexit, tariffs on Mexico, praised May's time on the job, and blasted London Mayor Sadiq Khan. June 4, 2019"
The issues Donald Trump turns to as 'his safety blanket' | MSNBC,www.msnbc.com,Steve Benen,06-04-2019,2019,6,http://www.msnbc.com/rachel-maddow-show/the-issues-donald-trump-turns-his-safety-blanket,"By Steve Benen According to Donald Trump’s plan , the United States will begin imposing a 5% tariff on all Mexican goods early next week. The only way for Mexico to avoid the tax penalty would be to satisfy unspecified White House demands about stemming the flow of immigration.
What’s more, according to the president, the tariff would climb incrementally, month by month, reaching a 25% tax on Oct. 1.
As is usually the case, many of those close to Trump told him not to do this . In fact, Treasury Secretary Steven Mnuchin, U.S. Trade Representative Robert E. Lighthizer, and White House senior advisor Jared Kushner all lobbied the president to choose a more responsible course. True to form, he ignored them .
It’s worth appreciating why. The Atlantic reported today on Trump’s “preferred method of relief in moments of crisis.”
In the days leading up to the tariff announcement, the news cycle was captivated by Special Counsel Robert Mueller’s first public remarks since he was appointed to his role more than two years ago…. Trump was clearly affected by the fallout. “How do you impeach a Republican President for a crime that was committed by the Democrats? WITCH-HUNT!” the president tweeted on Wednesday. […]
So while his tariff announcement was in many ways a surprise, it also had a tinge of inevitability. According to current and former aides, who requested anonymity to speak freely, when Trump feels he has lost control of the narrative, he grasps at two issues: border security and trade. Those aides said he sees these topics as reset buttons, ways to rile both Democratic and Republican lawmakers and draw attention away from whatever dumpster fire is blazing in a given week.
A senior campaign adviser told The Atlantic ’s Elaina Plott, “Whenever a negative story comes around, his instinct is to pivot to immigration or trade. It’s kind of like his safety blanket. He knows that Fox and conservative media will immediately coalesce and change what the base is talking about.”
The article added , “Aides say that the Mexico tariff decision and its developments to come represent a way for Trump to channel his anxieties and feel in control.”
Or put another way, the White House has no policy process. It instead has the whims of an erratic amateur who sees two major issues – neither of which he understands in any meaningful way – as a pacifier. Mexico is facing an economic threat, not because our neighbor deserves punishment, but because Robert Mueller, Democrats, and news organizations made the Republican feel bad.
Your government at work.
Whether Trump intends to follow through on his plan remains an open question. Many congressional Republicans believe the president is bluffing , hoping to see what he can get out of Mexico City. Trump himself said this morning that he’s “ likely ” to follow through on his idea, which was hardly categorical.
He’s made related threats before, only to back off before doing real harm.
Meanwhile, on Capitol Hill, the Washington Post reports today that GOP lawmakers are “discussing” how and whether to block the White House’s tariffs plan, raising the prospect of Republicans choosing a “dramatic act of defiance.”
Having been awake since January 2017, I’m skeptical of the possibility, but the fact that Trump’s party is sending these signals is emblematic of just how wrong they believe the president is.
In this case, they’re right. The president’s gambit may be “his safety blanket,” but this is a dreadfully misguided plan .
Explore: The MaddowBlog , Donald Trump , Immigration Policy and Trade"
Nadler echoes Mueller in Trump obstruction probe,www.msnbc.com,msnbc.com,06-04-2019,2019,6,http://www.msnbc.com/the-beat-with-ari/watch/nadler-echoes-mueller-in-trump-obstruction-probe-61275205649,"MSNBC Chief Legal correspondent Ari Melber analyzes Judiciary Chairman Nadler’s statement announcing new Mueller hearings on obstruction. Melber notes the upcoming hearings may just be for fact finding but he focuses in on Nadler referring to “constitutional remedies” that is “a diplomatic reference to impeachment” and reveals a parallel to language Mueller used in his resignation address. June 4, 2019"
George Will: Trump has nothing to do with conservatism,www.msnbc.com,"June 3, 2019",06-04-2019,2019,6,https://www.msnbc.com/morning-joe/watch/george-will-trump-has-nothing-to-do-with-conservatism-61132357950,The Beat with Ari Nadler echoes Mueller in Trump obstruction probe 
"Tuesday's Campaign Round-Up, 6.4.19 | MSNBC",www.msnbc.com,Steve Benen,06-04-2019,2019,6,http://www.msnbc.com/rachel-maddow-show/tuesdays-campaign-round-6419,"By Steve Benen Today’s installment of campaign-related news items from across the country.
* A new national CNN poll found former Vice President Joe Biden (D) leading Sen. Bernie Sanders (I-Vt.) in the race for the Democratic presidential nomination, 32% to 18%. That’s a smaller gap than in a CNN poll conducted last month around the time of Biden’s kickoff. Sen. Kamala Harris (D-Calif.) is third in the poll with 8%, followed by Sen. Elizabeth Warren (D-Mass.) with 7%.
* On a related note, Sen. Michael Bennet (D-Colo.) reached 1% in the CNN poll, which means he’s now qualified to participate in the first round of Democratic debates. It’s worth noting, however, that the DNC has capped the number of participants at 20 – and Bennet is the 20th. It raises the prospect of candidates qualifying for the events but not making it onto the stage.
* Biden’s campaign this morning unveiled the Delaware Democrat’s climate and energy plan , and it’s a bit more ambitious than expected. The blueprint calls for, among other things, net zero emissions by 2050, which is line with the IPCC’s plan.
* Speaking of Biden, the New York Times today takes a closer look at the Delaware Democrat’s 1988 presidential campaign, which was a bit of a train wreck.
* Elizabeth Warren, meanwhile, unveiled a $2 trillion climate plan today, which includes extensive investments in low-carbon technology and a “Green Marshall Plan” to assist developing nations poised to suffer as the climate crisis intensifies.
* Another presidential hopeful, Julián Castro, yesterday unveiled a plan to overhaul police use of deadly force and reduce wrongful shootings through federal law enforcement standards. As part of the proposal, the former HUD secretary intends to combat “racially discriminatory policing.”
* And in North Carolina, a state the president won by nearly four points in 2016, a new Emerson poll points to possible trouble for the Republican. In a hypothetical match-up, the poll found Trump trailing Biden by 12 points. The incumbent is also behind Sanders and Pete Buttigieg by 8 and 4 points, respectively. The same poll found him tied with Warren and narrowly leading Harris.
Explore: The MaddowBlog"
Watch Trump AG Barr contradict himself on Mueller,www.msnbc.com,"June 4, 2019",06-04-2019,2019,6,https://www.msnbc.com/the-beat-with-ari/watch/watch-trump-ag-barr-contradict-himself-on-mueller-61275717578,The Beat with Ari Nadler echoes Mueller in Trump obstruction probe 
"Fmr. Parkland cop charged with neglect of child, perjury and negligence",www.msnbc.com,msnbc.com,06-05-2019,2019,6,http://www.msnbc.com/ali-velshi/watch/fmr-parkland-cop-charged-with-neglect-of-child-perjury-and-negligence-61298245687,"Scot Peterson, the former sheriff’s deputy who’s accused of not doing enough to stop the 2018 Parkland shooting, faces 7 counts of neglect of a child, 3 counts of culpable negligence, and 1 count of perjury. NBC News’ Tom Winter reports. June 4, 2019"
"Tune in for ‘The Deciders: Dayton, Ohio’ on June 13",www.msnbc.com,msnbc.com,06-05-2019,2019,6,http://www.msnbc.com/hardball/watch/tune-in-for-the-deciders-dayton-ohio-on-june-13-61319237948,"Chris is on the road again, this time going to Dayton, Ohio to hear what people have to say about the issues that matter to them ahead of the 2020 presidential election. June 5, 2019"
Politico: Trump looks to expand reelection path beyond Rust Belt states,www.msnbc.com,msnbc.com,06-05-2019,2019,6,http://www.msnbc.com/hardball/watch/politico-trump-looks-to-expand-reelection-path-beyond-rust-belt-states-61320261799,"Politico reports that, “President Donald Trump is targeting a trio of states that he lost in 2016 — a move aimed at widening his path to reelection that comes as he’s struggling in the Rust Belt states that propelled him to the White House.” June 4, 2019"
Dems plan to win back industrial Midwest,www.msnbc.com,msnbc.com,06-05-2019,2019,6,http://www.msnbc.com/all-in/watch/dems-plan-to-win-back-industrial-midwest-61322309821,"Senator Sherrod Brown joins Chris Hayes to talk about how Democrats can win back the industrial midwest in 2020. June 5, 2019"
