Trump's infatuation: the Personality behind the WALL,lunaticoutpost.com,,04-03-2019,2019,4,http://lunaticoutpost.com/thread-119952.html,"Post: #1 Trump's infatuation: the Personality behind the WALL
Advertisement Trump's infatuation with the WALL and the Personality behind the WALL
We, all people in this time and in our journey have either become more interested or un-interested for the flood of propaganda that is never given clearly; to help all people better understand the ‘time’ in which we are, and prophetically for the full story to be heard.
There is an epidemic of confusion that creates further disorientation in the two time-lines like the two lanes in a highway for either direction, and we easily lose the trail that leads us to the origin of everything. In this report I stress how there is a difference between two objects and how the replacements of theology occurs when such a large book is replaced with a ‘smart phone’?
You must have access to the New Strong’s exhaustive concordance of the Bible to see it or are there ways for smart phone users to flip through the pages and your eye scroll the many columns of numbers in the Hebrew Lexicon while a finger holds a place elsewhere in the same book?
You must clear your mind of all preconceived ideas and knowledge of all things so to prevent a multitude of stumbling blocks, and put away your fears of what the Antichrist is, really? The smart phone is an object with a great role in life, and people’s lives may be ruined if all of the hand held phones suddenly where band like grounding all Boeing 737 Max8 passenger jet planes? The associations are too childish at the cost of the highest stakes, as if little children are given the freedom and positions to rule the world, and are the same as a baby doing what they will with a set of wooden baby blocks?
Okay, I’ll get to the punch because there isn’t time therefore; you do your homework and find such this book to see the same, as it was when there were books? The Antichrist isn’t obvious to the greater portion of people or perhaps, isn’t as horrible as thieves want you to believe? Let’s look at facts, and specifically the name, ‘JESUS’, and the number 2424 in the New Strong’s exhaustive concordance of the Bible and you will find number 846 is the only number that is found on page 730, and it points to John 7:50, and the story of a man named, Nicodemus.
The number, 846 specifies the Wall, which is the root of the spirit of the man named, Nicodemus, and this will help everyone better know that Nicodemus is a character that also repeats in history, and in prophecy. President Donald Trump is the Antichrist that stands in place of the real Christ while he is cast away; Trump is Nicodemus reincarnate if you please? There are many characters inside of the Trump image, and the image is Mosaic, and it changes like a kaleidoscope does as the world turns?
The story of Nicodemus is one that needs consideration when you must know who is running the world as one power, and yet there are the liars that say it’s something that is yet coming, and we better watch out because they want you to mistake God for Satan, and Satan for God? That’s too dramatic, and imposes on too many sensitive minds so then, just imagine Trump’s infatuation with a so called, WALL? (Trumpodemus?) Is Trump the last brick maker in America? Who is making bricks for Trump's WALL? Could it be his own form of a Pyramid?"
Secretary-General's remarks at Al Azhar mosque [as delivered],www.un.org,United Nations Office of the Spokesperson of the Secretary-General,04-02-2019,2019,4,https://www.un.org/sg/en/content/sg/statement/2019-04-02/secretary-generals-remarks-al-azhar-mosque-delivered,"Secretary-General's remarks at Al Azhar mosque [as delivered]
As salaam alaikum. I am honoured to address you in this esteemed seat of Islamic learning. Standing here, one cannot fail to feel the impressive weight of more than 1,000 years of history, culture, scholarship and worship. As Secretary-General of the UN, and as a man of faith, I have come to express my respect for Islam and my solidarity with its followers in these turbulent times. It is less than a month since a terrorist attack on two mosques in Christchurch, New Zealand, took the lives of 50 worshippers of all ages. Over the weeks, we have come to learn many inspiring stories about the victims. We have read about people who lost their lives saving others. And we have heard the words of a husband lost in grief over the death of his wife, yet extending words of forgiveness, because, as he said, “that’s what Islam taught me.” As the Holy Quran says in Surah Fussilat, verse 34, “Good and evil deeds are not equal. Repel evil with what is better and then you will see that one who was once your enemy has become your dearest friend.” We have also been deeply moved by the extraordinary displays of leadership, love and solidarity from the people of New Zealand and beyond. We saw it in England where a white non-Muslim man held up a placard outside a mosque that read “You are my friends; I will keep watch while you pray.” Such solidarity is often in evidence after a tragedy. We saw it in Pittsburgh, last year, after the worst anti-Semitic terrorist attack in United States history. Members of the Muslim community were quick to voice their support and raise money for the victims.
The executive director of the Pittsburgh Islamic Center said at the time. “We just want to know what you need. If it is people outside your next service protecting you, let us know. We’ll be there.”
This is the spirit that I know is deeply embedded in Islam – a faith of love, compassion, forgiveness, mercy and grace.
As UN High Commissioner for Refugees, I saw the generosity of Muslim countries opening their borders to people in distress in a world where, unfortunately, so many borders are closed. This is in line with what I regard as the most beautiful prescription for refugee protection in world history. It is found in the Surah Al-Tawbah of the Holy Quran, Surah 9, verse 6: “And if anyone seeks your protection, then grant him protection so that he can hear the words of Allah. Then escort him where he can be secure.” This was revealed to the Prophet , May Peace be upon Him, more than fourteen centuries before the 1951 Convention on the Protection of Refugees. Let me emphasise that the prescription is that protection should be given to both believers and non-believers. This is a remarkable example of openness and tolerance. In this time of difficulties and division, we must stand together and protect each other. Yet, around the world, we are seeing ever-rising anti-Muslim hatred, anti-Semitism, racism and xenophobia. Hate speech is entering the mainstream, spreading like wildfire through social media and radio. We see it spreading in liberal democracies as well as in authoritarian States. These dark forces menace democratic values, social stability and peace. They stigmatize women, minorities, migrants and refugees. When people are attacked, physically, verbally or on social media, because of their race, religion or ethnicity, all of society is diminished. We all have a part to play in repairing the fissures and ending the polarization that are so prevalent in many of our societies today. Our faith leaders, in particular, have a very important role. That is why it is so heartening to see the Grand Imam of al-Azhar, Sheikh Ahmed al-Tayeb, and Pope Francis join hands in Abu Dhabi in February in a show of interfaith brotherhood. I have here, given by the Grand Imam, the text - the common text, approved by him and the Pope, which is a fantastic testimony of mutual respect, tolerance, compassion and peace, given by the two great religious leaders to the world. As the Grand Imam stated, Muslims have paid a heavy price due to the actions of “a handful of criminals.” He also stressed that “all religions agree that God forbids killing.” The document they signed on “human fraternity for world peace and living together” calls on religious and political leaders to bring an end to wars, conflicts, and environmental decay. It further calls on Christians and Muslims to recognize and respect one another and work together for the good of humanity. And we will do our best for the UN to make sure that this document goes everywhere and is seen by everybody. I commend this bold move, and the Grand Imam’s call for Muslims in the Middle East to protect Christian communities. I also commend the initiatives taken by al-Azhar to promote the true face of Islam and counter violent extremist philosophies and terrorist propaganda. Nothing justifies terrorism, and it becomes particularly hideous when religion is invoked. To live in a world of peace, we must nurture mutual understanding and invest in making diversity a success. As the Prophet Muhammed, peace be upon him, said: “None of you truly believes until he wishes for his brother what he wishes for himself.” We must counter and reject religious and political figures who exploit differences. And we must ask why so many people feel excluded, and why they are tempted by extreme messages of intolerance against each other. Ultimately, we must all work together for our collective benefit. This is the reasoning behind the United Nations 2030 Agenda and its Sustainable Development Goals – the world’s blueprint for a fair globalization and an inclusive and prosperous society. At the heart of our efforts, we must uphold and promote human dignity and universal human rights. Yes, we have different faiths, cultures and histories, but we are all connected by our common humanity. Instead of dwelling on our differences, let us focus on what unites us, and work together for a better future for everyone, everywhere."
"Hispanics Rally to Trump, Boosting His 2020 Chances!!!",lunaticoutpost.com,,04-03-2019,2019,4,http://lunaticoutpost.com/thread-119951.html,"Post: #1 Hispanics Rally to Trump, Boosting His 2020 Chances!!!
Advertisement Hispanics Rally to Trump, Boosting His 2020 Chances
Get ready for the anti-Trump “resistance” to go truly loco, because new polling data indicates Hispanic support for the president is swelling, a trend that could seal his 2020 re-election victory..
...McLaughlin & Associates revealed that Hispanic approval for Trump in March jumped to 50%. This number matched the January Marist/NPR/PBS survey that shocked cynics with its own 50% approval finding. Even if those polls are too aggressive, February’s Morning Consult/Politico poll showed Trump’s Hispanic approval vaulting to a still-impressive 45%.
What explains this stunning trend?
https://www.realclearpolitics.com/articl...39933.html"
Olivia-Newton John: Ghosts of her family and famous friends are spirit guides,lunaticoutpost.com,,04-03-2019,2019,4,http://lunaticoutpost.com/thread-119950.html,"Post: #1 Olivia-Newton John: Ghosts of her family and famous friends are spirit guides
Advertisement I believe that some of my dead relatives and guardian angels may be visiting me, so this does not seem especially strange to me. Does anyone here ever sense the presence of dead loved ones?
""The Grease star reportedly made the surprising revelation in her new memoir Don't Stop Believin'. In the book, she writes that the spirits of John Denver, who passed away in 1997, and Karen Carpenter, who died in 1983, have become a powerful presence in her life.
""I often feel as if they hover around me when I perform,"" Newton-John says, ""they are my spirit guides who I ask to support me before every show and they keep me strong.""""
Source:
https://www.coasttocoastam.com/article/o...rit_guides"
American Safari goer Kidnapped in Uganda,lunaticoutpost.com,,04-03-2019,2019,4,http://lunaticoutpost.com/thread-119947.html,"American Safari goer Kidnapped in Uganda Advertisement Whoa, and the kidnappers want 500k. So many places to hide in those countries, it will be hard to find them. If they kidnapped me while on safari and said 500k, my relatives would tell them 'too little' My family would want at least 750k in cash from the kidnappers to take me back Disclosure: Lunaticoutpost.com is a participant in the Amazon Services LLC Associates Program , an affiliate advertising program designed to provide a means for sites to earn advertising fees by advertising and linking to Amazon.com. Amazon, the Amazon logo, MYHABIT, and the MYHABIT logo are trademarks of Amazon.com, Inc. or its affiliates. Terms of Service : Don't be a pest to the forum. No profanity in thread-titles or usernamesNo excessive profanity in postsNo Racism, Antisemitism + HateNo calls for violence against anyone.. Disclaimer: This website exists for fun and discussion only. The reader is responsible for discerning the validity, factuality or implications of information posted here, be it fictional or based on real events. The content of posts on this site, including but not limited to links to other web sites, are the expressed opinion of the original poster and are in no way representative of or endorsed by the owners or administration of this website. The posts on this website are the opinion of the specific author and are not statements of advice, opinion, or factual information on behalf of the owner or administration of LunaticOutPost.Com. The owners or administration of this website can't be hold responsible for content hosted on sites that posters link to in; including, but not limited to, posts, signatures, private messages and such. This site may contain content not suitable for minors and if you feel you might be offended by such content, you should log off immediately. Fair Use Notice: This site may contain copyrighted material the use of which has not always been specifically authorized by the copyright owner. Users may make such material available in an effort to advance awareness and understanding of issues relating to civil rights, economics, individual rights, international affairs, liberty, science & technology, etc. We believe this constitutes a 'fair use' of any such copyrighted material. The material on this site is distributed without profit to those who have expressed a prior interest in receiving the included information for research and educational purposes. In accordance with industry accepted best practices we ask that users limit their copy / paste of copyrighted material to the relevant portions of the article you wish to discuss (no more than 50% of the source material) provide a link back to the original article and provide your original comments / criticism in your post with the article. If you are a legal copyright holder or a designated agent for such and you believe a post on this website falls outside the boundaries of ""Fair Use"" and legitimately infringes on yours or your clients copyright please contact [email protected] Privacy Policy: This website is owned by : Marco Zwaneveld 2516 XR The Hague Netherlands. I will not rent, sell, share or otherwise disclose your personal information to any third party. We might contact you from time to time regarding your purchases or the services (like forums and announcement lists) you have subscribed to. Some of the 3rd party advertisers on lunaticoutpost.com may use cookies to track peformance and/or to serve relevant ads. If you wish to read more and/or opt out of such cookies, please visit: http://www.networkadvertising.org/choices/"
TW,lunaticoutpost.com,,04-03-2019,2019,4,http://lunaticoutpost.com/thread-119946.html,"TW Advertisement So searching for perfection are we? The wise know it doesn't exist. Its right in front of you ;) Мишки No. Perfection does not exist. LoP Guest LoP Guest Wrote: (Today 05:46 PM) No. Perfection does not exist. I question it? Sometimes it is on my mind! LoP Guest LoP Guest Wrote: (Today 05:48 PM) LoP Guest Wrote: (Today 05:46 PM) No. Perfection does not exist. I question it? Sometimes it is on my mind! We can imagine perfection. Disclosure: Lunaticoutpost.com is a participant in the Amazon Services LLC Associates Program , an affiliate advertising program designed to provide a means for sites to earn advertising fees by advertising and linking to Amazon.com. Amazon, the Amazon logo, MYHABIT, and the MYHABIT logo are trademarks of Amazon.com, Inc. or its affiliates. Terms of Service : Don't be a pest to the forum. No profanity in thread-titles or usernamesNo excessive profanity in postsNo Racism, Antisemitism + HateNo calls for violence against anyone.. Disclaimer: This website exists for fun and discussion only. The reader is responsible for discerning the validity, factuality or implications of information posted here, be it fictional or based on real events. The content of posts on this site, including but not limited to links to other web sites, are the expressed opinion of the original poster and are in no way representative of or endorsed by the owners or administration of this website. The posts on this website are the opinion of the specific author and are not statements of advice, opinion, or factual information on behalf of the owner or administration of LunaticOutPost.Com. The owners or administration of this website can't be hold responsible for content hosted on sites that posters link to in; including, but not limited to, posts, signatures, private messages and such. This site may contain content not suitable for minors and if you feel you might be offended by such content, you should log off immediately. Fair Use Notice: This site may contain copyrighted material the use of which has not always been specifically authorized by the copyright owner. Users may make such material available in an effort to advance awareness and understanding of issues relating to civil rights, economics, individual rights, international affairs, liberty, science & technology, etc. We believe this constitutes a 'fair use' of any such copyrighted material. The material on this site is distributed without profit to those who have expressed a prior interest in receiving the included information for research and educational purposes. In accordance with industry accepted best practices we ask that users limit their copy / paste of copyrighted material to the relevant portions of the article you wish to discuss (no more than 50% of the source material) provide a link back to the original article and provide your original comments / criticism in your post with the article. If you are a legal copyright holder or a designated agent for such and you believe a post on this website falls outside the boundaries of ""Fair Use"" and legitimately infringes on yours or your clients copyright please contact [email protected] Privacy Policy: This website is owned by : Marco Zwaneveld 2516 XR The Hague Netherlands. I will not rent, sell, share or otherwise disclose your personal information to any third party. We might contact you from time to time regarding your purchases or the services (like forums and announcement lists) you have subscribed to. Some of the 3rd party advertisers on lunaticoutpost.com may use cookies to track peformance and/or to serve relevant ads. If you wish to read more and/or opt out of such cookies, please visit: http://www.networkadvertising.org/choices/"
Renewable energy now makes up a third of global power capacity,lunaticoutpost.com,,04-03-2019,2019,4,http://lunaticoutpost.com/thread-119945.html,"Renewable energy now makes up a third of global power capacity Advertisement https://www.irena.org/publications/2019/...stics-2019 They said it was impossible, so it happened. At some point, the full solution includes the World Wide Grid with all the power systems connected. But we can't have that with the nations so divided, right? Disclosure: Lunaticoutpost.com is a participant in the Amazon Services LLC Associates Program , an affiliate advertising program designed to provide a means for sites to earn advertising fees by advertising and linking to Amazon.com. Amazon, the Amazon logo, MYHABIT, and the MYHABIT logo are trademarks of Amazon.com, Inc. or its affiliates. Terms of Service : Don't be a pest to the forum. No profanity in thread-titles or usernamesNo excessive profanity in postsNo Racism, Antisemitism + HateNo calls for violence against anyone.. Disclaimer: This website exists for fun and discussion only. The reader is responsible for discerning the validity, factuality or implications of information posted here, be it fictional or based on real events. The content of posts on this site, including but not limited to links to other web sites, are the expressed opinion of the original poster and are in no way representative of or endorsed by the owners or administration of this website. The posts on this website are the opinion of the specific author and are not statements of advice, opinion, or factual information on behalf of the owner or administration of LunaticOutPost.Com. The owners or administration of this website can't be hold responsible for content hosted on sites that posters link to in; including, but not limited to, posts, signatures, private messages and such. This site may contain content not suitable for minors and if you feel you might be offended by such content, you should log off immediately. Fair Use Notice: This site may contain copyrighted material the use of which has not always been specifically authorized by the copyright owner. Users may make such material available in an effort to advance awareness and understanding of issues relating to civil rights, economics, individual rights, international affairs, liberty, science & technology, etc. We believe this constitutes a 'fair use' of any such copyrighted material. The material on this site is distributed without profit to those who have expressed a prior interest in receiving the included information for research and educational purposes. In accordance with industry accepted best practices we ask that users limit their copy / paste of copyrighted material to the relevant portions of the article you wish to discuss (no more than 50% of the source material) provide a link back to the original article and provide your original comments / criticism in your post with the article. If you are a legal copyright holder or a designated agent for such and you believe a post on this website falls outside the boundaries of ""Fair Use"" and legitimately infringes on yours or your clients copyright please contact [email protected] Privacy Policy: This website is owned by : Marco Zwaneveld 2516 XR The Hague Netherlands. I will not rent, sell, share or otherwise disclose your personal information to any third party. We might contact you from time to time regarding your purchases or the services (like forums and announcement lists) you have subscribed to. Some of the 3rd party advertisers on lunaticoutpost.com may use cookies to track peformance and/or to serve relevant ads. If you wish to read more and/or opt out of such cookies, please visit: http://www.networkadvertising.org/choices/"
Alyssa Milano's 'I believe' Kavanaugh accuser becomes 'we can't assume' Biden gui,lunaticoutpost.com,,04-03-2019,2019,4,http://lunaticoutpost.com/thread-119944.html,"Post: #1 Alyssa Milano's 'I believe' Kavanaugh accuser becomes 'we can't assume' Biden gui
Advertisement Actress Alyssa Milano said Monday that she stands behind former Vice President Joe Biden in response to allegations that he kissed a Nevada politician without her consent in 2014.
Milano, 46, is a staunch #MeToo activist who last year attended the Senate hearing on Supreme Court nominee Brett Kavanaugh in support of his accuser Christine Blasey Ford. She said she opposed his nomination because of unsubstantiated accusations that Kavanaugh sexually assaulted Ford in high school. She live-tweeted from inside the proceeding, letting her three million-plus followers know: ""I believe Dr. Christine Blasey Ford.""
https://www.washingtonexaminer.com/news/...-did-wrong
Democrats are f*cking disgusting hypocrites."
Christchurch Shooters False Flag,lunaticoutpost.com,,04-03-2019,2019,4,http://lunaticoutpost.com/thread-119943.html,"Post: #1 Christchurch Shooters False Flag
Advertisement Looking more likeva false flag attack to clran up loose ends funded by the NZ government which were about to be exposed.
Mark Taylor captured, interrogated, read like a whos who of ISIS funfing.
Could have taken out NZ government.
Decided to liquidate both mosques and blame white supremacists.
Operation run by Mossad MI6 with support from NZ police freemasonry.
Hard to miss police isus body armour.
Note silver vehicle at first mosque assistant to shooter.
Also not 2 other shooters caught at Site 2 trying to get inside with AR15 rifles."
