title, publication, authors, date, year, month, url, content
Florida Business Owner Found Guilty of Millions in Food Stamp Fraud,www.breitbart.com,EggBert,04-02-2019,2019,4,https://www.breitbart.com/crime/2019/04/02/florida-business-owner-guilty-millions-food-stamp-fraud/#post-84,Which is a large part of the reason so many come to US. Free crap.
Florida Business Owner Found Guilty of Millions in Food Stamp Fraud,www.breitbart.com,zonablue,04-02-2019,2019,4,https://www.breitbart.com/crime/2019/04/02/florida-business-owner-guilty-millions-food-stamp-fraud/#post-83,"May not be their best, but able to defraud our inept social welfare net of millions, over a multi-year period."
Florida Business Owner Found Guilty of Millions in Food Stamp Fraud,www.breitbart.com,Sebastian,04-02-2019,2019,4,https://www.breitbart.com/crime/2019/04/02/florida-business-owner-guilty-millions-food-stamp-fraud/#post-85,Nothing in the story to indicate that they where not born here.
Florida Business Owner Found Guilty of Millions in Food Stamp Fraud,www.breitbart.com,Cheezits,04-02-2019,2019,4,https://www.breitbart.com/crime/2019/04/02/florida-business-owner-guilty-millions-food-stamp-fraud/#post-86,True.
Polish priest ‘very sorry’ for Harry Potter book burning,www.freemalaysiatoday.com,AFP,04-03-2019,2019,4,https://www.freemalaysiatoday.com/category/world/2019/04/03/polish-priest-very-sorry-for-harry-potter-book-burning/,"Polish priest ‘very sorry’ for Harry Potter book burning By - April 3, 2019 7:31 PM Three Polish priests had burned a number of books last week, saying they were ‘linked to the occult and magic’. (Reuters pic)
WARSAW: A Polish priest apologised Wednesday for burning “magic” Harry Potter books, after his actions sparked a wave of protest and comparisons with totalitarian regimes and the Inquisition.
Last Sunday, after mass, three priests in a parish at the Baltic port city of Gdansk presided over the burning of items including books they said were “linked to the occult and magic”.
They had burned them in line with Biblical exhortations against practising idolatry, they said.
A post detailing the incident on a Facebook page run by the Catholic “SMS from Heaven” evangelical group went viral, drawing heavy criticism online and headlines around the world.
On Wednesday Father Rafal Jaroszewicz, one of the three priests involved, posted on the same Facebook page that he was “very sorry”.
“The fact of burning books and other objects was unfortunate,” he wrote.
“However, it was not irreverent to any social group or religion, nor was it aimed at books as such or culture.”
The offending – which included photographs showing two altar boys standing over the fire pit as Jaroszewicz prayed over the “occult” items – had been deleted, he added.
Father Jaroszewicz had appeared unrepentant in a post on Monday.
He “dreamed of the day” when “the killing of unborn babies” would trigger as much outcry as the book burning, he wrote then.
‘Ideological madness’
The books burned included some from British author JK Rowling’s famed Harry Potter fantasy series; and at least one from the Twilight vampire-themed fantasy romance stories.
But other items included a Hindu religious figurine.
The Polish Episcopate declined to comment despite calls for it to condemn the incident.
Respected commentator Lukasz Turski described the “participation of children” in the burning as “particularly reprehensible”.
“In 1821, Heinrich Heine made a prophetic statement in his ‘Almanzor’ drama: ‘When we start to burn books, we finish by burning people’,” he wrote in the liberal daily Gazeta Wyborcza.
“A hundred and some odd years later, in Nazi Germany, Heine and (Thomas) Mann’s books and many other prominent artists were burning in piles in Berlin; a dozen or so years later, crematoria burned… the victims of the ideological madness of the supposedly civilised world.”
The top-selling Fakt tabloid daily thundered that “nobody expected a Holy Inquisition”, referring to the campaign against heresy led by the Catholic Church in the Middle Ages, which involved burning books and witch-hunting.
The row blew up as Poland’s influential church is struggling to deal with the fallout of unprecedented revelations about paedophilia among priests.
A Kantor Millward Brown survey published on Monday suggested that 64% of Poles want a secular state, with 29& opposed and 7% without an opinion. "
"Middle East Forum CEO: First recognize Israel, then negotiate for peace",www.jpost.com,JERUSALEM POST STAFF,04-03-2019,2019,4,https://www.jpost.com/Israel-Elections/Middle-East-Forum-CEO-First-recognize-Israel-then-negotiate-for-peace-585661,"Israel Elections Middle East Forum CEO: First recognize Israel, then negotiate for peace “It is customary to say that peace is made with enemies,” he said. “But peace is made with ex-enemies."" By JERUSALEM POST STAFF 1 minute read. b Daniel Seaman, CEO of Middle East Forum, speaks at the Jerusalem Post Elections Conference, April 3, 2019 Daniel Seaman, CEO of Middle East Forum, speaks at the Jerusalem Post Elections Conference, April 3, 2019
Daniel Seaman, CEO of Middle East Forum, spoke Wednesday at the Jerusalem Post Elections Conference. He said the question that interests the citizens of Israel is when there will be peace.“It is customary to say that peace is made with enemies,” he said. “But peace is made with ex-enemies. It will be possible to sit down for negotiations and turn to diplomacy when the basic assumption is reached that the Palestinians will stop terror, that they will recognize the fact that Israel is a reality - when the Palestinians recognize Israel, other countries will find it difficult to ignore it.” Seaman said that to achieve this, one must be determined to show the people of Gaza that their future will be better if they recognize Israel. “The Arab states understand that Israel is part of the Middle East solution and not so much the problem,” Seaman explained. “Israel has become a technological superpower and most countries in the Middle East understand that cooperation with us pays for them.”He said that once the Palestinians recognize Israel’s existence, then recognition will not be the basis for discussion and the parties will be better poised to examine solutions - two states or any other idea.“The time has come for the Israelis themselves to understand and internalize a strong Israel that upholds its rights, that wins,” he said. “From there, we can sit down together and bring an end to the conflict and achieve the peace we all desire.”
 "
"IGP should clarify statement that Adib was assaulted, says cop probing case",www.freemalaysiatoday.com,Ho Kit Yen,04-03-2019,2019,4,https://www.freemalaysiatoday.com/category/nation/2019/04/03/igp-should-clarify-statement-that-adib-was-assaulted-says-cop-probing-case/,"IGP should clarify statement that Adib was assaulted, says cop probing case By April 3, 2019 7:24 PM Investigating officer Lew Keng Joe.
SHAH ALAM: A police investigating officer today told an inquest that the court should subpoena Inspector-General of Police Mohamad Fuzi Harun over his statement that fireman Muhammad Adib Mohd Kassim was assaulted after a temple riot.
Lew Keng Joe, of Subang Jaya police headquarters, said this when questioned by lawyer Ahmad Taufiq Baharum, who is representing Adib’s family, on Fuzi’s statement.
He said such a statement by the IGP did not provide much help to his investigation.
Taufiq further questioned Lew how the country’s police chief would make such a statement on Adib’s situation.
To that, Lew said, “maybe you should subpoena the IGP and ask him”.
Earlier, Lew told the inquest he had seen photos of Adib when the fireman was initially admitted to Subang Jaya Medical Centre (SJMC) and said there were no injuries on the fireman’s face.
“If he was assaulted by others, he would have injuries on his head,” he said.
Lew also told the inquest that the investigation papers were reclassified as murder just before the post-mortem was conducted.
He said he was notified of the matter by the Selangor police just after Adib died on the night of Dec 17, 2018.
“I received this message from an officer in the state police when I was at Institut Jantung Negara that day.”
Adib’s case was initially investigated for attempted murder.
Lew said Adib’s post-mortem was done in the early hours of Dec 18 at Hospital Kuala Lumpur (HKL).
The inquest was called by the government amid conflicting claims on the cause of Adib’s death.
Adib was part of a response team sent from the Subang Jaya fire and rescue station on Nov 27 last year to the temple area in response to a call that cars had been set on fire. He died at IJN on Dec 17.
The inquest will resume on March 9 and March 11 before coroner Rofiah Mohamad.
Two expert witnesses from the housing and local government ministry will testify then. "
Raul Srugo on the housing issue: We are marching toward the greatest crisis,www.jpost.com,JERUSALEM POST STAFF,04-03-2019,2019,4,https://www.jpost.com/Israel-News/Raul-Srugo-on-the-housing-issue-We-are-marching-toward-the-greatest-crisis-585632,"Raul Srugo at The Jerusalem Post elections conference, April 3rd, 2019 (Credit: Ronen Shamir) Raul Srugo at The Jerusalem Post elections conference, April 3rd, 2019 (Credit: Ronen Shamir)
Raul Srugo, president of the Israel Builders Association, spoke Wednesday at the 2019 Jerusalem Post Elections Conference, delivering a powerful message: The upcoming elections will be more personal and less political, but one cannot ignore the housing crisis, which is one of the most critical issues in the country.In his remarks, he revealed several facts: 1 - According to data from the Construction and Housing Ministry, contractors profit around 15.1% minus taxes, which means around 8%. The investment of the government in the cost of housing is more than 60%. “So, it is impossible that the crisis starts with us. Apparently, the problem is in the hands of the government.”2 - Srugo noted that 55,000 families are formed in Israel each year. If we add to this number the couples who decide to buy, we reach around 70,000. With the expected rise in antisemitism around the world, there is expected to be further need in the coming year. But we only build around 45,000 apartments annually - so this gap is widening each year.3 - If you look at Israel in comparison to other OECD countries, we see that the basis of our failure lies in infrastructure. The next government should examine how best to investment in infrastructure, as you cannot talk about housing without concurrently discussing infrastructure. ""I think that we have done injustice to Transportation Minister Yisrael Katz. He promoted more infrastructure than any other minister, but there is still much more to go. We must invest between NIS 30 billion and NIS 40b. a year on infrastructure. We need a Transportation Ministry that is forward-thinking and plans today so we can reap rewards tomorrow.4 - The problem is building enough housing to meet our needs by 2050, when the number of citizens in Israel is expected to double. In other words, we need at least 3 million housing units. We are always proud of what we have been able to accomplish in this country in 70 years, but we need to make this next leap within 30. If it does not happen, we will see cities of temporary houses and tents.Srugo said that if Israel does not deal with the housing crisis, “we are marching toward the greatest crisis that Israel will have seen since the establishment of the state.”He said that to solve the problem, we need to think strategically.“In the early years, they said that we would raise the purchase tax and the bubble would explode,” he said. “But it did not happen -because this is not a bubble. It's a concrete ball and its growing. And to dismember this concrete ball requires strong tools.”The solution he said cannot just be subsidized housing, though that can be one aspect of a plan. He praised Finance Minister Moshe Kahlon for his “truly commendable” efforts and said he understood that the minister “wanted to be Robin Hood, taking from the rich and giving to the poor.” But he said it is not enough.“We need to build 100,000 housing units a year, Srugo continued. “We have to allow foreign workers to come and help us build.“We are not the problem, we are the solution,” he said of the Builders Association. “On the one hand, they tell us, you have foreign workers, and on the other hand you tax us for bringing in foreign workers. It is untenable.”He said that with three million apartments to be built, we must expand where we build by developing new metropolitan areas in the Golan Heights and in the Negev.He added that many mayors are opposed to programs such as Tama 38, which expands and refurbishes area apartments, and that they protest city planning.“The government must push the mayors to move forward with these plans and strengthen existing housing,” he said.
 "
Tan Sri and wife arrested for abusing their 3 domestic workers,www.freemalaysiatoday.com,Bernama,04-03-2019,2019,4,https://www.freemalaysiatoday.com/category/nation/2019/04/03/tan-sri-and-wife-arrested-for-abusing-their-3-domestic-workers/,"Tan Sri and wife arrested for abusing their 3 domestic workers By April 3, 2019 7:23 PM (File pic)
KUALA LUMPUR: A Tan Sri and his wife were today remanded for nine hours today for allegedly abusing their three foreign maids at their bungalow in Kajang recently.
Kajang police chief Ahmad Dzaffir Mohd Yussof said the two suspects were arrested at 8am and immediately taken to the Magistrate’s Court in Kajang for remand application.
The nine-hour remand order on the couple, which ended at 5pm, was issued by Magistrate Nor Afidah Idris, he said.
Yesterday, police recorded the statements from all the maids, aged between 25 and 41.
They have been placed under witness protection.
Last Friday, the three women claimed they were slapped and punched by their employers. They later escaped and sought help at their embassy. "
Fulham owner Khan apologises to fans after relegation to second tier,www.freemalaysiatoday.com,Reuters,04-03-2019,2019,4,https://www.freemalaysiatoday.com/category/sports/2019/04/03/fulham-owner-khan-apologises-to-fans-after-relegation-to-second-tier/,"Fulham owner Khan apologises to fans after relegation to second tier By April 3, 2019 7:17 PM Fulham owner Shahid Khan inside the ground before the match against Huddersfield Town. (Reuters pic)
BANGALORE: Fulham chairman Shahid Khan has apologised to the club’s supporters after the London club were relegated from the Premier League following a 4-1 defeat at Watford on Tuesday.
Needing at least a point to extend their battle against the drop, there was a glimmer of hope with the score 1-1 at halftime. However, they then conceded three times to ensure they follow Huddersfield Town into the second-tier Championship.
“I’m sorry that we let you down,” Khan said on Wednesday in a statement on the club’s website.
“Our goal this season was to build on what we achieved in promotion and deliver on our pledge to invest heavily in the squad, ensuring that Fulham would always compete in the Premier League and, no matter the result, never disappoint.
“Last night’s outcome made official what we didn’t think would be possible in August and tried desperately to remedy and avoid as the season wore on.”
The club spent an estimated 100 million pounds (US$131.79 million) on new players in the close season after gaining promotion to the top flight.
But they failed to click as a team, even naming three managers over the course of the season with Slavisa Jokanovic being replaced in November by Claudio Ranieri, who was then sacked in February and succeeded by interim coach Scott Parker.
“We hold ourselves accountable,” Khan added. “We will reflect, plan thoroughly and respond accordingly. In the weeks ahead we will communicate further as to our vision for the future.”
Fulham, who have the worst defensive record in the league having conceded 76 goals in 33 games, could still finish bottom with Huddersfield only three points behind with a game in hand. "
Hellobike said to seek at least US$500 mil in funding round,www.freemalaysiatoday.com,Bloomberg,04-03-2019,2019,4,https://www.freemalaysiatoday.com/category/business/2019/04/03/hellobike-said-to-seek-at-least-us500-mil-in-funding-round/,"Hellobike said to seek at least US$500 mil in funding round By - April 3, 2019 7:00 PM HelloBike bicycles stand parked on a sidewalk in Shanghai, China, on Jan 9, 2019. (Bloomberg pic)
HONG KONG: Hellobike, a bicycle-sharing startup backed by Ant Financial, plans to raise at least US$500 million in funding as it fights for customers in a brutal Chinese market, people familiar with the matter said.
The startup could seek as much as US$1 billion as it gauges interest from both existing investors and new backers, the people said, requesting not to be named because the matter is private.
While the Shanghai-based company’s valuation wasn’t clear, in June it said it was worth US$2.3 billion.
Just a few years after Chinese startups built dockless bike-sharing into a global business, the sector is floundering as pioneer Ofo flirts with bankruptcy and Mobike shows no signs of ending losses.
Hellobike, a relative late-comer, emerged as a strong contender with the backing of Ant Financial, which is leveraging the platform to win mobile payments business.
Though the funding may look surprising given the financial tumult, Hellobike is part of a proxy war in China.
Ant Financial is the finance affiliate of Alibaba Group Holding Ltd, which is locked in brutal fight for e-commerce customers with Meituan Dianping, the owner of Mobike.
Hellobike and Ant Financial, formally known as Zhejiang Ant Small & Micro Financial Services Group, declined to comment in separate e-mailed statements.
While Hellobike has managed to remain a standalone entity and now has 200 million registered users, it’s done so by repeatedly raising new capital.
Hellobike tapped investors at least twice last year, completing a 4 billion yuan (US$596 million) round as recently as December, according to Chinese news publication Jiemian.
Co-founder Li Kaizhu said in a January interview that the company would seek a future initial public offering without specifying a time-frame.
Meituan’s US$3.4 billion purchase of Mobike is proving problematic with Hellobike’s heavy investment in the sector.
Since the deal, Meituan has announced plans to pull out of most overseas markets and reduce the number of bikes it has on the streets as it tries to turn a profit. "
"I wanted to quit politics, Tok Mat says, after May 9 polls",www.freemalaysiatoday.com,Faiz Zainudin,04-03-2019,2019,4,https://www.freemalaysiatoday.com/category/nation/2019/04/03/i-wanted-to-quit-politics-tok-mat-says-after-may-9-polls/,"I wanted to quit politics, Tok Mat says, after May 9 polls By - April 3, 2019 6:55 PM Mohamad Hasan says he changed his mind about quitting after being left frustrated by Pakatan Harapan ministers.
SEREMBAN: Mohamad Hasan, the Barisan Nasional candidate seeking to retain his seat in the coming Rantau by-election, had thought of quitting politics altogether after BN’s disastrous outing in the May 9 polls.
Mohamad, fondly known as “Tok Mat”, said he had been prepared to throw in the towel as he was fed up with politics.
“I was just really tired and hurt when I was given the notice to leave my official residence immediately after the election defeat,” the former menteri besar told a crowd in Kampung Bemban.
“I just packed my clothes and dumped them in a box. I did not know where to move my family to, and at that moment, I decided to quit.”
Mohamad, who is Umno’s acting president, said he decided to stay with one of his children in Negeri Sembilan as he did not own a house in the state.
He attributed this to his hectic schedule of governing the state for 14 years.
But Mohamad said he decided to cancel his plans to retire from politics after feeling frustrated with Pakatan Harapan ministers.
The ‘penumpang’ controversy
Mohamad again clarified his controversial “penumpang” (passengers) remark, which saw DAP lodge police reports against him, insisting that there were no racial undertones.
He said it was to describe the underperforming ministers in Dr Mahathir Mohamad’s Cabinet.
“But it was intentionally misinterpreted by Pakatan as a slur against non-Malays.”
Mohamad had, when campaigning for BN in the Semenyih by-election, reportedly said Malays were being made to feel like visitors in their own country as there were too many “penumpang” in Parliament.
In the Rantau by-election on April 13, Mohamad will be up against PH’s Dr Streram Sinnasamy and two independents, Malar Rajaram and Mohd Nor Yassin. "
Putrajaya plans to stop depending on Singapore for treated water,www.freemalaysiatoday.com,Bernama,04-03-2019,2019,4,https://www.freemalaysiatoday.com/category/nation/2019/04/03/govt-aiming-for-zero-dependency-on-spore-treated-water-says-minister/,"Putrajaya plans to stop depending on Singapore for treated water By - April 3, 2019 6:43 PM A facility in Kota Tinggi, Johor to ensure adequate raw water supply for the state as well as for Singapore. (Bernama pic)
PETALING JAYA: The government today said it is working towards zero dependency on Singapore treated water for Johor and is conducting a study to ensure sufficient water supply in the state.
The study is being conducted by the water, land and natural resources ministry with the cooperation of the National Water Services Commission (SPAN) and the Johor government.
“We want zero dependency for Johor and we don’t want them to get (treated) water from Singapore anymore.
“At the same time, the study will ensure sufficient water supply in Johor in the future,” its minister Xavier Jayakumar said after launching a SPAN water conservation campaign in conjunction with World Water Day at the Petaling Jaya Boulevard.
He said the findings of this study will be submitted to Prime Minister Dr Mahathir Mohamad in a month’s time.
Johor Menteri Besar Osman Sapian had said last month the state government planned to stop depending on Singapore for its treated water supply.
At present, Singapore buys raw water from Johor at the price of 3 sen per 1,000 gallons and then sells back treated water to Johor for 50 sen per 1,000 gallons.
Asked about the water levels at dams nationwide because of the hot weather, Xavier said they were under control.
“Although the water levels at several dams are low, they are not critical. Anyway, it has started to rain and we expect certain areas hard hit by the hot weather to experience rain this month,” he said.
Earlier, Xavier announced the appointment of seven new SPAN commissioners – Steven Choong Shiau Yoon, Abdul Rashid Maidin, Gurdial Singh Nijar, Abdul Halim Jantan, V Subramaniam, Faizal Parish Abdullah and Sarajun Hoda Abdul Hassan.
“They will determine the direction to be taken by SPAN and ensure the commission functions smoothly,” he said, adding that they were picked based on their experience and expertise in water-related matters. "
