Neil Gorsuch Just Made Death Worse | The Nation,www.thenation.com,Elie Mystal,04-03-2019,2019,4,https://www.thenation.com/article/neil-gorsuch-death-penalty-bucklew/,"Neil Gorsuch Just Made Death Worse Neil Gorsuch Just Made Death Worse In an appalling majority opinion, Gorsuch endorses pain-filled deaths for people subjected to capital punishment. US Supreme Court Justice Neil Gorsuch testifies during his Senate Judiciary Committee confirmation hearing. (Reuters / Joshua Roberts)
The moral argument against the death penalty is actually harder to make than the legal argument against the death penalty. Most people who oppose the death penalty on moral grounds think it’s the other way around; they think that the sanctity of human life offers sufficient justification, and the law muddles it up somehow. But just Netflix any blockbuster from, say, the last 30 years, and you’ll see that view has it twisted. We live in a culture that fetishizes vengeance. Nobody is going to cry if Tony Stark blasts Thanos’s face off this summer. Nobody is going to care if Game of Thrones returns with a ritualistic burning of the Lannisters. Morally, our society is more at peace with the death penalty than it might seem. Ad Policy
Compared to moral philosophy, the law offers a much more compelling case against capital punishment. Some would argue that the first law is a law against capital punishment: thou shalt not kill. And if Charlton Heston is not your idea of a law-giver, political philosophers will tell you that the only reason we’re even in a “society” is because “law” was the only way to stop the endless cycle of revenge-killings that we would clearly engage in without it . The law has ever tried to mollify our thirst for vengeance.
Making the case that the death penalty is unconstitutional is downright easy. First of all, juries get it wrong, all the time. Apparently, 165 people have been freed from death row since 1973, and that must mean that some number of innocent people have been put to death. I’m going to go out on a limb and assume that killing innocent people violates some constitutional principle, or all of them. More specifically, we know that race plays a significant factor in who gets put to death, and that’s a pretty clear violation of the 14th Amendment’s promise of due process.
Oh, and there’s this whole constitutional amendment that says: “Excessive bail shall not be required, nor excessive fines imposed, nor cruel and unusual punishments inflicted.” The Eighth Amendment seems pretty dispositive on this issue. The Supreme Court has literally explained why the death penalty violates the Eighth Amendment, in the 1972 case Furman v. Georgia .
But Furman was functionally overturned just a few years later . Since 1976, we’ve executed around 1,500 people . Texas basically does it for sport now. The death penalty remains attached to our society like a vestigial tail reminding us of our bestial savagery.
Why? Why hasn’t the law been able to stop us from doing the thing it was arguably invented to stop us from doing? Well, because we keep putting people like Neil Gorsuch on the Supreme Court.
This week, Gorsuch wrote a majority opinion that was both shockingly cruel and entirely consistent with arch-conservative thought. The case is called Bucklew v. Precythe . Russell Bucklew is a convicted murderer whose depraved crimes are not in dispute. He was sentenced to death in Missouri. Missouri is a lethal-injection state, but Bucklew has a rare medical condition that would cause him to be in extreme pain as the lethal drugs do their work. Bucklew appealed his sentence, arguing that the pain would be a violation of his Eighth Amendment protections, and asked for alternative methods of death that are not sanctioned under Missouri law.
Gorsuch, writing for a 5-4 majority , denied his appeal. Gorsuch wrote: “The Eighth Amendment forbids ‘cruel and unusual’ methods of capital punishment but does not guarantee a prisoner a painless death.” That’s about the most heartless-bastard thing I’ve read in a while, and I work on the Internet.
Everybody should notice the sleight of hand Gorsuch is playing at here. Saying the Eighth Amendment only forbids certain “methods” of capital punishment presupposes that the Eighth Amendment allows capital punishment. That’s no better than saying you can’t drown a person, unless she’s a witch.
Gorsuch is demonstrably wrong. The Eighth Amendment makes no mention of death, painless or otherwise. It talks about cruelty . It contemplates unusual cruelty. Throwing me off the top of the Empire State Building would be almost entirely painless until I came to a sudden stop. It would still be cruel. It would still be unusual.
Would that Russell Bucklew was the only person doomed to suffer under Neil Gorsuch’s perverse interpretations. But what Gorsuch is doing here is creating an entirely new Supreme Court interpretation of the Eighth Amendment. Later in his opinion, Gorsuch explains that the Eighth Amendment is only offended when the method of death is “superadded” with some additional measure of “terror, pain, or disgrace.”
That’s new. Up until now, even as we allow for capital punishment, the central question has been whether the method of death is the most “humane” form of murder, oxymoronic as that phrase may be. Even though conservative judges have ruled time and again that no particular method of execution is too inhumane for our bloodthirsty desires, this view that any method is okay so long as the state doesn’t go out of its way to hurt you had only been the arch-conservative minority opinion.
It’s also a standard that is near impossible for a condemned person to meet. Unlike their ancestors, modern executioners do not make a habit of preening and dancing and pontificating about how the pain they’re about to inflict is good for the condemned soul. How can a person prove that the state is trying to hurt them when it’s already established that the state is trying to kill them? It would seem Neil Gorsuch reads Franz Kafka for cool new ideas on how to mentally torture death-row inmates.
To give his monstrous opinion the veneer of civilized thought, Gorsuch digs deep into his “originalist” bag of tricks. Gorsuch spends a lot of time detailing all of the horrible methods of execution that had fallen out of favor by the time the Eighth Amendment was ratified. The goal is to show that the founding fathers were perfectly okay with capital punishment (which they were) but had a civilized approach to it that comports with our modern views. The argument is that the Eighth Amendment should be read with these upstanding fellows in mind, men who were not interested in abolishing the death penalty, but wanted to ensure that the medieval tortures of the Old World were not transported to their New World.
Gorsuch tells us that some methods of death were clearly prohibited by the Eighth Amendment at the time of the Founding: Cruel and Unusual Punishment Alabama Is Going to Execute Rocky Myers. He Might Be Innocent. Ashoka Mukpo
These included such “[d]isgusting” practices as dragging the prisoner to the place of execution, disemboweling, quartering, public dissection, and burning alive, all of which Blackstone observed “savor[ed] of torture or cruelty.”
Methods of execution like these readily qualified as “cruel and unusual,” as a reader at the time of the Eighth Amendment’s adoption would have understood those words.
The founding fathers can choke on a cherry pit for all I care about their “enlightened” views on executions. Gorsuch conveniently leaves out that all of the methods he lists, every single one, remained well in use, in America, long after the Constitution and Eighth Amendment were ratified. Those methods were just primarily used to kill slaves and Native Americans is all. The originalist view of American history always seems to ignore how these same Founding Fathers treated nonwhites. I wonder why.
The Eighth Amendment should not be caged and hobbled in accordance with the wishes of the simple and bigoted minds who wrote it. It’s not our fault that these hypocrites blurted out a principle that would honor human dignity more than they had the will to in their own time. Way back in 1958 , the Supreme Court said that the Eighth Amendment “must draw its meaning from the evolving standards of decency that mark the progress of a maturing society.” The Eighth Amendment isn’t an artifact; it’s a challenge. It’s not something to hide behind; it’s something to live up to.
But Neil Gorsuch, and a legion of conservative legal “thinkers” like him, don’t want our society to mature and evolve. They want it to arrest and ossify. They don’t view the Constitution as a floor upon which we can build a better society;, they view it as ceiling which we are doomed to forever struggle against.
People will suffer because of this opinion. More people will spend their last moments on this earth in agonizing pain, because of this decision. That primarily (though not exclusively) “bad” people will suffer is the only reason Gorsuch thinks he can get away with authorizing such suffering. (I’ll spare you Brett Kavanaugh’s concurring opinion in this case, because it’s just a thoughtless contemplation of firing squads. He sounds like a child who’s just figured out he’s strong enough to pull the wings off a fly.)
This decision is immoral. It is painful. It is evil. You don’t even have to be morally against the death penalty to understand what has been done here. You just have to be more decent than Neil Gorsuch.
Elie Mystal Elie Mystal is the executive editor of Above the Law and a contributing writer for The Nation , as well as the legal editor of WNYC's More Perfect . He can be followed @ElieNYC.
 (19) "
World Economic Forum On the Middle East And North Africa To Focus On Building New Platforms Of Cooperation – Eurasia Review,www.eurasiareview.com,Eurasia Review,04-03-2019,2019,4,http://www.eurasiareview.com/03042019-world-economic-forum-on-the-middle-east-and-north-africa-to-focus-on-building-new-platforms-of-cooperation/,"By Eurasia Review
The World Economic Forum on the Middle East and North Africa will be held at the Dead Sea in Jordan on 6-7 April 2019 in partnership with the King Abdullah II Fund for Development (KAFD). This will be the 10th meeting in Jordan and 17th meeting in the region. The meeting will convene more than 1,000 government, business and civil society leaders from over 50 countries.
Under the theme “Building New Platforms of Cooperation”, the meeting will focus on four transformational imperatives: Shaping a new economic and social model for the region; environmental stewardship in the Arab world; finding common ground in a multiconceptual world; and the Fourth Industrial Revolution in the Arab world.
“The region is at a pivotal time of taking the bold decisions necessary to future-proof its societies and economies. At this meeting, we will hold several strategic dialogues, with particular attention on the relationship between the public, private and civic sectors, the impact of the Fourth Industrial Revolution on skills and jobs, and new initiatives to help resolve long-standing conflicts,” said Mirek Dusek, Deputy Head of Centre for Geopolitical and Regional Affairs and Member of the Executive Committee at the World Economic Forum.
For his part, Chairman of KAFD’s Board of Trustees Alaa Batayneh said, “Having Jordan host the World Economic Forum on the Middle East and North Africa for the 10th time reaffirms the importance of Jordan’s political and economic position within the region.” “The Forum offers an international platform to highlight the priorities and plans of Jordan and the region, in the fields of development, energy, technology applications, and natural resource management,” he added.
With the full support of the host country and presence of Their Majesties King Abdullah II bin Al Hussein, Queen Rania Al Abdullah and H.R.H. Crown Prince Al Hussein bin Abdullah II of the Hashemite Kingdom of Jordan, the meeting will bring together leaders from Gulf Cooperation Council countries, the Levant and North Africa, as well as key international stakeholders from East Africa, Europe and the United States.
The Co-Chairs of this year’s meeting are: Khalid Al Rumaihi, Chief Executive, Bahrain Economic Development Board, Bahrain; Thani Ahmed Al Zeyoudi, Minister of Climate Change and Environment of the United Arab Emirates; Rania A. Al-Mashat, Minister of Tourism of Egypt; Alain Bejjani, Chief Executive Officer, Majid Al Futtaim Holding, United Arab Emirates; Wafa Ben-Hassine, MENA Policy Counsel, Access Now, USA; Sumantra Chakrabarti, President, European Bank for Reconstruction and Development (EBRD), London; Tony F. Chan, President, King Abdullah University of Science and Technology (KAUST), Saudi Arabia; and Sigrid Kaag, Minister for Foreign Trade and Development Cooperation of the Netherlands.
For the second time, the World Economic Forum is partnering with the Bahrain Economic Development Board to bring 100 Arab start-ups to the meeting. The initiative aims to further integrate entrepreneurs into a national and regional dialogue on pressing challenges. More than 400 applicants representing 17 countries and spanning numerous sectors including finance, energy, health, environment, media and education applied. Among the selected start-ups are Careem (UAE) – also included in the 2017 selection – the region’s first “unicorn”, which was recently sold for $3.1 billion; Coded (Kuwait), the first coding boot camps for the Arab world; Proximie (Lebanon), a company that uses augmented reality for surgeons to contribute remotely to clinical procedures; and Wahed (UAE), the world’s first halal investment platform.
The meeting will also focus on highlighting long-term approaches to responding to systemic issues. For example, the Humanitarian Investing Initiative, launched at the Forum’s Annual Meeting in Davos, will showcase innovative approaches to investing that respond to the long-term challenges of protracted humanitarian crises. Taking this long-term approach, other sessions will feature solution-based, forward-looking dialogues on issues of healthcare, energy, water, gender equality, the future of jobs, cybersecurity and more. "
EFF Fights For Redditor Targeted By Religious Organization For Forum Posts About Its Data Collection Policies,www.techdirt.com,Tim Cushing,04-03-2019,2019,4,https://www.techdirt.com/articles/20190331/12091041914/eff-fights-redditor-targeted-religious-organization-forum-posts-about-data-collection-policies.shtml,"from the shut-up,-they-dmca'ed dept Wed, Apr 3rd 2019 9:38am — Tim Cushing
There goes the DMCA, being wielded as a tool of censorship again. The EFF is currently battling for a Redditor's anonymity -- something threatened by a bogus DMCA takedown and a subpoena seeking to unmask this supposed infringer.
It's about much more than simply disappearing content from the internet one party didn't want exposed. It's about targeting an individual to deter them from ever posting content like this again. Behind the subpoena is a powerful religious entity -- one that's seeking to shut down criticism of its means and methods .
The Electronic Frontier Foundation (EFF) is representing an anonymous Reddit commenter who is facing an abusive copyright claim from the Watchtower Bible and Tract Society, a group that publishes doctrines for Jehovah’s Witnesses. Today, EFF filed a motion to quash the attempt by Watchtower to unmask the online commenter.
The commenter referred to as “John Doe” in the filing is a lifelong member of the Jehovah’s Witness community. Using the handle “darkspilver,” Doe has chosen to share comments and concerns via one of Reddit’s online discussion groups. Darkspilver’s posts included a copy of an advertisement asking for donations that appeared on the back of a Watchtower magazine, as well as a chart Doe edited and reformatted to show the kinds of data that the Jehovah’s Witness organization collects and processes. Earlier this year, Watchtower subpoenaed Reddit for information on “darkspilver” as part of a potential copyright lawsuit.
There is no legitimate reason for the Watchtower's actions. The point of these efforts is to chill free speech about a large religious organization that engages in questionable behavior. Anonymity is essential to these discussions. Without this protection, Watchtower could track down users whose comments it didn't like and engage in targeted harassment until the comments stopped.
The EFF is asking the court to quash the subpoena and stand up for the right to engage in anonymous speech. As the EFF's motion [PDF] points out, members of the church stand to lose a lot more than the ability to comment on their church's actions if exposed. Their social and familial lives could be completely disrupted.
The ability to speak pseudonymously is crucial to Doe’s ability to comment freely about matters that can be deeply divisive and contentious among both current and former members of the Jehovah’s Witness community. Doe’s lifelong experience with that community makes Doe afraid to question or doubt religious doctrine or administration in public. Doe believes that dissenting points of view are strongly discouraged in the Jehovah’s Witness community, and that those who express them are likely to be labeled “apostates,” and excommunicated, or “disfellowshipped” from the community. For Doe and others, who grow up and live their lives within the Jehovah’s Witness community, alienation from their religious community means alienation from central social relationships with friends and family.
As the EFF points out, the content targeted by the bogus takedown can only be considered ""infringing"" if everything else contained in copyright law is thrown out. One targeted posting was a scan of the back of a Watchtower magazine containing instructions on how to donate to the organization. The other contained information about the organization's compliance with European data collection regulations. These were posted for informational purposes, allowing members of the subreddit to express their opinions about the organization's data collections and policies. Even if Watchtower has legal ownership of both of these pieces of content, copyright law wasn't violated by the user's posting.
If Watchtower is able to establish ownership for both items, its infringement claims would still fail because both posting are lawful fair uses. The doctrine of fair use “allows the public to use copyrighted works ‘for purposes such as criticism, comment, news reporting, teaching ... and scholarship.’”
[...]
The first posting, the Ad, was originally intended to raise money for the organization. Doe, by contrast, posted it on Reddit in order to spark further commentary regarding the organization’s solicitation strategy – which it did. Moreover, there is no evidence that Doe had any conceivable commercial purpose. The Chart, appears to have been originally created to summarize the Jehovah’s Witness organization’s storage and handling of personal data in connection with obligations of a new European data privacy rule. Doe’s reformatted version, by contrast, was intended to give subreddit members truthful information about the type of data the Jehovah’s Witness organization stores, and how it handles that information, to assuage potentially misguided concerns, and thus help encourage the preservation of information that might be useful in the future to reveal or punish past abuse.
The court has an obligation to protect free speech -- even the anonymous speech of a person who may reside outside of the United States. Commentary on issues of public interest is an essential element of free speech. The internal workings of a religious organization with 20 million members worldwide is definitely of interest to the public -- especially members of an online forum dedicated to discussion of this organization. Hopefully, this attempt to intimidate a forum member into silence by abusing copyright law will be decisively rejected by the court."
