US stocks edge higher after solid March jobs report,www.urdupoint.com,,04-05-2019,2019,4,https://www.urdupoint.com/en/miscellaneous/us-stocks-edge-higher-after-solid-march-jobs-587087.html,"US Stocks Edge Higher After Solid March Jobs Report Zeeshan Aziz (@imziishan) 23 hours ago Fri 05th April 2019 | 08:55 PM
New York, April 5 (UrduPoint / Pakistan Point News - 5th Apr, 2019 ) :Wall Street stocks rose modestly early Friday as a solid March US jobs report eased fears over slowing growth and the risk of recession.
About 10 minutes into trading, the Dow Jones Industrial Average stood at 26,411.25, up 0.1 percent.
The broad-based S&P 500 also gained 0.1 percent to 2,883.14, while the tech-rich Nasdaq Composite Index advanced 0. 2 percent to 7,909.52.
The Labor Department reported that the US added 196,000 net new positions for the month, well above expectations, while the jobless rate held steady at 3.8 percent.
Wall Street greeted the solid improvement in hiring after a weak February report, as well as a moderation in wage inflation that should discourage the Federal Reserve from shifting to a more hawkish posture on interest rates, said Briefing.com analyst Patrick O'Hare."
Re: Cold water getting dumped on viral tweet about Trump’s ‘animals’ comment triggers Resistance backlash,twitchy.com,DaveInIA,04-06-2019,2019,4,https://twitchy.com/dougp-3137/2019/04/06/cold-water-getting-dumped-on-viral-tweet-about-trumps-animals-comment-triggers-resistance-backlash/,"Cold water getting dumped on viral tweet about Trump’s ‘animals’ comment triggers Resistance backlash Posted at 12:45 pm on April 6, 2019 by Doug P.
Something President Trump said almost a year ago has taken on new life on the Left and with at least one Democrat candidate for president thanks to a video that leaves something out: . @realDonaldTrump on people asking for asylum ""These aren't people. These are animals."" pic.twitter.com/pTKY08Obm2
— Mark Elliott (@markmobility) April 5, 2019
And that tweet caught fire quickly with some help from people like Chrissy Tiegen, Rosanna Arquette, Ana Navarro and 2020 Dem candidate Pete Buttigieg: This is journalist, @TifaniRoberts comforting a small boy on the border. He was shot in the throat by Ortega’s thugs in Nicaragua. This little boy is seeking asylum in the United States. His name is William. Trump calls him “animal”. pic.twitter.com/avGe5mWctH
— Ana Navarro-Cárdenas (@ananavarro) April 6, 2019 This is Disgusting the only animal is you mr trump.
— Rosanna Arquette (@RoArquette) April 6, 2019 You do not refer to human beings as animals. You just don’t.
— Pete Buttigieg (@PeteButtigieg) April 6, 2019
Not surprisingly, there’s something they forgot to mention about what Trump said: Now that guests on cable news networks and a presidential candidate are referring to these remarks as new, think it’s important to point out they were made in May 2018, not yesterday. Also, as Snopes pointed out then, Trump was referring to MS-13 members https://t.co/LOeAdRd3wx https://t.co/rqPiaa8dks
— Yashar Ali 🐘 (@yashar) April 6, 2019 This tweet is going viral and it's not correct. Trump was not talking about asylum speakers at the time (this clip is from last May). The president's comments came in response to a California official's remarks on MS-13 gang members. https://t.co/KtmokemSTP https://t.co/frdZVF3YHn
— John Haltiwanger (@jchaltiwanger) April 6, 2019 Trending Sooo ... she's hangin' with HOES? AOC's
Trump’s “animals” remark was in reference to MS-13 gang members, but many didn’t want to hear that part. Respectful disagree. We *shouldn't* just dropping things down the memory hole. Even if he did mean MS-13, it's awful even to mean it about criminals—that kind of thinking can lead to police overreach and brutality. Police have confused asylum-seekers for gang members.
— Elizabeth Picciuto (@epicciuto) April 6, 2019
Reporter Yashar Ali explained further: That’s fine – but people are treating the remarks as new and they’re not. Additionally this clip is missing a lot of context. If all of the context is offered and people still believe there is an issue, like you, that’s understandable
— Yashar Ali 🐘 (@yashar) April 6, 2019
But many just don’t want to hear anything about context: I watched the entire segment on Cspan from 5/18. From trump to almost every person introduced around the room, they referred to migrants as “other” that they didn’t want in their town. MS-13 or not, they were all dehumanized. It was awful.
— C. Graziano (@artgraz) April 6, 2019 With the context btw it’s clear he’s referring to undocumented immigrants being deported en masse and not just MS-13
— Mehdi Hasan (@mehdirhasan) April 6, 2019 No he wasn’t https://t.co/4RWN1zSFQt
— Oliver Willis (@owillis) April 6, 2019 It's what his defenders said at the time. But it was during a discussion of immigration and sanctuary cities, and as he rambled on he mentioned MS-13. That was the excuse.
And of course being a member of MS-13 doesn't strip a person of their humanity and make them an animal. https://t.co/gUETxjTH9y
— Joshua Holland 🔥 (@JoshuaHol) April 6, 2019 OK, not new: but even members of MS-18 are not animals. And we all know that he was tarring peaceful asylum seekers and other would-be immigrants from the South with violent gang-members. https://t.co/LoOTbSfQyE
— Jason Pontin (@jason_pontin) April 6, 2019 it was dog whistling under the guise of talking about MS-13.
His incoherent wandering from topic to topic is NOT just cognitive decline – it's intentionally shifting the locus of conversation to whistle to his base but maintain an out for denial.
— random facts girl. (@soychicka) April 6, 2019 Except he wasn’t referring to MS-13. Read the god damn transcript. Trump is making a broad generalization about all undocumented immigrants coming into the country. https://t.co/zQBsbIdZJp
— ResistTrump (@SphallSteve1245) April 6, 2019 I watched the entire segment on Cspan from 5/18. From trump to almost every person introduced around the room, they referred to migrants as “other” that they didn’t want in their town. MS-13 or not, they were all dehumanized. It was awful.
— C. Graziano (@artgraz) April 6, 2019 Dehumanizing ANYONE is not okay. Not now, not ever and certainly not from the POTUS.
I’m surprised you’d say this.
— Jonathan Kraus (@kraus_jonathan) April 6, 2019 Attention those claiming “he was talking specifically about MS-13” in this PARTICULAR comment as if that excuses the PRESIDENT OF THE UNITED STATES using this term to describe (horrible) human beings. It’s NOT the same as Joe Schmoe using a colloquial term re rapists/murderers. https://t.co/LMZvZetrLX
— Charles Gaba (@charles_gaba) April 6, 2019
At the time Trump made the above comments about MS-13, Nancy Pelosi, 2014 recipient of Planned Parenthood’s Margaret Sanger Award, reminded America that every human being has a “spark of divinity.” It's amazing. There is a lot of context missing from that short video clip, but all you have to do is watch it and you know he's at least talking about people who have been deported, not asylum-seekers. Yet few are calling out Mark as the liar he is
— (((Aaron Worthing))) (@AaronWorthing) April 6, 2019 It all reminds me of the Covington Catholic incident. The original video was missing context, but it was clear from the start the old man was intentionally getting into the young kid's face, and probably even committed assault. Yet the prejudice was so thick ppl couldn't see it"
Quran Khawani for CM's father held,www.urdupoint.com,,04-05-2019,2019,4,https://www.urdupoint.com/en/pakistan/quran-khawani-for-cms-father-held-587086.html,"Quran Khawani For CM's Father Held Zeeshan Aziz (@imziishan) 18 hours ago Fri 05th April 2019 | 08:50 PM
LAHORE, (UrduPoint / Pakistan Point News - 5th Apr, 2019 ) :Quran Khawani for the departed soul of Sardar Fatah Muhammad Khan Buzdar, the father of Punjab Chief Minister Sardar Usman Buzdar , was held at Punjab Civil Officers Mess here Friday.
Fateha was offered for the departed soul.Qari Rafi-ud-Din Sialvi recited the Holy Quran while Marghoob Ahmad Hamdani and Provincial Minister Pir Syed Saeed-ul-Hassan Shah recited Naat.
Khateeb Badshahi Masjid Maulana Abdul Khabeer Azad and Foreign Minister Shah Mehmood Qureshi prayed for the departed soul of Sardar Fatah Muhammad Buzdar.
Federal and provincial ministers, assembly members, political leaders, important personalities and a large number of people attended the Quran Khawani.
Various people also condoled with the Chief Minister and paid tributes to the services to his late father.
The dignitaries present on the occasion include Ghulam Sarwar Khan, Tariq Bashir Cheema, Speaker Punjab Assembly Ch. Pervaiz Elahi , Raja Basharat , Mian Aslam Iqbal, Hashim Jawan Bakhat, Mian Khalid Mehmood, Muhammad Taimur Khan, Mehr Muhammad Aslam, Sardar Husnain Bahadur Dreshak, Hafiz Mumtaz Ahmad, Hafiz Amaar Yasir, Ijaz Alam, Bao Rizwan, Raja Rashid Hafeez, Malik Muhammad Ahmad, Ch. Zaheer-ud-Din, Ajmal Cheema, Muhammad Akhlaq, Akram Chaudhary, Faisal Hayat, Asif Nakai, Monis Elahi, Zain Qureshi, Khursheed Kasuri, Ijaz Chaudhary, Fiaz-ul-Hassan Chohan, Tahir Ashrafi, former Chief Minister Manzoor Wattoo , former Speaker National Assembly Ch. Amir Hussain, Shoaib Siddiqui, Nadeem Afzal Chan, Abrar-ul-Haq, Spokesman to CM, Chief Secretary, ACS, ACS(Home), IG Police and secretaries and senior officials of various departments. Facebook Twitter Google + Related Topics"
Three convicted for keeping explosive material,www.urdupoint.com,,04-05-2019,2019,4,https://www.urdupoint.com/en/pakistan/three-convicted-for-keeping-explosive-materia-587085.html,"Three Convicted For Keeping Explosive Material Mohammad Ali (@ChaudhryMAli88) 24 hours ago Fri 05th April 2019 | 08:50 PM
FAISALABAD, Apr 5 (UrduPoint / Pakistan Point News - 5th Apr, 2019 ) ::The anti-terrorism court Friday awarded five years imprisonment each to three accused in a case of having explosive material.
According to the prosecution, the counter terrorism department had arrested Abdul Razzaq Qasmi, Muhammad Nauman and Usman Shakir besides recovering explosive material from their possession the last year.
Judge Muhammad Khalil Naz also directed to confiscate properties of the convicts."
GB Governor calls on CM Punjab,www.urdupoint.com,,04-05-2019,2019,4,https://www.urdupoint.com/en/pakistan/gb-governor-calls-on-cm-punjab-587084.html,"GB Governor Calls On CM Punjab Zeeshan Aziz (@imziishan) 24 hours ago Fri 05th April 2019 | 08:50 PM
LAHORE, (UrduPoint / Pakistan Point News - 5th Apr, 2019 ) : Governor Gilgit Baltistan Raja Jalal Hussain Maqbool called on Punjab Chief Minister Sardar Usman Buzdar here on Friday.
The governor expressed condolence on demise of father of the chief minister , offered Fateha for the departed soul and expressed heartfelt sympathies with Usman Buzdar .
While paying tributes to the socio-political services of late Sardar Fatah Muhammad Buzdar, the governor said that the deceased was a popular personality of the area who spent all his life for public service."
Trump Urges Federal Reserve to Lower US Interest Rates,www.urdupoint.com,,04-05-2019,2019,4,https://www.urdupoint.com/en/world/trump-urges-federal-reserve-to-lower-us-inter-587081.html,"Trump Urges Federal Reserve To Lower US Interest Rates Muhammad Irfan 24 hours ago Fri 05th April 2019 | 08:45 PM
WASHINGTON (UrduPoint News / Sputnik - 05th April, 2019) US President Donald Trump on Friday said the Federal Reserve should lower US interest rates and adopt a policy of quantitative easing to accelerate the economy's growth.
""I personally think the Fed should drop rates. I think they really slowed us down. There's no inflation. I would say in terms quantitative tightening, it should actually be now quantitative easing. ... I think they should drop rates and they should get rid of quantitative tightening, you would see a rocket ship. Despite that we are doing very well,"" Trump told reporters before departing the White House for California, where he will visit the US-Mexico border .
On Thursday, Trump called the Federal Reserve's actions ""unnecessary and destructive."" The president last week said that the US economy as well as global markets would be much higher and better off if the Fed had not raised interest rates.
The US central bank increased the interest rate four times last year and projected that more hikes were to come in 2019 .
On March 20, the Fed announced that it will maintain the US interest rate at the 2.25-2.5 percent range and indicated that no changes are expected for the rest of the year."
Balance of Entire Mediterranean Region at Stake in Libya - Italian Interior Minister,www.urdupoint.com,,04-05-2019,2019,4,https://www.urdupoint.com/en/world/balance-of-entire-mediterranean-region-at-sta-587080.html,"Balance Of Entire Mediterranean Region At Stake In Libya - Italian Interior Minister Zeeshan Aziz (@imziishan) 24 hours ago Fri 05th April 2019 | 08:45 PM
ROME (UrduPoint News / Sputnik - 05th April, 2019) The balance of the entire Mediterranean region is at stake in Libya , and efforts should be made to ensure the situation in the country does not worsen, Italian Deputy Prime Minister and Interior Minister Matteo Salvini said on Friday, adding that a military solution to the nation's crisis will only have a destructive effect.
Tensions are on the rise in the North African nation after the Libyan National Army (LNA), led by Field Marshal Khalifa Haftar, moved toward the country's west and started clashing with rival forces just south of the capital Tripoli . On Friday the LNA again started advancing on the capital.
""I am worried about Libya . I get constant updates from special services and intelligence. We need to throw water on the fire and not gasoline. I do not [support] anyone who, out of economic and commercial interests, campaigns for a military solution [in Libya] that would be destructive,"" Salvini told reporters on the sidelines of the G7 interior ministers' meeting in Paris , as broadcast on his Facebook page.
The high-ranking Italian minister noted that an armed solution and use of troops did not serve to solve the problem. He added that he also had held a bilateral meeting with US State Department officials, who said that they were trusting Italy to maintain stability of the region.
""The balance of the entire Mediterranean is at stake [in Libya], as there are problems in Algeria that can spread, I emphasize that economic and commercial interests of individual countries should not conflict with a peaceful solution to the crisis ... We hope that no one is playing with fire ,"" Salvini concluded.
Libya is currently divided into two parts � the internationally recognized Government of National Accord headed by Fayez Sarraj in the capital of Tripoli and a parallel administration allied to Haftar in the east of the country. During a UN-organized meeting in March both Sarraj and Haftar agreed to hold a general election this spring. Facebook Twitter Google + Related Topics"
Indian army troops target civil population at LOC,www.urdupoint.com,,04-05-2019,2019,4,https://www.urdupoint.com/en/pakistan/indian-army-troops-target-civil-population-at-587079.html,"Indian Army Troops Target Civil Population At LOC Fahad Shabbir (@FahadShabbir) 20 hours ago Fri 05th April 2019 | 08:45 PM
RAWALPINDI, (UrduPoint / Pakistan Point News - 5th Apr, 2019 ) : Indian army troops on Friday targeted civil population in unprovoked fire in Chirikot Sector of Line of Control( LOC).
According to Inter Services Public Relations press release, six citizens including a woman and four children sustained injuries.
It added the injured have been evacuated to hospital. Those who sustained injuries includedShabnam W/O Raqeeb Hussain Shah, age 35 years, Kashan S/O Raqeeb Hussain Shah, age 13 years, Faizan S/O Raqeeb Hussain Shah, age 6 years, Nisah D/O Shafique, age 14 years, Asifa D/O Shafique, age 10 years, residents of village Serian and Shahid Hussain S/O Muhammad Hussain, age 28 years, resident of village ChafarIt said that Pakistan Army troops responded effectively targeting Indian posts undertaking the fire . There were reports of killing of five Indian soldiers and many injured , it added."
Pakistan appreciates SL's role in UN peace keeping missions,www.urdupoint.com,,04-05-2019,2019,4,https://www.urdupoint.com/en/pakistan/pakistan-appreciates-sls-role-in-un-peace-ke-587078.html,"Pakistan Appreciates SL's Role In UN Peace Keeping Missions Sumaira FH 24 hours ago Fri 05th April 2019 | 08:40 PM
ISLAMABAD, Apr 5 (UrduPoint / Pakistan Point News - 5th Apr, 2019 ) :The government of Pakistan on Friday while appreciating Sri Lanka 's role in the United Nation's peace keeping missions, presented 15 computers and printers to the newly established Peace Keeping Training Centre of Sri Lankan Army .
High Commissioner of Pakistan to Sri Lanka , Maj. Gen. (R) Dr. Shahid Ahmad Hashmat handed over the computers and printers to the Sri Lankan Army Commander Lt. Gen. Mahesh Senanayake in a ceremony held at Army Headquarters, according a press release received here from Colombo .
On the occasion, Dr Shahid Ahmad said the relations between Pakistan and Sri Lanka are time-tested and based on mutual trust. He hoped that both countries will continue to make efforts for nurturing new vistas of cooperation in the years ahead.
He also underscored that Pakistan has been the most significant and consistent contributor to the UN Peacekeeping around the world with the participation of over 150,000 troops since 1960.
Pakistani peacekeepers have left no stone unturned in the noble cause of helping humanity, building peace and bringing stability across the regions, under the banner of United Nations , he said.
Sri Lankan Army Commander, Lt. Gen. Mahesh Senanayake expressed his gratitude over the assistance and said it would help further improving the IT facilities at the centre."
"US job growth resumes in March, letting Trump breathe easier",www.urdupoint.com,,04-05-2019,2019,4,https://www.urdupoint.com/en/miscellaneous/us-job-growth-resumes-in-march-letting-trump-587077.html,"US Job Growth Resumes In March, Letting Trump Breathe Easier Fahad Shabbir (@FahadShabbir) 24 hours ago Fri 05th April 2019 | 08:40 PM
Washington, April 5 (UrduPoint / Pakistan Point News - 5th Apr, 2019 ) :US job creation came back to life in March , possibly assuaging recession fears and allowing Donald Trump a sigh of relief.
Government data released Friday showed a hiring surge in healthcare, bars and restaurants, while unemployment held steady and worker wages continued to climb.
The return to healthy job creation at the close of the third quarter followed wild results at the start of the year, including an anemic February when employers added just 33,000 net new positions, the slowest in 17 months.
The world 's largest economy added 196,000 net new positions for March , well above expectations, while the jobless rate held steady at 3.8 percent, according to the Labor Department.
The broad consensus among economists is that the US economy is slowing as the boost from recent tax cuts and fiscal stimulus fades. But President Trump 's administration has forecast that 2019 will be another banner year for growth.
Shortly after the numbers were released, Trump delighted in the news.
""Our country is doing unbelievably well,"" he said.
Average hourly wages rose four cents for the month, putting them up 3.2 percent over March of last year, more than twice the pace of consumer inflation over the same period -- but down from February 's 3.4 percent, which had been the highest in a decade but which may have been distorted by weather effects.
This gives workers purchasing power and suggests they will continue to spend despite surprising recent dips in retail sales and consumption.
- A dark spot - Ian Shepherdson of Pantheon Macroeconomics said the numbers were good but ""not a game changer."" ""Normal service is restored, after a couple of wild swings,"" he wrote in a note to clients.
A dark spot, however, was hiring among manufacturers, a sector hard-hit by Trump 's trade war with China . Automakers shed 6,300 jobs . Retailers also gave up nearly 12,000 workers. This was offset by gains in architecture, engineering and management services.
The labor force also shrank as more than 220,000 people stopped looking for work, driving the participation rate down two tenths of a percentage point to 63 percent -- a level around which it has stubbornly fluctuated for much of the past two years.
After steadily tightening interest rates last year, much to Trump 's chagrin, the Federal Reserve now forecasts it will not raise rates at all this year, taking note of slowing economic activity in the United States and globally.
However, economists say even a slower pace of growth is enough to continue driving unemployment downward at a time when employers already complain they are desperate to find capable workers.
As wages rise as a result of falling unemployment, inflation may soon follow, leaving central bankers little choice but to continue pushing their benchmark lending rates higher.
Yet, in his remarks to reporters on Friday, Trump called on the Fed to cut interest rates and resume its post-financial crisis bond-buying stimulus program, saying inflation was negligible.
""The data don't give the Fed reason to start tightening again soon but they don't support the case for easing either,"" Jim O'Sullivan of High Frequency Economics wrote in an analytical note on the March employment numbers.
Wall Street forged a little higher after the news , with the benchmark Dow Jones Industrial Average up 0.1 percent at 1430 GMT. Facebook Twitter Google + Related Topics"
