Farmers start harvesting of wheat crop in Multan,www.urdupoint.com,,04-06-2019,2019,4,https://www.urdupoint.com/en/agriculture/farmers-start-harvesting-of-wheat-crop-in-mul-587451.html,"Farmers Start Harvesting Of Wheat Crop In Multan Zeeshan Aziz (@imziishan) 17 hours ago Sat 06th April 2019 | 01:52 PM The local farmers have started harvesting of wheat crop by using labourers and latest machinery in Multan and suburban areas
MULTAN, (UrduPoint / Pakistan Point News - 6th Apr, 2019 ) :The local farmers have started harvesting of wheat crop by using labourers and latest machinery in Multan and suburban areas.
A large number of labourers can be seen harvesting wheat crop despite the hot weather , however, the reaper machines and harvester machines were also being used for harvesting in the area.
A few days delay has been noticed this season in the harvesting of wheat crop due to continuous spells of rain but now it begins. Most of the wheat crops were ready for harvesting, however, shortage of labourers and busy schedule of harvesting machines causing more delay, a farmer Muhammad Afzal told APP here on Saturday.
Afzal added that he has eight acres of agriculture land and he had produced 43 maund wheat per acre last year and he was expecting 38 to 40 maund wheat per acre this year.
Bashir Ahmed, another farmer expalined that he has started harvesting of the wheat crop by using reaper machines due to shortage of labourers for this purpose.
He said that he would complete the harvesting and threshing of the wheat crop within next 10 to 12 days. He said that any natural calamity like hail storm and rainy spells could cause maximum loss to farmers in the current situation.
He complained high rates of the machinery for harvesting and threshing of wheat crop adding that the reaper and threshing machines were charging more than 10 maund wheat per acre.
On the other hand, advance booking of the reaper, harvester and thresher machines have been made by the farmers.
A reaper machine owner, Ghulam Mustafa said that his reaper machine has been booked for next 13 days for harvesting of wheat crop of others. He said that he was charging Rs 800 per acre from the farmers for harvesting through reaper machine.
The same advance booking schedule have also been noticed for harvester and thresher machines in the area, APP observed."
Thailand election: Future Forward's Thanathorn faces sedition charges,www.urdupoint.com,,04-06-2019,2019,4,https://www.urdupoint.com/en/world/thailand-election-future-forwards-thanathor-587444.html,"Thailand Election: Future Forward's Thanathorn Faces Sedition Charges Fahad Shabbir (@FahadShabbir) 17 hours ago Sat 06th April 2019 | 01:44 PM The leader of a new political party that did well in Thailand's election last month has appeared at a police station to face charges of sedition.
Bangkok (UrduPoint / Pakistan Point News / Online - 06th April, 2019) The leader of a new political party that did well in Thailand 's election last month has appeared at a police station to face charges of sedition.Scores of supporters greeted Thanathorn Juangroongruangkit, the leader of Future Forward, at the Bangkok offices.Thanathorn says an allegation, from 2015 , that he aided a protest leader is politically motivated.The ruling military and an opposition coalition are both vying to form the next government following the polls.At 40, he is the young and charismatic head of the Future Forward Party, which has appealed strongly to young voters and opposes the military government , which has been in charge of Thailand since 2014.Future Forward did well in March 's election , finishing a strong third, gathering 6.2 million votes.It has since joined a ""democratic alliance "" to try to prevent the 2014 coup leader and current Prime Minister Prayuth Chan-ocha from staying in power.They date back to 2015 and allege Thanathorn gave assistance to the leader of anti-coup protesters, who violated laws on crowd gatherings.Thanathorn is accused of breaking three articles of the Thai criminal code and could face up to nine years in prison if found guilty.He could also be disqualified from parliament .The charges have been filed by an officer in the ruling government .Commenting on the delay in bringing the charges, police said there had been several reshuffles of personnel. Thanathorn is also facing a cybercrime charge for allegedly spreading false information.Earlier in the week he said the charges were politically motivated, adding: ""The dark influence will not leave Future Forward Party alone.""As he left the police station on Saturday, he asked: ""Why does this come a week after the election?""We believe in our innocence This isn't about me.
This is about everyone who fights for justice.""Scores of supporters, many wearing the party's orange colour, shouted slogans backing Thanathorn.They held up posters with the trending #SaveThanathorn hashtag and slogans such as ""end the age of the dinosaur"".The election results are not scheduled to be ratified until 9 May .Preliminary results suggest the party backing Gen Prayuth won the most popular votes, ahead of the Pheu Thai party, which is allied with exiled former PM Thaksin Shinawatra.But a complicated system of allocating seats in parliaments based on vote share , introduced by the military, means it remains unclear how many seats each party will ultimately have, hence the uncertainty on the next government .The Election Commission has been indicating that fewer seats than expected will be given to Future Forward and Thanathorn's supporters view the latest criminal charge against him as part of a wider campaign to keep his party out of power. Facebook Twitter Google + Related Topics"
China to close industrial park where deadly blast killed 78,www.urdupoint.com,,04-06-2019,2019,4,https://www.urdupoint.com/en/world/china-to-close-industrial-park-where-deadly-b-587443.html,"China To Close Industrial Park Where Deadly Blast Killed 78 Faizan Hashmi 17 hours ago Sat 06th April 2019 | 01:44 PM The Chinese chemical industry park where an explosion last month killed 78 people and left hundreds injured will be closed, authorities have said.
Beijing (UrduPoint / Pakistan Point News / Online - 06th April, 2019) The Chinese chemical industry park where an explosion last month killed 78 people and left hundreds injured will be closed, authorities have said.The blast in Yancheng city, eastern Jiangsu province, was one of the worst industrial accidents in the country in recent years, razing buildings nearby and blowing out the windows of surrounding homes.
Authorities evacuated thousands of residents.The decision to close the Xiangshui Chemical Industry Park was made Thursday by the local government , state broadcaster CCTV reported on Friday.Jiangsu province will also begin closing chemical plants, with the number of producers to be cut roughly in half by 2020 , news site The Paper reported.Local authorities said Tuesday 187 people hurt in the blast remained in hospital with two in critical condition.Three employees from the firm Jiangsu Tianjiayi Chemical, whose facility was involved in the blast, have been detained by police . They bore ""significant responsibility"" for the accident , according to a statement on the Yancheng governments official Twitter-like Weibo account.The company , with 195 employees, was established in 2007 and mainly produced raw chemical materials including anisole, a highly flammable compound.It had a history of violating environmental regulations, according to online records from Yancheng citys environment and ecology bureau.Deadly industrial accidents are common in China , where safety regulations are often poorly enforced.In November , a gas leak at a plant in the northern Chinese city of Zhangjiakou which will host the 2022 Winter Olympics killed 24 people and injured 21 others.In 2015 , China saw one of its worst industrial accidents when giant chemical blasts in the northern port city of Tianjin killed at least 165 people."
Iran floods: Thousands evacuate homes as heavy rain forecast,www.urdupoint.com,,04-06-2019,2019,4,https://www.urdupoint.com/en/world/iran-floods-thousands-evacuate-homes-as-heav-587442.html,"Iran Floods: Thousands Evacuate Homes As Heavy Rain Forecast Faizan Hashmi 17 hours ago Sat 06th April 2019 | 01:44 PM Flood-hit Iran is evacuating more towns and villages as forecasts show further rain is expected on Saturday.Heavy
Tehran (UrduPoint / Pakistan Point News / Online - 06th April, 2019) Flood-hit Iran is evacuating more towns and villages as forecasts show further rain is expected on Saturday.Heavy downpours are set to strike the south western provinces of the country as officials plan to release water from key river dams that are near capacity. Women and children are being moved to safer areas while men are asked to stay and assist with relief efforts.In recent weeks, much of the country has been submerged and the death toll currently stands at 70.Towns such as Susangerd, with a population of 50,000, will be left at risk and it will be evacuated on Saturday, along with around five other communities in the province of Khuzestan.Around 70 villages in the province have already been evacuated over the past week.The region is rich in oil and energy companies placed in the area have been assisting with the flood relief by using pumps to remove water .Extremely heavy rain began on March 19, in total affecting about 1,900 cities, towns and villages.
Many thousands of roads, bridges and buildings have been destroyed.So far, 86,000 people are living in emergency shelters, of which about 1,000 were airlifted to safety.Aid agencies are struggling to cope with the demands and Iran 's state budget is under pressure due to US sanctions on energy and banking.Foreign Minister Javad Zarif has accused US sanctions - reimposed after President Donald Trump withdrew from the Iran nuclear deal last year - of impeding aid efforts to affected areas, saying that it has caused a shortage of rescue helicopters.""This isn't just economic warfare; it's economic terrorism,"" Zarif tweeted on April .The government has maintained that people, especially farmers, will be compensated for their losses.The head of Iran 's elite Revolutionary Guards said the armed forces were ""using all their power"" to minimise damage."
Week long exams of Wafaq-ul-Madaris Al Arabia begins,www.urdupoint.com,,04-06-2019,2019,4,https://www.urdupoint.com/en/education/week-long-exams-of-wafaq-ul-madaris-al-arabia-587441.html,"Week Long Exams Of Wafaq-ul-Madaris Al Arabia Begins Sumaira FH 17 hours ago Sat 06th April 2019 | 01:37 PM The week long Middle to MA level annual examination of Wafaq-ul-Madaris Al Arabia Pakistan has begun simultaneously across the country on Saturday,
ISLAMABAD, (UrduPoint / Pakistan Point News - 6th Apr, 2019 ) :The week long middle to MA level annual examination of Wafaq-ul-Madaris Al Arabia Pakistan has begun simultaneously across the country on Saturday, as over 370,113 students were trying their luck , said Abdul Quddus Muhammadi of Central Media Cell. He said Wafaq-ul-Madaris has prepared same question papers for every student (of same grade) right from Gilgit-Baltistan to Karachi .
A total of 17,888 examiners and invigilators were performing duties to make examinations transparent.
He said Wafaq-ul-Madaris has already invited prominent personalities to visit examination halls and check transparency of the examinations.
There was no concept of cheating or hooliganism in Wafaq-ul-Madaris examinations, so there was no need to hire the services of Police or Rangers for security, he remarked.
President Wafaq-ul-Madaris, Dr Abdul Razzaq Sikandar and other leaders including Maulana Anwaar ul Haq, Mufti Muhammad Rafi Usman and Maulana Muhammad Hanif Jalandhri urged prominent educationalists to visit examination halls and pinpoint any anomaly in the examination system."
Aishwarya Rai Bachchan's character in Mani Ratnam's next to have shades of grey?,www.urdupoint.com,,04-06-2019,2019,4,https://www.urdupoint.com/en/showbiz/aishwarya-rai-bachchans-character-in-mani-ra-587428.html,"Aishwarya Rai Bachchan's Character In Mani Ratnam's Next To Have Shades Of Grey? Muhammad Irfan 17 hours ago Sat 06th April 2019 | 01:05 PM It's been quite some time since Aishwarya Rai Bachchan has kept her fans busy in guessing which project she'll take up next after her last outing in Fanney Khan
Mumbai (UrduPoint / Pakistan Point News / Online - 06th April, 2019) It's been quite some time since Aishwarya Rai Bachchan has kept her fans busy in guessing which project she'll take up next after her last outing in Fanney Khan.
For the longest time, Aishwarya and Abhishek Bachchan were in talks with Anurag Basu for Gulab Jamun, but they both opted out of the film , for reasons best known to them.DNA had already told you that Aishwarya Rai Bachchan is in talks withMani Ratnam for an upcoming project.
The beautiful actress had told DNA After Hrs, ""There is a discussion about a film , but we have to really pick up our conversation from where we left it. Mani is one of my favourite filmmakers.""Now, if recent reports are anything to go by, then the actress may be seen playing a grey character in Mani Ratnam's next which is likely to have Telugu actor Mohan Babu in the role of her husband.
A report on India Today quoted sources suggesting that Mohan Babu is apparently in talks with the filmmaker to play Aishwarya's husband in the film . Reportedly, Aishwarya's character will have shades of grey in the film .Reports doing the rounds also suggest that the film will be an adaptation of Kalki Krishnamurthy historical novel Ponniyin Selvan and will have an ensemble cast.
Probable Names that are popping up as being considered for the film 's cast include, Amitabh Bachchan , Jayam Ravi and Vikram among others. However, there hasn't been any confirmation on the same as yet."
"Akshay Kumar and Kiara Advani's Hindi remake of 'Kanchana' tentatively titled as 'Laxmi, shooting starts this month",www.urdupoint.com,,04-06-2019,2019,4,https://www.urdupoint.com/en/showbiz/akshay-kumar-and-kiara-advanis-hindi-remake-587426.html,"Akshay Kumar And Kiara Advani's Hindi Remake Of 'Kanchana' Tentatively Titled As 'Laxmi, Shooting Starts This Month Umer Jamshaid 17 hours ago Sat 06th April 2019 | 01:05 PM Fans of Akshay Kumar has a reason to rejoice as the actor will be seen in a horror film almost after 12 years. As
Mumbai (UrduPoint / Pakistan Point News / Online - 06th April, 2019) Fans of Akshay Kumar has a reason to rejoice as the actor will be seen in a horror film almost after 12 years. As reported earlier, Akki has signed a horror film which is a Hindi remake of a very popular South drama 'Kanchana'.
Reports were floating that Kiara Advani has been roped in to play the female lead in the film and also R Madhavan has signed on the dotted lines to be on the project. The latest report has confirmed that Akki and Kiara are been finalised to play the leads and the film has been tentatively titled as Laxmi.
Moreover, the shooting of the film will go on the floors from the second half of this month ( April ) and will finish its first schedule . Raghava Lawrence will himself step into direct this Hindi remake and a few changes in the storyline and the characters have been made to suit the sensibilities of the Hindi film audience.Talking about the storyline, Akshay plays the protagonist who gets possessed by the spirit of a transgender, while Kiara will portray the superstar's girlfriend in the movie ."
2 prisoners die in Adyala jail in Rawalpindi,www.urdupoint.com,,04-06-2019,2019,4,https://www.urdupoint.com/en/pakistan/2-prisoners-die-in-adyala-jail-in-rawalpindi-587417.html,"2 Prisoners Die In Adyala Jail In Rawalpindi Zeeshan Aziz (@imziishan) 18 hours ago Sat 06th April 2019 | 12:55 PM Two prisoners who were serving jail term in drug-related case died in Adyala jail on Saturday.According
Rawalpindi (UrduPoint / Pakistan Point News / Online - 06th April, 2019) Two prisoners who were serving jail term in drug-related case died in Adyala jail on Saturday.According to media reports two prisoners Basharat and Abbas who were convicted in drug abuse case died in Adyala jail . Basharat was in cell at the time of death while Abbas was kept in barrack.
Both were found dead at morning. Jail administration also confirmed their death . Health condition of both prisoners suddenly deteriorated at night but jail administration did not give them any medical treatment nor moved them to hospital. After legal proceedings both dead bodies were given to their family members ."
Overseas institutions racing into Chinese bonds market,www.urdupoint.com,,04-06-2019,2019,4,https://www.urdupoint.com/en/business/overseas-institutions-racing-into-chinese-bon-587416.html,"Overseas Institutions Racing Into Chinese Bonds Market Mohammad Ali (@ChaudhryMAli88) 18 hours ago Sat 06th April 2019 | 12:55 PM Overseas institutions are racing into the Chinese bonds market lured by the country's continuous opening-up and steady economic growth.
BEIJING, (UrduPoint / Pakistan Point News - 6th Apr, 2019 ) :Overseas institutions are racing into the Chinese bonds market lured by the country's continuous opening-up and steady economic growth.
About 300 new overseas institutional investors opened their accounts in the first quarter of 2019 , quadrupling that of Q1 2018 , according to the China Foreign Exchange Trading System and National Interbank Funding Center.
Q1 transactions by overseas institutional investors totaled 919.1 billion Yuan (136.81 billion U.S. Dollars ), up 31 percent year on year.
Products from global leading assets management firms like BlackRock have entered the Chinese bonds market , the center said.
China's yuan-denominated bonds started to be added to the Bloomberg Barclays Global Aggregate Index on Monday. A total of 356 government and policy bank bonds will be added into the index over the next 20 months."
Mirwaiz denounces disallowing Juma prayers at Srinagar Jamia Masjid,www.urdupoint.com,,04-06-2019,2019,4,https://www.urdupoint.com/en/kashmir/mirwaiz-denounces-disallowing-juma-prayers-at-587412.html,"Mirwaiz Denounces Disallowing Juma Prayers At Srinagar Jamia Masjid Faizan Hashmi 18 hours ago Sat 06th April 2019 | 12:48 PM The Chairman of Hurriyat forum, Mirwaiz Umar Farooq has denounced the authorities for disallowing congregational Juma prayers at historic Srinagar Jamia Masjid in Indian occupied Kashmir.
ISLAMABAD, (UrduPoint / Pakistan Point News - 6th Apr, 2019 ) :The Chairman of Hurriyat forum, Mirwaiz Umar Farooq has denounced the authorities for disallowing congregational Juma prayers at historic Srinagar Jamia Masjid in Indian occupied Kashmir.
According to Kashmir Media Service, the authorities imposed restrictions in downtown Srinagar on Friday following massive protests inside the Central Jail Srinagar , the previous night. The authorities had also sealed the Jamia Masjid and placed the Mirwaiz, who delivers weekly Friday sermon at the historic mosque , under house detention.
Mirwaiz Umar Farooq in a statement issued in Srinagar said that preventing the people from offering congregational prayers at the grand Masjid , following the Shab-e-Meraj, had deeply hurt the religious sentiments of hundreds of the masses.
He said repeated locking down of the grand mosque is unacceptable. He said that while entire Muslim Umaah was observing Meraj-e-Alam with religious fervour, thousands of Kashmiri people were deprived of their religious right and stopped from attending the traditional religious event at Jamia Masjid as stringent curbs were in place amid heavy deployment of Indian troops and police personnel."
China and Central and Eastern European Countries (CEEC )see steady trade growth,www.urdupoint.com,,04-06-2019,2019,4,https://www.urdupoint.com/en/business/china-and-central-and-eastern-european-countr-587411.html,"China And Central And Eastern European Countries (CEEC )see Steady Trade Growth Mohammad Ali (@ChaudhryMAli88) 18 hours ago Sat 06th April 2019 | 12:48 PM China and Central and Eastern European Countries (CEEC) saw steady trade growth last year as cooperation between the two sides strengthened.
BEIJING, (UrduPoint / Pakistan Point News - 6th Apr, 2019 ) : China and Central and Eastern European Countries (CEEC) saw steady trade growth last year as cooperation between the two sides strengthened.
Bilateral trade reached 82.23 billion U.S. Dollars last year, up 21 percent year on year, according to the Ministry of Commerce (MOC).
China's exports to the CEEC totaled 59.19 billion dollars last year, while imports reached 23.04 billion dollars, up 19.6 percent and 24.6 percent respectively, said MOC spokesperson Gao Feng.
Investment between the two sides also expanded. Chinese firms have invested over 10 billion dollars in the CEEC, while receiving more than 1.5 billion dollars from them. Bilateral investment covers sectors including auto parts, chemicals, finance and medicine.
China is willing to deepen economic and trade cooperation with the CEEC and further align the Belt and Road Initiative with CEEC national development strategies to seek win-win partnership, Gao said."
Federal Minister for Information and Broadcasting Chaudhry Fawad Hussain pleased over organizing grand Jashan-e-Jhelum,www.urdupoint.com,,04-06-2019,2019,4,https://www.urdupoint.com/en/pakistan/federal-minister-for-information-and-broadcas-587391.html,"Federal Minister For Information And Broadcasting Chaudhry Fawad Hussain Pleased Over Organizing Grand Jashan-e-Jhelum Mohammad Ali (@ChaudhryMAli88) 18 hours ago Sat 06th April 2019 | 12:12 PM Federal Minister for Information and Broadcasting Chaudhry Fawad Hussain has expressed his pleasure over successful organization of grand Jashan-e-Jhelum
ISLAMABAD, (UrduPoint / Pakistan Point News - 6th Apr, 2019 ) : Federal Minister for Information and Broadcasting Chaudhry Fawad Hussain has expressed his pleasure over successful organization of grand Jashan-e-Jhelum.
In a tweet on the occasion, he said he was really pleased to see such a big festival in Jhelum which was mostly a tradition of big cities only.
The festival is being held in Zamir Jafrey cricket Stadium and renowned folk singer Arif Lohar , famous characters Uncle Sargam and Masi Museebtey and local artists entertained the audience in the inaugural ceremony.
Traditional dances were also performed on folk music .
The festival received overwhelming response from the people of Jhelum , as large number of people thronged to the festival and enjoyed it completely.
Majority of the visitors came with their families at the opening ceremony and expressed happiness on the entertainment facilities provided there.
Children seemed over joyed on the establishment of special play area for them. Rescue 1122 , revenue, forest, health, education and police departments have set up special stalls at the festival to create awareness among the people on their respective subjects."
