"title, publication, authors, date, year, month, url, content"
Apogee Enterprises (APOG) Stock Rating Upgraded by BidaskClub,www.dailypolitical.com,Tyrone Williams,04-03-2019,2019,4,https://www.dailypolitical.com/2019/04/02/apogee-enterprises-apog-stock-rating-upgraded-by-bidaskclub.html,"Equity Residential (EQR) Stock Rating Lowered by Zacks Investment Research Apogee Enterprises (APOG) Stock Rating Upgraded by BidaskClub April 2nd, 2019 - Comments Off on Apogee Enterprises (APOG) Stock Rating Upgraded by BidaskClub - Filed Under - by Tyrone Williams Tweet
BidaskClub upgraded shares of Apogee Enterprises (NASDAQ:APOG) from a hold rating to a buy rating in a report issued on Saturday morning, BidAskClub reports.
A number of other brokerages have also weighed in on APOG. Sidoti lowered shares of Apogee Enterprises from a buy rating to a neutral rating in a research note on Monday, February 25th. ValuEngine raised shares of Apogee Enterprises from a strong sell rating to a sell rating in a research note on Friday, February 8th. Finally, Craig Hallum set a $48.00 price target on shares of Apogee Enterprises and gave the stock a buy rating in a research note on Friday, December 21st. One equities research analyst has rated the stock with a sell rating, four have assigned a hold rating and two have assigned a buy rating to the company. Apogee Enterprises has a consensus rating of Hold and a consensus price target of $48.50. Get Apogee Enterprises alerts:
Shares of NASDAQ:APOG opened at $38.24 on Friday. The company has a market capitalization of $1.02 billion, a PE ratio of 12.34, a P/E/G ratio of 1.04 and a beta of 1.62. Apogee Enterprises has a twelve month low of $26.38 and a twelve month high of $50.87. The company has a quick ratio of 1.38, a current ratio of 1.75 and a debt-to-equity ratio of 0.44. In related news, Director Jerome L. Davis sold 9,276 shares of the stock in a transaction that occurred on Monday, February 25th. The shares were sold at an average price of $37.63, for a total transaction of $349,055.88. Following the completion of the sale, the director now directly owns 17,251 shares of the company’s stock, valued at $649,155.13. The transaction was disclosed in a document filed with the SEC, which can be accessed through the SEC website . 2.90% of the stock is owned by corporate insiders.
Hedge funds have recently added to or reduced their stakes in the stock. Bessemer Group Inc. acquired a new stake in Apogee Enterprises during the fourth quarter valued at approximately $45,000. First Bank & Trust lifted its stake in Apogee Enterprises by 73.1% during the fourth quarter. First Bank & Trust now owns 3,565 shares of the industrial products company’s stock valued at $106,000 after purchasing an additional 1,505 shares during the last quarter. Pacer Advisors Inc. lifted its position in shares of Apogee Enterprises by 217.8% in the 3rd quarter. Pacer Advisors Inc. now owns 4,545 shares of the industrial products company’s stock valued at $188,000 after acquiring an additional 3,115 shares in the last quarter. D. E. Shaw & Co. Inc. purchased a new stake in shares of Apogee Enterprises in the 4th quarter valued at approximately $217,000. Finally, WINTON GROUP Ltd purchased a new stake in shares of Apogee Enterprises in the 4th quarter valued at approximately $246,000. 97.48% of the stock is owned by institutional investors and hedge funds.
Apogee Enterprises Company Profile
Apogee Enterprises, Inc designs and develops glass and metal products and services in the United States, Canada, and Brazil. It operates through four segments: Architectural Framing Systems, Architectural Glass, Architectural Services, and Large-Scale Optical Technologies (LSO). The Architectural Framing Systems segment designs, engineers, fabricates, and finishes the aluminum frames used in customized aluminum and glass window, curtainwall, storefront, and entrance systems comprising the outside skin and entrances of commercial, institutional, and multi-family residential buildings. Receive News & Ratings for Apogee Enterprises Daily - Enter your email address below to receive a concise daily summary of the latest news and analysts' ratings for Apogee Enterprises and related companies with MarketBeat.com's FREE daily email newsletter . Latest News"
Vicor (VICR) Downgraded by ValuEngine to Hold,www.dailypolitical.com,Stacy Sanders,04-03-2019,2019,4,https://www.dailypolitical.com/2019/04/02/vicor-vicr-downgraded-by-valuengine-to-hold.html,"Equity Residential (EQR) Stock Rating Lowered by Zacks Investment Research Vicor (VICR) Downgraded by ValuEngine to Hold April 2nd, 2019 - Comments Off on Vicor (VICR) Downgraded by ValuEngine to Hold - Filed Under - by Stacy Sanders Tweet
ValuEngine lowered shares of Vicor (NASDAQ:VICR) from a buy rating to a hold rating in a research note released on Saturday morning, ValuEngine reports.
Other equities analysts have also recently issued reports about the company. BidaskClub upgraded Vicor from a sell rating to a hold rating in a report on Tuesday, December 18th. TheStreet upgraded Vicor from a c rating to a b- rating in a report on Thursday, January 24th. Get Vicor alerts:
Vicor stock opened at $30.33 on Friday. The company has a market cap of $1.26 billion, a price-to-earnings ratio of 39.77 and a beta of 0.49. Vicor has a 52-week low of $27.10 and a 52-week high of $64.50. In related news, Director Samuel J. Anderson sold 9,092 shares of the stock in a transaction on Thursday, March 14th. The stock was sold at an average price of $30.95, for a total value of $281,397.40. Following the transaction, the director now directly owns 15,223 shares in the company, valued at approximately $471,151.85. The sale was disclosed in a document filed with the SEC, which is available through the SEC website . 37.40% of the stock is owned by company insiders.
Several institutional investors and hedge funds have recently modified their holdings of the stock. Capital Impact Advisors LLC lifted its holdings in shares of Vicor by 25.2% in the 4th quarter. Capital Impact Advisors LLC now owns 49,297 shares of the electronics maker’s stock worth $1,850,000 after purchasing an additional 9,938 shares in the last quarter. Geode Capital Management LLC lifted its stake in Vicor by 0.7% during the 4th quarter. Geode Capital Management LLC now owns 189,887 shares of the electronics maker’s stock valued at $7,175,000 after acquiring an additional 1,322 shares in the last quarter. Dimensional Fund Advisors LP lifted its stake in Vicor by 10.9% during the 4th quarter. Dimensional Fund Advisors LP now owns 495,575 shares of the electronics maker’s stock valued at $18,728,000 after acquiring an additional 48,853 shares in the last quarter. Public Employees Retirement System of Ohio lifted its stake in Vicor by 11.3% during the 4th quarter. Public Employees Retirement System of Ohio now owns 98,350 shares of the electronics maker’s stock valued at $3,717,000 after acquiring an additional 10,000 shares in the last quarter. Finally, Ashford Capital Management Inc. lifted its stake in Vicor by 25.3% during the 4th quarter. Ashford Capital Management Inc. now owns 743,800 shares of the electronics maker’s stock valued at $28,108,000 after acquiring an additional 149,970 shares in the last quarter. Institutional investors own 30.70% of the company’s stock.
About Vicor
Vicor Corp. engages in the design, development, manufacture, and marketing of modular power components and complete power systems based upon a portfolio of patented technologies. It operates through the following segments: Brick Business Unit, VI Chip, Picor, and Corporate. The Brick Business Unit provides modular power converters and configurable products.
To view ValuEngine’s full report, visit ValuEngine’s official website . Receive News & Ratings for Vicor Daily - Enter your email address below to receive a concise daily summary of the latest news and analysts' ratings for Vicor and related companies with MarketBeat.com's FREE daily email newsletter . Latest News"
BayCom (BCML) Raised to “Hold” at ValuEngine,www.dailypolitical.com,Trevor Kearing,04-03-2019,2019,4,https://www.dailypolitical.com/2019/04/02/baycom-bcml-raised-to-hold-at-valuengine.html,"Equity Residential (EQR) Stock Rating Lowered by Zacks Investment Research BayCom (BCML) Raised to “Hold” at ValuEngine April 2nd, 2019 - Comments Off on BayCom (BCML) Raised to “Hold” at ValuEngine - Filed Under - by Trevor Kearing Tweet
ValuEngine upgraded shares of BayCom (NASDAQ:BCML) from a sell rating to a hold rating in a report published on Saturday morning, ValuEngine reports.
Other research analysts have also recently issued research reports about the company. Zacks Investment Research upgraded BayCom from a hold rating to a strong-buy rating and set a $26.00 price objective on the stock in a research report on Thursday, January 3rd. TheStreet upgraded BayCom from a c+ rating to a b rating in a research report on Monday, January 28th. Hovde Group assumed coverage on BayCom in a research report on Monday, February 4th. They set an outperform rating and a $24.50 price objective on the stock. Finally, B. Riley assumed coverage on BayCom in a research report on Friday, March 15th. They set a buy rating and a $28.00 price objective on the stock. One equities research analyst has rated the stock with a hold rating and four have issued a buy rating to the company’s stock. BayCom presently has a consensus rating of Buy and an average target price of $26.38. Get BayCom alerts:
Shares of BayCom stock opened at $22.87 on Friday. BayCom has a 1 year low of $17.19 and a 1 year high of $26.94. The firm has a market cap of $246.59 million, a price-to-earnings ratio of 13.86, a price-to-earnings-growth ratio of 1.04 and a beta of 0.35. BayCom (NASDAQ:BCML) last announced its quarterly earnings results on Tuesday, January 29th. The company reported $0.39 earnings per share (EPS) for the quarter, beating the consensus estimate of $0.36 by $0.03. The business had revenue of $15.52 million for the quarter, compared to analyst estimates of $15.90 million. Equities research analysts expect that BayCom will post 2.17 earnings per share for the current fiscal year.
A number of hedge funds have recently bought and sold shares of BCML. Vanguard Group Inc grew its holdings in BayCom by 14.9% during the 3rd quarter. Vanguard Group Inc now owns 480,637 shares of the company’s stock valued at $12,824,000 after purchasing an additional 62,271 shares in the last quarter. Bank of Montreal Can boosted its stake in BayCom by 25.4% during the 4th quarter. Bank of Montreal Can now owns 7,940 shares of the company’s stock valued at $183,000 after acquiring an additional 1,607 shares during the last quarter. Assenagon Asset Management S.A. bought a new position in BayCom during the 4th quarter valued at $390,000. D.A. Davidson & CO. boosted its stake in BayCom by 11.6% during the 4th quarter. D.A. Davidson & CO. now owns 19,148 shares of the company’s stock valued at $442,000 after acquiring an additional 1,991 shares during the last quarter. Finally, Rhumbline Advisers boosted its stake in BayCom by 47.0% during the 4th quarter. Rhumbline Advisers now owns 14,209 shares of the company’s stock valued at $328,000 after acquiring an additional 4,542 shares during the last quarter. Hedge funds and other institutional investors own 63.71% of the company’s stock.
About BayCom
BayCom Corp operates as the bank holding company for United Business Bank that provides various financial services to businesses, business owners, and individuals. The company offers demand, savings, money market, and time deposit accounts. It also provides commercial and multi-family real estate loans, including owner-occupied and investor real estate loans; commercial and industrial loans, such as equipment loans and working capital lines of credit; small business administration loans; construction and land loans; agriculture-related loans; and consumer loans comprising installment loans, unsecured and secured personal lines of credit, and overdraft protection.
To view ValuEngine’s full report, visit ValuEngine’s official website . Receive News & Ratings for BayCom Daily - Enter your email address below to receive a concise daily summary of the latest news and analysts' ratings for BayCom and related companies with MarketBeat.com's FREE daily email newsletter . Latest News"
Gladstone Land (LAND) Upgraded to “Buy” at ValuEngine,www.dailypolitical.com,Trevor Kearing,04-03-2019,2019,4,https://www.dailypolitical.com/2019/04/02/gladstone-land-land-upgraded-to-buy-at-valuengine.html,"Q2 2020 EPS Estimates for Sportsman’s Warehouse Holdings Inc (SPWH) Lowered by Analyst Gladstone Land (LAND) Upgraded to “Buy” at ValuEngine April 2nd, 2019 - Comments Off on Gladstone Land (LAND) Upgraded to “Buy” at ValuEngine - Filed Under - by Trevor Kearing Tweet
ValuEngine upgraded shares of Gladstone Land (NASDAQ:LAND) from a hold rating to a buy rating in a report released on Saturday, ValuEngine reports.
Several other analysts also recently weighed in on LAND. Zacks Investment Research downgraded shares of Gladstone Land from a buy rating to a hold rating in a research report on Saturday, December 22nd. JMP Securities downgraded shares of Gladstone Land from a market perform rating to an underperform rating in a research report on Monday, January 14th. Finally, Maxim Group reiterated a buy rating and issued a $15.00 price objective on shares of Gladstone Land in a research report on Thursday, February 28th. Get Gladstone Land alerts:
Shares of NASDAQ:LAND opened at $12.60 on Friday. The stock has a market capitalization of $228.64 million, a P/E ratio of 24.67 and a beta of 0.99. Gladstone Land has a fifty-two week low of $11.12 and a fifty-two week high of $13.85. The company has a debt-to-equity ratio of 1.86, a quick ratio of 1.61 and a current ratio of 1.61. The business also recently declared a monthly dividend, which was paid on Friday, March 29th. Shareholders of record on Wednesday, March 20th were given a dividend of $0.0445 per share. This represents a $0.53 dividend on an annualized basis and a dividend yield of 4.23%. This is an increase from Gladstone Land’s previous monthly dividend of $0.04. The ex-dividend date was Tuesday, March 19th. Gladstone Land’s payout ratio is 103.92%.
In related news, CEO David Gladstone purchased 100,000 shares of the company’s stock in a transaction on Friday, March 15th. The shares were bought at an average cost of $12.00 per share, for a total transaction of $1,200,000.00. Following the transaction, the chief executive officer now owns 2,015,300 shares of the company’s stock, valued at $24,183,600. The purchase was disclosed in a legal filing with the Securities & Exchange Commission, which is accessible through the SEC website . 16.08% of the stock is currently owned by insiders.
Hedge funds have recently added to or reduced their stakes in the business. FCA Corp TX bought a new stake in shares of Gladstone Land during the 4th quarter worth about $111,000. Advisor Group Inc. raised its position in shares of Gladstone Land by 13.0% during the 4th quarter. Advisor Group Inc. now owns 10,407 shares of the real estate investment trust’s stock worth $119,000 after buying an additional 1,197 shares in the last quarter. Cahill Financial Advisors Inc. bought a new stake in shares of Gladstone Land during the 3rd quarter worth about $131,000. Rhumbline Advisers raised its position in shares of Gladstone Land by 49.0% during the 4th quarter. Rhumbline Advisers now owns 21,490 shares of the real estate investment trust’s stock worth $247,000 after buying an additional 7,071 shares in the last quarter. Finally, Strs Ohio raised its position in shares of Gladstone Land by 5.8% during the 4th quarter. Strs Ohio now owns 22,959 shares of the real estate investment trust’s stock worth $263,000 after buying an additional 1,254 shares in the last quarter. Institutional investors own 31.13% of the company’s stock.
About Gladstone Land
Gladstone Land is a publicly-traded real estate investment trust that invests in farmland and farm-related properties located in major agricultural markets in the U.S., which it leases to unrelated third-party farmers. The Company reports the current fair value of its farmland on a quarterly basis; as of September 30, 2018, the estimated net asset value of the Company was $13.79 per share.
To view ValuEngine’s full report, visit ValuEngine’s official website . Receive News & Ratings for Gladstone Land Daily - Enter your email address below to receive a concise daily summary of the latest news and analysts' ratings for Gladstone Land and related companies with MarketBeat.com's FREE daily email newsletter . Latest News"
BioNano Genomics (BNGO) Rating Reiterated by Maxim Group,www.dailypolitical.com,Tyrone Williams,04-03-2019,2019,4,https://www.dailypolitical.com/2019/04/02/bionano-genomics-bngo-rating-reiterated-by-maxim-group.html,"Investors Buy Large Volume of Call Options on TC Pipelines (TCP) BioNano Genomics (BNGO) Rating Reiterated by Maxim Group April 2nd, 2019 - Comments Off on BioNano Genomics (BNGO) Rating Reiterated by Maxim Group - Filed Under - by Tyrone Williams Tweet
BioNano Genomics (NASDAQ:BNGO) ‘s stock had its “buy” rating restated by analysts at Maxim Group in a research report issued to clients and investors on Monday, AnalystRatings.com reports. They currently have a $11.00 target price on the stock. Maxim Group’s target price points to a potential upside of 144.44% from the stock’s previous close.
The analysts wrote, “Following 4Q18 results on 3/14, we reference publications on Saphyr in 2019 (see our note from 3/18, link). There was also a recent Bionano presentation in which was discussed (in part), a study in the cytogenetics space which we believe should be of interest. In addition, it’s important to understand, in our view, the dynamics around building revenue with Saphyr (shown below).”” Get BioNano Genomics alerts:
BNGO has been the subject of a number of other research reports. Zacks Investment Research downgraded BioNano Genomics from a “hold” rating to a “sell” rating in a research report on Monday, December 10th. Roth Capital reiterated a “buy” rating on shares of BioNano Genomics in a research report on Tuesday, February 5th. Finally, ValuEngine downgraded BioNano Genomics from a “buy” rating to a “hold” rating in a research report on Friday, December 21st. Shares of NASDAQ:BNGO opened at $4.50 on Monday. BioNano Genomics has a twelve month low of $3.50 and a twelve month high of $10.00. The company has a market cap of $44.11 million and a P/E ratio of -1.72. The company has a quick ratio of 4.85, a current ratio of 5.09 and a debt-to-equity ratio of 0.89.
BioNano Genomics (NASDAQ:BNGO) last announced its earnings results on Thursday, March 14th. The company reported ($0.62) earnings per share for the quarter, missing the consensus estimate of ($0.48) by ($0.14). The company had revenue of $4.01 million during the quarter, compared to analysts’ expectations of $3.71 million. On average, equities research analysts forecast that BioNano Genomics will post -1.8 earnings per share for the current fiscal year.
Several hedge funds have recently made changes to their positions in BNGO. Federated Investors Inc. PA bought a new stake in shares of BioNano Genomics in the 3rd quarter worth approximately $56,704,000. Sio Capital Management LLC bought a new stake in shares of BioNano Genomics in the 3rd quarter worth approximately $7,353,000. Monashee Investment Management LLC lifted its position in shares of BioNano Genomics by 50.6% in the 4th quarter. Monashee Investment Management LLC now owns 245,860 shares of the company’s stock worth $1,288,000 after acquiring an additional 82,595 shares during the period. Worth Venture Partners LLC lifted its position in shares of BioNano Genomics by 1,666.6% in the 4th quarter. Worth Venture Partners LLC now owns 79,902 shares of the company’s stock worth $417,000 after acquiring an additional 75,379 shares during the period. Finally, Millennium Management LLC bought a new stake in shares of BioNano Genomics in the 4th quarter worth approximately $254,000. Institutional investors own 11.43% of the company’s stock.
BioNano Genomics Company Profile
Bionano Genomics, Inc operates as a life sciences instrumentation company in the genome analysis space. The company develops and markets the Saphyr system, a platform for ultra-sensitive and ultra-specific structural variation detection that enables researchers and clinicians to accelerate the search for new diagnostics and therapeutic targets and to streamline the study of changes in chromosomes, which is known as cytogenetics. Receive News & Ratings for BioNano Genomics Daily - Enter your email address below to receive a concise daily summary of the latest news and analysts' ratings for BioNano Genomics and related companies with MarketBeat.com's FREE daily email newsletter . Latest News"
Restoration Hardware (RH) PT Lowered to $157.00,www.dailypolitical.com,Tyrone Williams,04-03-2019,2019,4,https://www.dailypolitical.com/2019/04/02/restoration-hardware-rh-pt-lowered-to-157-00.html,"Investors Buy Large Volume of Call Options on TC Pipelines (TCP) Restoration Hardware (RH) PT Lowered to $157.00 April 2nd, 2019 - Comments Off on Restoration Hardware (RH) PT Lowered to $157.00 - Filed Under - by Tyrone Williams Tweet
Restoration Hardware (NYSE:RH) had its price target lowered by research analysts at Citigroup from $200.00 to $157.00 in a research note issued on Monday, BenzingaRatingsTable reports. The firm currently has a “buy” rating on the stock. Citigroup ‘s price objective would suggest a potential upside of 55.06% from the stock’s current price.
Several other analysts have also issued reports on RH. Zacks Investment Research lowered shares of Restoration Hardware from a “buy” rating to a “hold” rating in a research report on Monday. Bank of America reiterated an “underperform” rating and issued a $85.00 price target on shares of Restoration Hardware in a research report on Friday, March 29th. Loop Capital dropped their price target on shares of Restoration Hardware to $140.00 and set a “buy” rating for the company in a research report on Friday, March 29th. They noted that the move was a valuation call. Stifel Nicolaus dropped their price target on shares of Restoration Hardware from $180.00 to $145.00 and set a “buy” rating for the company in a research report on Friday, March 29th. Finally, Wedbush reiterated an “outperform” rating and issued a $160.00 price target on shares of Restoration Hardware in a research report on Friday, March 29th. One equities research analyst has rated the stock with a sell rating, twelve have issued a hold rating and nine have assigned a buy rating to the company’s stock. Restoration Hardware currently has a consensus rating of “Hold” and a consensus price target of $145.56. Get Restoration Hardware alerts:
Shares of NYSE RH opened at $101.25 on Monday. The company has a debt-to-equity ratio of 26.22, a current ratio of 0.74 and a quick ratio of 0.16. The company has a market cap of $2.19 billion, a P/E ratio of 11.86, a price-to-earnings-growth ratio of 0.63 and a beta of 1.55. Restoration Hardware has a 12-month low of $84.19 and a 12-month high of $164.49. Restoration Hardware (NYSE:RH) last announced its earnings results on Thursday, March 28th. The company reported $3.00 earnings per share (EPS) for the quarter, beating the consensus estimate of $2.83 by $0.17. The company had revenue of $671.00 million during the quarter, compared to analyst estimates of $686.44 million. Restoration Hardware had a net margin of 6.01% and a return on equity of 522.94%. The firm’s quarterly revenue was up .1% compared to the same quarter last year. During the same period in the previous year, the business posted $1.69 earnings per share. Equities research analysts anticipate that Restoration Hardware will post 9.33 EPS for the current year.
An institutional investor recently raised its position in Restoration Hardware stock. Boston Advisors LLC grew its position in Restoration Hardware Holdings, Inc (NYSE:RH) by 13.1% in the fourth quarter, according to the company in its most recent Form 13F filing with the Securities and Exchange Commission (SEC). The firm owned 34,103 shares of the company’s stock after purchasing an additional 3,945 shares during the quarter. Boston Advisors LLC owned approximately 0.16% of Restoration Hardware worth $4,087,000 as of its most recent filing with the Securities and Exchange Commission (SEC).
About Restoration Hardware
RH, together with its subsidiaries, operates as a retailer in the home furnishings. It offers products in various categories, including furniture, lighting, textiles, bath ware, décor, outdoor and garden, tableware, and child and teen furnishings. The company provides its products through its retail galleries; and Source Books, a series of catalogs, as well as online through rh.com, restorationhardware.com, rhbabyandchild.com, rhteen.com, and rhmodern.com, as well as waterworks.com.
Featured Story: Golden Cross Receive News & Ratings for Restoration Hardware Daily - Enter your email address below to receive a concise daily summary of the latest news and analysts' ratings for Restoration Hardware and related companies with MarketBeat.com's FREE daily email newsletter . Latest News"
