"title, publication, authors, date, year, month, url, content"
Sharpton: 'Big Mistake' for Democrats to Try to 'Out-Trump Trump' | Breitbart,www.breitbart.com,DreamKilla2.0,04-03-2019,2019,4,https://www.breitbart.com/clips/2019/04/03/sharpton-its-a-big-mistake-to-out-trump-trump/#post-83,About as easy as out$hitting a $hithead.
Watch - New Ad Tells Trump: Reject 'Koch Brothers Cheap Labor Agenda',www.breitbart.com,Chris,04-03-2019,2019,4,https://www.breitbart.com/politics/2019/04/03/fair-ad-koch-bros-white-house/#post-94,"99 out of 100 politicians are either:
corrupt before they get in office or
corrupted before they leave office.
Why? because the deep state are frightened by ""outsiders""; you know, anyone that can't be bought. So the deep state will work together to ""get something on the outsider or buy them off. You will know them by the fruits of their labor. Don't listen to what politicians say or promise, pay attention to what they have previously voted and supported."
Texas Senate: 'Crisis' at Mexican Border Is an 'Emergency',www.breitbart.com,msck2010,04-03-2019,2019,4,https://www.breitbart.com/border/2019/04/03/texas-senate-crisis-at-mexican-border-is-an-emergency/#post-5,"Until the Federal government stands up and does its job in California and Texas this disease will spread.
We need a HERO"
Sharpton: 'Big Mistake' for Democrats to Try to 'Out-Trump Trump' | Breitbart,www.breitbart.com,Ed,04-03-2019,2019,4,https://www.breitbart.com/clips/2019/04/03/sharpton-its-a-big-mistake-to-out-trump-trump/#post-68,Exactly. It shocks me that there's even Breitbart readers in denial of this!
Texas Senate: 'Crisis' at Mexican Border Is an 'Emergency',www.breitbart.com,larry king,04-03-2019,2019,4,https://www.breitbart.com/border/2019/04/03/texas-senate-crisis-at-mexican-border-is-an-emergency/#post-8,"This is the Dem party's dirty plot to allow as many illegals into the US as possible, and make them vote for the Dem party, so they will turn our country into a socialist country, and the Dem socialists will take and keep the power forever.
."
Sharpton: 'Big Mistake' for Democrats to Try to 'Out-Trump Trump' | Breitbart,www.breitbart.com,Rider,04-03-2019,2019,4,https://www.breitbart.com/clips/2019/04/03/sharpton-its-a-big-mistake-to-out-trump-trump/#post-79,"In Nevada, they have perfected the art of the election steal. First, the started with early voting. When that didn't yield them the results they desired, The precinct voting essentially ended, and you can go anywhere in the county to vote. The resulted in a virtual democrat sweep of offices up for election. This, despite republicans polling up by double digits in most races. There was voter fraud on an epic scale in Nevada, but nobody investigated!"
Sharpton: 'Big Mistake' for Democrats to Try to 'Out-Trump Trump' | Breitbart,www.breitbart.com,P Smith,04-03-2019,2019,4,https://www.breitbart.com/clips/2019/04/03/sharpton-its-a-big-mistake-to-out-trump-trump/#post-82,"Agreed 100%. CT has a leftist governor because poll people in Hartford and Bridgeport first got the statewide counts and only then ""found"" enough absentee ballots to elect him. I would keep absentee voting for the military."
Texas Senate: 'Crisis' at Mexican Border Is an 'Emergency',www.breitbart.com,JugEarsButtHurt,04-03-2019,2019,4,https://www.breitbart.com/border/2019/04/03/texas-senate-crisis-at-mexican-border-is-an-emergency/#post-17,"You wouldn’t know that dumping 2000 illegal aliens per day in the middle of McAllen and El Paso was an emergency by watching Senator Cornyn. I want to remind Texans that that jerk is up for reelection in 2020, and I think it’s way past time to run a primary challenger who feels a little more urgency about protecting the state."
Texas Senate: 'Crisis' at Mexican Border Is an 'Emergency',www.breitbart.com,heckle_and_jeckle,04-03-2019,2019,4,https://www.breitbart.com/border/2019/04/03/texas-senate-crisis-at-mexican-border-is-an-emergency/#post-23,We have too many RINO's in Texas. It was all a facade. fake RED state
Sharpton: 'Big Mistake' for Democrats to Try to 'Out-Trump Trump' | Breitbart,www.breitbart.com,Sapper 9,04-03-2019,2019,4,https://www.breitbart.com/clips/2019/04/03/sharpton-its-a-big-mistake-to-out-trump-trump/#post-86,"The hand writing is on the wall. A huge wall could be built today and it would make no difference because there are 40-65M illegals already here. Who will soon be voting exclusively for their leftist handlers. With the prospect of being perpetually in the minority, we on the right must take steps to thwart this outcome. The only solution is separation from them before a hot civil war. We can never accept minority status."
Sharpton: 'Big Mistake' for Democrats to Try to 'Out-Trump Trump' | Breitbart,www.breitbart.com,theamericanhippie,04-03-2019,2019,4,https://www.breitbart.com/clips/2019/04/03/sharpton-its-a-big-mistake-to-out-trump-trump/#post-80,"You may be right and I am not a lawyer. The proportional vote is done in some states now. I believe 17 (I think) states have already passed the popular vote = all electors laws. I think this can only be challenged in court AFTER the next presidential election in which it matters otherwise the parties to a suit would have no standing since no harm would have been done yet. Once a leftist is elected it would be too late. Nadler, et al, are playing with shinny objects like RUSSIA!!! so that we conservatives are too distracted...to our cost, IMHO."
Texas Senate: 'Crisis' at Mexican Border Is an 'Emergency',www.breitbart.com,Bravo Zulu,04-03-2019,2019,4,https://www.breitbart.com/border/2019/04/03/texas-senate-crisis-at-mexican-border-is-an-emergency/#post-27,"That's why the military calls WE The People civilians, not citizens. That's where the desensitizing begins."
Sharpton: 'Big Mistake' for Democrats to Try to 'Out-Trump Trump' | Breitbart,www.breitbart.com,Ratified1791,04-03-2019,2019,4,https://www.breitbart.com/clips/2019/04/03/sharpton-its-a-big-mistake-to-out-trump-trump/#post-84,Sharpton may be a fraudster but he is not stupid.
Sharpton: 'Big Mistake' for Democrats to Try to 'Out-Trump Trump' | Breitbart,www.breitbart.com,opto,04-03-2019,2019,4,https://www.breitbart.com/clips/2019/04/03/sharpton-its-a-big-mistake-to-out-trump-trump/#post-88,"I think it is though. We don’t own any of the vehicles for messaging. We don’t own the (education) indoctrination mills, media, social network sites, search engines, etc. The regressive Left owns all of it. For example, why is it that there are zero tech guys who are Conservative/freedom leaning that have yet to set up an opposing search engine to Google or on-line merchant like Amazon and PayPal?"
Sharpton: 'Big Mistake' for Democrats to Try to 'Out-Trump Trump' | Breitbart,www.breitbart.com,Cerise Rowan,04-03-2019,2019,4,https://www.breitbart.com/clips/2019/04/03/sharpton-its-a-big-mistake-to-out-trump-trump/#post-94,"My understanding is they do when there is no question on citizenship. Since that question has not been on the census since the '70's or so, no one really knows but I firmly believe it will yield truth or the leftists would not be fighting so hard against it with Soros money amoung others."
Texas Senate: 'Crisis' at Mexican Border Is an 'Emergency',www.breitbart.com,heckle_and_jeckle,04-03-2019,2019,4,https://www.breitbart.com/border/2019/04/03/texas-senate-crisis-at-mexican-border-is-an-emergency/#post-28,"There AG needs to file suit against the Executive & Legislative Branches for failure to uphold Article 4, Section 4 of the US Constitution."
Sharpton: 'Big Mistake' for Democrats to Try to 'Out-Trump Trump' | Breitbart,www.breitbart.com,Jones,04-03-2019,2019,4,https://www.breitbart.com/clips/2019/04/03/sharpton-its-a-big-mistake-to-out-trump-trump/#post-100,Wa state uses the same method. Mail in ballots are easily manipulated.
Texas Senate: 'Crisis' at Mexican Border Is an 'Emergency',www.breitbart.com,Dave Levine,04-03-2019,2019,4,https://www.breitbart.com/border/2019/04/03/texas-senate-crisis-at-mexican-border-is-an-emergency/#post-35,Austin is fine.
Sharpton: 'Big Mistake' for Democrats to Try to 'Out-Trump Trump' | Breitbart,www.breitbart.com,Cerise Rowan,04-03-2019,2019,4,https://www.breitbart.com/clips/2019/04/03/sharpton-its-a-big-mistake-to-out-trump-trump/#post-89,and when is he going to stop talking about closing the border and do it?
Sharpton: 'Big Mistake' for Democrats to Try to 'Out-Trump Trump' | Breitbart,www.breitbart.com,Cerise Rowan,04-03-2019,2019,4,https://www.breitbart.com/clips/2019/04/03/sharpton-its-a-big-mistake-to-out-trump-trump/#post-90,Please reference that speech.
Texas Senate: 'Crisis' at Mexican Border Is an 'Emergency',www.breitbart.com,AST Manager,04-03-2019,2019,4,https://www.breitbart.com/border/2019/04/03/texas-senate-crisis-at-mexican-border-is-an-emergency/#post-9,Is every kid being vaccinated?
Texas Senate: 'Crisis' at Mexican Border Is an 'Emergency',www.breitbart.com,larry king,04-03-2019,2019,4,https://www.breitbart.com/border/2019/04/03/texas-senate-crisis-at-mexican-border-is-an-emergency/#post-12,We Texans need to build our own damn wall.
Sharpton: 'Big Mistake' for Democrats to Try to 'Out-Trump Trump' | Breitbart,www.breitbart.com,Mid Mo Conservative,04-03-2019,2019,4,https://www.breitbart.com/clips/2019/04/03/sharpton-its-a-big-mistake-to-out-trump-trump/#post-96,"Hey genius, when you go on a conservative site, you tend to get conservative views.
Huffington isn’t exactly equal opportunity, but liberal hypocrisy is nothing new!"
Texas Senate: 'Crisis' at Mexican Border Is an 'Emergency',www.breitbart.com,LucySmooch,04-03-2019,2019,4,https://www.breitbart.com/border/2019/04/03/texas-senate-crisis-at-mexican-border-is-an-emergency/#post-15,"That's why keeping the draft would have been a good idea.
Citizen soldiers have minds of their own, and won't fire on their neighbors where professional career soldiers well..maybe."
Texas Senate: 'Crisis' at Mexican Border Is an 'Emergency',www.breitbart.com,Sharon Marie Guidry,04-03-2019,2019,4,https://www.breitbart.com/border/2019/04/03/texas-senate-crisis-at-mexican-border-is-an-emergency/#post-56,"That's the answer I wanted to hear to a question I posed years ago:
Semper Fidelis, But To Whom?
United We Stand Second Amendment In Hand."
Texas Senate: 'Crisis' at Mexican Border Is an 'Emergency',www.breitbart.com,Enoch,04-03-2019,2019,4,https://www.breitbart.com/border/2019/04/03/texas-senate-crisis-at-mexican-border-is-an-emergency/#post-65,Has AOC finished construction of that train yet?
Texas Senate: 'Crisis' at Mexican Border Is an 'Emergency',www.breitbart.com,Ray R,04-03-2019,2019,4,https://www.breitbart.com/border/2019/04/03/texas-senate-crisis-at-mexican-border-is-an-emergency/#post-45,we can return the favor.
Texas Senate: 'Crisis' at Mexican Border Is an 'Emergency',www.breitbart.com,cut#27,04-03-2019,2019,4,https://www.breitbart.com/border/2019/04/03/texas-senate-crisis-at-mexican-border-is-an-emergency/#post-21,"With 16"" steel posts and proper braces and free floating aluminum supports by the hundreds. No problem"
Texas Senate: 'Crisis' at Mexican Border Is an 'Emergency',www.breitbart.com,Powderhound,04-03-2019,2019,4,https://www.breitbart.com/border/2019/04/03/texas-senate-crisis-at-mexican-border-is-an-emergency/#post-39,you have someone in mind?
Texas Senate: 'Crisis' at Mexican Border Is an 'Emergency',www.breitbart.com,maggie mae,04-03-2019,2019,4,https://www.breitbart.com/border/2019/04/03/texas-senate-crisis-at-mexican-border-is-an-emergency/#post-69,Good luck. You might find some on MARS. $$$$ buys people.
Texas Senate: 'Crisis' at Mexican Border Is an 'Emergency',www.breitbart.com,SocialMediaWarrior,04-03-2019,2019,4,https://www.breitbart.com/border/2019/04/03/texas-senate-crisis-at-mexican-border-is-an-emergency/#post-74,"Don't blame Texans. TX is a border state getting the full brunt of foreign invading breeds who, once they've worked their way into the U.S. via FAULTY IMMIGRATION LAWS, are taught how to ILLEGALLY VOTE by the millions in our elections. IGNORANT FREEBIE SEEKING FOREIGNERS vote Democrat. The Democrat party counts on them."
Texas Senate: 'Crisis' at Mexican Border Is an 'Emergency',www.breitbart.com,White Clowns,04-03-2019,2019,4,https://www.breitbart.com/border/2019/04/03/texas-senate-crisis-at-mexican-border-is-an-emergency/#post-47,problem is nobody runs against that pink skinned panty waist
Texas Senate: 'Crisis' at Mexican Border Is an 'Emergency',www.breitbart.com,SocialMediaWarrior,04-03-2019,2019,4,https://www.breitbart.com/border/2019/04/03/texas-senate-crisis-at-mexican-border-is-an-emergency/#post-80,"When I look at my own political education I think the voting age should be 30-35. It wasn't until that age I cared enough to really learn American history. My misspent youth didn't seem like it at the time, and I have no regrets, it was a different time.
I do thank a Washington State ex-sheriff whose daughter I dated for handing me a book he never thought I'd read. Richard Nixon: The Man Behind the Mask by Gary Allen was a book I read while cutting cedar on the Olympic peninsula at age 20. The information germinated in my mind as I observed the world following the course foretold. The seed that book planted finally sprouted."
Watch - New Ad Tells Trump: Reject 'Koch Brothers Cheap Labor Agenda',www.breitbart.com,flash,04-03-2019,2019,4,https://www.breitbart.com/politics/2019/04/03/fair-ad-koch-bros-white-house/#post-69,"The WALL? Here it is in living color:
https://www.youtube.com/wat...
https://www.youtube.com/wat...
https://www.youtube.com/wat...
https://www.youtube.com/wat..."
Texas Senate: 'Crisis' at Mexican Border Is an 'Emergency',www.breitbart.com,Frank Castle,04-03-2019,2019,4,https://www.breitbart.com/border/2019/04/03/texas-senate-crisis-at-mexican-border-is-an-emergency/#post-86,"Yes, but not to kill fellow citizens...."
Watch - New Ad Tells Trump: Reject 'Koch Brothers Cheap Labor Agenda',www.breitbart.com,Bullet2354,04-03-2019,2019,4,https://www.breitbart.com/politics/2019/04/03/fair-ad-koch-bros-white-house/#post-75,How many Senators and Representatives can you buy with that pile of cash?
Texas Senate: 'Crisis' at Mexican Border Is an 'Emergency',www.breitbart.com,john born again in the usa,04-03-2019,2019,4,https://www.breitbart.com/border/2019/04/03/texas-senate-crisis-at-mexican-border-is-an-emergency/#post-93,They go invade foreign countries with out hesitation no questions asked innocent people in their own country killed by American solders why no t us?
Texas Senate: 'Crisis' at Mexican Border Is an 'Emergency',www.breitbart.com,RavviOli,04-03-2019,2019,4,https://www.breitbart.com/border/2019/04/03/texas-senate-crisis-at-mexican-border-is-an-emergency/#post-98,"That is what happened last time. but that was over 200 years ago. According to most historians, we are overdue."
Watch - New Ad Tells Trump: Reject 'Koch Brothers Cheap Labor Agenda',www.breitbart.com,Jeff Omarah,04-03-2019,2019,4,https://www.breitbart.com/politics/2019/04/03/fair-ad-koch-bros-white-house/#post-78,"In ""safe districts"" a lot of congress people run unopposed so there is literally no alternative. Gerrymandered districts mean that even if someone of the opposing party does run they stand zero chance. Incumbents have the support of the party and all their resources (if they play according to swamp rules) so running against an incumbent is an almost insurmountable task. This is the reality of the situation and has less to do with apathy."
Watch - New Ad Tells Trump: Reject 'Koch Brothers Cheap Labor Agenda',www.breitbart.com,Jeff Omarah,04-03-2019,2019,4,https://www.breitbart.com/politics/2019/04/03/fair-ad-koch-bros-white-house/#post-82,Shut up libtard
Watch - New Ad Tells Trump: Reject 'Koch Brothers Cheap Labor Agenda',www.breitbart.com,bin04,04-03-2019,2019,4,https://www.breitbart.com/politics/2019/04/03/fair-ad-koch-bros-white-house/#post-86,Your stupid and know nothing
Watch - New Ad Tells Trump: Reject 'Koch Brothers Cheap Labor Agenda',www.breitbart.com,James1754,04-03-2019,2019,4,https://www.breitbart.com/politics/2019/04/03/fair-ad-koch-bros-white-house/#post-91,Pound sand Trump cult member!
Watch - New Ad Tells Trump: Reject 'Koch Brothers Cheap Labor Agenda',www.breitbart.com,Chris,04-03-2019,2019,4,https://www.breitbart.com/politics/2019/04/03/fair-ad-koch-bros-white-house/#post-96,"Not just me, everyone who supports it should send it to Trump via Twitter/email/mail/phone .
If 1000's do it, he will take it up seriously."
Watch - New Ad Tells Trump: Reject 'Koch Brothers Cheap Labor Agenda',www.breitbart.com,teapartydudeabides,04-03-2019,2019,4,https://www.breitbart.com/politics/2019/04/03/fair-ad-koch-bros-white-house/#post-7,"For years we thought the Bush family were on our side...the right, conservative side. Trump exposed them for what they really care about...themselves."
Watch - New Ad Tells Trump: Reject 'Koch Brothers Cheap Labor Agenda',www.breitbart.com,Dana Garcia,04-03-2019,2019,4,https://www.breitbart.com/politics/2019/04/03/fair-ad-koch-bros-white-house/#post-10,Kochsters were always about global money tricks.
Watch - New Ad Tells Trump: Reject 'Koch Brothers Cheap Labor Agenda',www.breitbart.com,Robert Edward Lee,04-03-2019,2019,4,https://www.breitbart.com/politics/2019/04/03/fair-ad-koch-bros-white-house/#post-13,"I am not for eliminating the money. It is free speech.
But the Morality Argument needs to be made.
And NO ONE (except the NRA) is buying off politicians to PROTECT THE CONSTITUTION. 99% of Lobbyists are writing checks to basically 'alter' it/regulations to their favor. And much of that is to directly 'sell out' America."
Texas Senate: 'Crisis' at Mexican Border Is an 'Emergency',www.breitbart.com,John Baker,04-03-2019,2019,4,https://www.breitbart.com/border/2019/04/03/texas-senate-crisis-at-mexican-border-is-an-emergency/#post-59,They are trained to do what they are told to do!
Watch - New Ad Tells Trump: Reject 'Koch Brothers Cheap Labor Agenda',www.breitbart.com,frogface,04-03-2019,2019,4,https://www.breitbart.com/politics/2019/04/03/fair-ad-koch-bros-white-house/#post-56,"I can't sleep at night worrying that some
Wall Street execs don't have their own private jets..."
Texas Senate: 'Crisis' at Mexican Border Is an 'Emergency',www.breitbart.com,LarryJ ✓ᴰᵉᵖˡᵒʳᵃᵇˡᵉ,04-03-2019,2019,4,https://www.breitbart.com/border/2019/04/03/texas-senate-crisis-at-mexican-border-is-an-emergency/#post-84,"New M<exico is="""" the="""" big="""" sleeper,="""" no="""" news="""" here..="""" but="""" deming="""" looks="""" like="""" little="""" guatamala..="""">"
Watch - New Ad Tells Trump: Reject 'Koch Brothers Cheap Labor Agenda',www.breitbart.com,Vlad-the-Emailer,04-03-2019,2019,4,https://www.breitbart.com/politics/2019/04/03/fair-ad-koch-bros-white-house/#post-27,"I won't kill your mother for $300. Actually no amount of money will make me do that.
So there are boundaries.
There are at least moral limits to Self-Maximization. And our Politicians know VERY WELL the consequences of the policies they 'slip into' legislation.
As John Adams stated rather plainly-
Our Constitution was made only for a moral and religious People. It is wholly inadequate to the government of any other"
Watch - New Ad Tells Trump: Reject 'Koch Brothers Cheap Labor Agenda',www.breitbart.com,Bill Thompson,04-03-2019,2019,4,https://www.breitbart.com/politics/2019/04/03/fair-ad-koch-bros-white-house/#post-38,Bushs' 'one world order' speech exposed him... but no one seemed to mind at the time.
Texas Senate: 'Crisis' at Mexican Border Is an 'Emergency',www.breitbart.com,Gary Last,04-03-2019,2019,4,https://www.breitbart.com/border/2019/04/03/texas-senate-crisis-at-mexican-border-is-an-emergency/#post-55,"Congress will order it in their constitutional right to put down we """"INSURGENTS."""
Texas Senate: 'Crisis' at Mexican Border Is an 'Emergency',www.breitbart.com,Kris,04-03-2019,2019,4,https://www.breitbart.com/border/2019/04/03/texas-senate-crisis-at-mexican-border-is-an-emergency/#post-66,It's more FEDERAL CONGRESS than STATE that ALL Americans need to address. Texas government cannot fight for the entire U.S.
Watch - New Ad Tells Trump: Reject 'Koch Brothers Cheap Labor Agenda',www.breitbart.com,Bill Thompson,04-03-2019,2019,4,https://www.breitbart.com/politics/2019/04/03/fair-ad-koch-bros-white-house/#post-31,The American electorate is too distracted/disinterested/dumb to do anything about what exactly? Election cycle feedback? Those polls of Americans' opinion of Congress are dumb propaganda. Americans poll as far more satisfied by their actual Congressional representatives. The satisfaction with Congress polling measures Americans' attitude toward everybody else's representative (and by extension the rest of America).
Watch - New Ad Tells Trump: Reject 'Koch Brothers Cheap Labor Agenda',www.breitbart.com,Caius Keys,04-03-2019,2019,4,https://www.breitbart.com/politics/2019/04/03/fair-ad-koch-bros-white-house/#post-42,"Agree. If Trump is smart enough , he should pass E.O to ban all terror/crime/drug linked persons from coming to America and those who advocate for them should lose their assets/citizenship and deported/jailed as terror agents.
Unless this is done there will be never ending cases . And America will become like canada/EU
Like this Left/Liberal Loons Run Country has been turned into ISIS/jihadi base https://tinyurl.com/y74v5327
But corrupt MSM will not talk about it"
Watch - New Ad Tells Trump: Reject 'Koch Brothers Cheap Labor Agenda',www.breitbart.com,bookish1,04-03-2019,2019,4,https://www.breitbart.com/politics/2019/04/03/fair-ad-koch-bros-white-house/#post-61,"Trump exposed them, half of trumps staff are ex bush people? !! HAHAHA"
Texas Senate: 'Crisis' at Mexican Border Is an 'Emergency',www.breitbart.com,doug hutsell,04-03-2019,2019,4,https://www.breitbart.com/border/2019/04/03/texas-senate-crisis-at-mexican-border-is-an-emergency/#post-68,He's following Pelosi's mouthing.
Texas Senate: 'Crisis' at Mexican Border Is an 'Emergency',www.breitbart.com,dan b,04-03-2019,2019,4,https://www.breitbart.com/border/2019/04/03/texas-senate-crisis-at-mexican-border-is-an-emergency/#post-100,That is also one way to reduce the prison populations in your state... parole on the condition they travel to one of the mentioned states and never return...
Watch - New Ad Tells Trump: Reject 'Koch Brothers Cheap Labor Agenda',www.breitbart.com,Art,04-03-2019,2019,4,https://www.breitbart.com/politics/2019/04/03/fair-ad-koch-bros-white-house/#post-45,"No, the Bush family was never conservative, at best they are moderates. The Bush family is simply ELITIST POLITICIANS and always have been"
Watch - New Ad Tells Trump: Reject 'Koch Brothers Cheap Labor Agenda',www.breitbart.com,frogface,04-03-2019,2019,4,https://www.breitbart.com/politics/2019/04/03/fair-ad-koch-bros-white-house/#post-37,"BS I wanna know what your job is and Union Bashing never ends
Hey if you value me I want to value you and assuredly I will keep your views and cost saving ideas to judge you"
Texas Senate: 'Crisis' at Mexican Border Is an 'Emergency',www.breitbart.com,partsmaker,04-03-2019,2019,4,https://www.breitbart.com/border/2019/04/03/texas-senate-crisis-at-mexican-border-is-an-emergency/#post-72,"And they expect us to fight for them, to save their jobs, their lives, their America.
Isn't it always the way?"
Watch - New Ad Tells Trump: Reject 'Koch Brothers Cheap Labor Agenda',www.breitbart.com,Miamiboy76,04-03-2019,2019,4,https://www.breitbart.com/politics/2019/04/03/fair-ad-koch-bros-white-house/#post-49,"A lot of this is caused by party politics. These people trust political parties for some reason and the republicans were wrongly associated with conservatism. I would argue that the vast number of so called republicans, walking through the halls of power are no closer being conservative than Obama, Piglousy or Hillary.
The condition of America PROVES that."
Watch - New Ad Tells Trump: Reject 'Koch Brothers Cheap Labor Agenda',www.breitbart.com,Caius Keys,04-03-2019,2019,4,https://www.breitbart.com/politics/2019/04/03/fair-ad-koch-bros-white-house/#post-65,"I won't say it's the only reason, but part of the reason is that the quality of the mainstream news media is so poor and uninformative that people don't know a great deal that we need to know."
Watch - New Ad Tells Trump: Reject 'Koch Brothers Cheap Labor Agenda',www.breitbart.com,Bullet2354,04-03-2019,2019,4,https://www.breitbart.com/politics/2019/04/03/fair-ad-koch-bros-white-house/#post-53,"How is this any different than the slavery issue that led to the Civil War? They wanted cheap labor back then, not much has changed"
Texas Senate: 'Crisis' at Mexican Border Is an 'Emergency',www.breitbart.com,Sharon Marie Guidry,04-03-2019,2019,4,https://www.breitbart.com/border/2019/04/03/texas-senate-crisis-at-mexican-border-is-an-emergency/#post-51,"I am none of those things. But, I AM a Software Engineer. ATX is great for that, and for great food, nightlife and outdoors activities. Maybe YOU need to get out of the basement more, and quit pretending only alt-righters deserve to breathe air."
Texas Senate: 'Crisis' at Mexican Border Is an 'Emergency',www.breitbart.com,Enoch,04-03-2019,2019,4,https://www.breitbart.com/border/2019/04/03/texas-senate-crisis-at-mexican-border-is-an-emergency/#post-61,You first need to send the leftists back to California.
Texas Senate: 'Crisis' at Mexican Border Is an 'Emergency',www.breitbart.com,Sharon Marie Guidry,04-03-2019,2019,4,https://www.breitbart.com/border/2019/04/03/texas-senate-crisis-at-mexican-border-is-an-emergency/#post-49,ALL the soldiers I know will NOT fire on fellow Americans. They have sworn a duty to the Constitution and an oath to not follow an order that is in direct opposition to that duty.
