"A warning for democracy, not a eulogy",www.brusselstimes.com,,04-03-2019,2019,4,http://www.brusselstimes.com/opinion/14777/a-warning-for-democracy-not-an-eulogy,"A warning for democracy, not a eulogy Tuesday, 02 April 2019 16:53 Alicja Gescinska Alicja Gescinska is a Belgian-Polish philosopher and novelist. Thierry Baudet founder and leader of the right wing political party Forum for Democracy voting at a polling station in Amsterdam, March 20, 2019. Share on Facebook Share on Twitter ‘A blow of the hammer.’ That is how Dutch writer and essayist Bas Heijne captured the sentiment prevailing among many Dutch after the recent elections. Forum for Democracy (FvD) came out of the Provincial States elections as the country’s biggest party. FvD is a text-book, right-wing populist party. Many fear we are witnessing the end of democracy, or at least the beginning of the end. All across the globe populists are on the rise, most visibly on the right, attempting to undermine the pillars of democracy: freedom, solidarity, toleration, non-discrimination, respect. Now even the Netherlands – renowned for their love of liberty and their talent for tolerance – are haunted by the spectre of populism.One must however be cautious not to draw too preliminary and one-sided conclusions about the state of Dutch democracy. The political landscape is quite fragmented, and it has definitely not been a landslide victory. The party of current prime minister Mark Rutte managed to minimize the loss, and will lose one seat in the First Chamber. The heaviest blows have been delivered to the Christian-Democrats, the left-wing liberals, and also to Geert Wilder’s PVV. Hence, the rise of FvD coincides with the decline of Wilder’s extreme-right, anti-Islam party. The Dutch are definitely not on the populist path to illiberal democracy. Holland will not soon become a Hungary by the North Sea, or a Poland in the polders. The opposition to FvD is much stronger than its support. Therefore, we must not panic, but we must be deeply concerned. Here are a few reasons why. Savior of civilization We are beginning to get familiar with the populist strategy. FvD has meticulously and diligently followed the text-book. There is the use of a false dichotomy between the elite and the people. ‘The elite’ is being blamed for betraying their own country, while the party leaders of FvD themselves of course happily belong to the elite they pretend to despise. There is the praise for Putin and authoritarian figures. There is climate-change denial, fact-free politics and a whole bunch of alternative truths and complete lies. There is the overly one-sided anti-immigration perspective, with immigrants and the EU getting blame for problems they hardly have anything to do with. Nostalgia And then there is the one sin I find unforgivable: the exploitation of nostalgia. Where once nostalgia was a sweet sentiment of sadness, synonymous with the music of Chopin and the poems of Alan Tate, it is now a political instrument. Nostalgo-nationalist rhetoric is a key component of the populist strategy. Thierry Baudet, founder of FvD, sees himself as a savior, ‘standing on the ruins of what was once the best of civilizations.’ Sexism Sexism too is a recurrent leitmotiv in the right-wing populist’s strategy. And it is also present in FvD. Baudet is the author of a novel that is bad in so many ways, not least because of the misogyny that sprouts from every page. Evidently, a writer is not responsible for the horrible things his characters do or say. But in interviews Baudet does little to sharpen the line between fiction and reality. He has shown a remarkable willingness to claim on camera, without a slightest hint of hesitation, that women are, by their very own nature, less competent in most jobs, obedient and not really capable of thinking for themselves either. While the world is full of advocates of gender equality, we must not turn a blind eye to a group that is getting increasingly louder: those who openly challenge rights and capabilities of women. It isn’t hard to see that the effect on society in general and the labour market in particular of having political leaders voicing such views and mainstreaming them is likely to be quite damaging. A lost civic virtue In short: FvD’s rhetoric involves a great deal of talk that one would nowadays not even get away with being drunk in a bar, but which for some reason has become acceptable in the political arena. Respect was once a moral and civic virtue. Now it is disrespectfulness with which many votes are won. Baudet masters the art of blatantly insulting people like few others. He has, to give just one example, celebrated his election victory by describing prime minister Rutte as a worthless piece of stupidity. As is so often the case with populists: the problem is not only what is being said, but also how it is being said. Baudet does not seem interested in reasoned arguments. He addresses gut-feelings and seeks to exploit them. No surprise While many reacted to FvD’s success with shock and astonishment, their success doesn’t come as a surprise. We have all been able to witness the growing popularity of the party that was founded in 2015, first as a think tank and alternative political movement. We have also been able to witness what the party stands for. Baudet is completely open about his views, as expressed in an endless chain of tweets and interviews. The success of FvD is founded on its use of social media. It is not a surge to power consolidated in the backrooms and corridors of politics. It all happens out in the open. ‘Democracy dies in darkness’, is the Wall Street Journal’s famous catchphrase. Yet there is reason to believe that in our era, democracy dies in broad day light too. On Twitter. On Facebook. On the streets. Many people no longer feel the need to hide their anti-democratic feelings and convictions. Prophets of doom I have never felt comfortable in the company of prophets of doom. We have heard it all too often over the past few years. The West is collapsing. Democracy is a thing of the past. A new world war is imminent. I don’t think we are witnessing an Untergang des Abendlandes. My faith in most people is stronger than my fear of some people. Liberal democracy can perish, but it won’t go down without a fight. We must not bury democracy before she has died. But we must begin to cure her, before she is dead. A remedy There is not a single remedy for our political system and society. But we must combat lies and alternative truths with reason. We must restore respect where there is now disdain. We must advocate a politics of compassion to counter the politics of resentment. We must listen to what people are saying, understand their worries and grievances, and offer a better and more humane solution than the one offered by those who want to recruit feelings without subjecting them to examination. Surely that is what democracy implies. Simply to dismiss popular feeling is to betray the democratic mission. But most of all: we must be clear about what is at stake. The most important struggle in politics today is not a struggle between left and right, rich and poor, so-called elites and the common people. It is a struggle between defenders of liberal democracy and its enemies. Given the historical relevance of the forthcoming European elections in May, it is important to bear this in mind. The future of Europe is not doomed, but it is at stake. By Alicja Gescinska Share on Facebook Share on Twitter Latest from Alicja Gescinska"
Airport security staff threaten to go on strike,www.brusselstimes.com,,04-03-2019,2019,4,http://www.brusselstimes.com/belgium/14762/airport-security-staff-threaten-to-go-on-strike,"Airport security staff threaten to go on strike Monday, 01 April 2019 18:22 © Belga Security staff and guards could take strike action at Belgium’s airports from Saturday, the start of the Easter holidays, their labour federation, FGTB, warned on Monday. The workers are calling for salaries more in keeping with their workloads and the atypical schedules they are subjected to, according to the FGTB (Fédération général du Travail de Belgique). Among other things, they want more pay for Saturday, Sunday and night work and higher call-back allowances.Strike notice served one month ago by the unions in the airport security sector expires on Friday. The management of companies that operate in the sector, mainly Securitas and Group 4, made proposals last week, particularly regarding staff in charge of the safety of passengers and luggage, but these do not go far enough, according to Mathieu London of the FGTB For now, union representatives in the various airports are independently organising the actions that could be taken on Saturday.However, unions and management are scheduled to meet on Thursday. Much will depend on any new proposals that management might come up with, and the unions’ responses to them. Jason Bennett"
Poultry and pigeon holders warned of potential spread of contagious disease,www.brusselstimes.com,,04-03-2019,2019,4,http://www.brusselstimes.com/belgium/14761/poultry-and-pigeon-holders-warned-of-potential-outbreak-of-contagious-disease,"Poultry and pigeon holders warned of potential spread of contagious disease Monday, 01 April 2019 17:47 A chicken displaying signs of Newcastle disease. UC Davis School of Veterinary Medicine A protection zone of 500 meters has been set up in Willemeau, Wallonia, after a pigeon was discovered to have the highly contagious Newcastle disease. While not dangerous to humans, Newcastle Disease is a highly contagious viral infection that affects many species of domestic and wild birds to varying degrees.As a result of the discovery, all poultry and pigeon holders in the area have been asked to return the duly completed animal inventory form with proof of valid vaccination, within seven days, at the Animal Welfare Department in Tournai.Newcastle disease does not occur in humans from eating poultry products. In very rare instances people working directly with sick birds can become infected. Symptoms are usually very mild, and limited to conjunctivitis and/or influenza-like symptoms. Infection is easily prevented by using standard personal protective equipment.The disease can result in digestive, respiratory and/or nervous clinical signs, which range from a mild, almost inapparent respiratory disease to very severe depression, drop in egg production, increased respiration, profuse diarrhoea followed by collapse, or long-term nervous signs (such as twisted necks), if the birds survive. Severe forms of the disease are highly fatal. Jules Johnston"
Half of Flemish adopting parents do not finish the process,www.brusselstimes.com,,04-03-2019,2019,4,http://www.brusselstimes.com/belgium/14771/half-of-flemish-adoptive-parents-don-t-finish-the-process,"Half of Flemish adopting parents do not finish the process Tuesday, 02 April 2019 13:12 1 in 2 parents don't finish the adoption procedure. Edward Eyers/Pexels Almost half of the Flemish looking to adopt end up not going through with the adoption process. 48,8% of candidate-parents tend to drop out because the procedure is too cumbersome or keeps dragging on, according to Het Nieuwsblad . Sometimes, it even happens that there aren't enough candidate-parents and too many children.Ariane Van den Berghe, the Flemish adoption officer, put the percentages in perspective, explaining that candidate-parents are regularly found unfit, or quit midway through the procedure because they unexpectedly managed to get pregnant, for example. ""In some instances, it's true that there aren't enough parents, but those are very specific situations. Some kids have special needs, or they are already a little older.""The international exchange can be difficult as well. For children from some countries, the procedure is extra difficult and that takes more time. ""The conditions are sometimes really strict,"" clarified Van den Berghe. ""The parents-to-be have to be married for a specific amount of time, religion is important, procedures can be expensive."" It's not always so obvious.Now, the goal is to focus on these difficult situations to create more space for an accelerated intake procedure. ""Reduced waiting times will limit the number of candidate-parents dropping out.""In practice, the waiting time varies depending on the specific situation. For some candidates, the procedure goes very quickly, but for some countries, it can take up to 7 or 8 years. ""Those are the people I want to support, that way we can make sure these people don't quit part way through,"" said Van den Berghe. Maïthé Chini"
Major delays predicted for Easter vacation throughout Europe,www.brusselstimes.com,,04-03-2019,2019,4,http://www.brusselstimes.com/belgium/14773/red-easter-weekend-on-roads-throughout-europe,"Major delays predicted for Easter vacation throughout Europe Tuesday, 02 April 2019 14:05 © Belga Roads look set to be congested on the Easter weekend throughout Europe, Touring announced on Monday in a press release. Code-red congestion is to be expected as people leave for the Easter vacation on 19 and 20 April and on Easter Monday, 22 April, when most will be returning home.On the other hand, the start of the Spring break will be smoother since Belgians will be just about the only people in Europe already on vacation, with other countries going on holiday later.Touring forecasts traffic snags (orange) for departures on Friday 5 April and Saturday 6 April in Belgium and Switzerland, then on Friday 12 and Saturday 13 April in Belgium, Germany, Austria and Switzerland.Sundays will be ideal for travelling: 7 and 14 April are coded “green”. Travel will be much more complicated on the Easter weekend. For departures, traffic will be very dense from late Friday morning to Saturday morning. Touring thus advises motorists to leave early Friday morning or late Friday evening and Saturday from noon onward.Saturday 20 April is expected to be extremely difficult in Île-de-France, and for south-bound travel (red).On the return journeys, sizeable queues are to be expected on Easter Monday in the late afternoon and evening. Monday 22 April is coded red in northwest France and Île-de-France. Oscar Schneider"
Koekelberg accident driver: I feel like a victim myself,www.brusselstimes.com,,04-03-2019,2019,4,http://www.brusselstimes.com/brussels/14769/driver-fatal-accident-in-koekelberg-i-feel-like-a-victim-myself,"Koekelberg accident driver: ‘I feel like a victim myself’ Tuesday, 02 April 2019 11:09 William Murphy/Flickr The driver who fatally hit a pedestrian in Koekelberg on Sunday admits he was wrong, but doesn’t show a lot of remorse. The driver, Houssem-Eddine B., told his side of the story in the newspapers Het Nieuwsblad and La Capitale today. “I decided to take over the wheel from a drunk friend after a night out. I feel like I’m a victim as well.”A 30-year-old woman from Brussels died in the accident on Avenue de Jette in Koekelberg. She left Parc Elisabeth in Koekelberg at around 11.30 a.m. and wanted to cross Avenue de Jette via the pedestrian crossing at Rue De Neck. Two vehicles stopped to let the woman cross, but a Volkswagen Polo, with Houssem-Eddine B. behind the wheel, drove past the stationary cars along the right side of the bicycle path and hit the woman head-on. The driver was not under the influence of alcohol but only had his provisional driving license.“The car in front of me slowed down. I thought he wanted to take the left turn and tried to take him over on the right. I was only going 40 kilometres per hour. Don’t get me wrong; I feel bad about it,” the 19-year-old said.“We were returning from a night out. A friend of mine was driving; it was her car. But she was really drunk, and going 100 where you are only allowed 50. That’s why I decided to take over the wheel.” Maïthé Chini"
Ryanair joins Europes top-10 CO2 emitting companies,www.brusselstimes.com,,04-03-2019,2019,4,http://www.brusselstimes.com/business/14776/ryanair-joins-europe-s-top-10-co2-emitters,"Ryanair joins Europe’s top-10 CO2 emitting companies Tuesday, 02 April 2019 14:46 © Belga Ryanair has now become one of Europe’s 10 biggest CO2-emitters, the Transport & Environment (T&E) organisation reported on Tuesday, based on data from the European Commission. This is the first time that an airline has made the top 10, usually dominated by companies active in the coal sector, according to T&E, which campaigns for cleaner transport in Europe based on the principles of sustainable development. Ryanair is in 10 th place, with its CO2 emissions amounting to 9.8 million tonnes in 2018, 7% more than in 2017. Its emissions dwarf those of Brussels Airline, for example, which gave off some 780,000 tonnes of CO2 last year.Belgium’s main emitters are ArcelorMittal in Ghent (4.4 million tonnes), Electrabel’s Knippegroen electricity plant in Ghent (4.6 million tonnes) and the Total refinery in Antwerp (3.6 million tonnes).In Europe, CO2 emissions have decreased overall by 4.2% but in the air industry they have gone up by 5.7%.According to T&E, the authorities have not been doing enough to monitor CO2 emissions in the air-transport sector which, moreover, does not pay taxes on its fuel or VAT on its tickets. Jason Bennett"
Koekelberg accident: Police recorded driving in cycle lane,www.brusselstimes.com,,04-03-2019,2019,4,http://www.brusselstimes.com/brussels/14775/koekelberg-accident-police-recorded-driving-in-cycle-lane,"Koekelberg accident: Police recorded driving in cycle lane Tuesday, 02 April 2019 15:17 VRM screenshot A recording made by VTM NEWS has shown a police vehicle driving on a cycle path in Koekelberg, where a young woman fatally hit by a car on Sunday. VTM journalists made the recording of several cars - including a police vehicle - driving along a cycle path in Koekelberg. The journalists then decided to show these images to the mayor, Ahmed Laaouej, who denounced the act, telling them to give the video to the police.A 30-year-old woman from Brussels died in the accident on Avenue de Jette in Koekelberg. She left Parc Elisabeth in Koekelberg at around 11.30 a.m. and wanted to cross Avenue de Jette via the pedestrian crossing at Rue De Neck.Two vehicles stopped to let the woman cross, but a Volkswagen Polo drove past the stationary cars along the right side of the bicycle path and hit the woman head-on. The driver was not under the influence of alcohol but only had his provisional driving license.""We will identify the car and determine who the driver was. Then we will rightly inform the director,"" said Johan Berckmans, police chief of the Brussels West zone on seeing the action of the police car, according to reports. The Brussels Times"
"Nearly 45,000 vehicles have personalized licence plates",www.brusselstimes.com,,04-03-2019,2019,4,http://www.brusselstimes.com/belgium/justice/14772/nearly-45-000-vehicles-have-a-personalized-licence-plate,"Nearly 45,000 vehicles have personalized licence plates Tuesday, 02 April 2019 13:23 © Belga In Belgium, 44,900 cars (0.85%) have a personalized license plate, according to Federal Minister of Mobility François Bellot in response to Veli Yüksel (CD&V, Flemish Christian Democrats). Since 2014, when legislation on personalized plates was relaxed, the measure has added 26.2 million euros to the State coffers. Seeing this success, late in 2015, the government raised the fee for a personalized plate from 1,000 to 2,000 euros. The number of new requests declined sharply, as well as the their ""contribution"", plunging from 6.4 million in 2015 to 3.3 million in 2017. In December 2017, the price was lowered again to 1,000 euros, which proved to be successful. Last year, 6.008 people requested a personalized plate, which is almost the same number as in 2015. The Brussels Times"
Plan B: Labour rebels squeeze Jeremy Corbyn – POLITICO,www.politico.eu,msn.com,04-03-2019,2019,4,https://www.politico.eu/article/labour-rebels-hatch-new-plan-to-fight-jeremy-corbyn-liverpool-uk-london-conference/,MPs launch ‘Project Anaconda’ in guerrilla war to control UK Labour Party’s ruling politburo.
"Radiation concerns halt Brussels 5G development, for now",www.brusselstimes.com,,04-03-2019,2019,4,http://www.brusselstimes.com/brussels/14753/radiation-concerns-halt-brussels-5g-for-now,"Radiation concerns halt Brussels 5G development, for now Monday, 01 April 2019 10:54 © Belga Plans for a pilot project to provide high-speed 5G wireless internet in Brussels have been halted due to fears for the health of citizens, according to reports. In July, the government concluded an agreement with three telecom operators to relax the strict radiation standards in Brussels. But according to the Region, it is now impossible to estimate the radiation from the antennas required for the service. ""I cannot welcome such technology if the radiation standards, which must protect the citizen, are not respected, 5G or not,"" Environment minister Céline Fremault (CDH) told Bruzz. ""The people of Brussels are not guinea pigs whose health I can sell at a profit. We cannot leave anything to doubt,"" she added.A pilot project is not feasible with the current radiation standards, and Fremault told Bruzz that she does not intend to make an exception.The Brussels region has particularly strict radiation standards for telecom applications. The standard of 6 volts per metre has already led to problems in the past with providing fast mobile internet via 4G in the capital. Last week, the various governments in Belgium once again failed to reach agreement on the auctioning of the 5G licences . The file remains stuck on the distribution of the proceeds. It will be up to the next government to handle the proposal, said Telecom Minister Philippe De Backer (Open VLD) last week. The Brussels Times"
Brussels tunnel closed due to a ventilation problem,www.brusselstimes.com,,04-03-2019,2019,4,http://www.brusselstimes.com/brussels/14767/brussels-tunnel-closed-due-to-a-ventilation-problem,"Brussels tunnel closed due to a ventilation problem Tuesday, 02 April 2019 10:48 wikipedia Due to a problem with ventilation, the Leopold II tunnel in Brussels had to close a traffic lane in the direction of Gare du Midi on Tuesday morning. The situation created disturbances for the traffic in and around the tunnel. Bruxelles-Mobilité indicated that the situation should be resolved around 11am. #TunnelBru , suite à un incident, l'entrée Charles Quint du tunnel Léopold II direction Midi est fermée. — Info-trafic Bruxelles Mobilité (@MobirisFr) April 2, 2019 The Brussels Times"
Residents mistake art for car bomb,www.brusselstimes.com,,04-03-2019,2019,4,http://www.brusselstimes.com/belgium/14778/bomb-alert-for-a-work-of-art,"Residents mistake art for car bomb Tuesday, 02 April 2019 17:00 © Belga Deminers from Heverlee rushed to the Stavelot-Malmedy area on Sunday at 7.00 a.m. in response to citizen fears of a car bomb in the town. Passers-by had reported a suspicious vehicle there in the small hours of the morning, licensed in the UK, with wires sticking out of it. Strange boxes and garbage bags were stacked on the front seat, it was mistaken for a car bomb.As a precaution, police and the deminers decided to strip the vehicle completely but found nothing alarming. On closer inspection, the material inside the car was found to look very much like equipment for a party, complete with sound boxes. The police were able to question the driver, an Englishman who had come to Belgium for a festival of contemporary art to be held in Brussels.His car? One of the future exhibits for the festival. Maria Novak"
Imagining the Mueller Report Uncensored,www.allgov.com,,04-03-2019,2019,4,http://www.allgov.com/news?news=860504,"“…difficult issues…”
“…while this report does not conclude that the President committed a crime, it also does not exonerate him.”
“…the evidence does not establish that the President was involved in an underlying crime related to Russian election interference.”
What if the context of the first and last excerpts are…
“ Although there are numerous instances of President Trump’s associates and family members meeting with and otherwise communicating with Russian individuals engaged in interfering with the 2016 U.S. election on Trump’s behalf, the investigation did not establish that members of the Trump Campaign conspired or coordinated with the Russian government in its election interference activities.”
“ Although the investigation uncovered numerous examples of Donald Trump engaging in activities that would be considered criminal if committed by an individual who was not the sitting president of the United States, the evidence does not establish that the President was involved in an underlying crime related to Russian election interference.” David Wallechinsky"
