"In ‘White Man’s Culture’ Remarks, Biden Shows How Little He Knows About History",www.dailysignal.com,Ben Shapiro,04-03-2019,2019,4,https://www.dailysignal.com/2019/04/03/in-white-mans-culture-remarks-biden-shows-how-little-he-knows-about-history/,"Former Vice President Joe Biden speaks during the 2019 Biden Courage Awards at the Russian Tea Room on March 26, 2019, in New York City. (Photo: Cindy Ord/Stringer/Getty Images) Commentary By Ben Shapiro / @benshapiro Ben Shapiro is host of ""The Ben Shapiro Show"" and editor-in-chief of DailyWire.com. He is The New York Times best-selling author of ""Bullies."" He is a graduate of UCLA and Harvard Law School, and lives with his wife and two children in Los Angeles.
Last week, former Vice President Joe Biden spoke at the Biden Courage Awards ceremony in preparation for his presidential campaign launch. There, in an attempt to forestall claims that as a white man, he simply isn’t intersectional enough to compete in the Democratic primaries, he critiqued a central pillar of Western civilization as inherently racist.
“Back in the late 1300s, so many women were dying at the hands of their husbands because they were chattel, just like the cattle, or the sheep, that the court of common law decided they had to do something about the extent of the deaths,” Biden fibbed.
So you know what they said? No man has a right to chastise his woman with a rod thicker than the circumference of his thumb. This is English jurisprudential culture, a white man’s culture. It’s got to change. It’s got to change.
Biden’s take was, as always, historically illiterate. The “rule of thumb” story has been circulating for years—and it has been repeatedly debunked. There was no “rule of thumb,” as feminist scholar Christina Hoff Sommers points out.
“On the contrary,” she writes, “British law since the 1700s and our American laws predating the Revolution prohibit wife beating.” In actuality, the phrase originated in craftsmen so expert that they could perform tasks without precise measuring tools.
More importantly, however, Biden’s characterization of “English jurisprudential culture” as “white man’s culture” is profoundly disturbing.
English jurisprudential culture is rooted in the belief in the rule of law, due process of law, equal rights under law; English jurisprudential culture is responsible for preserving the natural rights we hold dear, rights which were imperfectly but increasingly extended over time to more and more human beings, particularly minorities.
No less a leftist figure than Barack Obama explained just that in 2009, saying he sought a system at Guantanamo Bay that “adheres to the rule of law, habeas corpus, basic principles of Anglo-American legal system.”
Protection of individual rights—and in particular, minority rights—lies at the heart of English jurisprudence. Yet Biden boiled down those rights to racial privilege.
And the attempt to reduce the fundamental principles of our civilization to a mask for racial hierarchical power is both false and frightening. It suggests that those principles ought to be undermined for purposes of disestablishing that supposed hierarchy. Get rid of English jurisprudential law, presumably, in order to fight racism.
Ironically, reduction of Western civilization to racial supremacy isn’t just a strategy of the intersectional left; it’s a strategy of the despicable alt-right, which champions Western civilization as white civilization and then seeks to rip away the universalism of its principles from nonwhite people.
Thus, the very term “Western civilization” is under assault by a variety of political forces seeking to tear out eternal truths and natural rights in the name of tribalism.
But that’s not what Western civilization is about at all. Western civilization was built on Judeo-Christian values and Greek reason, culminating in a perspective on natural rights that is preserved by institutions like English jurisprudence.
It is thanks to those philosophical principles that free markets, free speech, and free association have grown and flourished. Only if we re-enshrine those principles, rather than undermine them, will our prosperity and freedoms be preserved.
COPYRIGHT 2019 CREATORS.COM"
Thumb rule for selecting filter frequency cut off,www.edaboard.com,treez,04-03-2019,2019,4,https://www.edaboard.com/showthread.php?383434-Thumb-rule-for-selecting-filter-frequency-cut-off,"Thumb rule for selecting filter frequency cut off Hi I am experimenting with analog and digital filters. Would like to know the thumb rule for selecting filter frequency cut off. I want to realize 4th order filter by combining analog + digital How should I choose analog filter cut off, sampling rate and digital filter cutoff. Requirement is 100Hz 4th order Re: Thumb rule for selecting filter frequency cut off Originally Posted by garimella thumb rule for selecting filter frequency cut off. The raw formula for capacitors: f= 1 / (2 Pi R C) Besides a resistor or resistors which are in plain sight, often a neighboring component has some unknown or unseen resistance, which must be taken into account. - - - Updated - - - Inductors also are used in filters. There is a formula for cutoff frequency with inductors. However capacitors tend to be more convenient to use for high-pass or low-pass, especially at small Ampere levels. Re: Thumb rule for selecting filter frequency cut off Hi, The above formula is correct, but only for first order RC filter. You asked about 4th order. My personal opinion: There is no rule of thumb. It depends. First please give some basic informations: * LPF, BPF, HPF? * filter at the ADC side or DAC side * does the filter frequency need to be adjustable? Now you say you want 4th order. It's telling me you have requirements that call for a 4th order filter. But we don't know this requirements. I assume you already know that there is no ideal filter * A filter always causes amplitude- and phase errors at the passband. * and a filter always has a finite steepness at the stop band Thus the cutoff frequency (usually at -3dB ) needs to have some distance to yor frequency range of interest And the cutoff frequency needs to have some distance to the frequencies you want to suppress. Thus it's urgent that you first define your requiremens in values with units, no vague text. * pass band: min and max frequency, max amplitude error. Optional: phase requirements, setup time * Stop band: frequency range you want to suppress, and how much you need to attenuate them. Also tell us more about your application. Is it audio, or do you want to build a scope, do you have a fixed sample frequency, what resolution, what processing power, what's the input signal, what's the information you are interested in? Klaus Please don´t contact me via PM, because there is no time to respond to them. No friend requests. Thank you."
Architectural sector enjoys rapid growth,www.cambodiadaily.com,,04-03-2019,2019,4,https://www.cambodiadaily.com/business/architectural-sector-enjoys-rapid-growth-147363/,"Home Business Architectural sector enjoys rapid growth A-SmileArt Architecture & Construction director Thorng Linthong discusses the progress of Cambodia’s architectural sector. HIN PISEI Architectural sector enjoys rapid growth By - April 3, 2019
Along with the rapid growth of the Kingdom’s construction industry, use of architectural services has also dramatically increased.
With more than a decade of work experience, Thorng Linthong, the director of A-SmileArt Architecture & Construction – an architectural design and construction company – met with The Post’s Hin Pisei to discuss the progress of Cambodia’s architectural sector.
In full: https://www.phnompenhpost.com/business-post-property/architectural-sector-enjoys-rapid-growth © 2019, The Cambodia Daily . All rights reserved No part of this article may be reproduced in print, electronically, broadcast, rewritten or redistributed without written permission."
"Margaux Senlis photographs the effects of unexploded ordnance in Vietnam, Cambodia and Laos",www.cambodiadaily.com,,04-03-2019,2019,4,https://www.cambodiadaily.com/culture/margaux-senlis-photographs-the-effects-of-unexploded-ordnance-in-vietnam-cambodia-and-laos-147352/,"Home Culture Margaux Senlis photographs the effects of unexploded ordnance in Vietnam, Cambodia and... Margaux Senlis: UXO Margaux Senlis photographs the effects of unexploded ordnance in Vietnam, Cambodia and Laos By - April 3, 2019
“I used to love looking at old family pictures trying to imagine all the stories behind them,” says Paris-born photographer Margaux Senlis. “Then, I got my first camera at ten years old and haven’t stopped making images since.”
Following these early years of inspiration, Margaux made photography her full-time pursuit, completing a BA at Gobelins, a school of arts and visual communication in Paris, and then moving to the The National School of Photography (ENSP) in Arles, where she is currently studying a master’s degree.
In full: https://www.itsnicethat.com/articles/margaux-senlis-uxo-photography-020419 © 2019, The Cambodia Daily . All rights reserved No part of this article may be reproduced in print, electronically, broadcast, rewritten or redistributed without written permission."
Gender Equity at Factories: Cambodias Female Leadership Program,www.cambodiadaily.com,,04-03-2019,2019,4,https://www.cambodiadaily.com/business/gender-equity-at-factories-cambodias-female-leadership-program-147355/,"Home Business Gender Equity at Factories: Cambodia’s Female Leadership Program Gender Equity at Factories: Cambodia’s Female Leadership Program By - April 3, 2019
With women making up more than 80 percent of the global workforce in the apparel supply chain, LS&Co. is expanding its efforts to support and empower the women working across its supply chain.
By 2020, our Worker Well-being program, which began as a project of the Levi Strauss Foundation, will have reached more than 200,000 people in factories around the world – the vast majority of them women – providing guidance on health, economic planning, and other facets of work and life that impact well-being for individuals and families. Our Terms of Engagement for suppliers also contain stringent, zero-tolerance policies on sexual harassment and coercion in the workplace. Additionally, new programs and partnerships targeted towards women are being rolled out in several locations.
Last year, Better Factories Cambodia (BFC) and UN Women, with funding from the Levi Strauss Foundation, piloted the “Female Leadership Program” across Cambodia. Though specific to Cambodia, the program addresses conditions seen in many manufacturing regions where mostly young women work far from home, away from families and support networks, with predominantly male managers.
In full: https://www.levistrauss.com/2019/04/02/gender-equity-factories-cambodias-female-leadership-program/ © 2019, The Cambodia Daily . All rights reserved No part of this article may be reproduced in print, electronically, broadcast, rewritten or redistributed without written permission."
"Vietnamese, Cambodian religious officials hold talks",www.cambodiadaily.com,,04-03-2019,2019,4,https://www.cambodiadaily.com/news/vietnamese-cambodian-religious-officials-hold-talks-147370/,"ភាសាខ្មែរ Home News Vietnamese, Cambodian religious officials hold talks Head of Vietnam’s Government Committee for Religious Affairs Vu Chien Thang (L) and Cambodian Minister of Cults and Religion Him Chhem (Source: VNA) Vietnamese, Cambodian religious officials hold talks By - April 3, 2019
Head of Vietnam’s Government Committee for Religious Affairs Vu Chien Thang said he wishes that the Cambodian Ministry of Cults and Religion would create favourable conditions for overseas Vietnamese following Buddhism and Caodaism in the country to join religious activities.
He made the statement at his talks with Cambodian Minister of Cults and Religion Him Chhem in Phnom Penh on April 2, which forms part of his working visit to Cambodia from April 1-6.
Chhem expressed thanks to the Vietnamese voluntary soldiers, Government, and people for helping Cambodia escape the Pol Pot genocidal regime in the past, saying the future generation needs to remember this and work together to preserve solidarity.
In full: https://en.vietnamplus.vn/vietnamese-cambodian-religious-officials-hold-talks/149342.vnp © 2019, The Cambodia Daily . All rights reserved No part of this article may be reproduced in print, electronically, broadcast, rewritten or redistributed without written permission."
Singapore latest to join Asian push against fake news,www.cambodiadaily.com,,04-03-2019,2019,4,https://www.cambodiadaily.com/news/singapore-latest-to-join-asian-push-against-fake-news-147373/,"ភាសាខ្មែរ Home Media Singapore latest to join Asian push against fake news Singapore has moved to restrict fake news spread through social media, prompting concerns about the erosion of free speech. © Reuters Singapore latest to join Asian push against fake news Free speech advocates and global tech leaders fear chilling effect. By - April 3, 2019
Singapore has joined a growing campaign in Asia to crack down on fake or misleading information on the internet, prompting concerns that government-led efforts could infringe on the already limited freedom of speech in the city-state.
A sweeping bill submitted to parliament on Monday would remove or force corrections to online information considered inaccurate by government monitors. In addition to individuals and businesses responsible for the information, platform operators such as Facebook and Yahoo would be required to take action to limit the viewing of such content.
In full: https://asia.nikkei.com/Politics/Singapore-latest-to-join-Asian-push-against-fake-news © 2019, The Cambodia Daily . All rights reserved No part of this article may be reproduced in print, electronically, broadcast, rewritten or redistributed without written permission."
DC-Cam to train lecturers in course on KR genocide,www.cambodiadaily.com,,04-03-2019,2019,4,https://www.cambodiadaily.com/news/dc-cam-to-train-lecturers-in-course-on-kr-genocide-147379/,"ភាសាខ្មែរ Home News DC-Cam to train lecturers in course on KR genocide Deputy DC-Cam director So Farina (left) and Ministry of Education, Youth and Sport under-secretary of state Ton Sa Im at the ‘Cambodia’s Genocide Conference’. Heng Chivoan DC-Cam to train lecturers in course on KR genocide By - April 3, 2019
The Documentation Centre of Cambodia (DC-Cam), in collaboration with the Ministry of Education, Youth and Sport, is running a course to train 50 lecturers from 50 of the Kingdom’s universities to teach the history of the Khmer Rouge from 1975-1979.
“Cambodia’s Genocide Conference” is being held over three days from Monday to Wednesday at the Sleuk Rith Institute at Phnom Penh’s National Institute of Cambodia.
The event will focus on the history of Democratic Kampuchea and encompass sessions on “Genocide in World History”, looking at atrocities in Armenia, Bosnia-Herzegovina, Germany and Rwanda.
In full: https://www.phnompenhpost.com/national-kr-tribunal/dc-cam-train-lecturers-course-kr-genocide © 2019, The Cambodia Daily . All rights reserved No part of this article may be reproduced in print, electronically, broadcast, rewritten or redistributed without written permission."
Disappeared Activist Reportedly Found Working on Construction Site,www.cambodiadaily.com,,04-03-2019,2019,4,https://www.cambodiadaily.com/todays-top-news/disappeared-activist-reportedly-found-working-on-construction-site-147382/,"ភាសាខ្មែរ Home News ‘Disappeared’ Activist Reportedly Found Working on Construction Site FILE PHOTO - Sum Moeun, left, and his son, Mean Moeun, right, were arrested and handcuffed by the local military police. (Courtesy photo) ‘Disappeared’ Activist Reportedly Found Working on Construction Site Sum Moeun’s disappearance prompted concern from rights groups including Human Rights Watch, who suspected Moeun had “disappeared” by state security forces over his activism. By - April 3, 2019
Phnom Penh – A land rights activist who went missing for more than two months has turned up after being spotted in Preah Sihanouk province where he was working in construction, officials have claimed.
Sum Moeun’s disappearance prompted concern from rights groups including Human Rights Watch, who suspected Moeun had “disappeared” by state security forces over his activism.
But the Preah Vihear local’s reappearance appears to have put to bed the suggestion that the security forces were involved in his absence from public life.
In full: https://www.voacambodia.com/a/disappeared-activist-reportedly-found-working-on-contruction-site/4858681.html © 2019, The Cambodia Daily . All rights reserved No part of this article may be reproduced in print, electronically, broadcast, rewritten or redistributed without written permission."
Invader Zim was a good show.,lunaticoutpost.com,,04-03-2019,2019,4,http://lunaticoutpost.com/thread-119882.html,Invader Zim was a good show. Advertisement RE: Invader Zim was a good show. I smell a trap. Smells like tacos... RE: Invader Zim was a good show. strange candy reminds me of Gaz 
Obama Or Trump Impeach Trump,lunaticoutpost.com,,04-03-2019,2019,4,http://lunaticoutpost.com/thread-119881.html,"Post: #1 Obama Or Trump Impeach Trump
Advertisement It is all I see on advertising while viewing googletube/youtube videos sometimes 4 or 5 times and also Impeach Trump Advertisments.
ALso, within past 3-4 weeks google has ramped up there forced advertising try to use blockers and it is very CPU dependent ive noticed new flower ytics also.
PATHETIC is all I can Say"
Seems like half the people on CT sites think space is fake.,lunaticoutpost.com,,04-03-2019,2019,4,http://lunaticoutpost.com/thread-119879.html,"Post: #1 Seems like half the people on CT sites think space is fake.
Advertisement Back in the good old 2012 days, people would write about Mayan prophecies, UFO's, and ghosts, etc.
Now its all crazy stuff and politics and flat earth BS. do people seriously think its flat?, or is it just one big piss taking joke?
Seems like most people here think space is fake, what is going on with humanity? I am convinced we are devolving as a species."
"The Newest AI-Enabled Weapon: ""Deep-Faking"" Photos Of The Earth",lunaticoutpost.com,,04-03-2019,2019,4,http://lunaticoutpost.com/thread-119878.html,"The Newest AI-Enabled Weapon: ""Deep-Faking"" Photos Of The Earth Advertisement The Newest AI-Enabled Weapon: ""Deep-Faking"" Photos Of The Earth Step 1: Use AI to make undetectable changes to outdoor photos. Step 2: release them into the open-source world and enjoy the chaos. Worries about deep fakes — machine-manipulated videos of celebrities and world leaders purportedly saying or doing things that they really didn’t — are quaint compared to a new threat: doctored images of the Earth itself. China is the acknowledged leader in using an emerging technique called generative adversarial networks to trick computers into seeing objects in landscapes or in satellite images that aren’t there, says Todd Myers, automation lead for the CIO-Technology Directorate at the National Geospatial-Intelligence Agency. “The Chinese are well ahead of us. This is not classified info,” Myers said Thursday at the second annual Genius Machinessummit, hosted by Defense One and Nextgov. “The Chinese have already designed; they’re already doing it right now, using GANs—which are generative adversarial networks—to manipulate scenes and pixels to create things for nefarious reasons.” For example, Myers said, an adversary might fool your computer-assisted imagery analysts into reporting that a bridge crosses an important river at a given point. “So from a tactical perspective or mission planning, you train your forces to go a certain route, toward a bridge, but it’s not there. Then there’s a big surprise waiting for you,” he said. First described in 2014, GANs represent a big evolution in the way neural networks learn to see and recognize objects and even detect truth from fiction. Say you ask your conventional neural network to figure out which objects are what in satellite photos. The network will break the image into multiple pieces, or pixel clusters, calculate how those broken pieces relate to one another, and then make a determination about what the final product is, or, whether the photos are real or doctored. It’s all based on the experience of looking at lots of satellite photos. "
Forget 'Creepy' - Biden Has A Major Ukraine Problem,lunaticoutpost.com,,04-03-2019,2019,4,http://lunaticoutpost.com/thread-119877.html,"Forget 'Creepy' - Biden Has A Major Ukraine Problem Advertisement Forget 'Creepy' - Biden Has A Major Ukraine Problem Joe Biden appears to have made a major tactical error last year when he bragged to an audience of foreign policy experts how he threatened to hurl Ukraine into bankruptcy if their top prosecutor, General Viktor Shokin, wasn't immediately fired, according to The Hill's John Solomon. In his own words, with video cameras rolling, Biden described how he threatened Ukrainian President Petro Poroshenko in March 2016 that the Obama administration would pull $1 billion in U.S. loan guarantees, sending the former Soviet republic toward insolvency, if it didn’t immediately fire Prosecutor General Viktor Shokin. -The Hill ""I said, ‘You’re not getting the billion.’ I’m going to be leaving here in, I think it was about six hours. I looked at them and said: ‘I’m leaving in six hours. If the prosecutor is not fired, you’re not getting the money,’"" bragged Biden, recalling the conversation with Poroshenko. ""Well, son of a bit*h, he got fired. And they put in place someone who was solid at the time,"" Biden said at the Council on Foreign Relations event - while insisting that former president Obama was complicit in the threat. "
"I believe I can activate wamom's ""dormant"" biological clocks....",lunaticoutpost.com,,04-03-2019,2019,4,http://lunaticoutpost.com/thread-119876.html,"I believe I can activate wamom's ""dormant"" biological clocks.... Advertisement It's early in the field study but results are staggering. This is a good thing. Excitement all around the neighborhood specifics. "
"Hey, its me, DrVIP. Wanna voice chat?",lunaticoutpost.com,,04-03-2019,2019,4,http://lunaticoutpost.com/thread-119875.html,"Post: #1 Hey, its me, DrVIP. Wanna voice chat?
Advertisement Don't agree with me?
Wanna have a discussion?
Let me know and I'd set up a discord channel/google hangout."
Dear Oppo,lunaticoutpost.com,,04-03-2019,2019,4,http://lunaticoutpost.com/thread-119874.html,"Dear Oppo Advertisement Hello, kindly requesting a system update. Android security patch level is 5th Oct 2018 (6 months old). I require such updates to keep me as a customer and give me incentive to upgrade to one of your newer technological phones in the future. Still running on android 8.1.0 after all this time. Hello, and kindly increase my battery life via your updates, other than that all is good. "
Venezuela: Pro-Maduro lawmakers strip Juan Guaido of parliamentary immunity,lunaticoutpost.com,,04-03-2019,2019,4,http://lunaticoutpost.com/thread-119873.html,"Post: #1 Venezuela: Pro-Maduro lawmakers strip Juan Guaido of parliamentary immunity
Advertisement Venezuela: Pro-Maduro lawmakers strip Juan Guaido of parliamentary immunity
Venezuela's self-declared president has been stripped of his immunity from prosecution. Guaido accused President Nicolas Maduro's ""regime"" of carrying out an ""inquisition.""
Venezuela's Constituent Assembly voted to strip opposition leader and self-declared president Juan Guaido of his parliamentary immunity Tuesday.
The move by the assembly, which is loyal to President Nicolas Maduro, could pave the way for Guaido's prosecution and potential arrest.
What you need to know
* The Constituent Assembly voted unanimously to strip Guaido of his immunity from prosecution.
* Venezuela's Supreme Court of Justice ordered the assembly to do so after Guaido violated an order banning him from leaving the country while under investigation.
* Under the constitution, withdrawing a lawmaker's immunity requires approval from the National Assembly. But the opposition-controlled chamber has not done endorsed the decision.
https://www.dw.com/en/venezuela-pro-madu...a-48172325"
Back here to let you folks know that I am ready to lead,lunaticoutpost.com,,04-03-2019,2019,4,http://lunaticoutpost.com/thread-119872.html,"Post: #1 Back here to let you folks know that I am ready to lead
Advertisement I want to tend to the users every little need. I have the nik nik nik nik nik attitude. I want folks to feel comfortable and welcome to the colony. My slogan is Welcome To They Colony. Colony Conspiracy is great. I lead differently than any other of the mods and owners lead.
I am not criticizing. Just saying we do things differently.
It is important that leaders have the nik nik nik nik nik attitude. Users have to feel like they are important and comfortable."
