VA loan limits to be lifted in 2020,https://www.housingwire.com,"['Jessica Guerin Is An Editor At Housingwire Covering Reverse Mortgages', 'The Housing Wealth Space. She Is A Graduate Of Boston University', 'Has A Master S Degree Northwestern S Medill School Of Journalism. She Worked Previously As The Editor-In-Chief Of The Reverse Review Magazine', 'Which Was Recently Acquired Housingwire.']",,,,https://www.housingwire.com/articles/49500-va-loan-limits-to-be-lifted-in-2020,"Last month, President Donald Trump signed a bill into law that allows the Department of Veterans Affairs to back loans that exceed the conforming loan limit.

The bill, H.R. 299, enables homebuyers using a VA loan to borrow above the 2019 limit of $484,350 for most counties, without any down payment.

A VA spokesperson told HousingWire that the loan limit will be lifted for loans that are guaranteed or appraised on or after January 1, 2020, and that guidance for lenders would be coming ahead of this date, published on the VA home loan circular page of its website.

The VA also clarified other changes that will go into effect as a result of the bill.

In addition to alleviating limits for veterans looking to purchase a home, H.R. 299 temporarily increase rates for certain loans by 0.15-0.30%, the VA said.

The slight bump in loan fees is intended to help finance health care costs for veterans who are suffering the effects of Agent Orange exposure as a result of their service.

Additional changes to the VA’s loan guaranty program include the elimination of funding fee differences for borrowers who are veterans versus those who are members of the Reserve.

It also removes the loan limit for the Native American Direct Loan Program, exempts Purple Heart recipients from paying loan fees, and authorizes VA-designated appraisers to rely on third parties for appraisal-related information.

The bill’s passage comes after years of lobbying on behalf of numerous trade groups, including the National Association of Realtors, which teamed with other housing industry trade groups to ensure veterans’ health care benefits would be extended without a significant increase to VA loan fees.

Now that the bill has passed, it is expected to “fast-track” disability compensation for as many as 90,000 affected former service members, according to military.com.

The VA said it does not have any formal projections as to how the changes brought on by the bill will its home loan guaranty program."
"Opioids, El Chapo, Ransomware And Mueller: 1 Year Atop DOJ's Criminal Division",https://www.npr.org,['Carrie Johnson'],07-11-2019,2019,7,https://www.npr.org/2019/07/11/740352292/opioids-el-chapo-ransomware-and-mueller-1-year-atop-dojs-criminal-division,"Opioids, El Chapo, Ransomware And Mueller: 1 Year Atop DOJ's Criminal Division

Enlarge this image toggle caption Shuran Huang/NPR Shuran Huang/NPR

Thursday marks one year since a divided Senate confirmed Brian Benczkowski to lead the Justice Department's criminal division.

The 51-48 vote reflected Democrats' worry that he'd try to interfere with the investigation into Russia's attack on the 2016 election.

Things didn't work out that way.

Benczkowski promised to consult with career officials about any possible conflicts with the special counsel probe, but he said this week that never became necessary.

""I've kept the promises that I made,"" Benczkowski said. ""I didn't have anything to do with the Mueller investigation. Nothing came across my desk. There was nothing that I had to deal with.""

Instead, Benczkowski has spent the past year advancing the administration's priorities: punishing transnational gangs; cracking down on corrupt doctors and pharmacists who fuel the opioid crisis in Appalachia and beyond; and making the process of investigating companies and business executives more transparent.

United States v. Guzman

It started with what Benczkowski said could be the biggest criminal trial in U.S. history: the effort to bring to justice former Sinaloa cartel leader Joaquin ""El Chapo"" Guzman.

That trial extended nearly three months and coincided with a federal government shutdown, bringing uncertainty to DOJ lawyers about whether their hotel bills would ever be paid.

In the end, prosecutors from the criminal division at Justice worked with their counterparts in U.S. attorney's offices in Brooklyn and Miami to secure conviction of Guzman on all 10 of the drug and conspiracy charges.

Authorities recently asked for forfeiture in the amount of $12,666,181,704. Guzman faces mandatory life imprisonment when he is sentenced in New York City on July 17.

Benczkowski said he plans to be in court to support the team.

DOJ's opioid strike force

Benczkowski expressed concern early in his tenure that DOJ wasn't targeting the region that was hardest hit by the opioid crisis. So the criminal division put together a strike force that spans 10 areas in Appalachia.

He secured approval and funding to send 14 health care fraud prosecutors into the region, culminating in dozens of indictments of doctors, pharmacists and other medical professionals last April.

That team continues to crunch data from health care providers and insurance programs to help uncover fraud. Benczkowski said he anticipates another round of prosecutions in Appalachia before the end of the year.

""We're going to keep going at it until we drive down the addiction rate and we drive down the overdose rate in those districts,"" he said.

The white-collar cases

Benczkowski said his third priority is bringing more ""transparency"" to white-collar crime investigations.

So the Justice Department issued new guidelines for prosecutors about recommending independent monitors to oversee errant corporations. Benczkowski also revamped the way that prosecutors assess whether a company is complying with the Justice Department.

Enlarge this image toggle caption Shuran Huang/NPR Shuran Huang/NPR

Now, DOJ publishes online the times it declines to bring charges against companies that have behaved appropriately and deserved credit for that.

That sends a message, he said, and it makes his own prosecutors work ""a little bit harder."" Lawyers defending companies can point to those decisions and fashion arguments for their own leniency.

""Certainly it's going to give outside lawyers a little bit more ammunition to advocate with,"" he said, arguing that transparency will make government decisions more just.

Benczkowski's comment may prove controversial with consumer protection and shareholder advocates, as well as critics who argue the Justice Department has abandoned its responsibility to police corporate misconduct.

But the Justice Department said it has charged 211 people with fraud so far this year, about half of whom have pleaded guilty, an increase from last year in the same period. Benczkowski also said financial recoveries from corporate resolutions this year will be ""well north"" of $2 billion, about double the amount in 2018.

Benczkowski said he expects to pick a new chief of the DOJ fraud section, which prosecutes such offenses, by the end of the month.

Robert Zink has been filling the job in an acting role since January and may be in line to get the job on a permanent basis, two sources told NPR.

The ransomware menace

Prosecutors are also in the middle of responding to a wave of ransomware attacks that have victimized small and midsize cities in Florida, Georgia, Maryland and elsewhere.

Benczkowski said criminal groups are becoming sophisticated in how they identify their targets: municipalities big enough to afford to pay ransom, but not so sophisticated they're prepared for these kinds of threats.

Benczkowski said he has a message for those cities:

""Invest in the basic cybersecurity protections for your systems that you need, have redundant offline systems that you can turn to in the event that you're attacked, come to law enforcement early in the process ... so that we can help you get better prepared."""
Castro responds to Obama DHS secretary criticism: Open borders are 'a right-wing talking point',https://thehill.com,[],07-11-2019,2019,7,https://thehill.com/homenews/campaign/452732-castro-responds-to-obama-dhs-secretary-criticism-open-borders-are-a-right,"Former Housing and Urban Development Secretary Julián Castro on Thursday rebuffed criticism from former Homeland Security Secretary Jeh Johnson of Castro's proposal to decriminalize unauthorized border crossings.

Castro said that Johnson's suggestion that doing so would be tantamount to having open borders echoed a ""right-wing talking point.""

Asked during a presidential candidate town hall hosted by the League of United Latin American Citizens what he thought of Johnson's so-called friendly fire, Castro said the criticism was ""obviously not friendly.""

The former San Antonio mayor also took a shot at two of his rivals in the Democratic presidential primary, former Vice President Joe Biden Joe BidenHarris on Biden civil rights record: 'Not going to allow us to engage in revisionist history' Congress must reclaim its war-making powers The Hill's Morning Report — Trump retreats on census citizenship question MORE and former Rep. Beto O'Rourke Beto O'RourkeCastro responds to Obama DHS secretary criticism: Open borders are 'a right-wing talking point' Biden, Warren top latest poll of 2020 Democratic field The Hill's 12:30 Report: Pelosi looks to squash fight with progressives MORE (D-Texas), who have come out against making illegal border crossings a civil violation rather than a criminal offense.

ADVERTISEMENT

""I would say that Secretary Johnson is wrong, Vice President Biden is wrong on this and Congressman O’Rourke is wrong on this,"" Castro said.

Castro noted that ""until about 2004, we treated crossing the border as a civil violation, not a criminal violation,"" and said by conflating that with the notion of open borders, Johnson was repeating a prominent political argument on the right.

""Secretary Johnson has suggested somehow that people will take that as open borders. Open borders are a right-wing talking point,"" he said, pointing to current enforcement mechanisms on the U.S. southern border, like existing fencing and the presence of Border Patrol agents.

He also argued that migrants crossing the border without permission often do so with the intention of presenting themselves to Border Patrol and law enforcement officials.

""They want to present themselves to our border officials,"" Castro said. ""It makes no sense to make policy based out of fear, political fear."""
State Dept. Intelligence Analyst Quits to Protest Blocked House Testimony,https://www.nytimes.com,['Coral Davenport'],07-10-2019,2019,7,https://www.nytimes.com/2019/07/10/climate/rod-schoonover-resigns.html,"Want climate news in your inbox? Sign up here for Climate Fwd:, our email newsletter.

WASHINGTON — A State Department intelligence analyst has resigned in protest after the White House blocked his discussion of climate science in Congressional testimony, according to a person familiar with the matter.

Rod Schoonover, an analyst with the State Department’s Bureau of Intelligence and Research, testified last month before the House Permanent Select Committee on Intelligence on the effects of climate change on national security. But, in a highly unusual move, the White House refused to approve Dr. Schoonover’s written testimony for entry into the permanent Congressional record.

The reasoning, according to a June 4 email reviewed by The New York Times, was that the science cited in Dr. Schoonover’s testimony did not correspond with White House views. Ultimately, Dr. Schoonover did deliver the oral testimony before the committee, but his accompanying written statement was not included in the official record of the hearing.

Dr. Schoonover did not respond to text message requesting comment. A policy expert familiar with his case confirmed that his resignation came as a direct result of the episode. His last day is expected to be Friday."
Jeffrey Epstein's new charges are a direct rebuke to Alex Acosta — no matter what Acosta says,https://www.nbcnews.com,"['Glenn Kirschner', 'Glenn Kirschner Is A Former Assistant U.S. Attorney For The District Of Columbia. He Is Currently An Nbc News Msnbc Legal Analyst.']",07-11-2019,2019,7,https://www.nbcnews.com/think/opinion/jeffrey-epstein-s-new-charges-are-direct-rebuke-alex-acosta-ncna1028751,"Jeffrey Epstein's new charges are a direct rebuke to Alex Acosta — no matter what Acosta says

The DOJ is taking a welcome stand against influence peddlers who have long attempted to use their status to undermine justice. But what about the prosecutors who enable them?"
Rep. Nunes on Christopher Steele's grilling by DOJ investigators: A lot of the dossier 'was just made up',https://www.foxnews.com,"['David Montanaro', 'David Montanaro Is An Editor With Fox News.']",,,,https://www.foxnews.com/politics/devin-nunes-christopher-steele-dossier-fbi-questioning,"Rep. Devin Nunes, the ranking Republican on the House Intelligence Committee, said Tuesday he believes the public will soon see that much of the Trump-Russia dossier compiled by former British spy Christopher Steele was ""made up.""

According to a New York Times report, FBI officials questioned one of Steele's sources and ""came to suspect that the man might have added his own interpretations to reports from his own sources that he passed on to Mr. Steele, calling into question the reliability of the information.""

Steele was interviewed as part of Justice Department Inspector General Michael Horowitz's probe of how the FBI used the unverified dossier, including its role in obtaining a surveillance warrant against then-Trump campaign adviser Carter Page.

AOC PUSHES BACK AT PELOSI, SAYS HOUSE SPEAKER'S BELITTLING OF PROGRESSIVES 'PUZZLING'

Reacting on ""Fox News @ Night,"" Nunes, R-Calif., said Steele refused to talk to the House Intelligence Committee while he served as chairman in 2017 and 2018.

""This is a man who made up this entire document. As you're starting to see it's unraveling, his sources are not real or if they are real they're second and third hand. So a lot of this is just made up out of whole cloth,"" said Nunes.

Shannon Bream then asked Nunes about a Politico report which suggested Steele's 16-hour grilling led to ""new and important information"" and could therefore ""dampen expectations among the president's allies who’ve claimed that Steele’s sensational dossier was used improperly by the bureau to 'spy' on the campaign.""

CLICK TO GET THE FOX NEWS APP

Nunes scoffed at that notion, saying either Steele had credible sources or he did not.

""The fact remains that they used that garbage that was paid for by a political campaign before a court,"" said Nunes, adding that there is information that is ""equally as bad or worse"" that has not been made public about Steele's work."
Ex-State Department employee gets more than three years in prison over Chinese intel ties,https://www.washingtonexaminer.com,[],07-10-2019,2019,7,https://www.washingtonexaminer.com/news/ex-state-department-employee-gets-more-than-three-years-in-prison-over-chinese-intel-ties,"A former State Department employee was sentenced to 40 months in prison for accepting thousands of dollars worth of gifts from Chinese intelligence agents in exchange for internal government documents.

Candace Marie Claiborne, 63, failed to disclose her repeated contacts with two agents of China’s intelligence service, who gave her cash, international travel and vacations, tuition at a Chinese fashion school, a furnished apartment, and more over five years.

In exchange, Claiborne, who was employed as an office management specialist, gave the agents copies of internal State Department documents on U.S. economic strategies and visits by dignitaries between the two countries, among other topics.

Claiborne then misled FBI and State Department investigators about her contacts with the agents and urged a co-conspirator to dispose of evidence connecting her to the agents.

She will also have three years of supervised release and a fine of $40,000.

“This is not what I had envisioned for my life. … I still don’t know how I lost myself,” Claiborne told U.S. District Court Judge Randolph Moss on Tuesday. ""I lost my job, reputation and the trust of the government. I made a terrible mistake and now I'm paying the price.""

China has seen increasing success in recruiting Americans to pass along government secrets. Since March, at least three other Americans have pleaded guilty or were convicted of espionage or attempted spying on behalf of the Chinese.

“The targeting of U.S. security clearance holders by Chinese intelligence services is a constant threat we face, and today’s sentencing shows that those who betray the trust of the American people will be held accountable for their actions,” John Selleck, the acting assistant director of the FBI’s Washington Field Office, said in a statement Tuesday.

Claiborne, who held a top secret security clearance during her employment, joined the State Department in 1999, serving in posts in China, Sudan, and Iraq until she returned to the U.S. in 2015.

The Chinese agents began paying her in 2011 for information. Prosecutors said Claiborne was aware of the consequences of her agreement with the Chinese agents, but was motivated by the financial rewards.

When renewing her security clearance in 2014, Claiborne “deliberately excluded” her contacts with the Chinese agents, the criminal complaint said. She also omitted the contacts to investigators while she continued to communicate with the agents about additional benefits and tried to hide evidence of their agreement.

The FBI also sent an undercover agent, who posed as a Chinese intelligence officer, to her home in Washington, D.C., and Claiborne invited the undercover agent into her home but never reported the contact to the U.S. government, despite the government’s requirement to do so.

Claiborne was arrested in March 2017. She pleaded guilty in April to one count of conspiracy to defraud the United States."
Second federal judge blocks Justice Dept. bid to replace census attorneys,https://www.washingtonpost.com,"['Matt Zapotosky', 'National Security Reporter Covering The Justice Department', 'July At Pm', ""Matt Zapotosky Covers The Justice Department For The Washington Post'S National Security Team. He Has Previously Worked Covering The Federal Courthouse In Alexandria"", ""Local Law Enforcement In Prince George'S County"", 'Southern Maryland.']",07-10-2019,2019,7,https://www.washingtonpost.com/national-security/second-federal-judge-blocks-justice-dept-bid-to-replace-census-attorneys/2019/07/10/4a82fb80-a35a-11e9-b732-41a79c2551bf_story.html,"A second federal judge has denied the Justice Department’s bid to withdraw its attorneys from the legal battle over adding a citizenship question to the 2020 Census, though he signaled Wednesday that he might ultimately allow the move if the new lawyers were prepared to address discrepancies between what the previous team had told the court and the Trump administration’s current posture.

U.S. District Judge George J. Hazel in Maryland wrote in a six-page order that he shared the concerns of a federal judge in New York who similarly blocked the Justice Department maneuver this week, but noted that in his district, unlike the other judge’s, attorneys do not have to provide “satisfactory reasons for withdrawal.” He wrote he was concerned that “a shift in counsel at this late stage may be disruptive to an already complicated and expedited case.”

But Hazel also wrote that he was “inclined to ultimately permit the withdrawal” — if the Justice Department would, among other things, provide assurances that the new team was “aware of and prepared to address potential conflicts between recent developments in this case and positions repeatedly taken before this Court by the withdrawing attorneys.”

[Federal judge rejects Trump administration’s bid to swap out lawyers for census case on citizenship question]

The decision marks yet another headache for the Justice Department in what has become a fraught case. Earlier this week, the department sought to replace the team of lawyers assigned to it, after at least some career attorneys on the case grew frustrated with the Trump administration’s sudden shift in position on whether it could keep fighting.

That fight, which once seemed at its end, intensified Wednesday when a group of conservative lawmakers wrote a letter to Attorney General William P. Barr urging him to support President Trump adding the question to the census by executive order.

The letter controversially states that assessing the citizenship question is “germane to carrying out our duty to apportion representatives.”

The Trump administration has denied that adding the question is meant to boost its political fortunes through redistricting, but many Democrats charge that the question is meant to scare away Latinos from participating in the census, resulting in an undercount of that population.

The department filed motions this week to remove the lawyers in cases that are ongoing in multiple federal courts.

U.S. District Judge Jesse Furman of the Southern District of New York was the first judge to block the move, though he said the Justice Department could refile its request and provide more specific reasons for the change.

Hazel wrote that, because the Justice Department already had entered new lawyers into the case, his denying their request to replace the team would “not prevent the attorneys who have been representing the Defendants’ interests thus far from simply receding into the background as new counsel take the lead.”

He wrote he was “less focused on the formality of whose names appear at the bottom of future pleadings and more focused on the need for a transition of counsel that does not disrupt the orderly administration of justice.”

Hazel added that “while the Court is inclined to ultimately permit the withdrawal, under the unique circumstances of this request, more specific assurances will first need to be provided.”

The department, he wrote, would “need to provide specific assurances to the Court that one or more of the withdrawing attorneys are remaining available to the new DOJ team, as necessary, or provide detailed reasoning for why such an arrangement is untenable.” He questioned whether the new team could proceed without any help from the previous lawyers.

“As a practical matter, the Court cannot fathom how it would be possible, at this juncture, for a wholesale change in Defendants’ representation not to have some impact on the orderly resolution of these proceedings unless Defendants provide assurance of an orderly transition between the withdrawing attorneys and new counsel,” Hazel wrote. “This requires more than just the effort of the new DOJ team, but the involvement and availability of the withdrawing attorneys.”

Hazel also noted that the new lawyers should be prepared to address questions about the previous lawyers’ possibly misleading assertions to the court. Just last week, those lawyers believed the matter was over, because of an imminent deadline to start printing census forms and a Supreme Court decision that prevented the administration from adding a citizenship question. But Trump ordered the department to keep looking for ways to continue the fight, raising questions about what it had earlier told the court about the deadline.

“Defendants must realize that a change in counsel does not create a clean slate for a party to proceed as if prior representations made to the Court were not in fact made,” Hazel wrote. “A new DOJ team will need to be prepared to address these, and other, previous representations made by the withdrawing attorneys at the appropriate juncture.”

A Justice Department spokeswoman declined to comment.

Colby Itkowitz contributed to this report."
Treasury yields continue comeback on the week after another report shows rising inflation,https://www.cnbc.com,['Yun Li'],07-12-2019,2019,7,https://www.cnbc.com/2019/07/12/us-bonds-traders-await-fresh-data.html,"The yield on 10-year Treasury note hit a one-month high on Friday, on pace to post its biggest weekly gain since April after recent data showed hotter-than-expected inflation.

The rate on the benchmark Treasury note, which moves inversely to price, rose to 2.1310%, the highest since June 11. The yield on the 30-year Treasury bond was also higher at around 2.6535%.

The U.S. consumer price index — a widely followed measure of inflation — rose more than expected last month, with the core CPI posting its biggest gain in one and a half years.

The Labor Department said on Friday its producer price index for final demand edged up 0.1% last month after a similar gain in May. Economists polled by Reuters had forecast the PPI unchanged in June.

""Another core inflation surprise... PPI drives in-range downtrade,"" Ian Lyngen, head of U.S. rates strategy at BMO, said in a note. The inflation number is ""marginally bearish for the Treasury market and as yields come off this morning's lows.""

The yield on the benchmark 10-year note had fallen below 2% this month on expectations global central banks would respond to a slowing global economy with more monetary stimulus. The rate started coming back after a blowout June jobs report boosted the confidence on the U.S. economy.

Wall Street rallied to a record high on Thursday, after testimony by Federal Reserve Chair Jerome Powell this week that signaled easier monetary policy could be implemented later this month."
