title, publication, authors, date, year, month, url, content
Utah judge suspended without pay for 6 months after critical comments about Trump,https://www.foxnews.com,"['Nicole Darrah', 'Nicole Darrah Covers Breaking', 'Trending News For Foxnews.Com. Follow Her On Twitter At']",,,,https://www.foxnews.com/us/utah-judge-suspended-critical-comments-trump,"A judge in Utah was suspended without pay for six months last week after criticizing President Trump — both online and in court — for his ""political incompetence.""

Judge Michael Kwan, who's been a justice court judge in Taylorsville, a suburb of Salt Lake City, since 1998. Between 2016 and 2017, he shared inappropriate posts on Facebook and LinkedIn about the president, according to Utah's State Supreme Court.

TRUMP: 'SLEEPY JOE BIDEN' HASN'T 'APOLOGIZED' FOR INVOLVEMENT IN 1994 CRIME LAW

Kwan violated the judicial code of conduct and lessened ""the reputation of our entire judiciary,"" Justice John Pearce wrote in an opinion on Wednesday.

""Judge Kwan's behavior denigrates his reputation as an impartial, independent, dignified, and courteous jurist who takes no advantage of the office in which he serves,"" Pearce said.

An investigation was opened after Kwan made comments about Trump during court in 2017, KSTU reported. He told a defendant who said he planned to use his tax refund for his court fees that he would need to pray in order to get a tax return because of Trump's proposed border wall along the southern border.

“Prayer might be the answer. ‘Cause, [Trump] just signed an order to start building the wall and he has no money to do that, and so if you think you are going to get taxes back this year, uh-yeah, maybe, maybe not,"" Kwan reportedly said. ""But don’t worry, there is a tax cut for the wealthy so if you make over $500,000 you’re getting a tax cut.""

TRUMP SEIZES ON NYU PROFESSOR'S TWEET TO PUSH CHANGE OF LIBEL LAWS

On Inauguration Day in 2017, Kwan posted online: ""Welcome to governing. Will you dig your heels in and spend the next four years undermining our country's reputation and standing in the world? . . . Will you continue to demonstrate your inability to govern and political incompetence?""

The following month, he wrote: ""Welcome to the beginning of the fascist takeover. . . We need to be diligent in questioning Congressional Republicans if they are going to be the American Reichstag and refuse to stand up for the Constitution.""

An attorney for the judge — who was first appointed by elected city officials to a six-year term and was later voted in to keep the position — said that, like many others, Kwan felt strongly about the 2016 elections. Kwan, however, recognizes that judges are held to a higher standard.

CLICK HERE TO GET THE FOX NEWS APP

""He certainly regrets making those statements and is committed to not doing anything like that again,"" attorney Greg Skordas told The Associated Press.

It's unknown what Kwan's political affiliation is because he chooses to keep his voter registration private, an option available to any state voter, Justin Lee, director of elections for Utah's state elections, said.

Skordas noted the judge has been reprimanded previously during his career for comments critical of politicians from both major parties.

The Associated Press contributed to this report."
"Savior of G.M. Lordstown Plant, Hailed by Trump, Is a Corporate Cipher",https://www.nytimes.com,"['Nelson D. Schwartz', 'Matthew Goldstein', 'Neal E. Boudette']",05-28-2019,2019,5,https://www.nytimes.com/2019/05/28/business/economy/trump-gm-workhorse-lordstown.html,"For months, President Trump had been putting pressure on the chief executive of General Motors, Mary T. Barra, because she had decided to idle an Ohio factory and lay off 1,600 workers. “I am not happy that it is closed when everything else in our Country is BOOMING,” he said on Twitter. “I asked her to sell it or do something quickly.”

In early May, it seemed an answer was at hand. From her spacious office on the 39th floor of the Renaissance Center in Detroit, Ms. Barra called the president on May 8 to update him. The automaker was in negotiations to sell the plant in Lordstown, Ohio, to a new company affiliated with a little-known electrical vehicle maker called Workhorse.

G.M. planned to announce the talks that afternoon along with a $700 million investment elsewhere in Ohio. But Mr. Trump beat the company to the punch, posting on Twitter that the Lordstown sale was practically a done deal. It wasn’t — but that was the least of the problems with what the president said.

The new venture, whose name remains secret, exists almost entirely on paper. Headed by the founder and former chief executive of Workhorse, Steve Burns, the business would have to raise at least $300 million to get Lordstown running again."
"Trump tax return strategy could backfire, recent court decisions indicate",https://www.foxnews.com,['Ronn Blitzer'],,,,https://www.foxnews.com/politics/recent-court-decisions-indicate-trump-tax-return-strategy-could-backfire,"The Trump administration is fighting back against the House Democratic push to obtain the president's past tax returns, but two court decisions in recent days indicate it's possible the administration's strategy could backfire.

Recent rulings from two federal courts went against President Trump in his efforts to block subpoenas from financial institutions. If the White House's arguments for withholding Trump's tax returns also fail to convince a judge, an ensuing appeal might only serve to delay the exposure until closer to the 2020 election -- when the president would prefer to talk about other issues.

WELLS FARGO, TD BANK TURN OVER TRUMP FINANCIAL RECORDS TO HOUSE DEMS

Michael Stern, a former senior counsel in the House of Representatives' Office of General Counsel, told Politico, ""I don't think anyone would say that it's impossible for there to be a final order for him to produce the tax returns by the middle of next year."" That would be in the heat of Trump's re-election campaign.

First, Judge Amit Mehta of the D.C. District Court ruled that accounting firm Mazars USA must comply with a House Oversight Committee subpoena for Trump's financial documents. Then Judge Edgardo Ramos of the Southern District of New York ruled similarly regarding the House Financial Services and Intelligence Committees' suboenas issued to Deutsche Bank and Capital One.

Whether a president's tax returns enjoy greater protection remains to be seen. University of Iowa Law Professor Andy Grewal says in his recent paper ""The President's Tax Returns"" that court precedent may be on Trump's side, at least for the time being.

Grewal notes that while congressional committees do have broad authority to request a person's tax returns, that power is not unlimited. Such requests must be made with a legitimate legislative purpose. He cites the Supreme Court's 1957 decision in Watkins v. United States, which pointed to the need for Congress to act in relation to ""a legitimate task,"" and 1880's Kilbourn v. Thompson, which said that Congress' investigation of the Navy Secretary was improper, but ""the whole aspect of the case would have been changed"" had it been in the context of an impeachment inquiry.

Based on those cases, Grewal argues, Congress may not have the authority to presently demand Trump's tax returns, as they have not opened an impeachment investigation.

House Speaker Nancy Pelosi, D-Calif., stated earlier this month that using an impeachment probe as an excuse to get documents could work, even if the investigation does not lead to impeachment. Grewal's paper appears to support the validitiy of this idea, but so far House Democrats have resisted making that move.

Mehta's ruling, however, appears to claim that opening an official investigation is not even necessary, at least in the context of Trump's financial documents that were subpoenaed from Mazars USA.

""It is simply not fathomable that a Constitution grants Congress the power to remove a President for reasons including criminal behavior would deny Congress the power to investigate him for unlawful conduct---past or present---even without formally opening an impeachment inquiry,"" Mehta wrote.

On top of that, Mehta ruled that Congress does not even need to be motivated by a legitimate legislative purpose, as long as their investigation is based ""on a subject matter on which 'legislation could be had.'""

Treasury Secretary Steve Mnuchin said he would comply with a court order to release Trump's tax returns, but that does not mean the administration would not at least try to appeal a district court's decision. During that time, similar appeals in the Mazars USA and Deutsche Bank cases could advance through the judicial system as well. Since those matters are taking place in different circuits, if those appeals meet different outcomes, it could be grounds for the Supreme Court to consider taking up the issue of the limits of congressional oversight of the executive branch.

The timing of all this is what could ultimately pose a problem, depending on how long these legal battles last.

Trump's own past statements have supported the idea that releasing tax returns sooner rather than later would be a good idea. When Mitt Romney ran for president in 2012, he held out until finally making them public in September. Trump commented on this in 2016.

JUDGE WHO UPHELD TRUMP SUBPOENA DONATED TO DEMS ON COMMITTEE SEEKING THE RECORDS

""He waited until September to give them, just before the election,"" Trump told ABC. ""They made him look so bad, it was so unfair, I actually think he didn't lose because of the 47 percent, I think he lost because of a couple of really minor items in tax return where he did nothing wrong.""

If the issue of Trump's tax returns is decided the way lower courts ruled on his financial documents, the president and his legal team may have to weigh the benefits of trying to push a court case past November 2020, or potentially prevailing beforehand, versus letting the information out early, so that Trump's campaign has more time to address it.

""He's gambling,"" Stern said."
"Michael Wolff’s ‘Draft Indictment’ of Trump Doesn’t Exist, Says Mueller’s Office",https://www.thedailybeast.com,['Jamie Ross'],05-28-2019,2019,5,https://www.thedailybeast.com/michael-wolffs-draft-indictment-of-trump-doesnt-exist-says-muellers-office,"A spokesman for Robert Mueller has emphatically denied a claim from Fire and Fury author Michael Wolff that the special counsel drew up a three-count obstruction-of-justice indictment against Donald Trump before deciding to ditch it.

The unverified allegation is made in Wolff’s new book, Siege: Trump Under Fire, which is due to be published next week. It’s the sequel to Fire and Fury, which infuriated the president for its claims about the dysfunctional inner workings of his White House.

The Guardian obtained a copy of the new book and reports that Wolff states his findings about Mueller’s supposed draft indictment are “based on internal documents given to me by sources close to the Office of the Special Counsel.” The newspaper writes that it’s seen the documents.

However, Peter Carr, a spokesman for Mueller, told The Guardian: “The documents that you’ve described do not exist.”

Wolff claims the draft listing the president’s alleged abuses was written under the title “United States of America against Donald J. Trump, Defendant,” and it sat on Mueller’s desk for a year before being discarded.

The Guardian reports the first of the three counts charged the president with corruptly influencing, obstructing, or impeding a pending proceeding before a department or agency. The second count is said to have charged the president with tampering with a witness, victim, or informant, while the third allegedly charged Trump with retaliating against a witness.

According to Wolff, Mueller’s team drew up both the three-count indictment of Trump as well as a supporting draft memorandum of law opposing any motion from Congress or the White House that sought to dismiss it.

The memo quoted by Wolff says: “The Impeachment Judgment Clause, which applies equally to all civil officers including the president… takes for granted… that an officer may be subject to indictment and prosecution before impeachment. If it did not, the clause would be creating, for civil officers, precisely the immunity the Framers rejected.”

Wolff writes that Mueller agonized for a long time over whether to charge the president before ultimately deciding he could not move to prosecute a sitting president.

Wolff's conclusion reads: “Bob Mueller threw up his hands. Surprisingly, he found himself in agreement with the greater White House: Donald Trump was the president, and, for better or for worse, what you saw was what you got—and what the country voted for.”"
'A Hard Rain's Gonna Fall' on Obama's Bad Cops and Spies,https://www.realclearpolitics.com,[],05-28-2019,2019,5,https://www.realclearpolitics.com/articles/2019/05/28/a_hard_rains_gonna_fall_on_obamas_bad_cops_and_spies_140429.html,"The skies are growing dark and increasingly ominous for dirty officials at the top of Obama-era law enforcement and intelligence agencies. Leading the “I’m really worried” list are James Comey, John Brennan, James Clapper, Loretta Lynch, and their senior aides, all political appointees. They expected Hillary Clinton to win in 2016 and bury any traces of malfeasance, just as they had buried hers. It didn’t work out that way.

Now they need protection themselves. House Democrats and anonymous leakers are busy providing it. Many are delicately called “current and former senior officials” by the New York Times, Washington Post, and other legacy media. Gee, I wonder who they are?

These defenders of the old guard are sliming Attorney General Bill Barr, who heads the investigation into their actions. They have good reasons, if not clean hands, for their attack. First, they want to keep as much secret as they can. Exposure can only harm them. Their main argument is that any disclosures will damage U.S. national security. Second, they want to paint the disclosures and forthcoming indictments as President Trump’s revenge, the illegitimate use of powerful agencies that should be nonpartisan. That, of course, is precisely what they are accused of doing.

Barr won’t be deterred. He did not return for a second stint as AG to pad his résumé or protect Donald Trump. He returned to clean out the Augean Stables. He needs to muck out the mess left by his predecessors and find the horses that left it.

Barr is determined to do that. He intends to find out how and why the Department of Justice embarked on an all-consuming, two-year project to investigate Trump’s alleged cooperation with Putin’s Russia to win the presidency. The investigation by Special Counsel Robert Mueller found no such cooperation (going well beyond saying he simply could not indict). Now, Barr wants to understand the origins of the probe and whether the tools used to launch it were lies or distortions — and were known to be so by DoJ, FBI, and CIA officials. Barr wants to know if U.S. intelligence agencies were used to spy illegally on Americans, or if they outsourced that to friendly foreign services and then recovered the information from them. He wants to know if the investigations really began in July 2016, as the FBI testified, or earlier, and what evidence was used to begin them.

None dare call it spying. At least no Democrats or Obama officials will. But that’s exactly what it was. As that master of the English language, Winston Churchill, put it, “Short words are best and old words when short are best of all.” That’s far too clear for bureaucratic obfuscators, presidential contenders, and their media allies. They prefer long, Latinate terms like “surveillance” and “surreptitious investigation.” Barr is effectively telling them to “pound sand.”

Over the next few months, the public will finally see what kind of malfeasance there was. At least they will see some of it. Some will remain classified to protect sources and methods; some will be released only after criminal charges are filed. The initial evidence will come from two sources: a major report by DoJ Inspector General Michael Horowitz, and the steady declassification of underlying documents by AG Barr, who was given that task by the president. Barr needed that authority because the FBI and intelligence community are resisting disclosure with all their institutional power. They fear years of abuse will be exposed.

Horowitz, a highly regarded career prosecutor, initially appointed by President Obama, will issue a public report and is virtually certain to make criminal referrals. The referrals will then be handled by John Durham, a skilled, apolitical U.S. attorney, who has successfully prosecuted major corruption cases for AGs in both parties. Apparently, he has already convened a grand jury. Another federal prosecutor, John Huber, has been working on related problems. Durham will coordinate, supervised by Barr.

These joint efforts will show whether there were good legal reasons to spy on Americans, whether the secret intelligence courts were given complete and honest information before they issued search warrants, whether top officials leaked secret information to the media, and whether U.S. intelligence agencies (which cannot legally spy on Americans) evaded that restriction. They may also show if outside contractors illegally tapped into classified databases and spied on American citizens, including political opponents.

These are very serious charges, and, if proven, serious crimes. What makes them worse — far worse — is that they may well be connected to each other. If they are, they would represent a high-level conspiracy by government officials, appointed by one party and directed at political opponents during and after an election.

This assault on democracy has not been proven, but the evidence emerging in dribs and drabs strongly suggests the possibility. If it is proven, and if the Obama White House was directly involved, as some FBI texts plainly say, the scandal would be one of the biggest in American history.

How big? Big enough that major news organizations, which always favor transparency (“Democracy Dies in Darkness”), are now deeply troubled by the release of any secret documents. They know the stakes are too high and transparency too dangerous for their side, politically.

Right now, we don’t know how big the scandal is, how extensive the coordination was, and how far up it went. But we certainly need to know, just as we needed to know if Donald Trump won the presidency by cooperating with a hostile foreign power. He did not, according to the Mueller report. Now, we need to know if the U.S. government itself worked secretly and illegally to prevent his election and, when that failed, to damage his new presidency. That conspiracy would be equally serious, and for the same reasons. It needs to be rooted out, exposed, and punished.

The fundamental problem was identified by James Madison, who led the drafting of our constitution. “In framing a government which is to be administered by men over men,” he wrote in Federalist Paper 51, “the great difficulty lies in this: you must first enable the government to control the governed; and in the next place oblige it to control itself."" Under Comey, Lynch, Brennan, and Clapper, under Obama and Biden, it failed to control itself.

Over the next few months, we will learn the extent of that failure. We will see if top officials misused their agencies to investigate and crush their political opponents. Constitutional democracies cannot permit that. They cannot wave it off as yesterday’s news and expect to survive unscathed. If undetected and unpunished, it will happen again to another party, another candidate.

As the evidence comes out, a hard rain’s gonna fall. The damage will be compounded by partisan divisions, corroding trust in our basic institutions, and an impending election. For democracy’s sake, let’s hope the bitter winds are not a Cat-5 storm."
