Trump Takes Credit for Obama’s Gains for Vets,https://www.snopes.com,['Associated Press'],05-27-2019,2019,5,https://www.snopes.com/ap/2019/05/27/trump-takes-credit-for-obamas-gains-for-vets/,"WASHINGTON (AP) — Boastful on the occasion of Memorial Day, President Donald Trump and his Veterans Affairs secretary are claiming full credit for health care improvements that were underway before they took office.

Trump said he passed a private-sector health care program, Veterans Choice, after failed attempts by past presidents for the last “45 years.” That’s not true. The Choice program, which allows veterans to see doctors outside the government-run VA system at taxpayer expense, was first passed in 2014 under President Barack Obama.

Trump’s VA secretary, Robert Wilkie, also is distorting the facts. Faulting previous “bad leadership” at VA, Wilkie suggested it was his own efforts that improved waiting times at VA medical centers and brought new offerings of same-day mental health service. The problem: The study cited by Wilkie on wait times covers the period from 2014 to 2017, before Wilkie took the helm as VA secretary. Same-day mental health services at VA were started during the Obama administration under Wilkie’s predecessor, David Shulkin.

A look at the claims:

TRUMP: “We passed VA Choice and VA Accountability to give our veterans the care that they deserve and they have been trying to pass these things for 45 years.” — Montoursville, Pennsylvania, rally on May 20.

THE FACTS: Wrong. Trump is not the first president in 45 years to get Congress to pass Veterans Choice; Obama did it in the wake of a scandal at VA’s medical center in Phoenix, where some veterans died while waiting months for appointments. The program currently allows veterans to see doctors outside the VA system if they must wait more than 30 days for an appointment or drive more than 40 miles (65 kilometers) to a VA facility.

Trump did expand eligibility for the program. Now, starting June 6, veterans are to have that option for a private doctor if their VA wait is only 20 days (28 for specialty care) or their drive is only 30 minutes.

Still, VA’s top health official, Dr. Richard Stone, described the new program’s start to “almost be a non-event” in testimony to Congress. That’s in part because wait times in the private sector are typically longer than at VA. In 2018, 34 percent of all VA appointments were with outside physicians, down from 36 percent in 2017.

Also key to the Choice program’s success is an overhaul of VA’s electronic medical records to allow seamless sharing of them with private physicians, a process expected to take up to 10 years. Wilkie has said full implementation of the expanded Choice program is “years” away.

___

WILKIE: “The first thing I did was change out the leadership at VA. … (The president) also allowed me to change out leadership in the VA centers. If someone wasn’t walking the post, getting to know the people who work for her or him, or getting to know those veterans, they had to leave. And, as a result, the Journal of the American Medical Association this year said that our waiting times are now as good or better than any in the private sector.” — interview Thursday with Fox News.

THE FACTS: It’s true that a study by the medical association came out in January that found wait times at VA medical centers on average were better than the private sector. But the improvement wasn’t a “result” of anything that Wilkie did: The study involved a period largely covering the Obama administration — and before Wilkie became acting VA secretary in late March 2018.

In fact, in a VA press release in January announcing the study’s results, Wilkie credits the department’s “concerted” effort to improve access to care “since 2014.”

The study covered four specialties, primary care, dermatology, cardiology and orthopedics.

It found that in 2014, the average wait time at VA medical centers was 22.5 days, compared with 18.7 days in the private sector, which was not statistically different. By 2017, the wait time at VA improved to 17.7 days, while increasing to 29.8 days for private doctors. Wait times at VA medical centers were shorter in all specialties except orthopedics.

According to the study, the number of patients seen yearly in VA increased slightly between 2014 and 2017, to about 5.1 million. VA patient satisfaction also rose, according to patient surveys cited in the study.

___

WILKIE: The VA “had suffered from bad leadership. And that’s a bipartisan comment. And the second thing I had to do was make sure that as we approach our veteran population that we make sure that they are at the center, their needs are at the center of what we do … I think we’ve had it backwards at VA for many years. … One of the things that we’re doing at VA is that we have same-day mental health service. … It is huge.” — interview with Fox News.

THE FACTS: Same-day mental health service started at VA before Trump took office in January 2017, let alone Wilkie.

VA’s effort to provide same-day primary and mental-health care when medically necessary at every VA medical center was publicized in April 2016 under the Obama administration. At the time, Shulkin was helping lead the effort as VA’s top health official. By late 2016, the department’s blog announced that the goal of same-day mental health services would be achieved by year’s end.

A Dec. 23, 2016, article in the Harvard Business Review cites new same-day services at all VA hospitals as evidence of notable progress at the department. Shulkin, who was then named by Trump to be his VA secretary, told Congress in late January 2017 the services already were fully in place.

Trump selected Wilkie to be his VA secretary after firing Shulkin in March 2018 because of ethics charges and internal rebellion at the department over the role of private care for veterans. Trump’s initial replacement choice, White House doctor Ronny Jackson, withdrew after allegations of workplace misconduct surfaced. While Wilkie has been credited by both parties in Congress for bringing stability to the department, the VA improvements he attributes to himself this past week are misplaced."
Top DHS official to depart agency at Trump's request,https://www.washingtonexaminer.com,[],05-25-2019,2019,5,https://www.washingtonexaminer.com/news/top-dhs-official-to-depart-agency-at-trumps-request,"The head of U.S. Citizenship and Immigration Services is stepping down from his post next month per the request of President Trump, according to a new report.

Lee Francis Cissna notified staff Friday that he would be leaving the Department of Homeland Security on June 1. It’s unclear what his plans are after departing the administration.

“During the past 20 months, every day, I have passionately worked to carry out USCIS’ mission to faithfully administer the nation’s lawful immigration system,” Cissna wrote to staff, according to an email obtained by the Associated Press.

Cissna’s job was in jeopardy last month as the agency coped with a surge of migrants crossing the border and a new caravan assembling. But Republicans including Sen. Chuck Grassley of Iowa went to bat for Cissna, and he did not leave with former Secretary of Homeland Security Kirstjen Nielsen.

Cissna’s position requires Senate confirmation. It’s unknown who will replace Cissna, although the Trump administration announced that former Virginia Attorney General Ken Cuccinelli would join the agency."
U.S. Department of Labor plans to close 1 local Job Corps Civilian Conservation Center,http://wlos.com,['John Harbin'],,,,http://wlos.com/news/local/us-department-of-labor-plans-to-close-one-local-job-corps-civilian-conservation-center,
10-year Treasury yield drops to 19-month low as trade fights threaten US growth,https://www.cnbc.com,['Thomas Franck'],05-28-2019,2019,5,https://www.cnbc.com/2019/05/28/us-bonds-wall-street-set-to-monitor-economic-data-treasury-auctions.html,"The yield on the benchmark 10-year Treasury note fell to a 19-month low Tuesday as Wall Street grew more certain that the U.S.-China trade war will last longer and afflict GDP growth more than first thought.

At around 3:33 p.m. ET, the yield on the benchmark 10-year Treasury note, which moves inversely to price, was lower at around 2.264%, off a 19-month low hit earlier in the session. The yield on the 30-year Treasury bond yield traded at 2.705%, off its lowest level since 2017; the 2-year Treasury note yielded 2.127%.

The 3-month Treasury bill yielded 2.356%, keeping a portion of the yield curve inverted. The German 10-year bund yield hit a low of -0.163%, its lowest level since Sept. 30, 2016.

The U.S. bond market was closed Monday in observance of Memorial Day."
Atlanta Braves Latin American scouting records requested by Justice Department,https://tomahawktake.com,"['Jonathan Magel', 'Alan Carpenter', 'Scott Polacek']",05-26-2019,2019,5,https://tomahawktake.com/2019/05/26/atlanta-braves-latin-american-scouting-records-subpoenaed-by-doj/,"Atlanta Braves must send Latin American scouting reports to the Department of Justice.

According to a report in the Washington Post, The US Department of Justice (DoJ) served subpoenas on the Atlanta Braves, Los Angeles Dodgers, and San Diego Padres “seeking records relating to scouting and signing of players from Latin America.”

While this report is dated May 23rd, there was no indication of when these subpoenas were actually issued, though the investigation is known to have been in progress for close to a year now.

Last September Jeff Passan reported that a Federal Grand Jury subpoenaed officials from several teams including “at least one former Atlanta Braves official as well as people involved with the signing of Cuban star Hector Olivera.”

Agents from the FBI have spearheaded the investigation, according to sources familiar with it, and lawyers from the Department of Justice who specialize in Foreign Corrupt Practices Act cases – which typically involve bribery of foreign officials – are involved as well.

This news comes just a year after MLB severely sanctioned the Atlanta Braves for their actions in Latin America during the John Coppolella/John Hart regime.

Alan wondered at the time why Gordon Blakeley’s name never appeared in Passan’s post, as he helped the Yankees scout and sign in Latin America before coming to Atlanta to assist Coppolella. We may now have an answer,

RELATED PRODUCT Feels Right Buy Now! Buy Now!

What’s it all about Alfie?

The probe centers on something called the Foreign Corrupt Practices Act, which Alan explained in layman’s terms in his original post.

the provisions of the FCPA are an attempt to level the playing field for those doing business internationally by telling US citizens that they can’t pay a bribe to (or anything that looks like there’s a bribe) to a ‘foreign official’ to facilitate a business transaction.

In the Post article, Hobson says that more than a dozen people associated with the game, including scouts and a former MLB official (Bud Selig comes to mind) testified before the Grand Jury, as well as players and at least one agent.

The DoJ indicted a native Cuban agent Bart Hernandez sports and trainer Julio Estrada also from Cuba. At their trial, documents produced suggested the New York Yankees were aware crimes were being committed.

… State Department document summarized an August 2012 interview … between a U.S. consulate official and a Cuban pitcher, Omar Luis … (that Luis) “Was directly recruited from Cuba by the Yankees,” the State Department official wrote. When asked about how he got residency in Haiti, the report said the player replied, “The Yankees contacted a Haitian functionary who make [sic] it all happen.”

Blakeley left the Yankees in 2014 and joined the Atlanta Braves."
"Feds probing Veterans Affairs hospital for malpractice, forged records after vet files formal complaint and sues",https://www.nydailynews.com,['Janon Fisher'],05-24-2019,2019,5,https://www.nydailynews.com/new-york/ny-northport-veterans-affairs-medical-center-gary-zambito-diagnosis-20190524-pblxb5i2wne5rcnq3r7qsbqpzq-story.html,"Zambito told doctors at the hospital that the 1970 attack had left him with heart irregularities, and that after tests he was diagnosed with supraventricular tachycardia, an abnormally rapid heart rhythm. But, Zambito said in interviews and court records, doctors could not identify the cause of the fainting spells and he crashed onto sidewalks 18 times, injuring his eye, face, hands and knees. He said questions about the possibility of a relationship between his heart condition and fainting were ignored."
"Bill seeks to speed up EPA approach to Wright-Patt, Dayton contaminant",https://www.daytondailynews.com,[],,,,https://www.daytondailynews.com/news/local/bill-seeks-speed-epa-approach-wright-patt-dayton-contaminant/KYUMnlIg2EjlpeFqdvdPSO/,"A new bill in the U.S. Senate aims to help identify the health effects of a type of contaminant found in drinking water supplies near Wright-Patterson Air Force Base and a Dayton firefighter training center.

U.S. Sen. Rob Portman, R-Ohio, sponsors the bill called the Safe Drinking Water Assistance Act. The bill would address barriers that limit the government’s response to the chemicals called PFAS, found in man-made firefighting foam, his office said.

RELATED: What you need to know about chemicals in water

The bill would also expedite analysis of the chemicals and provide support and resources to states dealing with them, the office said. The bill also proposes efforts to identify the health effects of cyanotoxins, the toxin in the algal bloom that shut down Toledo’s water supply in 2014.

Drinking water safety is one of the topics examined by the Dayton Daily News Path Forward project, which digs into solutions for the most pressing issues facing the community.

For several years, Wright-Patt officials have faced concerns about PFAS, formally known as per- and polyfluoroalkyl substances. Last year, the city of Dayton found PFAS in the groundwater near the McFadden Avenue firefighter training center.

The city of Dayton runs the region’s largest water system, which includes several other Montgomery County communities.

Existing law requires the Environmental Protection Agency to identify and analyze emerging contaminants, but Portman’s office said actions to monitor and treat contaminants is often delayed due to “the rigorous yet lengthy nature of EPA’s multi-step review process.”

“This legislation will help the federal government more efficiently and effectively analyze the impacts of, and respond to, emerging contaminants through greater coordination among federal agencies, and will provide states with the resources they need to monitor, test, and respond to potential risks posed by emerging contaminants,” Portman said in a statement.

MORE: Nearly $1M to fix water line behind largest outage in Dayton’s history

Activists like Bill Walker said the encroachment of PFAS in the water is “rooted in the failure of federal chemical regulation.”

Walker, vice president of the Environmental Working Group, said PFAS presents “the biggest drinking water contamination crisis in the country right now and certainly for quite some time.”

“We still believe this is basically the tip of the toxic iceberg,” Walker said.

The Dayton Daily News earlier this year reported Dayton and Wright-Patt are working to keep the chemicals out of regional drinking water, but progress is slow because federal agencies have not set safety levels for some chemicals or funded clean-up efforts of groundwater contamination.

The bill would direct the EPA to give support and technical assistance to communities that have detected emerging contaminants in their water supply. It additionally would establish and maintain a database of resources to assist states and water utilities with testing for contaminants. The bill also would direct certain federal agencies to create inter-agency working groups to coordinate the federal response and research strategy.

Read more coverage:

» Progress slow in addressing chemicals in local water

» ‘Nearly catastrophic’ break a glimpse of vulnerabilities to area’s water

Thank you for reading the Dayton Daily News and for supporting local journalism. Subscribers: log in for access to exclusive deals and newsletters.

Thank you for supporting in-depth local journalism with your subscription to the Dayton Daily News. Get more news when you want it with email newsletters just for subscribers. Sign up here.

About The Path Forward The Dayton Daily News has assembled a team to write about solutions to some of the region’s most pressing problems, including protecting our drinking water. Find our coverage at DaytonDailyNews.com/PathForward."
