DOJ inspector general: DEA supervisor had improper relationship with confidential source,https://www.washingtonexaminer.com,[],07-08-2019,2019,7,https://www.washingtonexaminer.com/news/doj-inspector-general-dea-supervisor-had-improper-relationship-with-confidential-source,"The Justice Department’s watchdog revealed that a group supervisor with the Drug Enforcement Administration had an “inappropriate relationship” with a DEA confidential source, used a government vehicle to take the source out on dates, shared nonpublic information with the source, made unjustified payments to them, and lied about it.

The DOJ’s Office of Inspector General, led by Michael Horowitz, released the summary on Monday. The probe concluded that the DEA group supervisor “violated DEA policy” by “repeatedly meeting with the CS alone,” including at the source’s home. The inquiry also found that the group supervisor “went on two personal trips” with the source and let the source visit the group supervisor’s family and friends.

“None of these individuals were made aware that the group supervisor’s companion was a DEA confidential source who was participating in drug trafficking investigations involving violent criminals,” the DOJ inspector general wrote. “In so doing, the group supervisor deceived these individuals and exposed them and their families to potential danger.”

DOJ’s watchdog also concluded that the DEA assistant special agent in charge signed off on improper payments and failed to properly manage the group supervisor.

The report said “criminal prosecution was declined” by the Justice Department.

Horowitz’s investigation into alleged FISA abuse has reportedly concluded, although last-minute witnesses and a tricky classification process mean it may be a while until the report is released."
"Census farce: Trump, Barr and the Justice Department make a mockery of the law",https://www.washingtonpost.com,"['Jennifer Rubin', 'Opinion Writer Covering Politics', 'Policy', 'Foreign', 'Opinion Writer', 'Jennifer Rubin Writes Reported Opinion For The Washington Post.']",07-07-2019,2019,7,https://www.washingtonpost.com/opinions/2019/07/07/census-farce-trump-barr-doj-make-mockery-law/,"Opinion writer

The Supreme Court found late last month that the administration’s explanation for inclusion on the 2020 Census of a question asking about citizenship didn’t match the facts. In other words, Commerce Secretary Wilbur Ross lied when he said the Justice Department had initiated the process by asking for such a question to enforce the Voting Rights Act, a blatant misrepresentation.

Last week, things got even worse. The Post reports:

Government lawyers said in a filing Friday that the Justice and Commerce departments had been “instructed to examine whether there is a path forward” for the question and that if one was found they would file a motion in the Supreme Court to try to get the question on the survey to be sent to every U.S. household.

The administration, you see, just hasn’t figured out what that non-pretextual excuse is. Its position now raises several questions, including: 1) Did the Justice Department lie to the courts to get an expedited Supreme Court hearing by claiming the issue had to be resolved by June 30 and 2) Did the president give the game away when he told reporters the question was needed for reapportionment? As The Post reports, “Trump’s statement could give additional heft to information discovered in May suggesting the administration worked with a Republican redistricting strategist who saw the question as a way to give Republicans and non-Hispanic whites an electoral advantage.”

Ian Bassin, executive director of the nonpartisan nonprofit Protect Democracy, tells me, “There’s a term for trying to create a structural political advantage for ‘Republicans and non-Hispanic whites,’ and that term is ‘white power.’ And we now know that’s been the purpose all along for adding a citizenship question to the census.”

President Trump seems to think that by invoking “executive order,” he can make his legal problem disappear. Wrong. The Supreme Court disallowed the question for now and sent it back for the “real reason” for including the question. He cannot shout “Executive order!” and cure his legal problem.

Moreover, we know from evidence belatedly uncovered that the real reason was to produce a census that favored white voters and hence the Republican Party (thereby acknowledging that the party’s political survival is entirely dependent on artificially inflating the white share of the electorate). The government actually tried to halt discovery in a Maryland lawsuit over the census question while it comes up with a new explanation, a cheeky move slapped down by U.S. District Judge George J. Hazel. They want to keep litigating the real reason for the citizenship question? Fine, let’s have at it.

Constitutional scholar Laurence Tribe observes, “The district court’s refusal to go along with the antics of the Justice Department’s legal team has been a reassuring reminder that this dictator-admiring president has not yet succeeded in breaking the judicial guardrails completely.” However, Tribe argues that Trump “has left little doubt about his willingness to do so if he senses at any given moment that it would serve his theatrical or political interests — interests that he seems incapable of distinguishing.”

There is good reason for the plaintiffs to be optimistic about their chances. “The court vacated the Voting Rights Act rationale as a contrived pretext,” Thomas Wolf, counsel with the Democracy Program at the Brennan Center for Justice at the New York University School of Law, told The Post. “What they’re trying to do now is the textbook definition of a pretext — telling the court, ‘We plan to do this but we don’t know why yet.’”

As Tribe points out, “Among the many things wrong with the government’s disgraceful game is that [the] president has today made absolutely clear that his sole purpose in trying to circumvent the Supreme Court’s recent decision by inserting a citizenship question in the census one way or another is to reduce the political power of areas with a relatively high proportion of noncitizen residents (read: nonwhites) — perfectly lawful residents, despite Trump’s reference to them as ‘illegals.’” This, of course, amounts to “flatly violating the 14th Amendment’s mandate in Section 2 that such power be allocated among the states in proportion to their actual population.”

The entire debacle raises serious questions about the credibility and honesty of the Justice Department. “The Trump administration lied to the courts about the real reason for the citizenship question. And they got caught by the Supreme Court,” Mimi Rocah, a former federal prosecutor, tells me. “Now Trump has directed DOJ lawyers to come up with some other lie. No DOJ lawyer should sacrifice her integrity with the courts for this or any administration.”

Trump’s contempt for the rule of law and blatant dishonesty would not continue without the help of underlings. And they must do some serious soul-searching. “There are some things no DOJ lawyer can do. One of those is make arguments in court that are untrue in order to benefit the political whims of a president,” Joyce White Vance, a former prosecutor, says. “If DOJ’s leadership, the [attorney general,] the deputy AG, the solicitor general and the head of the Civil Division [don’t want to be] complicit in violating the duty of candor DOJ lawyers owe to the court, then they should resign on principle and in protest.”

They won’t resign en masse, of course, because the professional and ethical expectations have been so diminished in this administration that the unimaginable is now standard operating procedure for both political appointees and career lawyers.

“Make no mistake: The government lawyers — appointees and civil servants alike — who are spending this weekend trying to cleanse the record of this fact and salvage this plan are employing their legal skills in the service of white power,” Bassin says. “That’s not just a violation of their oath of office, it’s an abdication of the basic morality on which we all as human beings are ultimately judged. They don’t have to do this. We all make choices.”

The long-term reputation of the Justice Department may be severely damaged by these types of episodes. “A self-respecting DOJ official, whether a political hire or a long-serving civil servant, would resign rather than make arguments that treat the federal judiciary with such disrespect simply to humor the president or his lackey in the office of attorney general,” Tribe observes. Because they have not chosen that course, the next president and attorney general will have their hands full rehabilitating the department and reestablishing professional norms.

As Trump continues to mow down one democratic norm after another and tries to defy Congress and the courts on a regular basis, one has to reevaluate the efficacy and urgency of impeachment. “To refrain from promptly beginning formal impeachment proceedings against a president who conducts his office in this chaotically lawless manner, on top of everything else he has done, would be an abdication of constitutional responsibility,” Tribe asserts.

At the very least, this new example of deceitful lawyering should be added to the list of topics for House Judiciary Committee hearings.

Read more:

Greg Sargent: Trump rages over his latest failure to corrupt our democracy

Hugh Hewitt: The census belongs to the president. He needs to get it back. Here’s how.

Paul Waldman: Trump’s efforts to rig the census may already be working

The Post’s View: The Trump administration is pushing the census question again. Good luck with that."
U.S. says its producers harmed by some structural steel imports,https://www.reuters.com,"['Reuters Editorial', 'Min Read']",07-09-2019,2019,7,https://www.reuters.com/article/us-usa-trade-steel/u-s-producers-harmed-by-some-structural-steel-imports-commerce-department-idUSKCN1U32GV,"FILE PHOTO: A worker walks past rolls of steel wires at a factory in Nantong, Jiangsu province, China July 3, 2018. REUTERS/Stringer

WASHINGTON (Reuters) - The U.S. government on Monday said domestic producers were being harmed by imports of fabricated structural steel from China and Mexico, and that it would instruct the customs agency to collect cash deposits from importers of such steel.

The U.S. Commerce Department said it had found that imports from Canada were not being unfairly subsidized.

Mexico said in a statement that a U.S. countervailing duty investigation of Mexican fabricated structural steel was an “ordinary” anti-dumping probe with no relation to earlier tariff threats by U.S. President Donald Trump.

Mexico added that its economy ministry would defend the interests of the companies under investigation, and that it had been actively participating in anti-subsidy procedures since early 2019. It did not give further details in the statement.

The preliminary subsidy determination does not endanger ratification of the new North American trade deal, Mexico’s deputy foreign minister for the region, Jesus Seade, said on social network Twitter.That deal was designed to replace the North American Free Trade Agreement that governs more than $1.2 trillion of mutual trade.

The U.S. International Trade Commission said in March that imports of fabricated structural steel from Canada, China and Mexico were harming domestic producers.

Fabricated structural steel is used in major building projects, such as bridges, buildings, parking decks and ports. An industry trade group had filed a petition asking for the trade case to be launched.

In 2018, the United States imported $722.5 million worth of fabricated structural steel from Canada, $897.5 million worth from China and $622.4 million worth from Mexico, according to the Commerce Department.

The department is expected to make its final ruling on the imports around Nov. 19."
Robert Kraft sits with President Trump during dinner at Treasury Department,https://www.wcvb.com,[],07-09-2019,2019,7,https://www.wcvb.com/article/robert-kraft-sits-with-president-trump-during-dinner-at-treasury-department/28332290,"Robert Kraft sits with President Trump during dinner at Treasury Department

President Donald Trump had dinner Monday night with New England Patriots Owner Robert Kraft. Kraft sat one seat away from the President at an event at the Treasury Department in Washington, D.C.The dinner was hosted by Treasury Secretary Steven Mnuchin in honor of Qatar's Emir, Sheikh Tamim bin Hamad Al Thani. Trump has said he was surprised when Kraft was charged in a prostitution sting in Florida -- but pointed out he has maintained his innocence.

President Donald Trump had dinner Monday night with New England Patriots Owner Robert Kraft.

Kraft sat one seat away from the President at an event at the Treasury Department in Washington, D.C.

Advertisement

Carolyn Kaster

The dinner was hosted by Treasury Secretary Steven Mnuchin in honor of Qatar's Emir, Sheikh Tamim bin Hamad Al Thani.

Trump has said he was surprised when Kraft was charged in a prostitution sting in Florida -- but pointed out he has maintained his innocence.

AlertMe"
Trump's EPA stands up for consumers and freedom by standing up to the ethanol lobby,https://www.washingtonexaminer.com,[],07-09-2019,2019,7,https://www.washingtonexaminer.com/opinion/editorials/trumps-epa-stands-up-for-consumers-and-freedom-by-standing-up-to-the-ethanol-lobby,"President Trump’s Environmental Protection Agency took a step toward draining the swamp by curbing the amount of corn ethanol being forced into our economy by the crony capitalist ethanol mandate.

Big Corn is exploding with shock and dismay, as are corn-friendly lawmakers. But the White House shouldn’t heed the objections of these subsidized corporate moonshiners. Instead, he should lean on Congress to go further and reduce the ethanol mandate to zero.

Ethanol is a fuel alcohol derived from plants, in this country mostly from corn. Without federal support, there would be a very small market for ethanol, which is less powerful than gasoline, typically more expensive, cannot be shipped by pipeline, and tends to corrode engines.

The federal renewable fuel standard, also known as the RFS and the ethanol mandate, is King Corn’s current gravy train. The mandate requires refineries to blend a certain amount of ethanol into their gasoline. The EPA has some leeway on this score, and the agency has used it to protect consumers rather than the ethanol lobby.

The fuel standard requires at least 15 billion gallons of “conventional biofuels,” basically corn ethanol, for 2020. The ethanol lobby wanted the Trump administration to require more ethanol than even the law requires. Trump’s EPA further infuriated the industry by issuing exemptions for small refineries, which often struggle to get their hands on the amounts of ethanol required to meet the mandates.

The corn lobby angrily denounces these exemptions as “small refinery bailouts,” in the words of Geoff Cooper, president of the Renewable Fuels Association. Consider for a moment the perverse sense of entitlement here. An organization representing for-profit businesses, firms engaged in enterprise and supposedly proud of their product, calls it a ""bailout"" when a potential customer is granted limited freedom to not buy their product.

This is how crony capitalism not only distorts the economy and corrupts our politics (watch the Democratic presidential candidates bow before the altar of ethanol in Iowa these days), but how it also corrupts our businesses.

We understand that some of ethanol's biggest champions are powerful. We understand that Trump's political allies include some ethanol hustlers. And we understand the desire to help farmers, especially at a moment when tariffs are unfairly hurting them.

But if Trump cares about the economy, and about draining the swamp, he will not give into King Corn's demands. In fact, he should go in the other direction.

Trump should call on his friends in Congress to kill the ethanol mandate. Pass and sign a law winding the mandate down from its 15 billion gallons down to zero gallons in 2025. At the same time, scrap the mandate for ""advanced"" biofuels. If these fuels are so great, then consumers will buy them without a mandate.

That's how capitalism works, even if the swamp wants it to work differently."
The Justice Department Hasn’t Found a New Reason for the Census Citizenship Question—but Trump Has,https://slate.com,['Mark Joseph Stern'],07-05-2019,2019,7,https://slate.com/news-and-politics/2019/07/justice-department-census-citizenship-question-trump.html,"President Donald Trump boards Air Force One before departing from Andrews Air Force Base in Maryland on Friday. Mandel Ngan/Getty Images

The Department of Justice revealed on Friday that it’s still searching for a new justification for a census citizenship question that might pass legal muster. And while it rummages around for that rationale, the DOJ asked a federal judge to delay discovery into the allegedly discriminatory motives that produced the citizenship question, a request he promptly denied. Meanwhile, Donald Trump revealed his actual reason for wanting a citizenship question on the census—and it contradicts statements his own solicitor general made to the Supreme Court.

Welcome to the ongoing clown show of census 2020.

Friday’s DOJ filing was expected to provide a new reason for the citizenship question, after SCOTUS ruled that its previous rationale was bogus. (Secretary of Commerce Wilbur Ross, who oversees the census, said the question was necessary to better enforce the Voting Rights Act, a claim that does not make sense and is contradicted by the record.) Trump ordered administration officials to devise this new pretext just one day after they told a court they had dropped their quest for the citizenship question.

That about-face created difficulties in the ongoing case before U.S. District Judge George Hazel. The Supreme Court blocked the citizenship question because it was illegally supported by pure pretext, not because it was discriminatory. In June, however, plaintiffs uncovered new evidence that seemed to indicate the purpose of the question was to diminish Hispanics’ voting power. In light of these materials, Hazel reopened discovery in the case to let plaintiffs pursue their equal protection claim, a decision affirmed by the 4th U.S. Circuit Court of Appeals.

Had the Trump administration simply dropped the citizenship question, this case would be moot. But Trump has refused to give up on the question, so this case should, in theory, move forward, with discovery commencing as soon as possible.

On Friday, though, DOJ attorneys asked Hazel to pause discovery while they develop a different justification for the citizenship question. They argued that, by “providing a new rationale,” they will have magically cleansed the question of any discriminatory intent. For support, they cited Trump v. Hawaii, in which the Supreme Court held that any prejudiced motives undergirding Trump’s initial travel ban had been washed away by its third iteration. The DOJ, in other words, believes that Trump v. Hawaii prohibits courts from examining illegal motives behind the original citizenship question once it issues a new rationale for that question.

None of these shenanigans will please Chief Justice John Roberts.

Hazel did not agree, rejecting the DOJ’s request on Friday in an order allowing discovery to move forward. And for good reason.* It would be much more difficult to engage in animus-laundering here, where the administration’s first justification for the citizenship question has already been shot down. Trump officials are now openly contriving a new rationale, beginning with their conclusion and working backward to find some pretext that SCOTUS might accept. The administration must uproot the entire legal structure upon which the citizenship question stands—unlike in the travel ban case, where the stated purpose (national security) was always the same. Any animus attached to rationale No. 1 will surely taint rationale No. 2 when both are fruit of the same poisonous tree.

It is also pretty shocking to see the DOJ take its time in crafting a new pretext when it repeatedly told the Supreme Court that it had to finalize the census forms by June 30. The administration used this deadline to leapfrog over the court of appeals and get a swift Supreme Court ruling. Now that urgency has vanished, creating the inescapable impression that the DOJ lied to SCOTUS about its alleged timeline in a game of chicken that it unexpectedly lost. (The government is already printing census forms without a citizenship question, so any alteration at this late date will cost a huge sum of money.)

Finally, the Justice Department is not being helped by Trump, who acknowledged on Friday that the “number one” reason for a citizenship question is “for districting.” Presumably, Trump means that he wants to let states draw districts by counting only citizens of voting age, not all persons—a scheme that would dramatically boost white voting power. (It has been neither permitted or prohibited by SCOTUS.) That’s a troubling concession, because Solicitor General Noel Francisco told the Supreme Court that using citizenship data for redistricting was not the purpose of the census citizenship question. Once again, Trump is telling a very different story from the narrative carefully crafted by DOJ attorneys.

None of these shenanigans will please Chief Justice John Roberts, who wrote the opinion blocking the citizenship question on the first go-round. With every reversal and misrepresentation, the Trump administration is making it more difficult for Roberts to uphold the question under a new rationale. The DOJ will eventually contrive a new pretext that will likely get laughed out of court. It is destroying its own credibility to pursue what has become a feeble and humiliating vanity project for the president.

Update, July 5, 2019, at 3:48 p.m.: This article has been updated to note that Hazel allowed discovery to move forward."
