title, publication, authors, date, year, month, url, content
British ambassador who called Trump 'inept' has Theresa May's 'full support',https://www.foxnews.com,"['Lukas Mikelionis', 'Downing Street', 'Lukas Mikelionis Is A Reporter For Foxnews.Com']",,,,https://www.foxnews.com/world/british-ambassador-trump-inept-may-full-support,"Outgoing Prime Minister Theresa May on Tuesday issued a statement of support to Britain’s ambassador to the U.S. after President Trump cut off contact with him amid the leak of diplomatic cables.

May backed ambassador Kim Darroch amid the controversy over leaked diplomatic cables in which he disparaged Trump, including calling him “inept.”

TRUMP SAYS US WILL 'NO LONGER DEAL' WITH BRITISH AMBASSADOR AFTER LEAKED ANTI-TRUMP CABLES

Downing Street said Darroch “continues to have the prime minister's full support,” adding that “We have made clear to the U.S. how unfortunate this leak is” and that “the selective extracts leaked do not reflect the closeness of, and the esteem in which we hold, the relationship.”

""Sir Kim Darroch continues to have the prime minister's full support.” — Downing Street

“At the same time we have also underlined the importance of ambassadors being able to provide honest, unvarnished assessments of the politics in their country,” the spokesman added.

In the leaked documents, Darroch described the Trump administration as “diplomatically clumsy and inept” and said he doubted it would become “substantially more normal.”

The memo was one of several documents published by the Mail on Sunday in which Darroch apparently made other highly negative statements about the government of Britain's closest ally.

WATCH: TRUMP SAYS U.S. 'NOT BIG FANS' OF DARROCH

Trump on Sunday called Darroch ineffective and said “he has not served the U.K. well.”

He followed up on Twitter Monday to attack both Darroch and May – announcing that he won’t work with the ambassador anymore.

“I have been very critical about the way the U.K. and Prime Minister Theresa May handled Brexit. What a mess she and her representatives have created. I told her how it should be done, but she decided to go another way,” he wrote in a tweet.

“I do not know the Ambassador, but he is not liked or well.... thought of within the U.S. We will no longer deal with him,” he added.

CLICK HERE TO GET THE FOX NEWS APP

While the leak prompted awkwardness between the two countries that tout the “special relationship” and some called upon the government to recall Darroch, senior Conservative Party figure and former Foreign Secretary William Hague said the government was right to back him.

“You can’t change an ambassador at the demand of a host country,” Hague told the BBC. “It is their job to give an honest assessment of what is happening in that country.”

The Associated Press contributed to this report."
Obamacare in Jeopardy as Appeals Court Hears Case Backed by Trump,https://www.nytimes.com,[],07-09-2019,2019,7,https://www.nytimes.com/2019/07/09/health/obamacare-appeals-court.html,"NEW ORLEANS — A federal appeals court panel will hear arguments Tuesday on whether a federal judge in Texas was correct in striking down the Affordable Care Act, a case with enormous stakes not only for millions of people who gained health insurance through the law but for the political futures of President Trump and other candidates in the 2020 elections.

The case, which could make its way to the Supreme Court ahead of those elections, threatens insurance protections for people with pre-existing medical conditions and many other sweeping changes the 2010 law has made throughout the health care system.

It was filed by a group of Republican governors and attorneys general against the federal government, which carries out the law. But the Trump administration refused to defend the full law in court and this spring said it agreed with the ruling that the law’s requirement for people to buy insurance was unconstitutional, and that as a result, the entire law must be dismantled.

That has left a group of 21 states with Democratic attorneys general to intervene to defend the law, along with the House of Representatives, which entered the case after Democrats won control of the chamber last fall."
Florida fisherman says Trump's environmental moves helped turn his business around,https://www.foxnews.com,"['David Montanaro', 'David Montanaro Is An Editor With Fox News.']",,,,https://www.foxnews.com/politics/florida-fisherman-trump-environmental-moves-helped-turn-his-business-around,"A Florida fisherman delivered a full-throated endorsement of President Trump's environmental policies Monday at the White House, crediting the administration's efforts with helping turn his business around.

Bruce Hrobak, the owner of Billy Bones Bait and Tackle in Port St. Lucie, Florida, joined ""Fox & Friends"" Tuesday to explain how the administration helped combat the ""red tide"" of toxic algae that was devastating his business.

""The president loves everybody and I just don't get why people give him a hard time. He's a great guy and I was proud and honored to meet him,"" said Hrobak, who shouted ""Trump 2020"" into the microphone at the end of his show-stealing appearance.

Hrobak made the president and the audience laugh a few times, joking that his wife isn't ""yelling at him as much"" and that his father looked a little bit like Trump.

TRUMP CAMPAIGN, RNC ANNOUNCE $105M FUNDRAISING HAUL, BLOWING PAST DEM CANDIDATES

Hrobak said his business suffered in recent years because people were scared away by the toxic algae, which has now subsided near his bait shop. He also touted the administration's efforts to speed up repairs on the Herbert Hoover Dike.

""He wouldn't allow all this money to go improving things if he didn't care. That's my personal opinion,"" he said.

In a White House speech that exhaustively documented his administration's environmental efforts, Trump issued a new denunciation of the Green New Deal championed by top Democrats including New York Rep. Alexandria Ocasio-Cortez, saying the proposal would devastate the economy and hit minorities the hardest.

UNIONS WARN GREEN NEW DEAL MAY LEAD TO POVERTY

The address was aimed at publicizing the often under-reported work by the Environmental Protection Agency (EPA), as well as firing a political shot across the bow of Democrats who largely have dominated the conversation on climate change and related issues.

It came as polls have shown Americans increasingly voicing concern over the environment.

""We have only one America. We have only one planet,"" Trump said at one point. But, ""while we're focused on practical solutions, more than 100 Democrats in Congress now support the so-called Green New Deal. Their plan is estimated to cost our economy nearly $100 trillion -- a number unthinkable, a number not affordable even in the best of times.""

UH-OH -- AUTHOR OF GREEN NEW DEAL COST STUDY SLAMS AOC, SANDERS FOR MISINTERPRETING DATA

Democrats, however, dismissed the president's environmental record, with presidential candidates Sen. Bernie Sanders and Washington Gov. Jay Inslee slamming Trump's rollback of Obama-era regulations.

“President Trump’s record on the environment is pathetic and an embarrassment to the world,” Sanders, I-Vt., wrote. “This is a man who still thinks climate change is a ‘hoax.’ He better start listening to scientists and not his friends in the fossil fuel, chemical, and big agribusiness industries.”

CLICK TO GET THE FOX NEWS APP

Inslee, who has made climate change the central issue for his campaign, tweeted throughout the event.

""As Trump touts his administration’s environmental ‘accomplishments,’ a reminder that the EPA is run by a coal lobbyist, Interior is run by an oil lobbyist and Energy is run by someone who wanted to abolish the department,"" he tweeted.

Fox News' Gregg Re contributed to this report."
Judge Blocks Trump Rule Requiring Pharma Companies To Disclose Drug Prices In TV Ads,https://www.npr.org,[],07-09-2019,2019,7,https://www.npr.org/2019/07/09/739770699/judge-blocks-trump-rule-requiring-pharma-companies-to-say-price-of-drugs-in-tv-a,"Judge Blocks Trump Rule Requiring Pharma Companies To Disclose Drug Prices In TV Ads

Enlarge this image toggle caption Susan Walsh/AP Susan Walsh/AP

A federal judge on Monday stopped a Trump administration initiative that would have required drugmakers to reveal the sticker price of their drugs in television ads.

Under the rule, if a medicine's list price was more than $35 a month, it would have to be stated during the commercial. The challenge, opponents say, is that a drug's list price and estimates of what people can expect to pay vary widely depending on coverage.

The rule was blocked hours before it was set to take effect, the latest setback for the White House as Trump administration officials continue to search for ways to pressure pharmaceutical companies into lowering their prices — a proposal made by the Trump administration in the runup to last November's midterm election.

The decision from U.S. District Judge Amit Mehta in Washington, D.C., ruled that the Department of Health and Human Services does not have the regulatory power to make drug manufacturers include the cost of drugs in television commercials.

Mehta wrote that in halting the rule, the court was not questioning its wisdom, but resting the issue on the law set by Congress in the first place.

""That policy very well could be an effective tool in halting the rising cost of prescription drugs. But no matter how vexing the problem of spiraling drug costs may be, HHS cannot do more than what Congress has authorized,"" Mehta wrote.

Critics pointed out that the rule was toothless, since there was no enforcement mechanism spelled out for when a company did not comply. Instead, the rule relied on the private sector to police itself.

The television-ad rule had the support of both the Trump administration and consumer rights advocates.

That said, patient advocate groups told NPR that while holding drugmakers accountable for prices is welcome, they remained skeptical that drug companies could be shamed, as the administration intended, into lowering their prices.

Last month, groups including drug manufacturers Merck, Eli Lilly and Amgen sued the Trump administration over the rule, arguing that it would violate the companies' free speech rights.

AARP, which represents older Americans, expressed disappointment on Monday over the court's ruling.

""Today's ruling is a step backward in the battle against skyrocketing drug prices and providing more information to consumers,"" the group said. ""Americans should be trusted to evaluate drug price information and discuss any concerns with their health care providers."""
Trump 'dossier' author grilled by Justice Department watchdogs: sources,https://www.reuters.com,"['Mark Hosenball', 'Min Read']",07-09-2019,2019,7,https://www.reuters.com/article/us-usa-trump-russia/trump-dossier-author-grilled-by-justice-department-watchdogs-sources-idUSKCN1U410I,"(Reuters) - Federal lawyers probing the origins of the investigation of ties between Russia and President Donald Trump’s campaign have interviewed the author of a “dossier” that alleged misconduct between Trump and Moscow, prompting the lawyers to extend their inquiry.

A police car drives past an address which has been linked by local media to former British intelligence officer Christopher Steele, who has been named as the author of an intelligence dossier on President-elect Donald Trump, in Wokingham, Britain, January 12, 2016. REUTERS/Peter Nicholls

Three attorneys from the Inspector General’s office of the U.S. Department of Justice met in person in early June with dossier author Christopher Steele in Britain, said two sources with direct knowledge of the lawyers’ travels.

The interview with Steele, a former top spy on Russia for Britain’s Secret Intelligence Service, or MI6, took place while Trump was in London for a formal state visit with Queen Elizabeth and a meeting with UK Prime Minister Theresa May.

Steele’s dossier, made public in 2017, alleged that Moscow attempted to interfere in the 2016 U.S. presidential election and that there was potential collusion between Russia and Trump’s campaign, along with other unverified and salacious claims about the president.

The Justice Department’s inspector general has been examining the earliest stages of an FBI investigation of Trump, his former 2016 presidential campaign rival Democratic nominee Hillary Clinton, Russia and former Trump adviser Carter Page.

Inspector General Michael Horowitz, whose office is an internal Justice Department watchdog, launched his probe in March 2018 amid allegations by Republican lawmakers that the FBI erred in seeking a warrant to monitor Page.

Trump has described the Steele dossier as “bogus” and Republicans have long sought to discredit the FBI’s investigation, which was later taken over by U.S. Special Counsel Robert Mueller. His final report on Russia and the Trump campaign was released in redacted form in mid-April.

In that same month, Attorney General William Barr, who now heads the Justice Department, told a congressional committee that the Horowitz probe would be completed by May or June.

One of the two sources said Horowitz’s investigators appear to have found Steele’s information sufficiently credible to have to extend the investigation. Its completion date is now unclear.

A key focus of the Horowitz probe is whether the FBI followed proper procedures when it applied for a warrant with the Foreign Intelligence Surveillance Court (FISA) to secretly conduct surveillance on Page and his ties to Russia.

Declassified documents show that the FBI cited information in Steele’s dossier when it asked the secretive FISA court in late 2016 for a warrant to eavesdrop electronically on Page, a U.S. businessman with interests in Russia.

Horowitz’s office in Washington declined to comment.

A spokesman for Orbis Business Intelligence, Steele’s London investigations firm, declined to comment.

UK government agencies declined to disclose whether they were in contact with Horowitz’s team in London.

Moscow repeatedly rejected accusations of interfering in the election.

Mueller’s report, released on April 18, said that Russia did meddle in the election in an attempt to boost Trump’s candidacy. It said Trump campaign officials had multiple contacts with Russian officials. But it found insufficient evidence to establish a criminal conspiracy between the campaign and Moscow.

The report also described numerous attempts by Trump to impede Mueller’s inquiry, but it stopped short of declaring that he committed a crime. Mueller during his inquiry brought charges against 34 people, including Russian agents and ex-Trump aides.

Page, a foreign policy adviser during Trump’s campaign, drew scrutiny from the FBI, which said in legal filings in 2016 that it believed he had been “collaborating and conspiring” with the Kremlin. But he was not charged.

Investigators working for Mueller in September 2017 twice interviewed Steele, who also gave written testimony to the U.S. Senate Intelligence Committee in August 2018. That panel and other committees of Congress have taken up where Mueller left off after his investigation ended."
"Bill Clinton 'knows nothing' about financier Jeffrey Epstein's 'terrible crimes,' former president's spokesman says",https://www.foxnews.com,"['Gregg Re', 'Gregg Re Is A Lawyer', 'Editor Based In Los Angeles. Follow Him On Twitter']",,,,https://www.foxnews.com/politics/bill-clinton-knows-nothing-about-financier-jeffrey-epsteins-terrible-crimes-former-presidents-spokesman-says,"Bill Clinton ""knows nothing"" about the ""terrible crimes"" linked to Jeffrey Epstein, the former president's spokesman said Monday, in Clinton's first statement after new sex-trafficking charges were lobbed against the wealthy financier.

An indictment alleging sex trafficking and sex trafficking conspiracy was unsealed Monday morning against Epstein, the wealthy and politically connected financier who pleaded not guilty during his initial appearance in a New York City federal court. Prosecutors alleged that Epstein, the 66-year-old wealthy hedge fund manager arrested on Saturday, preyed on ""dozens"" of victims as young as 14.

""In 2002 and 2003, President Clinton took a total of four trips on Jeffrey Epstein’s airplane: one to Europe, one to Asia, and two to Africa, which included stops in connection with the work of the Clinton Foundation,"" the statement said. ""Staff, supporters of the foundation, and his Secret Service detail traveled on every leg of every trip. He had one meeting with Epstein in his Harlem office in 2002, and around the same time made one brief visit to Epstein’s New York apartment with a staff member and his security detail. He’s not spoken to Epstein in well over a decade, and he has never been to Little St. James Island, Epstein’s ranch in New Mexico, or his residence in Florida.”

Separately, claims in court showed that President Trump may have flown on the jet at least once, as well.

CUSHY PLEA BARGAIN WITH EPSTEIN WAS SO BAD IT BROKE THE LAW, JUDGE RULES

Meanwhile, Attorney General Bill Barr said he has recused himself from the matter ""because one of the law firms that represented Epstein long ago was a firm I subsequently joined for a period of time.""

On Saturday evening, Christine Pelosi, a Democratic National Committee official and daughter of House Speaker Nancy Pelosi, warned conspicuously that it is ""quite likely that some of our faves are implicated"" in the ""horrific"" sex-trafficking case.

""This Epstein case is horrific and the young women deserve justice,"" Pelosi tweeted. ""It is quite likely that some of our faves are implicated but we must follow the facts and let the chips fall where they may - whether on Republicans or Democrats.""

For his part, Trump previously called attention to Clinton's dealings with the financier.

""Nice guy -- uh, got a lot of problems coming up, in my opinion, with the famous island, with Jeffrey Epstein,"" Trump told Fox News' Sean Hannity in 2015, referring to Clinton's connections with Epstein. ""A lot of problems.""

Meanwhile, Trump biographer Tim O'Brien this weekend reposted an excerpt fom a 2002 profile of Epstein in New York Magazine, in which Trump told a reporter, ""I've known Jeff for fifteen years. Terrific guy. He's a lot of fun to be with. It is even said that he likes beautiful women as much as I do, and many of them are on the younger side.""

Trump banned Epstein from his Mar-a-Lago estate “because Epstein sexually assaulted an underage girl at the club,” according to court documents filed by Bradley Edwards, the lawyer who has represented several Epstein accusers. That claim has not been confirmed by Trump or Mar-a-Lago.

Epstein appeared Monday in a hearing that lasted about 30 minutes wearing a blue prison top with a brown T-shirt underneath, in addition to orange slip-on sneakers. Prosecutors said in the 36 hours since Epstein's arrest, multiple attorneys and several individuals have come forward and said they were victims, none of whom had previously been spoken to.

FORMER FBI OFFICIAL: INDICTMENT OF JEFFREY EPSTEIN IS 'PLACEHOLDER,' EXPECT DOZENS MORE CHARGES IN NEAR FUTURE

Epstein allegedly created and maintained a ""vast network"" and operation from 2002 ""up to and including"" at least 2005 that enabled him to ""sexually exploit and abuse dozens of underage girls"" in addition to paying victims to recruit other underage girls.

""This allowed Epstein to create an ever-expanding web of new victims,"" U.S. Attorney Geoffrey Berman said at a news conference.

Berman added that nude photographs ""of what appeared to be underage girls"" were discovered at Epstein's Manhattan mansion during a search following his arrest Saturday. The hundreds of photos were discovered in a locked safe, according to officials.

Prosecutors also allege Epstein ""worked and conspired with others, including employees and associates"" who helped facilitate his conduct by contacting victims and scheduling their sexual encounters with the 66-year-old at his mansion in New York City and Palm, Beach, Fla.

At Epstein's multi-story mansion on the Upper East Side of Manhattan, prosecutors said that victims would be escorted to a room with a massage table where they would perform a massage on him.

""The victims, who were as young as 14 years of age, were told by Epstein or other individuals to partially or fully undress before beginning the 'massage,'"" prosecutors wrote. ""During the encounter, Epstein would escalate the nature and scope of physical contact with his victims to include, among other things, sex acts such as groping and direct and indirect contact with the victim's genitals.""

In Monday's court appearance, prosecutors said that the massage room in New York was set up exactly as how the alleged victims described it 15 years ago.

CHRISTINE PELOSI WARNS IT'S 'QUITE LIKELY THAT SOME OF OUR FAVES ARE IMPLICATED' IN 'HORRIFIC' EPSTEIN CASE

Victims would be paid hundreds of dollars in cash by either Epstein or one of his associates or employees, according to prosecutors. The 66-year-old also allegedly ""incentivized his victims"" to become recruiters by paying the victim-recruiters hundreds of dollars for each girl brought to him.

""In so doing, Epstein maintained a steady supply of new victims to exploit,"" federal prosecutors said.

FBI Assistant Director-in-Charge William Sweeney said that Epstein was arrested at Teterboro Airport in New Jersey at 5 p.m. on Saturday ""without incident."" Epstein is now being held at the Metropolitan Correctional Center, a federal jail near the Manhattan courthouse where he appeared Monday afternoon.

Fox News' Travis Fedschun and Tamara Gitt contributed to this report."
