"Alexandria Ocasio-Cortez is the most coveted endorsement besides former presidents, edging out Nancy Pelosi",https://www.insider.com,"['Grace Panetta', 'Walt Hickey']",07-11-2019,2019,7,https://www.insider.com/aoc-most-coveted-2020-endorsement-of-non-ex-presidents-2019-7,"Self-reported Democratic primary voters polled by INSIDER say they value prominent progressive lawmaker Alexandria Ocasio-Cortez's 2020 endorsement the most out with the exception of former Democratic presidents.

25% said they valued Ocasio-Cortez's endorsement, the same percentage who said they valued 2016 Democratic nominee Hillary Clinton's endorsement.

A number of progressive senators running for president are clamoring for the opportunity to collaborate with Ocasio-Cortez on legislation and vying for her endorsement.

""What I would like to see in a presidential candidate is one that has a coherent worldview and logic from which all these policy proposals are coming forward,"" Ocasio-Cortez told CNN in May.

Ocasio-Cortez has collaborated with Sen. Bernie Sanders on a climate change resolution and legislation capping credit interest rates, shot a video with Sen. Elizabeth Warren criticizing Treasury Secretary Steve Mnuchin, and is teaming up with Sen. Kamala Harris on a bill to reform federal public housing.

Visit Business Insider's homepage for more stories.

Several Democratic presidential candidates are actively courting the support of progressive star Rep. Alexandria Ocasio-Cortez of New York — and Democratic primary voters polled by INSIDER say they value her 2020 endorsement the most out of all non ex-Democratic presidents.

As part of our recurring 2020 primary polling with SurveyMonkey Audience, INSIDER polled 1,105 respondents from July 9 to July 10. Of those, 421 said they would likely participate in their state's Democratic primary or caucus.

INSIDER asked those respondents ""Setting aside those already running for the presidency, which of the following figures' endorsement would you most value when it comes to the Democratic primary?"" allowing respondents to select up to five figures.

70% of respondents said they valued former President Barack Obama's endorsement.

28% valued former President Bill Clinton's endorsement.

27% valued former President Jimmy Carter's endorsement.

25% valued Ocasio-Cortez's endorsement.

24% valued former Secretary of State and 2016 Democratic nominee Hillary Clinton's endorsement.

22% valued House Speaker Nancy Pelosi's endorsement.

Ocasio-Cortez's performance is well within the margin of error in this case, meaning that it's entirely possible among the total population of Democratic primary voters that Pelosi and Clinton are more highly prized, and it's also entirely possible the freshman congresswoman from New York's support means more than Presidents Carter or Clinton. The takeaway is that this is now the company she keeps.

Read more: 2020 Democrats are scrambling to team up with Alexandria Ocasio-Cortez to boost their progressive credentials

Other high performers among those asked include philanthropist and billionaire Bill Gates (23%) and climate activist and former Vice President Al Gore (24%). There was then a considerable drop off, but other valued endorsements included:

Former Secretary of State John Kerry (13%)

Stacey Abrams, who was the Democratic nominee in a tough Georgia gubernatorial election (12%)

Former Ambassador and National Security Advisor Susan Rice (8%)

California Gov. Gavin Newsom (7%)

Although Ocasio-Cortez's support is valued in league with presidents and former presidential nominees, she's also handily surpassing fellow members of Congress and fellow New Yorkers with decades more political experience.

New Yorker and Senate majority leader Chuck Schumer and California Sen. Dianne Feinstein both notched 7%.

New York Gov. Andrew Cuomo pulled in 5%.

Rep. Jim Clyburn, Rep. Steny Hoyer and Sen. Chris Van Hollen, who all hold leadership positions within Congress, each fail to surpass 2%.

While former presidents and House Speakers typically don't weigh in to take sides in partisan primaries, a number of senators running for president are clamoring for the opportunity to collaborate with Ocasio-Cortez on legislation to bolster their credentials among progressives, and get a shot at earning her endorsement.

While Ocasio-Cortez has said she isn't planning on endorsing anyone in the primary for quite some time, she indicated that it may come down to either Sen. Bernie Sanders or Sen. Elizabeth Warren in a recent interview with CNN.

""What I would like to see in a presidential candidate is one that has a coherent worldview and logic from which all these policy proposals are coming forward,"" she told CNN's Ryan Nobles in May. ""I think Sen. Sanders has that. I also think Sen. Warren has that.""

Ocasio-Cortez has partnered with Sanders, who she affectionately nicknames ""tío"" or Uncle Bernie, on climate issues, holding town halls to promote her Green New Deal resolution and more recently, partnering on legislation to cap credit card interest rates and drawing up a resolution to declare a national emergency over climate change.

Read more: Bernie Sanders compares climate change to Pearl Harbor attack as he and Alexandria Ocasio-Cortez unveil emergency resolution

In April, Ocasio-Cortez had lunch in DC with Warren, with the two later teaming up to shoot a video sharply criticizing Treasury Secretary Steve Mnuchin over his role in the demise of department store Sears— and joked about their disappointment over the series finale of ""Game of Thrones.""

On July 10, Sen. Kamala Harris— who has faced scrutiny over her record on criminal justice — announced that she and Ocasio-Cortez were collaborating on legislation to allow Americans with criminal records to apply for government-subsidized housing, and eliminate the so-called ""no-fault eviction"" rule, which allows the government to evict entire families if someone in the unit, including guests, commits a crime.

Warren also wrote a blurb about Ocasio-Cortez for TIME Magazine, which named the young lawmaker as one of the 100 most influential people of 2019.

""A year ago, she was taking orders across a bar,"" Warren wrote. ""Today, millions are taking cues from her... she reminds all of us that even while greed and corruption slow our progress...in our democracy, true power still rests with the people.""

Read more:

Elizabeth Warren outraised Bernie Sanders and Kamala Harris as her support surged in the 2nd quarter of 2019

Alexandria Ocasio-Cortez says Elizabeth Warren 'knocked it out of the park' in the first debate, while some candidates looked like unprepared schoolkids

Alexandria Ocasio-Cortez says Nancy Pelosi is picking on newly elected women of color

SurveyMonkey Audience polls from a national sample balanced by census data of age and gender. Respondents are incentivized to complete surveys through charitable contributions. Generally speaking, digital polling tends to skew toward people with access to the internet. SurveyMonkey Audience doesn't try to weight its sample based on race or income.The poll was conducted July 9-10, had a total of 1,105 respondents and a margin of error of plus or minus 3.15 percentage points with a 95% confidence level. See this page for more details about methodology."
EPA employee protests union contract while receiving award from Admin. Wheeler,https://thehill.com,[],07-11-2019,2019,7,https://thehill.com/policy/energy-environment/452614-epa-employee-protests-union-contract-while-receiving-award-from,"An Environmental Protection Agency (EPA) employee protested the agency’s new union contract while receiving an award from Administrator Andrew Wheeler Andrew WheelerOvernight Energy: Critics worry Trump ignoring plight of honeybees | EPA employee protests union contract while receiving award from Wheeler | Green groups team up to host presidential climate summit EPA employee protests union contract while receiving award from Admin. Wheeler Overnight Energy: Trump threatens veto on defense bill that targets 'forever chemicals' | Republicans form conservation caucus | Pressure mounts against EPA's new FOIA rule MORE on Wednesday.

Loreen Targos, an EPA employee in Chicago, unfurled a banner on stage next to Wheeler reading, “I care about EPA workers having a fair contract to address public health and climate change. Do you?”

Targos was on stage with the rest of a team being honored for cleaning up refinery waste near Muskegon Lake in Michigan.

ADVERTISEMENT

In

a video

released by American Federation of Government Employees (AFGE) Local 704, based in the Great Lakes region, Targos can be heard asking Wheeler if he supports a fair contract for EPA workers.

EPA employees have been outraged by a recent contract that went into effect Tuesday that remains unsigned by union leaders and scales back union protections.

In an interview with The Hill, Targos said Wheeler did briefly respond to her.

“I did look at him and ask him and ask if he was going to support a fair contract and he said something along the lines of agency talking points of ‘We tried to come to the bargaining table but you guys refused.’”

The fight between the EPA and the union began over how much of the contract was even negotiable. The EPA wanted to renegotiate the entire contract, while the union wanted to renegotiate a narrower slice.

Under the latest contract, union employees would have to give up office space within the EPA offices and union leaders would not be able to use the intranet or agency billboards to communicate with members. It would also limit the amount of time union leaders could spend helping rank-and-file employees with labor disputes and other issues by 75 percent. It also changes how employees can arbitrate their grievances.

Targos said the new contract was “unilaterally imposed.” The AFGE has already filed an unfair labor practice charge against the EPA.

“There was all this pomp and circumstance to highlight the good work of EPA employees,” Targos said. “Why take away the conditions that supported such award-winning work?”

The EPA said it issued the new contract after years of fruitless negotiations.

“Administrator Wheeler was proud to host the National Honor Awards ceremony for the first time in 10 years and recognize the outstanding achievements of more than 700 EPA staff,” a spokesman told The Hill. “This collective bargaining agreement (CBA) expired 12 years ago, the Trump EPA has worked with AFGE for the past two-and-half years to reach a new CBA and EPA is not the party refusing to come to the negotiating table.”

Targos said a security officer stopped her later and asked if she was actually an EPA employee.

“When I said yes he asked if I was really here to receive an award for that team and if I had just snuck on stage, so I said, ‘Yes I was in that group and supposed to get an award with that team,’” she said.

Targos said she was hoping to get more of a response from Wheeler.

“There’s always a part of you that hopes they will be better than what they say about them in the media, and it’s a sad thing to always be disappointed and realize, 'Oh you’re as bad as they say you are.'”"
Trump Admin’s ‘Pro-Women’ Human Rights Panel Stacked With Anti-Abortion Figures,https://www.thedailybeast.com,"['Emily Shugerman', 'Gender Reporter']",07-11-2019,2019,7,https://www.thedailybeast.com/state-department-loads-pro-women-commission-on-unalienable-rights-with-abortion-opponents,"A new Trump administration commission on human rights will be filled with anti-abortion advocates, including a former ambassador to the Holy See who declared that abortion is “related to the coarsening of the social fabric.”

Secretary of State Mike Pompeo announced the creation of the Commission on Unalienable Rights last week in a Wall St. Journal op-ed, in which he claimed the discussion around human rights had become diluted. The new group, he wrote, would “ground our discussion of human rights in America’s founding principles.”

The announcement drew concern from human rights groups like Amnesty International, who worried the commission would seek to limit the scope of human rights domestically and abroad. And while the State Department claims the group will not discuss abortion, the conservative makeup of the commission has reproductive rights advocates on edge.

“Appointing these ideologues to a commission purporting to safeguard human rights will have the opposite effect and will endanger the health and well-being of countless women,” Michelle Kuppersmith, director of reproductive rights group Equity Forward, said in a statement.

“This is a clear extension of the Trump administration’s anti-women, anti-reproductive health campaign, and a blatant attempt to restrict the rights of vulnerable populations around the globe.”

The chair of the 12-person commission, Harvard Professor Mary Ann Glendon, is a former U.S. ambassador to the Holy See who led the Vatican’s delegation to the United Nations Conference on Women in 1995. At the time, she told The New York Times she “could not agree more” with Pope John Paul II, who was known for his traditional Catholic stances on abortion and contraception. She later went on to receive Notre Dame’s Evangelium Vitae Medal for “Heroes Of The Pro-Life Movement.”

‘The whole question about abortion is related to the coarsening of the social fabric,” Glendon told the Times in 1995. “It promotes a certain callousness which has frightening implications for the future.”

Also serving on the commission is F. Cartwright Weiland, a Texas-based attorney who studied under Glendon at Harvard Law. Weiland helped write Supreme Court amicus briefs supporting Texas’s restrictions on abortion providers and served on the Council For Life’s “Role of Rights” education panel.

Commission member Shaykh Hamza Yusuf Hanson, the president of Zaytuna College, published an article last year calling abortion “an assault on a sanctified life,” while fellow member Christopher Olaf Tollefsen co-authored the book Embryo: A Defense of Human Life, which argues against stem-cell research and promotes the idea that life begins at conception.

“There is nothing potential about the life of the fetus, the embryo, or the zygote: it is actually alive,” he wrote in a 2010 journal article. “Nor is there anything potential about the humanity of that life: it is an actual human life.”

Commission member Jacqueline Rivers, a sociology lecturer at Harvard, spoke on a 2017 Harvard Law Students For Life Panel Entitled “Why We Are ProLife: Dignity, Equality, Human Rights,” where she discussed how her pro-life views are rooted in her Christian faith. (The year before, she had delivered a letter to Hillary Clinton from more than 20 black church leaders asking her to address “justice for the unborn.”) In 2016, commission member Paolo Carozza spoke about a pro-life approach to international develeopment on the Notre Dame Right To Life Panel.

A senior administration official did not answer The Daily Beast’s questions about whether any members of the commission support abortion rights. The official, who spoke on the condition of anonymity, said the commission would be advisory in nature and would not address “policy questions” like abortion rights. Instead, the official said, it would attempt to ground human rights in the founding principles of “life, liberty and the pursuit of happiness.”

“This is really a commission devoted to principles of inalienable rights,” the official said. “The commission has nothing to do with those kinds of domestic policy debates of the day; it will not discuss them.”

“ The commission is the most pro-women commission in the world, because it doesn't distinguish between men and women. ” — Senior administration official

“The commission is the most pro-women commission in the world, because it doesn't distinguish between men and women,” the official added.

The Trump administration has repeatedly tried to reduce its commitment to reproductive rights internationally, pushing to remove references to “sexual and reproductive health” from U.N. documents and threatening to veto a United Nations Security Council resolution on rape as a weapon of war because it mentioned reproductive health services. The State Department has also removed all data on reproductive rights from its annual Country Reports on Human Rights Practices.

In a press release, the Center for Reproductive Rights called the new commission “part of a comprehensive effort by this Administration to erase sexual and reproductive health and rights from global discourse.”

“Contrary to its asserted purpose, there is no need to redefine or develop foundational principles on human rights,” they said. “There is a clear and unequivocal consensus by U.N. human rights treaty bodies and independent experts that reproductive rights are human rights, grounded in the right to life, health, equality, non-discrimination and freedom from cruel, inhumane and degrading treatment, among other rights.”

Amanda Kasling, the Human Rights Watch Acting Co-Director for Women’s Rights, added that interpretations of international law define abortion is a human rights issue. Even a limited discussion of of “inalienable rights,” she said, would have include access to health care—including access to family planning and abortion—as well as prevention of maternal mortality.

“For women to actually be able to fully enjoy and have a fulfillment of their human rights, you have to ensure access to reproductive health care, full stop,” she said."
"Gold Prices Extend US Fed's 'Cut Coming' Gains, UK Gold Hits 8-Year Peak",https://www.bullionvault.com,[],,,,https://www.bullionvault.com/gold-news/gold-price-071120193,"× Save your cookie preferences

We use cookies to remember your site preferences, record your referrer and improve the performance of our site. For more information, see our cookie policy.

Please select an option below and 'Save' your preferences.

No cookies. Without any cookies our websites can't remember your site preferences (currency, weight units, markets, referrer, etc.) for your next visit. Any cookies already dropped will be deleted at the end of your browsing session.

BullionVault cookies only. We use these cookies to record your site preferences (currency, weight units, markets, referrer, etc.) for your next visit.

BullionVault cookies and third-party cookies. Also, allow our use of cookies from well-known third parties such as Google, Facebook, Bing and YouTube. These help us understand how visitors use our websites so we can improve them.

You can update your cookie preferences at any time from the 'Cookies' link in the footer."
Justice Department probing Deutsche Bank’s dealings with Malaysia’s 1MDB,https://nypost.com,['July'],07-11-2019,2019,7,https://nypost.com/2019/07/11/justice-department-probing-deutsche-banks-dealings-with-malaysias-1mdb/,"The US Justice Department is investigating whether Deutsche Bank violated foreign corruption or anti-money-laundering laws in its work for state fund 1Malaysia Development Berhad (1MDB), the Wall Street Journal said on Wednesday.

The news comes after the bank announced plans to scrap its global equities unit, cut some fixed-income operations and slash 18,000 jobs globally in an $8.34 billion restructuring program.

Deutsche Bank’s work for 1MDB included helping to raise $1.2 billion in 2014 as concerns about the fund’s management and financials had begun to circulate, the newspaper said, citing unidentified people familiar with the matter.

Prosecutors are mainly looking into the role of Tan Boon-Kee, a colleague of a former Goldman Sachs executive, Tim Leissner, who worked with him on 1MDB-related business, the paper said.

She left Goldman to become Asia-Pacific head of banking for financial institutions clients at Deutsche Bank, where she was involved with further 1MDB dealings, it added.

In an emailed statement, Deutsche Bank said it had fully cooperated with all regulatory and law enforcement agencies that made inquiries about the fund.

“As stated in asset forfeiture complaints filed by the U.S. Department of Justice, 1MDB made ‘material misrepresentations and omissions to Deutsche Bank officials’ in connection with 1MDB’s transactions with the bank,” the bank told Reuters.

“This is consistent with the bank’s own findings in this matter,” it added.

A DoJ civil asset forfeiture complaint repeatedly describes Deutsche Bank as being misled by 1MDB officers, the WSJ said.

Tan left Deutsche Bank last year, after it discovered communications between her and Jho Low, the Malaysian financier whom the Justice Department has described as the central player in the 1MDB scandal, it added.

A representative of insurance company FWD Group, Tan’s current employer, said the company and Tan declined to comment.

The DoJ did not immediately respond to a request for comment from Reuters."
Interior Dept. says it spent $2.45M in public funds on Trump’s ‘Salute to America’,https://wtop.com,['News Traffic Weather'],07-11-2019,2019,7,https://wtop.com/dc/2019/07/interior-dept-says-it-spent-2-45m-in-public-funds-on-trumps-salute-to-america/,"Interior Secretary David Bernhardt put estimates of department's share of costs for President Donald Trump’s July 4 ""Salute to America"" at $2.45 million.

In a letter to lawmakers on Capitol Hill made public Thursday, Interior Secretary David Bernhardt put estimates of the department’s share of costs for President Donald Trump’s July Fourth “Salute to America” at the Lincoln Memorial at $2.45 million.

Bernhardt called the use of public funds justified, and cited past administrations’ spending for concerts, parades and other celebrations in and around the National Mall.

Interior’s costs included crowd accommodations, such as temporary fencing and portable toilets.

The disclosure confirms what The Washington Post had previously reported: that close to $2.5 million was diverted from the National Park Service, which normally uses the money from entrance and recreation fees to make improvements to U.S. parks.

Arizona Democrat Raul Grijalva, chairman of the House Natural Resources Committee, said the public funds were used to “celebrate President Trump.”

There are further concerns from local leaders as well.

In a Tuesday letter to Trump, D.C. Mayor Muriel Bowser said the president’s Fourth of July event on the National Mall, as well as protests by others, have left the city’s security fund bankrupt, and that it will be running at a deficit of more than $6 million by the end of September.

She attributed the Emergency Planning and Security Fund (EPSF) numbers to estimates by the District’s Homeland Security and Emergency Management Agency and said the total cost for the District is estimated at $1.7 million.

The EPSF covers public safety at events, anti-terror efforts and support for the Secret Service.

Security for the annual “A Capitol Fourth” concert, which was held the same day on the National Mall, was provided by the federal Capitol Police and U.S. Park Police, not D.C. police.

Bowser also said D.C. still hasn’t been reimbursed the $7.3 million extra it spent for Trump’s 2017 inauguration.

“These overages can be attributed to declining reserves, increased demand for heightened security, and a one-time draw down of $7.3 million to cover security costs associated with the 2017 presidential inauguration,” Bowser wrote.

The White House debates that figure.

Reached for comment about Bowser’s letter, the White House said: “We have received the letter and will respond in a timely manner.”

Senators are also seeking to probe the cost of the event, which included military flyovers and tanks on the National Mall.

WTOP has submitted a Freedom of Information Act request with the National Park Service, via the Interior Department, to see a cost breakdown for the event.

A Defense Department spokesperson confirmed Wednesday that the Pentagon spent $1.2 million on the “Salute to America” celebration, which does not factor in the cost of flyovers, since the flyovers are being listed as training flights to “facilitate flying hours, which are imperative to military readiness.”

That puts known cost estimates for “Salute to America” at $5.35 million.

The Associated Press contributed to this report.

Like WTOP on Facebook and follow @WTOP on Twitter to engage in conversation about this article and others.

© 2019 WTOP. All Rights Reserved. This website is not intended for users located within the European Economic Area."
