Treasury is about to flood the market with debt to fund U.S.’s $1 trillion deficit — and that is a concern,https://www.marketwatch.com,"['Joy Wiltermuth', 'Markets Reporter']",08-15-2019,2019,8,https://www.marketwatch.com/story/the-us-treasury-is-about-to-flood-the-market-with-debt-to-fund-a-1-trillion-deficit-heres-why-that-is-a-worry-2019-08-15,"There may be some limitations to the U.S. government’s borrowing, after all.

An anticipated surge of U.S. borrowing in the global debt markets in the second half of this year is starting to create concern as the Treasury is expected to ramp up its issuance of bills, notes and bonds to fund a soaring $1 trillion budget deficit.

The U.S. government’s budget gap has widened 27% as compared with the first 10 months of fiscal 2018, as spending has risen 8% and receipts have grown by 3%. The federal fiscal year runs October through September. The Trump administration recently forecast a $1 trillion full-year shortfall, while the Congressional Budget Office is slightly more conservative, putting it at $896 billion.

Last month the U.S. Treasury laid out its plans to borrow $814 billion between July and December, after the Trump administration and Congress agreed to a two-year postponement of the U.S. debt ceiling, ensuring no government shutdown or a federal default.

Not only does the Treasury needs to borrow to cover the fiscal deficit created by Trump’s 2017 tax cuts and the inability of Congress to agree on spending cuts, but Treasury needs to rebuild its cash balance which was run down to pay the governments bills when the debt ceiling was hit in May.

The coming deluge of Treasury issuance has stoked worries on Wall Street about whether there is enough liquidity in the system in the short term to meet the supply without pushing up short-term borrowing costs and inverting the yield curve even further.

U.S. dollar liquidity is deteriorating and “is reaching a point where it may require drastic action if measures aren’t taken to address it soon,” warned Gaurav Saroliya, director of macro strategy at Oxford Economics, in a note on Wednesday.

To illustrate the concern, Saroliya pointed to the higher costs already faced by London-based banks lending to one other overnight in dollars, the popular dollar Libor-OIS spread, which has climbed in anticipation of the Treasury glut hitting markets.

This chart shows the rise of the 3-month dollar Libor-OIS spread since May, even as U.S. Treasury cash balances at the Federal Reserve have dropped from about $400 billion to closer to $150 billion.

Oxford Economics International funding squeeze

As the Treasury restores its cash balance with the coming supply, Saroliya expects liquidity woes to worsen, particularly in a scenario where long-term Treasury notes are yielding less than shorter-dated debt.

“With Treasury issuance set to surge in the wake of the recent debt-ceiling deal, an inverted yield curve could create a significant issuance indigestion in the market,” Saroliya wrote.

On Wednesday, the U.S. Treasury 10-year note’s TMUBMUSD10Y, -1.58% yield briefly fell below the 2-year note’s TMUBMUSD02Y, -1.86% yield, an inversion of the funding curve that has foretold past economic slowdowns.

Read: 2-year/10-year Treasury yield curve inverts, triggering bond-market recession indicator

Meanwhile fears of an economic recession rattled U.S. stocks Wednesday, with the Dow Jones Industrial Average DJIA, +0.96% closing down 800 points, its biggest one-day fall this year, before some recovery on Thursday morning in the benchmark S&P 500 index SPX, +1.21% .

Amid the stock-market rout, the chances of a half-percentage-point cut in the federal funds rate in September rose to 30.4%. Markets are pricing in a 69.6% chance of a quarter-point rate cut next month.

Despite the rising Treasury debt issuance, investors globally have been buying U.S. government debt, pushing the 30-year U.S. bond TMUBMUSD30Y, -1.09% to a record low around 2% this week, as yields on many other developed-economy bonds are even lower, with about $15 trillion in debt now offered at negative yields.

Slowing global economic growth due to the U.S.-China trade war is resulting in central banks’ easing monetary policy, and an array of geopolitical risks from Brexit, to Italian political instability, to U.S. sanctions on Iran and violent protests in Hong Kong are encouraging investors into the safe haven of U.S. debt.

But in the short-term money markets, the coming flood of U.S. debt issuance may cause indigestion.

Bond dealers who underwrite the Treasury’s debt sales in the weekly auctions are already holding record amounts of U.S. Treasurys on their books as the fiscal deficit has increased. Now their need to borrow more cash in short-term money markets, using Treasuries as collateral, to buy even more government debt is pushing up short-term rates.

A key risk barometer, the U.S. “repo” market, where cash is borrowed overnight using Treasurys for collateral, has signaled that liquidity is tightening.

Repo rates have climbed recently in relation to what the Federal Reserve pay banks to hold excess reserves. The rate that lenders have charged for cash in the market for Treasury repurchase agreements was 2.22% on Tuesday, compared with the 2.1% that the Federal Reserve pays banks to hold excess reserves, known as the IOER rate.

See at WSJ.com: Rising repo rates fuel concern over mounting U.S. debt

Liquidity may also be tightening in the market for short term borrowing of U.S. dollars internationally, known as the “foreign repo pool” where non-U.S. investors keep cash balances with the Federal Reserve, and the rising costs of currency hedging given the strength of the U.S. dollar may make investing in U.S. Treasury debt less appealing, Saroliya noted.

China and Japan were by far the largest foreign holders of Treasury securities, as of July 16, in the most recent report of holders.

For Saroliya, it all boils down to the Federal Reserve needing to act to preserve liquidity, perhaps by cutting benchmark U.S. rates by another 50 to 100 basis points or through another round of quantitative easing or bond buying.

“And that needs to be immediate!” Saroliya urged.

Read: Fed not on red-alert after yield-curve inversion

Earlier this month, Bank of America Merrill Lynch analyst Mark Cabana also warned that the historically high levels of Treasury securities held by dealers could pose problems when it come to issuing more debt.

This chart shows dealer holdings of Treasury debt rising between January and July, at the same time custody holdings at the New York Fed have declined.

Bank of America Merrill Lynch

“We are concerned that the U.S. banking system is nearing reserve scarcity,” Cabana wrote in a note to clients. Ultimately, he said opening the Treasury “floodgates” would likely “force the Fed to start expanding its balance sheet by year-end.”

To be sure, not everyone sees doom in the U.S. adding to the already $22.4 trillion national debt.

“A lot of Street commentators have highlighted the fact that there is going to be a huge amount of supply in the Treasury market, and how that is going to affect rates,” said Robert Sabatino, global head of liquidity at UBS Asset Management, in an interview with MarketWatch.

“When you look at the space though this is a market that most people want to own at some point, especially given the fact that there are $15 trillion of bonds in negative yields,” he said. “It makes the U.S. look really attractive.”"
"New evidence shows why Steele, the Ohrs and TSA workers never should have become DOJ sources",https://thehill.com,[],08-15-2019,2019,8,https://thehill.com/opinion/white-house/457628-new-evidence-shows-why-steele-the-ohrs-and-tsa-workers-never-should-have,"One of the inevitable outcomes of the Russia case will be that the Department of Justice (DOJ) almost certainly will need internal reforms.

The first reform is the most obvious, given the unraveling of the Russia collusion narrative: a new set of rules governing when the FBI can investigate or spy on a First Amendment-protected political campaign during an election.

The FBI never should have been allowed to sustain a counterintelligence investigation into Donald Trump Donald John TrumpTrump pushes back on recent polling data, says internal numbers are 'strongest we've had so far' Illinois state lawmaker apologizes for photos depicting mock assassination of Trump Scaramucci assembling team of former Cabinet members to speak out against Trump MORE’s campaign based on hearsay from Australian diplomat Alexander Downer, who helped to arrange a $25 million Australian government donation to the Clinton Foundation, and on a “minimally” verified dossier written by British spy Christopher Steele, who was working on the Hillary Clinton Hillary Diane Rodham ClintonTop Sanders adviser: Warren isn't competing for 'same pool of voters' Anti-Trump vets join Steyer group in pressing Democrats to impeach Trump Republicans plot comeback in New Jersey MORE opposition-research team.

ADVERTISEMENT

The second reform may be less visible but becomes painfully obvious, thanks to a series of internal DOJ investigative memos released this month that expose glaring issues with the handling, vetting and weighting of “confidential human sources.” That’s a fancy term for people — sometimes called “snitches” or informants, in street vernacular — who secretly provide evidence to law enforcement.

Some examples of the DOJ’s problems with informers fall outside the Russia case but mirror the same issues unmasked in the now-debunked probe of Trump.

Take, for example, the DOJ inspector general’s finding this month that the Drug Enforcement Administration (DEA) was paying other government officials at the Homeland Security Department’s Transportation Security Administration (TSA) to work as informants.

The IG spared few words in decrying the idiocy of allowing government security officers collecting a federal salary to double-dip into taxpayers’ money by receiving informant pay to report criminal activity they were required by their jobs to disclose.

Two agents and one supervisor “violated the DEA Confidential Source policy” by paying three TSA workers as informants, the report concluded. And one agent wrongly served as handler for a TSA informant with whom he was involved in a “personal relationship,” investigators found, exposing a problem dating to 2013.

“By establishing the TSA employees as paid Limited Use Confidential Sources, the DEA agreed to pay for information that the TSA employees were already obligated to provide to law enforcement,” the IG concluded.

ADVERTISEMENT

In other words, there should be a bright line: Government agents should stick to their jobs and leave the informing to private citizens.

That line similarly was breached in the minds of many when Bruce Ohr, then the DOJ’s assistant deputy attorney general, began collecting anti-Trump information on July 30, 2016, from former MI6 agent Steele and pushing it on the top levels of the DOJ and the FBI.

At the time, Ohr knew his wife, Nellie, and Steele worked for the Fusion GPS research firm on the same project to dig up Russia dirt on Trump, to help the Clinton campaign and the Democratic National Committee (DNC) win the 2016 election. Furthermore, Ohr told the FBI he knew Steele was a foreigner “desperate” to stop a Trump presidency, FBI memos show.

With his seniority inside DOJ, Ohr quickly got Steele’s information to the FBI’s deputy director, Andrew McCabe, and three top DOJ supervisors, despite the red flags.

Before long, Steele was working as a confidential informant for the bureau, and his dossier was used to secure a surveillance warrant targeting the Trump campaign weeks before Election Day.

When Steele got fired Nov. 1, 2016, by the FBI for leaking to the media, Ohr became a conduit for the bureau to keep getting information from Steele for months. Ohr met at least 12 times in late 2016 and 2017 with FBI agents to provide new intel from the British spy. In other words, Ohr transitioned from being a DOJ supervisor to a backdoor source for the FBI to receive information from a terminated source.

And he didn’t stop there.

Records released this week, thanks to litigation by the conservative group Judicial Watch, show the senior DOJ official took at least two research files from his wife and her Fusion GPS work and provided them to FBI agents investigating Trump. One alleged that unverified ties existed between the Trump organization and Russian mobsters; the other provided a timeline alleging wrongdoing by former Trump campaign manager Paul Manafort.

Nellie Ohr testified to Congress that some of her anti-Trump information came from foreign officials in Ukraine, including a parliamentary member highly critical of Manafort.

Examination of the Nellie Ohr documents given to the FBI shows some of her source material also came from former Ukrainian presidential candidate Yulia Tymoshenko and a lawsuit she filed against Manafort.

Why is that significant? Tymoshenko and Hillary Clinton had a simpatico relationship after the former secretary of State went out of her way in January 2013 to advocate for Tymoshenko’s release from prison on corruption charges.

So, Bruce Ohr became a conduit of information not only for intelligence from Clinton’s British opposition-researcher but also from his wife’s curation of evidence from a Clinton foreign ally and Manafort enemy inside Ukraine. Talk about foreign influence in a U.S. election!

ADVERTISEMENT

To Ohr’s credit, he disclosed his potential conflict of interest involving his wife to DOJ officials. To DOJ’s discredit, he was allowed to act as a source for both his wife and Steele anyway.

Ohr also didn’t get compensated as a paid informant, like the TSA workers. But documents show a curious thing happened during the time he began peddling the anti-Trump intelligence from his wife and Steele: His annual performance bonus doubled from about $14,000 in November 2015 to $28,000 in November 2016.

The blurred line between government official and informer/source didn’t stop with Ohr. Former FBI General Counsel James Baker also admitted he took dirt on Trump from DNC lawyer Michael Sussmann in summer 2016 and gave it to the agents investigating the Trump campaign.

The ultimate consequence — some might argue folly — of all these blurred lines is most easily exposed in an often overlooked document from the Russia probe.

I’ve written that the FBI kept a spreadsheet showing almost all of what Steele provided agents and Ohr on Russia-Trump dirt turned out to be unverified, disproven or nothing more than internet rumors. But when the FBI closed its paperwork on Steele in 2018, a professional intelligence analyst concluded in his human source validation report that the bureau assessed it had only “medium confidence” in Steele and that his intelligence could only be “minimally” verified.

In other words, his intelligence wasn’t very good. And yet, America spent nearly three years in turmoil only to learn that Steele’s Trump-Russia allegations — paid by Clinton and propagated by Ohr — were not true.

ADVERTISEMENT

The tales of Bruce and Nellie Ohr, Christopher Steele, Yulia Tymoshenko, and those DEA and TSA agents raise a stark warning: The lines between government officials and informants, unverified political dirt and real intelligence, personal interest and law enforcement, became too blurred for the Justice Department’s own good.

That’s a problem sorely in need of fixing.

John Solomon is an award-winning investigative journalist whose work over the years has exposed U.S. and FBI intelligence failures before the Sept. 11 attacks, federal scientists’ misuse of foster children and veterans in drug experiments, and numerous cases of political corruption. He serves as an investigative columnist and executive vice president for video at The Hill. Follow him on Twitter @jsolomonReports."
E.P.A. Backtracks on Use of ‘Cyanide Bombs’ to Kill Wild Animals,https://www.nytimes.com,['Neil Vigdor'],08-16-2019,2019,8,https://www.nytimes.com/2019/08/16/us/epa-cyanide-bombs.html,"The federal Environmental Protection Agency on Thursday withdrew its support for the continued use of so-called cyanide bombs to protect livestock from predators, reversing course amid strong opposition to the practice.

The E.P.A. administrator, Andrew R. Wheeler, said he was withdrawing an interim reauthorization for the use of M-44 devices, which are used to kill coyotes, foxes and other animals that prey on livestock. The agency, he added, would re-evaluate the highly criticized practice.

“This issue warrants further analysis and additional discussions by E.P.A. with the registrants of this predacide,” Mr. Wheeler said in a statement on Thursday. “I look forward to continuing this dialogue to ensure U.S. livestock remain well protected from dangerous predators while simultaneously minimizing off-target impacts on both humans and nonpredatory animals.”

The federal Department of Agriculture, along with its state counterpart agencies in Montana, New Mexico, South Dakota, Texas and Wyoming, have relied on the M-44s for farming since the mid-1970s."
Barre now owes $170K on USDA loan to former fire district,https://www.wcax.com,[],,,,https://www.wcax.com/content/news/Barre-now-owes-170K-on-USDA-loan-to-former-fire-district-554395941.html,"Barre Town is on the hook for about $170,000 of a U.S. Department of Agriculture loan to a fire district since absorbed by the town.

The Times Argus reports that the USDA has contacted Barre Town officials about a loan the Websterville Fire District received in the 1990s.

The Websterville district was absorbed into Barre Town last June after voters there and in Websterville approved it.

It was thought that absorbing the district and its water supply could offset the $100,000 the town spends on water from Barre City.

The town manager says the district never notified the USDA of the merger and the town is now responsible for the loan.

(Copyright 2019 The Associated Press. All rights reserved. This material may not be published, broadcast, rewritten or redistributed.)"
