Save The Bees: EPA Bans 12 Pesticides Harmful To Honeybees,https://www.wbur.org,[],05-28-2019,2019,5,https://www.wbur.org/onpoint/2019/05/28/honeybees-pesticides-epa,"With Meghna Chakrabarti

The EPA is pulling a dozen products containing chemicals harmful to honeybees. It's the end of a long legal battle, but not the end of the threat to bees.

Guests

Adam Allington, chemicals and pesticides reporter for Bloomberg Environment. Host of Bloomberg Environment’s ""Business of Bees"" podcast. (@aallington)

Aimee Code, pesticide program director at the the Xerces Society for Invertebrate Conservation. (@xercessociety)

Carson Klosterman, corn and soybean farmer who uses neonics. Former president of the North Dakota Corngrowers Association. (@NDStripTillCorn)

From The Reading List

Bloomberg Environment: ""EPA Curbs Use of 12 Bee-Harming Pesticides"" — ""The Environmental Protection Agency has canceled registration of a dozen pesticides, from a class of chemicals known to harm bees.

""The cancellations are effective as of May 20 for 12 neonicotinoid-based products produced by Syngenta, Valent, and Bayer.

""The Federal Insecticide, Fungicide, and Rodenticide Act requires pesticides sold or distributed in the U.S. to be registered by the EPA.

""Under a December settlement agreement linked to an Endangered Species Act challenge by environmental groups, the companies voluntarily agreed to petition EPA to cancel 12 out of 59 products containing the active ingredients clothianidin and thiamethoxam.

""Developed as an alternative to organophosphate and carbamate pesticides, neonicotinoids are chemically related to nicotine, and attack the nervous system of insects.""

Washington Post: ""The Energy 202: EPA blocks a dozen products containing pesticides thought harmful to bees"" — ""The Environmental Protection Agency is pulling from the market a dozen products containing pesticides known to be toxic to a linchpin of the U.S. food system — the honeybee.

""The agency announced Monday it has canceled the registrations of 12 pest-killing products with compounds belonging to a class of chemicals known as neonicotinoids, as part of a legal settlement.

""For years, beekeepers and wildlife conversationalists alike have voiced concern that the widespread use of neonics, as the chemicals are commonly called, is imperiling wild and domesticated bees crucial to pollinating commercial fruit, nut and vegetable crops.""

PBS NewsHour: ""Neonicotinoid pesticides are slowly killing bees"" — ""Neonicotinoid pesticides commonly found in agricultural areas kill bees and hurt their ability to reproduce, two separate large-scale studies confirmed for the first time Thursday.

""The two studies — one that examined honeybees in Canada and the other that looked at three bee species in the United Kingdom, Germany and Hungary — were the first large-scale investigations to test the popular agrochemicals influence on bees in real world settings.

""The work also turns many preconceived notions about bees and pesticides on their heads.""

Grace Tatter produced this hour for broadcast."
Department of Homeland Security Detains Miami Activist at Homestead Facility for Migrant Children UPDATED,https://www.miaminewtimes.com,['Brittany Shammas'],05-27-2019,2019,5,https://www.miaminewtimes.com/news/homestead-shelter-for-migrant-children-alessandra-mondolfi-detained-by-homeland-security-11181156,"Alessandra Mondolfi was painting hearts on a poster board outside the Homestead child migrant camp last Friday when she spotted a pair of law enforcement officers walking toward her. An artist and activist who's part of a group of protesters maintaining a daily presence outside the facility, Mondolfi was working on a memorial to migrant children who have died in custody. ""Here they come,"" one of the other activists said as the officers approached.

The two men — one in a Department of Homeland Security police uniform, the other in plainclothes — asked Mondolfi her name, then pushed her against a car and cuffed her, she says. They then allegedly put her in the back of a car and questioned her for about an hour, asking, bizarrely, whether she had aliases or a neck tattoo, and if she knew the names of the other protesters. Then, about an hour after first approaching Mondolfi, the officers let her go.

Days later, it's still unclear why she was detained. DHS did not respond to a request for comment. Mondolfi says the Miami-Dade Police Department and, weirdly, the Miami-Dade Schools Police, sent squad cars to the scene. The El Paso Police Department has a warrant out for Mondolfi's arrest over a protest she and other activists held at the U.S. Border Patrol Museum. But why would DHS be involved in a city-level case?

Mondolfi has a theory for why she was detained: It was done to rattle her after months of protesting. She notes it was her group that spotted John Kelly — former Homeland Security chief and White House chief of staff under President Donald Trump — touring the Homestead shelter last month, around the same time congresswomen were being denied entry. Soon after Kelly's visit became public, CBS News confirmed he had joined the board of Caliburn International, the for-profit company that runs the place.

""They are trying to scare me, intimidate me,"" Mondolfi says.

Courtesy of Alessandra Mondolfi

Her detainment comes amidst a series of instances of the government watching and prosecuting protesters. Earlier this year, the Intercept revealed that DHS had monitored anti-family separation protests held across the country, treating them as if they were security threats. A contractor working with the agency reviewed demonstrations across South Florida, from West Palm Beach to Miami. The information was shared with DHS and state-level law enforcement.

Meanwhile, two University of Arizona students were arrested in late March for protesting the appearance of Customs and Border Protection officers. The Arizona Republic reported they were among people who stood outside the event calling the officials “murderers” and “an extension of the KKK.” A group of protesters followed the agents as they left the presentation, calling them ""Murder Patrol."" Anti-Dakota Access Pipeline protesters have also been arrested.

At the Homestead shelter, another protester was detained on April 24. That day, MDPD officers handcuffed a New York man named Joshua Rubin and put him in the back of a squad car. Rubin said the cops told him he was being stopped on suspicion of trespassing. He refused to give them his name, he said, because he was on a county road. Eventually he identified himself and was released. MDPD told New Times it had no record of Rubin's detainment.

""You have to expect, when you're protesting, that people are going to try and get you to go away,"" said Rubin, who for months held a one-man vigil outside a camp for migrant teenagers in Texas. ""But the extent to which it's happening here is more extreme.""

Mondolfi says Homeland Security officers began showing up at the facility several weeks ago. When the two men approached her last Friday, they asked for her ID, but it was in her car. She says she asked to go get it, but instead ended up being questioned in the back of a police car. The MDPD and schools police cars showed up.

Daisy Gonzalez, a spokeswoman for Miami-Dade County Public Schools, tells New Times there is no record of a call for service on that date, and questioned whether a photo provided by protesters was actually taken on the date in question. After publication, she said a school officer responded after the Department of Homeland Security ""put out an emergency call for back-up."" When the officer arrived, the situation had already been handled, so he cleared the incident without taking action. MDPD did not respond to a request for information.

Courtesy of Alessandra Mondolfi

For her part, Mondolfi says she hasn't been back to the shelter since the day she was detained.

""I am not in Homestead; I have not been all week,"" she says. ""I'm not able to do the work that I'm doing. And I am scared, which is all the things they want. They want you to be scared, they want you to be intimidated... and at this point, they're winning, and that's angering me."""
Trump climbs into a sumo ring to present a 60-pound ‘President’s Cup’ in highlight of Japan trip,https://www.washingtonpost.com,"['Ashley Parker', 'White House Reporter', 'Simon Denyer', 'Tokyo Bureau Chief Covering Japan', 'North Korea', 'South Korea.']",05-26-2019,2019,5,https://www.washingtonpost.com/politics/trump-presents-gilded-presidents-cup-to-sumo-champion-in-a-highlight-of-his-japan-trip/2019/05/26/fca43394-7e37-11e9-8bb7-0fc796cf2ec0_story.html,"Finally, after a full day of matches, perhaps the biggest star of all — weighing in at 243 pounds, according to his most recent physical — climbed into the sumo ring.

President Trump stepped into the dohyo shortly after 5:30 p.m. Sunday to present the “President’s Cup” — a roughly 4½ -foot, more than 60-pound trophy that served as a physical manifestation of the gilded, ceremonial nature of Trump’s four-day trip here.

The president seemed to enjoy his low-key star turn at Ryogoku Kokugikan stadium, exclaiming afterward, “That was an incredible evening at sumo.”

“Sumo wrestling,” he marveled later.

[Trump is presenting a sumo trophy in Japan. France beat him to it nearly 20 years ago.]

Trump took in just five matches — some lasting but several seconds — alongside Japanese Prime Minister Shinzo Abe on Sunday evening. But he spent the morning putting on a show of his own; at roughly 7:30 a.m. local time, the president fired off a tweet that, in a single social media missive, undercut his national security adviser, reaffirmed his ties with a dictator and attacked a domestic political rival on foreign soil, while misspelling the rival’s name.



President Trump, first lady Melania Trump and Prime Minister Shinzo Abe’s wife, Akie Abe, watch a sumo battle during the Summer Grand Sumo Tournament in Tokyo on Sunday. (Brendan Smialowski/AFP/Getty Images)

“North Korea fired off some small weapons, which disturbed some of my people, and others, but not me,” Trump wrote, in a second tweet that corrected his initial misspelling of former vice president Joe Biden’s last name. “I have confidence that Chairman Kim will keep his promise to me, & also smiled when he called Swampman Joe Biden a low IQ individual, & worse. Perhaps that’s sending me a signal?”

Less than a day earlier, Trump’s national security adviser, John Bolton, had argued the opposite to reporters here, warning there is “no doubt” North Korea’s missile tests violated United Nations Security Council resolutions and adding that Trump was determined to maintain sanctions pressure on the regime until it backs down.

In a conference call with reporters before Trump departed for Japan, a senior administration official had promised a “substantive” trip, with “some substantive things to announce.” But until the president made news with his impromptu tweet Sunday morning, Trump’s appearance at the sumo championship seemed to be one of the main events of his visit.

Indeed, Trump spent his first full day in Japan largely as a tourist. Earlier in the day, the president and Abe had played golf at Mobara Country Club in Chiba — complete with selfies and double cheeseburgers made with U.S. beef — and after the sumo championship, the two leaders and their wives headed for dinner of traditional Japanese grilled fare known as robatayaki. (The menu seemed specifically designed for Trump’s generally bland tastes — a five-course meal that included buttered potatoes, grilled chicken, Wagyu beef with vegetables and vanilla ice cream).

Trump’s planned appearance at the sumo match was relatively restrained for a president who became a household name as a reality TV star and often seems to thrive amid chaos and even encourage it. Gone were his days as a World Wrestling Entertainment personality who, in 2007, clotheslined WWE Chairman Vince McMahon and faux-pounded him, ringside, before shaving him bald in a viral pay-per-view moment.

Instead, Trump entered the sumo ring after donning slippers — no shoes are allowed in the dohyo — and read from a scroll, the “certificate of commemoration” in honor of the 25-year-old victor, Asanoyama.

“In honor of your outstanding achievement as sumo grand champion, I hereby award you the President’s Cup,” Trump said.

A sumo official helped him lift the heavy cup and hand it to Asanoyama, who bowed several times. The president shook his hand, clapped, at one point bowed slightly himself, and exited the ring.

Perhaps the most dramatic moment of Trump’s award presentation came before the president was even onstage; the silver trophy — which features an eagle atop it, wings high, and which was displayed Sunday afternoon to some fanfare in the lobby of the hotel where the president is staying — was brought out draped in white cloth, and the crowd gasped when its covering was removed.

Jaime Tiktin, 54, a tourist from Mexico City, said it was a “strange surprise” to learn that Trump would be attending the sumo match. Tiktin said he read in the Japan Times that the Japanese “kind of made up this prize to make him feel good,” but he noted that Trump seemed subdued.

“He didn’t smile at all; he didn’t do any gestures,” Tiktin said. “It was kind of strange to see him not moving his lips at all.”

Tiktin and his wife — who came bearing a homemade “Viva Mexico” sign — said they are not fans of Trump because of the way he has treated Mexicans, but they added that Trump was apparently trying to abide by sumo protocol. “I think he was being respectful,” Tiktin said. “I hate to say that, but I think he was respectful.”

In the run-up to the sumo championship, Trump prompted some griping among the Japanese. Some were annoyed that he and his wife, Melania, received special treatment and were allowed to sit in chairs close to the ring. Normally, attendees on the lower levels sit on cushions, called zabutons, and VIPs opt for seats on the second floor designed specifically for them. There was also concern the president’s entourage and large security detail would take away seats from Japanese sumo fans.

One widely shared article in the Japanese news media pointed out that the Japan Sumo Association is happy to follow many anachronistic traditions, such as forbidding women from standing in the ring. The article asked rhetorically, “Is not it against their traditions to let Trump sit on a seat by the ring and wear slippers into the ring to present his cup?” (Sumo wrestlers fight barefoot, though slippers were an acceptable alternative to shoes for Trump.)

The zabutons — which spectators often throw into the air to cheer or show their dissatisfaction after a spectacular match — also posed a potential security headache. Sankei, a Japanese daily, even featured a story, complete with a photo of a flying zabuton, headlined, “Mr. Trump to watch the final day matches. Fear of zabuton.”

But in the end, Trump proved more a curiosity than a nuisance, the mere mention of his name almost invariably prompting giggles among the spectators.

“He’s a crazy guy, yeah?” said Ryugo Kato, 45, a Tokyo resident.

Kato said he thought Trump should have sat on the floor if he wanted to be close to the ring. “That’s the way this place is set up,” Kato said. “He should respect the custom. It’s the culture.”

Nonetheless, he also welcomed Trump to the match. “If he wants to come, fine,” Kato said. “There’s nothing wrong with watching the sport and paying some respect to Japan’s national sport.”

Asanoyama, for his part, seemed to be a potential Trump convert. According to Nikkan Sports, in an interview Saturday, the champion said, “I am going to check Wikipedia for Trump-san,” apparently to be better prepared.

By Sunday, asked after his victory about being the first person to receive the “President’s Cup,” Asanoyama was emotional.

“I was overjoyed,” he said. “It was almost too much to say in words.”

Akiko Kashiwagi contributed to this report."
47 States Call On Betsy Devos To Forgive Student Loans For Disabled Veterans,https://www.npr.org,['Cat Schuknecht'],05-25-2019,2019,5,https://www.npr.org/2019/05/25/727002406/47-states-call-on-betsy-devos-to-forgive-student-loans-for-disabled-veterans,"47 States Call On Betsy Devos To Forgive Student Loans For Disabled Veterans

Enlarge this image toggle caption Bloomberg/Bloomberg via Getty Images Bloomberg/Bloomberg via Getty Images

Updated Sunday at 2:14 p.m. ET

On Friday, three days before Memorial Day, attorneys general for 47 states wrote to Education Secretary Betsy DeVos asking her to automatically forgive student loans for eligible disabled veterans.

The Department of Education has identified more than 42,000 veterans who qualify for a federal program known as Total and Permanent Disability Discharge, or TPD, that offers to relieve borrowers from repaying certain government student loans. These veterans, the letter says, shoulder over $1 billion in education debt that could be forgiven.

To get the benefit, veterans must first apply for the program. According to information obtained by the group Veterans Education Success through a Freedom of Information Act request, almost 60 percent of eligible veterans had defaulted on a loan payment as of April 2018. Yet only about 20 percent had applied to the loan forgiveness program.

The attorneys general want that to change. In the letter — which was also signed by attorneys general for the District of Columbia and three U.S. territories — they propose making the forgiveness program automatic for veterans who have been identified by the Department of Education.

""As a nation, we have a moral obligation to assist those who have put their lives on the line to defend us,"" the letter reads. ""There is no statutory or legal requirement that the Department of Education demand that eligible veterans affirmatively apply for TPD discharges before the Department will forgive their loans.""

In a statement to NPR, the Education Department said it recognized the sacrifices that veterans make for their country, adding that it has worked to streamline the TPD discharge process.

""While we have worked to make this process as easy and as seamless as possible for veterans, the last thing we want to do is cause unintended consequences for them,"" according to the statement.

The department said discharges could raise veterans' tax bills or inhibit them from taking out more student loans.

In their letter to DeVos, the attorneys general dismissed the department's concern about increasing borrowers' tax bills.

""[F]ederal tax law now excludes loan discharges for disabled borrowers from taxable income, and most states' tax codes do likewise,"" said the letter. ""Moreover, we think it likely that most borrowers would prefer to have one hundred percent of their outstanding loans discharged, even if this resulted in an increase to their state tax bill.""

The letter from the attorneys general follows at least two other similar letters that Republican and Democratic members of Congress sent to DeVos last year."
USDA staffers quit en masse as Trump administration eyes moving offices out of DC,https://www.foxnews.com,"[""Andrew O'Reilly""]",,,,https://www.foxnews.com/politics/usda-staffers-quit-en-masse-as-trump-administration-eyes-moving-offices-out-of-dc,"Employees at the U.S. Department of Agriculture are quitting at a rapid clip as Secretary Sonny Perdue prepares to move forward with plans to relocate two offices far outside the Washington, D.C., Beltway.

Federal employees at the Economic Research Service (ERS) and the National Institute of Food and Agriculture (NIFA) – two small but important agencies within the USDA – are unhappy with Perdue’s plan, announced last August, to move the majority of their staff from current offices in the capital to an area closer the country’s agricultural centers.

“This move does not serve a public purpose,” Peter Winch, a representative for the American Federation of Government Employees, a union that represents ERS workers, told Fox News. “Employees don’t want to move, and it doesn’t make sense for them to move.”

US FARMERS HURT BY TRADE WAR GETTING $16 BILLION BOOST, US AGRICULTURE SECRETARY SAYS

Winch added that since ERS employees joined AFGE earlier this month, six employees have already quit their jobs with the government agency in response to the planned move. He said overall staffing is down to 209 from 300 during the Obama administration.

A Washington Post report cited an estimate that the ERS used to see roughly one “non-retirement” departure per month – but that pace has doubled since October. NIFA reportedly has also seen people leave.

Perdue said in a statement to Fox News that the move was meant “to improve performance and the services these agencies provide.” The secretary of agriculture added that the planned move would bring the department’s scientists closer to “stakeholders” and “customers” such as Midwest farmers.

“It’s been our goal to make USDA the most effective, efficient, and customer-focused department in the entire federal government,” Perdue said. “We don’t undertake these relocations lightly, and we are doing it to improve performance and the services these agencies provide.”

Perdue added: “We will be placing important USDA resources closer to many stakeholders, most of whom live and work far from Washington, D.C. We will be saving money for the taxpayers and improving our ability to retain more employees in the long run.”

The goal of the ERS, however, is to provide statistical information to lawmakers in Washington, while NIFA works to fund hundreds of millions of dollar annually in research in the agricultural sector.

HISTORIC FLOODS IN MIDWEST HAVE FARMERS WORRIED ABOUT THEIR FUTURE

Congressional Democrats are scrambling to try and block the move.

“This parochial idea of, like, ‘Washington messes everything up. Let’s move it out of town’ overlooks the important role that this agency plays,” Rep. Chellie Pingree, D-Maine, a member of the House Agriculture Committee, told The Washington Post. “There’s just a heightened level of concern about this administration, generally, about data collection and science.”

Critics, including former USDA officials, say the move would weaken the agencies, reduce their influence with lawmakers and provide little benefit to the farming community.

Winch argued that weakening the agencies' influence in Washington is at least part of the point. The NIFA funds grants that go into researching the effects the agriculture sector has on climate change – which the Trump administration has tried to downplay – and Perdue was allegedly upset by NIFA’s policy to support LGBT members of the 4-H youth farming organization.

The president’s 2020 budget has also proposed slashing funding to ERS research from $87 million to $61 million and cutting 160 jobs, while Perdue has suggested moving the agency from under the USDA’s science arm to being supervised by the USDA’s chief economist, a political wing of the department.

“There is some sort of punitive motivation,” Winch said. “Someone has made a negative judgment about these agencies.”

CLICK HERE TO GET THE FOX NEWS APP

Perdue and his staff have narrowed the list of places where the two agencies could go down to three from an original 130 -- with Kansas City, the state of Indiana and North Carolina’s research triangle in the Raleigh-Durham area on the shortlist. St. Louis, Mo., and Madison, Wis., are two alternate locations.

Perdue is expected to make the announcement of where the agencies will move as soon as Friday, but it remains unclear whether the two agencies will actually leave Washington.

The USDA’s own inspector general is currently looking into whether Perdue has the legal authority to move these agencies, while the House Appropriations Committee’s draft bill of agricultural appropriations, which was released earlier this week, prohibits the USDA from using funds to move agencies outside of the Washington area. Trump’s 2020 budget proposal wants $15.5 million to relocate ERS and $9.5 million to relocate NIFA.

“We continue to believe that the USDA lacks the legal authority to carry out this proposal,” Rep. Steny H. Hoyer, D-Md., and Del. Eleanor Holmes Norton, D-D.C., said in a statement earlier this spring. “However, even if it had such authority, USDA has not done the proper analysis of the cost and benefits, and this proposal will harm agriculture research and our constituents.”"
Are you a robot?,https://www.bloomberg.com,[],05-28-2019,2019,5,https://www.bloomberg.com/opinion/articles/2019-05-28/epa-s-wheeler-on-costs-of-clean-air-regulation,"Why did this happen?

Please make sure your browser supports JavaScript and cookies and that you are not blocking them from loading. For more information you can review our Terms of Service and Cookie Policy."
