There's no need to focus on anonymously-sourced stories about Trump when he says bonkers stuff out in the open,https://www.washingtonexaminer.com,[],08-26-2019,2019,8,https://www.washingtonexaminer.com/opinion/theres-no-need-to-focus-on-anonymously-sourced-stories-about-trump-when-he-says-bonkers-stuff-out-in-the-open,"This past weekend followed a familiar pattern of stories about President Trump based on anonymous sources that get joked about and debated, then eventually denied.

In the most recent case, Axios, citing a number of officials anonymously, reported that Trump repeatedly inquired about the possibility of blasting hurricanes with nuclear weapons to stop them before they hit the shore. The story also quoted unnamed White House officials as defending Trump for having the right objective, downplaying any reason for panic. The reported idea has obviously not come into fruition.

On Monday morning, Trump tweeted, ""The story by Axios that President Trump wanted to blow up large hurricanes with nuclear weapons prior to reaching shore is ridiculous. I never said this. Just more FAKE NEWS!""

Let me say at the outset, I don't question that Axios reporters Jonathan Swan and Margaret Talev were told Trump said such things. Also, there is some room between Trump's denial and the story — i.e., he could have asked about the possibility without actually affirmatively wanting to do it.

The problem with assessing stories such as this is that at this point, we know there are many people within the administration who do not agree with Trump — indeed, who see it as their duty to protect the country from him by reining him in. At the same time, people in position to be cited as high-ranking officials know that based on his statements and behavior in public, people will believe just about any story about Trump, and that there is an insatiable appetite for such stories. So the threshold for selling an outlandish story is much lower than the typical president.

But here's the thing. To me, there's no reason to get so worked about anonymously sourced stories at this point when there's so much that Trump says and does in full public view that's lamentable or absolutely bonkers.

Just last week, Trump vented about the disloyalty of Democratic voting American Jews, canceled a meeting with the leader of Denmark over the sale of Greenland, escalated his trade war with China on Twitter, called his own appointment to lead the Fed an ""enemy"" on par with the ruler of communist China, and then joked about the resulting stock market crash.

So critics and defenders have plenty of stuff to argue about without even debating the validity of the anonymously-sourced stuff."
State Department says removal of 'Palestinian Territories' from website isn't policy change,https://www.cnn.com,"['Jennifer Hansler', 'Andrew Carey']",08-26-2019,2019,8,https://www.cnn.com/2019/08/26/politics/state-department-website-palestinian-territories/index.html,"(CNN) The State Department on Monday denied that the removal of a listing for the Palestinian Territories from its website constituted a change in policy.

""Website is being updated. There has been no change to our policy,"" a State Department official said in a statement. Asked whether the listing would be added back to the website, the official reiterated that the site is being updated.

It is unclear when exactly the listing for the territories, which was once included as one of the ""countries and other areas"" under the Bureau of Near Eastern Affairs, was removed. It was active until at least February 2019, according to an archived version of the page. The State Department unveiled its modernized website in June 2019, and the link for the Palestinian Territories now redirects to a message about that modernization.

""Welcome to state.gov. We recently modernized our website. Part of this modernization was to reduce the number of pages on the current state.gov website by not moving items that are in existence on our archive sites. This keeps the content on the current state.gov current while older content remains intact and fully accessible on our archive sites,"" the message says.

The omission of the Palestinian Territories drew outrage from Palestinian officials.

Read More"
Annapolis housing authority announces new executive director from Charleston,https://www.capitalgazette.com,['Naomi Harris'],08-26-2019,2019,8,https://www.capitalgazette.com/news/ac-cn-haca-executive-director-20190826-aiuwjpqtjzhsfkdwlvu4fdphlq-story.html,"While at the Housing Authority of the City of Charleston, Maddox-Evans also worked as the chief executive officer of the Charleston County Housing & Redevelopment Authority. She has also worked with Charleston city by helping a nonprofit develop a “community land trust for the Charleston region as a method to preserve land for affordable housing,” according to the release. She also served as the president and chair of the nonprofit board and worked as an adviser to a special task force that develops affordable housing trust fund for the city."
Georgia governor on trade war with China: ‘Trust the president’,https://www.ajc.com,['Greg Bluestein'],,,,https://www.ajc.com/blog/politics/georgia-governor-trade-war-with-china-trust-the-president/ifYrsLAJixIdkYlPtNB5LN/,"Gov. Brian Kemp had just begun a question-and-answer session with eight Asian-American business owners in Gwinnett County when Tim Le, a real estate investor, asked a question on many of their minds: With threats of a trade war looming, how does the U.S. economy keep growing?

Le and the other executives had spent the first 30 minutes lavishing praise on President Donald Trump and Kemp’s administration, praising the $1.5 trillion package of tax cuts that Congress adopted in 2017 and the governor’s promise to slash regulations.

But with Trump’s ongoing tit-for-tat trade war with China and the constant threat of new tariffs, Le and others wanted to know whether Kemp believed the American economy can withstand new threats of trade turbulation.

The governor said the tariffs have had a scattershot impact on Georgia businesses – some are hurting, other owners told him they are “exhausted” by all the new business. His message: He said he’s hopeful “that a lot of what’s gone on recently is posturing” and that the trade war is easing.

“We have to continue to trust the president, Sen. Perdue, Secretary Perdue – the whole team he’s got working on that,” said Kemp, of Sen. David Perdue and Agriculture Secretary Sonny Perdue, two Georgians who supported his campaign.

“China has taken advantage of us for a long time – really, the rest of the world. I’m no expert on trade, but I think we’ve probably waited too long to fight this battle. And people who are getting hurt from it even understand that.”

The event at a Peachtree Corners office park was part of a national series of Republican roundtables to highlight Trump’s economic agenda. But in Georgia it also had a different goal: To boost Asian-American support for Republicans in the 7th District, a competitive territory that stretches across parts of Gwinnett. .

Each of the eight business owners pledged to support Trump’s business agenda and work to encourage voters in the Asian-American community to vote next year.

“Thanks to President Trump’s tax cuts and less regulations, we have more money in our pockets and we’re able to hire more employees. We’re doing great,” Lonnie Vo, the owner of an auto repair shop, said to Kemp.

The sunny economic messaging contrasts with signs of fiscal turmoil ahead. Kemp has ordered 4% budget cuts this year and 6% next year, saying the slash is needed so he can pay for some of his top priorities, including another teacher pay raise.

Democrats have blasted his decision, sharpening their critiques after the Department of Community Health said it might have to lay off workers to meet the edict.

“I look forward to hearing why these cuts are necessary in a growing state with a lean budget and $2.55 billion in rainy day funds,” said Democratic state Rep. Sam Park.

Pressed on that question, Kemp criticized “political posturing” surrounding his orders to cut spending.

“They would be complaining if I took money out of the rainy day fund and kept the budget where it is,” he said. “We’re asking people to make government smaller and more efficient, and I believe you can do that without hurting services and programs.”

Support real journalism. Support local journalism. Subscribe to The Atlanta Journal-Constitution today. See offers.

Your subscription to the Atlanta Journal-Constitution funds in-depth reporting and investigations that keep you informed. Thank you for supporting real journalism."
DOJ Increases Power Of Agency Running Immigration Court System,https://www.npr.org,['Richard Gonzales'],08-23-2019,2019,8,https://www.npr.org/2019/08/23/753912351/doj-increases-power-of-agency-running-immigration-court-system,"DOJ Increases Power Of Agency Running Immigration Court System

Enlarge this image toggle caption Susan Walsh/AP Susan Walsh/AP

The Trump administration is making changes to the agency that operates the nation's immigration court system, a move immediately denounced by the immigration judges' union as a power grab.

The agency is called the Executive Office for Immigration Review and it is an arm of the Justice Department. Under the interim rule announced Friday, the agency's director will have the power to issue appellate decisions in immigration cases that have not been decided within an allotted timeframe. It also creates a new office of policy within EOIR to implement the administration's immigration policies.

The head of the immigration judges' union accused the administration of trying to strip power away from judges and turn the immigration court system into a law enforcement agency.

""In an unprecedented attempt at agency overreach to dismantle the Immigration Court, the Department of Justice, Executive Office for Immigration Review (EOIR) today published a new interim rule, effective next Monday, which takes steps to dismantle the Immigration Court system,"" Judge Ashley Tabaddor, president of the National Association of Immigration Judges, said in a statement. ""DOJ's action ends any transparency and assurance of independent decision making over individual cases.""

The new rule, first reported by The Associated Press, comes after the administration announced an effort to decertify the immigration judges' union. The judges, 440 in total, are employees of the Justice Department and not part of the independent judiciary. The Trump administration has also imposed quotas on judges in an effort to speed up deportations and reduce the backlog of more than 900,000 cases pending in immigration courts.

Tabaddor said the administration is trying to concentrate its power over immigration proceedings.

""The new rule is a wolf in sheep's clothing,"" Tabaddor said. ""While couched in bureaucratic language, the impact of this regulation is to substitute the policy directives of a single political appointee over the legal analysis of non-political, independent adjudicators.""

The EOIR did not respond to a call for comment.

Earlier this week, the EOIR sent the immigration judges a newsletter containing a blog post from VDare, an anti-immigration website, which included an anti-Semitic reference, according to Tabaddor. After she protested, Justice Department officials said some information included with the newsletter had been compiled by a third-party contractor and should not have been distributed.

""The Department of Justice condemns anti-Semitism in the strongest terms,"" Kathryn Mattingly, a spokeswoman for EOIR told BuzzFeed."
African American employee's office vandalized inside Education Department,https://www.nbcnews.com,"['Suzy Khimm', 'Suzy Khimm Is A National Reporter For Nbc News', 'Focused On Investigating Federal Agencies.', 'Heidi Przybyla', 'Heidi Przybyla Is An Nbc News Correspondent.', 'Jonathan Allen', 'Jonathan Allen Is A Washington-Based National Political Reporter For Nbc News Who Focuses On The Presidency.', 'Laura Strickler', 'Laura Strickler Is An Investigative Producer In The Nbc News Investigative Unit Based In Washington.']",08-23-2019,2019,8,https://www.nbcnews.com/politics/politics-news/african-american-employee-s-office-vandalized-inside-education-department-n1045856,"A pedestrian passes in front of the U.S. Department of Education (DOE) headquarters in Washington, on Aug. 23, 2019.

Andrew Harrer / Bloomberg via Getty Images"
US Department of Interior meets with tribes in Bethel to hear public safety concerns,https://www.adn.com,[],08-25-2019,2019,8,https://www.adn.com/alaska-news/2019/08/25/us-department-of-interior-meets-with-tribes-in-bethel-to-hear-public-safety-concerns/,"Representatives from the U.S. Department of the Interior visited Bethel on Wednesday to hear from tribal representatives about the public safety issues unique to the Yukon-Kuskokwim Delta. The visit comes in the wake of Attorney General William Barr’s tour of the region for similar reasons.

For DOI Assistant Secretary of Indian Affairs Tara Sweeney, the visit to Bethel was a bit of a homecoming.

“At Kilbuck, Mrs. Han was my fifth grade teacher,” Sweeney said.

Sweeney is the first Alaska Native to be confirmed to her position. Growing up in Bethel and Utqiagvik, she says that she saw the problems with public safety in rural Alaskan communities firsthand.

“The issues that we are discussing today are prevalent in every Alaska Native village. Every family has been impacted by domestic violence, sexual assault, violent crimes,” Sweeney said. “So yes, this is personal.”

Sweeney says that the Bureau of Indian Affairs has heard about these issues for years. Now, DOI Chief of Staff Kate MacGregor says that the bureau has the support it needs to take action.

“The president earlier this year declared May 5 as national missing and murdered Native American Awareness Day,” MacGregor said. “So this is something that has been raised in profile.”

MacGregor said that it was important to note that several members of the White House were in attendance at the listening session. Charles Addington, Director of the BIA’s Office of Justice Services, thinks that funding will be available. The next step is figuring out where the BIA can get the biggest bang for its buck.

“Trying to figure out where do we already have things in place that we can just start enhancing,” Addington said. “Low-hanging fruit that we can start making a difference right away.”

The Association of Village Council Presidents had called for the listening session. Forty-seven of the 56 federally recognized tribes in the Yukon-Kuskokwim Delta sent representatives. AVCP Director of Communications Azara Mohammadi described some of their suggestions.

“There was a lot about restorative justice, there was a lot about resources for victims, and infrastructure came up again and again. Public safety infrastructure,"" she said.

She said that people in the Lower 48 take holding cells and office space for granted, but in many villages that infrastructure is either falling apart or doesn’t exist.

“I mean, if you just don’t have the physical space for it, it’s very difficult,” Mohammadi said.

Tribal representatives asked for more funding for VPSOs and tribal courts. Another request was for changing the funding process itself. AVCP Director of Tribal Justice Rick Garcia says that there are problems when villages have to apply for competitive grants every year.

“What competitive funding does, it puts neighbors against neighbors, it puts families against families,” Garcia said.

Garcia is hopeful. The listening session came just a few months after U.S. Attorney General William Barr visited Bethel to talk about public safety. Garcia said that this meeting struck a different tone.

“I think this session was much different than Attorney General Barr’s,” Garcia said. “In that they really did come with the intention of listening and getting recommendations directly from our tribal leadership and delegates.”

DOI Assistant Secretary of Indian Affairs Tara Sweeney said that improving public safety in this region will require creativity and should be developed in partnership with the people who know the issues best."
Terror-sponsor Iran threatens Washington think tank with actions by 'security apparatuses',https://www.washingtonexaminer.com,[],08-24-2019,2019,8,https://www.washingtonexaminer.com/news/terror-sponsor-iran-threatens-washington-think-tank-with-actions-by-security-apparatuses,"Iran, an international sponsor of terrorism, has announced sanctions against a hawkish Washington think tank, threatening that any actions taken against it by ""security apparatuses"" will be ""considered legitimate"" by Tehran.

The ominous warning to the Foundation for Defense of Democracies and its chief executive officer Mark Dubowitz was carried in state-controlled media, which cited a law titled ""Countering America’s Human Rights Violation and Adventurous and Terrorist Actions” that was passed by the Iranian Parliament in 2017.

Iran's foreign ministry said the move had been made because of ""economic terrorism"" by the FDD, which has been sharply critical of the Iran nuclear deal and has advocated harsh American sanctions against the theocratic regime.

""Accordingly, taking any actions by the judicial and security apparatuses against the FDD and their Iranian and non-Iranian accomplices will be considered legitimate as their actions are against the Iran’s national security and the interests of Iranian people and government,"" the state-run Mehr news agency wrote.

The think tank addressed the news in a statement, and its leader Mark Dubowitz told the Washington Examiner, ""The regime has a history of targeted assassinations on European soil, places in the Gulf, Latin America, Asia ... We're treating it as a targets list, not a sanctions list.""

""I do think we have a sufficient profile with the U.S. administration, with Congress, and other allies that if the Iranians went after us, this would be a significant escalatory step,"" he continued. ""But, I also don't want to say that that necessarily will deter their behavior. They tried to assassinate a Saudi ambassador in Cafe Milano right in the heart of Washington, D.C.""

Dubowitz said the group would not be backing down, however.

""It just incentivizes us to redouble our efforts in researching and investigating the malign and destructive activities of Iran,"" he said.

A spokesperson for the State Department indicated that the U.S. is taking ""the regime's threats seriously"" and vowed to ""hold Iran responsible"" for compromising the safety of Americans.

The outlaw regime in Iran issued a threat today against @FDD, an American think tank, and its CEO. The U.S. takes the regime’s threats seriously. We intend to hold Iran responsible for directly or indirectly compromising the safety of any American. — Morgan Ortagus (@statedeptspox) August 25, 2019

Since its theocratic regime was established in 1979, Iran has been behind numerous terrorist activities throughout the world, often through its proxies Hamas and Hezbollah. In 2011, its plan to assassinate the Saudi Arabian ambassador to the U.S. at the Cafe Milano restaurant in Washington's Georgetown district was thwarted and one of the plotters sentenced to 25 years."
