Trump Administration Asks Supreme Court to Permit Employment Discrimination Against Transgender Workers,https://time.com,['Tara Law'],,,,https://time.com/5654844/title-vii-trump-transgender-department-of-justice-supreme-court/,"The Trump administration’s Department of Justice is asking the Supreme Court to set a legal precedent that would enable employers to fire employees because they are transgender.

The Department of Justice has submitted a brief to the Court Friday asking the Justices to rule that Title VII, a federal law that prohibits employment discrimination on the basis of sex, race, color, religion or national origin, does not protect transgender people. The department argued that they should throw out a lower court ruling that found that a funeral home that fired a transgender woman had discriminated against her.

The brief concerns R.G. & G.R. Harris Funeral Homes Inc. v. Equal Employment Opportunity Commission, one of three cases that the Supreme Court agreed to hear earlier this year that concern whether Title VII can be applied to LGBTQ workers.

In the case, the U.S. Court of Appeals for the 6th Circuit found that the owner of the funeral home, Thomas Rost, had violated the law when he fired Aimee Stephens, a transgender woman who worked for the company from 2007 to 2013. According to court documents, Stephens sent the company a letter in 2013 that said she struggled with a “gender identity disorder” and planned to begin to live as a woman, including by wearing the company’s female uniform – a jacket and skirt – instead of a suit and tie.

The Brief Newsletter Sign up to receive the top stories you need to know right now. View Sample Sign Up Now

The company argued that Stephens was fired because she refused to wear the company’s dress code and argued that “[m]aintaining a professional dress code that is not distracting to grieving families is an essential industry requirement that furthers their healing process.”

In its brief, the Department of Justice has argued in favor of the funeral home, arguing that Title VII only protects what it defines as “biological sex.”

“In 1964 [when Title VII was enacted], the ordinary public meaning of ‘sex’ was biological sex. It did not encompass transgender status,” the DOJ writes, clarifying, “In the particular context of Title VII—legislation originally designed to eliminate employment discrimination against racial and other minorities—it was especially clear that the prohibition on discrimination because of “sex” referred to unequal treatment of men and women in the workplace.”

Chase Strangio, an American Civil Liberties Union attorney representing Stephens, told HuffPo that the case could weaken Title VII protections both for transgender people and other groups.

“People don’t realize that the stakes are extending not just the trans and LGB communities, but every person who departs from sex stereotypes: Women who want to wear pants in the workplace, men who want more childbearing responsibilities,” Strangio said.

Write to Tara Law at tara.law@time.com."
President Trump's Louisville visit to shut down many downtown streets Wednesday,https://www.wdrb.com,[],,,,https://www.wdrb.com/news/president-trump-s-louisville-visit-to-shut-down-many-downtown/article_6508a31a-c2ea-11e9-beab-4b3104eb5990.html,You are the owner of this article.
EPA sued for allowing use of pesticide harmful to bees,https://thehill.com,[],08-20-2019,2019,8,https://thehill.com/policy/energy-environment/458094-epa-sued-for-allowing-use-of-pesticide-harmful-to-bees,"An environmental group is suing the Environmental Protection Agency (EPA) for its decision to expand use of a pesticide the agency considers toxic to bees.

In July the EPA said it would allow sulfoxaflor to be used in ways barred during the Obama administration as well as on new crops where the pesticide had not been used before.

“Even for Trump’s EPA, which seems to measure success by pesticide-company profits, it’s stupefying to OK spraying a bee-killing poison across millions of acres of crops frequented by bees,” Lori Ann Burd, director of the Center for Biological Diversity’s environmental health program, said in a statement. “While leading scientists and countries across the globe are calling for eliminating harmful bee-killing pesticides like sulfoxaflor, Team Trump is cheerfully promoting its use like a corporate PR firm. It’s nauseating.”

Burd said the pesticide will harm not just bees and butterflies but also plants that rely on them for pollination.

The EPA would not comment on the lawsuit but said the pesticide ""provides benefits to growers and is supported by strong science that shows minimal risks for pollinators.""

In previous documents, the EPA described sulfoxaflor as “very highly toxic” to bees, and a study published in Nature last year found sulfoxaflor inhibited bumblebee reproduction.

In a July call with reporters to announce the decision, a top EPA official emphasized the agency’s research on the pesticide's effects on bees and said the rule was designed with pollinators in mind.

“To reduce exposure to bees, the product label will have crop-specific restrictions and important pollinator protection language,” including limits on how close to bloom sulfoxaflor can be sprayed, the official said.

But it may be difficult to monitor whether the regulations spare bees as intended. Just before EPA’s decision on sulfoxaflor, the U.S. Department of Agriculture announced it was suspending one of the few remaining government data sets that monitor bee populations and loss.

The center’s suit, filed in the 9th Circuit Court of Appeals, argues the EPA failed to compile “substantial evidence” as required under law before approving sweeping new uses of sulfoxaflor. They say the EPA also failed to consult with other agencies to ensure the new regulation wouldn’t harm endangered species.

The suit is not the first on the pesticide.

It was temporarily barred after a lawsuit from beekeepers in 2015, pushing the EPA in 2016 to change its instructions for how to use the pesticide in a way designed to reduce the harm to bees.

EPA said it was spurred to reconsider uses of sulfoxaflor following numerous emergency requests from states — many of which the agency granted — to allow the use of the pesticide on certain crops. It contends sulfoxaflor is safer than the alternatives.

The regulation allows farmers to once again use sulfoxaflor on citrus, cotton and types of squash, and the pesticide can now be used on alfalfa, corn, cocoa, grains and pineapple, among others, for the first time.

In some cases, farmers will not be able to spray sulfoxaflor within three days of bloom, but bee activists say the pesticide can remain in the soil and harm bees.

Bees are key in the production of almost a third of U.S. crops, spurring a commercial bee industry that brings colonies from field to field to pollinate farmers’ fields.

The EPA said the economic plight of farmers was a factor in its decision. The agency said growers could see net revenue losses of up to 50 percent if they aren't able to use the pesticide.

But Burd said pesticides like sulfoxaflor are dangerous to bees because they attack the nervous system, causing bees to get confused and diminishing their appetite.

“They don’t respond as well to predators ... cognitive loss is causing them to die as they get lost in the field,” she told The Hill previously.

Updated at 1:28 p.m."
Lindsey Graham says Horowitz FISA report will be 'ugly and damning' for DOJ,https://www.washingtonexaminer.com,[],08-18-2019,2019,8,https://www.washingtonexaminer.com/news/lindsey-graham-says-horowitz-fisa-report-will-be-ugly-and-damning-for-doj,"Republican Sen. Lindsey Graham of South Carolina predicted Sunday that the upcoming report by Justice Department Inspector General Michael Horowitz on abuse of the Foreign Intelligence Surveillance Act would be “ugly and damning” for the DOJ.

The Republican Senate Judiciary chairman spoke with Fox News host Maria Bartiromo on Sunday Morning Futures, saying the much-anticipated Horowitz report was “coming out in weeks, not days, not months.” In explaining to Bartiromo why the release of the report had been repeatedly delayed — Attorney General William Barr predicted early this year it would come out in May or June — Graham said “every time you turn around you find something new.”

Graham predicted Horowitz would have a lot to say about ""the good, the bad, and the ugly"" at the FBI and DOJ, and would likely have recommendations about what should be done to fix it.





Graham also said once Horowitz finishes his report, it will be sent to the Justice Department for a review for any classified information. The senator said he was meeting with Barr next week to ensure as much of the report as possible is made public.

“I want to declassify as much as possible,” Graham said. “I want the American public to hear the story. I want all of this information to come out. I don’t want people to believe what I say about it — I want them to read for themselves how bad it was.”

""I believe the Horowitz report is going to be ugly and damning regarding the Department of Justice handling of the Russia probe,"" Graham added.

The FBI and DOJ obtained four FISA warrants and renewals against Trump campaign associate Carter Page beginning in October 2016 through June 2017. The 412 pages of redacted FISA documents released in 2018 show the DOJ and FBI made extensive use of the dossier compiled by British ex-spy Christopher Steele, which he put together in 2016 at the behest of the opposition research firm Fusion GPS. The Clinton campaign hired the firm through Marc Elias of the Perkins Coie law firm, and the campaign was briefed about Steele's findings throughout the race. Steele’s funding from Democrats was never revealed to the Foreign Intelligence Surveillance Court.

And newly released FBI interview notes with top DOJ official Bruce Ohr shed light on his role as a conduit between Steele and the FBI in 2016 and 2017, even after the bureau says it cut Steele off as a source for leaking to the media. Ohr told the FBI that Steele was desperate Trump not win and suggested some of Steele's information may have stemmed from ""Russian conspiracy theories."" Ohr's wife, Nellie, worked at Fusion GPS, and Bruce Ohr passed her research along to the FBI too.

Graham explained today that Horowitz “is doing a very in-depth dive about the FISA warrant application” and is looking into “the behavior regarding the counterintelligence operation.” Graham said he believed the evidence would show the FBI’s FISA filings were “a fraud on the court.”

The senator specifically pointed to the FBI being “on notice” that Steele “hated Trump, that he was an unreliable informant,” as well as Steele’s information — “unverified to this day” — allegedly coming from Russian sources and allegedly exonerating nonpublic transcripts of interviews of Trump campaign aide George Papadopoulos with an FBI informant, likely Cambridge professor Stefan Halper.

The interactions that Papadopoulos had with the mysterious Maltese professor Joseph Mifsud allegedly led to the FBI opening an inquiry into Trump in July 2016. Mifsud allegedly told Papadopoulos in the spring of 2016 about the Russians having “dirt” on Hillary Clinton. Papadopoulos then allegedly mentioned this to Australian diplomat Alexander Downer, who later passed the information along to the FBI, triggering what the FBI dubbed “Crossfire Hurricane.” Republicans now say exonerating information about Papadopoulos was concealed from the FISA Court.

“I want it all out,” Graham emphasized. “I want people to see how off the rails this investigation got, and I want people to be held accountable. And I am patient, I’m not in a hurry to do it, I want to do it right.”"
American Airlines to pay $22.1 million U.S. fine over mail delivery times: Justice Department,https://www.reuters.com,"['David Shepardson', 'Min Read']",08-20-2019,2019,8,https://www.reuters.com/article/us-american-airline-fraud/american-airlines-to-pay-22-1-million-u-s-fine-over-mail-delivery-times-justice-department-idUSKCN1VA2AH,"FILE PHOTO: An American Airlines plane takes off from Los Angeles International airport (LAX) in Los Angeles, California, U.S. March 28, 2018. REUTERS/Mike Blake

WASHINGTON (Reuters) - American Airlines Group Inc (AAL.O), the largest U.S. airline, will pay $22.1 million to settle claims it falsely reported the times it transferred possession of U.S. mail to foreign postal administrations or other intended recipients, the U.S. Justice Department said on Tuesday.

The United States Postal Service contracted with American to take possession of receptacles of U.S. mail at six locations and then deliver it to numerous international and domestic destinations. The settlement resolves claims American Airlines falsely reported the times it transferred possession of the mail. American did not immediately comment Tuesday.

“We expect companies doing business with the government to comply with their contractual obligations,” said Assistant Attorney General Jody Hunt, who heads the department’s civil division. “The Department of Justice vigorously pursues all manner of fraudulent conduct that undermines the benefits that the government has bargained for.”

American said in a statement it was pleased it had reached a settlement.

“The allegations focused on conduct that was remedied years ago, and we have invested in new equipment and procedures to ensure that we are in full compliance with our commitments,” the statement said. It added that “the U.S. Postal Service is an important customer for American, and we are glad to have corrected these procedures and put this matter behind us.”

American said in a securities filing the Justice Department in April 2015 notified the airline it was investigating American’s 2009 and 2011 contracts with the U.S. Postal Service for the international transportation of mail by air.

The contract required American to take possession of mail at U.S. locations or at various Department of Defense and State Department locations abroad, and then deliver that mail to numerous international and domestic destinations.

“To obtain payment under the contracts, American Airlines was required to submit electronic scans of the mail receptacles to USPS reporting the time the mail was delivered at the specified destinations. The contracts specified penalties for mail that was delivered late or to the wrong location,” the Justice Department said.

“The U.S. Postal Service contracts with commercial airlines for the safeguarding and timely delivery of U.S. Mail to foreign posts, including the mail sent to our soldiers deployed to foreign operating bases,” said Scott Pierce, special agent in Charge, USPS Office of Inspector General."
Justice Dept. reiterates it believes federal employment discrimination law doesn't protect transgender workers,https://www.cnn.com,"['Ariane De Vogue', 'Cnn Supreme Court Reporter']",08-19-2019,2019,8,https://www.cnn.com/2019/08/19/politics/justice-department-transgender-worker/index.html,"Washington (CNN) The Trump administration reiterated to the Supreme Court on Friday that it does not believe that federal employment law that bans discrimination based on sex also encompasses discrimination based on transgender status.

The Justice Department's argument was included in the latest filing in one of the most important cases of the upcoming Supreme Court term. The issue, coupled with whether the law also protects claims of discrimination based on sexual orientation, is of critical importance to LGBT rights supporters who are seeking broadened protections.

The case will be heard on October 8, and the decision will come down in the heat of the presidential campaign. A major fact as well will be that Justice Anthony Kennedy, who often voted in favor of the LGBT community, is no longer on the court, and has been replaced by Justice Brett Kavanaugh.

Title VII, of the Civil Rights Act, that bars discrimination based on sex ""does not bar discrimination because on transgender status,"" Solicitor General Noel Francisco argued in a brief filed with the Supreme Court Friday evening.

Lower courts -- and the federal government -- have split on the issue of whether Title VII provides such protections.

Read More"
