In our opinion: The Department of Agriculture is moving workers to Kansas City. Utahns should hope they can be next,https://www.deseretnews.com,[],06-18-2019,2019,6,https://www.deseretnews.com/article/900075743/in-our-opinion-the-department-of-agriculture-is-moving-workers-to-kanas-city-utahns-should-hope-they-can-be-next-blm-usda.html,"Utah is still waiting to see whether the Trump administration decides to move its Bureau of Land Management headquarters here from Washington — a move that makes sense considering how most BLM decisions affect the West much more than any property along the Potomac.

Continuing this trend, the administration announced last week that economists and scientists at the Department of Agriculture will be relocated to Kansas City. This is another move that makes great sense, considering that bureaucracy’s effect on farmers concentrated in the heartland.

The good sense seemed lost on angry employees of the Economic Research Service and the National Institute of Food and Agriculture, however. Many of them stood and turned their backs on Agriculture Secretary Sonny Perdue as he made the announcement last Thursday.

Frankly, they need to get over it. Those affected by federal decisions have little need for bureaucrats who want to cling to the power structure in Washington.

"" Those affected by federal decisions have little need for bureaucrats who want to cling to the power structure in Washington. ""

CNN cited concerns by employees who don’t want to be separated from the government they serve. That is a perfect example of the problem. They are supposed to serve the people, not the government.

That said, we sympathize with workers who would need to uproot their families, sell houses, leave friends and move to an entirely different part of the country. Such moves are not easy. Millions of people each year face decisions whether to go where their employer wants them to go or to find other work that would allow them to stay. These can be difficult choices, and we acknowledge that, unlike the BLM, where many workers already reside in various states, these agencies operate mainly in Washington. However, we have no doubt that Department of Agriculture employees will weather these changes as well as have others in various industries.

Critics worry about the loss of institutional knowledge if these agencies need to hire new people. This may be a valid concern, but it should be weighed against the possible gains of having fresh eyes with fresh ideas looking at old problems. Stagnation, entrenchment and an attitude of entitlement are bigger concerns in bureaucracies.

These agencies are supposed to produce nonpartisan reports and analyses. That should be as easy to do in Kansas City as it is in Washington, where politics permeate every crevice.

Administrations will shift from conservative to liberal and back again through the years. But having these agencies close to the people they serve will add a new level of accountability.

Besides all this, the move makes great economic sense. The department estimates a savings of $300 million over 15 years. Kansas City has more modest living costs and lower salaries than does Washington.

In addition, the move will be a boon to the Kansas City economy, adding many good-paying jobs.

Perhaps only a Washington bureaucrat could find fault with such a move. Utahns, meanwhile, should hope they soon can host the headquarters of the BLM. Spreading the federal government among the people is a capital idea."
Trump takes credit for passing veterans bill that passed under Obama,https://thehill.com,[],06-18-2019,2019,6,https://thehill.com/homenews/campaign/449240-trump-touts-passing-va-bill-that-passed-under-obama,"President Trump Donald John TrumpGOP senator introduces bill to hold online platforms liable for political bias Rubio responds to journalist who called it 'strange' to see him at Trump rally Rubio responds to journalist who called it 'strange' to see him at Trump rally MORE at his 2020 campaign kickoff rally on Tuesday took credit for passing a veteran's health care bill that was signed into law by former President Obama.

""We passed VA Choice,"" he said, referring to a bill that allows veterans to seek health options outside the Veterans Affairs-run system. ""You go out now, you get a doctor, you fix yourself up, the doctor sends us the bill, we pay for it. And you know what? It doesn't matter because the life and the veteran is more important, but we also happen to save a lot of money doing that.""

""They've been trying to get that passed also for about 44 years,"" he added.

Trump takes credit for a Veterans Choice bill that was signed into law by President Obama in 2014 pic.twitter.com/zKmfTPFDa6 — Aaron Rupar (@atrupar) June 19, 2019

In 2014, Obama signed a bill that permitted veterans to seek private care outside of Veterans Affairs facilities. It also gave money for the VA to hire additional doctors and nurses and overhauled the VA's electronic medical records.

ADVERTISEMENT

Trump did sign the VA Mission bill, which permits veterans to have a private doctor if their wait time is 20 days (28 days in the case of specialty care) or if their drive is 30 minutes, according to an Associated Press fact check of similar comments by the president.

Trump launched his reelection bid at a rally in Orlando, Fla."
Mississippi’s Mental-Illness Policies Are Working. DOJ Is Challenging Them.,https://www.nationalreview.com,"['John Hirschauer', 'John Fund', 'David French', 'Rich Lowry', 'Alexandra Desanctis', 'Jack Crowe', 'Jonathan S. Tobin', 'Kyle Smith', 'Declan Leary', 'Christopher Tremoglie']",06-17-2019,2019,6,https://www.nationalreview.com/2019/06/mississippi-mental-illness-policies-working-doj-challenging-them/,"(Pixabay)

The state is leading a quiet revolt.

Despite having the highest poverty rate in the United States, Mississippi has the nation’s lowest rate of homelessness. But instead of heralding Mississippi’s success and imploring other states to follow its lead, the Department of Justice is taking formal legal action against the state’s highly effective method of delivering mental-health services.

Advertisement

Advertisement

Back in 2016, DOJ filed a formal complaint against the state, alleging that its approach to mental health “has resulted in [the] repeated, prolonged, and unnecessary institutionalization [of the mentally ill] in state-run psychiatric hospitals, and placed them at serious risk of such institutionalization, in violation of Title II of the Americans with Disabilities Act of 1990.” The complaint and ensuing legal challenges brought both sides before U.S. District Judge Carlton Reeves early this month, and the judge rejected the state’s motion to dismiss the case. The case raises a series of questions about the limits of federal oversight and the jurisdictional authority of states and localities.

Mississippi is one of the few states in the country to retain a state mental-hospital network as an integral part of its mental-health system. While every state has public or private mental institutions, most have relegated their hospitals to ancillary roles, available only to treat a small handful of hard cases and forensic patients. As a result, the most seriously mentally ill, who often require institutional services, have been forced into inappropriate placements in the community. Many end up homeless, incarcerated, or as frequent patients in already-crowded emergency rooms. Mississippi has stood firm in its provision of a robust network of inpatient services for the mentally ill, much to the dismay of the Department of Justice. DOJ is apparently unsatisfied with the carnage deinstitutionalization has wrought on communities across the country and is attempting to force Mississippi to alter its approach to treating its most vulnerable citizens.

Advertisement

DOJ’s complaint letter accuses Mississippi of violating the terms of the landmark 1999 Supreme Court case Olmstead vs. L.C., which held that the state of Georgia had violated the Americans with Disabilities Act in its refusal to offer community-based services to two mentally ill complainants for whom the state’s experts deemed such a transfer clinically appropriate. In Mississippi, the DOJ isn’t bringing forth an analogous case; the complaint is not filed on behalf of a specific aggrieved party, but is instead directed at the entire statewide treatment apparatus for its alleged failure to protect “the rights of adults with mental illness to receive services in the most integrated setting appropriate to their needs.” DOJ is attempting to force Mississippi to restructure its entire mental-health system.

The original Olmstead decision, authored by Ruth Bader Ginsburg, was far more balanced than DOJ portends. The decision compelled states to offer individuals with mental disabilities access to community-based services, subject to three substantial qualifications.

First, the transfer of individuals from “institutions” to less structured environments must be formally approved by the state’s medical professionals, who are required to “have determined that community placement is appropriate” for the affected individual. Ginsburg drew explicit boundaries around the scope of the community mandate, quoting the American Psychiatric Association:

“Some individuals, whether mentally retarded or mentally ill, are not prepared at particular times — perhaps in the short run, perhaps in the long run — for the risks and exposure of the less protective environment of community settings”; for these persons, “institutional settings are needed and must remain available.”

Ginsburg also made clear that “nothing in the ADA or its implementing regulations condones termination of institutional settings for persons unable to handle or benefit from community settings.”

This last clause — “unable to handle or benefit from community settings” — has been occasionally inverted to assert that no one needs institutional services. Deena Fox, an attorney in DOJ’s Civil Rights Division, has not explicitly called for Mississippi to cease all institutional services, but she has promised that “evidence at trial will make clear that individuals with serious mental illness can be appropriately served in the community.” Some individuals with severe mental illness can be served in the community, of course, to different degrees and at different times. But the objection of the DOJ is principally much deeper than that.

Advertisement

Attorney Bill Choslovsky, who has fought similarly obstreperous Olmstead-based litigation in the state of Illinois, calls the logical terminus of DOJ’s argument a “leeches” hypothesis. Just as leeches are viewed as an intrinsically inappropriate medical device — it would be malpractice to use leeches to treat any conceivable disease — the DOJ is trying to impose its view that institutionalization is medically inappropriate per se by asserting medical authority that it doesn’t have. The analogy is wrong on the merits: According to Dr. E. Fuller Torrey in his book American Psychosis, 15 psychiatric experts were empaneled in 2008 to examine the minimum number of public psychiatric beds necessary to deal with those who inevitably fall through the cracks of the community system. This includes beds necessary for both the acutely ill (those suffering temporary suicidal or homicidal impulses, psychotic breaks, or other aggravated psychiatric phenomena) and the small but significant number of profoundly ill individuals who, in Olmstead’s phrasing, are not prepared “for the risks and exposure of the less protective environment of community settings” in the long run. The panel arrived at between 40–60 public psychiatric beds per 100,000 population, presuming adequate outpatient services.

Advertisement

The second qualifier that Olmstead made to its community-services mandate maintains that “the transfer from institutional care to a less restrictive setting” must not be “opposed by the affected individual.” Olmstead imparts no duty for patients to forgo services they are currently receiving, even if they are qualified to be in a less intensive care environment.

Advertisement

Advertisement

Advertisement

Finally — and this is the qualification most pertinent to Mississippi’s affirmative defense — the majority opinion insisted that for a community placement to occur, it must be “reasonably accommodated, taking into account the resources available to the State and the needs of others with mental disabilities.” This begets the “fundamental alteration” defense, which traces itself back to the original language of the ADA (emphasis mine):

A public entity shall make reasonable modifications in policies, practices, or procedures when the modifications are necessary to avoid discrimination on the basis of disability, unless the public entity can demonstrate that making the modifications would fundamentally alter the nature of the service, program, or activity.

Mississippi’s attorneys insist that the Department of Justice is demanding adherence to what amounts to a limitless and arbitrary standard. Mississippi already has community-based mental health services, though proportionately fewer than its peers. Every other state retains some degree of institutional services, and many of them have avoided DOJ litigation. The DOJ, then, is taking issue with the proportion of individuals who receive institutional services, which raises the question: How much is enough? In the absence of a specific claimant who can demonstrate harm under the Olmstead guidelines, how many hospitals must Mississippi close to meet the undefined and interminable demands of DOJ? And how does this not amount to a “fundamental alteration” of the balance of services that the state already provides?

Advertisement

Because of the nature of public finance and the budgetary strictures of state government, the state is making the laudable decision to orient their system towards treating the seriously mentally ill who require hospitalization; Mississippi has precisely nothing to apologize for.

Clarence Thomas’s dissent in Olmstead highlighted the imprecision with which the majority used the word “discrimination” to describe Georgia’s decision to treat patients in “an institutional setting after they became eligible for community placement.” He presciently noted that “by adopting such a broad view of discrimination, the majority drains the term of any meaning other than as a proxy for decisions disapproved of by this Court.” But even Ginsburg acknowledged an appellate court’s ruling that “the State’s duty to provide integrated services ‘is not absolute.’” States are allowed by Olmstead to preserve institutional settings necessary for the most severely ill, and the cost of preserving those settings may, in the fiscally limited world of state government, preclude those with less severe impairments from receiving commensurate services.

Advertisement

In his concurring opinion, Justice Kennedy warned that “it would be a tragic event . . . were the Americans with Disabilities Act of 1990 . . . to be interpreted so that States had some incentive, for fear of litigation, to drive those in need of medical care and treatment out of appropriate care and into settings with too little assistance and supervision.” This is precisely what the DOJ is doing. Mississippi is not a straggler to be dragged across deinstitutionalization’s finish line; the state is a necessary rebuke to policies that have relegated the severely mentally ill to lives of squalor and neglect on our nation’s streets and in our prisons."
I-Team: U.S. Department of Education investigating Duke-UNC Consortium after complaints of anti-Semitism,https://abc11.com,['Jonah Kaplan'],06-18-2019,2019,6,https://abc11.com/i-team-us-dept-of-education-investigating-duke-unc-consortium/5350504/,"WASHINGTON, D.C. (WTVD) -- On Monday, U.S. Secretary of Education Betsy DeVos formally opened an investigation into the Duke-UNC Consortium for Middle East Studies which applied a federal grant to host a conference on Gaza tainted by accusations of anti-Semitism. In a letter obtained by the ABC11 I-Team , Secretary DeVos said she is ""troubled"" by the concerns raised by Rep. George Holding (R-North Carolina) who first requested an investigation earlier this spring ""In order for the department to learn more about this matter, I have directed the Office of Postsecondary Education to examine the use of funds under this program to determine if the Consortium violated the terms and conditions of its grant.""The Duke-UNC Consortium hosted the ""Conflict Over Gaza"" in March at UNC-Chapel Hill, and it was an event sponsored by more than two dozen university departments, plus the Rotary Club of Raleigh and other local organizations.A video taken by filmmaker Ami Horowitz captured an anti-Semitic song being performed by a Palestinian rapper - and met with applause.Many thought the conference would provide diverse perspectives on the conflict in the Middle East, but rapper Tamer Nafar tells the audience: ""Let's try it together. I need your help. I cannot be anti-Semitic alone."" That was before he sang a song with the lyrics: ""Don't think of Rihanna when you sing this, don't think of Beyonce - think of Mel Gibson. I'm in love with a Jew/Oh/I fell in love with a Jew/Oh/Her skin is white and my skin is brown, she was going up up and I was going down.""""I'd like to thank Secretary Devos for treating this matter with the seriousness and attention it deserves,"" Rep. Holding said in response to the new investigation. ""I hope we can all agree that it is irresponsible and immoral for taxpayer dollars to fund overtly biased advocacy under the guise of constructive academic discourse.""Many department heads and sponsors demanded their money back after the controversy erupted.In a scathing letter to leaders of the UNC Center for Middle East and Islamic Studies, which officially sponsored the event, UNC School of Law Dean Martin Brinkley said: ""Due to your inclusion of conference content over which I had no knowledge or control, I have been forced to spend most of the last two days responding to outraged members of my own community who are ashamed and embarrassed to see the law school shown as a sponsor of what they consider hate speech.""A statement released by UNC Interim Chancellor Kevin M. Guskiewicz called the performance ""disturbing"" and that he is ""heartbroken and deeply offended that this performance happened. I stand steadfast against Anti-Semitism and hate in all its forms.""UNC-Chapel Hill will continue to work with the U.S. Department of Education to directly answer any questions about the Duke-UNC Consortium for Middle East Studies, the university said."
Arizona Trump fans fired up about president's re-election launch,https://www.azcentral.com,"['Jeannette Hinkle', 'Arizona Republic', 'Published P.M. Mt June']",06-18-2019,2019,6,https://www.azcentral.com/story/news/politics/arizona/2019/06/18/arizona-trump-fans-fired-up-presidents-re-election-launch/1495317001/,"CLOSE

More than 100 attended the Arizona GOP's Trump re-election announcement watch party, June 18, 2019. (Photo: Jeannette Hinkle/The Republic)

Donna Messinger says she’s been to every rally President Donald Trump has held in Arizona.

""And I’m always first in line,"" she said.

Messinger, 66, couldn’t attend the president’s 2020 re-election launch on Tuesday in Orlando, but she was an early arrival to the “MAGA Meet Up” hosted by campaign group Trump Victory and the Arizona Republican Party at the state GOP headquarters in Phoenix.

“This is his coming out party,” said Messinger, who wore a fuschia pink Women for Trump shirt and matching lipstick. “It’s huge. I wanted to be with like minds. I wanted to celebrate and scream and yell and have people standing with me and behind me to promote President Trump’s re-election.”

About 130 people attended the watch party, according to a count taken by Arizona Republican Party officials. Attendees, many wearing red Make America Great Again hats, crowded a room decorated with multiple cardboard cutouts of first lady Melania Trump and of the president giving two thumbs up.

Follow Arizona politics? Our reporters stay on top of it all. Subscribe to azcentral.com.

Before Trump took the stage, Kelli Ward, the Arizona Republican Party chairwoman, welcomed the crowd.

“I look forward to working with and for all of you to win big in 2020, not just President Trump, but Republicans all the way down the ballot,” Ward said. “We are going to hold our Legislature and expand our Republican majority.”

Though Messinger said the country’s economic strength under Trump has impressed her, it’s his efforts to improve border security and deport the country’s undocumented people that have earned her continued support.

“I want to continue with the immigration issues,” Messinger said. “It's paramount now. It's gotten way out of hand. It's an important issue across America. They're coming in with more issues than we could ever have dreamed of, then they’re being shipped out across America.”

Arizona, where Trump defeated Democrat Hillary Clinton by about 3½ percentage points in the 2016 election, is considered a key battleground state in the 2020 election.

Sharon Flint, 51, recently decided to join the battle, and she’ll be fighting for Trump. A Facebook post making fun of the president posted by her brother prompted her to ride her bicycle to the Arizona Republican Party headquarters a few weeks ago, she said.

“I was like, ‘What can I do to help?'” Flint said, holding a small American flag in her hand.

Flint and others faced the front of the room where three television screens showed Trump take the stage in Orlando. The crowd cheered for minutes when Vice President Mike Pence introduced Trump and the first lady, and as the president took the stage, they broke out into a chant of “Trump! Trump! Trump!”

Ronna McDaniel, the Republican National Committee chairwoman, said Trump has kept his promises and ""is delivering for all Americans.""

""As a result, we are seeing unprecedented engagement from every day Americans who want to be a part of this movement,"" she said in a written statement. ""Just this week, we are training and activating thousands of new volunteers to add to our grassroots army. We are ready to re-elect President Trump and continue to Make America Great Again.""

Other Arizona watch parties had been scheduled for Phoenix's Ahwatukee area; Mesa; Sun City; Kingman; and Tucson.

Read or Share this story: https://www.azcentral.com/story/news/politics/arizona/2019/06/18/arizona-trump-fans-fired-up-presidents-re-election-launch/1495317001/"
