US Commerce Department adds 46 Huawei affiliates to entity list – TechCrunch,https://techcrunch.com,[],08-19-2019,2019,8,https://techcrunch.com/2019/08/19/us-commerce-department-adds-46-huawei-affiliates-to-entity-list/,"Update: Huawei has responded to the DoC’s move,

We oppose the US Commerce Department’s decision to add another 46 Huawei affiliates to the Entity List. It’s clear that this decision, made at this particular time, is politically motivated and has nothing to do with national security. These actions violate the basic principles of free market competition. They are in no one’s interests, including US companies. Attempts to suppress Huawei’s business won’t help the United States achieve technological leadership. We call on the US government to put an end to this unjust treatment and remove Huawei from the Entity List.

The United States Department of Commerce announced this morning the addition of 46 Huawei affiliates to its Entity List. Effective today, the companies join more than 100 entries added to the list over connections to the embattled Chinese consumer electronics giant.

The DoC also used this morning’s news to announce an extension of its Temporary General License (TGL), which affords people and companies a limited time use of goods from Huawei and affiliate companies in order to essentially wean them off of Huawei networking equipment. The license, which offers “narrow exceptions” is set to expire 90 days from today.

In a statement provided to the press, Secretary of Commerce Wilbur Ross stated, “As we continue to urge consumers to transition away from Huawei’s products, we recognize that more time is necessary to prevent any disruption. Simultaneously, we are constantly working at the Department to ensure that any exports to Huawei and its affiliates do not violate the terms of the Entity Listing or Temporary General License.”

Huawei has, of course, long denied any ties to security or spying accusations from the U.S. government. Recently, stories, including alleged ties to African government spying, have continued to shine a light on concerns about the company’s ties to the Chinese government. Those concerns have led to Huawei’s addition to the entities list, along with U.S. government bans on buying equipment.

Per the DoC:

Huawei was added to the Entity List after the Department concluded that the company is engaged in activities that are contrary to U.S. national security or foreign policy interests, including alleged violations of the International Emergency Economic Powers Act (IEEPA), conspiracy to violate IEEPA by providing prohibited financial services to Iran, and obstruction of justice in connection with the investigation of those alleged violations of U.S. sanctions, among other illicit activities.

Losing access to American software and hardware could, in turn, have a devastating impact on the company. Notably, Huawei recently unveiled HarmonyOS. The new mobile operating system is not yet an Android replacement, but is believed by many to be part of a long-term strategy to wean itself off of dependence on Google.

We have reached out to Huawei for comment."
State Dept. extends travel ban to North Korea,https://thehill.com,[],08-19-2019,2019,8,https://thehill.com/policy/international/457944-state-dept-extends-travel-ban-to-north-korea,"The Trump administration is extending a travel ban for Americans traveling to North Korea through next year, according to a State Department memo released Monday.

The ban, originally instituted in June 2017, will remain in place until Aug. 31, 2020, unless revoked earlier by Secretary of State Mike Pompeo Michael (Mike) Richard PompeoCotton warns China: Crackdown on Hong Kong would be 'grave miscalculation' Pompeo expresses concern over North Korea missile tests Pompeo acknowledges 'places where ISIS is more powerful today' MORE, according to The Associated Press.

It was imposed by then-Secretary of State Rex Tillerson Rex Wayne TillersonThe Hill's Morning Report - Trump searches for backstops amid recession worries State Dept. extends travel ban to North Korea Scaramucci breaks up with Trump in now-familiar pattern MORE after the death of U.S. student Otto Warmbier, who was detained in North Korea. The ban was renewed once already, in 2018.

U.S. citizens interested in going to North Korea for humanitarian- or journalism-related purposes will be able to apply for exceptions through the State Department.

The travel ban extension comes amid a stall in nuclear negotiations between the U.S. and North Korea.

President Trump Donald John TrumpFacebook releases audit on conservative bias claims Harry Reid: 'Decriminalizing border crossings is not something that should be at the top of the list' Recessions happen when presidents overlook key problems MORE has said he will meet with North Korean leader Kim Jong Un Kim Jong UnPompeo expresses concern over North Korea missile tests State Dept. extends travel ban to North Korea Can we do business with Kim Jong Un? Leadership analysis might give clues MORE to discuss denuclearization later this year. The two leaders have met multiple times already on the issue but have been unable to reach an agreement.

Kim has overseen several weapon test launches in the last month despite warnings from South Korea."
Justice Dept. reiterates it believes federal employment discrimination law doesn't protect transgender workers,https://www.cnn.com,"['Ariane De Vogue', 'Cnn Supreme Court Reporter']",08-19-2019,2019,8,https://www.cnn.com/2019/08/19/politics/justice-department-transgender-worker/index.html,"Washington (CNN) The Trump administration reiterated to the Supreme Court on Friday that it does not believe that federal employment law that bans discrimination based on sex also encompasses discrimination based on transgender status.

The Justice Department's argument was included in the latest filing in one of the most important cases of the upcoming Supreme Court term. The issue, coupled with whether the law also protects claims of discrimination based on sexual orientation, is of critical importance to LGBT rights supporters who are seeking broadened protections.

The case will be heard on October 8, and the decision will come down in the heat of the presidential campaign. A major fact as well will be that Justice Anthony Kennedy, who often voted in favor of the LGBT community, is no longer on the court, and has been replaced by Justice Brett Kavanaugh.

Title VII, of the Civil Rights Act, that bars discrimination based on sex ""does not bar discrimination because on transgender status,"" Solicitor General Noel Francisco argued in a brief filed with the Supreme Court Friday evening.

Lower courts -- and the federal government -- have split on the issue of whether Title VII provides such protections.

Read More"
Lindsey Graham says Horowitz FISA report will be 'ugly and damning' for DOJ,https://www.washingtonexaminer.com,[],08-18-2019,2019,8,https://www.washingtonexaminer.com/news/lindsey-graham-says-horowitz-fisa-report-will-be-ugly-and-damning-for-doj,"Republican Sen. Lindsey Graham of South Carolina predicted Sunday that the upcoming report by Justice Department Inspector General Michael Horowitz on abuse of the Foreign Intelligence Surveillance Act would be “ugly and damning” for the DOJ.

The Republican Senate Judiciary chairman spoke with Fox News host Maria Bartiromo on Sunday Morning Futures, saying the much-anticipated Horowitz report was “coming out in weeks, not days, not months.” In explaining to Bartiromo why the release of the report had been repeatedly delayed — Attorney General William Barr predicted early this year it would come out in May or June — Graham said “every time you turn around you find something new.”

Graham predicted Horowitz would have a lot to say about ""the good, the bad, and the ugly"" at the FBI and DOJ, and would likely have recommendations about what should be done to fix it.





Graham also said once Horowitz finishes his report, it will be sent to the Justice Department for a review for any classified information. The senator said he was meeting with Barr next week to ensure as much of the report as possible is made public.

“I want to declassify as much as possible,” Graham said. “I want the American public to hear the story. I want all of this information to come out. I don’t want people to believe what I say about it — I want them to read for themselves how bad it was.”

""I believe the Horowitz report is going to be ugly and damning regarding the Department of Justice handling of the Russia probe,"" Graham added.

The FBI and DOJ obtained four FISA warrants and renewals against Trump campaign associate Carter Page beginning in October 2016 through June 2017. The 412 pages of redacted FISA documents released in 2018 show the DOJ and FBI made extensive use of the dossier compiled by British ex-spy Christopher Steele, which he put together in 2016 at the behest of the opposition research firm Fusion GPS. The Clinton campaign hired the firm through Marc Elias of the Perkins Coie law firm, and the campaign was briefed about Steele's findings throughout the race. Steele’s funding from Democrats was never revealed to the Foreign Intelligence Surveillance Court.

And newly released FBI interview notes with top DOJ official Bruce Ohr shed light on his role as a conduit between Steele and the FBI in 2016 and 2017, even after the bureau says it cut Steele off as a source for leaking to the media. Ohr told the FBI that Steele was desperate Trump not win and suggested some of Steele's information may have stemmed from ""Russian conspiracy theories."" Ohr's wife, Nellie, worked at Fusion GPS, and Bruce Ohr passed her research along to the FBI too.

Graham explained today that Horowitz “is doing a very in-depth dive about the FISA warrant application” and is looking into “the behavior regarding the counterintelligence operation.” Graham said he believed the evidence would show the FBI’s FISA filings were “a fraud on the court.”

The senator specifically pointed to the FBI being “on notice” that Steele “hated Trump, that he was an unreliable informant,” as well as Steele’s information — “unverified to this day” — allegedly coming from Russian sources and allegedly exonerating nonpublic transcripts of interviews of Trump campaign aide George Papadopoulos with an FBI informant, likely Cambridge professor Stefan Halper.

The interactions that Papadopoulos had with the mysterious Maltese professor Joseph Mifsud allegedly led to the FBI opening an inquiry into Trump in July 2016. Mifsud allegedly told Papadopoulos in the spring of 2016 about the Russians having “dirt” on Hillary Clinton. Papadopoulos then allegedly mentioned this to Australian diplomat Alexander Downer, who later passed the information along to the FBI, triggering what the FBI dubbed “Crossfire Hurricane.” Republicans now say exonerating information about Papadopoulos was concealed from the FISA Court.

“I want it all out,” Graham emphasized. “I want people to see how off the rails this investigation got, and I want people to be held accountable. And I am patient, I’m not in a hurry to do it, I want to do it right.”"
USDA: National THC test for hemp ‘as challenging as you think it is’,https://hempindustrydaily.com,['Et On'],08-19-2019,2019,8,https://hempindustrydaily.com/usda-national-thc-test-for-hemp-as-challenging-as-you-think-it-is/,"Federal agriculture authorities are struggling to craft a nationwide THC testing standard so that state and local regulators can tell hemp from marijuana, complicating the release of standardized production rules, according to an official with the U.S. Department of Agriculture (USDA).

William Richmond, head of the Specialty Crops Program in the USDA’s Agricultural Marketing Service, told a group of dietary-supplement and CBD business owners last week the agency hoped to have hemp rules prepared by now.

But he said the agency is grappling with the Farm Bill‘s requirement for a national THC testing protocol “using post-decarboxylation or other similarly reliable methods.”

“We need to have testing procedures in place,” he said. Coming up with reliable testing methods, he added, is “as complicated as you think it is.”

Richmond gave no timeline for the USDA finishing its work, but he said after his speech the USDA still plans to have rules done in time for the 2020 growing season,

The USDA has been “bombarded with questions” about hemp, he added, and is “working hard to issue the hemp regulations.”

He reminded the CBD companies that the USDA’s hemp regulations won’t be final until the industry has had an opportunity to see them and share feedback.

“Tell us what we got right – and, more important, tell us what we got wrong, because we have the opportunity to fix it,” Richmond said.

Which THC?

THC testing has proved a major challenge in moving the hemp industry to a standardized commodity.

Law enforcement authorities from Texas to Florida have said they don’t have tests that can differentiate between legal hemp and illegal marijuana, and the patchwork of testing standards is complicating the Farm Bill’s goal of allowing nationwide commerce for the new crop.

“What we grow in Oregon needs to be able to go to Colorado, to Kentucky, to whatever state and not run into issues with law enforcement,” said Sunny Summers, who coordinates hemp policy for the Oregon Department of Agriculture.

She also said during her talk at a CBD conference in Denver sponsored by the American Herbal Products Association that THC testing is “a big, big situation that as an industry we need to deal with.”

The Farm Bill’s direction, she said, doesn’t tell states how to prepare tests “using post-decarboxylation or other similarly reliable methods.”

“This is the No. 1 issue that I have – what the heck does that mean?” Summers said. “What is THC? Which version?”

Industry fears

THC testing protocols coming from the USDA could dramatically shake up the growing hemp industry, growers say.

That’s because most U.S. hemp farmers are producing cultivars rich in cannabinoids other than THC – the same types of hemp most likely to violate THC limits depending how and when they are tested.

If post-decarboxylized tests are used, “most of the cultivars and most of the varieties that we’re currently using in the U.S. would no longer be defined as hemp,” said Matt Cyrus, who raises hemp along with hay and cattle in Sisters, Oregon.

Cyrus told Hemp Industry Daily that the USDA’s looming hemp rules could throw many entrepreneurs back to the black market, depending on the testing standard.

“In theory, everybody who has hemp biomass on hand anywhere in the U.S. … would suddenly be outside the law,” said Cyrus, who is also president of the Deschutes County (Oregon) Farm Bureau.

USDA wants to make it easy

Richmond of the USDA told dietary supplement manufacturers that the agency understands how complex it is to set a national THC testing standard, but he promised that federal authorities are scrambling to give farmers and state and local regulators a solution that simplifies interstate hemp commerce.

“Our goal is to provide a consistent, easy-to-follow regulatory framework around hemp production,” he said.

“I can’t speak to whether that means a hard, prescriptive set of requirements for everybody at this stage. But our goal is to provide consistent standards that make sense for growers and for the industry.”"
Former VA physician charged with the deaths of three veterans,https://www.washingtonpost.com,"['Lisa Rein', 'Reporter Covering Federal Agencies', 'The Management Of Government In The Trump Administration', 'August At Pm']",08-20-2019,2019,8,https://www.washingtonpost.com/politics/former-va-physician-charged-with-the-deaths-of-three-veterans/2019/08/20/0119ea16-c345-11e9-9986-1fb3e4397be4_story.html,"Federal prosecutors on Tuesday charged a former Veterans Affairs pathologist with the deaths of three veterans and a scheme to cover up years of drug and alcohol use on the job that caused him to misread thousands of fluid and tissue samples of ill patients.

Robert Morris Levy was indicted on three counts of involuntary manslaughter and 28 counts of mail fraud, wire fraud and false statements to law enforcement officials. The Department of Veterans Affairs has told members of Congress and investigators that Levy was responsible for at least 15 deaths and the inappropriate treatment of many other patients.

During 12 years as chief pathologist here and in leadership roles on multiple oversight boards and medical committees, Levy, 53, read almost 34,000 pa­thol­ogy slides of aging veterans. He had their lives in his hands, prosectors said in unsealing their indictment. But his addiction and attempts to cover it up even after VA paid for a lengthy inpatient treatment program led to multiple deaths and other life-threatening trauma for veterans, they said.

“Diagnoses rendered by Levy and the information he entered in patients’ medical records largely influenced decisions about the course of medical treatment” for patients at the Veterans Health Care System of the Ozarks, the indictment said.

“Doctors and other medical providers at [the medical center] relied upon the accuracy of the diagnoses,” prosecutors charged. The indictment was unsealed at a news conference by Duane Kees, the U.S. attorney for the Western District of Arkansas. Levy is an Air Force veteran who was fired from VA last year.

The charges unsealed Tuesday mark a rare criminal case against a physician, in or out of government, in a profession where mistakes or incidents of negligence are most often addressed in civil court through malpractice claims, authorities said.

The case already is prompting a reckoning and questions of oversight for the country’s largest medical system — a sprawling, decentralized network of 1,200 hospitals and smaller clinics that serve 9 million veterans a year.

From 2005 to 2017, Levy read slides and assisted radiologists, surgeons and other physicians during procedures called “needle biopsies,” rendering clinical diagnoses for about 24,000 veterans.

They were patients from rural and often low-income communities of northwest Arkansas, southwest Missouri and eastern Oklahoma. He did not treat veterans in person but from his pa­thol­ogy lab on the third floor of Specialty Building 21 in the back of the medical center’s campus. He was tasked with a crucial medical role — diagnosing cancer and other diseases in aging veterans who fought in World War II, Korea, Vietnam, the Gulf War or in Iraq and Afghanistan, and those who served but did not see combat.

Many of these veterans rely solely on VA for their medical care, lacking private insurance.

An 18-month review of Levy’s cases found that almost 10 percent of his diagnoses involved clinical errors, more than 10 times the normal misdiagnosis rate of 0.07 percent for pathologists.

Hundreds of the misdiagnoses were not serious, VA officials said. But the mistakes led to at least 15 deaths, authorities said, and other serious illnesses for veterans whose cancers or other illnesses were not diagnosed or were diagnosed when they should not have been, leading to unnecessary treatment.

Levy, appearing at his arraignment Tuesday in a federal courtroom here in a gray striped prison jumpsuit, pleaded not guilty. He awaited his turn on a crowded docket, slouched over and solemn, his hands shaking from time to time as if with tremors. Occasionally he glanced to the bank of prosecutors and investigators seated in the room.

Levy stood out: The other defendants, most facing drug charges, told the judge they had completed high school. When asked for his level of education, the pathologist, trained at the University of California and Emory University with a sub-specialty in hematopathology, responded, “MD”

Levy told Judge Erin Wiedemann he had secured an attorney only Monday. She set a trial date for Oct. 7, and Levy was returned by a U.S. marshal to the county jail in Fayetteville, where he has been since his arrest late last week.

VA fired Levy last year after an arrest for driving under the influence. But his termination followed a tumultuous tenure, particularly in recent years, during which his colleagues in the pa­thol­ogy lab complained that they witnessed erratic behavior from him while on the job. Their complaints went unheeded, the indictment alleges.

Following an incident of erratic behavior, Levy entered a VA program for impaired physicians in Mississippi in 2016 and returned to work. But a year later he appeared at a meeting of fellow pathologists and oncologists that he was chairing unable to stand and slurring his words, according to documents and interviews.

His medical privileges were suspended, but he continued to perform administrative work until the DUI arrest and was fired in April 2018.

At the heart of the case, say investigators, former employees and VA patients in northwest Arkansas interviewed by The Washington Post, is how 13 years of missed diagnoses, many of them of fatal diseases, went undetected and why distress calls from employees went unheeded.

VA has long struggled with issues of access to patient care and whether its physicians are vetted carefully enough for misconduct and mistakes that could endanger patients, when they are hired or on the job. Some said Levy’s impaired behavior on the job was well known for years but little was done to stop him.

Rep. Bruce Westerman (R-Ark.), who with his colleagues in Arkansas’s delegation to Congress has aggressively monitored VA’s outreach to veterans affected by the case, said he is furious at what he described as a “lack of oversight.”

“Of all the medical professionals, the person you really don’t want messing up is a pathologist,” Westerman said in an interview. “If you have cancer, you want to know about it. If you don’t have it, you don’t want to be treated for it.

“There were poor procedures in place, or they weren’t followed like they should have been. Levy had a record of being impaired on the job and continued to evaluate cases.”

In a statement before Levy was charged, Kelvin Parks, director of the Fayetteville medical center, offered his “sincerest apology to the Veterans and family members negatively impacted by this now-fired former employee.”

“In instances where his conduct did not meet the high standards Veterans and taxpayers expect from us, we are holding ourselves accountable, letting Veterans and families know their options and keeping the community informed,” the statement said.

Parks said there was a “vulnerability” in the internal case review process that sometimes allowed supervisors to review their own cases. In the future, he said the hospital will have someone from the quality-control department manage and oversee all case reviews."
