It's time to break up the Department of Homeland Security,https://www.cnn.com,['David Perry'],07-04-2019,2019,7,https://www.cnn.com/2019/07/04/opinions/department-of-homeland-security-needs-dismantling-perry/index.html,"David M. Perry is a journalist and historian. He's the senior academic adviser to the history department at the University of Minnesota. Follow him on Twitter . The views expressed here are those of the author. View more opinion articles on CNN.

(CNN) Every day, it seems, we get another story about the horrible conditions in the US Customs and Border Protection detention facilities or Border Patrol officers behaving badly . This current crisis at the border and in the various immigration agencies is not just a byproduct of Trump and his advisers' virulent nativism, but a manifestation of the flaws built into the Department of Homeland Security. The DHS was never going to work. It's time to break it up.

The department was thrown together during George W. Bush's administration, forged in fear in the aftermath of 9/11. Today, it's a hodgepodge of diverse agencies -- including the TSA, FEMA, ICE, and many more -- often with conflicting missions, all of which have been subordinated beneath Trump's anti-immigrant agenda

I remember remarking to a friend in 2002, when the Homeland Security Act created the new department with broad bipartisan support, that ""Homeland Security"" sounded like something out of a dystopian novel. A year after 9/11, American politicians were afraid of another attack, they were being misled toward war in Iraq, compromising civil liberties in exchange for projecting a feeling of security, and making lots of mistakes, usually with wide margins of support from their constituencies.

As we head toward the 2020 election, and as horrific conditions in prison-like facilities run by the immigration agencies of DHS are headline news , it's long past time to take a sober look at the post-9/11 moment and find ways to fix some of those mistakes.

This week, as the Congressional Democrats were touring a Texas border facility run by Customs and Border Protection, ProPublica broke a story that described a secret Facebook group of some 9,500 current and former Border Patrol agents. Here, members ""joked about the deaths of migrants, discussed throwing burritos at Latino members of Congress visiting a detention facility in Texas on Monday and posted a vulgar illustration depicting Rep. Alexandria Ocasio-Cortez engaged in oral sex with a detained migrant."" The US Customs and Border Protection Agency has called the posts ""completely inappropriate"" and promised to investigate its officers

Examining these abuses shines a light on the folly of slamming immigration enforcement agencies (such as ICE and CPB) into a single department with agencies in charge of emergency management (FEMA), transportation (TSA), and energy (Cybersecurity and Infrastructure Security Agency), all bound together by a counterterrorism mission statement.

As security expert Bruce Schneier often says , in the aftermath of terrorism, politicians feel desperate, rationalizing: ""Something must be done. This is something. Therefore, we must do it."" That's the kind of thinking that created the Department of Homeland Security.

Immigration police from throughout the US Immigration and Customs Enforcement division of DHS, which includes ICE and CPB, seem to feel free to act with impunity , knowing they can resist oversight by citing the counterterrorism mission of DHS. Any budgetary limit on one agency opens up the other components to plundering, such as when DHS transferred nearly $10 million from the Federal Emergency Management Agency to ICE, the funds at least partially used for immigration detention and deportation, in the midst of the 2018 hurricane season.

JUST WATCHED Border patrol agent warns of derogatory culture at CBP Replay More Videos ... MUST WATCH Border patrol agent warns of derogatory culture at CBP 03:55

I'm far from the first to call for breaking up DHS and returning its components to other departments where they belong, back to pre-existing agencies like Transportation, Justice, and Energy. In 2006, not long after FEMA failed New Orleans during Hurricane Katrina, Yale sociologist Charles Perrow offered some ""dreary conclusions"" in Homeland Security Affairs, writing that DHS is not particularly adept at fulfilling its core mission of streamlining intelligence sharing among federal agencies while diverting funds from supporting first responders in the wake of natural disasters.

In 2011, David Rittgers, a legal policy analyst for the libertarian Cato Institute, made his case that ""the Department of Homeland Security should be abolished and its components reorganized into more practical groupings."" In 2012, Tulane scholar Kevin Gotham linked the 2002 Homeland Security Bill to an accelerated process of privatization of disaster relief at least partially responsible for the failures during Hurricane Katrina.

Former DHS counterterrorism official Matt Mayer, later a scholar of homeland security, wrote in 2015 , ""after twelve years of mediocre-to-poor operations and countless scandals ... the core functions overseen by DHS can be managed more effectively elsewhere, especially where territorial battles undermine operational efficacy.""

None of these authors are radicals. They are just looking at the mission of DHS, assessing its successes, condemning its many failures, and concluding that the agency can't be fixed.

DHS was a bipartisan mistake. It's made it harder for FEMA to respond to national disasters. It's enabled a culture of impunity and aggression among our immigration officers. It has a history emerging from a specific historical context and time. I believe that as the decades pass, historians like me will look back in sadness at the years after 9/11, when national unity was squandered in persuading Americans to abandon their civil liberties, plunging the nation into endless war, and laying the groundwork for our new regime of concentration camps (as some genocide scholars characterize them ) on the American border.

Stay up to date... Sign up for our new newsletter. Join us on Twitter and Facebook

We can make new decisions and claim a new historical moment. Breaking up the Department of Homeland Security is a first step toward making the homeland more just and more secure."
"Lots of DoD Small Launchers, But What Will They Launch?",https://breakingdefense.com,"['Theresa Hitchens', 'Arie Egozi', 'Sydney J. Freedberg Jr.', 'Breaking Defense', 'Leonardo Drs']",,,,https://breakingdefense.com/2019/07/lots-of-dod-small-launchers-but-what-will-they-launch/,"WASHINGTON: Small satellite launcher projects are all the rage at DoD, but there aren’t many actual small satellites for them to launch. While there are numerous experimental satellites being designed and flown, there is no officially funded program aimed at designing, building and using smallsats for DoD missions.

“I think there’s been a long chicken and egg problem between small launch and small satellites” says Steve Nixon, president of the aptly-named SmallSat Alliance. “The traditional way is to attack them at the same time: do a little bit of both consecutively. We would like to see the national security side move out more aggressively, because there is lot of agreement about the value of small satellites.”

Indeed, part of the mission of the SmallSat Alliance, formed last year, is to help DoD figure out how it can “go beyond just experiments and begin to use small satellites for true operations.”

A DoD official admitted this week that right now it would be impossible to name a “program of record” for small satellites within the military services.

Part of the problem is that Air Force leadership has sent mixed signals on the level of interest in small satellites. The Air Force accounts for about 90 percent of DoD space spending.

Former Air Force Secretary Heather Wilson waxed decidedly noncommittal in a speech at the annual Space Symposium in April. Wilson said that an internal Pentagon study on future space architectures found that “exquisite satellites” (that is, large, expensive, and highly capable) are still a key DoD focus. (That study has not been released publicly.)

Air Force Space Command Vice Commander Lt. Gen. David Thompson, however, told a New America conference here in May that the Air Force will “definitely be using” large constellations of small satellites.

“The external and internal communication regarding [DoD] smallsat strategy is not consistent and not clear,” Carissa Christensen, CEO of Bryce Space and Technologies, said somewhat wryly in a Tuesday interview.

Experiments Everywhere

At the same time, practically every space-related body within DoD seems to be experimenting with small satellites based in Low Earth Orbit (LEO) — or in Pentagonese, “proliferated LEO.”

One of the flagship programs underway is the Defense Advanced Research Project Agency’s (DARPA) Blackjack program, designed to test small satellite constellations based on a Lego-like model of standardized bus designs with switchable payloads. While the Air Force has been planning to transition technology proven successful from Blackjack — called CASINO for Commercially Augmented Space Inter Networked Operations — to its own LEO-based constellation of smallsats, funding for that is uncertain.

The Air Force Research Laboratory (AFRL) at Wright Patterson AFB long has developed smallsat-based experiments, such as the Demonstration and Science Experiments (DSX) spacecraft studying the affects of the Van Allen radiation belts on spacecraft components. The DSX was launched last week on SpaceX’s Falcon Heavy, along with 24 other small satellites under Air Force Space and Missile System Center’s (SMC) Space Test Program-2 mission.

The DoD Space Test Program (STP) has been around for decades, working to orbit Army, Navy and Air Force space experiments that are chosen by the DoD Space Experiments Review Board (SERB), chaired by the head of Air Force acquisition, Will Roper. SMC manages the STP program.

The Army, which has long been interested in the promise of small satellites for its tactical needs, has its own programs as well. The most recent effort is the Gunsmoke-L program started last year with a two-year (plus an option for a third), $8.3 million contract with Dynetics, based in Huntsville, Ala., to develop, test, integrate and demonstrate two “tactical space support vehicles.” The Army has built a series of the classified Gunsmoke satellites, dating back to at least 2017.

Further, my colleague Vivienne Machi last week broke the news that the Army is developing its first “tactical space layer” strategy that could include satellites in LEO for communications; position, navigation, and timing (PNT) and battle management command and control (BMC2) missions.

The Navy, in November 2018, launched its ICE-Cap (Integrated Communications Extension Capability) nansosatellite to demonstrate the ability of Low Earth Orbit (LEO) satellites to expand the coverage of its Mobile User Objective System (MUOS) narrow-band communications satellite network to the polar regions.

But none of these test projects are slated to transition to formal programs, with formal budgets, and formal military missions.

Proliferating Launch Initiatives

Meanwhile, there is enormous industry buzz in the small launch vehicle market, including about the potential for DoD contracts.

Christensen said one of the reasons small launch vehicle vendors around the world are increasingly looking at governments as potential customers is that the commercial market is simply not going to be able to support all of them. Based on market history and future trends, she explained, not all the thousands of smallsats being proposed (or even already licensed) will actually be deployed; even some of the companies that manage to orbit some smallsats will fail; and once a company actually manages to become economically viable, the size of its satellites is likely to grow.

But rather than being concerned about the disconnect between DoD’s eagerness to on-ramp commercial launch capability and the lack of real DoD smallsat programs, Christensen believes DoD is doing the right thing by moving out to try to harness the capability for responsive launch. (Responsive launch, the ability to launch practically on demand, has been a Holy Grail for the Pentagon for more than a decade. See Operationally Responsive Space.)

“I really feel like this slight disconnect of market dynamics is creating a really good opportunity to take advantage of emergent systems and determine if they have applicability to future military of IC [Intelligence Community] needs, for much cheaper than starting from scratch and building internal DoD programs.”

There are at least three significant DoD programs seeking to validate smaller launchers for future military use.

STP is partnering with the Defense Innovation Unit (DIU) on the Rapid Agile Launch Initiative (RALI). RALI is designed to leverage DIU’s expertise in open sourcing by rapidly awarding DoD launch service agreements with non-traditional, venture-class companies.

Last week, the truly non-traditional startup SpinLaunch announced it has become the latest winner of a DIU contract under that initiative. The contract (for an unspecified amount) is to prototype SpinLaunch’s ground-based, kinetic energy launch system that functions as a kind of centrifugal force catapult to heave a small rocket carrying a satellite out of the atmosphere.

A SpinLaunch fact sheet explains that the launch system uses “existing technology and components from oil/gas/mining and wind turbine industries to construct an innovative mass acceleration system, which achieves very high launch speeds without the need for enormous power generation or massive infrastructure. After ascending above the atmosphere, a relatively small, low-cost onboard rocket will be used to “provide the final required velocity for orbital insertion.”

The RALI program’s first launch was in May, when New Zealand startup Rocket Lab successfully lofted three small experimental satellites into LEO. It included the Army’s Harbinger, a commercial small satellite built by York Space Systems in Denver, to “demonstrate the ability of an experimental commercial system to meet DoD space capability requirements.”

DARPA’s Launch Challenge in April awarded $400,000 to each of three companies chosen to demonstrate “flexible and responsive” launch of small payloads. Tucson-based Vector Launch, Virgin Orbit, and a “stealth” startup now are competing for prizes up to $10 million for proving they can successfully launch twice in a row — from any launch facility chosen by DARPA — within a short timeframe. As a next step, the competitors early next year will be asked to launch a payload to LEO within two weeks from one of eight predetermined sites — after receiving notice of the launch site only a few weeks prior, and exact details on the payload and intended orbit just days before. One of the goals is to demonstrate that DoD can contract backup launches if one of its few fixed launch facilities is put out of commission by either an accident or an attack.

Todd Master, the program manager for the DARPA Launch Challenge, told me that DARPA is busy with preparatory work in the run up to the actual launch-off planned for early next year. This includes, he says, working with the Federal Aviation Authority to ensure that the commercial licensing process is smooth, given the “challenges” the project presents to the FAA’s normal launch licensing process. “They’ve been a great partner,” he said, adding that DARPA sees the Launch Challenge as “hopefully laying the ground work for streamlined licensing processes that could work in the future” to help DoD acquire commercial space launch capabilities.

And yet another new Air Force small launch effort, called the Rapid Space Launch Initiative (RSLI), was kicked off in late May by SMC’s Rocket Systems Launch Program based at Kirtland AFB in New Mexico. The RSLI request for proposals says that the Air Force is “investigating the possible procurement of a capability to rapidly launch and deploy space payloads critical to national security in an ultra-responsive manner. The objective is 24 hours from “call up” notification to on-orbit capability.”

That project seeks to demonstrate rapid space launch capabilities to LEO “on a small scale,” with “the intended payload” an “Evolved Expendable Launch Vehicle Secondary Payload Adapter (ESPA) class space vehicle or smaller with a mass up to 220kg.” The RFI, however, notes that “demonstrated solutions that can scale to orbits and payloads of national security value are also of great interest. The program intends to hold an industry day in El Segundo, Calif., July 29-30."
Tucson veterans groups unhappy with changes in VA care,https://tucson.com,"['Danyelle Khmara Arizona Daily Star', 'Danyelle Khmara', 'Griffin Riley', 'For The Arizona Daily Star', 'Dylan Simard', 'Cronkite News']",,,,https://tucson.com/news/local/tucson-veterans-groups-unhappy-with-changes-in-va-care/article_6e57a430-7f00-5eaf-abdb-bdf3cce62772.html,"Reporter

Danyelle joined the Star in 2018 and covers mental health, addiction, homelessness, veterans’ issues and affordable housing. Previously, Danyelle wrote for the Tucson Weekly for two years and won several awards while she was there."
"After nearly two years, State Dept. responds to inquiry over alleged alcohol poisonings of US tourists",https://www.cnn.com,"['Michelle Kosinski', 'Zachary Cohen']",07-03-2019,2019,7,https://www.cnn.com/2019/07/03/politics/state-department-tainted-alcohol-mexico/index.html,"Washington (CNN) Nearly two years after receiving an inquiry from Senate Homeland Security Committee chairman Ron Johnson, the State Department is finally revealing details about its investigation into multiple deaths and illnesses that occurred shortly after Americans drank alcohol at Mexican resorts , CNN has learned.

The response, obtained by CNN, said that two bars were ultimately shut down by Mexican authorities after the State Department pressured them to inspect a number of establishments.

It was sent to Johnson, a Wisconsin Republican, last month by the State Department's Office of Inspector General. Johnson first wrote to enquire about the cases involving allegations of tainted alcohol in October 2017.

The timing of the OIG's response coincides with a more recent string of mysterious tourist deaths in the Dominican Republic

In several of those cases, families have alleged that the victims became ill just after consuming alcohol, leading the FBI to look into whether tainted alcohol might be a factor there as well.

While there is no indication of a link between the incidents that occurred in Mexico and the more recent cases in the Dominican Republic, the response to Johnson's 2017 letter highlights several concerns related to the US government's handling of inquires involving American tourists abroad.

Johnson sent his letter to the State Department just months after the death of a 20-year-old woman from Wisconsin named Abbey Conner in January 2017.

She and her brother Austin lost consciousness soon after consuming alcohol at the pool bar in the Iberostar Paraiso del Mar on the first day of their family's vacation. Abbey was found face-down in the shallow end of the pool, nearly drowned, and died days later after being airlifted to a hospital in Florida.

""According to Ms. Connor's family, and other victims who have since come forward, the consumption of allegedly tainted alcohol at Mexican resorts has led to violence, physical abuse and even death,"" Johnson's letter to the State Department states. ""I respectfully ask the Office of the Inspector General to examine how the Department monitors, records and reports overseas incidents involving physical abuse or death after the consumption of potentially tainted alcohol.""

'Formal report would not be appropriate'

Despite prompting a wide-ranging probe into the issue, which included reviewing every complaint made to the State Department about possible bootleg alcohol, interviewing the people involved and significant coordination with the Mexican government, the Inspector General ultimately concluded that a ""formal report would not be appropriate.""

The response explains, ""OIG faced several challenges in completing this review, including the fact that victims often did not report incidents of unregulated alcohol to the department, which significantly limited the number of cases on which OIG could base any generalizable findings,"" it states.

""In addition, OIG's review was complicated by the fact that the guidance for consular personnel who face these types of situations is general and sometimes advisory, mainly because of the complex and variable nature of the incidents themselves.""

However, the lengthy response does detail the inner workings of how this inquiry was handled as a result of pressure on the State Department, and details some of the actions that were taken as a result of the review.

Ultimately, the State Department's Bureau of Consular Affairs did provide OIG with a list of 15 complaints that it has received since 2017 related to the consumption of unregulated alcohol by Americans in the Mexican state of Quintana Roo, the most visited by tourists from the US.

Two bars shut down

The State Department pressured the Mexican government to inspect 30 bars, restaurants and hotels. Two bars -- including one that served Abbey and Austin Conner -- have been shut down as a result. Raids were conducted by Mexican authorities that did end up finding ""a significant amount of alcohol of 'undetermined origin'"" and led to the identification of one supplier of questionably-sourced alcohol.

Ten thousand gallons of this alcohol was seized -- although according to the OIG, none tested positive for any dangerous substances.

And the State Department's work led to the Mexican government opening an office staffed with bilingual attorneys to help American tourists file police reports.

The response makes no mention, however, of multiple incidents reported in various media outlets that Mexican officials had, in other raids, seized hundreds of gallons of alcohol allegedly tainted with methanol, a toxic form of alcohol that is used in fuel, antifreeze, windshield wiper fluid and solvents. It can cause blindness and death.

Those findings are included in the Conner family's wrongful death lawsuit against Iberostar, filed last year.

The Milwaukee Journal Sentinel, which has reported extensively on the Mexican cases, reports that it has heard from more than 200 people who believe they encountered tainted alcohol in Mexico, and the paper cites a 2017 Mexican government-spearheaded study that found that as much as 36% of all alcohol consumed throughout Mexico is produced illegally and unregulated.

The OIG's response did detail some of the difficulties American families of victims faced in getting help from the State Department while in Mexico, which some families described as ""insensitive,"" ""bureaucratic,"" or virtually nonexistent. At times families were told by State officials that they could not help them navigate the Mexican law enforcement or healthcare process.

The family of one woman who died was told the State Department couldn't help them at all submitting a police report when the Mexican government refused to let them file one.

In one case, a man had to wait until the next day for assistance filing a police report, despite reporting he was drugged and sexually assaulted after drinking tainted alcohol.

Yet despite recording the summaries of various reported cases, OIG did not express an opinion as to whether extensive handling of alleged cases of tainted alcohol in Mexico falls under the State Department's area of responsibility.

""OIG cannot draw definitive conclusions about any individual consular officer's compliance with Department policies in these cases,"" their response to Johnson's letter says, since State Department guidance on this issue remains vague.

An official with the inspector general's office told CNN their investigation is now closed.

""We were really limited by our jurisdiction, in what we could look at,"" the official said. ""We mostly had to focus on the actions of the State Department. And it did put a lot of pressure on the Mexican government to do thorough inspections.""

The official said the Mexican government was receptive to the US's urgings to do something about‎ the problem, but added, ""Mexico doesn't want to lose tourist dollars. It's a huge source of revenue.""

Gary Davidson, an attorney for the family of Abbey Conner, continues to seek answers and compensation for the family's loss. ""There is basically homemade liquor down there, circulating in the community of hotels -- and a lot of the hotels are buying it,"" he told CNN."
