Homeland Security’s Jeanette Manfra is coming to Disrupt SF – TechCrunch,https://techcrunch.com,[],06-12-2019,2019,6,https://techcrunch.com/2019/06/12/jeanette-manfra-disrupt-sf/,"We can’t talk cybersecurity without hearing from the government.

We’re thrilled to announce Homeland Security Assistant Director Jeanette Manfra, a senior executive at the department’s Cybersecurity and Infrastructure Security Agency (CISA), will be at Disrupt SF.

Manfra is one of the federal government’s most experienced cybersecurity civil servants. She currently leads CISA’s cybersecurity efforts in protecting and strengthening the country’s most important infrastructure, like the power grid and water supplies. A decade-long government career professional, she previously served as acting deputy under secretary for cybersecurity at the National Protection and Programs Directorate, a division of Homeland Security dedicated to protecting government networks and critical infrastructure, later absorbed by CISA after the agency was created by President Trump in November 2018.

Prior to Homeland Security, Manfra served in the U.S. Army as a communications specialist and a military intelligence officer.

For years, cybersecurity warfare was somewhat limited to governments attacking governments. But the threat landscape has changed, and the new battleground is both in government and in the private sector.

Now under one roof, CISA acts as the nation’s cybersecurity risk adviser — working closely with government departments to protect federal systems and networks, and private industry to advise and warn on ongoing and emerging threats.

The agency has recently doubled down on its efforts to ensure election security, as well as risks to the U.S. supply chain.

Cybersecurity is one of those universal topics that affects every consumer, business, enterprise and government. We’re excited to talk shop with Manfra about the state of the security union.

Disrupt SF is in San Francisco on October 2-4; tickets are available here."
Gregory Angelo: Trump's the most pro-gay GOP president ever – That’s why State's Pride flag ban is so odd,https://www.foxnews.com,"['Gregory Angelo', 'Gregory T. Angelo Is A Communications Consultant Based In Washington', 'The Former President Of Log Cabin Republicans.']",,,,https://www.foxnews.com/opinion/gregory-angelo-trump-gop-pro-gay-state-department-pompeo-pride-flag-ban,"With a few taps of his fingers, President Trump made history with a May 31 message on Twitter: ""As we celebrate LGBT Pride Month and recognize the outstanding contributions LGBT people have made to our great Nation, let us also stand in solidarity with the many LGBT people who live in dozens of countries worldwide that punish, imprison, or even execute individuals on the basis of their sexual orientation.""

It was the eve of a month that commemorates the 50th anniversary of the Stonewall Rebellion, which marked the start of the contemporary gay rights movement in the United States.

Trump added: ""My Administration has launched a global campaign to decriminalize homosexuality and invite all nations to join us in this effort!""

TRUMP ADMINISTRATION DENIES EMBASSIES' REQUESTS TO FLY PRIDE FLAG ON FLAGPOLES

The announcement was twofold in significance. One, it marked the first time in the history of the United States that a sitting Republican president formally recognized Pride Month. Secondly, it reaffirmed the unprecedented campaign his State Department has waged to end the cruel custom of criminalizing homosexuality, a practice still embraced by barbaric nations around the world.

Without a doubt, Trump is the most pro-gay Republican president in American history. He is also the first president from either political party to enter the White House while supporting same-sex marriage, and he has made a bold commitment to eradicate HIV domestically by 2030. Taking all of this into account, Trump is situated to become the most pro-gay president ever.

Of course, there is still time for Pompeo to change course on this nonsensical policy. Here’s to hoping he does.

Considering this context, the State Department's order to embassies around the globe not to fly the gay pride flag is perplexing. It's an unforced error that generates unnecessary ill will in the gay community — in addition to the everyday Americans who President Trump will need in order to win re-election next year.

With the number of Americans who support gay individuals trending upward, the State Department's decision could have drastic consequences at the ballot box for our country’s commander-in-chief.

Make no mistake: the responsibility for this decision ultimately rests with Secretary of State Mike Pompeo. Even worse: this is not a matter of undoing some Obama-era standard. It marks a categorical reversal of Trump administration policies.

""The United States joins people around the world in celebrating Lesbian, Gay, Bisexual, Transgender, and Intersex (LGBTI) Pride Month, and reaffirms its commitment to protecting and defending the human rights of all, including LGBTI persons,"" Pompeo said in an official statement commemorating Pride Month last year.

Days later, United States embassies around the world raised the rainbow flag in a symbolic echo affirming Pompeo’s very words — without incident or controversy. The flags did not fly in lieu of Old Glory, nor did they fly above the Stars and Stripes; it was a simple gesture expressing solidarity with gay people around the world, many of whom face threats of death simply because of who they are.

Simple gestures can be powerful things: Just this week, Iran Foreign Minister Mohammad Javad Zarif publicly affirmed his country’s practice of executing gay people.

CLICK HERE TO GET THE FOX NEWS APP

Secretary Pompeo’s reversal of United States embassy policy regarding the gay pride flag telegraphs mixed messages to terrorist regimes such as Iran and muddies the diplomatic waters at a time when American leadership on gay human rights issues should be paramount.

Of course, there is still time for Secretary Pompeo to change course on this nonsensical policy, and here’s to hoping he does — President Trump is none too fond of cabinet secretaries who insist on disregarding his leadership and doing things their way instead.

CLICK HERE TO READ MORE BY GREGORY ANGELO"
Treasury Department finalizes rule to stop Democratic states’ tax workaround,https://www.washingtontimes.com,"['The Washington Times Http', 'Stephen Dinan']",06-11-2019,2019,6,https://www.washingtontimes.com/news/2019/jun/11/treasury-department-finalizes-rule-stop-democratic/,"The Treasury Department released its final rules Tuesday outlawing the push by Democrat-led states to undermine the GOP’s new tax law, saying that donating to state-run charities isn’t a substitute for paying federal taxes.

A number of high-tax states had balked after the tax changes President Trump signed in 2017 limited how much state and local taxes could be written off on federal returns.

New York, California and New Jersey all explored new laws allowing residents to make some of their state tax payments as contributions to charities, figuring that would be an end-run around the federal changes, since charitable contributions are still fully deductible.

But the feds said that violated the spirit of the law and they are shutting it down.

They said a longstanding principle of tax law is that someone who gets something of value in exchange for a donation to charity can only deduct the net value of the donation.

The new rule “applies that principle, known as the quid pro quo principle, to state tax benefits provided to a donor in return for contributions,” Treasury said.

That means if someone donated $1,000 to a state charity and the state gives a $700 tax credit for the donation, the taxpayer can only take a federal write-off on the remaining $300, since the taxpayer already got $700 of value.

Rep. Bill Pascrell, a New Jersey Democrat and one of the most vocal critics of the GOP’s tax overhaul, blasted the IRS rules.

“This Trump administration seems to wake up in the morning trying to think up ways to screw my state,” he said, saying the move undermines New Jersey’s workaround.

“This isn’t over,” he vowed.

The IRS had proposed the rules earlier, and Tuesday’s announcement was a finalization of the rule.

Limiting state and local tax (SALT) deductions to $10,000 for a married couple filing jointly was a major part of the GOP’s tax overhaul. While income tax rates were lowered, the new law imposed caps or did away with a number of deductions.

The SALT limits struck particularly hard at wealthier people with expensive homes, who pay high property taxes.

Republicans said high-tax states had been benefitting unfairly, since residents wrote off a larger share of their tax burden. That meant those states were powering their spending at the expense of federal taxpayers.

GOP lawmakers said the answer was for those states to cut their taxes.

The states, though, had other ideas.

Several of them sued, arguing the rules were discriminatory. Some sought the workarounds.

Meanwhile, Mr. Pascrell and other Democrats from those high-tax states rushed to introduce legislation repealing the SALT limits, in a move that would have amounted to a new tax cut for wealthier Americans.

That legislation has not gained traction on Capitol Hill.

Copyright © 2019 The Washington Times, LLC. Click here for reprint permission."
Are you a robot?,https://www.bloomberg.com,[],06-12-2019,2019,6,https://www.bloomberg.com/news/articles/2019-06-12/trump-offers-to-negotiate-price-of-j-j-anti-depressant-for-va,"Why did this happen?

Please make sure your browser supports JavaScript and cookies and that you are not blocking them from loading. For more information you can review our Terms of Service and Cookie Policy."
3 Republican former EPA chiefs accuse Trump of 'undermining of science',https://abcnews.go.com,['Abc News'],,,,https://abcnews.go.com/Politics/republican-epa-chiefs-accuse-trump-undermining-science/story?id=63631502,"Three Republican former heads of the Environmental Protection Agency accuse the agency's current leadership of supporting the ""undermining of science"" and a potentially ""catastrophic"" approach to climate change.

Interested in Donald Trump? Add Donald Trump as an interest to stay up to date on the latest Donald Trump news, video, and analysis from ABC News. Add Interest

In an exclusive interview with ABC News Live, before a rare joint appearance on Capitol Hill, former EPA administrators William Reilly, Lee Thomas and Christine Whitman warned that recent gains in cleaner air and water in the U.S. are beginning to ""backslide.""

""If we continue business as usual, it's catastrophic,"" said Reilly, who led the agency under President George H.W. Bush. ""We're the number two emitter in the world after China.""

Whitman, a former New Jersey governor who ran the EPA under President George W. Bush, raised concerns about ""the disrespecting of science in the administration and the undermining of science and the importance of science.""

Thomas said his old boss, President Ronald Reagan, would have wanted the agency to recommit to its central purpose.

""Change the direction, change the management and go back to the mission of the agency. That's what I think President Reagan would say, 'That's not how I want this agency to operate,'"" Thomas said.

Three Republican former @EPA chiefs join me for an exclusive joint interview @ABCNewsLive on the state of the agency and our #climate. 3:30/5:30/6:30p ET https://t.co/t5KL0KMFpQ or @ABC on Hulu, Roku, Facebook, Apple TV pic.twitter.com/ioQg8e339q — Devin Dwyer (@devindwyer) June 11, 2019

The trio spoke with ABC News before a House Energy and Commerce Subcommittee hearing Tuesday on the direction of the EPA, which was created in 1970 by Republican President Richard Nixon to protect the human health and the environment. Former Obama administration EPA chief Gina McCarthy also testified.

Asked to grade the performance of the current EPA leadership, led by Administrator Andrew Wheeler, the three Republicans agreed on ""D"" or ""a little lower.""

""You need an agency that is credible, has consistency in its rule making and is science-based,"" said Thomas, who lamented a steady exodus of career employees from the EPA because of disillusionment with its current direction.

ABC News

When ABC News Live spoke with Wheeler earlier this year, he insisted that the agency remains focused on its core purpose but is balancing other economic priorities. He said he does not believe climate change is a ""hoax,"" as President Donald Trump has insisted, but also does not think it's the ""crisis"" many environmentalists make it out to be.

""That's an unfair characterization,"" said Reilly of Wheeler's position, noting that the agency's own National Climate Assessment has painted a dire picture of the situation.

""The Green New Deal did something really wonderful,"" he said. ""I am told by so many Republican members of Congress that they are never asked about climate when they go on the stump. And now, they're asked. That is marvelous. It's put it on the agenda.""

Whitman agreed.

""For the first time in my memory, an environmental issue is going to be a major part of a political campaign for the presidency,"" she said. ""I haven't seen that before, and it's not going to go away, and that's good.""

WATCH the full ABC News Live interview here.

ABC News' Heidi Jensen contributed to this report."
USDA division votes to unionize as employees protest planned relocation,https://www.washingtonpost.com,"['Ben Guarino', 'Reporter Covering The Practice', 'Culture Of Science', 'Lisa Rein', 'Reporter Covering Federal Agencies', 'The Management Of Government In The Trump Administration', 'June At Pm', 'Ben Guarino Is A Reporter For The Washington Post S Science Section. He Joined The Post In', 'Lisa Rein Covers Federal Agencies', 'The Management Of Government In The Trump Adminstration. At The Washington Post']",06-11-2019,2019,6,https://www.washingtonpost.com/science/2019/06/11/usda-division-votes-unionize-employees-protest-planned-relocation/,"

“We will work with this group of employees just as we work with all USDA employees,” Agriculture Secretary Sonny Perdue said in a statement Tuesday. (Erik S. Lesser/EPA-EFE/Shutterstock) (Erik S Lesser/EPA-EFE/REX/Shutterstock)

For the second time this year, workers at a science division of the Agriculture Department voted overwhelmingly to unionize in apparent revolt against the administration’s plan to relocate them from Washington, D.C., to a yet-to-be-announced location.

On Tuesday, employees at the National Institute of Food and Agriculture, which distributes $400 million in competitive grants to researchers around the country each year, voted 137 to 2 to be represented by the American Federation of Government Employees, the largest federal employees union. In May, the Economic Research Service, a federal statistical agency also included in the relocation, voted 138 to 4 to unionize with AFGE.

“We will work with this group of employees just as we work with all USDA employees,” Agriculture Secretary Sonny Perdue said in a statement distributed to reporters before the votes were counted. In August, Perdue announced the relocation as a cost-saving measure that would move scientists closer to those they serve, a claim critics dispute.

In early May, USDA announced that Kansas City, the Research Triangle in North Carolina and the state of Indiana had been selected as the leading candidates for relocation sites. The department has not said when it would make a final decision. “I truly believe that the relocation of ERS and NIFA will help to fulfill USDA’s commitment to be the most effective, most efficient and most customer-focused agency in the federal government,” Perdue said in the statement.

But former USDA officials and leaders in the agricultural community argue the relocation will paralyze the agencies, and have also warned that this proposal is an attempt to weaken the influence of scientists under the Trump administration.

Members of Congress were divided largely along partisan lines. At an Agriculture Committee hearing last week, Rep. Neal Dunn (R-Fla.) said the secretary “has broad support to move forward with this decision.” But Democrats in both chambers have introduced legislation to block the move, and they dispute whether the secretary has the authority to relocate the offices without congressional approval.

Peter Winch, a union organizer for AFGE, said that the newly formed union would ask the department to allow employees to visit the proposed relocation site and to give them more than 30 days to respond to reassignment letters.

The unionization vote comes as the Trump administration has taken a confrontational approach toward federal employees and their unions with executive orders, new policies creating a faster path to firing and tough stances at the bargaining table.

At a rally on Tuesday morning, about a dozen NIFA and ERS employees waved American flags and handed out pro-union stickers. Unionization would “delay changes to working conditions” and offer “protection from political interference,” according to the fliers they distributed. Those who spoke to The Washington Post did so on the condition of anonymity because they said they feared professional repercussions. Many employees are applying for new jobs in the District, and few said that they would consider relocating.

A senior NIFA employee said that the push to unionize “would never have happened without the secretary of agriculture.” Another lamented the absence of a USDA chief scientist, who in previous administrations had been the voice of scientists in the department.

A third employee said the workload — the number of grant awards to be processed — has quadrupled due to high attrition and the lasting effects of the federal government shutdown this winter. NIFA’s $1.7 billion budget supports cutting-edge research as well as rural communities and programs like 4-H. “The mission still has to be done,” the person said, but the “morale is not great.”

Inside the NIFA office building, workers waited for up to an hour to vote. Three-quarters of NIFA employees eligible to cast a ballot did so. About 30 people watched as an official from the Federal Labor Relations Authority counted the votes. NIFA employees cheered when the final tally was announced.

“Waiting for the department to give us a voice was not going to happen,” the senior NIFA employee said. The relocation process, which has “generated considerable frustration,” the person said, “provided a lot of motivation for employees to form a union in order to have a voice.”

The administration has argued that its pro-management policies are an effort to make government and its employees more efficient and able to serve the public. But the actions have created anxiety in federal offices and resulted in court challenges.

Last year, a federal judge shot down the bulk of three White House executive orders that were designed to bring a pro-management atmosphere to federal offices.

Among the toughest provisions was a drastic cut to what is known as official time, legally mandated spans that union officials spend on the clock representing their members in grievances and other disputes. The executive orders also sought to make it easier for managers to fire poor performers.

The judge’s ruling is on appeal, and a decision is expected in the coming weeks. Meanwhile, the administration has worked around the constraints of the court ruling at the bargaining table.

This article has been updated.

Read more:

Trump administration plans to move USDA research divisions despite concerns

After outcry, USDA will no longer require scientists to label research ‘preliminary’

China increasingly challenges American dominance of science"
US Department of Defense Reports Final Results from Travelan® Shigellosis Challenge Study,https://finance.yahoo.com,[],06-12-2019,2019,6,https://finance.yahoo.com/news/us-department-defense-reports-final-110000151.html,"Key Highlights:



Travelan ® shigellosis challenge studies in non-human primates successfully completed

Travelan ® prevented clinical shigellosis (bacillary dysentery) in 75% of Travelan ® treated animals compared to placebo and demonstrated a significant clinical benefit

Prophylactic administration of Travelan ® may provide an effective prevention alternative to antibiotics for gastrointestinal infections in humans

Three new Shigella specific anti-microbial therapeutics under preclinical evaluation

A preventative treatment that protects against enteric diseases, specifically Shigella, is a high priority objective for the US Army

MELBOURNE, Australia, June 12, 2019 (GLOBE NEWSWIRE) -- Immuron Limited (ASX: IMC; NASDQ: IMRN), an Australian biopharmaceutical company focused on developing and commercializing oral immunotherapeutics for the prevention and treatment of many gut mediated pathogens, today is pleased to provide shareholders with an update on the company’s cooperative research and development agreements with the US Department of Defense (US DoD).

The Shigella challenge model was used to assess the therapeutic potential of Travelan® as a prevention treatment for shigellosis or dysentery. The placebo-controlled study was carried out in 12 juvenile rhesus monkeys segregated into 2 groups: a Travelan® treatment cohort of 8 and a placebo cohort of 4, which were treated twice daily for a total of 12 doses over a 6-day period. The animals received treatment for 3-days prior to oral challenge with ~3 x 109 viable Shigella organisms.

As reported in September last year, all (4 of 4 - 100%) placebo-treated animals displayed acute clinical signs of dysentery within 24 – 36 hours of Shigella challenge. Only two of the eight Travelan-treated group displayed any signs of dysentery. The remaining 6 of 8 (75%) of the Travelan-treated group remained healthy and without signs of dysentery post challenge. Recently completed histopathological analysis, which provides a comprehensive view of the clinical disease and its effect on tissues of gut, revealed that all animals in the placebo-treated group displayed severe inflammation in different parts of the gastrointestinal tract. These animals also had very high levels of inflammatory cytokines (IL-1b, IL-6 and IL-8) in fecal samples collected throughout the study. The inflammation seen in the gastrointestinal tract and the increase in inflammatory cytokines in the feces were closely associated with the observed clinical outcomes of dysentery. Only 3 of the 8 Travelan-treated animals had signs of inflammation in the gastrointestinal tract, and only 2 of those had high levels of inflammatory cytokines in fecal samples. All other animals in the Travelan-treated group were clinically healthy and did not excrete any inflammatory cytokines. Overall the results suggest that Travelan® is functionally cross-reactive and may have some prophylactic activity against Shigellosis.

“The latest results reported by our colleagues at the US Armed Forces Research Institute of Medical Sciences (AFRIMS), an overseas laboratory of the Walter Reed Army Institute of Research (WRAIR), located in Bangkok, Thailand are very impressive indeed. The study results clearly demonstrated that animals with severe inflammation in the gastrointestinal tract and high inflammatory cytokines in fecal samples were associated with severe dysentery and that prophylactic administration of Travelan® significantly reduced the inflammatory response,” said Dr. Robert Kaminski, Chief, Subunit Enteric Vaccines and Immunology, Department of Enteric Infections, Bacterial Diseases Branch, WRAIR.

The abstract of the study findings has been submitted for presentation at the 10th International conference on Vaccines for Enteric Diseases which will be held at the University of Lausanne Switzerland on the 16th to 18th October 2019.

“This is further validation of our technology platform,” said Dr. Gary Jacob, CEO of Immuron. “The work completed by our research collaborators at the WRAIR has clearly demonstrated the effectiveness of Travelan® and the Immuron technology platform in neutralizing pathogenic gastrointestinal bacterial infections and offers significant potential as a preventative treatment for US military personnel and civilians stationed or traveling in locations where such infections may be debilitating.”

The company is also pleased to report that it has completed the manufacture of three new Shigella specific therapeutic products which have been manufactured with proprietary vaccines developed by the WRAIR. Preliminary laboratory evaluation has indicated that all three products have generated a strong antibody response to the Shigella antigens used in the manufacturing campaign. The three products will be evaluated in preclinical models of shigellosis developed by the WRAIR.

“The WRAIR has been developing vaccines against Shigella for over a decade and the combination of our Shigella vaccine research and development efforts with Immuron’s oral immunotherapy platform make perfect sense. The WRAIR will fund the evaluation of the anti-Shigella specific activity of the new products including assessing their protective capacity in established small animal models which will be completed and reported throughout the remainder of this year,” said Dr. Robert Kaminski.

Story continues"
