Barr says DOJ would back Mueller if he decides not to testify,https://www.foxnews.com,"['Gregg Re', 'Gregg Re Is A Lawyer', 'Editor Based In Los Angeles. Follow Him On Twitter']",,,,https://www.foxnews.com/politics/william-barr-robert-mueller-testify-census-question,"Attorney General William Barr said in an interview Monday that the Justice Department would support Robert Mueller if he decides he ""doesn't want to subject himself"" to questioning from congressional Democrats at a planned July 17 hearing.

Barr's comments raised the dramatic possibility that Mueller would pull out of the questioning at the last minute -- a potential coup for Democrats, as some Republicans and commentators have said Mueller's testimony could end up revealing fundamental problems with his now-closed investigation.

Although Mueller no longer was a DOJ employee, the Trump administration could still limit testimony about decisions made while he was special counsel. Barr indicated the Justice Department would seek to block any attempt by Congress to subpoena members of the former special counsel's team but did not say Mueller's testimony would be restricted in any way.

At the same time, a Mueller pullout would avert an unnecessary ""public spectacle,"" Barr told The Associated Press, given that Mueller has stated publicly that his exhaustive report on 2016 foreign election interference spoke for itself.

Trump attorney Jay Sekulow, however, has countered that Mueller's remarks could be necessary. Sekulow, in a Fox News op-ed last month, pushed for answers as to when exactly Mueller learned there was no evidence of collusion between the Trump team and Russia -- and why Mueller's team hinted in sworn court filings even late into the investigation that such collusion remained a tantalizing possibility.

TRUMP ATTY JAY SEKULOW: HERE'S THE QUESTIONS MUELLER MUST BE ASKED ON JULY 17

""I'm not sure what purpose is served by dragging him up there and trying to grill him,"" Barr asserted. ""I don't think Mueller should be treated that way or subject himself to that, if he doesn't want to.""

Mueller's 448-page report, released with redactions in April, found no proof that the Trump campaign conspired with Russian actors to influence the election, despite multiple outreach efforts by Russians, and did not reach a conclusion on whether President Trump obstructed justice.

Even so, Rep. Adam Schiff, D-Calif., the chairman of the House Intelligence Committee, tweeted Monday that Barr's remarks were ""no surprise.""

""Barr misled the public about Mueller's report, and wants his own deception to stand,"" Schiff wrote, referring to Barr's decision to release an initial summary of Mueller's report shortly before publishing the complete, redacted version. ""The public has a right to hear the truth, from Mueller himself, about Trump's misconduct and ongoing national security risks.""

In a news conference this past May, Mueller defended Barr's decision to release the summary: ""At one point in time, I requested that certain portions of the report be released,"" Mueller said. ""The attorney general preferred to make the entire report public all at once. We appreciate that the attorney general made the report largely public, and I certainly do not question the attorney general's good faith in that decision.""

MUELLER SUBPOENA COULD BACKFIRE ON DEMOCRATS, SAY POLITICAL, LEGAL EXPERTS

Barr's additionally said he still saw a legal path forward for requiring 2020 Census respondents to declare whether or not they're citizens. The Justice Department announced Sunday it was putting together a new legal team to spearhead its effort to ask the citizenship question after the Supreme Court temporarily blocked the move.

The justices said the administration's justification for the question ""seems to have been contrived,"" but implied they would consider additional arguments from the White House.

The new legal team, named in court papers, included Deputy Assistant Attorney General David Morrell, a former Trump White House lawyer and law clerk to Justice Clarence Thomas; Christopher Bates, who previously worked for Utah Republican Sen. Orrin Hatch, and four career Justice Department attorneys: Glenn Girdharry, Colin Kisor, Christopher Reimer and Daniel Schiffer.

James Burnham, a top lawyer in the department's civil division who had been leading the team, had told Barr that a number of people who'd been litigating the case preferred ""not to continue during this new phase,"" the attorney general said.

Barr would not detail the new team's precise plans, though a senior official told The Associated Press that Trump was expected to issue a memorandum to the Commerce Department instructing it to include the question on census forms. Barr said he didn't have details on why the attorneys didn't want to continue, but ""as far as I know, they don't think we are legally wrong.""

Many Democrats have said a citizenship question would deter illegal immigrants from filling out census forms. House Speaker Nancy Pelosi, D-Calif., said Monday that Trump wanted to add the demand for citizenship information because he wanted to ""make America white again.""

Census data counts all residents, including illegal immigrants, and is used to determine congressional apportionments and the makeup of the Electoral College. Although illegal immigrants cannot vote, their children become citizens automatically if born in the United States under a practice known as birthright citizenship -- which the Trump administration separately has called into question.

OPINION: WHY ENDING BIRTHRIGHT CITIZENSHIP IS CONSTITUTIONAL

The Trump administration has argued it wanted the citizenship question included to aid in enforcing the Voting Rights Act, which protects minority voters' access to the ballot box. However, Chief Justice John Roberts joined the court's four more liberal members in last month's Supreme Court decision, openly skeptical about that justification.

Pelosi, meanwhile, said in a letter to colleagues that the full House would be moving forward with a vote to hold Barr and Commerce Secretary Wilbur Ross in contempt of Congress after the administration failed to comply with subpoenas regarding the census question.

Barr spoke to the AP after touring a federal prison in Edgefield, South Carolina, where he met with inmates and staff members to discuss the criminal justice reform law that Congress approved and Trump signed into law last year.

CLICK HERE TO GET THE FOX NEWS APP

Separately, Barr revealed that he recused himself from the Jeffrey Epstein criminal case ""because one of the law firms that represented Epstein long ago was a firm I subsequently joined for a period of time.""

An indictment alleging sex trafficking and sex trafficking conspiracy was unsealed Monday morning against Epstein, the wealthy and politically connected financier who pleaded not guilty during his initial appearance in a New York City federal court. Prosecutors alleged that Epstein, the 66-year-old hedge fund manager arrested on Saturday, preyed on ""dozens"" of victims as young as 14.

Fox News' Catherine Herridge, Jake Gibson, and The Associated Press contributed to this report."
Are you a robot?,https://www.bloomberg.com,[],07-09-2019,2019,7,https://www.bloomberg.com/news/articles/2019-07-09/acting-defense-chief-esper-modifies-recusal-pledge-on-raytheon,"Why did this happen?

Please make sure your browser supports JavaScript and cookies and that you are not blocking them from loading. For more information you can review our Terms of Service and Cookie Policy."
"DHS requests 1,000 more National Guard for Texas border",https://www.cnn.com,['Ryan Browne'],07-08-2019,2019,7,https://www.cnn.com/2019/07/08/politics/dhs-troops-texas-border/index.html,"(CNN) The Department of Homeland Security has asked the Pentagon to authorize 1,000 additional Texas National Guard troops ""to provide supplemental holding and port of entry enforcement support"" to Customs and Border Protection within the state, the Defense Department said Monday.

The Pentagon has not yet approved the request, which was made on Wednesday.

Texas Gov. Greg Abbott has consented to the use of the National Guard to support Customs and Border Protection, according to the Defense Department.

""Supplemental holding support is requested for CBP holding facilities located at Donna and Tornillo, Texas,"" Maj. Chris Mitchell, a Pentagon spokesman, told CNN, while adding that ""these holding facilities will be owned, operated, and managed by CBP.""

The holding facilities ""house single adult migrants who have illegally entered the United States, been processed by CBP, and are awaiting transfer to Immigration and Custom Enforcement (ICE) detention facilities,"" Mitchell said.

Read More"
DOJ files to halt Trump suit demanding financial documents,https://www.foxnews.com,[],,,,https://www.foxnews.com/politics/president-trump-financial-documents-department-of-justice,"The Justice Department on Monday challenged a federal judge's decision to allow a case accusing President Donald Trump of profiting off the presidency to move forward, asking an appeals court to take up the case instead.

Justice lawyers asked the U.S. Court of Appeals for the District of Columbia to overrule a federal judge and instead allow for a mid-case appeal or to dismiss the case outright, calling the case dealing with a Revolutionary War-era clause ""extraordinary.""

The government lawyers also want the court to suspend legal discovery recently approved by U.S. District Judge Emmet Sullivan, which would force Trump-related entities such as his New York and D.C. hotels, Trump Tower, the Trump Organization, and Mar-a-Lago Club to turn over business tax returns, receipts and other documents.

Justice lawyers said in the filings that answering their 37 subpoena requests in the interim, by July 29, would cause Trump ""irreparable injury"" and distract him from his official duties.

CUOMO SIGNS BILL ALLOWING CONGRESS TO GET TRUMP TAX RETURNS

This is the second time Justice lawyers have petitioned a higher court to take up a case dealing with the emoluments clause, which bans government officials from accepting foreign gifts and money without Congress' permission. Last December, the federal appeals court agreed to hear a similar case out of a Maryland federal court that had also reached such a point. In the meantime, a stay on proceedings was also allowed.

The lawsuit was brought by nearly 200 congressional Democrats led by Sen. Richard Blumenthal of Connecticut and Rep. Jerrold Nadler of New York, who is also chair of the House Judiciary Committee. It argues that Trump has been accepting gifts from foreign governments without congressional approval. Trump, unlike modern presidents before him, has declined to fully divest from his businesses.

""Our goal is simple and straightforward -- stopping President Trump from putting a `For Sale' sign in Russian on the door to the Oval Office,"" Blumenthal said in a statement Monday. ""Unsurprisingly, the Trump Administration is still seeking to delay, delay, delay, but we are confident that the D.C. Circuit will recognize the well-reasoned logic of the District Court, and allow discovery to proceed.""

The Trump Organization did not immediately return requests for comment.

RUSH LIMBAUGH: 'EUROPEAN ELITES' THREATENED BY 'MAKE AMERICA GREAT AGAIN'

The filing of a writ of mandamus is considered an ""extraordinary remedy,"" according to the Justice Department's website, which ""should only be used in exceptional circumstances of peculiar emergency or public importance.""

Among the judges who sit on the appeals court, includes chief judge is Merrick B. Garland, whose nomination by President Barack Obama to the Supreme Court was not allowed to be heard by Republicans.

The filing seeking for a writ of mandamus comes two weeks after Sullivan ruled against Justice Department lawyers who sought a mid-case appeal to a higher court and a stay on proceedings. For Justice to succeed at the appeals level, they must meet a demanding standard that would partly rest on showing Sullivan's decisions to be clearly wrong and that there's no adequate alternative for relief in the case.

They have argued that the court has ignored ""unique separation-of-powers concerns"" involved in having members of one branch of government conducting discovery against the president in his official capacity. The government also wrote in their filing that the legislature itself must bring such a case, ""not an amalgam of individual legislators or even a single chamber of a bicameral body.""

The case argues that the president has received foreign government favors, such as Chinese government trademarks for his companies, payments for hotel room stays and event-space rentals by representatives of Saudi Arabia and Kuwait, and proceeds from Chinese or Emirati-linked government purchases of office space in Trump Tower.



SEAN SPICER: 2020 ELECTION IS CHOICE BETWEEN TRUMP'S ECONOMIC PROSPERITY AND DEMS' LEFT TURN TOWARD SOCIALISM

Ethics experts say the constitutional emoluments clause was created by the Founding Fathers to ensure that government officials act with the interests of the American public in mind instead of their own pocketbooks.

Unlike prior presidents, Trump chose not to divest from his assets and he remains the owner of the Trump Organization, a sprawling business empire with 550 entities in more than 20 countries that include branded hotels, golf courses, licensing deals and other interests. His Washington, D.C., hotel is near the White House and has become a magnet for foreign governments, previously hosting groups tied to Kuwait, Bahrain, Turkey, Malaysia and Saudi Arabia.

The District of Columbia case is one of three that argues the president is violating the emoluments clause, but this case is notable because the plaintiffs in this suit -- members of Congress -- are mentioned in the clause itself. The Democrats' attorneys have argued that Congress not only has a right but is required, as part of their jobs, to weigh in on potential emoluments to Trump such as a $6.5 million condo purchase by the Qatari government or a Chinese-government owned company's investment in a project that will include a Trump-branded hotel and golf course in Indonesia.

Justice Department lawyers argued in court papers that the Democrats suing the president are not being injured by him at all but by their colleagues in Congress, who have refused to take up the emoluments issue. And the government has contended that Trump's business activity such as hotel room earnings don't qualify under the constitutional definition of emoluments.

Blumenthal said the subpoenas seeking information in the case are ""targeted"" to get information that ensures the president isn't avoiding his constitutional responsibility to ask Congress to approve any emoluments. The aim of the subpoenas is to trace ownership interests and money flowing to Trump from foreign governments and their representatives.

CLICK HERE TO GET THE FOX NEWS APP

The subpoenas were seeking the terms governing the Donald J. Trump Revocable Trust and related information, and aimed to determine trademarks granted to Trump or his companies by foreign governments since Jan. 20, 2017, and all pending applications for foreign trademarks.

The Justice Department asked the court in its filing Monday for a ruling regarding their request for a stay on the subpoenas by July 22 -- one week before the official response deadline -- ""in order to provide time to seek relief from the Supreme Court if necessary,"" an indication that the governments attorneys may be willing to elevate the case to the highest court if there is any indication they won't succeed at the appeals court."
Why the latest USDA report offers little good news for farmers,https://www.accuweather.com,[],,,,https://www.accuweather.com/en/weather-news/why-the-latest-usda-report-offers-little-good-news-for-farmers/70008768,"July 08, 2019 Why the latest USDA report offers little good news for farmers

By John Roach, AccuWeather staff writer July 08, 2019, 4:42:51 PM EDT



The latest Crop Progress from the U.S. Department of Agriculture (USDA) offered little comfort to U.S. farmers dealing with a difficult planting season. For the fourth straight week, the condition of corn and soybeans was rated below 60%.

The rain and flooding that has impacted Corn Belt farmers has affected the percentage of corn considered “good” or “excellent” in 18 key corn-producing states. That number this week is 57%; the first rating of the season was 59%, followed by consecutive weeks at 56%. The condition of corn rated “good” or “excellent” last year at this time was 75%.

The condition of soybeans in 18 soybean-producing states considered “good” or “excellent” is 53%, compared to 54% last week. That figure was at 71% this time last year.

The bad news continues for Illinois, which is joined by Iowa as the top corn-producing states, typically accounting for about one-third of the U.S. crop, according to the USDA. The condition of corn in Illinois rated ""good"" or ""excellent"" is just 37%, even lower than last week’s rating of 42%.

Other states with particularly poor corn condition data this week include Missouri (28%), Ohio (34%) and Indiana (38%). Those three states also had low percentages for the condition of soybeans, too: Ohio (28%), Missouri (35%) and Indiana (37%).

Next week’s numbers may not be much better.

RELATED

AccuWeather predicts the 2019 corn yield will be the lowest since 2012

A great unknown still remains for US farmers

‘Things are looking up’ weather-wise for the Corn Belt, but is it too late?

Dry weather to gradually expand across northeastern US early this week

“The weather overall for the heart of the Midwest for the next 10 days is slightly negative,” said AccuWeather senior meteorologist Jason Nicholls. “There’s not a whole lot of rain, but the temperatures will be favorable because it will be somewhat warmer than normal. It does look like they’ll get some helpful rains later next week.”

A new AccuWeather analysis predicts there will be 13.03 billion bushels of corn produced this year. That would be the lowest total since 2012 when 10.76 billion bushels of corn were harvested. In 2018, the total was 14.42 billion bushels.

The USDA’s 2019 corn production estimate as of June 28 is higher, at 13.88 billion bushels.

Report a Typo"
New Human Rights Panel Raises Fears of a Narrowing U.S. Advocacy,https://www.nytimes.com,"['Edward Wong', 'Eileen Sullivan']",07-08-2019,2019,7,https://www.nytimes.com/2019/07/08/us/politics/state-human-rights.html,"WASHINGTON — Secretary of State Mike Pompeo announced Monday that he was installing a human rights advisory panel in the State Department, and named a conservative law professor as its chairwoman, to review and tighten the agency’s definition of human rights and ensure it is grounded in the “nation’s founding principles” and a 1948 United Nations declaration.

The State Department already houses an internal bureau that oversees human rights issues. But the new panel, which Mr. Pompeo said would examine “the role of human rights in American foreign policy,” will not be managed by the bureau and was created without substantial input from its experts and officials.

“International institutions designed and built to protect human rights have drifted from their original mission,” Mr. Pompeo said. “As human rights claims have proliferated, some claims have come into tension with one another, provoking questions and clashes about which rights are entitled to gain respect.”

The announcement, along with a blunt commentary by Mr. Pompeo that was published in The Wall Street Journal on Sunday, raised worries among human rights advocates and Democratic lawmakers that Mr. Pompeo is moving to curtail State Department advocacy for some rights, particularly ones related to women’s health and reproduction and gay and transgender issues."
"Homeland Security requests 1,000 additional troops at border",https://nypost.com,['July'],07-08-2019,2019,7,https://nypost.com/2019/07/08/homeland-security-requests-1000-additional-troops-at-border/,"The Trump administration wants to send 1,000 more troops to the US-Mexico border “to provide supplemental holding and port of entry enforcement support” to Border Patrol agents, officials said Monday.

The Department of Homeland Security made the request last week and is waiting to get approval from the Pentagon, according to an agency spokesperson.

DHS officials are looking to send troops from the Texas National Guard.

“Governor Abbott has consented to the use of the National Guard to support CBP,” said the DoD spokesperson in a statement.

“Supplemental holding support is requested for CBP holding facilities located at Donna and Tornillo, Texas,” the statement added. “These holding facilities house single adult migrants who have illegally entered the United States, been processed by CBP, and are awaiting transfer to Immigration and Custom Enforcement (ICE) detention facilities. These holding facilities will be owned, operated, and managed by CBP.”

The additional 1,000 National Guard members would be a major boost to President Trump’s policing of the US southern border. There were already 6,000 troops in the region as of April — 2,100 of whom were members of the Guard, The Hill reports.

Trump has gotten criticized recently over the conditions at federal detention centers along the border, with Democratic lawmakers calling them terrible and “disgusting.”

The president has denied the accusations.

Vice President Mike Pence is planning to travel to the border town of McAllen, Texas, with a bipartisan delegation later this week."
