The EPA says a chemical in Monsanto's weed-killer doesn't cause cancer — but there's compelling evidence the agency is wrong,https://www.businessinsider.com,['Hilary Brueck'],06-01-2019,2019,6,https://www.businessinsider.com/glyphosate-cancer-dangers-roundup-epa-2019-5,"Gardeners Alva and Alberta Pilliod say they used Monsanto's Roundup spray to keep weeds off their driveway for more than two decades, applying the herbicide while wearing flip flops, shorts, and tank tops. Now, they both have Non-Hodgkin's Lymphoma (NHL). In a lawsuit, they were awarded $2.05 billion in damages in May.

School groundskeeper Dewayne Johnson, now in his 40s, also used to spray Roundup up to 30 times every summer. He has the same blood cancer as the Pilliods, and won nearly $80 million in a suit last year.

A third man, Edwin Hardeman, used Roundup for more than 25 years to keep weeds off his oak trees. He got NHL, too. A jury in California ruled in March that Roundup was a ""substantial factor"" in his diagnosis.

More than 13,000 similar lawsuits have popped up in the US. Almost all are being filed by gardeners, groundskeepers, and other professional weed-whackers who allege that their consistent, repeated use of Roundup gave them cancer. One of the latest allegations came this week from 44-year-old groundskeeper Jeffrey Sabraski. Sabraski alleges he sprayed Roundup several times per week, wearing nothing but shorts and t-shirts, and has also developed NHL. He's suing Monsanto, as the Minneapolis Star Tribune reported on Wednesday.

Roundup is the most widely-used herbicide in the world, and its key chemical is called glyphosate. The plaintiffs in this recent surge of court cases say that Monsanto didn't sufficiently warn them about the potential health risks associated with the product or tell them how to protect themselves from exposure.

But teasing out the health risks of glyphosate isn't easy. The World Health Organization's International Agency for Research on Cancer (IARC) says the chemical is ""probably"" carcinogenic to humans. But the US Environmental Protection Agency (EPA), and the agro-chemical giant Bayer, which now owns Monsanto, both say glyphosate isn't linked to cancer in any meaningful way.

""EPA continues to find that there are no risks to public health when glyphosate is used in accordance with its current label and that glyphosate is not a carcinogen,"" the agency said on its website. Canadian health authorities support the US' stance.

Read More: 33 of the most dangerous things science has strongly linked to cancer

However, peeling back the curtain on the scientific studies that have looked at glyphosate thus far can tell us a lot about how the chemical can indeed be dangerous when people and animals are exposed to it in the wrong ways.

Argentinian former farm worker Fabian Tomasi used to work supplying herbicides for plane-spraying and did not use protection. Pablo Aharonian/AFP/Getty Images

What Monsanto and the EPA say about glyphosate

Glyphosate, which has been in use around the world since the 1970s, blocks an enzyme pathway that helps plants grow. The herbicide's patent expired in 2000, and Indian and Chinese farmers are now the weed-killer's biggest buyers.

It's tricky for epidemiologists to say conclusively that something causes cancer, so what we know so far — from thousands of studies conducted in rats, mice, and humans — is that the pesticide might be linked with cancer, or it might not. Glyphosate might make cancer more likely to sprout up, since there's evidence it can encourage DNA damage. But more research is still needed to learn how, exactly, it affects the human body.

Monsanto maintains there's no good evidence the chemical causes cancer. The company often points to a 2017 study of more than 54,000 pesticide sprayers in Iowa and North Carolina (mostly farmers), which found no statistically significant association between glyphosate and cancer.

The company also often highlights the results of large-scale studies of French, Norwegian, and North American farmers that have found glyphosate to be safe.

But farmers are largely protected from the dangers of herbicides and pesticides, since they spray fields using industrial-grade farm equipment. In that same study, in fact, chemical sprayers who had the most exposure to glyphosate were found to have a slightly higher risk of developing acute myeloid leukemia than people who'd never used the weed-killer. The difference, however, was so small that more research is needed to confirm these results.

The EPA has also consistently said that consumers have nothing to worry about when it comes to glyphosate.

""In 2017, EPA published comprehensive ecological and human health risk assessments for glyphosate. No human health risks were identified,"" the agency said in April. However, the EPA cautioned that ""potential ecological risks were identified for terrestrial and aquatic plants, birds, and mammals, primarily from exposure to spray drift.""

Humans, of course, are terrestrial mammals, too. And gardeners who use lots of glyphosate — without much protection — would arguably also be exposed to spray drift.

""The evidence is not as strong so as to be absolutely sure"" Manolis Kogevinas, of the Barcelona Institute for Global Health, told Business Insider. ""But yeah, there's definitely a chance that they will develop cancer.""

The IARC has a different stance

In March 2015, the IARC convened a group of 17 experts from 11 countries to determine the potential human health dangers of glyphosate, along with four other pesticides and herbicides. The international, non-partisan committee concluded that glyphosate is ""probably"" carcinogenic to humans, based on studies in humans and lab animals.

That's why glyphosate is now a ""Group 2A"" carcinogen, according to IARC. That means that the chemical is considered to be a contributor to cancer, but not on the level of more well known cancer-causers like formaldehyde and UV radiation.

But the IARC also has a complicated history with glyphosate research. Reuters reported in 2017 that the agency had cut sections out of a draft report that suggested glyphosate might not contribute to cancer. In a follow-up letter to Congress, IARC director Christopher Wild wrote that the group revised that draft because some of the data came from ""a review article co-authored by a Monsanto scientist.""

He added that the information from that article ""was insufficient for independent evaluation of the individual studies and the conclusions reached by the Monsanto scientist.""

Why these groups came to different conclusions about glyphosate

A tightly reviewed and vetted paper published in the journal Environmental Sciences Europe earlier this year looked into why the EPA and IARC appear to disagree about the risks of glyphosate. It found that the EPA's conclusions relied mainly on ""unpublished regulatory studies,"" many of them industry-funded. The IARC, on the other hand, looked at ""mostly peer-reviewed studies.""

That could explain why 99% of the glyphosate studies that the EPA considered found that the chemical is not a cancer-causer, while 70% of the studies the WHO looked at suggested it probably is.

""It's kind of easy to understand why EPA would say, 'Well, geez, you know, it must be okay,'"" study author Charles Benbrook, an agricultural economist who now serves as an expert witness for plaintiffs involved in Roundup litigation, told Business Insider. ""It was okay because they were looking at a bunch of negative studies that Monsanto [did]. Monsanto repeated essentially the same study like 30 times.""

Benbrook alleges that the reason so many big payouts are being won in court is that Monsanto didn't properly warn people who used Roundup at home or on a small scale that they should wear protective clothing when they applied the weed-killer.

""It's not farmers out in the field with their large, modern spray rigs, where the operator is inside a steel and glass cab with a sophisticated air filtration system that essentially eliminates exposure,"" Benbrook said. ""Some people are spraying Roundup 6 or 8 hours a day for five days a week with this kind of handheld equipment.""

Monsanto maintains that as long as consumers follow the instructions on the label, glyphosate-based herbicides are perfectly safe. The company also points to hundreds of glyphosate studies in EPA databases that were not Monsanto-funded.

""At the end of the day, whether you're in the court of law, regulatory agencies, or court of public opinion, it's the science that should matter here,"" a Bayer spokesman said in an email to Business Insider. ""And the extensive body of science over 40 years, including several recent human epidemiology studies, shows that glyphosate-based herbicides are not associated with NHL. Customers who know these products best continue to rely on them.""

The company also points to the courtroom testimony of Robert Phalen, an environmental scientist who testified in the Pilliod's trial that human skin actually repels glyphosate. (Phalen once authored a textbook with another scientist also named Robert Phalen, who has said modern air may be ""a little too clean."")

Christine Sheppard in her backyard garden in Oceanside, California. Sheppard said she sprayed Roundup for years to control weeds on her coffee farm in Hawaii. In 2003, she was diagnosed with non-Hodgkin's lymphoma and given six months to live. Now 68, she is in remission but experiences severe pain in her hands and legs from her cancer treatment and has a weak immune system. AP Photo/Gregory Bull

Monsanto tweaked its Roundup formula in Europe

The US Food and Drug Administration (FDA) recommends that pets stay off lawns and plants that have just been sprayed with glyphosate, since animals can develop digestive or intestinal issues if they touch the substance when it hasn't dried. Glyphosate has also recently been linked to more severe cases of fatty liver disease in people.

But beyond glyphosate, there's another compound in Roundup: soap-like detergents called surfactants that help the chemical penetrate the leaves of plants to work its weed-killing magic. Benbrook believes Monsanto should be doing more to warn people about how surfactants work and how to protect themselves.

""It's the surfactants that are carrying the glyphosate first through the skin and inside the body, and then inside of cells where damage can be done to DNA,"" he said.

In Europe, Benbrook noted, surfactant chemicals have been made less toxic for consumers. In the US, however, there's been less regulatory pressure, so Monsanto has not changed Roundup formulas in the same way. ""When juries learn that Monsanto is making a product that's at least 10 times, maybe 100 times safer all across Europe?"" he said. ""That's not acceptable. That's one of the reasons that I think we can expect a continuation of these mammoth punitive damage awards that have occurred in the first three trials.""

Bayer said that allegation is one ""we don't believe is supported by the extensive body of science.""

The company told Business Insider in an email that ""regulators have specifically assessed the safety of the class of surfactants used in glyphosate-based herbicides; in 2009, the U.S. EPA concluded that these surfactants are not carcinogenic.""

The statement added that Monsanto tweaked the surfactants in products sold in Europe ""due to market preferences or country-specific requirements in the region.""

Argentine environmentalist Sofia Gatica tries to stop the spraying at a soybean field in Dique Chico, Argentina, on January 20, 2018. Diego Lima/AFP/Getty Images

Traces of glyphosate in food don't seem to hurt people

As lawsuits about glyphosate have entered the spotlight, some people have expressed concerns about the trace amounts of the chemical in our food.

The traces of glyphosate found in a bowl of Cheerios or a glass of wine are probably not going to kill anyone, though.

""Using the internationally accepted limits, an average adult male would have to drink over 1,000 liters of wine a day to reach any level of risk,"" pharmacologist Ian Musgrave recently wrote in The Conversation.

That said, it's worth remembering that different people's bodies can react differently to chemicals. The foods pregnant women eat impact how their fetus grows and develops, for example, and the developing digestive systems of infants and toddlers may be more delicate than others. Scientists are still studying how pesticides can impact childhood brain development.

Kogevinas still doesn't think the chemical's presence in food is much to worry about, though.

""If you ask me, is the glyphosate the problem in my food? No, it is not,"" he said. But he noted that he prefers to buy organic produce to avoid pesticides more generally.

Kogevinas lives in Barcelona, where the Roundup formulations adhere to the European standards, but that didn't affect his decision about whether or not to buy it: He has opted never to use glyphosate in his own garden."
Everything you need to know about Trump's state visit as the US president meets the queen,https://www.cnbc.com,['Sam Meredith'],06-03-2019,2019,6,https://www.cnbc.com/2019/06/03/trump-visit-all-you-need-to-know-as-the-us-president-lands-in-london.html,"President Donald Trump's first official state visit to the U.K. will be dominated by a series of official engagements with the British royal family and Prime Minister Theresa May.

Traveling with the first lady, Melania, and his four adult children, the U.S. president will also attend ceremonies in Portsmouth and Normandy marking the 75th anniversary of the World War II allies' D-Day invasion.

Just like his previous trip to the U.K. last year, Trump has again tested the resolve of May by telling a newspaper that Conservative lawmaker Boris Johnson would be an ""excellent"" prime minister.

May, who announced her resignation last month after repeatedly failing to win support for a deal under which Britain would leave the European Union, is set to leave office on June 7.

Here's a look at what Trump is scheduled to get up to over the next three days:"
Acting DHS secretary can’t explain how Trump’s tariffs on Mexico work,https://thinkprogress.org,[],,,,https://thinkprogress.org/mcaleenan-trump-mexico-tariffs-c674b6c2d6b6/,"In an interview with CNN’s Jake Tapper Sunday morning, Acting Homeland Security Secretary Kevin McAleenan wasn’t able to articulate how or when the White House will end its tariffs on Mexican goods.

McAleenan appeared on cable news to defend President Donald Trump’s decision to impose new tariffs on Mexico as a means to address migration to the United States. The longer apprehension rates along the U.S.-Mexico border continue to rise, the higher the tariffs.

As the White House announced last week, a 5% tariff is set to go into effect on June 10 if Mexico does not step up immigration enforcement measures. The tariffs would gradually increase — an additional 5% on the first day of each month for four months — to a maximum of 25% by October, unless “the illegal immigration problem is remedied.”

Tapper asked McAleenan at what point would the administration consider lifting the tariffs, but McAleenan had no concrete response.

Advertisement

“I guess one of the questions I would have is assuming these tariffs go through, and right now it’s just a threat, what specific benchmark are you going to be looking at to see if Mexico is actually doing what you want them to do?” Tapper asked.

“I think what the president said, we need a vast reduction in the numbers crossing,” McAleenan replied.

According to the Department of Homeland Security (DHS), there were roughly 100,000 apprehensions in April — so what would a “vast reduction” look like to the administration? McAleenan couldn’t answer that either.

Instead, McAleenan recommended the administration ask the Mexican government to enforce its own southern border with Guatemala, put an end to the organizations that help transport migrants across Mexico, and work with the United States on creating new asylum policies.

Advertisement

As ThinkProgress has previously reported, however, the Mexican government is already collaborating with the Trump administration on the immigration front, whether by arresting Central American migrants at the southern Mexico border or ordering bus operators to stop transporting migrants across the country.

Considering that the U.S. is one of Mexico’s biggest trade partners and even the preliminary 5% tariff could have devastating effects on the Mexican economy, this question is critical. U.S. imports of goods from Mexico totaled about $346.5 billion in 2018, according to the Office of the U.S. Trade Representative. Mexico, meanwhile, sends nearly 80% of its exports to the United States. Should tariffs reach the full 25% that Trump has threatened, American exporters of goods to Mexico would also be impacted, likely shoulder the cost of this new policy.

McAleenan also had no answers for how the U.S. would respond if Mexico’s economy took a downturn, causing more people to migrate.

“Bottom line for me is we need [Mexico] at the table looking at new strategies that we can aggressively move out on,” he said."
State Dept. panel to redefine human rights based on 'natural law and natural rights',https://abcnews.go.com,['Abc News'],,,,https://abcnews.go.com/Politics/state-dept-panel-redefine-human-rights-based-natural/story?id=63400485,"Secretary of State Mike Pompeo is setting up a commission at the State Department to redefine human rights as based on what the department is describing as ""natural law and natural rights.""

Interested in LGBT? Add LGBT as an interest to stay up to date on the latest LGBT news, video, and analysis from ABC News. Add Interest

The move has alarmed human rights activists, especially those focused on LGBT rights and women's rights, who fear it will mean an end to promoting protections for both groups around the world.

""It's an important review of how we think about human rights inside of our efforts in diplomacy,"" Pompeo told reporters Thursday, adding the effort is focused on ""how do we make sure that we have a solid definition of human rights upon which to tell all our diplomats around the world how to engage on those important issues.""

The State Department has declined to comment beyond Pompeo's remarks. But it did issue a public notice in the Federal Register on Thursday that says the body, named the Commission on Unalienable Rights, will provide Pompeo ""advice and recommendations concerning international human rights matters"" and meet about once a month.

Bloomberg via Getty Images, FILE

""The Commission will provide fresh thinking about human rights discourse where such discourse has departed from our nation's founding principles of natural law and natural rights,"" according to the notice.

Use of the term ""natural law"" has concerned some advocacy groups and department staff, as it is interpreted in this case as ""God-given"" or religiously-based rights that affect issues like sexuality, abortion rights, and more. In particular, the phrase has been prominent in the work of Princeton professor Robert George.

George has played a prominent role in the creation of the commission, according to a source familiar with the plans for the commission. George, co-founder of the National Organization for Marriage, a nonprofit that advocates against same-sex marriage, is among the 15 academics recommended to make up the panel, according to the source.

Author of the 1999 book ""In Defense of Natural Law,"" where he argued against homosexuality and abortion rights and in favor of religious liberty, George also wrote the original concept note that outlined a vision for the commission, the source said.

The commission ""is absolutely about those issues, but it's not explicit in the paper,"" the source said. ""It questions whether and which human rights are universal.""

George did not respond to a request for comment.

Dr. Kiron Skinner, Pompeo's director of policy planning, is listed as the top official on the Federal Register notice. Skinner, who leads the department's long-term foreign policy strategy team, recently raised eyebrows by describing the U.S. rivalry with China as a clash of civilizations and ""the first time that we will have a great power competitor that is not Caucasian.""

Mark Wilson/Getty Images, FILE

Along with George and Skinner, the full list of participants has been recommended to the Secretary, but he still has to approve the final list. As part of the process, however, the department had to publish the Federal Register notice, which is dated May 22.

Igniting further concern about the project is the fact that the department's Bureau of Democracy, Human Rights, and Labor was not consulted in the process, two sources told ABC News.

""The wording of the Commission's mandate raised eyebrows with human rights advocates and congressional staff. The fact that it was announced with no prior outreach to or input from the human rights community immediately raised concerns over its motives... [and] the State Department already has a well-defined understanding of how to advance human rights and maintains several offices dedicated to various human rights issues,"" said Rob Berschinski, who served as deputy assistant secretary of State for Democracy, Human Rights, and Labor, or DRL, in the Obama administration.

Pompeo said Thursday the project is ""separate"" from DRL, but ""deeply connected to the work that not only DRL does, but that the entire State Department does around the world.""

Promoting the right to religious freedom has been a high priority for Pompeo, who will host his second summit on the topic this July. But he and the Trump administration, in general, have been criticized for pulling punches on U.S. partners over their human rights abuses. Saudi Arabia and Egypt, for example, have been embraced by the top Trump officials despite their crackdowns on political opposition, women's rights activists, and NGOs.

""If the administration truly wants to engage in a meaningful dialogue about respecting human rights, then we are happy to have that discussion. But the fact that this panel was announced without details or consultation with human rights experts suggests that this may be just another instrument to negate rights, rather than protect them,"" said Tarah Demant, director of Amnesty International's Gender, Sexuality, and Identity program."
DOJ reportedly exploring antitrust probe of Google,https://www.foxbusiness.com,['Megan Henney'],,,,https://www.foxbusiness.com/technology/doj-reportedly-exploring-antitrust-probe-of-google,"The U.S. Department of Justice is gearing up to investigate antitrust violations by Alphabet Inc.’s subsidiary Google, focusing largely on the company’s search practices, according to a Friday report from The Wall Street Journal.

Continue Reading Below

The report comes amid renewed public scrutiny on the influence that big tech wields, as well as calls by 2020 presidential candidate Sen. Elizabeth Warren to break up some of the country’s biggest technology companies, including Amazon, Google and Facebook, which she referred to as “monopolies.”

If the DOJ proceeds with the investigation, it will mark the first major antitrust case against a big tech company since President Trump took office.

It’s unclear whether the DOJ has contacted Google. A spokesperson for the DOJ declined to comment. The FTC and Google did not immediately respond to FOX Business’ request for comment.

Google has faced questions about potential antitrust violations in the past.

Advertisement

The Federal Trade Commission, which shares antitrust authority with the DOJ, previously conducted a broad investigation of Google, looking into its advertising practices and influence in the online ad industry, but closed it in 2013 when the company agreed to voluntarily change some of its business practices, including agreeing to give online advertisers more flexibility to manage ad campaigns on Google, as well as its rival ad platforms.

In March, European Union regulators fined Google $1.7 billion for abusing its market dominance by preventing its rivals from placing online search advertisers,; in total, the EU has fined Google about $10 billion.

In a statement, the EU’s top antitrust watchdog, Margrethe Vestager, said Google cemented itself as a powerhouse in the online search industry -- then proceeded to shield itself from competition by imposing restrictive contracts with third-party websites that blocked other companies from placing their search adverts on those websites between 2006 and 2016.

“This is illegal under EU antitrust rules,” she said at the time.

CLICK HERE TO GET THE FOX BUSINESS APP

The commission found that Google and its parent company Alphabet Inc. blocked competition by inserting exclusivity clauses into its contracts with third-party websites beginning in 2006, prohibiting publishers from placing any search adverts from competitors on their search results pages.

As of 2009, Google began to replace those clauses with a so-called premium placement clause, requiring websites to save the most visible and clicked on parts of the websites’ search results pages for Google"
