Correspondence shows how climate change deniers got into EPA fuel economy rollback fight,https://electrek.co,"['Renogy Watts Volts Monocrystalline Solar Starter Kit', 'Chargepoint Home Wifi Enabled Electric Vehicle', 'Ev']",07-03-2019,2019,7,https://electrek.co/2019/07/03/climate-change-deniers-epa/,"In the ongoing saga of the Trump administration’s efforts to roll back fuel economy standards, it’s been known that automakers sought to ease the rising MPG requirements set by the Obama administration. But a new report reveals how a number of climate change deniers injected themselves into the conversation, pushing the administration to go “much further” than planned.

Recently released government emails show how these deniers even went so far as to call automakers “the opposition,” according to a new report from the New York Times.

Myron Ebell of the Competitive Enterprise Institute — described by the Times as “a free-market think tank in Washington that disputes that climate change is a problem” — did just that in a May 2018 email to an EPA official, among others.

Ebell, who leads the climate change-denying “Cooler Heads Coalition,” wrote that the administration should stick to the rollback. He was also, unsurprisingly, selected to lead the Trump administration’s EPA transition team in 2016.

As the administration finalizes its plan to roll back fuel economy standards, the automakers are concerned about a “split market” between California and states which plan to follow higher standards, and the other states. Last month, 17 automakers wrote a letter asking to stop the planned rollback.

Prior to that, in a letter sent to Trump this May, Ebell and his group wrote about the automakers’ pushback. From the Times:

“Their main concern is the expected legal battle with California,” they wrote. “In fact, what many liberal California politicians really want to do is ban gasoline-powered cars altogether.” Their letter went on to say: “You should dismiss this concern. We agree that in an ideal world, California would negotiate with you in good faith, but we all know that is not a reality in this current political climate.”

The administration still hasn’t shown any signs of pulling back.

As National Highway Traffic Safety Administration deputy administrator Heidi King simply told the Times, “In my experience, these rules tend to go to the courts regardless.” The NHTSA is making the new rules in conjunction with the EPA.

The Times also notes how another conservative group, American Commitment, generated “almost 1,600 public comments in support of the rollback, or 13 percent of the 12,000 comments received and posted by the National Highway Traffic Safety Administration.”

Many of these particular comments came with the same boilerplate language accusing Obama and California as wanting to ban the internal combustion engine, and so forth.

Even the oil companies seem to want no part of these efforts. BP sent a letter to EPA administrator Andrew Wheeler in June that found the oil giant siding with the automakers, asking the administration to focus on improving fuel economy, the Times said.

Electrek’s Take

As unsurprising as any of this might be to anyone who’s been following what’s going on with the fuel economy rollback — or with the current EPA and administration in general — it’s still gross beyond belief. A group of people that has absolutely no business even being involved in these decisions instead has an incredible amount of influence.

We’ve reached a point where even BP — BP! — is pushing back against the administration’s efforts.

Automakers are still not without blame in their role here. Not by a long shot, not at all. They’re the ones who opened this Pandora’s box and pushed the EPA to reduce emissions standards the first chance they got.

But now, at this point in time, it seems clear that if it were just a discussion between automakers that have realized the error of their ways and an administration that actually cared about listening to their concerns about what might happen to the market… or an EPA that cared about reducing emissions… or improving the environment… things could be at least a little different. There could be some sort of “compromise,” at a minimum.

But it’s not.

If you’re looking for a glimmer of hope on this, look to King’s quote about how “these rules tend to go to the courts regardless.” California and 17 other states already filed suit against the EPA last year for its proposed rollback. Upon finalization of the plan, legal challenges against the rollback only seem set to increase.

States will be leading the way in that regard, but after all this, wouldn’t it be something if the automakers stepped up with a legal pushback of their own? If the rules are indeed finalized as expected, we’re curious to see what the next move will be from the industry as they face the dreaded “split market.” After all, there’s nothing stopping them from wanting to meet the Obama-era standards on their own.

Subscribe to Electrek on YouTube for exclusive videos and subscribe to the podcast."
"To Improve Care, Veterans Affairs Asks Patients Their Life Stories",https://www.wsj.com,"['Ben Kesling', 'Ben.Kesling Wsj.Com']",,,,https://www.wsj.com/articles/to-improve-care-veterans-affairs-asks-patients-their-life-stories-11562146202,"MADISON, Wis.—Thor Ringler’s bouncing step, red-framed eyeglasses and flowered-print shirts brighten the colorless hallway at the Madison VA Medical Center where he works. When he bursts into patients’ rooms, he makes sure they feel like individuals in a system that can too often feel impersonal.

Mr. Ringler is at the forefront of the Department of Veterans Affairs’ effort to use what is known as “narrative medicine”—in which a patient is asked to tell their life story, and that story is included in their medical record. The..."
Acting DHS chief orders immediate investigation into offensive posts,https://www.cnn.com,['Priscilla Alvarez'],07-03-2019,2019,7,https://www.cnn.com/2019/07/03/politics/acting-dhs-secretary-orders-investigation/index.html,"(CNN) Acting Department of Homeland Secretary Kevin McAleenan has ordered an immediate investigation into offensive posts ""that allegedly includes active Border Patrol personnel,"" he said in a series of tweets Wednesday.

""I have directed an immediate investigation, and as the @USBPChief has made clear, any employee found to have compromised the public's trust in our law enforcement mission will be held accountable,"" McAleenan said. ""They do not represent the men and women of the Border Patrol or @DHSgov.""

Earlier this week, a report revealed a closed Facebook group for current and former Border Patrol agents that reportedly features jokes about migrant deaths, derogatory comments about Latina lawmakers and a lewd meme involving at least one of them.

In an interview with CNN, a Border Patrol agent, who said he's had enough and agreed to go on camera only if his identity was obscured, said being derogatory is part of the CBP culture.

""He was making fun of them,"" said the agent, referring to a supervisor joking about dead migrants.

Read More"
U.S. DHS boss orders probe into border agents' 'disturbing' Facebook posts,https://www.reuters.com,"['Reuters Editorial', 'Min Read']",07-04-2019,2019,7,https://www.reuters.com/article/us-usa-immigration-investigation/us-dhs-boss-orders-probe-into-border-agents-disturbing-facebook-posts-idUSKCN1TY1TP,"(Reuters) - The U.S. Department of Homeland Security’s acting secretary, Kevin McAleenan, has ordered an investigation into reports that border patrol agents have been posting offensive anti-immigrant comments and threats against lawmakers in a secret Facebook group.

“Reporting this week highlighted disturbing & inexcusable social media activity that allegedly includes active Border Patrol personnel,” he wrote on Twitter on Wednesday, calling the reported comments “completely unacceptable.”

He said any employee found to have “compromised the public’s trust in our law enforcement mission will be held accountable.”

(The story corrects day of the week in 2nd paragraph to Wednesday from Monday )"
"Is that unexpected US Treasury check a surprise tax refund, or something to worry about?",http://komonews.com,"['Connie Thompson', 'Komo News']",,,,http://komonews.com/news/consumer/is-that-unexpected-us-treasury-check-a-surprise-tax-refund-or-something-to-worry-about,
DHS report details ‘dangerous overcrowding’ in border facilities,https://nypost.com,['July'],07-02-2019,2019,7,https://nypost.com/2019/07/02/dhs-report-details-dangerous-overcrowding-in-border-facilities/,"Children and adult migrants detained at the US-Mexico border are subjected to “dangerous overcrowding” conditions that represent “an immediate risk to the health and safety” of border agents and those detained, according to a scathing new report released Tuesday by an independent government watchdog.

The Department of Homeland Security Office of Inspector General called on the Trump administration to take immediate steps to alleviate conditions in the Rio Grande Valley Border Patrol facilities.

Even managers of the detention facilities along the border raised security concerns over the conditions, with one senior manager calling the escalating tensions between migrants and border guards “a ticking time bomb.”

The OIG found children at three of the five border patrol facilities had no access to showers and limited access to fresh clothes. While infant formula, diapers, juice and snacks were available, children didn’t have hot meals at two of the facilities until inspectors arrived.

The new report contains photos taken during a June Inspector General visit depicting migrants crammed behind chained fences.

Some single adults at one facility were “held in standing room only conditions for a week and at another, some single adults were held more than a month in overcrowded cells,” the report found.

The conditions led to “security incidents among adult males at multiple facilities,” the DHS OIG reports. Some detainees (were) “clogging toilets with Mylar blankets and socks in order to be released from their cells during maintenance.”

One of the walk-throughs had to be cut short because “when detainees observed us, they banged on the cell windows, shouted pressed notes to the window with their time in custody, and gestured to evidence of their time in custody,” the report said, referring to male detainees pointing to their shaggy beards.

Food was a problem for adults, too. Border agents are required to respect detainees’ “religious and other dietary restrictions.” However, “many single adults had been receiving only bologna sandwiches,” which meant some “were becoming constipated and required medical attention.”

The damning report comes a day after Rep. Alexandria Ocasio-Cortez (D-Bronx/Queens) and other lawmakers visited two stations in the El Paso sector to sound the alarm about terrible conditions there.

The DHS said the current situation at the southern border represents “an acute and worsening crisis” due to the surge of undocumented immigrants trying to cross the border.

DHS said its agents were doing their best to address the problems, but they need “congressional action” to close the “legal and judicial loopholes” that have incentivized migrants from Central America to make the dangerous trek to the southern border.

Congress last week passed legislation to allocate $4.6 billion for humanitarian aid for migrant families following public outcry over a photo of a migrant father and his daughter who drowned trying to cross the Rio Grande.

The congressional action did not address any changes to asylum and detention rules that the Trump administration wants to make it harder for Central American immigrants to enter the US."
Strzok-Page texts debated whether to share details with DOJ on key London meeting in 2016,https://www.foxnews.com,"['Catherine Herridge', 'Catherine Herridge Is An Award-Winning Chief Intelligence Correspondent For Fox News Channel', 'Fnc', 'Based In Washington', 'D.C. She Covers Intelligence', 'The Justice Department', 'The Department Of Homeland Security. Herridge Joined Fnc In As A London-Based Correspondent.']",,,,https://www.foxnews.com/politics/strzok-page-texts-london-meeting-justice-department,"Text messages between former FBI officials Peter Strzok and Lisa Page debating how much information to share with the Justice Department about a London meeting -- days after the bureau opened its initial Russia investigation -- are drawing fresh scrutiny as alleged surveillance abuse and the probe’s origins are investigated by three separate probes, Fox News has learned.

On Aug. 3, 2016, Strzok wrote, ""I think we need to consider the lines of what we disclose to DOJ. For example, the last stipulation notes we will not disclose [the] identifies outside the FBI. I think you might argue the unauthorized disclosure might (reasonably) be expected to cause exceptionally grave damage to US national security...""

In an earlier discussion on Aug. 2, 2016, Strzok reported he had a “good meeting.” Page warned, ""Make sure you can lawfully protect what you sign. Just thinking about congress, foia (Freedom of Information Act), etc. I'm sure it's fine. I just don't know how protection of intel-type stuff works in that context.""

Fox News has learned some of the words and names that were redacted in the string of Strzok-Page messages; they are included below.

[NOTE: 'OUTBOX' messages are from Page, 'INBOX' messages from Strzok]

The New York Times was first to report lengthy details about the 2016 meeting in question, when the FBI ""dispatched a pair of agents to London on a mission so secretive that all but a handful of officials were kept in the dark."" The report said this assignment included questioning Australian Ambassador Alexander Downer. Downer's information about then-Trump campaign aide George Papadopoulos helped lay the foundation for the FBI’s counterintelligence probe – which later grew into former Special Counsel Robert Mueller’s investigation.

House Republicans, continuing to probe the texts, have considered August 2016 a pivotal month. They have been looking closely at these exchanges, and how long before the August meeting Downer reported the Papadopoulos information.

Inspector General Michael E. Horowitz, meanwhile, has been conducting a separate investigation into alleged surveillance abuse during the 2016 campaign, with that case in its final phases. And, this past May, Attorney General William Barr asked U.S. Attorney John Durham to probe the origins of the FBI counterintelligence case which was opened in late July 2016 by then-agent Strzok.

JOE DIGENOVA: 5 QUESTIONS THE DEMOCRATS WON'T ASK MUELLER

Fox News also has learned what's behind some of the redactions for the texts during that period, revealing new details of the Strzok meeting which took place at the U.S. embassy in London inside a secure facility known as SCIF.

In the texts, Strzok said the meeting did not include the No. 2 State Department official in London known as the deputy chief of mission.

""Was DCM (deputy chief of mission) present for the interview?"" Page asked.

""No, two of them, two of us."" Strzok responded.

Other texts indicated then-Deputy Director Andrew McCabe was trying to reach someone named “Jeremy” and make multiple references to “Ben,” though it’s not clear if they worked within or outside the FBI.

Strzok and Page then discussed how widely the information needed to be shared within the bureau, including Strzok’s immediate supervisor Bill Priestap.

Page wrote on Aug. 3, 2016, ""New case. Information flow. Control."" The section that followed was heavily redacted, but Strzok responded, “...plan on telling Bill I'm obviously going to tell him anything he wants to know, but recommend we not tell him or [higher] … specific data so that he and higher can tell DOJ, even we don't know the admin details.""

Horowitz also has been investigating leaks from senior FBI officials as part of his probes. The expectation is that report will come after the surveillance abuse investigation.

CLICK HERE TO GET THE FOX NEWS APP

In an apparent reference to bureau leaks, Strzok wrote, ""this is MUCH more tasty for one of those (redacted) aholes to leak. For the first time in a while I'm not worried about our side.""

A spokesman for the inspector general declined to comment on the status of the office's work."
Democrats running out of options to stop Trump from moving two USDA offices,https://www.washingtonpost.com,"['Jenna Portnoy', 'Reporter Covering Virginia', 'Maryland', 'D.C. Congressional Delegations']",07-01-2019,2019,7,https://www.washingtonpost.com/local/dc-politics/democrats-running-out-of-options-to-stop-trump-from-moving-two-usda-offices/2019/07/01/5260a12c-9829-11e9-8d0a-5edd7e2025b1_story.html,"Agriculture Secretary Sonny Perdue speaks to members of the news media June 3, on the Mall. (Erik S Lesser/EPA-EFE/Shutterstock)

Members of Congress representing many of the D.C.-based federal workers whose jobs are about to be reassigned or moved to the Midwest are running out of ways to try to stop the Trump administration from relocating those offices.

Democratic lawmakers have written a flurry of letters, bills and amendments in a race to block the measures before the end of the fiscal year on Sept. 30, with little success.

Agriculture Secretary Sonny Perdue last month finalized plans to move about 550 jobs at two scientific agencies in the Agriculture Department from Southwest Washington to the greater Kansas City region.

In a separate move, the administration has threatened to furlough and possibly lay off 150 workers at the Office of Personnel Management, the federal workforce’s human resources agency, if Congress blocks the administration’s plans to eliminate the department.

Proponents of the changes say they want to streamline operations, save taxpayer money, spread the economic effects of federal jobs beyond the nation’s capital and bring workers closer to the people they serve.

Opponents of the USDA’s move, including Democratic lawmakers and unions representing federal workers, say the agencies will hemorrhage talent because many scientists and researchers would rather quit than move their families 1,000 miles from the District.

[Perspective: Stark choice for USDA employees: Move to Kansas City or lose your job]

Capital region lawmakers say both of the administration’s proposals are part of a long-standing Republican campaign, bolstered by President Trump, to paint federal workers as unnecessary bureaucrats.

“In the White House, there is, among some people, a real disrespect for federal employees, animated by their disrespect for the government generally,” House Majority Leader Steny H. Hoyer (D-Md.), whose district includes part of Prince George’s County, said in a brief interview. “So if you’re hostile to government, you’re then . . . hostile to those who work in government.”

Rep. Gerald E. Connolly (D-Va.), who represents most of Fairfax and Prince William counties, said an “unrelenting assault” on benefits, compensation, hiring, workers’ rights, workplace conditions and appellate rights started when Republicans took control of Congress in 2011.

“The Republicans, and especially the Trump administration, view the entire federal enterprise, federal workers, as part of the swamp, and anything they can do to diminish it, demean it, from their point of view is a good thing,” Connolly said.

He pointed to a March 2017 resolution spearheaded by Republican Jason Chaffetz of Utah, then the chairman of the House Oversight Committee, that would have deemed it unnecessary for federal agencies to be located in the District. The measure, called Divest D.C., advanced to the full House but never got a floor vote.

Current efforts appear to be moving ahead unabated, raising concerns among federal workers that the administration could try to replicate the plans across government.

“It seems like if they are successful here, this could just be the tip of the iceberg,” said Sandra Salstrom, a lobbyist for the American Federation of Government Employees, a union for federal workers. “We don’t know who’s next.”

Connolly is chairman of the House Oversight Committee’s panel on government operations, which in May held a three-hour hearing titled “The Administration’s War on a Merit Based Civil Service.”

The hearing focused on the administration’s plans to move most Office of Personnel Management functions into the General Services Administration, the government’s real estate and procurement arm. The plan also would shift leadership to the executive branch, raising worries that the agency could become politicized.

The OPM-GSA merger was the subject of a rally last week organized by federal worker unions across from the current OPM headquarters.

In addition to Connolly and Hoyer, Rep. Don Beyer (D-Va.) and Del. Eleanor Holmes Norton (D-D.C.), the District’s nonvoting delegate, took turns at the microphone in the shadow of a statue of Argentine independence hero José de San Martín.

Plans to move the USDA agencies — the Economic Research Service, a statistical agency, and the National Institute of Food and Agriculture, which funds cutting-edge agricultural science — to Kansas City intensified Democrats’ frustration.

Sen. Chris Van Hollen (D-Md.) of Montgomery County has tried to stop the USDA move through a bill and an amendment, and he sits on a committee that could block the leases on new office space if the contracts exceed a certain threshold.

He suggested the move was part of an ongoing effort by the administration to suppress scientific data on climate change.

“I will use every tool I have on both the Appropriations Committee and the Environment and Public Works Committee to block this move,” he said in a statement.

The USDA Office of Inspector General began a review of the relocation in November at the request of Norton and Hoyer. The report is under review by the agency before its release to Congress and the public.

Kevin Hunt, a geographer and head of his union bargaining unit at the Economic Research Service, is a Missouri native but does not plan to move.

He said he is sad to leave what he considers a “dream job” that allows him to do research and publish in scientific journals, pays well and has promotion potential. His partner has a good job elsewhere, making it difficult to move.

Hunt said he believes the agency belongs in the District, where collaboration with other agencies is seamless.

“It’s not about Kansas City,” he said in a phone interview. “It’s about moving people who are established here and who are at the top of their game.”

Lawmakers have inserted language into multiple appropriations bills to block the administration from spending money to move workers in the fiscal year starting Oct. 1.

However, the changes are on track to begin before the end of the current fiscal year on Sept. 30, which prompted Norton to suggest litigation as a next step. The basis for a legal challenge is unclear.

“I’ve got to be absolutely candid with you,” she told workers at the rally. “I am going to ask you to go into court. . . . I’m standing here this afternoon to say, ‘If we don’t beat them, I am sure that you will beat them. Keep fighting. We are there with you!’”

She added in an interview: “I think we have done everything we can do. We’re racing against the clock.”

Asked about litigation, an AFGE spokesman said they are pursuing collective bargaining to block or delay the moves.

Ben Guarino and Lisa Rein contributed to this report.

Read more:

Perspective: Stark choice for USDA employees: Move to Kansas City or lose your job

Local newsletters: Local headlines (8 a.m.) | Afternoon Buzz (4 p.m.)

Like PostLocal on Facebook | Follow @postlocal on Twitter | Latest local news"
