Department of Energy awards Fermilab $3.5 million for quantum science,https://news.fnal.gov,[],,,,https://news.fnal.gov/2019/08/department-of-energy-awards-fermilab-3-5-million-for-quantum-science/,"The U.S. Department of Energy has awarded researchers at its Fermi National Accelerator Laboratory more than $3.5 million to boost research in the fast-emerging field of Quantum Information Science.

“Few pursuits have the revolutionary potential that quantum science presents,” said Fermilab Chief Research Officer Joe Lykken. “Fermilab’s expertise in quantum physics and cryogenic engineering is world-class, and combined with our experience in conventional computing and networks, we can advance quantum science in directions that not many other places can.”

As part of a number of grants to national laboratories and universities offered through its Quantum Information Science-Enabled Discovery (QuantISED) program, DOE’s recent round of funding to Fermilab covers three initiatives related to quantum science. It also funds Fermilab’s participation in a fourth initiative led by Argonne National Laboratory.

For a half-century, Fermilab researchers have closely studied the quantum realm and provided the computational and engineering capabilties needed to zoom in on nature at its most fundamental level. The projects announced by the Department of Energy will build on those capabilities, pushing quantum science and technology forward and leading to new discoveries that will enhance our picture of the universe at its smallest scale.

“Fermilab is well-versed in engineering, algorithmic development and recruiting massive computational resources to explore quantum-scale phenomena,” said Fermilab Head of Quantum Science Panagiotis Spentzouris. “Now we’re wrangling those competencies and capabilities to advance quantum science in many areas, and in a way that only a leading physics laboratory could.”

The Fermilab-led initiatives funded through these DOE QuantISED grants are:

Large Scale Simulations of Quantum Systems on High-Performance Computing with Analytics for High-Energy Physics Algorithms

Lead principal investigator: Adam Lyon, Fermilab

The large-scale simulation of quantum computers has plenty in common with simulations in high-energy physics: Both must sweep over a large number of variables. Both organize their inputs and outputs similarly. And in both cases, the simulation has to be analyzed and consolidated into results. Fermilab scientists, in collaboration with scientists at Argonne National Laboratory, will use tools from high-energy physics to produce and analyze simulations using high-performance computers at the Argonne Leadership Computing Facility. Specifically, they will simulate the operation of a qubit device that uses superconducting cavities (which are also used as components in particle accelerators) to maintain quantum information over a relatively long time. Their results will determine the device’s impact on high-energy physics algorithms using an Argonne-developed quantum simulator.

Partner institution: Argonne National Laboratory

Research Technology for Quantum Information Systems

Lead principal investigator: Gustavo Cancelo, Fermilab

One of the main challenges in quantum information science is designing an architecture that solves problems of massive interconnection, massive data processing and heat load. The electronics must be able to operate and interface with other electronics operating both at 4 kelvins and at near absolute zero. Fermilab scientists and engineers are designing novel electronic circuits as well as massive control and readout electronics to be compatible with quantum devices, such as sensors and quantum qubits. These circuits will enable many applications in the quantum information science field.

Partner institutions: Argonne National Laboratory, Massachusetts Institute of Technology, University of Chicago

MAGIS-100 – co-led by Stanford University and Fermilab

Lead Fermilab principal investigator: Rob Plunkett

Fermilab will host a new experiment to test quantum mechanics on macroscopic scales of space and time. Scientists on the MAGIS-100 experiment will drop clouds of ultracold atoms down a 100-meter-long vacuum pipe on the Fermilab site, and use a stable laser to create an atom interferometer which will look for dark matter made of ultralightweight particles. They will also advance a technique for gravitational-wave detection at relatively low frequencies.

This is a joint venture under the collaboration leadership of Stanford University Professor Jason Hogan, who is funded by grant GBMF7945 from the Gordon and Betty Moore Foundation. Rob Plunkett of Fermilab serves as the project manager.

Other participating institutions: Northern Illinois University, Northwestern University, Stanford University, Johns Hopkins University, University of Liverpool

Fermilab was also funded to participate in another initiative led by Argonne National Laboratory:

Quantum Sensors for Wide Band Axion Dark Matter Detection

Lead principal investigator: Peter Barry, Argonne

Researchers are searching high and low for dark matter, the mysterious substance that makes up a quarter of our universe. One theory proposes that it could be made of particles called axions, which would signal their presence by converting into particles of light, called photons. Fermilab researchers are part of a team developing specialized detectors that look for photons in the terahertz range — at frequencies just below the infrared. The development of these detectors will widen the range of frequencies where axions may be discovered. To bring the faint signals to the fore, the team is using supersensitive quantum amplifiers.

Other participating institutions: National Institute of Standards and Technology, University of Colorado"
Former New York Fed president says central bankers should interfere with the 2020 election to oust Trump,https://www.washingtonexaminer.com,[],08-27-2019,2019,8,https://www.washingtonexaminer.com/opinion/former-new-york-fed-president-says-central-bankers-should-interfere-with-the-2020-election-to-oust-trump,"Want to know how to spot someone who was unaffected by the last recession? Look for the people who argue now that another economic disaster would be worth it if it means President Trump loses his 2020 reelection bid.

The former chair of the New York Federal Reserve this week encouraged the central bank to “refuse to play along” with the president’s trade war with China, arguing in a Bloomberg News opinion article that it would be worth risking a major economic downturn if it means “making it abundantly clear that Trump will own the consequences of his actions.”

“I understand and support Fed officials’ desire to remain apolitical. But Trump’s ongoing attacks on [Fed Chairman Jay Powell] and on the institution have made that untenable,” Bill Dudley writes this week.

He adds, “Central bank officials face a choice: enable the Trump administration to continue down a disastrous path of trade war escalation, or send a clear signal that if the administration does so, the president, not the Fed, will bear the risks — including the risk of losing the next election.”

Remember: Dudley served as the president of the New York Fed for almost a decade (2009 to 2018, to be exact).

“There’s even an argument that the election itself falls within the Fed’s purview,” his op-ed concludes. “After all, Trump’s reelection arguably presents a threat to the U.S. and global economy, to the Fed’s independence and its ability to achieve its employment and inflation objectives.”

He adds, “If the goal of monetary policy is to achieve the best long-term economic outcome, then Fed officials should consider how their decisions will affect the political outcome in 2020.”

Well, that is a none-too-subtle message. He's effectively calling for a coup, stating in almost so many words that the Fed's mandate requires it to interfere in the Democratic process — to help presidents it likes and to ruin the economy for the ones it doesn't like.

Dudley argues that the central bank taking a stand against Trump “could benefit the Fed and the economy in three ways.”

“First,” he writes, “it would discourage further escalation of the trade war, by increasing the costs to the Trump administration. Second, it would reassert the Fed’s independence by distancing it from the administration’s policies. Third, it would conserve much-needed ammunition, allowing the Fed to avoid further interest-rate cuts at a time when rates are already very low by historical standards.”

I suspect Dudley would feel differently about encouraging potential economic disaster had the last one affected him in a meaningful way. But I suspect he suffered no real consequences for the disastrous decisions made by the same sort of people whom he calls on now to “resist” Trump through economic pressure. Those who had their life's savings wiped out, those who lost their homes, and those who struggled for months to find work as bills piled up are likely not the same ones suggesting that another recession would be preferable to four more years of Bad Orange Man in the White House.

Unfortunately, Dudley is not even alone in entertaining this destructive, vindictive fantasy. He is merely the latest and most powerful to call for economic sabotage.

I wonder, though, whether it won't help Trump's reelection in 2020 if those who oppose him are cheering on economic destruction."
United States Department of Defense Increases Deployment of Rekor Technology,https://finance.yahoo.com,[],08-27-2019,2019,8,https://finance.yahoo.com/news/united-states-department-defense-increases-113000911.html,"Expands use of Rekor’s proprietary vehicle recognition software to enhance existing camera networks following successful initial engagement

COLUMBIA, MD / ACCESSWIRE / August 27, 2019 / Rekor Systems, Inc, (REKR) (‘Rekor”) a Nasdaq company focused on bringing smarter, faster, cost-competitive solutions to the worlds of public safety and customer experience, announced today it has received a purchase order from the Department of Defense (DoD) to provide an additional 200 camera licenses for the Company’s vehicle recognition system. The DoD has now doubled its total camera licenses from Rekor, having originally purchased 200 licenses to use the Company’s machine-learning enabled vehicle recognition system in May of this year.

“We believe that both the initial selection and the rapid subsequent second purchase by the DoD confirms what we’ve long known about our technology - that it is the most robust vehicle recognition system on the market and a critical tool to support the important work of the world’s preeminent defense department,” said Robert A. Berman, President and CEO of Rekor. “Our solutions are easy to integrate, highly scalable and very cost efficient. By deploying our software within their existing infrastructure, our customers, including the DoD, can markedly enhance the functionality of their existing IP cameras by adding the most powerful vehicle recognition system in the world. What’s more, it’s all done without sacrificing any of the functionality of the existing system or the need to purchase new, expensive hardware.”

Rekor’s software enables automatic license plate and vehicle recognition through virtually any IP camera. Its industry-leading artificial intelligence-based solutions can be hosted locally or in the cloud. Enabled by machine learning from its robust and growing database covering over 70 countries, Rekor’s software can identify in real time vehicle license plate data, color, make, model and body type.

Rather than buying expensive cameras that take weeks or months to ship and install, Rekor’s software can be deployed to any existing IP camera immediately. This can represent a potential savings of tens of thousands of dollars per camera, as well as greater flexibility to expand or decrease usage as needed without large capital expenditures on hardware. It also eliminates the need for two separate cameras - one for lice plate reading functionality, one for general surveillance recording - as Rekor’s solution can be used to collect license plate data and information such as the make, model, and color of a vehicle using the same camera that provides surveillance monitoring.

About Rekor Systems, Inc.

Rekor Systems, Inc. is a publicly traded company listed on Nasdaq (REKR) with headquarters in Columbia, Maryland. Rekor is focused on bringing smarter, faster, cost-competitive solutions to the worlds of public safety and customer experience. With a strong presence in over seventy countries across the world, we use the power of artificial intelligence to provide actionable, vital information for our clients. Whether it’s using machine learning software to give those who protect us better tools to keep us safe, or through solutions tailored to improving the everyday lives of everyday people, Rekor has the tech, and the expertise, for the job. At Rekor, we strive to make the impossible … possible. To learn more please visit our website: https://rekorsystems.com.

Forward-Looking Statements

This press release contains forward-looking statements within the meaning of the Private Securities Litigation Reform Act of 1995 that involve substantial risks and uncertainties. Other than statements of historical facts, all statements contained in this press release are forward looking statements, including particularly statements regarding our future results of operations and financial position, business strategy, prospective products and services, timing and likelihood of success, plans and objectives of management for future operations, and future results of current and anticipated products and services. These statements involve uncertainties, such as known and unknown risks, and are dependent on other important factors that may cause our actual results, performance or achievements to be materially different from the future results, performance or achievements we express or imply. In some cases, you can identify forward-looking statements by terms such as “may,” “will,” “should,” “expect,” “plan,” “anticipate,” “could,” “intend,” “target,” “project,” “contemplates,” “believes,” “estimates,” “predicts,” “potential” or “continue” or the negative of these terms or other similar expressions. All forward looking statements contained in this press release speak only as of the date on which they were made, are based on management's assumptions and estimates as of such date and are subject to a number of risks, uncertainties and assumptions, including those described under the risk factors sections in our Annual and Quarterly Reports filed with the Securities and Exchange Commission. Because forward-looking statements are inherently subject to risks and uncertainties, some of which cannot be predicted or quantified and some of which are beyond our control, you should not rely on these forward-looking statements as predictions of future events. We undertake no obligation to publicly update any forward-looking statements, whether as a result of the receipt of new information, the occurrence of future events, or otherwise.

Story continues"
