"Trump administration breaks campaign promise, purges 200,000 VA healthcare applications",https://www.washingtonexaminer.com,[],05-13-2019,2019,5,https://www.washingtonexaminer.com/opinion/op-eds/trump-administration-breaks-campaign-promise-purges-200-000-va-healthcare-applications,"""The current state of the Department of Veterans Affairs is absolutely unacceptable,” presidential candidate Donald Trump said when speaking at a rally on Oct. 31, 2015, in front of the retired battleship USS Wisconsin in Norfolk, Va.

""Over 300,000 — and this is hard to believe, and it’s actually much more than that now — over 300,000 veterans died waiting for care,"" said Trump.

Trump’s strong condemnation of the Obama administration’s handling of the backlog of hundreds of thousands of veteran benefits claims made him the overwhelming choice for many veteran voters in 2016.

But after two years in the White House, the Trump administration has decided to execute a plan to purge 200,000 applications for VA healthcare caused by known administrative errors within VA’s enrollment process and enrollment system — problems that had already been documented by the Office of the Inspector General in 2015 and 2017.

In purging this massive backlog of applications, the VA is declaring the applications to be incomplete due to errors by the applicants, despite the OIG findings and in violation of the promise Trump made to fix the system. This purge has the dual effect of letting the VA avoid the work of processing the applications and absolving the agency of any responsibility for veterans’ delayed access to health and disability benefits.

Under the supervision of Dr. Richard Stone, the executive in charge of the Veterans Health Administration, VHA managers last November instructed the agency’s IT staff members to purge over 200,000 pending healthcare applications.

Such a profound decision to deny veterans benefits should have to come from someone higher up — the president or the Secretary of Veterans Affairs — not from a career bureaucrat who has not been elected or confirmed by the Senate.

This purge flies in the face of previous guidance provided by lawmakers. On March 3, 2017, Senate and House Veterans Affairs committee members sent a joint letter to the VA, instructing the agency to delay its plans to purge these records. The committees wanted the VA to send new letters to veterans, informing them of their application status and potential equitable relief or financial reimbursement for service-connected health expenses caused by enrollment system errors, as prescribed by law.

Currently, VA is skirting this provision of the law by blaming veteran applicants for the agency’s own mistakes processing health and disability claims. As a result, to win benefits wrongfully denied due to VA’s administrative errors, veterans are forced to go to court and pay legal fees out of whatever benefits they ultimately win.

The Trump administration’s decision opens the door to the agency purging any future backlog of veteran claims for benefits by falsely declaring the applications incomplete due to veteran error.

This is the second time the VA has been caught using its IT department to adjudicate benefits for veterans. In January 2017, the IT department auto-enrolled over 70,000 Iraq and Afghanistan combat veterans whose applications had erroneously been held up until they could meet a “means test” — that is, prove their income level. This mass-approval of applications was done in preparation for then-Under Secretary David Shulkin’s confirmation hearing.

They did this without bothering to fix the systemic error that required proof of income from combat veterans, who aren’t required to provide it. As a result, there are still more than 20,000 Iraq and Afghanistan combat veterans being denied healthcare benefits due to an erroneous means-test requirement.

Moreover, the means test error in the enrollment system not only affects veteran access to healthcare benefits, but it also causes billing errors for thousands of veterans each year.

The Veterans Health Administration’s Member Services office, which manages the enrollment system, had to reexamine over 6,000 veteran income verification cases, because veterans were overbilled for medical copays ranging from $200 to $3,000. About 1,000 veterans are believed to receive fraudulent bills from the VA every month due to this known system error.

Despite being aware of these systemic issues for years, VA has not initiated an outreach campaign to educate the veteran community about what to do if their application is in a pending status or if they get a fraudulent bill due to missing means-test information.

Instead, the agency has chosen a policy of sending a single notification letter for pending applications, despite knowing that 25% of the letters mailed to veterans are returned or placed on hold due to bad address information in the enrollment system.

Iraq and Afghanistan combat veterans routinely have incorrect address information in the enrollment system because they do not have permanent non-military addresses at the time of enrollment during the demobilization process.

The VA could resolve this problem through its data-sharing agreement with the Internal Revenue Service and Social Security Administration, to get current addresses for veterans in the pending backlog. But unfortunately for veterans, it is the VA’s practice to use information from the IRS and SSA only for the purposes of billing and verifying veterans’ dates of death.

All of these issues could be easily fixed. This is why President Trump’s reversal on this issue is so disappointing to the veteran community. Many veterans are asking why the enrollment system was not included in the President’s VA information technology modernization plan.

As a result, 200,000 applications have been purged, violating Trump’s promise. Currently, over 300,000 additional veteran healthcare applications remain in a pending status and will most likely be purged in the near future.

In the absence of executive leadership from the White House, veterans will continue to be denied access to their healthcare benefits at a rate of nearly 5,000 new pending healthcare applications per month.

Scott Davis (@ScottDavis_WB) is a VA whistleblower who testified before Congress in 2014 about the denial of healthcare benefits to veterans."
State Department: US trying to remove protesters from Venezuelan Embassy in DC,https://www.cnn.com,"['Adrienne Winston', 'Eli Watkins']",05-13-2019,2019,5,https://www.cnn.com/2019/05/13/politics/venezuelan-embassy-washington-dc/index.html,"(CNN) US law enforcement on Monday started the process of trying to remove protesters from the Venezuelan Embassy in Washington, a State Department official said.

The move to evict the protesters from the embassy came after a group of US anti-war activists began moving into the embassy last month

Medea Benjamin, one of the founders of the anti-war group Code Pink, previously told CNN that diplomats from the government of Venezuelan President Nicolas Maduro had given them access to the embassy before the diplomats left as the standoff unfolded between Maduro and Venezuelan opposition leader and self-proclaimed interim President Juan Guaido.

Venezuela's Vice Minister of Foreign Affairs for North America Carlos Ron denounced the removal of protestors on Monday

""The Government of the Bolivarian Republic of Venezuela has not authorized the entry of police officers into the former Embassy building in Washington, DC. This intrusion is yet another violation of international law by US authorities and an aggression against Venezuela,"" Ron, a Maduro official, said on Twitter

Read More"
"TSA identifies 200 agents, including air marshals, who can be sent to U.S.-Mexico border",https://www.nbcnews.com,"['Julia Ainsley', 'Julia Ainsley Is A National Security Reporter For Nbc News.']",05-15-2019,2019,5,https://www.nbcnews.com/politics/immigration/tsa-identifies-200-agents-including-air-marshals-who-can-be-n1005901,"TSA identifies 200 agents, including air marshals, who can be sent to U.S.-Mexico border

A TSA official said the DHS has not yet approved the list of 200 employees , but it would not include frontline personnel who deal with airport travelers."
Department of Energy seeks to kickstart storage under new budget,https://www.axios.com,[],05-15-2019,2019,5,https://www.axios.com/department-of-energy-seeks-to-kickstart-storage-under-new-budget-65bf8760-08ac-49b3-b788-b9847ca0ca7d.html,"Details: According to the budget justification documents provided to Congress by the DOE, this budget would support the following efforts:

Creation of an “Advanced Energy Storage Initiative” that would facilitate collaboration across the DOE’s offices to rapidly increase storage capabilities and integrations

Continued research on new storage devices and materials, including the “development of open source models and software tools for system level energy storage planning and evaluation""

Design and construction of a grid storage “launchpad” at the Pacific Northwest National Lab that would allow teams to test and evaluate new advanced storage technologies

Yes, but: The DOE’s energy storage initiatives do not address other challenges to implementation, including obstructive or unclear state policies.

The outcomes of evolving proceedings in the wake of FERC Order 841 — which requires wholesale power markets to develop rules that allow energy storage resources to participate — could affect the program's success. Some regional transmission organizations are already asking for extensions to FERC compliance deadlines for crafting storage policies.

Watch to watch: The DOE is requesting $5 million to build the launchpad, an expenditure it will partially offset with a $2.5 million reduction in research spending elsewhere.

While these numbers are rounding errors in the context of DOE’s $2.3 billion request for energy innovation and independence programs, the case for this swap will still need to be made to Congress.

Sarah E. Hunt is the co-founder and CEO of Joseph Rainey Center for Public Policy."
"George Papadopoulos calls on Barr, DOJ inspector general to examine 'marked' $10K from alleged spy",https://www.washingtonexaminer.com,[],05-14-2019,2019,5,https://www.washingtonexaminer.com/news/george-papadopoulos-calls-on-barr-doj-inspector-general-to-examine-marked-10k-from-alleged-spy,"Former Trump campaign adviser George Papadopoulos wants federal investigators to look into a $10,000 payment he claims to have received in the summer 2017 from a man he believes was a foreign spy.

The money, he said on Tuesday, might have come from special counsel Robert Mueller's team in an effort to entrap him.

""I actually want Congress, Barr, Horowitz, and Huber to review the bills,"" Papadopoulos said on Fox Business, referring to Attorney General William Barr, Justice Department Inspector General Michael Horowitz, and U.S. Attorney John Huber — all of whom are conducting investigations into the origins of the Trump-Russia investigation and possible misconduct by federal officials.

As Papadopoulos would tell it, a man gave him the money in a Israel hotel room for some sort of Mediterranean-Middle East political consulting venture they discussed. Beyond his work for the Ben Carson and Trump presidential campaigns, Papadopoulos was also an energy consultant. Papadopoulos said he felt uncomfortable and gave the money to his lawyer in Athens, Greece, but the man would not take the money back.

In July 2017, Papadopoulos flew to Dulles International Airport outside Washington where FBI agents placed him under arrest. He pleaded guilty October 2017 to making false statements to the FBI about his contacts with Russians and served 12 days in prison late last year. He also was fined $9,500 and ordered to do community service. Papadopoulos additionally agreed to cooperate with the Russia investigation conducted by Mueller, who recently wrapped up and found no criminal conspiracy between the Trump campaign and the Russian government. The FBI launched its original counterintelligence investigation, called Crossfire Hurricane, in July 2016. It was prompted by Australian diplomat Alexander Downer informing the FBI that Papadopoulos told him Russia had damaging information on Hillary Clinton, Trump's Democratic rival in the 2016 election. Papadopoulos has said Maltese academic Joseph Mifsud, who told him about the alleged dirt on Clinton, was also working for Western intelligence.

Papadopoulos said on Tuesday that the money is still with his lawyer in Greece. He said he believes the bills are ""marked"" and have a traceable link to the Obama Justice Department, FBI, and even Mueller himself.

""If the Mueller team is going around entrapping campaign associates and Trump associates, the way they did to me — I am sure it wasn't just me they did it to — it's going to open up a massive can of worms,"" Papadopoulos said. ""I think we need to get to the bottom of exactly not only how did this story start, but why were they entrapping us moving forward.""

Papadopoulos informed federal investigators about the payment. It is mentioned at the bottom of an August memo from Mueller that recommended Papadopoulos serve up to six months in jail for misleading the FBI.

""Based on the defendant’s offense level under the Guidelines, the applicable range for a fine is $500 to $9,500,"" the memo reads. ""The defendant provided information about $10,000 in cash he received from a foreign national whom he believed was likely an intelligence officer of a foreign country (other than Russia). The defendant has stated that he kept that money in a safe pending his sentencing in this case and Counsel for the defendant has consented to the imposition of this fine amount. Forfeiture is not applicable in this case.""

Papadopoulos identified the man he allegedly met and received the $10,000 from as Israeli American businessman Charles Tawil. The individual who introduced Papadopoulos to Tawil was an Israeli political strategist named David Ha’ivri. Ha’ivri told the Daily Caller that he was unaware of a $10,000 payment to Papadopoulos, but Tawil did secure a consulting contract with a petroleum and gas infrastructure company with a retainer of $10,000 a month after talks with Papadopoulos fell apart due to his ""immaturity.""

Ha’ivri said he was unaware the FBI was investigating Papadopoulos when he introduced Tawil to him. “Had we known about them before we would have never reached out to a guy like George,” he said.

Tawil told the Times of Israel that Papadopoulos never asked him to take back the money and “was desperate to work with me.” He also denied being part of some entrapment plot. ""First of all, I support Trump, so why would I entrap a pro-Trump guy?” he said. “I like the fact that Trump is the president. I wanted him to be president. I worked a lot in Africa and I see the damage that Clinton and Obama did to the world. Trump may be eccentric but he is at least straightforward.”"
VA Sec. Wilkie: A breakthrough in health care for veterans is coming in June -- Here's what to expect,https://www.foxnews.com,"['Robert Wilkie', 'Robert Wilkie Is The Secretary Of The U.S. Department Of Veterans Affairs']",,,,https://www.foxnews.com/opinion/sec-robert-wilkie-bringing-bipartisan-reform-to-veterans,"Imagine if Republicans and Democrats worked together to pass reforms that improve the lives of millions of people.

And imagine if those reforms put America’s veterans at the center of their health care decisions, leading to better customer service for our nation’s heroes.

This isn’t hypothetical. It happened last year when Congress passed the MISSION Act.

TRUMP REPORTEDLY TAKING BROAD LOOK AT VETERANS CONVICTED OF BATTLEFIELD CRIMES

The law gives the Department of Veterans Affairs (VA) the ability to provide veterans with the best health care possible, whether at VA health care facilities or with community providers.

The legislation sailed through Congress with overwhelming bipartisan support and the strong backing of veterans service organizations.

President Donald J. Trump’s signature put us on a path to implementing these reforms. On June 6, the MISSION Act will enable VA to consolidate the department’s community care efforts into a single, simple-to-use program that will empower veterans with the ability to choose the health care providers they trust.

So what can veterans expect on June 6?

Less red tape, more satisfaction and predictability for patients, more efficiency for our clinicians, and better value for taxpayers.

Veterans will be eligible to get community care for a variety of reasons, including when VA can’t provide the treatment they need or when care outside our system is in the best medical interest of the patient.

We listened to veterans and heard they preferred standards based on drive times rather than driving mileage because those standards better reflect veteran experiences, especially in large urban areas with lots of traffic.

To ensure our veterans are spending their time getting care instead of driving to it, patients facing an average drive time of 30-minutes or more for VA primary or mental health care, or non-institutional extended care services, will have the option of choosing a community provider closer to home. For specialty care, the drive-time standard will be an average of 60 minutes.

And to get veterans the care they need when they need it, VA patients facing a 20-day or more wait time for primary or mental health care, or non-institutional extended care services, will have the option of choosing a community provider who can deliver that care faster. For specialty care, the wait-time standard will be 28 days.

For additional convenience and timely treatment, eligible veterans will also have access to urgent, walk-in care that gives them the choice to receive certain services at participating community clinics in their communities. (To access this new benefit, veterans will select a provider in VA’s community care network and may be charged a copayment.)

Veterans will be encouraged to ask VA about these new options, and well-trained staff will be available to help them quickly understand their choices.

These exciting and important changes speak to my top priority – delivering the best medical customer service and offering veterans more health care choices.

With the MISSION Act, the future of the VA health care system will lie in the hands of veterans – precisely where it should be.

While we still have more work to do, the VA is making progress.

We are seeing more patients than ever before, more quickly than ever before and studies show VA now compares favorably to the private sector for access and quality of care – and in many cases exceeds it.

And veterans have noticed.

Patients’ trust in VA care has skyrocketed to 87.7 percent, and in the last fiscal year, VA completed more than 58 million internal appointments – a record high and 623,000 more than the year before.

VA employees are noticing improvements as well. VA ranked sixth out of 17 Federal Government agencies in the Partnership for Public Service’s most recent “Best Places to Work” survey, up from 17th the year prior.

To maintain the trust of our veterans, we must continue to deliver. And we will constantly innovate, upgrade, and pursue ways to better serve our Nation’s heroes.

The MISSION Act is a vital part of this effort, giving VA the ability to implement the best practices we’ve learned in our nearly 75 years of experience offering community care.

The core of the doctor-patient relationship is trust. President Trump promised veterans that this core value would shape the VA.

CLICK HERE TO GET THE FOX NEWS APP

With the MISSION Act, the future of the VA health care system will lie in the hands of veterans – precisely where it should be.

That’s exactly what President Trump promised, it’s exactly what Congress voted for, and it’s exactly what VA will deliver to America’s veterans."
Pompeo shares details on 'escalating' Iran threats in Brussels: U.S. State Department,https://www.reuters.com,"['Reuters Editorial', 'Min Read']",05-14-2019,2019,5,https://www.reuters.com/article/us-usa-iran-pompeo/pompeo-shared-details-on-iran-threats-with-nato-state-department-idUSKCN1SJ1XN,"BRUSSELS (Reuters) - U.S. Secretary of State Mike Pompeo shared information on “escalating” threats from Iran with European allies and NATO officials during meetings in Brussels on Monday, the U.S. special representative for Iran said.

FILE PHOTO - U.S. Secretary of State Mike Pompeo speaks during the Arctic Council summit at the Lappi Areena in Rovaniemi, Finland May 7, 2019. Mandel Ngan/Pool via REUTERS

“Iran is an escalating threat and this seemed like a timely visit on his way to Sochi,” Brian Hook told reporters, referring to Pompeo’s planned visit to Russia on Tuesday for meetings with Russian President Vladimir Putin and Foreign Minister Sergei Lavrov.

Pompeo canceled a visit to Moscow on Monday and stopped in Brussels instead, en route to Sochi.

“The secretary wanted to share some details behind what we have been saying publicly,” Hook said. “We believe that Iran should try talks instead of threats. They have chosen poorly by focusing on threats.”

Hook said Pompeo, while in Brussels, also discussed reported attacks on several oil tankers off the coast of the United Arab Emirates.

Asked if Pompeo was blaming Iran for the attacks, Hook said: “We discussed ... what seemed to be attacks on commercial vessels that were anchored off Fujairah ... we have been requested by the UAE to provide assistance in the investigation, which we are very glad to do.”

Asked if he himself believed there was the possibility of an Iranian role, Hook had no comment.

The UAE said on Sunday that four commercial vessels were sabotaged near Fujairah emirate, one of the world’s largest bunkering hubs lying just outside the Strait of Hormuz. It did not describe the nature of the attack or say who was behind it.

Saudi Arabia said Monday that two of its oil tankers were among those attacked and described it as an attempt to undermine the security of crude supplies amid tensions between the United States and Iran.

The UAE on Monday identified the vessels as very large crude carrier (VLCC) tanker Amjad and crude tanker Al Marzoqah, both owned by Saudi shipping firm Bahri. The other two were UAE-flagged fuel bunker barge A. Michel and Norwegian-registered oil products tanker MT Andrew Victory."
"Donald Trump figure, wearing ‘Keep America Great’ hat, arrives at Presidents Hall of Fame",https://www.orlandosentinel.com,['Jerry Fallstrom'],,,,https://www.orlandosentinel.com/news/lake/os-lk-trump-figure-presidents-hall-of-fame-20190515-2te4e2rlxbat5fini2cic5bxzq-story.html,"John Zweifel, who owns the roadside attraction he and his wife, Jan, opened in 1963, said he ordered the figure while Trump was a candidate, figuring he could display it in the museum even if Trump lost because of his prominence on the national stage."
