Exclusive: Google Insider Turns Over 950 Pages Of Docs And Laptop To DOJ,https://saraacarter.com,[],08-13-2019,2019,8,https://saraacarter.com/exclusive-google-insider-turns-over-950-pages-of-docs-and-laptop-to-doj/,"A former Google insider claiming the company created algorithms to hide its political bias within artificial intelligence platforms – in effect targeting particular words, phrases and contexts to promote, alter, reference or manipulate perceptions of Internet content – delivered roughly 950 pages of documents to the Department of Justice’s Antitrust division Friday.

The former Google insider, who has already spoken in to the nonprofit organization Project Veritas, met with SaraACarter.com on several occasions last week. He was interviewed in silhouette, to conceal his identity, in group’s latest film, which they say exposes bias inside the social media platform.

Several weeks prior, the insider mailed a laptop to the DOJ containing the same information delivered on Friday, they said. The former insider is choosing to remain anonymous until Project Verita’s James O’Keefe reveals his identity tomorrow (Wednesday).

He told this reporter on his recent trip to Washington D.C. that the documents he turned over to the Justice Department will provide proof that Google has been manipulating the algorithms and the evidence of how it was done, the insider said.

Google CEO Sundar Pichai told the House Judiciary Committee in December, 2018, that the search engine was not biased against conservatives. Pichai explained what algorithm’s are said Google’s algorithm was not offensive to conservatives because its artificial intelligence does not operate in that manner. He told lawmakers, “things like relevance, freshness, popularity, how other people are using it” are what drives the search results. Pichai said even if his programmers were anti-Republican, the process is so intricate that the artificial intelligence could not be manipulated and it was to complicated to train the algorithm to fit their bias.

Google did not immediately respond for comment on the insider’s claims, however, this story will be updated if comment is provided.

The insider says Google is aware most people are unaware or not knowledgeable about these advanced IT systems and therefore unable to determine who is telling the truth.

“I honestly think that a free market can fix this issue,” he told this reporter at a meeting in Washington D.C. “The issue is that the free market has been distorted and what’s happened is that the distortion is so grotesque and the engineering is so repulsive, all we need to do is just expose what’s going on. People can hear that it is bad but that can be bias. But when they see what Google has actually written with the documents, this will actually be taught in universities of what totalitarian states can do with this type of capability.”

“It will be so revolting that it doesn’t matter what the solution is, a solution will just form as a reaction to this manipulation they have done,” the Google insider said.

He said he’s asked himself many times if he’s overreacting “and every time I simply look back at the documents and realize that I am not.”

“It’s that bad,” he said. “Disclosing Google’s own words to the American public is something I am, must do, if I am to consider myself a good person. The world that google is building is not a place I, or you or our children want to live in.”

⚡️TOMORROW: Our ML Fairness Google insider comes out of the shadows. AND: OVER A THOUSAND of pages of internal documents are released. Google might take this new video down. Sign up for our video list NOW — so you don't miss our latest on Google: https://t.co/dt1eVMYB71 pic.twitter.com/psyf36DTZs

— James O'Keefe (@JamesOKeefeIII) August 13, 2019

Another Google insider, who has come forward already, told O’Keefe and other media outlets recently that it is the programers at Google who use the algorithms to manipulate the information to advance its leftist agenda.

Greg Coppola, a software engineer, told Project Veritas that he doesn’t “have a smoking gun.”

However, “I’ve just been coding since I was ten, I have a Ph.D., I have five years of experience at Google, and I just know how algorithms are. They don’t write themselves. We write them to make them do what we want them to do.”

“I look at Search and I look at Google News, and I see what it’s doing,” he said. “I see Google executives go to Congress and say … that it’s not political, and I’m just so sure that that’s not true.”

Department of Justice officials declined to comment on the document dump. But SaraACarter.com has reviewed the documents and obtained proof from the Google insider that the documents were delivered to the DOJ.

The unnamed Google insider first spoke to O’Keefe’s Project Veritas. O’Keefe has been criticized by the left for outing the political bias of executives and employees of Google and other social media companies.

In the nonprofits most recent video, Project Veritas uses their undercover techniques to get Google employees to talk openly about their disdain for Trump and how their artificial intelligence operates.

Jenn Gennai, who heads Google’s Responsible Innovation Team, did not know she was being filmed by O’Keefe’s group. She told the undercover journalist that “the reason we launched our AI principals is because we’re not putting our line in the sand. They were not saying what’s fair and what’s equitable so we’re like, well we’re a big company, we’re going to say it.”"
Disturbing trend of ICE facilities under attack,https://komonews.com,"['Kristine Frazao', 'Sinclair Broadcast Group']",,,,https://komonews.com/news/nation-world/disturbing-trend-of-ice-facilities-under-attack,
Tyson aims to reduce USDA involvement in beef inspection at Kansas plant,https://theweek.com,['Peter Weber'],08-14-2019,2019,8,https://theweek.com/speedreads/859008/tyson-aims-reduce-usda-involvement-beef-inspection-kansas-plant,"Tyson Foods is requesting that company employees at a Kansas beef plant take over some inspection responsibilities previously held by United States Department of Agriculture officials.

If enacted, the proposal would reduce the number of USDA inspectors present on the line in the factory for ""post-mortem, pre-sortation activities"" regarding food safety and disease conditions, per the proposal. The company's request to the USDA was written in March, and obtained via a Freedom of Information Act request by Food and Water Watch, a company that is suing Tyson, reports NBC News.

The USDA is considering the proposition, reports NBC News, which is in reference to the company's factory in Holcomb, Kansas.

According to the proposal, the requested changes aim to improve efficiency, work toward pathogen reduction, and ""allow better use of Agency's resources"" while providing equal outcomes to current inspection practices.

But consumer advocates are hesitant. Former USDA chief veterinarian Pat Basu told NBC News ""bypassing safeguards"" may result in missed signs of disease, drug injections, or bacteria due to lack of adequate training.

""It could be devastating for the whole country — you cannot turn it over,"" he told NBC News.

This isn't the first time the government has considering bowing out of certain inspection responsibilities. The Obama administration allowed an increase in privatized poultry inspection, reports NBC News, and the Trump administration announced a proposition to establish a ""new voluntary inspection system"" for pork plants. Read more at NBC News. Taylor Watson"
VA Partners With DoD to Upgrade Supply Chain at High Risk for Abuse,https://www.military.com,['Richard Sisk'],08-14-2019,2019,8,https://www.military.com/daily-news/2019/08/14/va-partners-dod-upgrade-supply-chain-high-risk-abuse.html,"The Department of Veterans Affairs announced a partnership with the Defense Department this week to upgrade its supply chain system, which is perennially on a government watchdog agency's ""high risk"" list for waste, fraud and abuse.

The partnership with the Defense Logistics Agency (DLA) will give the VA access to the DLA's worldwide procurement system in an effort to streamline the VA's purchase of everything from medical and surgical supplies to cleaning equipment and construction materials, the VA said in a news release Monday.

""This is a huge step forward in our efforts to transform VA into a modern, high-performing organization by simplifying operations and leveraging DoD's supply chain system to support our veterans,"" VA Secretary Robert Wilkie said in a statement.

Army Lt. Gen. Darrell Williams, director of the DLA, said the agreement would help the VA reduce costs for supplies.

Related content:

""On behalf of DoD, we are proud to be a value-add to VA on behalf of America's veterans,"" he said in a statement.

The VA release said the DLA will help ""create a centralized ordering system for VA"" aimed at ""reducing risk, waste, fraud and abuse in purchasing medical equipment and supplies,"" problems that have plagued the system for years and repeatedly been cited by the VA's Office of Inspector General and the Government Accountability Office.

In March, the GAO again put the VA on its biennial ""high risk"" list of agencies and departments whose practices are open to abuse; it also added a new area of concern at the VA -- acquisition management.

""VA's procurement policies have historically been outdated, disjointed and difficult for contracting officers to use,"" the GAO report states.

In 2017, the department launched a new program aimed at overhauling its supply chain system to achieve $150 million in cost reductions, the GAO noted.

However, the GAO reported in November 2017 that the new program ""was rushed, lacked key stakeholder involvement and buy-in, and relied on establishing non-competitive blanket purchase agreements for the overwhelming majority of products, resulting in low utilization by medical centers.""

The VA's Office of Inspector General was particularly scathing in a series of 2017 reports on supply chain scandals at the Washington, D.C., VA Medical Center.

IG Michael Missal found the problems at the Washington VA so troubling that he took the unusual step of issuing preliminary findings prior to the final report to alert the Veterans Health Administration to a situation ""sufficient to potentially compromise patient safety.""

The final report concluded that no patients were harmed but found that $150 million in supplies had never been inventoried, storage areas were filthy, and there was no system for ensuring that defective medical instruments and supplies were not used on patients.

Poor oversight of the medical supply system led to shortages in operating rooms at the hospital, according to the report. At one point, the operating room ran out of vascular patches to seal blood vessels and ultrasound probes used to map blood flow.

In addition, the hospital had to borrow bone material for knee replacement surgeries and also ran out of tubes needed for kidney dialysis, forcing staff to go to a private-sector hospital to procure them, the report added.

-- Richard Sisk can be reached at Richard.Sisk@Military.com."
"Only bottled water for Newark residents, EPA says",https://www.foxnews.com,['Georeen Tanner'],,,,https://www.foxnews.com/health/epa-tells-newark-provide-bottled-water,"Just over a year ago, Newark officials declared the city's water was ""absolutely safe to drink,"" but last week environmental officials called on the city to advise residents with known or suspected lead service lines that the filters they had been provided were not reliable after elevated lead levels were discovered in two Newark homes.

For three years the New Jersey city has been mired in a crisis caused by high levels of lead in the drinking water. The water filter program meant to answer the call for safer water has failed to solve the problem.

UK BABY LOSES ALL 4 LIMBS FOLLOWING HORRIFIC SEPSIS INFECTION

Now, in a move that echoes Flint, Mich., the city is distributing bottled water.

Last fall, the city distributed water filters to residents to reduce lead levels in drinking water while it implemented new corrosion control methods.

According to the CDC's Childhood Lead Poisoning Prevention Program, lead exposure is devastating. Lead serves no purpose in the human body and there is no safe level of lead in drinking water. Children are especially at risk of its deadly effects. Early exposure can have lifelong consequences, such as intellectual disabilities, the agency says.

According to the U.S. Environmental Protection Agency's (EPA) letter, the agency is “unable at this time to assure Newark residents that their health is fully protected when drinking tap water filtered through these devices.”

The EPA places the onus to provide bottled water to Newark residents on the city.

New Jersey Gov. Phil Murphy said in a joint statement with Newark Mayor Ras Baraka that he is prepared to make bottled water available to residents. He further stated that Newark is expanding the testing of filtered drinking water to more Newark homes and that the New Jersey Department of Environmental Protection is “working with the filter manufacturer to determine the scope of the situation.”

The city handed out nearly 40,000 PUR water filters, half of which were donated by the company. In a statement, PUR said it has been “working diligently with the City of Newark to understand the situation, assist with the establishment of testing protocols for additional sampling, and help them determine next steps.” PUR says its faucet filters are “independently tested and certified by NSF International (NSF) to remove 99 percent of lead at levels up to 10 times the applicable federal and state drinking water standard of 15 parts per billion (ppb).”

Erik Olson, senior director of health programs at Natural Resources Defense Council (NRDC), is “troubled” by these developments. NRDC, an environmental group, sued Newark last year for failing to comply with regulations for the control of lead in drinking water.

MASSACHUSETTS MAN WITH DEADLY MOSQUITO-BORNE VIRUS IN A COMA, DAUGHTER SAYS

“Everyone in Newark deserves safe drinking water,” Olson said, in a statement. “We welcome EPA’s recent letter stating that Newark residents with lead service lines should be provided bottled water, though we do not understand why EPA does not insist on protecting other at-risk people such as those with lead plumbing and whose water tests high for lead. We also continue to be concerned about risks to residents in the eastern part of the City, the Wanaque service area.”

The bottled water distribution targets families served by the Pequannock water system with lead service lines who have received filters. Other Newark residents are served by the Wanaque water system, which was not prioritized for filters.

Newark does not know why the filters are failing, but one resident is not surprised by the turn of events.

“We’ve been telling them this for the last two years, but we were looked at as crazy,” said Debra Salters, a member of advocacy group Newark Water Coalition.

“We told [city officials] to give out bottled water and now they’re talking about they’re only giving out two cases. That’ll be gone by the end of the night,"" she said.

According to Salters, residents must show two forms of identification to collect water. She believes that complicates an already alarming situation.

CLICK HERE TO GET THE FOX NEWS APP

“You couldn’t listen to the residents who pay your salary. You had to wait until the federal government put their foot on your neck and made you do something,” Salters said. “This is a life crisis.”

A reduction of lead levels is expected by the end of this year as stated in Murphy’s and Baraka’s statement. They are “optimistic” that the new corrosion control treatment will “prevent leaching from lead pipes.”"
Trump administration aims to shift money to immigration enforcement,https://www.politico.com,"['Caitlin Emma', 'Jennifer Scholtes']",08-14-2019,2019,8,https://www.politico.com/story/2019/08/14/trump-administration-federal-funding-ice-1662256,"Federal support for ICE, which falls under Homeland Security’s umbrella, has become a hotbed of progressive ire. | Carolyn Kaster/AP Photo employment & immigration Trump administration aims to shift money to immigration enforcement

The Trump administration wants to pour more federal funding into Immigration and Customs Enforcement by shifting money out of other Department of Homeland Security accounts, two House aides and a congressional office confirmed to POLITICO.

The move is sure to rile Democrats already angered by what they see as President Donald Trump's harsh immigration policies, most recently ICE raids across seven Mississippi food-processing plants that resulted in the arrest of 680 workers.

Story Continued Below

Congressional appropriators are reviewing a request from Homeland Security to redirect more money to ICE, aides said. It’s unclear how much the administration wants to move around through a process known as reprogramming, what the funds would be used for or whether the request would require congressional approval. Aides declined to provide details or a copy of the request.

House Appropriations Chairwoman Nita Lowey (D-N.Y.), however, was quick to throw cold water on the Trump administration’s bid for more ICE funding.

“ICE is not going to win an award in the Democratic caucus for popularity,” Lowey (D-N.Y.) told POLITICO in a phone interview on Wednesday. “I certainly cannot see our caucus supporting taking money from other programs and putting it into ICE ... I can assure you there would not be support for adding additional money for ICE.”

The Trump administration’s request comes after Homeland Security redirected $200 million last year from various accounts into ICE, pulling from the Coast Guard, TSA aviation security and more. Nearly $10 million was diverted from FEMA at the start of hurricane season, sparking congressional backlash.

Federal support for ICE, which falls under Homeland Security’s umbrella, has become a hotbed of progressive ire, especially when it comes to the administration’s desire to pay for additional immigrant detention beds. Democrats have also tried to limit the administration’s reprogramming authority, particularly when it comes to shifting money around for the construction of a wall at the U.S.-Mexico border.

ICE referred a request for comment to the Homeland Security Department, which did not immediately respond.

“This administration has thumbed its nose at congressional authority over and over again by taking millions of taxpayer dollars earmarked for other priorities and using them to jail and deport more immigrants,” said Heidi Altman, director of policy for the National Immigrant Justice Center, an organization that provides legal aid to immigrants and opposes Trump’s policies, in a statement.

Altman also called for the reprogramming request to be made public.

“It’s a threat to checks and balances that is hurting our democracy while lining the pockets of private prison company CEOs and devastating immigrant communities,” she said. “Congress is sitting on a document explaining from where ICE took money to fuel its anti-immigrant agenda. The public deserves to see it.”

Rep. Lucille Roybal-Allard’s (D-Calif.) office confirmed the reprogramming request in a statement, adding “that we are not at liberty to discuss the details at this time.“ Roybal-Allard serves as chairwoman of the House Homeland Security spending panel.

Ted Hesson contributed to this report."
New Jersey Paralegal Allegedly Used DOJ Access to Help Son’s Gang Identify “Snitches”,https://slate.com,['Molly Olmstead'],08-14-2019,2019,8,https://slate.com/news-and-politics/2019/08/new-jersey-gang-paralegal-doj-access-snitches.html,"The state seal of New Jersey. Photo illustration by Slate. Photo by Wikipedia.

A paralegal in the New Jersey U.S. Attorney’s Office has been accused of using her government access to identify people in her son’s gang who cooperated with investigators, putting them in danger of retaliation from their fellow gang members, according to filings in a federal court in Brooklyn. The woman pleaded not guilty to the charges on Tuesday.

According to prosecutors, Tawanna Hilliard, 44, used her access to Department of Justice computers to search databases to identify cooperating witnesses from the 5-9 Brims, a set of the Bloods street gang, at the direction of members of that gang. According to NJ.com, Hilliard had worked in the New Jersey U.S. Attorney Office’s Civil Division for nine years.

Hilliard also specifically targeted the co-defendant in a robbery case that resulted in her son, Tyquan, being sentenced to 10 years in prison. In May 2018, the man and Tyquan Hilliard robbed an AT&T store in Monticello, New York. The men threatened the store clerk and two shoppers with a gun and bound them with duct tape in a storage room. They fled the scene and led the police on a high-speed chase before crashing their car and being captured.

Texts between the mother and son allegedly show Tawanna Hilliard complaining that the co-defendant’s cooperation with the investigators after the robbery ruined her son’s defense. The man was “giving up murders, victims, shooters and all…SMH,” she wrote in a text, according to court documents. Tawanna Hilliard allegedly responded by posting a video on YouTube of the co-defendant talking to investigators about that robbery, with the title “NYC Brim Gang Member Snitching Pt. 1.” The man and his family then received death threats from other inmates linked to the Bloods, according to prosecutors.

According to NJ.com, the indictment contends that before his arrest, Hilliard told her son in an April 2016 call that she had “looked up” cases for another gang member who wanted to locate people who “snitched.”

Hilliard has been charged with witness tampering, obstruction of justice, and obtaining information from a government computer. She was released on bond with the order not to contact her son or other gang members. Her son is also charged in the indictment."
Columbia Housing Authority votes to close Harden Street Save-A-Lot,https://www.wistv.com,"['Miranda Parnell', 'Published August', 'At Am', 'At Pm']",08-16-2019,2019,8,https://www.wistv.com/2019/08/16/columbia-housing-authority-votes-close-harden-street-save-a-lot/,"“The original operator of the grocery store decided that it no longer could fulfill those responsibilities back in December,” Mathews said. “CHAD stepped in with what it thought would be a temporary solution and it used some of its non-federal resources to offset the cost of operating the grocery store, but that’s just not the business that we’re in. We’re in the business of housing families, so that was operating outside of our wheelhouse.”"
Environmentalists renew bid to overturn EPA policy barring scientists from advisory panels,https://thehill.com,[],08-15-2019,2019,8,https://thehill.com/policy/energy-environment/457631-environmentalists-renew-bid-to-overturn-epa-policy-keeping-scientists-off-advisory-committees,"Environmental groups on Thursday appealed a court decision in their attempt to end the Environmental Protection Agency’s (EPA) policy of excluding certain scientists from serving on its advisory boards.

“The Trump administration is simply trying to payback its polluter cronies by gutting sound science that our health and environmental protections rely on,” Neil Gormley, an attorney with Earthjustice, wrote in a statement announcing the appeal filed in the D.C. Circuit Court.

ADVERTISEMENT

who receive agency grants

would have a conflict of interest and shouldn’t be allowed to serve on various scientific panels that advise the EPA.

The move outraged science and environmental advocates who countered that the policy would sideline some of the nation’s top researchers while paving the way for industry-funded scientists to gain more influence at the EPA.

A July report from the Government Accountability Office found the EPA increased the number of industry representatives and consultants on its top scientific board and failed to ensure the appointees met ethics requirements.

But the Trump administration has already had a victory in court.

A judge previously ruled that the scientists involved in the case have no recourse because EPA’s decision is not subject to court review.

Earthjustice argues the EPA’s rule on conflicts of interest violates ethics rules and the procedure for changing them.

EPA did not immediately respond to request for comment.

A similar suit from the Natural Resources Defense Council was filed in June. That case is still being litigated.

The legal battles come at a time when many critics argue that such committees are under attack by the Trump administration.

A recent executive order signed by Trump directs all federal agencies to cut their advisory boards by at least one-third.

Those boards are often filled by people considered to be at the top of their fields who can provide important technical advice to various departments as they consider crafting a wide variety of policies.

Tensions between the boards and the agencies they advise have been particularly high at the EPA.

Members of the Science Advisory Board recently pushed back on the administration's efforts to bar consideration of studies that don't make their underlying data public."
