Trump's North Korea point man gets a look for No. 2 State Dept. job,https://www.politico.com,"['Daniel Lippman', 'Eliana Johnson']",08-26-2019,2019,8,https://www.politico.com/story/2019/08/26/biegun-north-korea-state-dept-1475896,"Special Envoy for North Korea Steve Biegun is being seriously considered to replace deputy secretary of state John Sullivan. | Jeon Heon-Kyun/Getty Images foreign policy Trump's North Korea point man gets a look for No. 2 State Dept. job Taking the deputy secretary position would leave the president without a dedicated envoy to Kim Jong Un.

Steve Biegun, President Trump’s special representative for North Korea, is being seriously considered for the No. 2 job at the State Department, according to two senior administration officials with knowledge of the matter.

The post looks like it’s going to open up soon because the current deputy secretary of state John Sullivan, who met with Trump in the Oval Office last week, is likely to get nominated in the coming weeks to be the U.S. ambassador to Russia, replacing Jon Huntsman, who leaves his post in early October.

Story Continued Below

While it’s early in the selection process for the job, multiple officials said that Biegun, a former auto executive who has been the point man on working-level negotiations with the North Korean regime, is a strong candidate.

Biegun, whose background before the North Korean job was in Russia policy, had also been considered to replace Huntsman and has talked to Trump about being an ambassador. He also reportedly turned down the Russia job.

“It’s good to have someone who is already in the system,” said a senior administration official. “They understand how the process goes. They already have a security clearance.” The White House didn’t immediately respond to a request for comment.

“The whole building is vying for the job,” according to another senior administration official. One of the contenders could include Brian Bulatao, the undersecretary of state for management, who was chief operating officer of the CIA when Secretary of State Mike Pompeo was CIA director, according to a former senior State Department official. Bulatao didn’t immediately respond to a request for comment.

It could take a while for Sullivan to get confirmed if and when he’s officially selected, since confirming judicial nominees is Senate Majority Leader Mitch McConnell’s priority, which leads to occasional delays for executive branch nominees. Russia also is likely to take at least two months to approve the U.S. picking Sullivan, a diplomatic protocol known as “agrément.”

POLITICO Playbook newsletter Sign up today to receive the #1-rated newsletter in politics Email Sign Up By signing up you agree to receive email newsletters or alerts from POLITICO. You can unsubscribe at any time.

Trump has resisted acknowledging that his talks with Kim Jong Un have made little headway, and has sought a third summit with the North Korean leader.

He told reporters at the G7 in France on Monday that Kim “is a man with a country that has tremendous potential.” He had said that he was “not happy” about North Korea’s recent missile tests, which his own national security adviser has said violate U.N. Security Council resolutions.

There has also been some rather public daylight between Biegun and Trump on the progress the U.S. has made in negotiating with North Korea. While Trump bragged last year that there wasn’t a nuclear threat from North Korea anymore, Biegun said earlier this year at Stanford that “it is fair to say we have more work ahead of us than behind us.”

With few signs of any coming breakthroughs with North Korea, Biegun has recently shown signs of wanting to leave his current job. He’s been telling associates he was eager to move on from the envoy post and felt it was a thankless job, according to three people familiar with his comments.

In his job as Trump’s North Korea envoy, Biegun has had difficulty getting meetings with top North Korean officials to advance U.S. goals of denuclearization.

“Not having the North Koreans meet with you and the North Koreans only want to meet with the president is pretty frustrating,” said one Republican foreign policy hand who knows Biegun. “And negotiating with the North Koreans is hopeless. They just want to meet at the presidential level so there’s no real meetings at his level.”

It’s not clear whether Biegun would actually take the deputy job if Trump offers it. He has also told people that he is tired of serving in government and is eager to return to the private sector.

The State Department, meanwhile, is fending off twin challenges: a president whose sudden pronouncements can rewrite policy in mere seconds; and a budget that is constantly under the threat of severe cuts under Trump.

“How are you supposed to come to work and to be a serious professional when you don’t know what’s coming tomorrow?” said another Republican involved in foreign policy in Washington. “Even Pompeo doesn’t know the crazy thing Trump is going to say the next day and it’s really hard to engage with people in the White House” who don’t know what Trump is going to do either.

Weighing against this chaos factor: If Biegun is picked for the deputy job, there’s a possibility he could eventually become the acting secretary of state should Pompeo leave to run for a Senate seat in his home state of Kansas.

Biegun served as executive secretary of the National Security Council in the Bush administration and also had a brief stint as foreign policy adviser to Sarah Palin when she was John McCain’s vice presidential nominee.

Before joining the Trump administration, he worked as the vice president of international governmental affairs at Ford. After H.R. McMaster left as Trump’s national security adviser, Biegun was considered for that job before John Bolton was picked.

Traditionally, the deputy secretary of state position is tasked with managing the State Department’s 69,000 employees, but also usually carves out select foreign policy portfolios of his or her own.

Sullivan, for instance, has focused on a few key issues, including implementing the sanctions against Russia, leading the administration’s diplomatic response to the gas attacks and barrel bombings in Syria, and guiding the Trump team’s efforts to stabilize South Sudan.

Trump told reporters last week that Sullivan “could very well be” picked as the ambassador to Russia and that Pompeo “likes him very much.”

As for Biegun’s suitability for the job, “It’s a really tough and challenging role but I think Steve would be really excellent at it, just because of his work ethic, his style, his intelligence,” another former senior State Department official said. “I’ve always found Steve to be fair.”

Biegun didn’t immediately respond to a request for comment.

His departure would leave the North Korea envoy role empty -- but Trump has shown few signs of leaning on Biegun in any event.

On Monday, the president said that his wife, First Lady Melania Trump, has also gotten to know Kim Jong Un. That left Stephanie Grisham, the White House press secretary, to quickly clarify Trump’s comments.

“President Trump confides in his wife on many issues including the detailed elements of his strong relationship with Chairman Kim,” she said in a statement. “And while the first lady hasn’t met him, the president feels like she’s gotten to know him too.”

Eliana Johnson contributed to this report."
Justice Department to seek death penalty against Pittsburgh synagogue shooting suspect,https://www.cnn.com,['Amir Vera'],08-26-2019,2019,8,https://www.cnn.com/2019/08/26/us/pittsburgh-synagogue-shooting-death-sentence/index.html,"(CNN) The Justice Department is planning to seek the death penalty against the suspected shooter in the Pittsburgh Tree of Life Synagogue massacre.

Robert Bowers

Federal prosecutors will seek the death penalty on charges that include obstruction of free exercise of religious beliefs resulting in death, use and discharge of a firearm to commit murder and possession of a firearm during a violent crime.

Prosecutors say their intent to seek the death penalty is justified because Bowers' anti-Semitic views played a role in the shooting, the shooting was intentional and he showed no remorse, according to a federal notice to seek the death penalty.

Bowers has been indicted on 63 federal charges, including hate crime charges, according to a superseding indictment issued in January 2019. Of the 63 charges, 22 counts carry the death penalty, a Justice Department news release in January said."
XRP Or Ethereum?,https://cryptodaily.co.uk,[],,,,https://cryptodaily.co.uk/2019/08/xrp-or-ethereum,"In terms of market capitalisation, XRP and Ethereum are very close rivals. Over the past year, the two have frequently battled it out for the second spot in the markets, becoming the second ‘biggest’ cryptocurrency on the planet in the process. Whilst this sort of market cap battle is mostly meaningless, it does bring some positive attention to XRP and Ethereum as cryptocurrencies. So, in the battle between the second and third best, which will come out on top? In order to hazard a guess at this, we need to understand the advantages and drawbacks to each cryptocurrency.

Firstly, XRP is the token native to the Ripple project. Ripple, is a blockchain company that promises to change the way remittance payments and international money transfers are made. By using blockchain technology, XRP, along with a number of technological revolutions, want to make international payments quicker and cheaper. Moreover, XRP exists as a token that can be bought, in order to buy into Ripple. XRP is unique to Ethereum in that it cannot be mined, this however does cause some issues, with many believing XRP is not a true cryptocurrency and that, because it’s owned in a majority stake by Ripple as a company, the token is a security token - something more like a traditional share in a company than a crypto.

Ethereum on the other hand, is very different, which is why it’s very interesting that this pair seem to have a direct rivalry. Ethereum is often seen as the second cryptocurrency and the first cryptocurrency that attempted to right the wrongs of Bitcoin. Like Bitcoin, Ethereum is fully decentralised and requires mining from the blockchain. Like XRP, Ethereum is a part of a wider blockchain project, though in Ethereum’s case, it’s got nothing to do with international payments. Ethereum wants to make the blockchain open source, and allows for the development of blockchain based applications, or decentralised applications that allows anyone to create and launch a cryptocurrency. Many of the world’s leading tokens where created in this way, including EOS and TRON.

So, once you understand these differences, it’s hard to know exactly which crypto will rule, frankly though, it doesn’t matter. Ethereum and XRP each have their own market and their own interests and we expect them both to excel in their own areas. Ethereum is likely to keep hold of the majority of the market cap because it has more use value, even if it doesn’t though, it’s not necessarily a bad thing, XRP is equally deserving of that second place spot too."
Weill Family Foundation announces public-private partnership with Energy Department on artificial intelligence,https://www.cnbc.com,['Riya Bhattacharjee'],08-26-2019,2019,8,https://www.cnbc.com/2019/08/26/weill-foundation-announces-public-private-partnership-with-dept-of-energy-on-artificial-intelligence.html,"The Department of Energy and the Weill Family Foundation on Monday signed a memorandum of understanding for a new public-private partnership which will use the agency's artificial intelligence capabilities for biomedical research.

Former Citigroup CEO Sandy Weill and Energy Secretary Rick Perry told CNBC's ""Closing Bell "" in an exclusive interview that the partnership aims to improve the diagnosis of brain diseases and neurological disorders, which would result in more effective treatment.

""As one looks at science and the development of new science, especially AI and computing, you really need to have partners to make things work."" Weill said. ""It's too expensive for anybody to try to do it by themselves.""

The partnership between the federal government and the Weill Family Foundation, involves Lawrence Livermore, Lawrence Berkeley and Argonne National laboratories, and was announced during a roundtable on DOE-fueled artificial intelligence at Lawrence Livermore Lab in Livermore, California.

The Department of Energy is currently home to the fastest supercomputers in the world.

The partnership aims to have new computers ready by 2022 that would run 15 times faster than current speeds.

""It will really break the logjam, especially as it related to neurodegenerative diseases,"" Weill said. ""And with everybody doing better, with the cancer research and with cardiovascular research, people are going to live longer. And we are all going to get these neurodegenerative diseases over time. And what we are working on is to prevent that because it would just be too costly.""

Perry said in the next 18 to 24 months, the department will have computers coming on board that will be between 50 to 100 times faster than today's computers. ""The improvement in health care, particularly in brain science, is going to be monumental, it's going to be world changing,"" Perry said.

Weill added it was important for the U.S. to beat China in this field.

When asked about current U.S.-China trade relations, Weill said it was important for the United States and China to figure out a way to get along with each other. ""With the two countries partnering for the future, I think we will end up with a better world, a safer world."""
State Department announces new head of policy planning,https://www.politico.com,['Eliana Johnson'],08-26-2019,2019,8,https://www.politico.com/story/2019/08/26/state-department-office-of-policy-planning-peter-berkowitz-1475732,"Peter Berkowitz came to the State Department from Stanford University’s Hoover Institution. | Mark Wilson/Getty Images Foreign Policy State Department announces new head of policy planning

The State Department on Monday announced the political scientist Peter Berkowitz as the head of policy planning, a post that puts him in charge of long-term strategic thinking for the department.

Berkowitz, who was already working in the Office of Policy Planning, will replace his former boss, Kiron Skinner, who was dismissed earlier this month over concerns about her management style.

Story Continued Below

The announcement came in an internal email to select State Department officials on Monday morning, according to one of those officials.

Berkowitz, who has taught both constitutional law and political philosophy, came to the State Department from Stanford University’s Hoover Institution. He is the author of four books on subjects ranging from conservatism and progressivism to the ethics of Nietzsche.

Under former Secretary of State Rex Tillerson, the Department of Policy Planning — which has historically operated as the State Department’s internal think tank — played a key role in the day-to-day management of the department.

Secretary of State Mike Pompeo, who works closely with a team of special envoys, has returned it to its traditional role of churning out papers and proposals on long-range strategic issues.

This article tagged under: State Department

Foreign Policy"
The President Spent the G-7 Summit Retweeting Conspiracy Theories,https://slate.com,['Ben Mathis-Lilley'],08-26-2019,2019,8,https://slate.com/news-and-politics/2019/08/trump-g7-china-twitter.html,"Donald Trump at the G-7 summit in Biarritz, France, on Sunday. Jeff J. Mitchell—Pool/Getty Images

Over the weekend and on Monday, President Donald Trump was in France for the G-7 summit, at which he was supposed to be doing things such as keeping the world economy from crashing and going to meetings about subjects like climate change.

Mostly, though, the president appeared to be self-soothing online. In one four-hour stretch on Sunday, Trump did nine consecutive reposts of tweets from the right-wing group Judicial Watch, in reverse chronological order, as if he were working his way through the feed to make himself feel better. The topics he shared included a conspiracy theory about Rep. Ilhan Omar’s personal life and various paranoid claims about the deep state, one of which featured a video involving, yes, Hillary Clinton’s emails.

What about summit business? On the economic front, Trump told reporters that his aides had been in touch with representatives of the Chinese government about working out a trade deal after the market-assaulting Friday tweet meltdown in which he’d spontaneously announced new tariffs and demanded that U.S. companies stop doing business in the country. According to the Associated Press, the president specifically said that his trade negotiation team had conducted two “very good calls” with the Chinese on Sunday. China, however, had a different take:

JUST IN: China's Foreign Ministry spokesman Geng Shuang says has no info on phone calls to U.S. cited by Trump, adding later “I can tell you clearly that I haven’t heard of such a thing”

* Says China will protect itself on trade if U.S. persists with current approach — Melissa Cheok (@mkcheok) August 26, 2019

So that’s going well. As for climate change, Trump not only missed the meeting but didn’t even know he had missed it. The Guardian:

Trump was later asked by reporters covering a meeting with the German chancellor, Angela Merkel, whether he had attended the climate session. He replied: “We’re having it in a little while.” He did not appear to hear when a reporter told him it had just taken place.

On the ball. Good.

Meanwhile, his Twitter feed testifies to what the president has been paying attention to in France. The Judicial Watch fixation was part of a Sunday/Monday spree—again, while he was supposed to be at a series of huge meetings—during which he posted or retweeted others’ posts 46 times. Some of these were pro forma PR messages that were probably put up by his staff, but others were vintage The President Is Mad at the Television material, like this zombie complaint about how well the press treated Clinton in 2016, this denial of the very plausible Axios report that he wants to drop a nuclear bomb on a hurricane, and this Obviously Fabricated Anecdote:

The question I was asked most today by fellow World Leaders, who think the USA is doing so well and is stronger than ever before, happens to be, “Mr. President, why does the American media hate your Country so much? Why are they rooting for it to fail?” — Donald J. Trump (@realDonaldTrump) August 25, 2019

Yeah, that sounds like something Shinzo Abe would say."
Justice Department takes controversial stand on transgender case at Supreme Court,https://www.washingtonexaminer.com,['Ap Photo J. Scott Applewhite'],08-26-2019,2019,8,https://www.washingtonexaminer.com/opinion/justice-department-takes-controversial-stand-on-transgender-case-at-supreme-court,"In one of the most important cases the Supreme Court will hear this fall, the Department of Justice has taken a stand, along with a number of influential people and organizations. All of them take specific, strong stances on the definition of sex and gender identity, which center around the questions both the LGBT activists, conservatives, and legal experts have been asking for some time: What is sex, who defines it, and what legal protections does it have?

In a brief filed with the Supreme Court, the Department of Justice said they believe transgender discrimination is not prohibited by Title VII of the Civil Rights Act of 1964. The Supreme Court will hear oral arguments in R.G. & G.R. Harris Funeral Homes Inc. v. Equal Employment Opportunity Commission in October to address the issue. The ACLU will argue on behalf of the transgender woman and the Equal Employment Opportunity Commission’s position, claiming the employee was fired because of her gender identity. R.G & G.R. Harris Funeral Homes maintains that the employee was fired after he transitioned from male to female because he did not wear sex-specific clothing, which is a company policy.

This particular brief is significant because the DOJ represents the Equal Employment Opportunity Commission, but their brief shows they will depart from the commission’s position that gender identity should be a protected category until Title VII’s sex discrimination clause. In the brief, the DOJ argues that Congress didn’t include transgender people and gender identity when Title VII of the 1964 Civil Rights Act was originally passed, and Congress has not passed any efforts to add gender identity to the statute. “Under this Court’s precedent, proving discrimination because of sex under Title VII requires showing that an employer treated members of one sex less favorably than similarly situated members of the other sex,” the Justice Department said in its brief.

The DOJ’s brief isn’t the only noteworthy opinion on the case. Paul McHugh is the University Distinguished Service professor of Psychiatry at the Johns Hopkins University School of Medicine and he filed an amicus brief “not to discuss statutory construction but to critically evaluate, on the basis of his clinical and scientific expertise” in support of the concept that gender identity and sex are not the same thing, which basically supports the funeral home's case. The brief reads that he “seeks to discuss the frequently heard claims about gender identity, which sometimes masquerade as science but are really ideological pronouncements not supported by scientific evidence.”

Just last week a brief was filed by a group of people who appear to have all undergone gender reassignment surgeries or transitioned to some degree, and warn others about the dangers of transitioning through hormone replacement or surgeries. In their brief, they too tackle the subject of gender identity, sex, and transitioning, rather than law. Both amicus briefs provide an insightful look into the world of those who treat or who have identified as a different gender from a cultural, rather than a legal, perspective.

This case will be to gender identity what Obergefell v. Hodges was to same-sex marriage. It will be interesting to see who else steps in to add a perspective to this controversial legal case.

Nicole Russell (@russell_nm) is a contributor to the Washington Examiner's Beltway Confidential blog. She is a journalist who previously worked in Republican politics in Minnesota."
"Corn, Soybean Ratings Move Up, USDA Says",https://www.agriculture.com,[],08-26-2019,2019,8,https://www.agriculture.com/corn-soybean-ratings-move-up-usda-says,"DES MOINES, Iowa -- The U.S. corn and soybean crop conditions improve vs. a week ago, according to the USDA’s weekly Crop Progress Report released Monday.

Corn

The overall condition of the corn crop is rated at 57% good to excellent in the top 18 corn producing states, slightly above 56% a week ago and below 68% a year ago.

The USDA pegged 71% of the corn has entered the dough stage vs. a 87% five-year average.

USDA rated the crop in the dent stage at 27% vs. 46% five-year average.

For folks keeping track at home, the National Agricultural Statistics Service (NASS) reported, Monday, that Texas farmers have harvested 45% of their corn crop vs. 52% a year ago and a 50% five-year average.

Mississippi farmers have 24% of their corn crop picked vs. 36% a year ago and a 37% five-year average. Also, Arkansas farmers have harvested 9% of their 2019 corn vs. 13% a year ago and an 18% five-year average.

Soybeans

The nation’s crop is rated 55% good/excellent compared with 53% a week ago and 66% a year ago.

Also, 94% of the soybean crop is blooming vs. a 99% five-year average.

The USDA pegged the amount of soybeans setting pods at 79%, well below a five-year average of 91%.

Wheat

Meanwhile, the U.S. spring wheat harvest is rated as 38% complete vs. a 65% five-year average."
