title, publication, authors, date, year, month, url, content
"Trump begins UK visit meeting Queen, sparring with London mayor",https://www.foxnews.com,['Judson Berger'],,,,https://www.foxnews.com/politics/trump-begins-uk-visit-meeting-queen-sparring-with-london-mayor,"President Trump mixed high-level diplomacy with schoolyard taunts as he kicked off his overseas visit meeting with Queen Elizabeth II at Buckingham Palace and later touring Westminster Abbey -- while sparring on the side with one of his biggest British critics, London Mayor Sadiq Khan.

The London itinerary is part of a packed overseas agenda that includes a state dinner at the palace and D-Day commemoration ceremonies.

At their initial visit to the palace early Monday morning, the president and first lady Melania Trump had a private lunch with the Queen, later inspecting a collection of artifacts including an 18th-century map of New York, historic photos of golf at St. Andrews and books about birds and George Washington. He then participated in a wreath-laying at the Grave of the Unknown Warrior at Westminster Abbey.

TRUMP SPARS WITH LONDON MAYOR

The visit began with formalities befitting a state visit. The Trumps were greeted by Prince Charles and his wife Camilla, the Duchess of Cornwall, at the palace. Trump could be seen chatting with members of the Guard of Honor as the rest of the American delegation, from a terrace, observed the elaborate arrival ceremony, complete with the playing of “The Star-Spangled Banner.” Royal gun salutes were fired from nearby Green Park and from the Tower of London.

Juxtaposed against that scene, however, was an opening scrap between Trump and London Mayor Khan, who penned a critical column of the president he called a ""global threat."" In the column titled, “It’s un-British to roll out the red carpet for Donald Trump,” Khan listed Trump’s most controversial policies and likened them to the actions of European dictators of the 1930s and 40s.

Before he even arrived in London, Trump fired back calling Khan the ""twin"" of New York City’s liberal Mayor Bill de Blasio “except shorter.”

Trump continued the attack Monday, calling Khan a ""stone cold loser.""

Khan's office said in response that the comment is ""much more serious than childish insults which should be beneath the President of the United States. Sadiq is representing the progressive values of London and our country warning that Donald Trump is the most egregious example of a growing far-right threat around the globe, which is putting at risk the basic values that have defined our liberal democracies for more than 70 years.""

Trump attempted to clarify that he would not let Khan dampen his trip and said he looks forward to his visit.

In another side skirmish, Trump began his visit by venting about CNN, tweeting: “Just arrived in the United Kingdom. The only problem is that @CNN is the primary source of news available from the U.S. After watching it for a short while, I turned it off. All negative & so much Fake News, very bad for U.S. Big ratings drop. Why doesn’t owner @ATT do something?”

Trump will be in the U.K. from Monday to Wednesday to commemorate the 75th anniversary of D-Day, which comes at a tumultuous time in British politics, with Prime Minister Theresa May due to step down on Friday.

The agenda for Trump's weeklong journey is mostly ceremonial: a state visit and an audience with Queen Elizabeth II in London, D-Day commemoration ceremonies on both sides of the English Channel and his first presidential visit to Ireland, which will include a stay at his coastal golf club.

CARAFANO: THIS IS TRUMP'S TOP JOB IN LONDON

But the U.S. president arrives at a precarious moment, as he faces a fresh round of impeachment fervor back home and uncertainty on the other side of the Atlantic Ocean. May has faced months of political turmoil over Brexit and French President Emmanuel Macron is expected to use the 75th anniversary of the World War II battle that turned the tide on the Western Front to call for strengthening the multinational ties the U.S. president has frayed.

A sense of deja vu quickly spread around London as Trump blasted British leaders.

A year ago, Trump also took aim at his hosts before landing on English soil, blasting May in an interview just hours she hosted him for dinner. Though he has spared May so far this time, he has praised her rival, prime ministerial hopeful Boris Johnson, just days before May steps down as Conservative leader on Friday for failing to secure a Brexit deal.

""I think Boris would do a very good job. I think he would be excellent,"" Trump told The Sun. ""I like him. I have always liked him. I don't know that he is going to be chosen, but I think he is a very good guy, a very talented person.""

It was not clear if the Trump endorsement would hurt or help Johnson's chances of becoming Britain's next leader.

After lunch with Queen Elizabeth II, Trump will be honored at an extravagant state dinner at Buckingham Palace. Demonstrators are expected, including the possible return of an inflatable balloon depicting the president as a baby.

Fox News’ Edmund DeMarche and The Associated Press contributed to this report."
"A ‘Bridge’ to China, and Her Family’s Business, in the Trump Cabinet",https://www.nytimes.com,"['Michael Forsythe', 'Eric Lipton', 'Keith Bradsher', 'Sui-Lee Wee']",06-02-2019,2019,6,https://www.nytimes.com/2019/06/02/us/politics/elaine-chao-china.html,"The Chao family’s ties to China have drawn some attention over the years. In 2001, The New Republic examined them in the context of the Republican Party’s softening tone toward the country. When Ms. Chao was nominated as transportation secretary, ProPublica and others highlighted the intersection of her new responsibilities with her family’s business. And in a book published last year, the conservative author Peter Schweizer suggested the Chaos gave Beijing undue influence.

The Times found that the Chaos had an extraordinary proximity to power in China for an American family, marked not only by board memberships in state companies, but also by multiple meetings with the country’s former top leader, including one at his villa. That makes the Chaos stand out on both sides of the Pacific, with sterling political connections going to the pinnacle of power in the world’s two biggest economies.

Ms. Chao’s father, a founder of Foremost in 1964, has for decades cultivated a close relationship with Jiang Zemin, a schoolmate from Shanghai who rose to become China’s president. As the schoolmates crossed paths again in the 1980s, the Chaos reaped dividends from a radar company linked to Mr. Jiang that targeted sales to the Chinese military, documents filed with the Chinese government show.

Though Ms. Chao’s financial disclosure statements indicate she receives no income from Foremost, she made at least four trips to China with the company in the eight years between her job as labor secretary during the George W. Bush administration and her confirmation as transportation secretary in January 2017. And her father accompanied her on at least one trip that she took as labor secretary, in 2008, sitting in on meetings, including with China’s premier, one of the country’s top officials.

Public records show that she has benefited from the company’s success. A gift to Ms. Chao and Mr. McConnell from her father in 2008 helped make Mr. McConnell, the Republican majority leader, one of the richest members of the Senate. And three decades worth of political donations have made the extended family a top contributor to the Republican Party of Kentucky, a wellspring of Mr. McConnell’s power."
Trump’s hairstyle at church service prompts speculation on social media,https://www.foxnews.com,"['Bradford Betz', 'Bradford Betz Is An Editor For Fox News. Follow Him On Twitter']",,,,https://www.foxnews.com/politics/trumps-new-hairstyle-prompts-speculation-on-social-media,"Speculation abounded Sunday after President Trump was photographed with what appeared to be a new hairstyle during a surprise visit Sunday to a Virginia church.

Trump’s slicked-back hair was a far cry from his usual look, which has been the subject of mockery in the pages of The New Yorker and ""Saturday Night Live.""

Some assumed it was simply a case of ""hat hair,"" given that Trump had just stepped off the golf course. Others speculated it may have been a makeover ahead of the president’s trip to the U.K. this week.

The White House said Trump stopped at the church to visit with the pastor and pray for the victims of Friday's deadly mass shooting in Virginia Beach.

GET THE FOX NEWS APP

The new hairstyle was short-lived. Trump spoke to reporters later in the day wearing his usual hairdo ahead of his departure for the U.K."
Jared Kushner won't comment on Trump's birtherism claim,https://www.cnn.com,[],06-03-2019,2019,6,https://www.cnn.com/videos/politics/2019/06/03/jared-kushner-trump-birtherism-comments-racist-sot-newday-vpx.cnn,"In an interview with Axios on HBO, White House senior adviser Jared Kushner deflected questions about President Trump's past birtherism claim that former President Obama was not born in the US."
"A tale of 2 invoices: Beto O'Rourke pays El Paso, which Donald Trump's campaign still owes $470,000",https://abcnews.go.com,['Abc News'],,,,https://abcnews.go.com/Politics/tale-invoices-beto-orourke-pays-el-paso-donald/story?id=63350337,"It was the best of times, it was the worst of times.

Interested in 2020 Elections? Add 2020 Elections as an interest to stay up to date on the latest 2020 Elections news, video, and analysis from ABC News. Add Interest

Actually, which it was depends on what street you stood on a chilly winter evening in El Paso, Texas.

On one side of town, raucous crowds gathered at the El Paso County Coliseum. With American flags and banners reading ""Finish the Wall"" displayed above him, President Donald Trump hailed his ""big, beautiful"" border wall as the reason for El Paso's low crime rate.

Paul Ratje/AFP/Getty Images, FILE

City of El Paso

Outside the coliseum, thousands of protesters gathered. Marching along the Rio Grande, they joined former Texas Congressman Beto O'Rourke at the Chalio Acosta Sports Center for a counter rally to celebrate El Paso's immigrant culture. It marked a clarion moment for a prospective candidate testing 2020 waters, and heralded what many expected to come -- O'Rourke's official campaign kickoff. Just a few weeks later, he held his first official campaign rally in his hometown.

The bills came due for both: Beto For America owed the city $28,630.50 for his March campaign launch; he had already paid $7,609.14 of that as a deposit. The remainder was due May 24. They paid on time -- just under the wire -- with a check dated the day prior to the deadline.

El Paso also billed Donald J. Trump for President Inc. for his ""Make America Great Again"" rally -- for nearly half a million dollars. The invoice was sent to the campaign's Fifth Avenue offices in New York on March 27. It was due April 26, and El Paso has yet to see a dime.

The exact number is $470,417.05, broken down by reimbursements owed to six departments:

Department of Aviation: $6,286.57

Fire Department: $60,630.84

Health Department: $528

Streets & Maintenance: $6,452

Sun Metro: $15,577.52

Police Department: $380,942.12

City of El Paso

A month overdue and no check in sight, El Paso sent a warning to the Trump campaign of its looming penalty -- a letter, coincidentally, sent the same day Beto's check was cut.

""Failure to pay your past due balance or to make acceptable payment arrangement within 30 days from the date of this notice (May 23) may result in your account being charged a one-time collection fee of 21 percent on your gross account receivable balance,"" the letter from El Paso's Office of the Comptroller states.

City of El Paso

That 21% would add almost $100,000 to the Trump campaign's tab, bringing the sum total to almost $570,000.

""As with any invoices we issue out, our expectation is to be paid for the services rendered,"" Robert Cortinas, El Paso's chief financial officer, told ABC News in a statement. ""The City is fiscally responsible.""

If El Paso doesn't receive payment from the Trump campaign, that money would come out of municipal revenue and the city's contingency budget -- funds used for unexpected and emergency situations, like natural disasters. Just last June, historic and deadly flooding ravaged southern Texas. Now, as tornado alley wakes up, and hurricane season looms -- that's a financial life vest no city wants to do without.

Donald J. Trump for President Inc.'s outstanding $470,417.05 is about 63% of the city's contingency budget for the year.

Susan Walsh/AP

The Trump campaign has said it doubts El Paso's accounting and has implied it's been overcharged.

""Since 2015, the Trump Campaign has held nearly 550 rallies all over the country, and this invoice is roughly 10 times the amount that a locality generally asks to be reimbursed,"" Michael Glassner, chief operating officer with the Trump Campaign, told ABC News. ""We are reviewing it.""

Campaigns failing to pay cities for their visits is not uncommon. During the 2016 election, both the Trump and Sen. Bernie Sanders' presidential campaigns were both behind in several rally payments.

Trump himself has a storied history of not paying his bills. Often boasting of his business success on the trail and touting his record as the ""Dealmaker in Chief,"" receipts and lawsuits alike reflect a long line of personal debts shifted to businesses, with the burden of multiple Chapter 11 filings falling on investors who bet on his business acumen. Thousands of contractors' lawsuits say Trump and his businesses have refused to pay them.

This time, one of the most important border cities would have to recoup the damage.

The City of El Paso tells ABC News that it will continue to reach out to see the bill is paid -- even after the books close on this fiscal year -- but if it's in vain, they'll have to absorb the difference.

Ironically, that cost would have to be eaten by the very people championed at Trump's campaign rally: El Paso police officers who are on the front lines of the president's border battle.

El Paso police officers, who partner with state and federal law enforcement including the FBI, told ABC News that they'll keep serving the public -- no matter what.

""We're doing our duties, whether it's a late call, or overtime -- we're going to respond no matter what,"" El Paso Sgt. Enrique Carrillo told ABC News. ""Budget isn't going to dictate how we handle an emergency.""

ABC News' Will Steakin contributed to this report."
Trump attacks CNN moments after arriving in London for state visit,https://www.foxnews.com,"['Liam Quinn', 'Liam Quinn Is A Senior Editor At Fox News. He Can Be Found On Twitter At']",,,,https://www.foxnews.com/politics/trump-cnn-london,"It seems as though President Trump isn’t happy with his television options in the United Kingdom.

Trump, who arrived in London on Monday for the start of a weeklong visit, launched another attack on CNN on Twitter.

“Just arrived in the United Kingdom. The only problem is that @CNN is the primary source of news available from the U.S. After watching it for a short while, I turned it off. All negative & so much Fake News, very bad for U.S. Big ratings drop. Why doesn’t owner @ATT do something?” he tweeted.

“I believe that if people stoped using or subscribing to @ATT, they would be forced to make big changes at @CNN, which is dying in the ratings anyway. It is so unfair with such bad, Fake News! Why wouldn’t they act. When the World watches @CNN, it gets a false picture of USA. Sad!”

TRUMP BEGINS UK VISIT MEETING QUEEN, SPARRING WITH LONDON MAYOR

The anti-CNN tweets capped off a busy social media morning for the president, who had earlier taken aim at London Mayor Sadiq Khan.

"".@SadiqKhan, who by all accounts has done a terrible job as Mayor of London, has been foolishly “nasty” to the visiting President of the United States, by far the most important ally of the United Kingdom. He is a stone cold loser who should focus on crime in London, not me......,” Trump tweeted.

TRUMP CALLS LONDON'S MAYOR 'THE TWIN OF DE BLASIO, EXCEPT SHORTER'

“....Kahn reminds me very much of our very dumb and incompetent Mayor of NYC, de Blasio, who has also done a terrible job - only half his height. In any event, I look forward to being a great friend to the United Kingdom, and am looking very much forward to my visit. Landing now!”

Bill de Blasio is 6'5. Khan is 5'6.

Khan recently said Trump was not in the “same class” as his predecessors. Prior to Trump’s visit, Khan wrote a column titled, “It’s un-British to roll out the red carpet for Donald Trump.”

Khan pointed out Trump’s most controversial policy initiatives and likened them to the actions of European dictators of the 1930s and 40s.

“Donald Trump is just one of the most egregious examples of a growing global threat,” Khan wrote. “The far right is on the rise around the world, threatening our hard-won rights and freedoms and the values that have defined our liberal, democratic societies for more than seventy years.”"
Alphabet shares tank 6% as Justice Department reportedly prepares for Google antitrust probe,https://www.cnbc.com,['Fred Imbert'],06-03-2019,2019,6,https://www.cnbc.com/2019/06/03/alphabet-shares-drop-as-justice-department-reportedly-prepares-for-google-antitrust-probe.html,"Alphabet shares tanked on Monday after a report said the Justice Department is readying an antitrust investigation against Google.

Shares dropped 6% on Monday.

The probe would look into Google's search practices and other businesses, The Wall Street Journal reported Friday. Citing sources, the report said third-party critics of Google have been in contact with the department on the matter. It was not clear whether the company had been contacted by DOJ.

Alphabet declined to comment.

The news comes as public debate on whether big technology companies should be broken up. Presidential candidate Sen. Elizabeth Warren, D-Mass., said in a March post that she wants to name regulators to undo ""anti-competitive mergers."" Such mergers include Google's deals with smaller companies like Nest and Waze.

An investigation could also bring trouble to investors, Evercore ISI analyst Kevin Rippey said in a note Monday.

""The investigation comes at a time when the stock's bull case is challenged by concerns of an abrupt revenue slowdown last quarter,"" Rippey wrote. ""GOOGL has successfully navigated an antitrust investigation before (2011-2013), and emerged unscathed after a two year inquiry, as the FTC voted 5-0 not to pursue further action. That said, Android and the Play Store have not been pressure tested in a precedent US-led investigation, adding to the complexity of assessing the spectrum of outcomes.""

""While precedent suggests that Google enjoys broad discretion over the direction of search results, the questions arising from an investigation will challenge the possibility of multiple expansion,"" added Rippey, who also trimmed his price target on Alphabet to $1,200 per share from $1,250.

Alphabet's Class A shares were trading at $1,040.58 on Monday.

—CNBC's Michael Bloom contributed to this report.

Subscribe to CNBC on YouTube."
