Justice Department says FDA ‘lacks jurisdiction’ over death-penalty drugs,https://www.washingtonpost.com,"['Laurie Mcginley', 'Reporter Covering Health', 'Mark Berman', 'National News Reporter', 'May At Pm', 'Laurie Mcginley Covers Health', 'Medicine For The Washington Post. She Focuses On The Food', 'Drug Administration As Well As Cancer Research', ""Treatment. She Was Previously The Post'S Health"", 'Science']",05-14-2019,2019,5,https://www.washingtonpost.com/national/health-science/justice-department-says-fda-lacks-jurisdiction-over-death-penalty-drugs/2019/05/14/da056e6c-764d-11e9-b7ae-390de4259661_story.html,"The Justice Department says in a new legal opinion that the Food and Drug Administration does not have authority over drugs used in lethal injections, a stance sure to be challenged by death-penalty opponents.

The department’s Office of Legal Counsel said that “articles intended for use in capital punishment by a state or the federal government cannot be regulated as ‘drugs’ or ‘devices.’ ”

The legal opinion, issued this month, comes as states have struggled in recent years to obtain drugs for lethal injections, which remain the country’s primary method of execution even as the number of executions has declined.

In 2015, the FDA blocked Texas from importing shipments of an anesthetic from an overseas distributor, finalizing the decision two years later. The agency argued the importation was illegal because the drug, sodium thiopental, was not approved in the United States and was improperly labeled. It also cited a 2012 federal injunction barring the agency from allowing the drug’s importation.

Texas responded to the FDA’s move by suing the agency in early 2017, claiming the agency was interfering with the state’s responsibility to carry out its law enforcement duties. The lawsuit was filed shortly before President Trump took office. Trump has long been a supporter of capital punishment. while his Senate-confirmed attorneys general — Jeff Sessions, who left the post last year, and William P. Barr, who assumed the job this year — have also backed the practice.

The legal opinion from the Justice Department this month sides against the FDA and with Texas. It says that drugs intended for executions are different from any others, noting that “they exclusively inflict harm” and “are not intended to produce any benefit for the end user.” It expressly highlights “the narrowness of our conclusion,” saying that it does not address whether the FDA “has jurisdiction over drugs intended for use in physician-assisted suicide.”

But it also takes a broad view of the issues at hand, arguing that if the FDA had jurisdiction over drugs meant for executions, it would have similar power over other areas — such as firearms — which the agency has not sought to regulate.

The Justice Department’s opinion is unlikely to have any immediate effect, however, because the FDA is still operating under the 2012 injunction. It is not clear whether the Justice Department will seek to have that injunction lifted, a move that could spark a long legal tussle.

The opinion seems aimed at “giving a green light” to corrections officials to look abroad for drugs needed for executions, said Deborah Denno, a law professor at Fordham University and a death-penalty expert.

“I think this has very broad ramifications, unfortunately,” Denno said in an interview. “This is intended to allow departments of corrections to access drugs outside the country because they’re having so much difficulty doing so.”

While European companies have objected to their products being used in executions, corrections officials could have more luck turning to countries such as China or India, Denno said. “It has the potential to open the floodgates,” she said.

The Texas attorney general’s office didn’t immediately respond to a request for comment.

The legal opinion was issued after a protracted battle between the FDA and the Justice Department over the regulation of lethal injection drugs.

More than a year ago, then-FDA Commissioner Scott Gottlieb and then-Attorney General Jeff Sessions had a heated argument in the White House Situation Room, according to people with knowledge of the matter.

Sessions wanted the FDA to allow drugs used for executions to enter the country without undergoing agency scrutiny. Gottlieb refused, saying that such a move could undermine the agency’s authority. Gottlieb left the agency in April, six months after Sessions left the Justice Department. Both Sessions and Gottlieb declined to comment.

States’ difficulties in obtaining lethal injection drugs stem from drug companies’ objections to having their products used in executions.

For many years, states relied on a combination of three drugs to carry out death sentences: an anesthetic, such as sodium thiopental; a paralytic; and a product meant to stop inmates’ hearts. But Hospira, maker of sodium thiopental, said in 2011 that it would stop manufacturing the product, a decision the company attributed to its use in executions.

In the years that followed, states began turning to new combinations and execution protocols. Nebraska last year became the first state to use fentanyl in an execution, combining it with three other drugs to execute an inmate convicted of killing two Omaha cabdrivers. Other states debated or adopted options including nitrogen gas and firing squads.

The FDA, in defending its efforts to block states from importing unapproved sodium thiopental has cited the 2012 injunction relating to the drug.

That ruling came after death-row inmates filed a lawsuit against the Obama administration, saying the FDA was acting unlawfully by exercising “enforcement discretion” to allow states to import unapproved sodium thiopental from an unregistered foreign facility.

Despite the 2012 order, however, states continued to order sodium thiopental from overseas. BuzzFeed News found that at least three states — Nebraska, Texas and Arizona — had tried to import drugs from a supplier in India despite getting warnings from the FDA in 2015.

The Texas lawsuit, filed in the waning days of the Obama administration, says the state alerted federal officials in June 2015 that its Department of Criminal Justice — which is responsible for the state’s executions — planned to “import thiopental sodium intended for law enforcement purposes.”

The lawsuit said the state’s “foreign distributor” shipped 1,000 vials of the drug to Houston in late July 2015, and not long after, the drugs were impounded. According to the FDA, the agency also impounded a shipment intended for Arizona that same year.

Texas officials said they had obtained the drugs legally and referred to the government’s actions as an “unjustified seizure.”

In April 2017, the FDA wrote a letter to Texas authorities saying that the agency could not admit the drugs.

Texas quickly filed an amended complaint, but in December, 2017, a federal judge in Texas stayed the case and later denied a motion to lift it.

The case remains stayed. A status conference had been scheduled for September 2018, but the Trump administration asked for a 90-day continuance and for the case to remain stayed, adding that Texas officials did not oppose that motion. The Trump administration wrote in that motion that the federal government had “internal deliberations” that could resolve the lawsuit in a way “that could allow this case to be resolved without additional litigation,” although it did not provide further details.

Matt Zapotosky contributed to this report."
"DiGenova: Comey, Clapper and Brennan will have to pay the 'Barr bill'",https://www.youtube.com,[],,,,https://www.youtube.com/watch?v=opmrky-jhFw,"Published on May 14, 2019

Barr taps U.S. attorney to investigate Russia probe origins; reaction and analysis from Joe DiGenova, Rep. Jim Jordan and Robert Ray on 'The Ingraham Angle.'



FOX News operates the FOX News Channel (FNC), FOX Business Network (FBN), FOX News Radio, FOX News Headlines 24/7, FOXNews.com and the direct-to-consumer streaming service, FOX Nation. FOX News also produces FOX News Sunday on FOX Broadcasting Company and FOX News Edge. A top five-cable network, FNC has been the most watched news channel in the country for 17 consecutive years. According to a 2018 Research Intelligencer study by Brand Keys, FOX News ranks as the second most trusted television brand in the country. Additionally, a Suffolk University/USA Today survey states Fox News is the most trusted source for television news or commentary in the country, while a 2017 Gallup/Knight Foundation survey found that among Americans who could name an objective news source, FOX News is the top-cited outlet. FNC is available in nearly 90 million homes and dominates the cable news landscape while routinely notching the top ten programs in the genre.



Subscribe to Fox News! https://bit.ly/2vBUvAS

Watch more Fox News Video: http://video.foxnews.com

Watch Fox News Channel Live: http://www.foxnewsgo.com/



Watch full episodes of your favorite shows

The Five: http://video.foxnews.com/playlist/lon...

Special Report with Bret Baier: http://video.foxnews.com/playlist/lon...

The Story with Martha Maccallum: http://video.foxnews.com/playlist/lon...

Tucker Carlson Tonight: http://video.foxnews.com/playlist/lon...

Hannity: http://video.foxnews.com/playlist/lon...

The Ingraham Angle: http://video.foxnews.com/playlist/lon...

Fox News @ Night: http://video.foxnews.com/playlist/lon...



Follow Fox News on Facebook: https://www.facebook.com/FoxNews/

Follow Fox News on Twitter: https://twitter.com/FoxNews/

Follow Fox News on Instagram: https://www.instagram.com/foxnews/"
State Department orders staff to leave Iraq amid Iran concerns,https://www.youtube.com,[],,,,https://www.youtube.com/watch?v=Tg-lhOLHrT4,"Published on May 15, 2019

The Iranian government claims the U.S. is trying to raise tensions in the Middle East as the U.S. State Departmenr orders non-essential staff to leave ; Rich Edson reports. #AmericasNewsroom #FoxNews



FOX News operates the FOX News Channel (FNC), FOX Business Network (FBN), FOX News Radio, FOX News Headlines 24/7, FOXNews.com and the direct-to-consumer streaming service, FOX Nation. FOX News also produces FOX News Sunday on FOX Broadcasting Company and FOX News Edge. A top five-cable network, FNC has been the most watched news channel in the country for 17 consecutive years. According to a 2018 Research Intelligencer study by Brand Keys, FOX News ranks as the second most trusted television brand in the country. Additionally, a Suffolk University/USA Today survey states Fox News is the most trusted source for television news or commentary in the country, while a 2017 Gallup/Knight Foundation survey found that among Americans who could name an objective news source, FOX News is the top-cited outlet. FNC is available in nearly 90 million homes and dominates the cable news landscape while routinely notching the top ten programs in the genre.



Subscribe to Fox News! https://bit.ly/2vBUvAS

Watch more Fox News Video: http://video.foxnews.com

Watch Fox News Channel Live: http://www.foxnewsgo.com/



Watch full episodes of your favorite shows

The Five: http://video.foxnews.com/playlist/lon...

Special Report with Bret Baier: http://video.foxnews.com/playlist/lon...

The Story with Martha Maccallum: http://video.foxnews.com/playlist/lon...

Tucker Carlson Tonight: http://video.foxnews.com/playlist/lon...

Hannity: http://video.foxnews.com/playlist/lon...

The Ingraham Angle: http://video.foxnews.com/playlist/lon...

Fox News @ Night: http://video.foxnews.com/playlist/lon...



Follow Fox News on Facebook: https://www.facebook.com/FoxNews/

Follow Fox News on Twitter: https://twitter.com/FoxNews/

Follow Fox News on Instagram: https://www.instagram.com/foxnews/"
The historic battle between Congress and White House,https://thehill.com,[],05-15-2019,2019,5,https://thehill.com/opinion/white-house/443845-the-historic-battle-between-congress-and-white-house,"Each end of Pennsylvania Avenue is ready for a heated battle over the constitutional role of Congress and its oversight of the executive branch. The White House has vowed to fight subpoenas, and House Democrats have already held Attorney General William Barr William Pelham BarrThe Hill's Morning Report - Presented by Pass USMCA Coalition - After GOP infighting, Trump Jr. agrees to testify again Barr throws curveball into Senate GOP 'spying' probe Justice Dept. says FDA lacks jurisdiction to regulate drugs in executions MORE in contempt. Even with little hope of convincing Senate Republicans to vote for removal of President Trump Donald John TrumpCollins votes against Trump judicial pick Hillicon Valley: Trump signs order to protect US networks from Chinese tech | Huawei downplays order | Trump declines to join effort against online extremism | Facebook restricts livestreaming | FCC proposes new tool against robocalls Senate confirms controversial 9th Circuit pick without blue slips MORE from office, talk of impeachment grows, even from leaders in Congress who were once rather wary of such an approach.

At stake in this struggle is one of the most fundamental aspects of our democratic government, which is that Congress indeed has the authority to exercise legislative oversight over the executive branch. While it is not explicitly defined in the text of the Constitution, the principle of legislative oversight has been repeatedly affirmed by the courts as a necessary tool for Congress to carry out its enumerated responsibilities ranging from the power of the purse, to war powers, to broad authority to make laws. In this era of hyperpartisan politics, this fundamental balance lies in danger.

ADVERTISEMENT

With a White House that relishes conflict and attempts to paint the Democrats with the brushstroke of legislative overreach, the strategy seems to be working. Buoyed by strong economic performance, the approval rating of the president has ticked up. The Republican base remains firmly behind Trump, and there is hope the clock stays ticking until 2020. If House Democrats go ahead with impeachment, there is the chance that it will backfire, just as it did during the impeachment of President Clinton. While disturbing in its details of Russian interference, most headlines about the report by special counsel Robert Mueller Robert (Bob) Swan MuellerSasse: US should applaud choice of Mueller to lead Russia probe MORE have led the public to believe that Trump has not committed any crimes.

However, there is also the example of Watergate. There is historical data that shows how impeachment hearings and the uncovering of executive criminality created a loud drumbeat that cratered the approval rating of President Nixon and led greater numbers of Americans to call for his removal from office. Stonewalling Congress also serves to keep possible details of Russian interference, family business mismanagement, and obstruction of justice out of the headlines before the election next year.

In the era of stark political tribalism today, it is clear that the institutional interests of Congress are trumped by partisanship. It is telling that the Senate Intelligence Committee subpoena to Donald Trump Jr. came from Republican Senator Richard Burr, who will not be running for reelection. Still, the long memory of our digital era has many of us remembering the forceful statement by Republican Senator Marc Rubio about oversight of former Attorney General Eric Holder and the “Fast and Furious” scandal, and the impassioned defense by Republican Senator Lindsey Graham of legislative subpoena powers during the Clinton impeachment process.

Thus, we are reminded that no party has a permanent hold on Congress or the White House. In historical circumstances, the courts resolved these impasses. In United States versus Richard Nixon, the Supreme Court ruled unanimously that there were limits to executive privilege. In a far more politicized judiciary, will these precedents be respected? Those reading the tea leaves will observe how the successful appointment of Associate Justice Brett Kavanaugh and the institutionalist priorities of Chief Justice Roberts might upend or reaffirm such precedents. If the courts were to curtail legislative oversight or expand executive privilege, then Congress would have little more than its power of the purse to check the president.

Legislative oversight exists so that we have a country governed by checks and balances and the rule of law. At best, Congress would continue its decline towards a partisan parliament where party affiliation, rather than institutional prerogative, rules the day. At worse, if Congress can do little more than leave the government unfunded and shut down to check an unaccountable president, then the United States will have emulated the tin pot dictatorships and banana republics that we have long decried.

Ultimately, with no sign of this conflict abating inside Washington, the answer will come from ballot boxes around the country. The results of the 2018 midterms showed that the American people wanted a legislative check on the president. If this oversight battle remains unresolved in 2020, then it will be up to the American people to decide whether our government endures the way it was meant to under the Constitution.

Dan Mahaffee is senior vice president and the director of policy at the Center for the Study of the Presidency and Congress in Washington."
Treasury Secretary Steve Mnuchin says battle over President Turmp's tax returns could go to court,https://abcnews.go.com,['Abc News'],,,,https://abcnews.go.com/Politics/treasury-secretary-steve-mnuchin-battle-president-turmps-tax/story?id=63050172,"Treasury Secretary Steven Mnuchin on Wednesday accused congressional Democrats of ""weaponizing the IRS"" by trying to obtain President Donald Trump's tax returns and suggested the battle may ultimately have to be decided by the courts.

Interested in Donald Trump? Add Donald Trump as an interest to stay up to date on the latest Donald Trump news, video, and analysis from ABC News. Add Interest

“Mr. Secretary, doesn’t Congress as a separate branch of government have a legitimate interest in determining whether or not the IRS is enforcing tax laws with respect to the President of the United States?"" Sen. Chris Van Hollen, a Maryland Democrat, asked Mnuchin at a Capitol Hill hearing. He was referring to the law that requires the IRS to audit every president's tax returns.

Mnuchin responded: ""Mr. Senator, I want to be respectful in answering this and I’m not trying to avoid your question, but the answer is that there is a difference in interpretation between Congress and us and the Department of Justice around this law that not only impacts the president and this Congress but has a very big impact on every single taxpayer in weaponizing the IRS.""

""And this is why there are three branches of government so if there is a difference of opinion, this will go to the third branch of government to be resolved,"" he said.

Mnuchin was testifying before a Senate Appropriations subcommittee just two days ahead of Friday's deadline set by the Rep. Richard Neal, the Democratic chairman of the House Ways and Means Committee, for Mnuchin and IRS Commissioner Charles Rettig to respond to a subpoena for six years of the president's tax returns. The request came after Mnuchin rejected an earlier request by Neal.

""First of all, we haven't made a decision, but I think you can guess which way we are leaning on our subpoena,"" Mnuchin said. ""To the extent that we don't and there is litigation, I take great comfort that there's a third branch of government to deal with this important issue.""

Patrick Semansky/AP

The president’s lawyers and White House are expected to challenge the move and have argued that Democrats’ request does not serve a legitimate legislative purpose, an argument the administration made in its rejection of the Democrats’ initial request.

The committee chairman, Sen. John Kennedy, R-La., pushed back against Van Hollen's line of questioning regarding Trump's tax returns by laying out a scenario where a member of Congress could try to obtain anyone's returns.

""How about you send me all the tax returns from every candidate among my Democratic friends running for the president of the United States? Now, I'm not interested in it for political reasons, I just want to study the IRS and I think I'll start with these returns. How much confidence do you think the American people will have in the internal revenue service and the privacy concerns if we start doing that in this country?"" Kennedy said.

Mnuchin said he thought that ""would be very dangerous.""

""I think it would also be very dangerous to provide you with returns of large Democrats or Republicans who made political gifts, or leaders of industry, or leaders of labor unions,"" Mnuchin said."
"Homeland Security to allow border wall to go through national monument, wildlife refuge",https://www.cbsnews.com,[],,,,https://www.cbsnews.com/news/homeland-security-to-allow-border-wall-to-go-through-national-monument-wildlife-refuge/,"The U.S. government plans on replacing barriers through 100 miles of the southern border in California and Arizona, including through a national monument and a wildlife refuge, according to documents and environmental advocates.

The Department of Homeland Security on Tuesday again waived environmental and dozens of other laws to build more barriers along the U.S.-Mexico border.

Funding will come from the Defense Department following the emergency declaration that President Donald Trump signed this year after Congress refused to approve the amount of border wall funding he requested.

Barriers will go up at Organ Pipe Cactus National Monument, a vast park named after the unique cactus breed that decorates it, and Cabeza Prieta National Wildlife Refuge, which is largely a designed wilderness home to 275 wildlife species. The government will also build new roads and lighting in those areas in Arizona.

Environmental advocates who have sued to stop the construction of the wall say this latest plan will be detrimental to the wildlife and habitat in those areas.

""The Trump administration just ignored bedrock environmental and public health laws to plow a disastrous border wall through protected, spectacular wildlands,"" said Laiken Jordahl, who works on border issues at the Center for Biological Diversity.

The Department of Homeland Security did not immediately respond to a request for comment but has typically not said much about construction plans.

At Organ Pipe Cactus National Monument, row after row of cactuses decorate 516 square miles of land that once saw so much drug smuggling that over half the park was closed to the public. But illegal crossings in that area dropped off significantly in the past several years, and the government in 2015 reopened the entire monument for the first time in 12 years.

While Arizona has seen an increase in border crossers over the last year, most are families who turn themselves in to Border Patrol agents. The number of drugs that agents seize in the state has also dropped significantly.

But the government is moving forward with more border infrastructure.

The waivers the department issued Tuesday are vague in their description of where and how many miles of fencing will be installed. The Center for Biological Diversity says the plans total about 100 miles of southern border in both Arizona and California, near Calexico and Tecate.

In Arizona, construction will focus on four areas of the border and will include the replacement of waist-high fencing meant to stop cars with 18- to 30-foot barriers that will be more efficient at stopping illegal crossings.

The government has already demolished refuge land in the Rio Grande Valley of Texas and construction is set to begin any day. On one section of the Lower Rio Grande Valley National Wildlife Refuge, crews have used heavy construction equipment to destroy a mix of trees, including mesquite, mulberry and hackberry. Those trees protect birds during the ongoing nesting season.

According to plans published last year, the cleared land will be filled in and a concrete wall will be installed, with bollards measuring 18 feet installed on top.

After months of public outcry, Congress forbade U.S. Customs and Border Protection from building in the nearby Santa Ana wildlife refuge or the nonprofit National Butterfly Center. But it didn't stop money from going to wall construction in other refuge lands, nor did it stop the government from building in otherwise exempted land due to the emergency declaration, said Marianna Trevino Wright, the butterfly center's director.

""They're going to have to protect us in every single spending bill going forward, and they have to protect us against the state of emergency,"" Wright said. ""And this administration has made it clear ... that they don't want any exemptions."""
