"Controversial agency relocation slammed as attack on science by lawmakers, employees",https://thinkprogress.org,[],,,,https://thinkprogress.org/agriculture-usda-blm-move-dc-climate-trump-protests-science-e8e534ec12fc/,"Employees and Democratic lawmakers are pushing back on the Trump administration’s plans to relocate hundreds of positions within two agencies outside of Washington, D.C. — a move some see as an effort to clamp down on science.

While the planned moves of both the Interior Department’s Bureau of Land Management (BLM) and parts of the Department of Agriculture (USDA) differ in their scope and rationale, resistance to both plans has shaped up similarly.

Critics are expressing concern over the motivations behind the efforts, which would lead to a mass-exodus of agency experts unwilling to relocate. This would spur a science brain drain in line with President Donald Trump’s crackdown on reports and research from within his own government.

“These decisions… are meant to displace seasoned scientists and regulators who have honorably served Republican and Democratic Administrations alike,” said Sen. Chris Van Hollen (D-MD) in a statement to ThinkProgress responding to both the BLM and USDA relocation plans. Van Hollen sits on the Interior and Environment Appropriations subcommittee.

Advertisement

Responsible for administering public lands, BLM has become a battleground under the Trump administration as the White House has rolled back the boundaries of national monuments and advocated for fossil fuel drilling on U.S. acreage.

Now, the bureau is sparking controversy again. Administration officials confirmed this week that the overwhelming majority of BLM positions in D.C. are set for relocation. Around 84% of BLM staffers will be asked to relocate by the end of next year to areas outside of the nation’s capital, mostly to western states.

That announcement comes a month after Secretary Sonny Perdue mandated that over 500 USDA employees move en masse to Kansas City — located in both Missouri and Kansas — by Sept. 30, and gave them a deadline of July 15 to respond.

In the case of BLM, the Interior Department (DOI) plans to concentrate many of the positions in Grand Junction, Colorado, in addition to a range of western states stretching from Arizona to Alaska. Joe Balash, DOI assistant secretary for land and minerals, called the decision “demonstrably cost-effective” in a July 16 letter to Sen. Tom Udall (D-NM), ranking member of the Senate Appropriations subcommittee on Interior and Environment.

Advertisement

The Trump administration argues that the move would both cut expenses and shift workers closer to the public lands they focus on, an argument supported by many Republicans including Rep. Rob Bishop (R-UT), who sits on the Natural Resources Committee.

But Democrats immediately raised objections. Udall said he had “serious reservations” about the move, as did his subcommittee counterpart in the House, Rep. Betty McCollum (D-MN). Democrats in both chambers of Congress indicated this week that they feel the plan is largely an effort to push out the D.C.-based senior staff who do not want to relocate.

Many of those employees are experts in their field, including scientists. “It’s a way for them to get rid of a lot of professional staff here in Washington,” said Rep. Jared Huffman (D-CA) in a statement.

Many BLM employees are already located in other parts of the country and support for moving the bureau has been somewhat bipartisan over the years. But the latest push for relocation by the Trump administration coincides with a heated clash between USDA and its employees.

Given until this past Monday to make their decision, scores of USDA workers have opted out of moving. Of the employees with the USDA’s Economic Research Service (ERS) and the National Institute of Food and Agriculture (NIFA), more than half declined to relocate, according to Politico.

Advertisement

ERS workers in particular argued that the move would disrupt their work and efforts to publish important scientific reports. NIFA, meanwhile, is responsible for grant funding that touches climate, economic, and agricultural work that uses D.C. as a home base.

Many USDA employees have also argued that the move is politically motivated. ERS has recently released reports critical of Trump’s escalating trade war with China and its impact on farmers.

Experts also worry the move is a warning shot with implications for climate science. An investigation by Politico last month found that USDA has repeatedly sought to bury studies showing the danger of climate change. That report noted that some scientists see the ERS move as a foreshadowing of wider repercussions for research that doesn’t align with the administration’s broader “energy dominance” agenda.

USDA workers have fought through their union, the American Federation of Government Employees (AFGE), to dispute the move, but the department has rejected those efforts. Moreover, there is concern that other departments could face similar moves, like the U.S. Fish and Wildlife Service and the U.S. Geological Survey, both of which are under DOI’s jurisdiction.

But Democrats asserted that they are looking into measures to combat the relocations, emphasizing that the move could be costly to taxpayers in addition to dramatically shifting the wealth of knowledge offered by current government staffers.

Lawmakers indicated they might seek to halt the relocation by blocking its funding in the upcoming appropriations bill that covers both the DOI and the Environmental Protection Agency (EPA). A group of senators, including Van Hollen, have meanwhile introduced legislation to keep ERS and NIFA in the D.C. metro area, a move that was made before the BLM move was announced.

“This Administration is acting to undermine the subject-matter experts at many of our federal agencies,” said Van Hollen, who added that his office would “continue to use every tool available to push back against these actions.”

This article has been updated to note that only USDA would be impacted by the Senate legislation due to timing."
U.S. Treasury sanctions Hezbollah operative over 1994 Buenos Aires attack,https://www.reuters.com,"['Reuters Editorial', 'Min Read']",07-19-2019,2019,7,https://www.reuters.com/article/us-usa-sanctions-hezbollah/u-s-treasury-sanctions-hezbollah-operative-over-1994-buenos-aires-attack-idUSKCN1UE1OF,"WASHINGTON (Reuters) - The United States on Friday imposed sanctions on a senior Hezbollah operative it said coordinated the 1994 bombing of a Jewish community center in Argentina’s capital Buenos Aires, in which 85 people died..

In a statement, the State Department also offered a $7 million reward for information on the whereabouts of Salman Raouf Salman, also known as Samuel Salman El Reda, who it said helped plan and carry out the attack in Argentina.

A U.S. administration officials said they believed Salman was in the Middle East.

The announcement follows the arrival of U.S. Secretary of State Mike Pompeo in Buenos Aires for a regional security conference. During his visit, Pompeo will highlight the risks posed by Hezbollah, U.S. officials said. The Iran-backed, heavily armed Shi’ite group is part of Lebanon’s coalition government.

Argentinian authorities on Thursday designated Hezbollah, which it blames for the attack on the Jewish community center and an attack on the Israeli embassy in Buenos Aires in 1992 that killed 29 people.

“We are targeting Salman Raouf Salman, who coordinated a devastating attack in Buenos Aires, Argentina against the largest Jewish center in South America 25 years ago and has directed terrorist operations in the Western Hemisphere for Hezbollah ever since,” said Sigal Mandelker, the U.S. Treasury’s under secretary for terrorism and financial intelligence.

The sanctions will freeze any assets belonging to Salman in the United States and prohibits U.S. citizens from dealing with him."
DOJ: Antitrust ruling against Qualcomm could ‘put our nation’s security at risk’,https://www.cnet.com,['Shara Tibken'],07-16-2019,2019,7,https://www.cnet.com/news/doj-says-antitrust-ruling-against-qualcomm-could-put-our-nations-security-at-risk/,"Stephen Shankland/CNET

The US Justice Department is weighing in on Qualcomm's appeal of a ruling that declared the chip giant to be a monopoly. And the government's citing national security and 5G leadership as reasons for an appeals court to let Qualcomm delay renegotiating its licensing contracts.

The Justice Department on Tuesday filed an amicus brief with the US Court of Appeals for the Ninth Circuit, asking the judges to grant Qualcomm a reprieve. The filing followed a request by Qualcomm last week that the appeals court grant a stay in remedies ordered by US District Court Judge Lucy Koh in May after she declared the wireless chip provider to be a monopoly.

At the time, Qualcomm said carrying out the remedies -- before the case went through the appeals process -- would be irreversible and would change its business model. The reforms included renegotiating licensing agreements previously reached with handset makers like LG, licensing wireless patents to rival chip makers and submitting to monitoring by the Federal Trade Commission. Qualcomm wanted the injunctions to be put on hold while the case made its way through the appeals process.

Now playing: Watch this: Powerful chipmaker Qualcomm is just too powerful, judge...

The Justice Department on Tuesday sided with Qualcomm, as did the US Department of Energy CIO Max Everett and Ellen Lord, the under secretary of defense for acquisition and sustainment. They cited 5G and national security as reasons for granting Qualcomm's reprieve. The Justice Department also said Qualcomm will likely win an appeal that will overturn the May ruling. The group said Judge Koh ""misapplied Supreme Court precedent,"" and the ordered remedy is ""unprecedented.""

""The district court's ruling threatens competition, innovation and national security,"" the Justice Department said. ""Immediate implementation of the remedy could put our nation's security at risk, potentially undermining US leadership in 5G technology and standard-setting, which is vital to military readiness and other critical national interests.""

Everett said the Department of Energy ""believes that any remedy that causes undue financial strain on Qualcomm may result in undermining Qualcomm's position in the growing 5G market (among other telecommunications markets) and ceding to foreign entities, in particular China, a dominant position in the development and expansion of 5G technology."" He noted that Qualcomm plays a key role in US telecom infrastructure and supply chain, and its competitive position ""is critically important to the Department of Energy.""

And Lord of the Defense Department said that the department ""firmly believes that any measure that inappropriately limits Qualcomm's technological leadership, ability to invest in research and development (R&D), and market competitiveness, even in the short-term, could harm national security. The risks to national security include the disruption of DOD's supply chain and unsure US leadership in 5G.""

She added that the Defense Department believes Qualcomm is the market leader in wireless chips because of its expertise and R&D expenditure and that Qualcomm holds important Defense Department security clearance and contracts.

""A hobbled Qualcomm, without the ability to make significant investments in R&D, presents a serious threat to DOD's extensive networks, advanced telecommunications systems, and ultimately its ability to control the battlespace,"" Lord said.

This isn't the first time parts of the US government have jumped to Qualcomm's defense, even though it was a US government agency -- the FTC -- that brought the antitrust lawsuit against Qualcomm two years ago.

President Donald Trump a year ago blocked Broadcom's proposed $117 billion acquisition of Qualcomm, saying the deal threatened to ""impair the national security"" of the US. Then in May, before Koh issued her ruling, the Justice Department asked for a hearing on Qualcomm's possible punishment if a California judge agreed with the FTC. The Justice Department said the court should carefully consider what remedy to carry out because it's worried about the US' position in the race to 5G.

Qualcomm and the FTC declined to comment.

Monopoly battle

Two years ago, the FTC accused Qualcomm of operating a monopoly in wireless chips. The FTC said Qualcomm forced customers like Apple to work exclusively with it and charged ""excessive"" licensing fees for its technology, in part by wielding a ""no license, no chips"" policy. Qualcomm's practices prevented rivals from entering the market, drove up the cost of phones and in turn hurt consumers, who faced higher handset prices, the FTC said.

Qualcomm argued the FTC's lawsuit was based on ""flawed legal theory"" and that customers choose its chips because they're the best. It also argued that competition is fierce in the mobile chip market and that Qualcomm never stopped providing processors to customers, even when they'd been arguing over licenses.

The parties faced off in an 11-day trial in January. In May, Koh ruled in the FTC's favor, saying Qualcomm was a monopoly that illegally hurt competitors in the wireless chip market. The ruling, which came four months after the trial ended, said Qualcomm must change how it does business and renegotiate license deals with its customers. To hold the company accountable, the court said Qualcomm must also submit compliance and monitoring reports for the next seven years and report to the FTC on an annual basis.

""Qualcomm's licensing practices have strangled competition in the CDMA and premium LTE modem chip markets for years, and harmed rivals, OEMs, and end consumers in the process,"" Koh wrote in her ruling in May.

The ruling came as a surprise to Qualcomm and others in the mobile market. For Qualcomm, the verdict called into question the company's entire business model. While it sells processors that connect devices to mobile networks, it also generates a significant percentage of its revenue from licensing. If it can't collect royalties based on the value of a handset -- which it had done in the past -- it will generate less money and may have to rethink its model entirely. Even though it's appealing the ruling, Qualcomm's licensees likely will try to alter their contracts.

Koh, in her ruling, said Qualcomm can't force a customer to sign a license before it'll supply that company with chips. It ""must negotiate or renegotiate license terms with customers in good faith under conditions free from the threat of lack of access to or discriminatory provision of modem chip supply or associated technical support or access to software.""

Though Qualcomm likely won't have to renegotiate its new agreement with Apple -- the two settled their long-running licensing and patent disputes during opening arguments in a May trial -- it'll have to offer other customers the chance to change their terms.

Qualcomm's appeal

Qualcomm filed a motion last week with the US Appeals Court for the Ninth Circuit, asking the court to grant a stay because carrying out the actions would ""fundamentally change the way it has done business for decades."" If the appeals court ultimately finds in Qualcomm's favor, the chip giant said, the company won't be able to undo the changes it's made. Qualcomm also filed a request for an expedited briefing and hearing for the appeal.

""This court has repeatedly found that a stay is warranted when -- as here -- an injunction imposes changes on a party's business practices and commercial arrangements that cannot be undone by this court's later reversal of the district court's judgment,"" Qualcomm said in its filing requesting the stay. ""There is no basis to depart from that settled, sound practice.""

Qualcomm also invoked the global race to 5G and the US' priority to lead when it comes to the super fast, next-generation technology.

""Unless stayed, the injunction will significantly impair an American company that is the worldwide leader in the development of cellular technologies, at a critical moment in the development of the worldwide standards for next-generation 5G cellular systems, thereby forfeiting the lead to foreign interests,"" Qualcomm's filing said.

The company said firms are already are trying to renegotiate their contracts with Qualcomm and noted it ""will be forced to negotiate under the cloud of an injunction requiring it to accept terms to which it would not otherwise agree.""

Wireless networking gear giant Ericsson -- one of the companies that testified in the January trial -- also filed an amicus brief in Qualcomm's favor on Monday. The wireless networking gear giant argued that the district court's order requiring Qualcomm to license its standard essential patents to other chipmakers, as well as the requirement it renegotiate its current licenses, ""threatens to disrupt the stability and predictability necessary to permit 5G investments to go forward.""

""The district court's injunction substantially alters the status quo governing Qualcomm's relationship with other players in the cellular phone industry,"" Ericsson said. ""Requiring Qualcomm to negotiate new licenses and to re-negotiate existing licenses -- with the expectation (realistic or not) that it could seek to re-negotiate those agreements if it wins its appeal -- creates an unacceptable level of uncertainty in the industry and threatens significant disruption that should be avoided by maintaining the status quo pending appeal.""

Originally published July 16 at 5:01 p.m. PT

Update July 17 at 8:36 a.m. PT: Adds FTC declining to comment."
House Democrats vote to hold Attorney General William Barr and Commerce Secretary Wilbur Ross in contempt over census fight,https://www.cnbc.com,"['Sunny Kim Kevin Breuninger', 'Sunny Kim', 'Kevin Breuninger']",07-17-2019,2019,7,https://www.cnbc.com/2019/07/17/census-fight-house-holds-ag-barr-commerce-secretary-ross-in-contempt.html,"U.S. Attorney General William Barr delivers opening remarks at a summit on ""Combating Anti-Semitism"" at the Justice Department in Washington, July 15, 2019.

House Democrats on Wednesday voted to hold Attorney General William Barr and Commerce Secretary Wilbur Ross in criminal contempt of Congress for defying subpoenas related to President Donald Trump's push to add a citizenship question to the 2020 census.

The resolution passed by a vote of 230-198. It marks the latest escalation in the fight between Democrats, who say their oversight duties require launching a slew of subpoenas and requests for information from the Trump administration, and Trump, who has vowed to fight ""all the subpoenas"" from the House.

The House Oversight and Government Reform Committee last month voted to recommend that the entire House hold Barr and Ross in contempt for ""refusing to comply"" with their subpoenas for information about the census controversy.

""It begs the question: What else is being hidden from the American people?"" Oversight Chairman Elijah Cummings, D-Md., said in a press release at the time.

Ross responded in a statement Wednesday, saying, ""House Democrats never sought to have a productive relationship with the Trump Administration, and today's PR stunt further demonstrates their unending quest to generate headlines instead of operating in good faith with our Department.""

""It is an unfortunate fact that there are some who would like nothing more than to see this Administration fail whatever the cost to the country may be,"" Ross said. ""Preferring to play political games rather than help lead the country, they have made every attempt to ascribe evil motivations to everyday functions of government.""

The White House also responded after the decision, calling it a ""ridiculous and yet another lawless attempt to harass the President and his Administration.""

Trump had asserted executive privilege over the documents requested by the committee. A Commerce Department official told Cummings in a letter at the time that Trump's hand was forced because Oversight had set an ""unnecessary"" and ""premature"" contempt vote ""rather than allowing the Department to complete its document production.""

Trump abandoned his bid to add the citizenship question to the 2020 census last Thursday, just a few weeks after the Supreme Court blocked the question. Chief Justice John Roberts said Ross' reasoning for adding the citizenship question was ""contrived"" and not ""genuine."" Trump himself said the reasoning for the question on the census was for redistricting purposes.

Instead of gathering the data through the census, Trump said he would order federal agencies to give the Commerce Department all records related to information regarding how many citizens and noncitizens live in the United States.

The census question would have led to fewer responses, especially in households with noncitizens, according to Census Bureau research. Democrats say adding the question would result in an undercount in areas with a large Hispanic population and other minority communities, which would reduce Democratic representation in such areas."
