House Judiciary calls for DOJ inspector general investigation into discrimination claims at FBI Academy,https://www.washingtonexaminer.com,[],06-29-2019,2019,6,https://www.washingtonexaminer.com/news/house-judiciary-calls-for-doj-inspector-general-investigation-into-discrimination-claims-at-fbi-academy,"Bipartisan leaders of the House Judiciary Committee called for the Justice Department’s inspector general to open an investigation into allegations of discrimination against women at the FBI Academy earlier this week following a federal lawsuit alleging that Quantico is run like a “good old boy network.""

Sixteen former female trainees at the FBI filed a lawsuit in late May claiming that they and dozens of other women had been sexually harassed, subjected to a hostile work environment and outdated gender stereotypes, wrongly kicked out of the training program, unfairly forced to resign or made to think that the continuing the training would be futile, suffered retaliation, and more.

And top members of the congressional committee tasked with overseeing the FBI called the allegations “disturbing” and said that, if true, “such conduct cannot be tolerated.”

The letter, signed this week by two Democrats and two Republicans — Chairman Jerry Nadler of New York and ranking member Doug Collins of Georgia as well as Karen Bass of California and John Ratcliffe of Texas — said they believed America’s diversity should be reflected by the FBI’s agents, emphasized that the FBI’s selection process should be free from bias, and called on DOJ Inspector General Michael Horowitz to look into it.

“We must ensure potential agents not be deterred from applying because they fear the possibility of such treatment,” they wrote. “We believe these detailed allegations require an investigation into the FBI’s training and selection prices for new agents.”

A representative for the FBI told the Washington Examiner that the bureau is “unable to comment on litigation” but that “the FBI is committed to fostering a work environment where all of our employees are valued and respected.”

“Diversity is one of our core values, and to effectively accomplish our mission of protecting the American people we need people of different genders, backgrounds, experiences, and perspectives,” the representative said.

The federal lawsuit filed by female former trainees in May is directed at the training policies at the FBI and the conduct of its instructors at its agent training facility in Quantico, Virginia. The lawsuit claims FBI training guidelines are “highly subjective” and that “the uneven power dynamic at the FBI Academy puts female trainees at a distinct disadvantage.” And the lawsuit claims the subjective guidelines lets instructors misrepresent scenarios and fail women.

The complaint also alleges that when one of the women told former FBI Director James Comey of the allegations, Comey denied that discriminatory behavior was occurring and “instead suggested she use her ‘pain’ to reflect on her strengths and weaknesses.”

Mark Morgan, a former deputy assistant director at the FBI and the new acting chief of Customs and Border Protection, is also mentioned in the lawsuit.

David Shaffer, the attorney for the plaintiffs, told the Washington Examiner the FBI Academy relies upon “a completely subjective system that allows instructors to give rise to their own biases and beliefs with no accountability and oversight.”

Shaffer said that a common dynamic is that when a female trainee explains or defends her actions to an instructor, she is viewed being argumentative while when a male trainee does he is seen as standing up for himself.

Statistics provided by the FBI show that 20% of the special agents who are brought into the FBI are female. For the 2019 cycle, the FBI says that women made up 32% of those in the special agent basic field training course and 36% of those who had applied to be special agents. The FBI says that its 2019 target for female applications had been 33%, and the numbers reflect improvements from the 26% of special agent applications in the 2018 cycle and 22% in the 2017 cycle.

The FBI says that the total number of those who make it through the entire FBI special agent process — including application, training, and graduation — has held steady at just 6%.

If the DOJ inspector takes up the issue of discrimination at Quantico, it wouldn’t be the first time. A 2003 inspector general report which looked into allegations of disciplinary double standards at the FBI uncovered instances of instructors making inappropriate comments towards some trainees.

When asked by the Washington Examiner whether the DOJ inspector general would be launching an inquiry following the request from congressional leaders, the watchdog office declined to say.

Shaffer said that an inspector general investigation “should be done of course,” but he said that Congress needed to take action too.

“They need to be doing their oversight of the agency and asking the hard questions — and not relying on the FBI to investigate themselves,” Shaffer said.

"
Fresh leadership churn at DHS agencies,https://thehill.com,[],06-30-2019,2019,6,https://thehill.com/policy/national-security/450970-fresh-leadership-churn-at-dhs-agencies,"The leadership carousel at the Department of Homeland Security (DHS) took another spin this week as the agency underwent fresh changes among officials tasked with enforcing immigration law.

Roughly 10 weeks after a purge of DHS leaders that included former Secretary Kirstjen Nielsen Kirstjen Michele NielsenThe Hill's Morning Report - Trump touts handshake with Kim, tariff freeze with Xi Fresh leadership churn at DHS agencies Booker calls for hearings on reports of ICE using solitary confinement MORE, the acting head of Immigration and Customs Enforcement (ICE) abruptly resigned and the agency announced a new head of Customs and Border Protection (CBP).

ADVERTISEMENT

And there are rumblings that acting DHS Secretary Kevin McAleenan is not on solid ground. Some of President Trump Donald John TrumpThe billionaire exemption Former Bolton aide pushes back on report of nuclear freeze with North Korea US breaks record for longest economic expansion MORE’s allies and outside groups that favor stricter immigration laws are expressing frustration with McAleenan, suggesting further changes could be on the horizon as the president seeks to implement the right mix of loyalists and immigration hardliners to implement his agenda heading into 2020.

""I've made changes — very good changes,"" Trump told reporters this past week. ""We're moving some people around into different locations.""

McAleenan announced this week that Mark Morgan, previously the acting director of ICE, would move over to lead CBP in the wake of John Sanders's resignation.

Morgan, who led Border Patrol during the Obama administration, made clear in an interview with The Hill earlier this month that he intended to carry out Trump's policies.

Replacing Morgan at ICE is Matthew Albence, a 25-year law enforcement veteran who has held various roles in the Trump administration since 2017.

The president said he was aware there would be a change when Sanders announced his CBP resignation. But Trump did not say whether he asked Sanders to step down, and Sanders did not provide a reason for his resignation.

ADVERTISEMENT

""I don’t know anything about it,"" Trump said Tuesday. ""I hear he's a very good man. I hear he's a good person. I don’t know him. I don’t think I ever spoke to him.""

Morgan and Albence's appointments follow Trump tapping Ken Cucinelli, an immigration hardliner and former Virginia attorney general, as the acting head of U.S. Customs and Immigration Services.

Trump also announced former ICE Director Tom Homan would return to the administration as ""border czar."" Homan has appeared regularly on Fox News to defend the president's policies, but it's unclear if or when he might return to government work or what his duties would entail.

Homan was sharply critical this week of McAleenan, suggesting he has not been supportive of Trump's agenda and has hindered ICE from doing its job.

The White House did not respond to questions about the recent shakeup at DHS, including whether Trump ordered the personnel changes.

The latest reshuffling came as House Democrats clashed over a bill to provide additional border funding and as Democratic presidential candidates made the treatment of migrants a central tenet of the party’s first two debates.

The president has often argued that congressional inaction is largely to blame for the surge in border apprehensions and poor humanitarian conditions for migrants. But the recent turnover atop DHS suggests growing impatience with that agency as well.

Any frustration by Trump with the agency’s performance could prove problematic for McAleenan.

Multiple advocates for Trump view McAleenan as a placeholder and have criticized him in recent weeks for failing to aggressively pursue the president's immigration priorities.

""He just basically has been a stumbling block for basically any enforcement that either CBP or ICE or USCIS wanted to do,"" said Rosemary Jenks, director of government relations for the immigration reduction group NumbersUSA.

DHS did not respond to a request for comment.

The Washington Post reported this month that McAleenan was uneasy with Trump's call for mass ICE raids to round up migrant families with deportation orders. McAleenan was said to have favored a more targeted approach.

Trump on June 22 postponed the raids for ""two weeks"" to give Congress time to attempt to pass legislation overhauling the country's asylum laws.

McAleenan denied in an interview with Fox News Radio on Thursday that he was the source of leaks to the media that jeopardized the raids, but wouldn’t say explicitly if there were any Trump policies that he disagreed with.

“That's not my role. I'm an operator, I'm a law enforcement professional, the president sets policy and we implement,” McAleenan said. “We implement in the best way we know how based on our operational experience.”

The White House did not respond to a request for comment about whether Trump planned to nominate the acting secretary for the role full-time.

Ur Jaddou, who was chief counsel to USCIS during the Obama administration, told The Hill that McAleenan's job has been complicated by the consistent turnover within his department.

""To have people at the top constantly changing and changing their direction on policy and how to approach things is completely disruptive which is why I call it chaos,"" she said in an interview.

Jaddou said she could not recall any comparable amount of turnover to what has taken place at DHS in recent months.

Andrew R. Arthur, who served in the former Immigration and Naturalization Service during the Clinton and George W. Bush administrations, was complimentary of McAleenan but was unsure of his long-term role. He described McAleenan as a ""very competent administrator"" and noted his wealth of experience from leading CBP.

McAleenan has been under additional scrutiny this past week as concerns over the administration's treatment of migrants gained a new sense of urgency.

Hundreds of children were moved from a detention facility in Texas after the Associated Press reported on poor conditions, including kids taking care of other kids and a lack of sanitation.

That same week, a photo went viral of a man and his daughter who drowned while trying to cross the Rio Grande River. Democrats seized on the image to decry the Trump administration's policies.

""In another administration an acting secretary would be out immediately,"" Jaddou said of the response to the photo. ""The person would not survive more than a day.""

McAleenan addressed the photo in a press conference Friday, calling the incident tragic and devastating, but deflected blame away from his own agency.

""This failure is not on the men and women of DHS, and definitely not on the outstanding border patrol agents, and CBP officers and ICE officers who have borne the brunt to the challenges and most of the criticism,"" he said.

McAleenan expressed appreciation for Congress for passing a funding package that includes $4.5 billion in resources for agencies responding to the influx of migrants.

Many Democrats panned the final version of the bill, saying it did not do enough to protect migrant children.

Still, McAleenan said the onus is on Congress to take further action, and he urged lawmakers to close immigration loopholes and approve changes to asylum laws.

""This situation should not be acceptable to any of us,"" McAleenan said. ""It should galvanize action and real debate based on what is actually happening on the border and why. And yet, here in Washington, we have collectively failed to act to address the drivers of the crisis."""
VA Secretary Robert Wilkie reflects on a year spent trying to fix his vital but troubled agency,https://www.wcpo.com,[],07-01-2019,2019,7,https://www.wcpo.com/news/our-community/homefront/va-secretary-robert-wilkie-reflects-on-a-year-spent-trying-to-fix-the-va-hows-it-going-so-far,"Listen to this episode of Homefront in the podcast player above

CINCINNATI — In the 11 months since Robert Wilkie became United States Secretary of Veterans Affairs, he’s booted medical directors from their roles, visited individual VA centers to assess their weaknesses and created history by requesting and receiving the largest-ever budget for his department: $220 billion.

The problems facing the VA as he entered it were numerous and well-documented — long wait times for appointments, allegations of misconduct, overprescription of opioids, a poor work environment and improperly kept records that led to delayed GI payments, to name a handful of the most prominent. Many still linger.

However, during a recent visit to Cincinnati, Wilkie said the agency’s approval ratings are rising as it takes a series of new approaches to fight its longtime bugbears.

“Most of the issues in the VA — not here in Cincinnati — have nothing to do with the technical competence of the employees,” he said. “It had everything to do with leadership walking the post.”

As the face of new leadership, Wilkie has overseen the implementation of the MISSION Act, which allows veterans to see pre-screened private practitioners if their local VA is more than a 30-minute drive from home or if the soonest available appointment time (for primary and mental health care) is more than 20 days away. For services falling under the umbrella of ""specialty care,"" veterans can see a community health care provider if their VA is over an hour away or the nearest available appointment is not within 28 days.

Wait times differ from need to need, but the average number of days elapsed between a request and appointment is 12 in Cincinnati, according to Wilkie. It’s 39 at the clinic in Hamilton.

“MISSION was designated to make sure those numbers did not affect the veteran’s health,” Wilkie said.

He also hopes to deal more effectively than his predecessors with issues such as mental illness and addiction, he added. Although Wilkie has in other interviews partially attributed the high rate of veteran suicide to veterans not being in contact with their local VA, he acknowledged the agency’s responsibility to provide better-quality services and outreach. He’s invested $9 billion this year — more than any year before — in improving those aspects of the agency.

“We are not even at the Sputnik stage in this country when it comes to getting our arms around mental health issues,"" he said at the National Coalition for Homeless Veterans conference in late May.

He echoed that statement during his trip to Cincinnati, noting that providing nuanced mental health care has practical benefits alongside humanitarian ones.

“This is not a draftee army anymore,” he said. “These are all volunteers, and you have to take better care of them than you did in the draftee days, where it didn’t matter what the individual soldiers did (because) there were 10 coming in to replace them on any day.”

Only comprehensive culture change can be the real answer, he added. That could take a significant amount of time, and it means focusing on more than suicide prevention. It means emphasizing wellness, exploring supplemental forms of treatment such as yoga and training veterans to look out for one another.

Mental health should be a significant element of veterans’ everyday care, he said. And everyone else’s, too.

If that $9 billion is spent wisely, Wilkie said he thinks it’s possible the VA could lead the conversation on effective psychiatric treatment in the United States.

“We have a community-based system here,” he said. “We have a culture that promotes communication, and what I see across the country — today, sadly, the fourth new York City policeman (in three weeks) has sadly taken his life. We’ve seen suicide among teenagers spiking. So it’s not just veterans. It’s the entire country that needs to be brought into this.”

Despite years of setbacks, many of which still weigh on his agency, Wilkie said he has generally witnessed encouraging progress since he assumed his post in June 2018.

He hopes to see much more ahead.

“Most of my professional and political career, the VA has always been 16 or 17 out of 17 in terms of best places in the government to work,” he said. “We’re No. 6 now and will likely be higher when the next ratings come out. So (those are) incredible steps forward, and I think it’s incumbent upon me, as someone who comes from the military — I was working for General Mattis when this offer came — to tell that story and encourage veterans to use the VA.

“This is a home for them with people who have served.”"
"EPA's backward accounting protects polluters, not the people",https://thehill.com,[],07-01-2019,2019,7,https://thehill.com/opinion/energy-environment/451212-epas-backward-accounting-protects-polluters-not-the-people,"Cost-benefit analysis. It’s an idea originally promoted by industry lobbyists to push regulatory agencies to tot up the costs and benefits of safeguards for health, safety, and the environment, after first translating them into dollars-and-cents terms. Industry’s goal was to delay and weaken public protections while cloaking the effort in a veil of arithmetic precision.

In 1981, the Reagan administration was only too happy to take up the cost-benefit cause, enshrining the idea in an executive order. The tortured process of weighing Americans’ health and lives against industry profit routinely understated the benefits of environmental, health and safety protections and overstated the costs of industry compliance. As a result, regulatory safeguards were frequently watered down or squelched.

Then a funny thing started happening. Even when working within this industry-rigged system, the Environmental Protection Agency (EPA) found that the monetary benefits of some of our most important public health and environmental rules far exceeded their costs.

ADVERTISEMENT

How did this happen? The EPA has gotten better at accounting for the benefits of addressing two specific harms — particulate matter and climate disruption — because of significant advances in the relevant fields of science and environmental economics. We now know that particulate pollution — fine particles suspended in the air we breathe — kills people. Similarly, we’re already getting a taste of how bad unchecked climate disruption will be for everyone.

Because the harms of particulate matter and climate disruption are so great, the benefits of addressing them turn out to be worth a lot of money. Consequently, when proposed regulations have a positive effect on climate or particular matter, the calculable benefits go up, even for rules that aren’t aimed directly at either.

While industry has dressed its support of cost-benefit analysis in the garb of “sound policymaking,” its real motivation has always been evading the costs of cleaning up its pollution. Polluters banked on the EPA and other agencies never being able to measure the vast majority of benefits in dollar terms (things like saving human lives and preventing cancer). Now that science and more accurate accounting have disrupted their game, they’re demanding their friends at the Trump EPA change the rules — again.

In response, EPA Administrator Andrew Wheeler Andrew WheelerOvernight Energy: Top EPA official stepping down amid ethics probe | Critics slam EPA for rolling back union protections | Trump officials open door to controversial Alaska mining project Top EPA official stepping down amid ethics probe Trump pick brings scrutiny to 'revolving door' between Pentagon, industry MORE and his departing air quality deputy Bill Wehrum — both former industry lobbyists — have commenced work on a “benefits-busting” project that would re-rig the cost-benefit game in industry’s favor. In May, Wheeler directed each of the agency’s program offices to launch formal rulemakings that would overhaul how they perform cost-benefit analyses on future rules. Before resigning, Wehrum set the agency’s air office to writing the first of these proposals. (This appears to be one of Wehrum’s last official acts before leaving the agency under an ethics cloud.)

Particulate matter and climate are likely to be the main targets of Wehrum’s swan song. The proposal will likely jettison particulate matter from many cost-benefit calculations by changing how the agency treats “co-benefits” — those that a rule produces even though they are not its principal objective. Since particulate matter is a byproduct of burning fossil fuels, any regulation that limits these activities saves lives by reducing particulate emissions. Barring co-benefits from the equation or establishing arbitrary limits on their consideration flies in the face of well-established economics, sound science and common sense.

ADVERTISEMENT

On climate, the proposal will likely formalize the Trump administration’s efforts to gut the Obama-era social cost of carbon (SCC), an attempt to put a value on reducing greenhouse gas emissions. The Obama administration set the SCC at about $45 per ton of carbon dioxide (though some economists would put it much higher, at over $1,000). The Trump EPA has proposed using a SCC as low as $1 per ton by disregarding harms U.S. emissions cause to other countries and future generations.

The Trump EPA is already relying on these head-in-the-sand accounting tactics to justify rolling back some of the agency’s most important environmental and public health rules. By writing these tricks into a binding benefits-busting rule, EPA would hobble future efforts to protect public health and the environment. Indeed, this will be a powerful tool for polluters in defeating air pollution safeguards.

The American public deserves honest accounting. Congress should conduct vigorous oversight of the Trump EPA’s efforts to transform the implementation of bedrock laws like the Clean Air Act into a loaded dice game in which public health and the environment always lose.

Amy Sinden is James E. Beasley professor of law at the Temple University Beasley School of Law in Philadelphia and a board member at the Center for Progressive Reform.

James Goodwin is the senior policy analyst at the Center for Progressive Reform. Both are experts in cost-benefit analysis."
