"Cornell team, EPA to partner on emissions big data project",https://news.cornell.edu,[],,,,https://news.cornell.edu/stories/2019/05/cornell-team-epa-partner-emissions-big-data-project,"A team from associate professor Max Zhang’s lab will work with the Environmental Protection Agency (EPA) over the next year on a machine learning model designed to predict fossil fuel emissions. The project was a winning entry in the EPA-sponsored EmPOWER Air Data Challenge.

Zhang directs the Energy and the Environment Research Laboratory at the Sibley School of Mechanical and Aerospace Engineering. His collaborators on the EPA project are Ye Jiang and Vignesh Rao, students in the Cornell Engineering master’s program in computer science; and doctoral student Jeff Sward.

The project, “Predicting the Environmental Performance of Power Plants Using Machine Learning,” will apply the machine learning model to air pollution monitoring data from the EPA’s Clean Air Markets Division (CAMD) to predict emissions rates from fossil fuel-burning power plants. The group will develop the model further to identify anomalies in CAMD data to enhance the quality of the data.

According to the EPA, most of the fossil fuel-fired, electricity-generating units in the U.S. submit quarterly reports on their hourly nitrogen oxide, sulfur dioxide and carbon dioxide emissions, along with operating parameters such as hourly heat input and gross electricity generation.

“Electronic data auditing involves a massive data set,” Zhang said. “Any power plant larger than 25 megawatts in the United States, including generators at Cornell, is equipped with the continuous emission monitoring system (CEMS). To maintain the quality of the data is very important for the environment, and we will develop a better data-driven tool to improve the quality of the CEMS data.”

Zhang said his lab initially developed the machine learning model for emissions as part of a project funded by the NewYork State Energy Research and Development Authority to evaluate the impact of clean energy initiatives in the state. “The timing was perfect to compete for this EmPOWER Air Data Challenge,” he said, “because we had some results already.”

The EPA and the Sibley School have signed a Memorandum of Understanding on the project, to be completed by June 2020. One of the agency’s goals is to advance power sector-related research and knowledge.

The Cornell team will work with and have direct support from EPA staff, experts and peers in the research community, to assist with CAMD tools and data analysis.

The EPA selected three winning EmPOWER projects for the 2019-20 academic year, including Zhang’s. The others chosen are at the Georgia Institute of Technology, on data engagement in the classroom; and the University of California, Berkeley, and the University of Oregon, a joint project applying satellite data on pollution to estimate health impacts from a decline in coal emissions.

Zhang sees Cornell’s EmPOWER project as a good opportunity for students to gain practical experience working with a government agency on environmental issues.

“I have a number of computer science students working in my lab this academic year. They are all very motivated to make a real-world impact,” he said. “I’d welcome computer science and engineering students to look at what we’re doing and join us for socially relevant research projects.”"
Ex-State Department head of diplomatic security 'surprised' by Hillary Clinton's private email use,https://www.washingtonexaminer.com,[],05-29-2019,2019,5,https://www.washingtonexaminer.com/news/ex-state-department-head-of-diplomatic-security-surprised-by-hillary-clintons-private-email-use,"The official in charge of protecting State Department staff said he was ""surprised"" to learn that Hillary Clinton used a personal email address to conduct government business.

Eric Boswell, the former head of diplomatic security, acknowledged in a deposition this month that he warned Clinton and other State Department staff against the use of personal emails.

""We also urge Department users to minimize the use of personal web email for business, as some compromised home systems have been reconfigured by these actors to automatically forward copies of all composed emails to an undisclosed recipient,"" read a 2011 memo that bore his signature.

Clinton was a recipient of the memo, but Boswell could not confirm whether the secretary of state actually read it.

Boswell, who stepped down from his position in 2012, said he and other former State Department officials had spoken about Clinton's use of the private email address clintonemail.com as a ""general issue.""

""We were surprised,"" he added.

Boswell participated in a deposition this month as part of a court-ordered discovery related to Clinton’s use of an unauthorized email server during her time as secretary of state. A federal judge ruled that several Obama administration officials would have to answer conservative watchdog group Judicial Watch's questions about whether Clinton intentionally attempted to evade the Freedom of Information Act by using a nongovernment email system.

Boswell also warned Clinton against her use of Blackberry devices in the executive offices of the State Department. In a previously declassified memo to Cheryl Mills, Clinton's chief of staff, Boswell said the secretary of state should discontinue her use of the device due to ""vulnerabilities and risks."" Although Clinton assured Boswell she read the internal memo and ""gets it,"" an email obtained by Judicial Watch indicates she still carried the device ""[a]gainst the advice of the security hawks.""

The debate over whether Clinton's home-based email server, which she claims was set up for convenience, remains alive today. During a hearing with Attorney General William Barr this month, Rep. Louie Gohmert accused FBI Director Christopher Wray of a pro-Clinton cover-up by not pressing the intelligence community for proof that it was not hacked by China.

Also this month, partially redacted documents were released by the FBI that were part of the bureau's ""Midyear Exam"" investigation, which looked into Clinton's mishandling of classified information on her unauthorized private email servers while serving as secretary of state. The documents put on display a sense of alarm among Clinton's staff following what they feared to be a hack of the server and glaring security oversights.

The FBI investigation into Clinton's emails came to a conclusion during the 2016 presidential election. Former FBI Director James Comey publicly recommended in 2016 that no charges be brought against Clinton, who was then a candidate for president, but admonished Clinton and her colleagues for being ""extremely careless"" in handling classified information.

One of the main controversies stemming from Clinton's emails was how a technician managing the server deleted 33,000 emails. The FBI was only able to recover about 5,000 of the emails, which were released in tranches up until earlier this year as part of a Judicial Watch lawsuit. Clinton has said she ""never received nor sent any material that was marked classified,"" but the FBI found 110 emails did contain classified information.

Clinton has long blamed the FBI's handling of the investigation as a reason for her 2016 loss to President Trump."
SA chosen as site of 2020 DOD Warrior Games,https://www.ksat.com,"['Https', 'Www.Ksat.Com Author Garrett.Brnger', 'Garrett Brnger', 'Www.Ksat.Com Author Lcienfuegos', 'Luis Cienfuegos']",05-31-2019,2019,5,https://www.ksat.com/news/sa-chosen-as-site-of-2020-dod-warrior-games,"SAN ANTONIO - Already known as ""Military City, USA,"" San Antonio will be the host city for the 2020 Department of Defense Warrior Games, city officials announced Thursday.

The Paralympic-style competition, which will be hosted in 2020 by the Marine Corps, brings together injured, ill or wounded active-duty service members and veterans to compete each year for the honor of their branch of service.

Events in the 2019 games, which will take place in June in Tampa, Florida, include archery, cycling, shooting, sitting volleyball, swimming, track and field, wheelchair basketball, indoor rowing, powerlifting, and time trial cycling.

""When they win a medal, they win it for their team. And they don't play their national anthem. They play their service song,"" said retired Marine Maj. Gen. Juan Ayala, the director of the city's San Antonio Office of Military and Veteran Affairs.

The games can mean a great deal to wounded service members like Marine Cpl. Mathew Maddux.

Maddux, the Marines' ambassador for the 2020 games, was injured in 2017 when a malfunction in his tank caused a nuclear, biological and chemical system to overheat and combust next to him. The blast left him with burns on his face, impaired peripheral vision, vertigo problems and a prosthetic ear.

Waking up after the incident, Maddux said he knew right away life would be different. Like the Marine he is, Maddux learned to adapt and overcome, competing in the 2018 Warrior Games.

""I was the ultimate champion last year -- did all the sports,"" Maddux said. ""I got a bronze medal in the 4x100, like a relay team.""

More than physically, he says, the games helped him mentally.

""Mentally reassuring yourself that you can still go out there and be an athlete,"" Maddux said. ""Still go out there and still be in a fight.""

Ayala, who the 2015 Warrior Games when he was still in the Marines, says the competition is special.

""They're focused on the recuperative powers to make that athlete feel like he or she are back in the game, they're back in the unit, they're back in the fight,"" Ayala said.

Copyright 2019 by KSAT - All rights reserved."
U.S. police chiefs call for meeting with Homeland Security over immigration issues,https://www.washingtonpost.com,"['Tom Jackman', 'Reporter Covering Criminal Justice Locally']",05-30-2019,2019,5,https://www.washingtonpost.com/crime-law/2019/05/30/us-police-chiefs-call-meeting-with-homeland-security-over-immigration-issues/,"

Houston police Chief Art Acevedo presides over a meeting of the Major Cities Chiefs Association in Miami on Wednesday. (Major Cities Chiefs Association/Major Cities Chiefs Association)

MIAMI — The police chiefs of America’s largest cities on Thursday called on the federal Department of Homeland Security to meet with them as their departments struggle with the influx of immigrants from the southern border. The chiefs said they want to hear how federal immigration authorities plan to deal with relocating immigrants to their cities and how they will handle “sanctuary city” status declared by local governments, and the police want a voice in the federal policymaking process.

The Major Cities Chiefs Association, comprising the chiefs and sheriffs of the 69 largest law enforcement agencies in the United States, formed an immigration working group at its meeting here, led by Houston police Chief Art Acevedo, who has openly opposed a Texas law banning sanctuary cities. Acevedo and other chiefs here said they do not take immigration status into account when performing their duties, only whether someone is breaking the law or has been a crime victim. They see immigration enforcement as a federal responsibility, not one for local police.

“From our perspective,” Acevedo said in an interview, “there is no such thing as a ‘sanctuary city’ in terms of taking action against those who would do harm to members of our communities.” Police have long felt that taking on immigration enforcement by routinely checking a person’s status will deter immigrants from reporting crime or cooperating with investigations. Acevedo said there had been a nearly 43 percent drop in reporting of sexual assaults in Houston by its Hispanic community in 2017.

The chiefs’ working group wants to discuss the federal policy on Immigration and Customs Enforcement civil detainers for undocumented immigrants, which a number of police departments and jails have refused to recognize since they are not criminal warrants. They also want to talk about the issue of notifying ICE before releasing prisoners who have immigration detainers. “The immigration authorities have to pick them up,” Acevedo said. “We don’t turn them over.”

Some chiefs told Acevedo that their local social service agencies are being overwhelmed by busloads of suddenly relocated immigrants. “There needs to be a sense of urgency,” Acevedo said, “when we see asylum seekers that are being distributed throughout the country. We need to know what is the plan and what is the impact on public safety. We need to be part of the discussion because while immigration enforcement is a federal issue, these decisions have an impact on the safety and security of the American people, and that is our primary responsibility.”

In a statement, a spokesperson for the Department of Homeland Security said the agency “has repeatedly and extensively worked with our country’s law enforcement officials to address the current immigration crisis facing our homeland and keep our communities safe. In fact, former Secretary Nielsen met with the Law Enforcement Immigration Task Force, co-chaired by Chief Acevedo, this past February to discuss law enforcement concerns and Acting Secretary McAleenan continues to meet with various law enforcement leaders to seek feedback and identify viable, lasting solutions to the ongoing crisis and achieve the Department’s humanitarian and security mission.”

The announcement from the Major Cities Chiefs Association is here."
U.S. Dept. of Labor finds overtime violations at Waynesville company,http://wlos.com,['Wlos Staff'],,,,http://wlos.com/news/local/us-dept-of-labor-finds-overtime-violations-at-waynesville-company,
