title, publication, authors, date, year, month, url, content
Ivanka’s North Korea Photobombs Perplex White House Officials,https://www.thedailybeast.com,"['Erin Banco', 'Asawin Suebsaeng', 'National Security Reporter', 'White House Reporter']",07-02-2019,2019,7,https://www.thedailybeast.com/ivanka-trumps-north-korea-photobombs-perplex-white-house-officials,"When Donald Trump and his advisers crossed over from South Korea into the heavily fortified demilitarized zone between North and South Korea over the weekend, the cameras were ready. Images of the president greeting North Korean dictator Kim Jong Un as “my friend” in a last-minute meet-up streamed across televisions worldwide.

Trump wasn’t alone. After a few snapshots, Ivanka Trump, along with her husband, Jared Kushner, followed the president into what’s known as the Freedom House—a building on the South Korean side of the zone. That’s when the cameras stopped. The media was reportedly blocked from entering and covering the historic event.

It wasn’t until later that reporters learned Ivanka and Kushner did more than accompany the president into the Freedom House. They were reportedly present at a closed-door meeting between the two leaders, who ended up speaking about one of the most sensitive topics on the planet—North Korea’s nuclear weapons program.

“ She matters because the president says she matters. Who in their right mind would cross her knowing that? ” — former administration official

The White House did not immediately respond to a request for comment. After this story was published, an official reached out and said: “Although they met Kim, Jared and Ivanka did not participate in the closed-door meeting.” The official did not clarify which meeting Ivanka and Jared participated in or how many meetings were held on the border. But two other officials told The Daily Beast that Ivanka and Kushner were in the room for conversations that pertained to nuclear weapons and sanctions.

President Trump has long used his family, particularly his son-in-law, to run various foreign policy projects, leading to investigations on Capitol Hill over security clearances and the administration’s circumvention of traditional foreign policy procedure. Former Secretary of State Rex Tillerson said in a recent congressional interview that he was often left in the dark about various high-stakes foreign policy decisions because Kushner at times ran his own shadow State Department, meeting secretly with world leaders from countries such as Mexico and Saudi Arabia.

The meeting in the DMZ seemed to spur a new sense of frustration in Washington on Monday, this time directed in particular at the first daughter, who was also present—front and center—at the G20 summit in Hamburg. She provided a video readout about the conversations Trump had with Indian Prime Minister Narendra Modi and took photo-ops with attendees.

“Ivanka has participated in previous bilateral meetings, and on behalf of the White House at past G20 summits,” said Garrett Marquis, a spokesperson for the National Security Council. “Issues of women’s empowerment are central to the president’s national security and women’s peace and security strategies.”

Photos and video footage from the conference emerged over the weekend, showing Ivanka mingling with some of the top world leaders, inserting herself into conversations with veterans of the foreign policy world. The internet erupted, and lawmakers took to social media.

“It may be shocking to some, but being someone’s daughter actually isn’t a career qualification,” Rep. Alexandria Ocasio-Cortez (D-NY) said on Twitter. “It hurts our diplomatic standing when the President phones it in & the world moves on.”

One senior administration official told The Daily Beast that the Trump team often tries to find roles for Ivanka on travels overseas because she is a talented spokesperson. But it is unclear what Ivanka was doing in North Korea beyond the purely ceremonial. Two senior administration officials and one former one said they do not consider the president’s daughter a significant player on major foreign policy initiatives, including on the Koreas, though they all acknowledged that President Trump will at least solicit her advice for gut checks on any manner of foreign policy and national security decision: striking other countries, climate agreements, and so on.

“She matters because the president says she matters,” the former official said. “Who in their right mind would cross her knowing that?”

A current official noted that she is often in the room during important policy discussions and read-into those matters specifically, and at times exclusively, because her father demanded it.

It’s not only Trump’s aides and advisers who have taken note of that; foreign leaders have factored it into their diplomacy and flattery of Trump, as well. Prime Minister Abe is known to go out of his way to ask the president how Ivanka is doing and ask about her interest in global women’s empowerment projects, another one of the current senior Trump administration officials said.

Still, Ivanka’s protected status in the Trump orbit has frustrated several high-ranking aides over the years, including the president’s one-time chief strategist Steve Bannon and former White House chief of staff John Kelly, the latter of whom reportedly complained in private that Ivanka is merely “playing government,” according to a CNN report early last year.

That report came at a time when Ivanka’s trip to South Korea, as leader of a U.S. delegation at the closing ceremony of the Winter Olympics, perplexed, if not outright aggravated, several of her fellow senior colleagues, chief among them Kelly, a former White House official said.

Lawmakers on Capitol Hill have looked into how and why the administration’s foreign policy has shifted at the hands of Trump’s family. The House Foreign Affairs Committee, in particular, has scrutinized Kushner’s relationship with Saudi Crown Prince Mohammed Bin Salman. Tillerson, in his interview with the committee in May, said the inclusion of Ivanka and Kushner in the national security process made his job more difficult.

“One of the challenges I think that everyone had… to learn to deal with was the role, the unique situation with the president’s son-in-law [Kushner] and daughter [Ivanka] being part of the White House advisory team,” Tillerson said. “There was not a real clear understanding of the role, responsibilities, authorities… which made it challenging for everyone.”"
Opinion | The Welcome Humiliation of John Bolton,https://www.nytimes.com,['Michelle Goldberg'],07-01-2019,2019,7,https://www.nytimes.com/2019/07/01/opinion/john-bolton-trump.html,"Bolton is sometimes described as a neoconservative, but that’s not really right. Neoconservatives purported to champion the expansion of American values, while Bolton just wants to impose American might. On the surface, he seems an excellent fit with Trump, who is also uninterested in human rights and contemptuous of multilateral institutions. Both are bellicose nationalists, dismissive of climate change, eager to empower the Israeli right, hostile to Islam but solicitous of Saudi Arabia.

But the uber-hawk Bolton, who still refuses to admit that the Iraq war was a mistake, has long believed that America’s most implacable enemies include North Korea, Russia and Iran. One multilateral organization he appears to value is NATO, a counterweight to Russia that he once called “the most successful political-military alliance in human history.” Now, at the summit of his career, he’s part of an administration that makes a mockery of his longtime foreign policy philosophy.

When the George W. Bush administration, in which Bolton also served, lifted some sanctions on North Korea in 2008, Bolton seemed almost heartsick. “Nothing can erase the ineffable sadness of an American presidency, like this one, in total intellectual collapse,” he wrote in The Wall Street Journal.

So one can only imagine the ineffable sadness he felt over the weekend, when Trump stepped into North Korea to shake the hand of his friend Kim Jong-un, North Korea’s totalitarian leader. On Sunday, The New York Times reported that the Trump administration was considering putting aside the goal of getting North Korea to surrender the nuclear weapons it already has, instead trying to get the country to stop making new nuclear material.

Given Trump’s limitations as a statesman, that’s probably the best that can be hoped for. But it’s almost certainly not what Bolton, who was calling for pre-emptive strikes on North Korea just before Trump appointed him, thought he was signing up for. In response to the Times article, Bolton tweeted angrily that he’d heard of no such plan, though he might have simply been out of the loop. After all, while Trump was flattering Kim, Bolton was in Mongolia."
Exclusive: Trump shares plans to combat homelessness and mental illness in interview with Tucker Carlson,https://www.foxnews.com,"['Nick Givas', 'Nick Givas Is A Reporter With Fox News. You Can Find Him On Twitter At']",,,,https://www.foxnews.com/politics/trump-tucker-exclusive-interview-homelessness,"President Trump sat down with Fox News host Tucker Carlson for an exclusive interview during his visit to Japan for the G20 summit and shared his plans to combat rising homelessness and mental illness in America.

During the interview, Trump told Carlson he is ""looking at it very seriously"" and said some people forced to live on the streets are ""living in hell.""

""It's disgraceful. I'm going to maybe and I'm looking at it very seriously,"" Trump said. ""We're doing some other things that you probably noticed like some of the very important things that we're doing now. But we're looking at it very seriously because you can't do that.

""You can't have what's happening -- where police officers are getting sick just by walking the beat. I mean, they're getting actually very sick, where people are getting sick, where the people living there living in hell, too.""

TUCKER CARLSON SAYS TRUMP 'DOMINATED' KIM AS 'WHEEZING' NORTH KOREAN DICTATOR STRUGGLED

Trump continued, saying most people suffering from homelessness have an accompanying mental illness and sometimes don't realize they're living in their own filth. He also said the issue needs to be addressed before it starts affecting healthy working people as well.

""Some of them have mental problems where they don't even know they're living that way,"" he said. ""In fact, perhaps they like living that way. They can't do that. We cannot ruin our cities. And you have people that work in those cities. They work in office buildings and to get into the building, they have to walk through a scene that nobody would have believed possible three years ago.""

Trump blamed the liberal politicians for exacerbating the problem and said he's been fighting them on all fronts, including within the city limits of Washington, D.C.

""And this is the liberal establishment. This is what I'm fighting,"" he added. ""They -- I don't know if they're afraid of votes. I don't know if they really believe that this should be taking place. But it's a terrible thing that's taking place. And we may be -- you know, I had a situation when I first became president, we had certain areas of Washington, D.C. where that was starting to happen, and I ended it very quickly.

TRUMP SAYS HE'S OPTIMISTIC ABOUT TRADE DEAL WITH CHINESE PRESIDENT XI, IN INTERVIEW WITH TUCKER CARLSON

""When we have leaders of the world coming in to see the President of the United States and they're riding down a highway, they can't be looking at that. I really believe that it hurts our country.

""They can't be looking at scenes like you see in Los Angeles and San Francisco. San Francisco... so we're looking at it very seriously. We may intercede. We may do something to get that whole thing cleaned up. It's inappropriate.""

Trump also said it shouldn't fall on the federal government to address the issue, but didn't give any indication that it would deter his administration from getting involved.

""We're really not very equipped as a government to be doing that kind of work,"" he told Carlson. ""That's not really the kind of work that the government probably should be doing. We've never had this in our lives before in our country. And it's not only those few cities, it's a couple of other ones.""

CLICK HERE TO GET THE FOX NEWS APP

The president's comments came after figures released last month stated the number of homeless people in Los Angeles County jumped 12 percent over the past year, officials announced Tuesday, despite $619 million in government spending to help alleviate the problem.

The annual point-in-time count recorded nearly 59,000 homeless people countywide, with the largest number -- 36,000 -- coming from the city of Los Angeles. The Los Angeles Homeless Services Authority, a county agency which conducted the count, delivered its report to the Board of Supervisors at its Tuesday meeting.

The 2018 tally found a slight decrease in the homeless population at just over 53,000 people. Supervisor Janice Hahn called the new numbers ""disheartening.""

The count found a 24 percent increase in homeless youth, defined as people under 25, and a 7 percent jump in people 62 or older. An estimated 29 percent of people experiencing homelessness are mentally ill or have substance abuse issues, officials said."
Trump Says Tanks Will Be on Display in Washington for July 4,https://www.nytimes.com,"['Michael D. Shear', 'Thomas Gibbons-Neff', 'John Ismay']",07-01-2019,2019,7,https://www.nytimes.com/2019/07/01/us/politics/trump-tanks-july-4th.html,"WASHINGTON — President Trump said on Monday that the Pentagon would put military tanks on display on Thursday in Washington as part of his plans to turn the annual Fourth of July celebration in the nation’s capital into a salute to the country’s military prowess.

The tanks will join an airborne display of the nation’s firepower, including a flight of Air Force One over Washington and a performance by the Navy’s Blue Angels jets. Mr. Trump, who is to speak at the celebration, has requested that the chiefs for the Army, Navy, Air Force and Marines stand next to him as aircraft from each of their services fly overhead and their respective hymns play on loudspeakers.

“It’ll be like no other — it’ll be special, and I hope a lot of people come,” Mr. Trump told reporters in the Oval Office. “We have some incredible equipment, military equipment, on display — brand-new. And we’re very proud of it.”

Mr. Trump’s Fourth of July homage to the military sets up a cultural clash between the Republican president and a mostly Democratic city that has for decades celebrated America’s independence with almost no public participation by presidents of either party. The City Council for the District of Columbia, which was not happy with Mr. Trump’s decision, posted on Twitter that “we have said it before, and we’ll say it again: Tanks, but no tanks.”"
Defense Department to ban beer and pizza? Mandatory keto diet may enhance military performance,https://www.militarytimes.com,"['Kristine Froeba', 'Mark D. Faram']",07-01-2019,2019,7,https://www.militarytimes.com/news/your-military/2019/07/01/defense-department-to-ban-beer-and-pizza-mandatory-keto-diet-may-enhance-military-performance/,"The controversial ketogenic or “keto” diet may be the future of the military, some defense officials say.

Service members, and Navy SEALS especially, may have to forgo beer and burritos for skinny cocktails and avocado salad (forget the tortilla chips) if a proposal from Special Operations Command gains momentum.

While a nutritionally enhanced future could eventually be put into effect for all branches, the SEALS and other underwater dive-mission specialists might be the first groups targeted for the change in nutritional guidelines.

Lisa Sanders, the director of science and technology at U.S. Special Operations Command, presented an Ohio State University study that recommends the nutritional change based on the keto diet, which is high in fat and low in carbohydrates. The diet works to deprive the body of glucose needed for energy and forces it to burn stored fats instead. The study was conducted on the university’s Army ROTC cadet population.

“One of the effects of truly being in ketosis is that it changes the way your body handles oxygen deprivation, so you can actually stay underwater at depths for longer periods of time and not go into oxygen seizures,” Sanders said at the Special Operations Forces Industry Conference last month.

Discussion of new dietary guidelines for service members comes at a time of growing concern about obesity in the military and its potential threat to readiness.

The possibly controversial change for the military is not without problems, not the least of which are questions about whether the military has the legal and ethical authority to control and monitor a service member’s diet 24/7.

Daily ketosis testing?

× Fear of missing out? Sign up for the Early Bird Brief - a daily roundup of military and defense news stories from around the globe. Thanks for signing up. By giving us your email, you are opting in to the Early Bird Brief.

Service members are familiar with physical training in boot camp and their routine Physical Fitness Tests, but are they ready for daily dietary ketosis testing?

For the keto nutritional plan to be successful, it has to be followed strictly, and that includes after-hours and weekends. Even a service member on leave would possibly face a restricted diet because it simply takes too long for the body to readjust and function in the ketosis stage after a weekend of dietary backsliding and binging on pizza, burritos, and beers.

The keto diet requires the body to be in a constant state of ketosis. Daily urine or blood tests using strips are necessary to measure glucose or ketone levels.

Navy votes down the sit-up for PRT Are you ready for some planks and the rowing machine?

Revamping MREs?

For the diet to be implemented laterally across the military, produce choices and meat quality at military dining facilities across the world would have to change significantly, not to mention the high-carb and sugar content of MRE’s. The popular pepperoni pizza MRE would be a thing of the past.

Although one benefit of formulating a new high-fat food ration is that it would be a lighter weight for service members to carry.

“You can carry even more calories because fats weigh less, which is an advantage,” said Kinesiologist Jeff Volek, a professor at Ohio State University’s Department of Human Sciences and author of the study.

Soldiers with the 4th Infantry Division at Fort Carson, Colorado, chow down on pizza MREs. (David Kamm/U.S. Army Natick Soldier Research, Development and Engineering Center)

On military bases, the dietary change could result in future dining facilities serving Ezekiel bread, zucchini “pasta spirals” to replace pasta, mashed cauliflower as a substitute for potatoes and rice, and avocado-heavy salad bars replacing soft-serve ice cream machines and dessert bars.

No fries with that at the DFAC

In addition to the regulatory and privacy questions about the proposed dietary change, there are also economic questions. Not only would DFACS and the military have to change, military households would have to follow suit as the diet requires higher quantities and quality of vegetables, fats, and proteins throughout the day.

If a keto meal plan became the required diet of the military’s future, some say military budgets, salaries and allowances may also have to rise to meet the economic demands required to follow the dietary guidelines on duty and off. But Volek, author of the study, disagrees.

“The ketogenic diet is high in fat, which is less costly,"" Volek said. The majority of the diet is based on fat, and fat calories can be very cheap. “Meats, eggs, fish, chicken, cheese, butter, seeds, nuts, and non-starchy vegetables are the basis of the diet. Fat is the key or primary nutrient.”"
