title, publication, authors, date, year, month, url, content
Why Pence spiked a Trump judge,https://www.politico.com,['Eliana Johnson'],07-12-2019,2019,7,https://www.politico.com/story/2019/07/12/mike-pence-kanne-judge-trump-1411915,"Vice President Mike Pence’s private political considerations cost the administration a chance to elevate a fresh conservative to the federal bench. | Chip Somodevilla/Getty Images white house Why Pence spiked a Trump judge The rare split between the president and his loyal sidekick offers a window into the vice president’s independent political ambitions.

In January 2018, Judge Michael Kanne received an unexpected call from the White House. Kanne, an Indiana native who sits on the 7th Circuit Court of Appeals, was then 79 years old.

Under leadership of Don McGahn, the White House counsel’s office was focused almost singularly on filling the federal bench with conservative judges, and in Kanne, Trump’s lawyers had spotted an opportunity to nudge out an old-timer and lock in a conservative who could serve on the federal bench for decades to come. Rob Luther, a McGahn deputy responsible for nominations, had phoned Kanne to suggest he retire. Luther told the judge the White House had a successor in mind: Tom Fisher, Indiana’s solicitor general and a former clerk for Kanne.

Story Continued Below

“I had not intended to take senior status because that wasn’t my plan, but if I had a former clerk who had the chance to do it, then I would,” Kanne said in an interview. “On the consideration that he would be named, I sent in my senior status indication to the president.”

Taking the status, a form of semi-retirement for judges, would allow Kanne to continue working while creating a vacancy on the bench for Trump to fill. It seemed like the perfect plan — until Vice President Mike Pence’s aides got wind of it and scuttled Fisher’s nomination, according to five people familiar with the events.

As solicitor general of Indiana, Fisher had defended Gov. Mike Pence’s policies in court, and aides to the now-vice president feared his nomination would dredge up events and information politically damaging to Pence.

POLITICO Playbook newsletter Sign up today to receive the #1-rated newsletter in politics Email Sign Up By signing up you agree to receive email newsletters or alerts from POLITICO. You can unsubscribe at any time.

In a series of tense conversations with the White House counsel’s office, Pence’s lawyers, Matt Morgan and Mark Paoletta, and his then chief of staff, Nick Ayers, objected to Fisher’s nomination, which died before it ever became a reality. Pence himself was kept apprised of the conversations.

The clash provides a rare glimpse into the vice president’s political calculations and ambitions, which he has been excruciatingly careful to conceal since signing on to the Trump ticket in the summer of 2016.

In this case, Pence’s private political considerations cost the administration a chance to elevate a fresh conservative to the federal bench when Kanne, who was nominated by President Ronald Reagan in 1987, revoked his senior status upon learning that Fisher wouldn’t be nominated to replace him.

""A number of weeks later, I got a phone call from [Fisher] saying, ‘It’s off, I’m not going to be named,’” Kanne said. “And I said, ‘If you’re not going to be named, then I’m not going to take senior status.’”

The virtually unprecedented move turned heads in legal circles at the time, but the backstory went unreported.

Pence almost never airs any disagreements with the president, even in private, and lavishes him with praise in public. Since Trump’s inauguration, he has worked to position himself as the president’s natural heir.

Like most vice presidents, he has packed his calendar with political events, but Trump’s disinterest in some of the routine aspects of coalition building have provided an opening for Pence to build his own base of support.

Pence has regularly hosted dinners at the Naval Observatory for conservative movement leaders and played a central role in convening White House gatherings focused on religious liberty and opposition to abortion.

Under the leadership of Don McGahn, the White House counsel’s office was focused almost singularly on filling the federal bench with conservative judges. | Chip Somodevilla/Getty Images

He also has embraced the role of sweet-talking deep-pocketed GOP benefactors, serving as the chief conduit between the administration and Republican donors the president has shown little interest in cultivating.

Pence has remained heavily involved with judicial nominations in his home state, and neither McGahn nor his deputies had consulted with the vice president’s office before striking the tentative deal with Kanne, a breach of protocol that rankled Pence and his aides, particularly Paoletta, who had a fraught relationship with McGahn.

Of particular concern to the vice president’s team was Fisher’s involvement in the litigation surrounding Pence’s attempt to stop Syrian refugees from settling in Indiana after the November 2015 terrorist attacks in Paris — a move that ultimately was knocked down in court.

A three-judge panel on the 7th Circuit ripped into Fisher’s defense of the Pence policy in an unusually vicious manner when he attempted to convince the court that the state had a legitimate concern about the federal government’s ability to vet Syrian refugees — and that they should instead be sent to other states.

“Honestly, you are so out of it,” Judge Richard Posner, who has since retired from the bench, told Fisher during the proceeding. “You don’t think there are dangers from other countries?” The Pence administration was handed a stinging legal defeat in September 2016, while the then-governor was on the campaign trail with Trump.

Pence had been elected governor of Indiana in November 2012, following stints as a radio talk show host and a member of Congress. His tenure in Indianapolis was tumultuous and hit a low point in the spring of 2015 when he signed the Religious Freedom and Restoration Act, a move cheered by religious conservatives but slammed by liberals and many businesses. A fix to the law passed by the Indiana Legislature left both groups unsatisfied, and Pence was in the midst of a difficult reelection battle when Trump tapped him as his running mate in July 2016.

Fisher, who became Indiana’s first solicitor general in 2005 under the state’s previous Republican governor, Mitch Daniels, continued on under Pence.

“The political issues that had been very controversial in Indiana while Pence was governor Fisher had also been very involved in because he was solicitor general, and that nomination would reignite those battles — and they could potentially embarrass the vice president,” said a former administration official involved in the conversations surrounding Fisher’s potential nomination.

Fisher did not respond to a request for comment."
Trump rips Paul Ryan as 'lame duck failure' with 'poor leadership',https://www.nbcnews.com,"['Adam Edelman', 'Adam Edelman Is A Political Reporter For Nbc News.']",07-12-2019,2019,7,https://www.nbcnews.com/politics/donald-trump/trump-rips-paul-ryan-lame-duck-failure-poor-leadership-n1029156,"Trump rips Paul Ryan as 'lame duck failure' with 'poor leadership'

“He quit Congress because he didn’t know how to Win,"" Trump wrote of the former House speaker in a late-night tweetstorm."
‘This wasn’t just a briefing’: Pompeo grilled CIA analysts on Russia findings,https://www.politico.com,['Natasha Bertrand'],07-12-2019,2019,7,https://www.politico.com/story/2019/07/12/pompeo-cia-russia-findings-1409190,"Mike Pompeo conducted a personal review of the CIA’s findings just after he took over as CIA director in 2017, but found no evidence of any wrongdoing. | Sarah Silbiger/Getty Images elections ‘This wasn’t just a briefing’: Pompeo grilled CIA analysts on Russia findings The DOJ is now reviewing those same findings after Mike Pompeo found no wrongdoing in how the agency concluded Russia wanted to help Trump in 2016.

Attorney General Bill Barr has ordered an investigation into whether the CIA was correct to determine that Russian President Vladimir Putin wanted to boost Donald Trump during the 2016 election.

But that question has already been asked and answered at the CIA’s highest levels — by Mike Pompeo, a Trump loyalist, according to three people familiar with the matter.

Story Continued Below

Just after Pompeo took over as CIA director in 2017, he conducted a personal review of the CIA’s findings, grilling analysts on their conclusions in a challenging and at times combative interview, these people said. He ultimately found no evidence of any wrongdoing, or that the analysts had been under political pressure to produce their findings.

“This wasn’t just a briefing,” said one person familiar with the episode. “This was a challenging back and forth, in which Pompeo asked the officers tough questions about their work and how they determined Putin’s specific objectives.” Pompeo also asked about CIA’s work with the FBI on the Russia probe in 2016. Two U.S. officials further confirmed to POLITICO that the interview occurred and was robust.

Additionally, a congressional official said Pompeo and his deputies never gave any indication to lawmakers, even behind closed doors, that the CIA had acted improperly or drawn incorrect conclusions about Putin’s desire to help Trump get elected. Special counsel Robert Mueller and the Republican-led Senate Intelligence Committee also separately reaffirmed the intelligence community’s assessment of Moscow’s motivations in 2016.

POLITICO Playbook newsletter Sign up today to receive the #1-rated newsletter in politics Email Sign Up By signing up you agree to receive email newsletters or alerts from POLITICO. You can unsubscribe at any time.

Still, Barr in May tapped John Durham, the U.S. attorney in Connecticut, to investigate many of these same questions. Barr said he wanted to find out whether there was inappropriate government “spying” on the Trump campaign that drove suspicions of a Kremlin link.

But the wide latitude he’s given Durham to also examine analytic conclusions drawn by CIA officers has alarmed some in the national security community who worry about its effect on the apolitical nature of intelligence gathering. And given Pompeo’s prior review — not to mention that of Mueller and Congress — the move has sparked cries of hypocrisy from those who say Trump is seeking his own “do-over,” something the president frequently accuses Democrats of attempting with their ongoing congressional hearings on the subject and mounting subpoenas of Mueller’s witnesses.

Michael Morell, the former acting CIA director, said the Justice Department is “absolutely the wrong organization to do the review.”

“The Justice Department’s job is to see whether a crime has been committed, not to assess the quality of intelligence analysis,” said Morell, who now hosts the Intelligence Matters podcast. “They have no training or experience in that.”

Jeffrey Edmonds, a former CIA analyst who served as a Russia adviser on the National Security Council during both the Trump and Obama administrations, said he is “worried” that Durham’s CIA inquiry “is a political attempt to undermine the intelligence community’s assessment.”

“It’s telling that Pompeo walked away from [his] review agreeing with the agency’s high confidence assessment” about Putin’s objectives, Edmonds added.

Indeed, the congressional official said, Pompeo’s own examination of the CIA’s analysis “really does call into question the purpose of the entire Durham exercise.”

In a statement, a person familiar with the situation said that Pompeo “routinely asks employees for their unvarnished assessments and opinions on important issues. Although no votes were changed, Secretary Pompeo agrees with the Intelligence Community’s report that the Russian government attempted to sow discord in our democracy and undermine our election process.”

The intelligence community has not made an assessment either way about whether the Russian meddling campaign altered actual votes.

The CIA declined to comment.

poster=""http://v.politico.com/images/1155968404/201905/1077/1155968404_6042731834001_6042727353001-vs.jpg?pubId=1155968404"" true

Trump’s allies have been fixated on the question of how the intelligence community determined that Russia intervened specifically to help Trump win rather than to just sow chaos and distrust in the Democratic process.

At the heart of their criticism is the “Intelligence Community Assessment of Russian Activities and Intentions” released in January 2017. In it, the CIA and FBI concluded with high confidence that “Putin and the Russian Government aspired to help President-elect Trump’s election chances when possible by discrediting Secretary Clinton and publicly contrasting her unfavorably to him.” The NSA reached the same conclusion with moderate confidence.

Notably, though, the FBI did not open its counterintelligence investigation into members of the Trump campaign because the CIA found that Putin was interfering to boost Trump’s candidacy, according to a person with knowledge of the probe. In fact, the CIA analysis of Putin’s motives appears to have followed, not preceded, the FBI’s probe, the person said.

House Intelligence Committee Republicans said in a report last year that the intelligence agencies “did not employ proper analytic tradecraft” when making those judgments about Putin’s motives. They stood by that assessment even after Putin announced during a joint news conference with Trump that he wanted the reality TV star to win “because he talked about bringing the U.S.-Russia relationship back to normal.”

The Senate Intelligence Committee, which reportedly interviewed CIA officers directly about the subject, implicitly rebuffed the House GOP in its own report.

""The Committee has spent the last 16 months reviewing the sources, tradecraft and analytic work underpinning the Intelligence Community Assessment and sees no reason to dispute the conclusions,"" the committee’s chairman, Republican Sen. Richard Burr, said at the time.

Mueller reaffirmed the intelligence community’s assessment, as well. His investigation determined that Russia “worked to secure” a Trump presidency, which it perceived would be more beneficial to the Kremlin, according to his final report.

In addition to Durham’s investigation, the DOJ’s Office of the Inspector General and Utah U.S. Attorney John Huber are also conducting their own probes into the origins of the Russia probe and related matters. Barr appointed Durham around the time Mueller was wrapping up his two-year-long Russia probe, which did not establish a criminal conspiracy between the Trump campaign and Russian intermediaries to disrupt the 2016 election.

It’s unclear what mandate Durham is operating under and whether he is looking at the intelligence agencies with an eye to recommending criminal charges. He has not been appointed to lead a criminal investigation, and the Justice Department has formally described the inquiry only as a “review.” Durham also won’t be leaving his day job in Connecticut.

It’s a setup that has unnerved intelligence veterans across the political spectrum.

“I don't think this is an appropriate job for the Justice Department,” said John McLaughlin, who served as the CIA’s deputy director and acting director under Presidents Bill Clinton and George W. Bush.

“Analysis inevitably includes an element of judgment on top of whatever hard data is amassed,” he added. “It's not something you can assess confidently with a standard prosecutorial yardstick.”

Morell agreed.

“Because they’re prosecutors, when they come knocking on an analyst’s door and say, ‘We want to talk to you about your judgment,’ it has a chilling effect,” he said. “Analysts might think twice in the future about making a tough call.”"
How Trump could win in 2020: Democrats nominate a very liberal candidate,https://www.cnn.com,['Analysis Harry Enten'],07-12-2019,2019,7,https://www.cnn.com/2019/07/12/politics/how-do-liberals-do-against-trump-2020-analysis/index.html,"(CNN) President Donald Trump's approval rating among voters has been stuck at or below 45% for pretty much his entire presidency. And, at this point in the campaign , a record percentage of voters say they'll vote against him .

So how does Trump win a second term? The answer may be that the Democrats nominate a very liberal candidate, something Democratic voters seem willing to do.

Further, Harris, Sanders and Warren are considerably further left of the 43 House Democrats who won seats from Republicans in 2018 -- the candidates who gave the Democrats their House majority.

The early evidence suggests that being seen as very left could make the difference. A recent ABC News/Washington Post poll found that Trump would beat a candidate perceived as a socialist by a 49% to 43% margin. That same poll gave Biden a 10-point advantage over Trump, while all the other top Democrats were either tied with (Warren), up by a point (Sanders) or up by 2 (Harris) over Trump. While some of this is likely because of name recognition -- though, as I've noted before, Warren and Sanders are well known -- the more liberal candidates have consistently done worse than Biden has against Trump.

Biden's ahead of Trump 49% to 41% in an average of more than 20 national polls taken since January. In these same polls, this 8-point lead for the Democrat slims to 5 points against Sanders (47% to 42%) and to 1 point against Warren (44% to 43%). Biden's better standing in the general election polls is driven by him being far better liked by non-Democratic voters than Sanders or Warren.

These polls look a lot like what you'd expect given research on the topic. A hallmark study by Stanford University's Andrew Hall and Daniel Thompson looking at congressional races from 2006 to 2014 demonstrated that more moderate candidates performed more strongly. This is because extreme candidates on one side tend to raise the opposition's turnout. (This runs counter to the argument that base candidates raise turnout to help their side win. Instead, it may be the opposite.) My own simple examination of the 2006-2018 House returns indicates that incumbents with more moderate voting records continued to have an advantage, once we control for a district's voting history and money spent by the campaigns.

The sample size for presidential elections isn't anywhere as large, but ideology probably also matters there. FiveThirtyEight's Nate Silver has shown that since the 1940s, more moderate presidential candidates do better on average

Ideology may have been part of the reason Trump won in 2016. He was seen as the least conservative Republican presidential nominee since at least Gerald Ford in 1976. Trump's ability to escape the very conservative label likely had to do with how he mixed in more moderate rhetoric on everything from infrastructure to the social safety net and even gay rights.

Now, to be clear, having a liberal voting record and being seen as liberal by the voters don't necessarily go hand-in-hand. After all, Clinton and Obama were both seen as quite liberal , even though their records weren't that liberal. Perhaps some of the more liberal Democrats won't be seen as liberal this time around.

Further, ideology is far from the only thing that matters for election outcomes. Good personal stories matter, for instance. Sometimes the fundamentals are so clearly pointing in one direction that extreme candidates win anyway. Sometimes strong candidates can overcome being far left or far right, and otherwise weak centrist candidates don't win. Obama won two terms, despite being seen as very liberal. George W. Bush actually did better in 2004 than in 2000, even though voters viewed him as considerably more conservative the second time around. And Jimmy Carter's perceived moderate views didn't solve him from a bad economy in 1980.

Nominating a very liberal candidate is a risky bet, though, especially given the polling so far. The well-known left candidates are doing worse than the more moderate one. Nominating one of them certainly strays from the playbook that Democrats used in the 2018 election to take back the House."
Trump officially issues executive order to tally citizens through the Commerce Department,https://www.washingtonexaminer.com,[],07-12-2019,2019,7,https://www.washingtonexaminer.com/news/trump-officially-issues-executive-order-to-tally-citizens-through-the-commerce-department,"President Trump officially issued his executive order Thursday, which demands all other departments and agencies provide the Commerce Department with any information related to citizenship.

Trump issued the order after courts ruled against having the citizenship question on the 2020 census. The order was also issued to avoid delaying the census any longer.

""To achieve that goal, I have determined that it is imperative that all executive departments and agencies provide the Department the maximum assistance permissible, consistent with law, in determining the number of citizens and non-citizens in the country, including by providing any access that the Department may request to administrative records that may be useful in accomplishing that objective,"" the executive order states.

All agencies are being ordered to provide the citizenship data to an interagency working group that will be created to process the information.

State information on citizens will also be sent to the Commerce Department.

In the order, Trump outlines which information will be sent by which federal agency:



Department of Homeland Security: National-level file of Lawful Permanent Residents, naturalizations, F1 and M1 nonimmigrant visas, national-level file of customs and border arrival/departure transaction data

Department of State: refugee and asylum visas, national-level passport application data

Social Security Administration: Master beneficiary records

Department of Health and Human Services: CMS Medicaid and CHIP Information System

Trump has instructed the Commerce Department begin planning the administrative processes necessary to add the citizenship question to the census in 2030."
