Dems investigate claims that Pompeo's security picked up Chinese food,https://www.channel3000.com,['Michelle Kosinski'],07-01-2019,2019,7,https://www.channel3000.com/news/politics/national-politics/dems-investigate-claims-that-pompeos-security-picked-up-chinese-food/1091006223,"CNN image

WASHINGTON (CNN) - Democrats on a key House congressional committee are investigating allegations from a whistleblower within the State Department about Secretary of State Mike Pompeo and his family's use of taxpayer-funded Diplomatic Security -- prompting agents to lament they are at times viewed as ""UberEats with guns.""

Congressional investigators, who asked for the committee not to be named as they carry out their inquiries, tell CNN that a State Department whistleblower has raised multiple issues over a period of months, about special agents being asked to carry out some questionable tasks for the Pompeo family.

In April, for example, an agent was asked to pick up Chinese food—without Pompeo in the car. The whistleblower said this led agents to complain that they are now serving as ""UberEats with guns,"" which has created a buzz within the department, according to multiple Democratic congressional aides who cited the whistleblower.

On another occasion, the whistleblower told aides, a Diplomatic Security special agent was given the job of picking up the Pompeo family dog from a groomer.

And CNN has seen a document given to the committee aides by the whistleblower showing that in January, Diplomatic Security was asked by a person in Pompeo's office to pick up his adult son from Union Station in Washington and bring him to the family home.

Lon Fairchild, the special agent in Charge of the Diplomatic Security Service, did not deny that the specific trips, such as the dog or the takeout food, were carried out by agents, but said in a statement, ""I was head of Secretary Pompeo's security detail since his first day on the job. At no point during my service did he or any member of his family ask me or any member of my team to act in any way that would be inconsistent with our professional obligation to protect the Secretary 24-hours a day, 7-days a week.""

A former senior Diplomatic Security official told CNN such tasks would not be appropriate—especially without the Secretary himself in the car at the time—unless some specific threat was identified that necessitated those trips. For example, they said when former Secretary of State Warren Christopher started in the job, he had hoped his agents would go get groceries for him, but had to be told that that's not what they do.

The Diplomatic Security Service is the law enforcement and security arm of the State Department tasked with protecting US diplomacy and diplomats worldwide and securing the integrity of US travel documents.

While protecting the security of the secretary of state is an important task for the service, there are concerns that agents may have been asked to carry out inappropriate tasks while assigned to Pompeo.

According to the Code of Federal Regulations, a federal employee ""shall not encourage, direct, coerce, or request a subordinate to use official time to perform activities other than those required in the performance of official duties or authorized in accordance with law or regulation.""

It is unclear if Pompeo requested the allegedly improper arrangements or whether they were made by someone on his staff without his knowledge.

But the whistleblower said there is a culture within Diplomatic Security to try and please the secretary and avoid upsetting him.

Former government ethics czar Walter Shaub told CNN ""sending subordinates to run personal errands for you is the very definition of misuse of position.""

Concerns about Susan Pompeo's security arrangements

Those personal-seeming tasks might be eye-catching, but congressional investigators say the State Department whistleblower told them the bigger issue causing concern among some agents is the question of why Pompeo's wife, Susan, has her own security detail, assigned to her in 2018, even while she is at home in the United States.

""There is a lot of confusion among agents over this, over why this is justified,"" one aide told CNN. ""Because according to this source they have seen nothing to indicate it is justified. In fact just the opposite. It's their understanding there was no finding of a high-enough level threat to merit this detail."" The whistleblower told these investigators that multiple special agents and supervisors within Diplomatic Security understood that a formal threat assessment had not been carried out, under longtime standard operating procedure, and that there is no specific threat against Susan Pompeo.

Furthermore, the whistleblower told aides that shortly after Susan Pompeo received her personal security detail, in July 2018, agents were verbally told not to use her callsign—which is ""Shocker""—over the radios or publicly. The reason, according to one aide, citing the whistleblower, was that ""they knew it wasn't kosher.""

CNN has viewed an email from within the State Department confirming that she has an agent assigned to her, along with her callsign. The assistant secretary overseeing Diplomatic Security, Michael Evanoff, was included in the correspondence. The subject line says ""Shocker Detail.""

The former senior Diplomatic Security official who asked not to be identified said that such a full-time detail for a spouse is unusual and would only be assigned once a formal process was followed, assessing the need for such security. They said that the risk investigation would be performed by Diplomatic Security's Protective Intelligence and Investigations Division, in the Office of Threat and Intelligence Analysis. The former official told CNN this protocol has existed within Diplomatic Security for decades. And that in this person's lengthy tenure at Diplomatic Security, no spouse was ever given a security detail for more than a short, specific period of time.

One congressional aide told CNN that under the current administration, ""We have a lot of concerns over how things are being conducted within Diplomatic Security. There is a lack of transparency.""

A State Department spokesperson insisted that a threat assessment for Susan Pompeo was carried out by the Protective Intelligence and Investigations Division, but would not tell CNN when that happened.

""The provision of a protective detail to Mrs. Pompeo is expressly authorized by federal law. In this case, Diplomatic Security determined that the threat warranted the provision of such a protective detail to Mrs. Pompeo and began providing it as of July 28, 2018.""

In a statement, Assistant Secretary of State for Diplomatic Security Michael Evanoff said, ""The Diplomatic Security Service has been protecting the spouse of the Secretary of State since the 1970s as the security threat dictates. We are a federal law enforcement agency, and this is an integral part of our core mission. Today the security threats against Secretary Pompeo and his family are unfortunately very real. The Diplomatic Security Service is proud to protect the Pompeo family from those who would harm the Secretary of State and the United States.""

Concerns about how Trump admin officials have used government resources

These questions about Pompeo are the latest in a slew of ethics allegations surrounding Trump administration Cabinet secretaries and their use of government resources.

Former Environmental Protection Agency administrator Scott Pruitt left his position after a series of ethical questions about his security team; the former head of Health and Human Services, Tom Price, resigned after a scandal over his use of private planes; Housing and Urban Development Secretary Ben Carson was assailed for extravagant taxpayer-funded furniture purchases. Interior Secretary Ryan Zinke stepped down amid probes of his real estate dealings and conduct in office. And Former Secretary of Veterans Affairs David Shulkin left that job under an ethics cloud after a damning inspector general report criticized him for improperly accepting gifts and misrepresenting travel plans.

The aides said another whistleblower has come forward, who worked on the State Department's executive seventh floor where the secretary of state and top aides are based—telling them that employees there have been told not to put information concerning Susan Pompeo into official emails, so that it would not be preserved in required recordkeeping.

The role Susan Pompeo has played within the State Department and when the secretary travels is another area of concern to congressional aides, Diplomatic Security officers and multiple sources within the State Department and the CIA, which Pompeo previously led.

Several sources told CNN when Susan Pompeo accompanies the secretary on certain trips she has not only had a dedicated special agent to tend to her, but also a State Department staffer.

They said that ahead of a recent trip to Kansas, during which she accompanied her husband, she had at times chaired meetings on trip logistics at the State Department, which raised eyebrows, including of senior State officials.

One person familiar with the situation called it ""the worst kept secret at State,"" telling CNN, ""[Secretary Pompeo] takes her on ... trips, has separate meetings, requiring control officers, motor pool assets, security, and time. It was especially brazen during the shutdown when people were actually called into the embassy while furloughed. Just one more thing killing morale at the department."""
"Agents feared riots, armed themselves because of dire conditions at migrant facility, DHS report says",https://www.nbcnews.com,"['Julia Ainsley', 'Julia Ainsley Is A Correspondent Covering The Department Of Homeland Security', 'The Department Of Justice For The Nbc News Investigative Unit.', 'Jacob Soboroff', 'Jacob Soboroff Is A Correspondent At Msnbc.']",07-01-2019,2019,7,https://www.nbcnews.com/politics/immigration/dhs-warned-may-border-station-conditions-so-bad-agents-feared-n1025136,"Agents feared riots, armed themselves because of dire conditions at migrant facility, DHS report says

The findings counter the statement by a top Trump admin official that reports of poor conditions for migrants at border stations were “unsubstantiated.”"
U.S. states sue EPA for stricter asbestos rules,https://www.reuters.com,"['Jonathan Stempel', 'Min Read']",07-01-2019,2019,7,https://www.reuters.com/article/us-usa-asbestos-lawsuit/us-states-sue-epa-for-stricter-asbestos-rules-idUSKCN1TW3N6,"(Reuters) - Ten U.S. states and Washington, D.C. sued the Environmental Protection Agency to begin working on rules to tighten oversight of asbestos, and reduce the health risks that the substance poses to the public.

FILE PHOTO: A ""Danger Asbestos"" sign is seen as a demolition crew removes the remains of a demolished home, next to an occupied one, in a neighborhood filled with blight in Detroit, Michigan, November 24, 2015. REUTERS/Rebecca Cook/File Photo

The attorneys general from California and Massachusetts, Xavier Becerra and Maura Healey, said on Monday they are leading the case, after the EPA denied the states’ petition that it collect more data on asbestos.

A spokesman for the EPA and its administrator, Andrew Wheeler, said the agency does not discuss pending litigation.

Asbestos is a carcinogen once used widely in fireproofing and insulation. Many companies stopped using it by the mid-1970s after it was linked to mesothelioma and other types of cancer.

Federal law still allows limited uses of asbestos, and Congress in 2016 amended the federal Toxic Substances Control Act (TSCA) to create a process for regulating the substance. Symptoms from asbestos exposure can take decades to surface.

“Asbestos is a known carcinogen that kills tens of thousands of people every year, yet the Trump administration is choosing to ignore the very serious health risks it poses,” Healey, a Democrat, said in a statement.

“There’s too much at stake to let the EPA ignore the danger that deadly asbestos poses to our communities, including to workers and children,” added Becerra, also a Democrat.

Connecticut, Hawaii, Maine, Maryland, Minnesota, New Jersey, Oregon and Washington state joined the lawsuit.

The EPA has said protecting people from asbestos exposure is a priority, including through an April rule giving it power to review asbestos products that were no longer on the market before they could be sold again in the United States.

In denying the states’ petition, the EPA determined that it was already aware of all current uses of asbestos, and had the essential information needed to assess the risks, according to the Federal Register.

But the states believe this denial was arbitrary and capricious, and violated the EPA’s obligations under the TSCA.

The lawsuit was filed late on Friday in the federal court in Oakland, California.

It is one of many lawsuits by Democratic-controlled or Democratic-leaning states challenging policies by the administration of U.S. President Donald Trump, a Republican, including the rolling back of some environmental protections.

The case is California et al v Environmental Protection Agency et al, U.S. District Court, Northern District of California, No. 19-03807."
These USDA employees face a stark choice: Move to Kansas City or be fired,https://www.washingtonpost.com,"['Joe Davidson', 'Columnist Focusing On Federal Government Issues', 'July At Am']",07-01-2019,2019,7,https://www.washingtonpost.com/politics/2019/07/01/these-usda-employees-face-stark-choice-move-kansas-city-or-be-fired/,"

Agriculture Secretary Sonny Perdue and President Trump speak during a signing ceremony for a farm bill. (Jabin Botsford/The Washington Post)

Columnist

The Agriculture Department is offering employees a rare choice: accept a forced transfer to a post 1,000 miles away or be fired.

The Trump administration’s plan to move two agencies from the District to the Kansas City area includes a document with two blank boxes on it, sent to employees on June 13. Check one, it instructs: Accept the transfer by July 15 or “be separated by adverse action procedures.”

That means getting fired, with an opportunity to appeal the dismissal through what could be an expensive process. Getting fired could also make it more difficult to find another federal job in an area where the government dominates.

Although a limited number of buyouts and early retirement opportunities will be available for what union officials expect to be fewer than 15 percent of those affected, and while some USDA employees might find work in government positions elsewhere in the D.C. area, the disruption to employees generally will be substantial.

“Adverse action” can have another meaning that goes beyond the affected employees and more broadly hits taxpayers, organizations and businesses. In addition to the big hassle for workers, relocations could have an adverse impact — a major brain drain — on the work of the two agencies, the Economic Research Service and the National Institute of Food and Agriculture.

Union officials estimate a strong majority of employees will decline reassignment. If that happens, the work of the small but important agencies could be seriously upset. Even before Agriculture Secretary Sonny Perdue announced the Kansas City region as the new location, but after officials said the agencies would be moving out of the District, department employees quit in droves, my colleague Ben Guarino reported last month.

“The current and projected attrition will curtail research data products that encompass commodity estimates, agricultural sector forecasts, food and farm economic and statistical indicators for U.S. agriculture, conservation, and food policy and markets,” said Kevin Hunt, a 10-year USDA employee, speaking as acting vice president of the American Federation of Government Employees (AFGE) Local 3403 representing research service staff.

What the government calls “directed reassignments” to a different city are “very rare in the federal government. That's not something that is a common practice,” said Joanna Friedman, a federal employment lawyer with the Federal Practice Group. “This is unprecedented.”

When the Pentagon closed bases around the country starting in 2005, it forced many defense civilians to make a similar choice. “We lost a lot of talent in geographic moves,” said Jeffrey Neal, formerly the top personnel officer at the Defense Logistics Agency and the Department of Homeland Security. “A 20 percent take-up rate is typical.”

Not only are government transfers like the USDA’s uncommon, but the size makes this one especially unusual. Typically, they are much smaller, said Neal, now a senior vice president with the ICF consulting firm. “Years ago, people were more likely to move with their jobs,” he added. “With most people living in two-wage-earner households, it is far more difficult to just pack up and go.”

Many, perhaps most, affected USDA employees are considering a third option — quit and find new work.

“I will be unemployed beyond Sept. 30,” which is the deadline for the District-based workers to report to the new location, Hunt said, “unless I can find another job.”

Of the 547 employees the department wants to move for the two agencies combined, 253 are with the Economic Research Service, 77 percent of its 329-person workforce. An additional 294 are with the National Institute of Food and Agriculture, 93 percent of its 315-person staff. News of the move prompted a surge of support for the union. Employees at the National Institute voted 137-2 to join AFGE two weeks ago. Last month’s vote at the economic service was 138-4.

When Perdue announced the moves to the Kansas City area, he said, “We did not undertake these relocations lightly, and we are doing it to enhance long-term sustainability and success of these agencies. The considerable taxpayer savings will allow us to be more efficient and improve our ability to retain more employees in the long run.”

But the USDA estimate of nearly $300 million in savings over 15 years is way off, according to an analysis by the Milwaukee-based Agricultural and Applied Economics Association. Instead, it would cost taxpayers between $83 and $182 million, the analysis found. The USDA underestimated the true cost in part because it did not account for “the lost value of research from staffers who resign or retire rather than move,” the association reported.

A group of Democratic senators, including all four from Maryland and Virginia, has introduced legislation to keep the headquarters of the two agencies within the D.C. area.

Andrew Crane-Droesch, an economist with the research service, said he is not moving and is now looking for another job in the D.C. area. “Definitely the choice we face is move to Kansas City or lose our jobs,” he said. “I’m certainly not happy. I love my job, but I can’t move to Kansas City, and moreover, I don’t want to even if I could.”

Like Crane-Droesch, these staffers “have families, they are part of a community and they’ve been dedicated public servants,” said Rep. Gerald E. Connolly (D-Va.), chairman of the House Oversight and Reform subcommittee on government operations. “They deserve better than having such a radical and consequential do-or-die decision, which is hardly a fair choice, thrown at them at the last minute.”

Read more:

Democrats running out of options to stop Trump from moving two USDA offices

Moving USDA research agencies is part of Trump’s war on science and statistics

USDA research agencies will move to Kansas City region despite opposition

USDA division votes to unionize as employees protest planned relocation"
Trump in Asia: ‘We’re the Hottest Show in Town’,https://www.nytimes.com,['Peter Baker'],07-01-2019,2019,7,https://www.nytimes.com/2019/07/01/us/politics/trump-asia-trip.html,"Using the initials for North Korea’s formal name, the Democratic People’s Republic of Korea, Mr. Carafano added: “If D.P.R.K. doesn’t come through, then his supporters will give him chips for trying, we are no worse off and D.P.R.K. is just as isolated, no matter how many selfies Kim has with Trump.”

The selfie with Mr. Kim was Mr. Trump’s most celebrated and criticized act during his trip, the one that put on display his flair for improvisation and spectacle. No other president would have posted a message on Twitter inviting North Korea’s dictator to meet him at the Demilitarized Zone barely 24 hours later and then step over the line to become the first sitting president to enter North Korea.

In another administration, such a move might have been deliberated for weeks, put through an interagency process and approved only as part of a comprehensive approach to pressuring North Korea into giving up its nuclear program — a reward for progress. Mr. Trump himself had previously been talked out of just such a move by cautious advisers. But this time he could not resist the idea of a showy “first,” whether it fit a long-term strategy or not.

In creating his preferred version of the story, Mr. Trump said he just came up with the idea when he woke up in Osaka on Saturday morning and spontaneously posted the message on Twitter. It was true that he caught his aides off guard, forcing them to scramble to see if a tweet could be turned into reality.

But it was not true that he just thought of it Saturday morning. He had talked about it at least five days earlier with journalists for The Hill news organization, which was then asked by the White House not to reveal that out of security concerns.

As with so many things, that reality did not fit neatly into the story line Mr. Trump was fashioning, so it was disregarded. The other part of his chronicle was how he was cleaning up the “fiery mess” he said was left by Mr. Obama.

He claimed that Mr. Obama wanted to meet with Mr. Kim only to be rebuffed and that had the last president stayed in office, he would have gone to war with North Korea — a pretty fanciful revision of history, according to advisers to the former president, but one that suited the heroic epic Mr. Trump was writing for himself."
