The latest USDA crop data shows ‘a difference of opinion on what reality is',https://www.accuweather.com,[],,,,https://www.accuweather.com/en/weather-news/the-latest-usda-crop-data-shows-a-difference-of-opinion-on-what-reality-is/70008685,"June 28, 2019 The latest USDA crop data shows ‘a difference of opinion on what reality is'

By John Roach, AccuWeather staff writer June 28, 2019, 2:12:42 PM EDT



There were surprising numbers in the annual U.S. Department of Agriculture (USDA)/National Agriculture Statistics Service (NASS) acreage estimates for corn and soybeans released Friday.

Corn-planted area for all purposes in 2019 is estimated at 91.7 million, a 3% increase from last year. Soybean-planted area is estimated at 80 million acres, down 10% from last year.

However, the average estimate from industry analysts in advance for U.S. corn was 86.66 million, which is significantly lower than the survey's figures. Those estimates took into consideration the rain and flooding that has affected U.S. farmers this year.

For soybeans, the industry analysts' average estimate was 84.36, a higher estimate than the survey's data for soybeans.

“There’s a difference of opinion on what reality is,” said AccuWeather senior meteorologist Jason Nicholls. “The USDA just put out their opinion, but that’s not the opinion a lot of others have.”

It’s also inconsistent from previous USDA estimates, although this USDA/NASS survey is separate and independent from the USDA’s own May and June estimates. The USDA estimated corn planted acreage at 92.8 and then 89.8 in May and June, respectively.

For soybean planted acreage, the USDA in both May and June estimated 84.6 million acres.

For comparison, in 2018 there were 89.1 million acres of corn planted and 89.2 million acres of soybean planted.

Report a Typo"
Acting Homeland Security chief denies leaking info on ICE raids: 'It's just not true',https://www.foxnews.com,"['Victor Garcia', 'Kevin Mcaleenan', 'Acting Dhs Secretary']",,,,https://www.foxnews.com/politics/dhs-head-denies-he-leaked-ice-raid-info-says-dems-decriminalizing-border-crossings-would-add-to-the-problem,"The acting head of the Department of Homeland Security on Thursday night denied leaking information that eventually led to the cancellation of ICE raids in 10 cities across America.

""I would not, have not, ever leaked details of a sensitive law enforcement operation,"" acting Secretary Kevin McAleenan said during an appearance on Fox News' ""The Ingraham Angle.""

""My primary responsibility,"" he added, ""is the safety of the men and women who go out there every day to protect the American people. And so it's just not true.""

TRUMP DELAYS PLANNED ICE RAIDS TO SEE IF CONGRESS CAN SOLVE BORDER CRISIS

""My primary responsibility is the safety of the men and women who go out there every day to protect the American people. And so it's just not true."" — Kevin McAleenan, acting DHS secretary

McAleenan was accused last week of leaking plans for raids scheduled by U.S. Immigration and Customs Enforcement (ICE), a unit of the DHS, after supposedly expressing fierce opposition to the plan and allegedly ordering top officials to “stand down” on the operation.

The source also said Homeland Security officials had been planning the raids since April and that McAleenan had been opposed to the plans from the start.

McAleenan also denied that anyone in his office leaked the information after host Laura Ingraham pressed further, saying that as the operation date nears ""you have to push information out into the field.""

""So tonight you're saying these rumors are wrong false and you did not do that?"" Ingraham asked.

""Absolutely not,"" McAleenan responded.

The acting secretary also commented on the Democratic presidential candidates advocating for decriminalizing illegal border crossings, saying it would ""further undermine our efforts at the border"" and increase the numbers of those crossing the U.S.-Mexico border.

""Decriminalizing crossing between ports of entry when we know it's associated with criminal smugglers ... when they know they bring drugs behind those people that are crossing, it would just add to the problem,"" McAleenan said.

""Decriminalizing crossing between ports of entry ... it would just add to the problem."" — Kevin McAleenan, acting DHS secretary

CLICK HERE TO GET THE FOX NEWS APP

McAleenan was also asked about the candidates' platform of free health care for illegal immigrants.

""We've got a lot of issues to solve domestically [with] the homeless population and medical care as it is,"" McAleenan said.

Fox News' Brooke Singman contributed to this report."
Trump campaign looks to gain support with Latino voters despite president’s harsh approach to immigration,https://www.washingtonpost.com,"['Josh Dawsey', 'Reporter Covering The White House']",06-29-2019,2019,6,https://www.washingtonpost.com/politics/trump-campaign-looks-to-gain-support-with-latino-voters-despite-presidents-harsh-approach-to-immigration/2019/06/29/41aa413e-9776-11e9-a027-c571fd3d394d_story.html,"Vice President Pence speaks during the launching of the “Latinos for Trump” coalition in Miami on Tuesday. (Cristobal Herrera/EPA-EFE/Shutterstock)

In an effort to buttress President Trump’s reelection chances, the Trump campaign is reaching out to an unlikely group: Latino and Hispanic voters.

In recent weeks, the campaign has made several hires to court these voters and placed targeted ads in Florida. Meanwhile, Trump conducted his first presidential interview with Spanish-language media giant Telemundo, and Vice President Pence flew to Miami on Tuesday to officially launch the “Latinos for Trump” coalition.

“All Americans everywhere draw inspiration from the Latino Americans’ steadfast love of liberty,” Pence said, appearing in front of a ballroom crowd.

The president’s aides and advisers said the effort to target Latino voters reflects the need to expand the president’s base of support beyond his most fervent backers to prevail again in key swing states such as Florida as well as a belief that Trump can make a compelling case based on the performance of the economy.

“It’s absolutely critical to his reelection to win over some Hispanic voters, and he can do it by being a little more open on some of these immigration issues. He doesn’t need a majority. He just needs to move the needle,” said Chris Ruddy, a longtime Trump friend. “He has too many people around him telling him to stick to the base when he owns the base.”

But Trump faces an enormous challenge given his fraught relationship with the Latino community that began when he launched his campaign in 2015 by disparaging Mexican immigrants and continues through his frequent warnings about the dangers posed by Central American migrants trying to enter the United States across the southern border.

For many of the president’s opponents, the outreach efforts are viewed as a cruel joke amid the backdrop of the humanitarian crisis at the U.S.-Mexico border, his harsh attacks on immigrants and threats of deportation. Melissa Mark-Viverito, the interim president of the liberal Latino Victory Fund, said she expects a record number of Latino voters to show up at the polls to cast their ballots against Trump.



“Every day, it’s an onslaught against our community. We know we’re under attack. We know nothing good is going to come out of a second term of this administration,” she said. “It’s a slap in our face.”

Polling released this week by Telemundo underscored the challenge facing the campaign in attracting Latino and Hispanic voters. In the key swing state of Florida, 34 percent of Hispanic voters would like to see Trump reelected, while 56 percent would prefer to replace him with a Democrat, according to the survey conducted by Mason-Dixon Strategies.

The numbers were even less favorable to Trump in other states, although they are mostly solid Democratic territories.

In California, 26 percent of Hispanic voters would like to see Trump reelected, while 66 percent would prefer a Democrat. In Texas, 25 percent would like to see him returned to office, while 69 percent want a Democrat. And in the New York metro area, 19 percent want Trump reelected, while 73 percent prefer a Democrat.

Trump won 28 percent of the Latino vote in 2016, compared with more than 40 percent for George W. Bush in 2004 — though he essentially matched Mitt Romney’s 2012 total.

About 29 million Latino voters are now registered to vote, and almost 12 million voted in the 2018 midterm elections, according to the Pew Research Center.

Trump’s supporters say the president should frame his message around the economy and national security. Hispanic unemployment is at historic lows, and campaign officials say many Hispanic voters even appreciate the president’s tough immigration rhetoric. They declined to show data supporting that assertion, and some of the campaign’s early data indicates the president is in a disappointing spot among Latino voters, according to campaign officials who were granted anonymity to discuss the issue.

The campaign on Wednesday bought two full-page ads in the Miami Herald and the Nuevo Herald, making an economic argument for “Latinos for Trump.”

The ads also argued a point campaign officials often make. “President Trump is clear on immigration: Millions have followed the law to come to America, new immigrants should too,” the ad read.

But even some of the president’s supporters are skeptical about the campaign’s ability to attract more Latino voters.

Al Zapanta, who leads the U.S.-Mexico Chamber of Commerce, said he supported Trump in 2016 and is helping lobby for passage of the recent trade deal struck with Mexico and Canada. He has recently visited the White House for meetings with senior officials, he said, but not the president.

“The Republican Party has really missed the opportunity to bring in the Hispanic and Latino vote,” Zapanta said. “The party still hasn’t decided they really want to make that a reality.”

Zapanta said he believed Trump could secure more support and hoped he would. “I haven’t seen at this point that focus,” he said.

Officials have been trying to sell donors on the idea that Trump can be more competitive with Latino voters, with campaign manager Brad Parscale saying during a recent presentation at the Willard Hotel that the campaign expected to secure more support from the community, according to people familiar with his remarks.

The campaign recently hired a coalitions director to build support among Latino communities, and it has hired a national press secretary to handle Latino members of the media. Hannah Castillo, the coalitions director, is expected to hire at least a dozen people, campaign officials said. About two dozen community and political leaders in Arizona, California, Florida, Nevada and other states are on board, according to the campaign.

Also on board is Alex Garcia, the RNC’s Latino outreach director in Florida in 2018, to lead the Trump campaign in the state. Advisers are building advertisements to target voters in Spanish, and they have targeted particular communities in Florida for messaging.

In Venezuela, Trump and his aides see policies that are appreciated by Cuban Americans — even though the effort to oust President Nicolás Maduro has stalled, and Trump has grown frustrated.

Jared Kushner, the president’s son-in-law, has cast his legal immigration plan as a messaging device to the Latino community, White House officials said. But the plan has picked up scant support while the president continues to use incendiary rhetoric.

Still, campaign aides said they believe there have been heartening signs. At an El Paso event, much of the crowd was Hispanic and in from New Mexico, officials said, giving the campaign hope they could play in a state where Trump lost by a large margin in 2016.

Ruddy said the campaign must do more to convince Latino news outlets to change coverage of Trump. “Only a handful of media outlets really control news to the Latino population, and they are almost entirely nonstop, anti-him,” he said.

Doug Deason, a prominent Trump donor, said he recently spoke with the president about Hispanic voters at the Trump International Hotel in Washington. Deason said he encouraged the president to occasionally tweet about how much he loves Hispanic voters and what he has done for them.

“They’re just concerned. Does he like us? So he needs to make it really clear. I told him, you have to let them know you love them,” Deason said. “I know you love them, but you have to let them know.”

Trump seemed surprised, he said.

“He was shocked to hear that,” Deason said. Trump, according to Deason, then turned to Kellyanne Conway, his former campaign manager and now a senior White House adviser, and said “You got that, Kellyanne?”

“She said, ‘Yes sir, I got it,’ ” Deason said.

Correction: An earlier version of this story innaccurately stated that Trump conducted his first presidential interview with Spanish-language media outlet Univision.

Jenna Johnson, John Wagner and Chelsea Janes contributed to this report."
"Democratic senator blocks DHS nominations, citing border conditions",https://www.cnn.com,['Priscilla Alvarez'],06-27-2019,2019,6,https://www.cnn.com/2019/06/27/politics/democratic-senator-holds-dhs-nominations/index.html,"Washington (CNN) Democratic Sen. Jacky Rosen is blocking two of President Donald Trump's Department of Homeland Security nominees, citing ""inhumane and substandard"" conditions for children at the department's facilities, according to her office.

Rosen said she will delay the nominations of Chad F. Wolf for DHS under secretary for strategy, policy, and plans and Troy D. Edgar for chief financial officer. Earlier this month, the two appeared before the Senate Homeland Security and Governmental Affairs Committee.

The future of their nominations now remain on hold, ""until the inhumane and substandard conditions for children at DHS processing and detention facilities improve significantly,"" Rosen said in a statement.

""I will maintain these holds until a nongovernmental third party certifies that DHS has complied. I will use all tools available to hold this Administration accountable for their treatment of vulnerable children and families,"" she added.

The move is yet another setback for the Trump administration which has been occupying several roles in DHS with acting heads, particularly in leadership.

Read More"
USDA reports large U.S. soybean sale to China ahead of Trump-Xi meeting,https://www.reuters.com,"['Karl Plume', 'Min Read']",06-28-2019,2019,6,https://www.reuters.com/article/us-usa-trade-china-soybeans/usda-reports-large-us-soybean-sale-to-china-ahead-of-trump-xi-meeting-idUSKCN1TT2ET,"CHICAGO (Reuters) - The U.S. Department of Agriculture (USDA) on Friday reported a large soybean sale to China, an apparent goodwill gesture a day before the first meeting between U.S. President Donald Trump and Chinese President Xi Jinping in seven months.

FILE PHOTO: Soybeans sit in a truck in Leonore, Illinois, U.S., July 6, 2018. REUTERS/Daniel Acker/File Photo

The trade war has curbed exports of U.S. crops to China and looms over the Group of 20 (G20) summit in Japan. Expectations have dimmed that the world’s two biggest economies can ease tensions when Trump and Xi meet in Osaka on Saturday.

The USDA said Chinese importers bought 544,000 tonnes of U.S. soybeans for shipment in the 2018/19 marketing year which expires Aug. 31. It was the largest U.S. soybean sale to China since late March, USDA data showed.

The USDA said in a statement the sale was new and not a change of destination of a previously announced sale.

The deal surprised some traders as soybean export premiums for late-summer shipments were unchanged this week, showing little evidence that a large purchase was occurring, and because recent large purchases have come only after talks between the two countries.

A sharp drop in China’s hog herd, which consumes most of the soybeans processed by the world’s largest pork market, due to a deadly hog disease called African swine fever has also reduced demand for the oilseed.

“To me it looks like a good faith purchase, which we’ve seen before, although in the past they came after the two presidents shook hands. Today it’s coming before they do so it may be trying to influence talks,” said Arlan Suderman, chief commodities economist for INTL FCStone.

“All this comes against a backdrop of China having ample supplies of soybeans and talk of them delaying shipment of July beans into August because of the big supplies,” he said.

Beijing had agreed to buy nearly 14 million tonnes from American farmers over December to March during a temporary truce in the trade spat.

More than 8 million tonnes of those have already been shipped to China, but about 6 million tonnes, including Friday’s sale, still need to be delivered.

Trump said on Friday he hopes for productive talks but made no promises about a reprieve from escalating tariffs that have cast a shadow on global growth.

U.S. soybean exports to China have plunged by more than 80 percent since Beijing slapped steep tariffs on shipments last July. China, the world’s top soybean importer, is on pace for its smallest U.S. soybean imports in 11 years as importers there have increased purchases from South America, mainly from top exporter Brazil."
"VA ordered fake appointments to cut waiting list, whistleblower says",https://www.washingtonpost.com,"['Joe Davidson', 'Columnist Focusing On Federal Government Issues']",06-26-2019,2019,6,https://www.washingtonpost.com/politics/whistleblower-says-va-ordered-fake-appointments-to-cut-waiting-list/2019/06/26/97e50648-9856-11e9-a027-c571fd3d394d_story.html,"Columnist

One day before Minu Aghevli testified at a House committee hearing about official Department of Veterans Affairs misconduct, she received a thick packet of documents that shook her life.

It amounted to a pink slip more than 170 pages long, including about 140 pages outlining reasons VA plans to fire her, according to Kevin Owen, her lawyer. The packet arrived on Monday. She testified on Tuesday.

Aghevli, 42, is a District native who has spent her entire 20-year career with VA. She is a clinical psychologist with a department opioid treatment program in Baltimore.

But the moniker that matters now for her is VA whistleblower. Aghevli has made disclosures that she said led department officials to dismiss her, despite her Gold VA Pins for excellent customer service.

Aghevli’s allegations are serious. They include phony-wait-list assertions of the type that have bedeviled VA since it was consumed by a scandal that broke in 2014. She also accused department officials of lying to Congress.

“In order to reduce the wait list, I was instructed to improperly remove veterans from the electronic wait list by scheduling fake appointments for them in an imaginary clinic,” she told the House Veterans’ Affairs subcommittee on oversight and investigations. “This clinic was not tied to any provider or location, nor did it actually correspond to any real visits. . . . The veterans scheduled for these fictitious appointments were not actually receiving VA care.” Aghevli said she protested and did not do as instructed.



Minu Aghevli, a VA whistleblower who testified before a House subcommittee in Washington on Tuesday. (Obtained by The Washington Post)

Other actions to seemingly reduce the number of veterans awaiting care, she said, included coding indigent patients as “care no longer needed” without confirming that.

When lawmakers demanded information about VA wait lists in September 2015, she said, “the VA deliberately sent these incorrect numbers to Congress.”

A VA statement said Aghevli’s proposed firing “is in no way related to any whistleblower activity. Rather, it is due to a number of serious clinical practice allegations against the employee.”

The Office of Special Counsel has moved to block Aghevli’ s firing while it reviews her case. This special counsel protects federal whistleblowers and is not related a better-known special counsel, Robert S. Mueller III, who led a probe into Russia’s interference in the 2016 elections.

Aghevli is not alone in making recent allegations about VA misconduct. At the House Veterans’ Affairs oversight and investigations subcommittee hearing, Chairman Chris Pappas (D-N.H.) said the panel is investigating secret-wait-list charges made in a Federal Insider column last month by Jereme Whiteman, VA’s national director of clinic practice management.

Only whistleblowers and their advocates testified at the hearing. Pappas said VA officials would be invited to a later session.

VA Secretary Robert Wilkie in a letter to the panel expressed disappointment that officials were not included this week. “When the committee holds a hearing to air criticisms of the Department, while simultaneously preventing the Department from participating to offer context and defend itself,” he wrote, “the Committee’s efforts risk appearing more like a political news conference than a hearing aimed at a balanced look at serious issues.”

Jeffery Dettbarn, an Iowa City VA Medical Center employee, said he had an “unblemished record before blowing the whistle on the improper mass cancellation of what turned out to be tens of thousands of radiology orders.”

The retaliation against him, he said, is a “banishment” from patient care as a radiologic technologist that began in July 2017 and continues. “My current situation is unbearable. . . . I am forced to forgo about one-third of my salary” because he no longer gets on-call pay. “But worst of all,” he added, “the VA won’t let me care for veterans.”

Dettbarn said VA has attempted to fire him and also filed “bogus complaints to my licensing agencies. . . . All these allegations were unfounded, but these attacks are incredibly damaging and threaten my professional livelihood.”

VA said complaints about his clinical performance were raised by other VA whistleblowers and the decision regarding his disciplinary action was made before his disclosures.

Charges such as these led Tom Devine, legal director of the advocacy group Government Accountability Project, to tell the panel that VA “remains a free-speech Death Valley for government witnesses. . . . Retaliation is ingrained in the culture” of the department. Forty percent of the 25 whistleblowers he represents are VA clients, he said, “an extraordinary number for an agency that comprises less than 20 percent of the executive branch workforce.”

A department statement said “there is no other agency in the federal government that puts more of a focus on the importance of protecting whistleblowers.”

Aghevli said the retaliation against her caused episodes of severe panic and prolonged tachycardia, an abnormally rapid heart rate. She is on medical leave. Testifying for the first time before Congress was nerve-racking. “I felt both horrified and heartbroken, but also relieved,” she said, to have told her story.

Getting a notice of proposed termination the day before her testimony, when she told her office about it weeks before, was “deliberately intimidating towards me,” she said in an interview, and an effort to frighten other whistleblowers.

Aghevli said she was removed from patient care in April, a few weeks after her complaint about a patient safety issue. She is eager to return to “my veterans.”

“I love my job and the veterans that I treat,” she told the subcommittee. “I can’t imagine any job I’d rather do.”

She might have to start thinking about that. VA doesn’t want her anymore.

Read more:

Whistleblower says there’s a secret VA wait list for care. The department says that’s not true.

Does VA have a secret wait list for health care? Key members of Congress want to know."
