The US Treasury is calling for mandatory financial literacy courses for college students,https://www.cnbc.com,['Shawn M. Carter'],06-19-2019,2019,6,https://www.cnbc.com/2019/06/19/us-treasury-calls-for-mandatory-financial-education-for-students.html,"The U.S. Department of the Treasury released a new report on behalf of the Financial Literacy and Education Commission that recommends mandatory financial literacy courses for college students.

With the cost of college rising faster than incomes and a staggering 44 million Americans owing more than $1.5 trillion in student loans, there has been growing concern that students and their families are taking on debt without truly understanding the long-term impact.

﻿Indeed, there is a lot of research exploring this national problem: Nine out of 10 parents and students failed a 2018 quiz about student loan debt. Meanwhile, MarketWatch reported that half of college students taking an AIG survey on personal finance basics got two or fewer questions correct. And in a recent survey from the Brookings Institution, less than 30% of student respondents could correctly answer three questions on inflation, interest and risk diversification.

""Helping students and their families avoid the pitfalls associated with financing higher education, and empowering them to make optimal financial choices, should be a priority of all institutions of higher education,"" the report reads. ﻿"
Dems want to nuke DOJ policy barring presidential prosecutions,https://www.foxnews.com,"['Alex Pappas', 'Alex Pappas Is A Politics Reporter At Foxnews.Com.']",,,,https://www.foxnews.com/politics/dems-want-to-nuke-doj-policy-barring-presidential-prosecutions,"Special Counsel Robert Mueller said last month that charging President Trump with a crime “was not an option we could consider” because of the Justice Department policy barring the prosecution of sitting presidents.

Democrats are now talking about finding a way to change that.

“Congress should make it clear that presidents can be indicted for criminal activity, including obstruction of justice,"" Massachusetts Sen. Elizabeth Warren, a Democratic presidential candidate, recently proposed.

WARREN PROPOSES LAW SAYING A PRESIDENT CAN BE INDICTED

And other congressional Democrats have since said they are considering whether the DOJ's Office of Legal Counsel 1973 memorandum against charging a sitting president should be revoked -- though no legislation has been introduced just yet.

“It's fair to say that one of the options we should consider is revisiting that Department of Justice rule so you don't have a rogue and lawless president immunized from criminal prosecution,” New York Rep. Hakeem Jeffries, the chairman of the House Democratic Caucus, told The Hill.

Another lawmaker, Virginia Rep. Gerry Connolly, a member of the House Oversight and Reform Committee, suggested that a measure revoking the policy could be included in some sort of spending package or authorization bill.

“I guarantee you it will be a topic of discussion,” Connolly told The Hill.

While Mueller in his report said his investigation found no evidence of a criminal conspiracy between the Trump campaign and Russia during the 2016 election, the special counsel declined to issue a conclusion in the report about whether Trump obstructed justice through his comments and actions related to the investigation. The president repeatedly referred to the probe as a ""witch hunt"" and allegedly sought to have Mueller removed -- but he never did, and Trump has recently disputed that he even sought the special counsel's ouster.

“Charging the president with a crime was not an option we could consider,” Mueller said during his public statement last month, adding that “it would be unfair to accuse someone of a crime when there could be no court resolution of the charge.”

After the release of the Mueller report, Attorney General Bill Barr said he determined no crime had been committed by the president, but Democrats have argued Trump would have been charged with obstruction had he not been president. Republicans, meanwhile, have countered that Trump could not have been charged with obstruction since Mueller determined there was no underlying crime of conspiring with the Russians.

TRUMP CLAIMS 'OBAMA HAD TO KNOW ABOUT' EFFORTS TO UNDERMINE PRESIDENCY

The fresh chatter about upending the DOJ guidance amounts to the latest Democratic bid to reexamine federal policy toward alleged wrongdoing of sitting presidents.

Last month, House Judiciary Chairman Jerrold Nadler, D-N.Y., and other Democrats introduced the “No President Is Above the Law Act.” The sponsors said in a news release at the time that it would pause the statute of limitations for any federal offense committed by a sitting president and “ensure that presidents can be held accountable for criminal conduct just like every other American and not use the presidency to avoid legal consequences.”

""No person can be permitted to evade accountability for their actions just because they happen to be president,"" Nadler said. ""I have concerns with the Justice Department interpretation that a sitting president cannot be indicted, but if that is the policy, a president who commits a crime before or during their term in office, could exploit this loophole and avoid prosecution just because the statute of limitations has run out. This is unacceptable. The presidency is not a get-out-of-jail-free card.""

Even though Barr said he determined no crime had been committed by the president, several Democratic presidential candidates are now indicating on the campaign trail that they would support a DOJ investigation into whether Trump obstructed justice if they win the White House in 2020.

California Democratic Sen. Kamala Harris said last week she believes the only reason Mueller didn’t recommend prosecuting Trump was because of the Justice Department’s policy. In an interview with NPR, Harris said that once out of office, Trump would be subject to charges – and she suggested the Justice Department in a Harris presidency would pursue them.

“I believe that they would have no choice and that they should, yes,” Harris said.

CLICK HERE TO GET THE FOX NEWS APP

Another 2020 Democratic presidential candidate, South Bend, Ind., Mayor Pete Buttigieg, said last week that if elected president, he could also support a Justice Department criminal investigation into Trump.

“To the extent that there’s an obstruction case, then yes, DOJ’s got to deal with it,” Buttigieg said in an interview with The Atlantic published Thursday.

Trump, during an interview that aired Sunday night on ABC News, denied being worried about being prosecuted once he leaves office.

“Did nothing wrong,” Trump said. “There was no collusion.”

Fox News’ Paul Steinhauser contributed to this report."
Moving USDA research agencies is part of Trump’s war on science and statistics,https://www.washingtonpost.com,['Editorial Board'],06-17-2019,2019,6,https://www.washingtonpost.com/opinions/moving-usda-research-agencies-is-part-of-trumps-war-on-science-and-statistics/2019/06/17/51c85328-9134-11e9-aadb-74e6b2b46f6a_story.html,"IN ITS war on science and statistics, the Trump administration has a habit of sidelining inconvenient information. Last week, it was at it again.

On Thursday, the Agriculture Department announced a decision to relocate two of its research agencies, the Economic Research Service and the National Institute of Food and Agriculture, from Washington to the Kansas City region. The Economic Research Service, which investigates the economics of food, farming, natural resources and rural America, and the National Institute of Food and Agriculture, which was established as part of the Food, Conservation and Energy Act of 2008, play a key role in providing the data essential for honest policy-making.

Agriculture Secretary Sonny Perdue initially declared an intention to move these sub-agencies 10 months ago but didn’t specify a location then. The USDA now says the move would put the agencies closer to the agricultural heartland while saving money both for taxpayers and for employees, because Washington is an expensive city. While the rationale may seem plausible , in reality the implications are worrying.

In theory, there’s no reason such agencies couldn’t function well in Kansas City or elsewhere. After all, as with the Centers for Disease Control and Prevention headquarters in Atlanta, this would hardly be the first time a government agency operates from beyond Washington. But the way this operation has been managed, with insufficient warning and explanation, suggests an intention by the administration to encourage qualified analysts to leave government and stifle independent and objective research.

If carried out, the move will disrupt ongoing scientific research and displace several hundred federal employees with valuable experience. Since the abrupt announcement last August, many of the agencies’ top economists and scientists have quit.

The investigations carried out by these agencies have long underpinned decisions by Congress and by American farmers, much as research from the Bureau of Labor Statistics underpins decisions in others parts of the economy. And much of the information produced by the Economic Research Service has indeed been inconvenient for the administration, as it has illustrated the ills wrought by President Trump’s trade wars and how small farmers were helped only marginally by the 2017 Republican tax overhaul.

Democratic members of the House and Senate have introduced the Agriculture Research Integrity Act, which would bar the move. They are right to do so, but it would be best if the USDA took the hint and retreated from this abrupt and ill-considered relocation. The better way to get sunnier data would be to develop better policies."
House Homeland Security Republicans to introduce slew of cybersecurity bills,https://thehill.com,[],06-18-2019,2019,6,https://thehill.com/policy/cybersecurity/448971-house-homeland-security-republicans-to-introduce-slew-of-cybersecurity,"Republicans on the House Homeland Security Committee are gearing up to introduce a bevy of bills aimed at enhancing the Department of Homeland Security's (DHS) cybersecurity capabilities.

The bills are the first glimpse into the new ""American Security Agenda"" that committee Republicans plan to pursue this Congress.

Rep. Mike Rogers Michael (Mike) Dennis RogersHillicon Valley: Facebook unveils new cryptocurrency | Waters wants company to halt plans | Democrats look to force votes on election security | Advertisers partner with tech giants on 'digital safety' | House GOP unveils cyber agenda Hillicon Valley: Facebook unveils new cryptocurrency | Waters wants company to halt plans | Democrats look to force votes on election security | Advertisers partner with tech giants on 'digital safety' | House GOP unveils cyber agenda House Homeland Security Republicans to introduce slew of cybersecurity bills MORE (R-Ala.), the ranking member of the Homeland Security Committee, will announce the agenda during remarks Tuesday afternoon at the International Summit on Borders in Washington, D.C.

ADVERTISEMENT

Rogers will say that the goal of the agenda is to “take a hard look at the Department’s missions and act to ensure that DHS is prepared to tackle the emerging threats to our homeland,” including threats to social media, satellites and theft of intellectual property.

Republican members of the committee plan to introduce seven pieces of legislation in the coming weeks, with several specifically focused on cybersecurity.

Rep. Pete King Peter (Pete) Thomas KingHillicon Valley: Facebook unveils new cryptocurrency | Waters wants company to halt plans | Democrats look to force votes on election security | Advertisers partner with tech giants on 'digital safety' | House GOP unveils cyber agenda Hillicon Valley: Facebook unveils new cryptocurrency | Waters wants company to halt plans | Democrats look to force votes on election security | Advertisers partner with tech giants on 'digital safety' | House GOP unveils cyber agenda House Homeland Security Republicans to introduce slew of cybersecurity bills MORE (R-N.Y.) will reintroduce the Securing the Homeland Security Supply Chain Act, which would enable DHS to keep products from vendors that pose national security risks out of U.S. supply chains. This legislation was passed by the House during the last Congress, but stalled in the Senate. It had multiple bipartisan co-sponsors, including Homeland Security Committee Chairman Bennie Thompson Bennie Gordon ThompsonHillicon Valley: Facebook unveils new cryptocurrency | Waters wants company to halt plans | Democrats look to force votes on election security | Advertisers partner with tech giants on 'digital safety' | House GOP unveils cyber agenda Top Dems question legal basis for appointing Cuccinelli as temporary immigration chief Top Dems question legal basis for appointing Cuccinelli as temporary immigration chief MORE (D-Miss.).

Rep. Debbie Lesko (R-Ariz.) will introduce the Pipeline Security Enhancement Act, which would give DHS’s Transportation Security Administration (TSA) the power to inspect and improve the physical security and cybersecurity of U.S. pipelines.

And the cybersecurity subcommittee's ranking member, Rep. John Katko John Michael KatkoHouse passes amendment to block funding for transgender troops ban House passes amendment to block funding for transgender troops ban Hillicon Valley: Facebook unveils new cryptocurrency | Waters wants company to halt plans | Democrats look to force votes on election security | Advertisers partner with tech giants on 'digital safety' | House GOP unveils cyber agenda MORE (R-N.Y.), will introduce the State and Local Cybersecurity Improvement Act. This legislation is designed to help DHS and its local government partners bolster their cybersecurity resiliency capacity by authorizing grants and technical assistance.

Rep. Michael McCaul Michael Thomas McCaulHillicon Valley: Facebook unveils new cryptocurrency | Waters wants company to halt plans | Democrats look to force votes on election security | Advertisers partner with tech giants on 'digital safety' | House GOP unveils cyber agenda Hillicon Valley: Facebook unveils new cryptocurrency | Waters wants company to halt plans | Democrats look to force votes on election security | Advertisers partner with tech giants on 'digital safety' | House GOP unveils cyber agenda House Homeland Security Republicans to introduce slew of cybersecurity bills MORE (R-Texas), the former chairman of the Homeland Security Committee, will introduce legislation to formally reauthorize the Biometric Identification Transnational Migration Alert Program, which allows DHS’s Immigration and Customs Enforcement (ICE) agency to compile data on violent criminals, terrorists and fugitives and scan migrants at the border.

Three other bills set to be introduced by GOP Homeland Security committee members will include one to help TSA identify emerging threats to the transportation system, and others on reforming DHS’s structure and management.

Rogers will note in his speech that “these seven bills are just the start,” and that “we are working on other bills to address emerging threats that we hope to introduce soon as part of our agenda.”

A Homeland Security Committee aide told The Hill in a phone call that while timing for the formal reintroduction of these bills has not been set, some will be reintroduced “this week."" The aide emphasized that “we are not going to drop everything tomorrow,” and that the overall agenda outlined by Rogers will be “built out in the next 16 months.”

The aide said that Rogers and Thompson appear to be in agreement on most of the cybersecurity issues, noting that both congressmen are “very interested in making sure that DHS keeps up with nation states and hackers and making sure that our cyber infrastructure is secure.”

The Senate Homeland Security and Governmental Affairs Committee has also been consulted on the issues Rogers will outline, the aide confirmed to The Hill, noting that the chairmen and ranking members of both committees have met to discuss the agenda.

The aide said that both Rogers and Katko engage with DHS on a weekly basis, and that the committee’s job is “to make sure they [DHS] can do their job correctly.”

“Instead of changing the deck chairs on a sinking ship, we want to make sure that this a department that is fully engaged and prepared for the 21st century,” the aide said."
"State Department cuts new funds to El Salvador, Guatemala and Honduras, pending immigration fixes",https://www.foxnews.com,"['Gregg Re', 'Gregg Re Is A Lawyer', 'Editor Based In Los Angeles. Follow Him On Twitter']",,,,https://www.foxnews.com/politics/el-salvador-guatemala-honduras-funds-state-department-immigration-fixes,"The State Department announced Monday it will cut new foreign aid to the ""Northern Triangle"" countries -- Guatemala, Honduras, and El Salvador -- unless their governments take ""concrete action"" to stem the flow of migrants towards the United States.

The aggressive move came less than two weeks after the Trump administration reached a last-minute deal with Mexico, which called for the country's deployment of more troops to its own southern border and tighter asylum protocols. The U.S. and Mexico reached the accord shortly before the White House was set to impose a series of escalating tariffs on its southern neighbor.

President Trump previously pushed in March to cut $615 million in aid to the Northern Triangle, noting that the nations have been home to some of the migrant caravans that have marched through Mexico to the U.S. border to claim asylum, in some cases fraudulently.

On further review, the State Department said the administration has decided to continue to provide $432 million for anti-gang, education, and health initiatives. U.S. officials said the review looked at roughly 700 projects funded with fiscal 2017 money by the United States in the three countries and concluded that a significant number were too far advanced to end them.

MEXICO VOWS TO HELP CENTRAL AMERICAN MIGRANTS AMID CRACKDOWN

However, the latest plans showed roughly $370 million from the fiscal year 2018 budget will no longer be spent on the Northern Triangle and approximately $185 million in funding from the 2017 budget will be withheld, at least for now.

A State Department official told Fox News a re-evaluation would be concluded no later than April 2020.

""We will not provide new funds for programs in those countries until we are satisfied that the Northern Triangle governments are taking concrete actions to reduce the number of migrants coming to the U.S. border,"" State Department spokeswoman Morgan Ortagus said. ""This is consistent with the president’s direction and with the recognition that it is critical that there be sufficient political will in these countries to address the problem at its source.""

She added, ""Working with Congress, we will reprogram those funds to other priorities as appropriate.""

Ortagus noted that ""previously awarded grants and contracts will continue with current funding.""

Many Democrats called the decision callous and unproductive.

""As feared, a presidential tantrum will limit our nation’s ability to actually help address the challenges forcing people to flee to the U.S.,"" Sen. Bob Menendez, D-N.J., tweeted.

The Northern Triangle's immigration policies have long rankled the Trump administration. Last December, the U.S. pledged more than $10 billion in aid to Central America and Mexico to help keep migrants put. Later that month, Trump tweeted: ""...Honduras, Guatemala and El Salvador are doing nothing for the United States but taking our money.

""Word is that a new Caravan is forming in Honduras and they are doing nothing about it,"" Trump added. ""We will be cutting off all aid to these 3 countries -- taking advantage of U.S. for years!""

The State Department in March then notified Congress that it would look to suspend 2017 and 2018 payments to the trio of nations.

Meanwhile, Mexico has offered refuge to migrants with credible fears as thousands remain in the country while they await court dates for asylum petitions in the U.S. The understaffed and underfunded Mexican refugee commission has faced a backlog of cases.

But, in recent months, police and immigration have stepped up enforcement in southern Mexico, setting up highway checkpoints, raiding a caravan of mostly Central American migrants and trying to keep people off the northbound train known as ""the beast.""

At the same time, Mexicans have grown increasingly intolerant of the large numbers of migrants passing through their country in an attempt to reach the United States.

CLICK HERE TO GET THE FOX NEWS APP

A June poll in Mexican newspaper El Universal showed that Mexicans are less receptive to allowing undocumented migrants to come in, or to stay on permanently as refugees, than they were in October, when caravans with thousands of Central American migrants were winding their way north.

Fox News' Rich Edson and The Associated Press contributed to this report."
"‘Human capital crisis’ at EPA, retirement for 40% of staff",https://www.washingtonexaminer.com,[],06-18-2019,2019,6,https://www.washingtonexaminer.com/washington-secrets/human-capital-crisis-at-epa-retirement-for-40-of-staff,"The Environmental Protection Agency is bleeding workers.

“I do have a concern absolutely. Forty percent of our workforce is eligible to retire over the next five years. While I don’t expect them all to retire in the next five years, I expect them to be gone in the next 10 years,” said Administrator Andrew Wheeler.

“I consider it a human capital crisis,” he added.

The issue is one being felt throughout government and business as baby boomers retire and younger workers come and go with much more regularity.

Wheeler, for example, said the EPA has always budgeted for workers to stay for decades. “We have a history at the agency of hiring people out of school and expecting them to stay 30, 40 years. We have 10 employees who have been here 49 years,” he said in an interview.

But that’s not happening anymore.

And, he added, government rules make it hard to start looking for a new employee before a retiring worker leaves the building. “You lose that institutional knowledge because they aren’t there to train their replacement.""

The White House, he said, is trying to give agencies more flexibility in hiring. But Wheeler said he is also taking charge, noting that he helped in the interviewing process of new EPA human resources director.

“Administrators don’t typically interview at that level,” he said, but added, “I want to meet who we’re going to hire before we hire them because on Day One I’m going to hit them with a dozen things and I want to make sure that they don’t get scared off.”"
Pete Buttigieg says the U.S. has probably already had a gay president,https://www.cnn.com,"['Leah Asmelash', 'Saeed Ahmed']",06-17-2019,2019,6,https://www.cnn.com/2019/06/17/politics/buttigieg-us-probably-had-a-gay-president-interview-trnd/index.html,"(CNN) Democratic presidential candidate Pete Buttigieg says it's likely he wouldn't be America's first gay commander-in-chief if he's elected in 2020.

In an interview with Axios on HBO that aired Sunday, Buttigieg said he believes it's probable that some of the country's former presidents were gay.

""I would imagine we've probably had excellent presidents who were gay — we just didn't know which ones,"" the Indiana Democrat said.

""Statistically, it's almost certain,"" he added.

His answer was in response to a question from Axios on how he would respond when critics say he's ""too young, too liberal, too gay to be commander-in-chief.""

Read More"
