"Acting DHS secretary says AOC's border facility statements 'not accurate,' praises agents' work",https://www.foxnews.com,['Charles Creitz'],,,,https://www.foxnews.com/politics/kevin-mcaleenan-alexandria-ocasio-cortez-border-facilities,"A claim by Rep. Alexandria Ocasio-Cortez, D-N.Y., that migrants being held at a Texas border facility had to drink from a toilet is inaccurate, according to acting Homeland Security Secretary Kevin McAleenan.

Border Patrol agents are doing incredible work with limited resources, and Congress must step up and provide more support, he said Wednesday on ""Special Report.""

""It's just not accurate,"" he said of the Bronx lawmaker's claim.

""We would never ask anyone to drink out of a toilet. The women in that cell had access to a five-gallon jug of water with cups right outside the door of their cell -- which was not locked.""

Earlier this week, Ocasio-Cortez reacted to her visit to the facility.

AOC CLAIMS WOMEN AT BORDER FACILITY BEING FORCED TO DRINK 'OUT OF TOILETS' AFTER TOUR

""This was them on their best behavior and they put them in a room with no running water, and these women were being told by CBP officers to drink out of the toilet,"" she said. ""And that was them knowing a congressional visit was coming.""

The New York Democrat said people of all ages were being mistreated.

She also said she ""forced herself"" into one of the cells to get a better look and spoke with a woman who claimed the guards were practicing ""psychological warfare"" by interrupting their sleep and calling them names.

CLICK TO GET THE FOX NEWS APP

In his interview with Mike Emanuel, McAleenan said it took Congress several weeks to approve emergency supplemental funding, after asking lawmakers to go further and ""close loopholes"" he claimed are aggravating the crisis at the border.

""It was a crisis the whole time,"" he said.

""It took us too long to get that aid and frankly I think it's important for your viewers to understand, a lot of concern about the number of children in our custody. I've been sounding the alarm for a long time on that.""

Fox News' Nick Givas contributed to this report."
The worst part about DOJ’s reversal on the census is the lack of deliberation,https://www.washingtonpost.com,"['Harry Litman', 'Contributing Columnist Focused On Legal Issues', 'Contributing Columnist', 'A Washington Post Contributing Columnist', 'Is A Former U.S. Attorney', 'Deputy Assistant Attorney General. He Teaches Constitutional Law', 'National Security Law At The University Of California At Los Angeles School Of Law', 'The University Of California At San Diego Department Of Political Science.']",07-04-2019,2019,7,https://www.washingtonpost.com/opinions/2019/07/04/worst-part-about-dojs-reversal-census-is-lack-deliberation/,"

The Justice Department in Washington in May 2013. (J. David Ake/AP)

Contributing columnist

Pity the poor Justice Department lawyer who draws the short straw these days.

On Wednesday, only 24 hours after assuring a federal district judge that the government would not try to add to the 2020 Census the citizenship question the Supreme Court had blocked, the department suddenly reversed ground.

That left it to a sheepish and bewildered career Justice Department lawyer, Joshua Gardner, to tell Judge George M. Hazel of the U.S. District Court for the District of Maryland that he was backing away from firm representations he had made to the court on behalf of the federal government just a day earlier.

The sole provocation for this humiliating situation: a tweet from President Trump on Wednesday morning asserting “we are absolutely moving forward” on the citizenship question,” notwithstanding the Supreme Court’s decision.

You read that right: a tweet. Nothing more.

Gardner had no choice but to inform the court, “The tweet this morning was the first I had heard of the president’s position on this issue. . . . As you can imagine, I am doing my absolute best to figure out what’s going on.""

And, in short order, Gardner found himself backpedaling and doing his best to defend his own credibility, pleading to the court that, “I’ve been with the United States Department of Justice for 16 years through multiple administrations, and I’ve always endeavored to be as candid as possible with the court.""

Translation: I’m a career employee and not a Trump toady; I recognize that the department looks lawless and untrustworthy right now, but please try not to hold it too much against us going forward.

Career Justice Department lawyers are used to working in anonymity and with the winds of their credibility and that of the department as a whole at their backs. This is very far from the way Gardner would like to have seen his name in the national news.

Likewise for Sarah Fabian, the career lawyer forced to the front lines to draw the fire of the U.S. Court of Appeals for the 9th Circuit — and public humiliation — for defending the proposition that denying immigrants soap and toothbrushes complies with the statutory mandate of “sanitary” detention facilities.

The fault here — beyond the obvious erratic lurching of the president and his l’etat-c’est-moi disregard of the rule of law — rests with Justice Department leadership.

Administrations change positions. That is understood and legitimate. But they do it with care, circumspection and due regard for the need to respect the law as objective and continuous, and for their duty of candor to the courts.

So the true eyebrow-raising feature of the department’s abrupt U-turn on the census is its absence of deliberation. The assistant attorney general for the civil division, Jody Hunt, who joined the conference before the court, conceded that the tweet was the sole impetus for the reversal.

That demonstrates an undue, if not ridiculous, solicitude for the whims of the mad king. The indication that Trump wanted to find a way around the ruling of the Supreme Court should have been (at most) a trigger for a reasoned process involving department leadership — in particular, the solicitor general, the client (in this case, the Commerce Department) and, perhaps, the White House counsel.

And voices within those discussions needed to be ready push back against political caprice, or measure it against the government’s longer-term responsibility to safeguard its credibility with the court and display fidelity to the rule of law. That is ultimately a service to the president, as well as to the department and the courts.

Yes, time is very short, but there is no indication of any such process having taken place here. Trump tweets; the department disposes.

The backwards somersault was all the more ill-considered given the severe credibility problems that the department and administration have created in this very case. The Supreme Court’s decision took the very unusual step of essentially rejecting as pretextual the proffered reason for including the citizenship question. Even before that, Hazel had taken the unusual step of reopening the case based on new evidence suggesting that the true reason for the question was to increase the political power of Republicans and non-Hispanic whites.

Finally, the solicitor general had made repeated representations to the Supreme Court that June 30 was a drop-dead date after which the census question could not be added. Now that the administration seems to believe otherwise, it leaves him with egg on his face.

The department seems relatively indifferent to the institutional cost of defending the imperial presidency, including the potential erosion in public confidence that the government is constrained by law. But this latest episode is a new indication that the federal courts at least are taking notice. The 9th Circuit on Wednesday handed the administration its latest setback, rejecting its request to stay a District Court ruling blocking the diversion of military funds to pay for Trump’s border wall.

If the department continues to jump at the president’s every hiccup — candor and consistency be damned — it may find that the courts are more likely to deny it the traditional benefit of the doubt and reject its litigating positions. That is more than an embarrassment for the front-line lawyers; it is a body blow to the department’s institutional interests and, potentially, the public’s confidence in a government of laws, not of men.

Read more:

The Post’s View: It’s time for Trump to surrender in his quest to warp the census

Paul Waldman: Trump’s efforts to rig the census may already be working

Jennifer Rubin: Census: A flat-out win for progressives, the courts and America

The Post’s View: It’s official: Trump fibbed on the census. Now he should just give it up.

Chris Dick: The 2020 Census is still at risk"
Homeland Security Report Details Poor Conditions in Border Patrol Stations,https://www.wsj.com,"['Alicia A. Caldwell', 'Andrew Duehren', 'Alicia.Caldwell Wsj.Com', 'Andrew.Duehren Wsj.Com']",,,,https://www.wsj.com/articles/homeland-security-report-details-poor-conditions-in-border-patrol-stations-11562104197,"LOS ANGELES—Conditions at Border Patrol stations in South Texas are so grim that migrant men detained in one facility pleaded for help from government inspectors visiting in June, according to an internal watchdog report released Tuesday.

Dozens of disheveled men crowded around a window, holding up notes telling passersby how long they had been there. Some pointed to their beards as evidence.

The..."
Vintage EPA photos reveal what US waterways looked like before pollution was regulated,https://www.businessinsider.com,['Aylin Woodward'],07-02-2019,2019,7,https://www.businessinsider.com/vintage-epa-photos-reveal-us-waterways-before-pollution-was-regulated-2019-6,"Just over 50 years ago, Ohio's Cuyahoga river caught fire.

The disaster prompted a public outcry that in part led to the formation of the US Environmental Protection Agency (EPA) in 1970. The EPA was charged with regulating the country's polluted air and waterways, among other environmental objectives.

Soon after its founding, the agency dispatched 100 photographers to capture the US' environmental issues as part of a photo project called Documerica. The photographers took about 81,000 images, more than 20,000 of which were archived. At least 15,000 have been digitized by the National Archives, and the images now function as a kind of time capsule, revealing what states from California to New York looked like between 1971 and 1977.

Read More: Photos reveal what New York City looked like before the US regulated pollution

Many of the photos were taken before the implementation of rules meant to keep water and air free of contamination.

The images of polluted waterways are especially striking. The following Documerica photos reveal what US rivers, streams, and coastlines looked like before the EPA started regulating pollution."
VA secretary changes rules to allow displaying of religious symbols,https://www.cnn.com,['Zachary Cohen'],07-03-2019,2019,7,https://www.cnn.com/2019/07/03/politics/wilkie-va-policy-religious-symbols/index.html,"Washington (CNN) Department of Veterans Affairs Secretary Robert Wilkie issued new policies Wednesday allowing religious symbols to be publicly displayed in VA facilities nationwide.

""Effective July 3, these changes will help ensure that patrons within VA have access to religious literature and symbols at chapels as requested and protect representations of faith in publicly accessible displays at facilities throughout the department,"" the VA said in a statement.

Wilkie said the new directive is intended to help protect ""religious liberty"" as part of a broader effort to make sure ""veterans and their families feel welcome at the VA.""

""We want to make sure that all of our Veterans and their families feel welcome at VA, no matter their religious beliefs. Protecting religious liberty is a key part of how we accomplish that goal,"" he said. ""These important changes will bring simplicity and clarity to our policies governing religious and spiritual symbols, helping ensure we are consistently complying with the First Amendment to the U.S. Constitution at thousands of facilities across the department.""

According to the VA, the new policies will:

Read More"
U.S. reviews export requests to Huawei with 'highest scrutiny': Commerce Department,https://www.reuters.com,"['Alexandra Alper', 'Min Read']",07-03-2019,2019,7,https://www.reuters.com/article/us-usa-china-huawei-tech-commerce-idUSKCN1TY2HA,"WASHINGTON (Reuters) - The U.S. government said on Wednesday it was reviewing license requests from U.S. companies seeking to export products to China’s Huawei Technologies Co Ltd “under the highest national security scrutiny” since the company is still blacklisted.

FILE PHOTO: A Huawei logo is pictured at Mobile World Congress (MWC) in Shanghai, China June 28, 2019. REUTERS/Aly Song/File Photo

In an email to Reuters, the Commerce Department said that as it reviewed applications, it was applying the “presumption of denial” standard associated with Entity Listed companies, meaning applications are unlikely to be approved.

President Donald Trump surprised markets on Saturday with an announcement that U.S. companies would be allowed to sell products to Huawei [HWT.UL], which was placed on the so-called Entity List in May over national security concerns.

U.S. chipmakers, which had been seeking a carve-out for exports of less sensitive technology to the world’s top telecoms technology maker, welcomed the news.

But four days after Trump’s announcement on the sidelines of the G20 in Japan, industry and government officials were uncertain what the new policy will be.

“It seems like nobody has made up their mind as to what the policy is and, as a result, nothing’s changing,” said Douglas Jacobson, an international trade lawyer.

“There’s even less change than we anticipated if we’re still applying the presumption of denial,” Jacobson added, noting that he’s advising clients not to even apply for a license because it’s not worth their time and money under that review policy.

In an email to enforcement staff on Monday, seen by Reuters, John Sonderman, deputy director of the Office of Export Enforcement in the Commerce Department’s Bureau of Industry and Security, sought to clarify how agents should approach license requests by firms seeking approval to sell to Huawei.

All such applications should be considered on merit, he wrote, citing regulations that include the “presumption of denial” licensing policy.

The Commerce Department spokesman said on Wednesday that the department intends to notify companies of decisions on export license applications once the review is complete.

White House trade adviser Peter Navarro said earlier this week that the government would allow “lower tech” chip sales that do not impact national security, echoing similar comments from National Economic Council Chairman Larry Kudlow.

The United States has accused Huawei of stealing American intellectual property and violating Iran sanctions.

It has launched a lobbying effort to convince U.S. allies to keep Huawei out of next-generation 5G telecommunications infrastructure, citing concerns the company could spy on customers. Huawei has denied the allegations."
"Agents feared riots, armed themselves because of dire conditions at migrant facility, DHS report says",https://www.nbcnews.com,"['Julia Ainsley', 'Julia Ainsley Is A Correspondent Covering The Department Of Homeland Security', 'The Department Of Justice For The Nbc News Investigative Unit.', 'Jacob Soboroff', 'Jacob Soboroff Is A Correspondent At Msnbc.']",07-01-2019,2019,7,https://www.nbcnews.com/politics/immigration/dhs-warned-may-border-station-conditions-so-bad-agents-feared-n1025136,"Agents feared riots, armed themselves because of dire conditions at migrant facility, DHS report says

The findings counter the statement by a top Trump admin official that reports of poor conditions for migrants at border stations were “unsubstantiated.”"
Deputy Attorney General Jeffrey Rosen not yet briefed on DOJ probe into origins of Russia probe,https://www.usatoday.com,"['Kevin Johnson', 'Published P.M. Et July']",07-05-2019,2019,7,https://www.usatoday.com/story/news/politics/2019/07/05/deputy-ag-jeffrey-rosen-not-yet-briefed-doj-surveillance-probe/1655150001/,"CLOSE Attorney General William Barr told a network television interviewer that he wants answers on how the probe began into possible collusion between the Trump campaign and Russia. (May 17) AP, AP

ENGLEWOOD, Colorado – Deputy Attorney General Jeffrey Rosen said that he has yet to be briefed on the potentially volatile inquiry into possible surveillance abuses by federal authorities in the early days of the Russia investigation.

Rosen, in an interview with USA TODAY this week, said that he was unaware of the investigation’s status and did not know whether it has since morphed into a criminal inquiry.

“I don’t know the answer to that. I’d have to check and get back to you. I hear it described as an inquiry. I don’t want to say something that won’t be accurate. So let me defer on that one. “

The Justice Department later declined to elaborate. But Rosen’s deference on such a high-profile matter underscored the extreme close-hold on an inquiry launched by Attorney General William Barr and now managed by Connecticut U.S. Attorney John Durham.

It also highlights how Rosen, more than a month following his confirmation, has so far assumed a role largely out of the public eye in a stark departure from his predecessor, Rod Rosenstein, whose rocky two-year tenure was defined by his management of the Russia investigation and former Justice special counsel Robert Mueller.

Deputy Attorney General Jeffrey Rosen poses for a portrait after an interview, the first interview since taking over for Rod Rosenstein. He was also touring the Englewood (Colorado) Federal Correctional Institution. (Photo: Ross Taylor, for USA TODAY)

John Durham: Attorney general taps top Connecticut federal prosecutor for review of Trump-Russia inquiry

""It (the surveillance inquiry) started before I arrived,"" Rosen said, adding that he was ""not currently"" being briefed on it. ""I had some generalized awareness, but I'm not meeting regularly with Mr. Durham.""

In April, Barr startled some lawmakers when he disclosed that he was reviewing the FBI's use of surveillance involving associates of President Donald Trump during the presidential campaign as authorities sought to understand Russia's interference efforts. At the time, Barr said he did not know whether officials had done anything wrong, though the review's disclosure was instantly cheered by some Republicans and Trump who has long disparaged Mueller's work as a ""witch hunt.""

""Spying on a campaign is a big deal,"" Barr told a Senate panel then. ""I think spying did occur. The question is whether it was adequately predicated.""

In May, the attorney general injected new urgency into that review when he tapped Durham, a long-time federal prosecutor, to review the ""genesis and the conduct"" of the FBI's investigation into possible ties between the Trump campaign and Russia.

Durham's appointment came just three days before Rosen's confirmation as second-in-command at Justice.

Rosen: Jeffrey Rosen, Transportation official, nominated as Justice Department's second-in-command to replace Rod Rosenstein

The inquiry is proceeding, as Justice's inspector general is conducting its own review of how federal authorities obtained a warrant in 2016 to monitor former Trump foreign policy adviser Carter Page and his possible links to Russia. The results of that investigation are expected to be disclosed soon.

While not briefed on the Barr-Durham inquiry, Rosen nevertheless characterized it as ""serious.""

""I'm not sealed out,"" the deputy attorney general said, explaining that the attorney general had already taken on the coordinating role with Durham.

Attorney General William Barr and Deputy Attorney General Jeffrey Rosen attend Medal of Valor ceremony Wednesday, May 22, 2019. (Photo: Manuel Balce Ceneta/AP)

Rosen, 61, arrived at the Justice as a largely unknown player, having served in the top ranks of the Transportation Department – but never at the sprawling Justice Department.

His lack of Justice experience drew criticism from some Democrats who have expressed concern for the department's independence from the White House in the aftermath of the Mueller investigation.

""At this critical moment, we need a deputy attorney general who knows the Justice Department, who has experience in criminal investigations and prosecutions, and who is committed to the department’s role of enforcing the law independently,"" Sen. Dick Durbin, D-Ill., said after voting against Rosen's confirmation.

DOJ: Justice Department looking for way to include citizenship question in census despite Supreme Court ruling

Acknowledging his role as ""the new guy,"" Rosen said the learning curve has presented few problems so far.

""You know it’s always risky to assume that you know what you don’t know,"" the deputy attorney general said. ""So, I’m sure there are things I don’t know. But it’s gone extremely well from my vantage point. I think some of the concerns that were raised about that (lack of experience) didn’t account for the fact that the Justice Department, in some ways, is like a big law firm. I spent a lot of time at a big law firm; there (are) tremendous resources available. And so the things that I need to get up to speed on, I have like the foremost experts in the world available to me to brief me on them.""

In his first month, Rosen has sought a fuller understanding of the opioid crisis in America and has taken a lead role in Justice's implementation of bipartisan criminal justice legislation aimed at easing sentences for non-violent drug offenders, reducing the federal prison population and assisting offenders' transition back into their communities.

Rosen said Justice is on schedule to deliver a critical tool to assess the needs and risks of future recidivism for federal prisoners. The program, required under the First Step Act, a sweeping measure intended to reduce the nation's prison population, is due by July 19.

On the same date, the federal Bureau of Prisons is set to recalculate the amount of so-called ""good time"" earned by federal offenders, an action that is expected to result in the release of 2,200 offenders to their home communities.

Deputy Attorney General Jeffrey Rosen (center) tours the Englewood Federal Correctional Institution with Hugh Hurwitz (at left), acting director of the Federal Bureau of Prisons. At right is the warden of the facility, Brad Greilick. (Photo: Ross Taylor, for USA TODAY)

Barr: Attorney general says he will review government 'spying' on Trump campaign; 'I am concerned'

Rosen, who was touring the federal prison in Englewood, Colo., earlier this week in advance of the actions slated for later this month, said Justice was ""pushing hard"" to abide by the requirements of the new legislation.

Since the First Step Act was signed into law in December, Rosen said 1,093 drug offenders have been released from federal prisons as part of a provision that reconciled overly harsh sentences issued to crack cocaine offenders. Another 171 low-risk elderly inmates and 46 chronically-ill offenders also have been released under terms of the legislation.

""I’m putting my personal attention on that,"" Rosen said of the legislation. ""The attorney general is, too.""

Rosen's personal attention to a separate prison-related matter, however, captured the most public notice of his tenure so far.

Rosenstein: Deputy AG offers biting defense of Russia investigation, jabs Obama administration

Deputy Attorney General Jeffrey Rosen smiles while meeting with other officials after the completion of a tour of the Englewood Federal Correctional Institution in Colorado (Photo: Ross Taylor, for USA TODAY)

In a letter to Manhattan District Attorney Cyrus Vance earlier this month, the deputy attorney general weighed in on the question of where former Trump campaign chairman Paul Manafort should be confined during his prosecution on state financial fraud charges.

Citing Manafort lawyers' concern for their client's ""health and safety"" if moved to a state prison, Rosen directly raised the issue with Vance, noting that that lawyers preferred that Manafort remain in federal custody where he is serving a 7.5-year sentence on a financial conviction. Such issues are generally not raised to the highest levels of the Justice Department.

Manafort: Reports: Manafort not headed to Rikers Island after DOJ intervened

Rosen dismissed the suggestion he was intervening on behalf of Manafort. He said he was merely attempting to resolve a question raised by federal prison officials.

""To me that seemed pretty benign,"" Rosen said. ""Maybe…I have to adapt to a new environment, as someone who came from another department. But it didn’t seem like an extreme measure to me to ask the New York district attorney, 'What do you think we should do with this?'""

Going forward, Rosen said he expects to apply a simple rule of management.

""It’s not my job to do their jobs,"" he said of the department's more than 110,000 employees. ""It’s to ensure that everyone is doing their job.""

Read or Share this story: https://www.usatoday.com/story/news/politics/2019/07/05/deputy-ag-jeffrey-rosen-not-yet-briefed-doj-surveillance-probe/1655150001/"
