title, publication, authors, date, year, month, url, content
"Trump inquires about US buying Greenland, but it's not for sale",https://www.cnn.com,"['Pamela Brown', 'Jim Acosta', 'Caroline Kelly']",08-15-2019,2019,8,https://www.cnn.com/2019/08/15/politics/trump-buy-greenland-wall-street-journal/index.html,"Washington (CNN) President Donald Trump has on multiple occasions brought up buying Greenland from the Danish government and the White House counsel's office has looked into the possibility, two sources told CNN on Thursday.

The island's government, however, said in a statement Friday it's not going to happen: ""Greenland is not for sale.""

Trump's interest in buying Greenland was first reported on Thursday by The Wall Street Journal . The Journal reported that people familiar with the deliberations said the President has raised the issue during meetings and dinners, asking aides and listening seriously about the possibility and advantages of owning Greenland. He also asked his White House counsel to research the matter, according to two of the people.

Two of the people also told the Journal that Trump's aides were divided on the issue, with some praising it as solid economic strategy and others dismissing it as a passing fancy.

CNN has contacted the White House and the State Department for comment.

Read More"
"Opinion | With Trump as President, the World Is Spiraling Into Chaos",https://www.nytimes.com,['Michelle Goldberg'],08-16-2019,2019,8,https://www.nytimes.com/2019/08/16/opinion/hong-kong-kashmir-trump.html,"Earlier this week, Pakistan’s ambassador to the United States, Asad Majeed Khan, visited The New York Times editorial board, and I asked him about the threat of armed conflict between his country and India over Kashmir. India and Pakistan have already fought two wars over the Himalayan territory, which both countries claim, and which is mostly divided between them. India recently revoked the constitutionally guaranteed autonomy of the part of Kashmir it controls and put nearly seven million people there under virtual house arrest. Pakistan’s prime minister compared India’s leaders to Nazis and warned that they’ll target Pakistan next. It seems like there’s potential for humanitarian and geopolitical horror.

Khan’s answer was not comforting. “We are two big countries with very large militaries with nuclear capability and a history of conflict,” he said. “So I would not like to burden your imagination on that one, but obviously if things get worse, then things get worse.”

All over the world, things are getting worse. China appears to be weighing a Tiananmen Square-like crackdown in Hong Kong. After I spoke to Khan, hostilities between India and Pakistan ratcheted up further; on Thursday, fighting across the border in Kashmir left three Pakistani soldiers dead. (Pakistan also claimed that five Indian soldiers were killed, but India denied it.) Turkey is threatening to invade Northeast Syria to go after America’s Kurdish allies there, and it’s not clear if an American agreement meant to prevent such an incursion will hold.

North Korea’s nuclear program and ballistic missile testing continue apace. The prospect of a two-state solution in Israel and Palestine is more remote than it’s been in decades. Tensions between America and Iran keep escalating. Relations between Japan and South Korea have broken down. A Pentagon report warns that ISIS is “re-surging” in Syria. The U.K. could see food shortages if the country’s Trumpish prime minister, Boris Johnson, follows through on his promise to crash out of the European Union without an agreement in place for the aftermath. Oh, and the globe may be lurching towards recession."
Trump's Israel intervention may have consequences for Netanyahu,https://www.cnn.com,['Analysis Stephen Collinson'],08-16-2019,2019,8,https://www.cnn.com/2019/08/16/politics/donald-trump-israel-ban-congresswomen/index.html,"Washington (CNN) Everything, as always with Donald Trump, is about what's good for the President.

In a fresh example of this core truth defining the current administration, Israel caved Thursday to his demands to ban two Muslim US lawmakers who Trump is ostracizing as part of his 2020 reelection strategy.

There is no sign that Trump considered whether his latest targeting of Reps. Ilhan Omar or Rashida Tlaib conflicts with US foreign policy goals, reflects American values, benefits Israel in the long-term or is in keeping with the principles of two rigorous democracies that pride themselves on debate among ideological foes.

The latest manifestation of the Trump first foreign policy was instead another sign that national interest is often subordinate to this President's immediate political requirements. In a characteristic but still shocking shattering of norms, the President of the United States actively lobbied a foreign government to refuse admission to two of his compatriots.

Trump's celebration of his success underscored how he plans to ignore any presidential guardrail in waging the cultural warfare on which he is relying to secure a second White House term.

""What they've said about Israel and Jewish people is a horrible thing, and they've become the face of the Democrat Party,"" Trump said, hours after Israel announced its decision.

Trump habitually shows few qualms in using the powers of the presidency, which are especially broad in foreign policy, for his own personal ends. His denial of Russian election meddling and crush on North Korean leader Kim Jong Un for example both arguably promote his image and ego over orthodox US global strategies.

But his power play against Israel was unapologetically partisan, even for Trump.

Amid a raging political controversy in Washington and Israel, authorities later granted permission for Tlaib to enter the country on humanitarian grounds to visit her family in the West Bank.

""Congresswoman Tlaib has sent tonight a letter to Minister Deri in which she committed to accept all the demands of Israel to respect the restrictions imposed on her in the visit, and she also promised not to advance boycotts against Israel during her visit,"" Interior Minister Aryeh Deri said in a statement.

AIPAC breaks with Trump

Many in Washington find the views of Omar and Tlaib toward Israel abhorrent. Omar was forced to apologize earlier this year after she suggested that support for the Jewish state in Congress was motivated by campaign contributions in remarks widely decried as anti-Semitic.

But there is widespread bipartisan concern about how the new travel ban could impact Israel's political standing in the Congress where support for the Jewish state has been sweeping and bipartisan.

Even the pro-Israel US lobby group AIPAC , usually in lockstep with Trump and which has criticized the two lawmakers over their rhetoric, expressed disquiet, despite making clear it disagreed with the views of Omar and Tlaib.

""We ... believe every member of Congress should be able to visit and experience our democratic ally Israel firsthand,"" AIPAC tweeted.

The President's tweets also put Israeli Prime Minister Benjamin Netanyahu in a tough spot. Trump's public pressure on the Prime Minister risked leaving a leader, not usually seen as weak looking, put upon at a perilous moment -- with a new election approaching that could end his long stranglehold on power in Israel.

None of that is likely to matter for Trump, since he pocketed a shrewdly engineered political win that helped distract from growing talk of a possible recession that could cast a cloud over his reelection hopes.

The President can now savor his success in returning Tlaib and Omar, who he wants to elevate as the extreme, anti-Semitic face of the Democratic Party back to the 2020 political spotlight.

He got to burnish pro-Israel credentials popular with his base -- especially evangelical voters who were earlier delighted with his decision to recognize Jerusalem as Israel's capital. And it all happened hours before his latest reelection rally in New Hampshire.

Perhaps most pleasing for the President was the chance to jam Democratic leaders, such as House Speaker Nancy Pelosi, into defending key members of the so-called ""squad"" as when he stirred a racial furor by telling the four American lawmakers to ""go back"" to where they came from.

""The President's statements about the congresswomen are a sign of ignorance and disrespect, and beneath the dignity of the Office of the President,"" Pelosi said in a statement.

The fact that Trump's hardball tactics sparked outrage among the diplomatic establishment and condemnation to the media was a clear added bonus from a day's work on Twitter for Trump.

Breaking with tradition

Sovereign nations have every right to bar entry from critics that they believe do not share their values. And presidents have long considered their own political interests in dealing with Israel and treacherous Middle East politics. Advancing foreign policy goals has also long been a tool in reelection races -- from Franklin Roosevelt to Richard Nixon to George H.W. Bush. But most presidents also seek to avoid the impression that they are acting purely for their own personal advantage. Often, their actions in the national interest risk prejudicing their own personal, political standing though in the end, serve to bolster their White House legacies.

The 45th President is cut from different cloth.

""Never has there been a President in my experience who has so subsumed the American national interest not just to his political interests but to his own personality sensibilities and in some respects his own vanity and ego,"" Aaron David Miller, a Middle East peace negotiator for Democratic and GOP presidents, told CNN's Bianca Nobilo.

Some Republicans worry that all this could backfire and hand Omar and Tlaib a political reward for their outspoken criticism of Israel and their support for the Boycott, Divestment, Sanctions movement.

""Denying them entry into #Israel is a mistake. Being blocked is what they really hoped for all along in order to bolster their attacks against the Jewish state,"" Florida GOP Sen. Marco Rubio tweeted.

The role of Washington's ambassador to Israel is also causing controversy. In a statement on Thursday, the envoy, David Friedman backed Israel's decision. But California Democratic Rep. Ted Lieu called on him to resign.

""He doesn't seem to understand that his allegiance is to America not a foreign power. He should be defending the rights of Americans to travel to other countries,"" Lieu told CNN's Wolf Blitzer on ""The Situation Room."" Lieu later tweeted a similar sentiment, but then deleted it because of criticisms that he was raising a dual loyalty allegation, an anti-Semitic trope.

Israeli blowback

JUST WATCHED Israel bans 2 congresswomen from entry after Trump push Replay More Videos ... MUST WATCH Israel bans 2 congresswomen from entry after Trump push 02:09

Trump's intervention will also have political implications inside Israel, some of which could rebound against Netanyahu.

Only a week ago, Israeli Ambassador to the US Ron Dermer said that his country would not deny entry to two members of the Congress.

That the government that he serves has now climbed down could leave Netanyahu looking like a supplicant of Trump who has outsourced Israeli sovereignty to a foreign leader.

Like other world leaders before him, Netanyahu has also learned that support from Trump must be repaid -- in terms and at a time most favorable to the President's political goals.

Netanyahu has relentlessly promoted his relationship with Trump, including in the previous Israeli election earlier this year.

But his US critics have long worried that his interventions in US politics -- against former President Barack Obama and in favor of Trump -- risk weakening bipartisan support for Israel and could therefore in the long term threaten its security.

""Denying entry to members of the United States Congress is a sign of weakness, not strength. It will only hurt the US-Israeli relationship and support for Israel in America,"" Senate Minority Leader Chuck Schumer said.

At some point, Netanyahu, or a future Israeli leader, will find themselves dealing with a Democratic president. The diplomatic fallout from Thursday's events will be in the background when those meetings occur."
Trump cites report Biden may scale back campaign schedule: 'If I ever did that it would be over',https://www.foxnews.com,['Danielle Wallace'],,,,https://www.foxnews.com/politics/trump-new-hampshire-joe-biden-scaled-down-campaign-schedule-verbal-gaffes,"President Trump told New Hampshire rally-goers Thursday that the campaign of Joe Biden was a ""disaster"" following a report that the 2020 Democratic frontrunner may scale back his scheduled appearances following weeks of verbal gaffes.

“If I ever did that it would be over,"" the president told the crowd in Manchester. ""The fake news would get us.""

The president said that if Biden's campaign advisers limit the former vice president's media exposure before next year's election, it could cost him the White House.

In the report, published Thursday by The Hill, unidentified “Biden allies” suggest that Biden limit his campaign stops before the 2020 election to minimize the bad publicity resulting from his verbal blunders. The allies claim that cutting back on appearances would also prevent critics, including President Trump, from suggesting the 76-year-old Biden is too old and not mentally fit to be president.

TRUMP TELLS NH RALLYGOERS 'WE HAVE A BUNCH OF SOCIALISTS OR COMMUNISTS TO BEAT' -- AS DEM RIVALS GATHER NEARBY

At Thursday's rally, Trump tried to draw a sharp contrast between himself and the former U.S. senator from Delaware.

“Is there anything better than a Trump rally?"" Trump asked the crowd, drawing cheers.

""What about a 'Sleepy Joe Biden' rally?"" he then asked, drawing laughs. ""I think Sleepy Joe may be able to limp across the finish line. But today they announced that they're going to cut way back on his appearances because he is such a disaster.”

Biden has faced a weeks-long flurry of negative attention surrounding verbal slip-ups that some noted have been a common occurrence across his long political career. For example, Biden recently claimed to support ""truth over facts"" during a speech at the Iowa State Fair. He also incorrectly stated that two high-profile mass shootings occurred in Michigan and Houston, instead of the correct locations of Dayton, Ohio, and El Paso, Texas.

In response to one of Biden's gaffe's, Trump tweeted last week: “Does anybody really believe he is mentally fit to be president? We are ‘playing’ in a very big and complicated world. Joe doesn’t have a clue.”

A Fox News Poll published Thursday showed Biden ahead of Trump by 12 points. On Tuesday, Biden slammed President Trump’s own choice of words when speaking about white nationalism and diversity.

“President Trump has emboldened white nationalists with messages of support, called Mexicans ""rapists,"" and told members of Congress to ""go back"" to where they came from,"" Biden wrote on Twitter. ""The words of a president matter. And Trump has used his to unleash the deepest, darkest forces in our nation.""

Biden also claimed the president ""doesn't get"" the role of diversity in the strength of America.

""This is America, and we are strong and great because of our diversity — not in spite of it,"" Biden wrote. ""Donald Trump doesn’t get that. Prioritizing wealthy immigrants while punishing working-class ones betrays the American idea that everyone gets a fair shot — regardless of background.""

Also Thursday, former Obama adviser David Axelrod claimed scaling back Biden's campaign schedule, therefore effectively limiting his media exposure before the election, would only hurt the former vice president's chances of winning the Democratic nomination and ultimately the presidency.

""This is bad advice. You can’t cloister the candidate and win,"" Axelrod tweeted. ""He either can cut it or he can’t, and the only way he can prove he can is to be an active and vigorous candidate. He’s running for president of the United States, for God’s sake!""

Axelrod similarly took aim at Biden's handling of federal funding for abortion. Biden has long supported the Hyde Amendment but video surfaced of him telling an activist that he would oppose it as president. Biden later said that he didn't hear the activist's question and eventually reversed his decadeslong support for the historically bipartisan measure.

Adding to the list of verbal gaffes, Biden mistakenly said he had met with students who survived a mass shooting at Marjory Stoneman Douglas High School in Parkland, Fla., while he was vice president. A gunman actually open-fired at the school in February 2018, about a year after Biden left the job.

CLICK HERE TO GET THE FOX NEWS APP

During a speaking engagement for Asian and Hispanic voters last week, Biden also said that “poor kids are just as bright and just as talented as white kids.” Biden recanted his statement after the event, telling reporters he meant to say “wealthy kids” instead of “white kids.”

In Thursday's report, ""Biden allies"" claimed limiting Biden's speaking engagements would actually save his campaign. In the past, Biden made two previous attempts at running for president. In 1988, he ran unsuccessfully in a primary that was ultimately won by then-Massachusetts Gov. Michael Dukakis. In 2008 he ran again but the Democratic Party nomination ultimately went to then-Sen. Barack Obama, D-Ill., who chose Biden as his running mate.

Fox News’ Charles Creitz and Sam Dorman contributed to this report.

Fox News’ Charles Creitz and Sam Dorman contributed to this report."
