House Intelligence panel requests documents after reports WH blocked climate change testimony,https://www.cnn.com,['Eli Watkins'],06-11-2019,2019,6,https://www.cnn.com/2019/06/11/politics/house-intelligence-state-department-climate-change/index.html,"Washington (CNN) House Intelligence Committee Chairman Adam Schiff has requested documents from a State Department agency on the heels of reports that the White House blocked an official from submitting testimony on climate change.

Schiff, a California Democrat, said in a letter dated Tuesday to Ellen McCarthy, the assistant secretary for the State Department's Bureau of Intelligence and Research, that his committee was left with ""deep concern"" that the Trump administration recently sought to bar the submission of written testimony from Rod Schoonover ""for political reasons."" Schoonover, an analyst with the State Department agency, testified before the House panel last week.

The Washington Post, citing several administration sources, reported that officials from several different White House offices took issue with Schoonover's prepared testimony in which he was going to warn Congress about wide-ranging and ""possibly catastrophic"" national security concerns as a result of human-caused climate change.

In his letter, Schiff said the administration ""repeatedly confirmed"" ahead of the June 5 hearing that Schoonover would submit written testimony, but that the evening before the hearing, the State Department informed the committee ""without explanation"" that the agency would not submit a written statement.

He said the House Intelligence Committee, ""in light of these reports of undue White House interference in testimony before the Committee,"" now requests testimony from McCarthy or ""an appropriate senior representative"" to address: Schoonover's testimony; communications with the White House about that written testimony; the prepared written testimony itself; and other documents relevant to the hearing and blocked testimony.

Read More"
Protesters want to fly ‘Baby Trump’ balloon during the president’s Fourth of July address in Washington,https://www.washingtonpost.com,"['Marissa J. Lang', 'Local Reporter Focused On D.C. Area News', 'June At Pm']",06-11-2019,2019,6,https://www.washingtonpost.com/local/protesters-want-to-fly-baby-trump-balloon-during-the-presidents-fourth-of-july-address-in-washington/2019/06/11/1a6d46b6-8bbe-11e9-b08e-cfd89bd36d4e_story.html,"When President Trump ascends the steps of the Lincoln Memorial to address the nation on Independence Day, a group of activists want him to see the scowling, splotchy face of a giant orange baby floating above the crowd.

The blimp known as “Baby Trump,” which has appeared at protests during the president’s visits to London, might be on its way to Washington for the July 4 festivities.

On Monday, activist group Code Pink became the first organization to request a protest permit from the National Park Service ahead of Trump’s planned overhaul of the city’s premier Fourth of July celebration. But organizers hope the screaming-baby balloon will be a sign of what’s to come that day: protests, and more of them.

The day will be busy as it is. More than a dozen other groups and individuals have requested space on the Mall that day — for activities that include making cards for troops, leading group meditations, selling books of poetry and preaching. They will join hundreds of thousands of Americans who annually head to the Mall to watch the fireworks.

District officials have expressed concern over how the president’s presence might affect visitors and the typically nonpartisan tenor of the celebration.

“It’s about the worst holiday he could have chosen,” D.C. Del. Eleanor Holmes Norton (D) has said. “You never want to make events like this around a single person. This is the difference between the Soviet Union — the old Soviet Union — and the United States. Cults of personality are not how we operate in this country.”

Code Pink organizers said the decision to import the blimp originated around the time Trump announced he would hold a military parade in Washington last year. The parade was canceled amid questions about its impact and price tag, estimated to cost as much as $92 million.

Through online fundraising efforts that began in July 2018, Code Pink raised more than $10,000 to bring “Baby Trump” to the District.

[Perspective: A stain on the Lincoln Memorial]

“We’ve just switched our plans from the military parade to the Fourth of July,” Code Pink co-director Ariel Gold said. “We’re appalled that Trump is taking that day to spew his hateful and racist rhetoric . . . and we really hope this gets canceled, too.”

Code Pink is asking to fly “Baby Trump” over “any open grassy area nearest to [the] Lincoln Memorial,” according to a permit application filed with the Park Service. The group said it expects about 40 people — including its setup and teardown crews — to attend its protest.

The Park Service has permitted a protest-by-balloon before: In 2017, an inflatable 30-foot-tall chicken with a golden head of coifed hair meant to look like Trump’s was displayed on the Ellipse south of the White House.

No other protest organizers have requested a permit from the Park Service for July 4. Such requests are handled on a first-come, first-serve basis, Park Service spokesman Mike Litterst said.

The U.S. Secret Service has not released details about the timing and duration of the president’s speech.

The White House declined to comment about the blimp or the day’s activities on the Mall.

Trump announced his plans to speak July 4 in a February tweet promising one of the biggest gatherings in Washington history, with a “major fireworks display, entertainment and an address by your favorite President, me.”

[Trump takes over Fourth of July celebration, changing its location and inserting himself into the program]

The Washington Post reported last month that the president was deeply involved in organizing changes to the annual event, which draws large crowds to the Mall each year.

Calling the program “A Salute to America,” Trump plans to address the nation from the Lincoln Memorial and move the fireworks to West Potomac Park. Federal agencies, including the Park Service and U.S. Park Police, have said they are working with the White House to determine the logistics of the day.

Litterst likened piecing the day’s events together to playing a giant game of Tetris.

“As long as everyone’s flexible, we do our best to accommodate the requests we get,” he said.

This month, House Democratic leaders — including Majority Leader Steny H. Hoyer (D-Md.) — wrote a letter to Trump, decrying his decision to place himself at the center of the July 4 festivities as something that “could create the appearance of a televised, partisan campaign rally on the Mall at public expense.”

Code Pink’s primary goal, Gold said, is to fly the “Baby Trump” balloon close to where the president will speak.

“We see it as an image of Trump’s behavior, which is, as we all know, unpredictable and prone to tantrums about things that are really, really dangerous,” she said. “It’s a way of saying, we really need an adult in the White House.”

Read more:

A $2.1 million parcel of D.C. land is on track to go to the dogs

‘Pride and protest’: Dyke March returns to Washington after a 12-year hiatus

What will become of the Venezuelan Embassy — and activists who lived for weeks inside and outside?

Local newsletters: Local headlines (8 a.m.) | Afternoon Buzz (4 p.m.)

Like PostLocal on Facebook | Follow @postlocal on Twitter | Latest local news"
"No trade aid for unplanted acres because of flooding, USDA says",https://journalstar.com,"['Matt', 'Nati Harnik', 'Ap File Photo']",,,,https://journalstar.com/business/agriculture/no-trade-aid-for-unplanted-acres-because-of-flooding-usda/article_bd9caee0-7aac-594a-a980-8ad7bc41e5a0.html,"Close Get email notifications on {{subject}} daily!

Your notification has been saved.

There was a problem saving your notification.

{{description}}

Email notifications are only sent once a day, and only if there are new matching items."
Wyden slaps hold on Treasury nominees amid block on Trump tax returns,https://www.ktvz.com,"['Donna Borak', 'Lauren Fox']",06-12-2019,2019,6,https://www.ktvz.com/news/politics/wyden-slaps-hold-on-treasury-nominees-amid-block-on-trump-tax-returns/1085756780,"(CNN) - The top Democrat on the Senate Finance Committee is moving ahead with a threat to hold up any Treasury Department nominees over resistance from two agencies overseeing the release of President Donald Trump's personal tax returns.

""The administration's blanket obstruction of all oversight as it relates to Donald Trump's tax returns cannot go unanswered -- Congress needs to take action to force the administration to comply oversight,"" Oregon Sen. Ron Wyden said in a statement on Wednesday.

Trump has broken with decades of presidential precedent by refusing to make his personal tax information public, and has retained his interest in the Trump Organization while in office.

In late May, Wyden threatened to place a hold on nominees appointed by Trump, if Treasury Secretary Steven Mnuchin and Internal Revenue Service Commissioner Charles Rettig failed to adequately answer congressional requests.

Wyden said he has received ""non-answers or no responses at all"" from both of the agencies on questions about when political appointees learned of a memo prepared in anticipation of congressional request for Trump's tax returns among other queries. The IRS has yet to respond to the senator's request, which carried a June 11 deadline.

""Congress has a constitutional obligation to conduct oversight of the executive branch so I am placing a hold on Treasury Department nominees,"" Wyden said.

He also urged the committee, which is led by Republican Sen. Charles Grassley of Iowa, not to proceed with a hearing for Brent McIntosh, the current general counsel, who has been nominated to be Treasury undersecretary for international affairs.

""Mr. McIntosh was central to the Treasury Department's decision making and without additional context on the process, committee members will not be able to ask informed questions,"" Wyden said.

Mnuchin has refused to comply with a subpoena from House Democrats for six years of Trump's tax returns, citing Department of Justice legal advice. House Ways and Means Chairman Richard Neal has requested the documents under an obscure statute that grants the heads of tax-writing committees access to tax returns for oversight purposes.

Trump has several nominees to the Treasury Department currently waiting for Senate confirmation, including Brian McGuire, nominee for assistant secretary for legislative affairs; Michael Faulkender, the nominee for assistant secretary of economic policy; Brian Callanan, the nominee for general counsel and Geoffrey William Seiji Okamoto, nominated for deputy undersecretary."
DOJ outlines to Congress its investigation of the investigators,https://www.washingtonexaminer.com,[],06-11-2019,2019,6,https://www.washingtonexaminer.com/news/doj-outlines-to-congress-its-investigation-of-the-investigators,"The Justice Department's investigation of the investigators involved in the Trump-Russia probe will look at actions both by the U.S. government and by foreigners.

That's what the agency said Monday, telling Congress its review is “broad in scope and multifaceted” in a letter from Assistant Attorney General Stephen Boyd to House Judiciary Committee Chairman Jerry Nadler, D-N.Y.

The DOJ said the wide-ranging inquiry led by Attorney General William Barr, along with his right-hand man U.S. Attorney John Durham, would seek to “illuminate open questions regarding the activities of U.S. and foreign intelligence services as well as non-governmental organizations and individuals.”

The letter made it clear that DOJ’s review is not limited just to their specific agency, but would also scrutinize the intelligence community as a whole. The letter stated that the DOJ review team had already asked certain intelligence community agencies to preserve records, make witnesses available, and start putting together documents that the DOJ would need to carry out its inquiry.

And the DOJ made it clear that they weren’t just looking to see if policies were violated — they’ll be looking at whether any laws were broken, too.

In 2016, the DOJ and FBI launched an investigation into any links between the Russian government and the Trump campaign. Special counsel Robert Mueller took over the ongoing effort in May 2017 after FBI Director James Comey was fired, and Mueller’s probe culminated in a 448-page report in April 2019. Mueller found that the Russians had interfered in the 2016 election through cyberattacks and social media disinformation campaigns, but did not establish that anyone associated with Trump criminally colluded with Russia. Mueller left the door open on obstruction of justice by Trump, but Barr and then-Deputy Attorney General Rod Rosenstein determined that he had not.

Barr believes “there remain open questions relating to the origins of this counter-intelligence investigation and the U.S. and foreign intelligence activities that took place prior to and during that investigation,” the letter states, and the DOJ review will look at “the efficacy and propriety“ of the steps that the DOJ, the FBI, the broader U.S. intelligence community, and foreign governments and actors took before and during the course of the probe — and to answer those questions “to the satisfaction of the Attorney General.”

The letter said Barr is coordinating with members of the U.S. intelligence community and ""certain foreign actors"" on the “collaborative” and “ongoing effort.""

Trump recently gave Barr “full and complete authority to declassify information"" during his review, a move that has been harshly criticized by many Democrats. Nadler called the move part of a “plot to dirty up the intelligence community, to pretend that there's something wrong with the beginning of the Mueller investigation and to persecute and bring into line the intelligence agencies."" And former FBI General Counsel Jim Baker called the move a ""slap in the face"" to Director of National Intelligence Dan Coats.

Apparently to push back against such concerns, DOJ said Monday it would work hard to make sure that U.S. intelligence agents as well as foreign partners were protected during the probe, along with sensitive methods, techniques, and materials that could compromise national security.

This broad probe by DOJ is separate from the investigation by DOJ Inspector General Michael Horowitz into alleged Foreign Intelligence Surveillance Act abuse by the Justice Department and the FBI. That inquiry includes a focus on the FBI’s handling of the unverified dossier compiled by British ex-spy Christopher Steele and its extensive use in the FBI's FISA applications and renewals to surveil former Trump campaign adviser Carter Page.

Barr has previously said, however, that Horowitz’s “ability to get information from former officials or from other agencies outside the Department [of Justice] is very limited.” Thus, Barr picked Durham to carry out a beefed-up inquiry.

Durham will continue serving as Connecticut’s U.S. attorney, the DOJ said, but his review is already “being conducted primarily in the Washington D.C. area” and his DOJ team will operate out of “existing office space.”"
Justice Department backs parents suing Maine over tuition for religious schools,https://www.pressherald.com,"['Follow On Twitter', 'Email Writer']",06-11-2019,2019,6,https://www.pressherald.com/2019/06/11/doj-expresses-support-for-plaintiffs-in-maine-religious-school-tuition-case/,"The U.S. Department of Justice has thrown its support behind a small group of Maine parents who have filed a federal lawsuit seeking reimbursement for their children’s religious school tuition.

The department filed a “letter of interest” in U.S. District Court in Portland on Monday expressing its opinion about the Maine case, Carson v. Makin. It sided strongly with the plaintiffs, citing DOJ guidance that “government may not target persons or individuals because of their religion,” and “individuals do not give up their religious-liberty protections by providing or receiving social services, education or healthcare.”

Related Headlines Families’ lawsuit challenges Maine law against public funding for religious schools

Three married couples in central Maine filed the lawsuit in August 2018 against the state Department of Education over a decades-old Maine law that bars tuition reimbursements for religious schools. Oral arguments in the lawsuit are scheduled for June 24 at the federal courthouse in Portland.

Local school administrative units in Maine that do not have their own secondary schools can pay a certain amount in tuition for students to attend outside public or private schools. But that money cannot be used at religious schools, a policy that the parents’ legal complaint calls discriminatory and unconstitutional.

The plaintiffs, led by Glenburn residents David and Amy Carson, are represented by two national groups that describe themselves as advocates for religious liberty and school choice. The lawsuit comes at a time when the Trump administration has made the push for alternatives to public schools central to the national education policy debate.

DOJ spokeswoman Kelly Laco said in an email that the protection of religious freedom is a top priority for the department.

In July 2018, the DOJ announced the formation of the Religious Liberty Task Force, which brings together department components to coordinate their work on religious freedom litigation and policy, and to implement former U.S. Attorney General Jeff Sessions’ 2017 religious liberty guidance, Laco said.

“That guidance was issued at the direction of President Trump’s May 4, 2017, executive order promoting free speech and religious liberty,” she said.

Laco did not respond to a follow-up email asking if the Department of Justice plans to get involved further in the case, such as by participating in oral arguments.

Zachary Heiden, legal director for the American Civil Liberties Union of Maine, said his organization joined the case as a “friend of the court” arguing in favor of upholding the state’s ban on tuition reimbursement for religious schools.

Heiden said he has read the DOJ’s letter and found that its legal arguments primarily echo those made by the plaintiffs in their original complaint. He said it’s not unusual for the department to file a letter of interest in a case in which it has an opinion.

“This is what they do,” Heiden said. “This is one of the ways in which the Department of Justice does its job.”

He said the impact of the lawsuit’s outcome will be limited in scope because the existing law only applies to certain small communities in Maine. However, it could be used as precedent in other related cases.

Heiden believes the plaintiffs have an uphill battle. The same state law has been challenged four times in various state and federal courts, he said, and in all four cases the plaintiffs have lost.

“Those courts have always said that this Maine law is constitutional, is permissible,” Heiden said. “That law hasn’t changed. The First Amendment hasn’t changed. So it would be quite significant for the court to now say that, actually, the Maine law violates the Constitution.”

More than 30 states have constitutional amendments that prohibit state funding of religious organizations, including schools. Though Maine is not one of them, it passed a law in 1981 that bars public funding for sectarian schools. Legislative efforts to expand school choice and give taxpayer money to religious schools have failed to gain traction in recent years.

One of the groups representing the plaintiffs in Carson v. Makin, the Virginia-based Institute for Justice, a nonprofit libertarian public-interest law firm, has said it decided to challenge the Maine law again in light of a U.S. Supreme Court ruling in 2017.

In that case, Trinity Lutheran Church in Missouri was barred from participating in a state program that reimburses the cost of rubberizing playground surfaces. The nation’s highest court ultimately decided the church should be eligible for that public funding. Advocates for public funding of religious schools hope that case will serve as legal precedent to advance their own interests.

But Heiden said he doesn’t see a strong connection between the Missouri case and the one in Maine.

“I disagree with their interpretation of that (Missouri) case,” he said. “It’s about … shredded rubber tires on playground surfaces, which I don’t think is the same thing as funding education. But obviously the DOJ has a different interpretation of that.”

Share

< Previous

Next >

filed under:"
