Treasury overlooks the true culprit behind US dollar strength,https://thehill.com,[],06-01-2019,2019,6,https://thehill.com/opinion/finance/446354-treasury-overlooks-the-true-culprit-behind-us-dollar-strength,"After a long delay, the Treasury Department just released its latest semi-annual report on global currency exchange policies. The congressionally mandated report provides an assessment of whether foreign countries are undervaluing their currencies to gain a trade advantage.

The major takeaway from the report is that Treasury has expanded the list of countries it is monitoring for exchange rate abuses. However, the department repeated its longstanding practice — and once again found no currency “manipulation” by America’s trade competitors.

In other words, Treasury believes that foreign central banks are not acting to push the U.S. dollar’s value up to noncompetitive levels.

ADVERTISEMENT

Treasury is barking up the wrong tree, however. In the current market, the dollar is indeed being driven up, but by private capital inflows, not central banks — and it’s making U.S. exports too expensive in global markets.

Conversely, the currencies of America’s chief competitors — Japan, China and Europe — are too low. The result is that American-made cars, airplanes and other manufactured goods are getting priced out of the market through no fault of domestic U.S. companies.

The Treasury Department did acknowledge in its report that the dollar is overvalued and that other countries’ currencies are undervalued. The report also recognized that the dollar’s relative overvaluation drives the current U.S. trade deficit. Regrettably, Treasury offered no policy proposals to address this growing problem.

With America’s global trade deficit continuing to climb, the administration and Congress must recognize that the 21st century’s problem is no longer currency manipulation by foreign central banks.

Instead, a glut of private foreign capital is flowing into U.S. financial markets, continually driving the dollar higher, which allows foreign competitors to reap a windfall without lifting a finger. Wall Street perpetually cheers this strong dollar, but it is now working against American companies.

For those wondering why the U.S. trade deficit grew in 2018 despite President Trump Donald John TrumpHead of Trump's Council of Economic Advisers to depart administration The Guardian editorial board says Trump is 'not welcome' in U.K. ahead of his first state visit Kushner casts doubt on the ability of Palestinians to govern themselves MORE’s aggressive trade intervention, it’s these capital inflows that are the root cause.

A wonkish explanation is needed to understand the problem. In the 1970s and 80s, Japan and West Germany followed a strategy that supercharged their economic growth.

They manipulated currency markets by buying dollar-based assets and sold their own currencies at the same time. The result was a rise in the dollar that made their exports comparably cheaper in the U.S. market.

In 1985, President Reagan faced the largest trade deficit in U.S. history. He responded to congressional pressure by negotiating with Japan and West Germany to stop their currency practices. The resulting agreement, the Plaza Accord, devalued the dollar significantly while raising the value of the yen and the Deutsche mark.

U.S. products became globally competitive, and the U.S. trade deficit shrank. In 1988, Congress passed a law requiring the Treasury Department to issue twice-yearly reports identifying countries that manipulate their currencies.

ADVERTISEMENT

From the mid-1990s through 2015, China and other countries followed a similar nationalistic strategy, buying dollars and selling their own currencies to gain a trade advantage. But in recent years, a global oversupply of private capital flowing into the U.S. has started to do the job for them.

Some foreign countries use economic strategies to produce more than their citizens consume, and they export the difference. They generate trade surpluses and, as a result, accumulate progressively more savings than they invest at home.

Those surplus savings flow into countries with trade deficits, primarily the United States. This flood of “toxic waste” capital — as some economists describe it — buys Treasury bonds and U.S. stocks, which drives the dollar higher. And so, the U.S. trade deficit gets worse as American exports become less competitive.

Wall Street is happy to accept these private capital inflows in exchange for the stocks and bonds their brokers sell. But U.S. goods and services become too expensive in global markets, harming workers and hurting economic growth.

American companies lose market share to foreign competitors both at home and abroad, and they struggle to remain profitable — cutting budgets for innovative research and wage increases. It’s the key problem facing Main Street today.

While Treasury correctly found that there is no large-scale currency manipulation occurring among central banks, the department is focused on the wrong issue because these governments no longer need to push the dollar higher. International banks and hedge funds are doing the work for them.

One solution is a market access charge to manage this toxic influx of foreign capital. Like a peak load charge during rush hour traffic, a fee applied to incoming investment could slow foreign capital inflows, gradually lowering the dollar to a trade-balancing price. America would become competitive again in international trade and maintain its global leadership.

President Trump and Treasury Secretary Mnuchin cannot eliminate the U.S. trade deficit until they focus on these excessive foreign capital inflows, which are weaponizing the dollar against the interests of America’s companies and workers.

Solving this problem will allow the president to fulfill his campaign promise of narrowing the trade deficit and creating millions of good-paying, middle-class U.S. jobs for many years to come.

Michael Stumo is CEO of the Coalition for a Prosperous America (CPA)."
Department of Corrections turns over disputed documents to Justice Department,https://www.al.com,"['William Thornton', 'Wthornton Al.Com']",06-01-2019,2019,6,https://www.al.com/news/2019/06/department-of-corrections-turns-over-disputed-documents-to-justice-department.html,"The Alabama Department of Corrections surrendered documents this week that the U.S. Department of Justice said dealt with reports of excessive force and sexual abuse against inmates by correctional officers.

According to a four-page motion filed Thursday by lawyers representing the DOJ, the ADOC provided documents “specifically related to use of force and sexual abuse by staff.” As a result, the DOJ withdrew a petition to enforce a subpoena that it filed last October.

U.S. Magistrate Judge Gray Borden had given both sides until Friday to come up with a solution to the impasse.

There is no word yet on what DOJ will do with the documents. In April the Justice Department released a report on its two-and-a-half-year investigation into violence and poor conditions within Alabama’s men’s prisons. The DOJ concluded that there is reasonable cause to believe that conditions in the prisons violate the Eighth Amendment.

Last month, in an effort to get the contested documents, Justice Department lawyers said there are still areas of the investigation that have “not been completed.”

A footnote on the first page of the 62-page report on Alabama’s prisons says that the investigation was opened to look at whether ADOC was adequately ensuring inmate safety from physical and sexual violence between inmates, and whether inmates had safe and sanitary living conditions.

However, the footnote stated that an investigation into a third issue - whether inmates were safe from excessive force and sexual abuse from staff members – is ongoing “because the Department’s petition to enforce its subpoena for documents relevant to that issue is pending with the court.”

On Oct. 12, 2018, DOJ filed a petition requesting the federal court force ADOC to turn over a series of individual prisoner investigative files, and documents on open and closed investigations, including autopsy reports on some inmates and some medical records not previously made available at correctional facilities.

The filing also requested weekly reports from ADOC’s Intelligence and Investigations Division from September 2016 to September 2017.

Since 2012, Alabama men’s and women’s prisons have come under repeated scrutiny for staffing and safety, as well as a pervasive atmosphere of documented sexual and physical abuse."
"Elizabeth Warren wants Congress to say that a president can be indicted - WBNS-10TV Columbus, Ohio | Columbus News, Weather & Sports",https://www.10tv.com,[],05-31-2019,2019,5,https://www.10tv.com/article/elizabeth-warren-wants-congress-say-president-can-be-indicted-2019-may,"Sen. Elizabeth Warren is pitching a plan to ""make sure no President is above the law.""

The proposal, the latest in a series published to the Democratic presidential hopeful's Medium page, shows frustration with Special Counsel Robert Mueller's assertion that Department of Justice policy made him incapable of charging President Trump with a crime no matter his findings.

""If Donald Trump were anyone other than the President of the United States, he would be in handcuffs and indicted. Robert Mueller said as much in his report, and he said it again on Wednesday,"" Warren wrote.

Advertisement - Story continues below

Warren's plan calls on Congress to clarify in law that the Justice Department can indict a sitting president and specifically that the president can be charged with obstruction of justice. It also calls for a U.S. code amendment to explicitly allow for indictment if the president abuses the powers of the office to obstruct justice.

""When I made this decision to run for president. It wasn't going to be about impeachment. It was going to be about plans, what's broken and how to fix it. And then the Mueller report came out 42 days ago,"" Warren said yesterday on The View.

Warren has been one of the most vocal presidential candidates calling for Trump's impeachment, but argues now that impeachment shouldn't be the only path to remove a president. Because it calls for the passage of laws, however, it won't be much help in the fight to pull Trump from office; it would only make it feasible to indict future presidents—beginning with Warren should she be elected.

At issue are two Office of Legal Counsel (OLC) memos from 1973 and 2000 that interpret the law to mean the Justice Department cannot indict a sitting president. The argument for that immunity hinges on separation of powers and looks to protect the president from politically motivated legal attacks.

Such protections, however, do not explicitly appear in the Constitution, so Warren's proposed law clarifying the Justice Department's ability to prosecute the president would theoretically take away the president's protection. But they would also require Congress to step into the lane of the courts with a law that in effect interprets law.

Warren also pledged to appoint an attorney general ""who will protect the rule of law."" Even if such measures were successful, any presidentially-appointed attorney general could stop a Justice Department indictment. She also said she would appoint an assistant attorney general in charge of the OLC to reverse the opinions protecting the president.

""No matter what he may think, Donald Trump is not a King. No President is. And our democracy only works if everyone can be held accountable,"" Warren wrote."
"DOJ watchdog: Former FBI official illegally leaked court docs, disclosed 'sensitive' information and took gift from media",https://www.foxnews.com,"['Gregg Re', 'Gregg Re Is A Lawyer', 'Editor Based In Los Angeles. Follow Him On Twitter']",,,,https://www.foxnews.com/politics/doj-watchdog-finds-fmr-fbi-deputy-assistant-director-leaked-sensitive-information-took-gift-from-media-but-declines-prosecution,"The Justice Department's internal watchdog announced in an investigative summary released Wednesday that an unnamed former FBI deputy assistant director engaged in ""misconduct,"" including leaking ""sensitive"" information to the media, violating federal law by disclosing sealed court records and taking a gift from someone in the media.

Nevertheless, the inspector general (IG) indicated, without explanation, that ""prosecution of the DAD [deputy assistant director] was declined."" The investigation's findings will be referred to the FBI for potential further action, the IG said.

The official became the second high-level FBI employee to be formally rebuked by the IG over media contacts seen as improper. Former FBI deputy director Andrew McCabe was fired from the bureau in March 2018 by then-Attorney General Jeff Sessions after an inspector general report revealed that he ""lacked candor"" when discussing his communications about federal probes with members of the media.

The IG first indicated in its June 2018 report on DOJ and FBI misconduct that ""although FBI policy strictly limits the employees who are authorized to speak to the media, we found that this policy appeared to be widely ignored during the period we reviewed.""

The IG, flagging what it called an apparent ""cultural"" problem at the bureau, said at the time it would announce the conclusion of multiple separate ""investigations"" into the matter at a later date. The Wednesday report appeared to be the opening salvo in those reports. A distinct, comprehensive IG report covering a variety of additional matters, including potential FBI surveillance abuses, is expected in a matter of weeks.

John Durham, the U.S. attorney in Connecticut, and John Huber, the U.S. attorney in Utah, are conducting independent parallel probes into the FBI and DOJ. Last week, President Trump authorized Attorney General William Barr to declassify and release materials pertinent to the reviews.

The investigative summary released Wednesday specifically found by a preponderance of evidence that the DAD had ""engaged in misconduct when the DAD accepted a ticket, valued at approximately $225, to attend a media-sponsored dinner, as a gift from a member of the media, in violation of federal regulations and FBI policy.""

STRZOK'S SPECIAL COUNSEL PHONE TOTALLY WIPED BY RECORDS OFFICER WHO ASSUMED NOTHING IMPORTANT WAS ON THERE

The report also assessed that the DAD ""disclosed to the media the existence of information that had been filed under seal in federal court, in violation of 18 USC § 401, Contempt of Court, provided without authorization FBI law enforcement sensitive information to reporters on multiple occasions; and had dozens of official contacts with the media without authorization, in violation of FBI policy."" Contempt of court can be punished by a jail term or a fine, at the court's discretion.

Media leaks played a central role in advancing the narrative that the Trump campaign may have colluded with Russia, and Republican lawmakers have charged that the FBI and DOJ planted sensitive information to further their own political and investigative goals.

The FBI, for example, extensively relied on news articles -- including one from Yahoo News -- to obtain a surveillance warrant to monitor former Trump aide Carter Page. The FBI did not inform the FISA court that the Yahoo article relied on a source that, according to Senate Judiciary Committee Chairman Lindsey Graham, R-S.C., the FBI knew was politically motivated. Internal FBI text messages obtained by Fox News also show FBI brass fretting that a senior DOJ officials had similar concerns about a FISA source's bias.

And text messages between ex-FBI employees and former lovers Peter Strzok and Lisa Page, unearthed last year, revealed that government officials were ""leaking like mad"" in the run-up to the Trump-Russia collusion probe.

""In addition to the significant number of communications between FBI employees and journalists, we identified social interactions between FBI employees and journalists that were, at a minimum, inconsistent with FBI policy and department ethics rules,"" the IG wrote in June. ""For example, we identified instances where FBI employees received tickets to sporting events from journalists, went on golfing outings with media representatives, were treated to drinks and meals after work by reporters, and were the guests of journalists at nonpublic social events.""

The IG concluded by describing ""the harm caused by leaks, fear of potential leaks, and a culture of unauthorized media contacts.""

""We do not believe the problem is with the FBI’s policy, which we found to be clear and unambiguous,"" the IG added. ""Rather, we concluded that these leaks highlight the need to change what appears to be a cultural attitude.""

Fox News' Brooke Singman and Catherine Herridge contributed to this report."
Mark Meadows sends referral to DOJ about mysterious UK communique about Christopher Steele,https://www.washingtonexaminer.com,[],05-30-2019,2019,5,https://www.washingtonexaminer.com/news/mark-meadows-sends-referral-to-doj-about-mysterious-uk-communique-about-christopher-steele,"Rep. Mark Meadows, R-N.C., sent a referral to the Justice Department about a message a top United Kingdom national security official delivered to the Trump transition team a week before President Trump's inauguration.

Congressional investigators told the Hill that in January 2017 then-U.K. national security adviser Sir Mark Lyall Grant hand-delivered a memo to soon-to-be national security adviser Michael Flynn's team that asserted the U.K. government had doubts about the credibility of British ex-spy Christopher Steele. Recent reports suggest Steele had briefed British intelligence officials on his dossier after the 2016 presidential election, and the heads of MI5 and MI6 were made aware of the contents of the dossier by late November.

“A whistleblower recently revealed the existence of a communique from our allies in Great Britain during the early days of the Russia collusion investigation,” Meadows said.

“Based on my conversations with that individual, and the credible timelines that are supported by other events, I made a referral to Attorney General William Barr and Inspector General Michael Horowitz for further investigation,” the North Carolina Republican added. “There now is overwhelming evidence to suggest that on multiple occasions the FBI was warned that Christopher Steele and the dossier had severe credibility issues.”

Steele compiled a dossier that contained salacious and unverified claims about Trump's ties to Russia. He was hired by opposition research firm Fusion GPS and was paid, in part, by the Democratic National Committee and Hillary Clinton's campaign. His dossier has become a flashpoint of concern for Republicans after the declassification of a House Intelligence Committee memo that said the FBI used the unverified research to obtain Foreign Intelligence Surveillance Act warrants beginning in October 2016 to wiretap onetime Trump campaign adviser Carter Page.

GOP investigators learned of the communique's existence within the past few weeks by a whistleblower who was part of Flynn's team and are pressing for answers ahead of Trump's visit to the United Kingdom early next month. Its existence came to light a month after the revelation of a State Department official's notes about an October 2016 meeting with Steele, sent to the FBI, that warned he was unreliable and that he had said he was being encouraged to get his allegations out prior to the 2016 presidential election.

The communique could be significant as it would have been delivered before the FBI applied for three FISA renewals against Page in 2017 using Steele's research. Sources said Flynn was not aware of its existence until he was questioned as part of special counsel Robert Mueller's investigation, after he pleaded guilty to lying to the FBI about his contacts with a Russian envoy, and therefore Trump too was likely not told about it.

The possible misuse of Steele's dossier has come into greater focus in recent weeks, including questions about whether the dossier contained possible Russian disinformation and whether former FBI Director James Comey or former CIA Director John Brennan tried to include the dossier in the January 2017 Intelligence Community Assessment on Russian interference in the 2016 election.

At least three federal investigations are looking into alleged FISA abuse, and other matters related to the way the FBI and the Justice Department conducted the Trump-Russia investigation, and several top ex-officials. Among them are Barr's examination of the origins of the counterintelligence inquiry into Trump's campaign. He has tasked U.S. Attorney John Durham to lead the review. Barr says he is working closely with Horowitz, who is nearing completion of his FISA abuse investigation.

Steele is reportedly open to speaking with Horowitz but has declined to cooperate with Barr."
EPA finalizes plan to expand ethanol use,https://abcnews.go.com,['Abc News'],,,,https://abcnews.go.com/Politics/epa-finalizes-plan-expand-ethanol-gasoline-summer/story?id=63397761,"Gasoline that contains a higher percentage of ethanol should be available to drivers around the country this summer, the Trump administration announced Friday.

The Environmental Protection Agency finalized a proposal to lift limits on the amount of ethanol in gasoline, saying it will expand the market for biofuels and generate a win for corn producers. Industry groups also said it will help the biofuel industry and give consumers more options at the pump.

“As President Trump promised, EPA is approving the year-round sale of E15 in time for summer driving season, giving drivers more choices at the pump,"" EPA Administrator Andrew Wheeler said in a press release.

Trump said he would ask for the change at a campaign rally last March, months before the midterm elections. Expanding ethanol is seen as a way to boost markets for corn produced in Midwestern states and benefit political candidates that support expanded ethanol production.

The head of EPA’s air office, Bill Wehrum, said the proposal helps support renewable fuels and addresses concerns from the oil industry about the regulation of biofuels.

Gerry Broome/AP, FILE

The EPA originally set limits on gasoline with 15% ethanol because of concerns the higher temperatures in the summer could lead to more air pollution. But Wehrum said he doesn't expect a noticeable impact because gasoline with 10% ethanol is already sold in the summer months.

""At the end of the day from an environmental standpoint this doesn't make any significant difference,"" he told reporters Friday.

Critics see the decision as an attempt by Trump to help farmers in the Midwest who have been hurt by the trade war with China and declining commodity prices. Corn growers have called for the administration to allow more ethanol and have opposed waivers from oil refineries exempting them from requirements to include a minimum amount of ethanol.

#E15YearRound is welcome news from the @EPA. @NationalCorn President Lynn Chrisp: ""We thank President Trump for following through on his promise to rural America and @SecretarySonny and supporters in Congress for their outspoken commitment to year-round E15."" pic.twitter.com/lQVuuOK9e8 — National Corn (NCGA) (@NationalCorn) May 31, 2019

Agriculture Secretary Sonny Perdue also applauded the decision in a statement, saying it will help farmers and consumers while the administration looks to grow the market for American-produced ethanol both in the U.S. and in other countries.

Many farmers are facing historic delays in planting corn crops due to severe flooding. Other efforts to help struggling farmers in states impacted by natural disasters have stalled in Congress."
