"Bill Clinton 'knows nothing' about financier Jeffrey Epstein's 'terrible crimes,' former president's spokesman says",https://www.foxnews.com,"['Gregg Re', 'Gregg Re Is A Lawyer', 'Editor Based In Los Angeles. Follow Him On Twitter']",,,,https://www.foxnews.com/politics/bill-clinton-knows-nothing-about-financier-jeffrey-epsteins-terrible-crimes-former-presidents-spokesman-says,"Bill Clinton ""knows nothing"" about the ""terrible crimes"" linked to Jeffrey Epstein, the former president's spokesman said Monday, in Clinton's first statement after new sex-trafficking charges were lobbed against the wealthy financier.

An indictment alleging sex trafficking and sex trafficking conspiracy was unsealed Monday morning against Epstein, the wealthy and politically connected financier who pleaded not guilty during his initial appearance in a New York City federal court. Prosecutors alleged that Epstein, the 66-year-old wealthy hedge fund manager arrested on Saturday, preyed on ""dozens"" of victims as young as 14.

""In 2002 and 2003, President Clinton took a total of four trips on Jeffrey Epstein’s airplane: one to Europe, one to Asia, and two to Africa, which included stops in connection with the work of the Clinton Foundation,"" the statement said. ""Staff, supporters of the foundation, and his Secret Service detail traveled on every leg of every trip. He had one meeting with Epstein in his Harlem office in 2002, and around the same time made one brief visit to Epstein’s New York apartment with a staff member and his security detail. He’s not spoken to Epstein in well over a decade, and he has never been to Little St. James Island, Epstein’s ranch in New Mexico, or his residence in Florida.”

Separately, claims in court showed that President Trump may have flown on the jet at least once, as well.

CUSHY PLEA BARGAIN WITH EPSTEIN WAS SO BAD IT BROKE THE LAW, JUDGE RULES

Meanwhile, Attorney General Bill Barr said he has recused himself from the matter ""because one of the law firms that represented Epstein long ago was a firm I subsequently joined for a period of time.""

On Saturday evening, Christine Pelosi, a Democratic National Committee official and daughter of House Speaker Nancy Pelosi, warned conspicuously that it is ""quite likely that some of our faves are implicated"" in the ""horrific"" sex-trafficking case.

""This Epstein case is horrific and the young women deserve justice,"" Pelosi tweeted. ""It is quite likely that some of our faves are implicated but we must follow the facts and let the chips fall where they may - whether on Republicans or Democrats.""

For his part, Trump previously called attention to Clinton's dealings with the financier.

""Nice guy -- uh, got a lot of problems coming up, in my opinion, with the famous island, with Jeffrey Epstein,"" Trump told Fox News' Sean Hannity in 2015, referring to Clinton's connections with Epstein. ""A lot of problems.""

Meanwhile, Trump biographer Tim O'Brien this weekend reposted an excerpt fom a 2002 profile of Epstein in New York Magazine, in which Trump told a reporter, ""I've known Jeff for fifteen years. Terrific guy. He's a lot of fun to be with. It is even said that he likes beautiful women as much as I do, and many of them are on the younger side.""

Trump banned Epstein from his Mar-a-Lago estate “because Epstein sexually assaulted an underage girl at the club,” according to court documents filed by Bradley Edwards, the lawyer who has represented several Epstein accusers. That claim has not been confirmed by Trump or Mar-a-Lago.

Epstein appeared Monday in a hearing that lasted about 30 minutes wearing a blue prison top with a brown T-shirt underneath, in addition to orange slip-on sneakers. Prosecutors said in the 36 hours since Epstein's arrest, multiple attorneys and several individuals have come forward and said they were victims, none of whom had previously been spoken to.

FORMER FBI OFFICIAL: INDICTMENT OF JEFFREY EPSTEIN IS 'PLACEHOLDER,' EXPECT DOZENS MORE CHARGES IN NEAR FUTURE

Epstein allegedly created and maintained a ""vast network"" and operation from 2002 ""up to and including"" at least 2005 that enabled him to ""sexually exploit and abuse dozens of underage girls"" in addition to paying victims to recruit other underage girls.

""This allowed Epstein to create an ever-expanding web of new victims,"" U.S. Attorney Geoffrey Berman said at a news conference.

Berman added that nude photographs ""of what appeared to be underage girls"" were discovered at Epstein's Manhattan mansion during a search following his arrest Saturday. The hundreds of photos were discovered in a locked safe, according to officials.

Prosecutors also allege Epstein ""worked and conspired with others, including employees and associates"" who helped facilitate his conduct by contacting victims and scheduling their sexual encounters with the 66-year-old at his mansion in New York City and Palm, Beach, Fla.

At Epstein's multi-story mansion on the Upper East Side of Manhattan, prosecutors said that victims would be escorted to a room with a massage table where they would perform a massage on him.

""The victims, who were as young as 14 years of age, were told by Epstein or other individuals to partially or fully undress before beginning the 'massage,'"" prosecutors wrote. ""During the encounter, Epstein would escalate the nature and scope of physical contact with his victims to include, among other things, sex acts such as groping and direct and indirect contact with the victim's genitals.""

In Monday's court appearance, prosecutors said that the massage room in New York was set up exactly as how the alleged victims described it 15 years ago.

CHRISTINE PELOSI WARNS IT'S 'QUITE LIKELY THAT SOME OF OUR FAVES ARE IMPLICATED' IN 'HORRIFIC' EPSTEIN CASE

Victims would be paid hundreds of dollars in cash by either Epstein or one of his associates or employees, according to prosecutors. The 66-year-old also allegedly ""incentivized his victims"" to become recruiters by paying the victim-recruiters hundreds of dollars for each girl brought to him.

""In so doing, Epstein maintained a steady supply of new victims to exploit,"" federal prosecutors said.

FBI Assistant Director-in-Charge William Sweeney said that Epstein was arrested at Teterboro Airport in New Jersey at 5 p.m. on Saturday ""without incident."" Epstein is now being held at the Metropolitan Correctional Center, a federal jail near the Manhattan courthouse where he appeared Monday afternoon.

Fox News' Travis Fedschun and Tamara Gitt contributed to this report."
Trump 'dossier' author grilled by Justice Department watchdogs: sources,https://www.reuters.com,"['Mark Hosenball', 'Min Read']",07-09-2019,2019,7,https://www.reuters.com/article/us-usa-trump-russia/trump-dossier-author-grilled-by-justice-department-watchdogs-sources-idUSKCN1U410I,"(Reuters) - Federal lawyers probing the origins of the investigation of ties between Russia and President Donald Trump’s campaign have interviewed the author of a “dossier” that alleged misconduct between Trump and Moscow, prompting the lawyers to extend their inquiry.

A police car drives past an address which has been linked by local media to former British intelligence officer Christopher Steele, who has been named as the author of an intelligence dossier on President-elect Donald Trump, in Wokingham, Britain, January 12, 2016. REUTERS/Peter Nicholls

Three attorneys from the Inspector General’s office of the U.S. Department of Justice met in person in early June with dossier author Christopher Steele in Britain, said two sources with direct knowledge of the lawyers’ travels.

The interview with Steele, a former top spy on Russia for Britain’s Secret Intelligence Service, or MI6, took place while Trump was in London for a formal state visit with Queen Elizabeth and a meeting with UK Prime Minister Theresa May.

Steele’s dossier, made public in 2017, alleged that Moscow attempted to interfere in the 2016 U.S. presidential election and that there was potential collusion between Russia and Trump’s campaign, along with other unverified and salacious claims about the president.

The Justice Department’s inspector general has been examining the earliest stages of an FBI investigation of Trump, his former 2016 presidential campaign rival Democratic nominee Hillary Clinton, Russia and former Trump adviser Carter Page.

Inspector General Michael Horowitz, whose office is an internal Justice Department watchdog, launched his probe in March 2018 amid allegations by Republican lawmakers that the FBI erred in seeking a warrant to monitor Page.

Trump has described the Steele dossier as “bogus” and Republicans have long sought to discredit the FBI’s investigation, which was later taken over by U.S. Special Counsel Robert Mueller. His final report on Russia and the Trump campaign was released in redacted form in mid-April.

In that same month, Attorney General William Barr, who now heads the Justice Department, told a congressional committee that the Horowitz probe would be completed by May or June.

One of the two sources said Horowitz’s investigators appear to have found Steele’s information sufficiently credible to have to extend the investigation. Its completion date is now unclear.

A key focus of the Horowitz probe is whether the FBI followed proper procedures when it applied for a warrant with the Foreign Intelligence Surveillance Court (FISA) to secretly conduct surveillance on Page and his ties to Russia.

Declassified documents show that the FBI cited information in Steele’s dossier when it asked the secretive FISA court in late 2016 for a warrant to eavesdrop electronically on Page, a U.S. businessman with interests in Russia.

Horowitz’s office in Washington declined to comment.

A spokesman for Orbis Business Intelligence, Steele’s London investigations firm, declined to comment.

UK government agencies declined to disclose whether they were in contact with Horowitz’s team in London.

Moscow repeatedly rejected accusations of interfering in the election.

Mueller’s report, released on April 18, said that Russia did meddle in the election in an attempt to boost Trump’s candidacy. It said Trump campaign officials had multiple contacts with Russian officials. But it found insufficient evidence to establish a criminal conspiracy between the campaign and Moscow.

The report also described numerous attempts by Trump to impede Mueller’s inquiry, but it stopped short of declaring that he committed a crime. Mueller during his inquiry brought charges against 34 people, including Russian agents and ex-Trump aides.

Page, a foreign policy adviser during Trump’s campaign, drew scrutiny from the FBI, which said in legal filings in 2016 that it believed he had been “collaborating and conspiring” with the Kremlin. But he was not charged.

Investigators working for Mueller in September 2017 twice interviewed Steele, who also gave written testimony to the U.S. Senate Intelligence Committee in August 2018. That panel and other committees of Congress have taken up where Mueller left off after his investigation ended."
U.S. Justice Department trying to quash Mueller team testimony -report,https://www.aol.com,"['Aol Staff', 'Thomson Reuters']",07-10-2019,2019,7,https://www.aol.com/article/news/2019/07/10/us-justice-department-trying-to-quash-mueller-team-testimony-report/23767478/,"WASHINGTON, July 10 (Reuters) - The Justice Department is trying to prevent two former members of Special Counsel Robert Mueller's team from testifying behind closed doors as Mueller prepares to make a public appearance before lawmakers next week, the New York Times reported on Wednesday.

The department said last week it opposed testimony by Aaron Zebley and James Quarles before the Democratic-led House of Representatives' Intelligence and Judiciary Committees, a senior congressional official told the paper. A Justice Department official confirmed the account and had instructed the men not to appear, the paper said.

A person familiar with the matter told Reuters the former Mueller team members were in negotiations to testify before the two panels behind closed doors. The person could not confirm that the Justice Department had instructed them not to testify.

Mueller is due to testify in open session before the House of Representatives Judiciary and Intelligence Committees on July 17.

Justice Department representatives were not immediately available for comment on the report. Committee spokesmen did not respond to a request for comment.

22 PHOTOS Robert Mueller See Gallery Robert Mueller WASHINGTON, DC - OCTOBER 28: Former FBI director Robert Mueller attends the ceremonial swearing-in of FBI Director James Comey at the FBI Headquarters October 28, 2013 in Washington, DC. Comey was officially sworn in as director of FBI on September 4 to succeed Mueller who had served as director for 12 years. (Photo by Alex Wong/Getty Images) US President Barack Obama applauds outgoing Federal Bureau of Investigations (FBI) director Robert Mueller (L) in the Rose Garden at the White House in Washington on June 21, 2013 as he nominates Jim Comey to be the next FBI director. Comey, a deputy attorney general under George W. Bush, would replace Mueller, who is stepping down from the agency he has led since the week before the September 11, 2001 attacks. AFP PHOTO/Nicholas KAMM (Photo credit should read NICHOLAS KAMM/AFP/Getty Images) Outgoing FBI Director Robert Mueller applauds key staff members during a farewell ceremony held for him at the Justice Department in Washington, August 1, 2013. On Monday the U.S. Senate confirmed former Deputy Attorney General James Comey to replace Mueller, who has led the bureau since shortly before the September 11, 2001, attacks on the United States. REUTERS/Jonathan Ernst (UNITED STATES - Tags: POLITICS CRIME LAW HEADSHOT) 391489 03: U.S. President George W. Bush speaks during a conference as he stands with Justice Department veteran Robert Mueller, left, who he has nominated to head the FBI, and Attorney General John Ashcroft July 5, 2001 the Rose Garden at the White House in Washington, DC. (Photo by Mark Wilson/Getty Images) Outgoing FBI Director Robert Mueller stands for the national anthem during a farewell ceremony for him at the Justice Department in Washington, August 1, 2013. On Monday the U.S. Senate confirmed former Deputy Attorney General James Comey to replace Mueller, who has led the bureau since shortly before the September 11, 2001, attacks on the United States. REUTERS/Jonathan Ernst (UNITED STATES - Tags: POLITICS CRIME LAW) Outgoing FBI Director Robert Mueller (L) reacts to a standing ovation from the audience, Deputy U.S. Attorney General James Cole (C) and U.S. Attorney General Eric Holder (R) during Mueller's farewell ceremony at the Justice Department in Washington, August 1, 2013. On Monday the U.S. Senate confirmed former Deputy Attorney General James Comey to replace Mueller, who has led the bureau since shortly before the September 11, 2001, attacks on the United States. REUTERS/Jonathan Ernst (UNITED STATES - Tags: POLITICS CRIME LAW) Outgoing FBI Director Robert Mueller gestures during his remarks at a farewell ceremony held for him at the Justice Department in Washington, August 1, 2013. On Monday the U.S. Senate confirmed former Deputy Attorney General James Comey to replace Mueller, who has led the bureau since shortly before the September 11, 2001, attacks on the United States. REUTERS/Jonathan Ernst (UNITED STATES - Tags: POLITICS CRIME LAW) FILE PHOTO -- U.S. Attorney General John Ashcroft (R) and FBI Director Robert Mueller speak about possible terrorist threats against the United States, in Washington, May 26, 2004. REUTERS/Kevin Lamarque/File Photo Outgoing FBI Director Robert Mueller reacts to applause from the audience during his farewell ceremony at the Justice Department in Washington, August 1, 2013. On Monday the U.S. Senate confirmed former Deputy Attorney General James Comey to replace Mueller, who has led the bureau since shortly before the September 11, 2001, attacks on the United States. REUTERS/Jonathan Ernst (UNITED STATES - Tags: POLITICS CRIME LAW) UNITED STATES - JUNE 19: Chairman Pat Leahy, D-Vt., right, and FBI Director Robert Mueller make their way to a Senate Judiciary Committee hearing in Dirksen Building on oversight of the FBI. (Photo By Tom Williams/CQ Roll Call) Outgoing FBI Director Robert Mueller (C) delivers remarks at a farewell ceremony for him at the Justice Department in Washington, August 1, 2013. On Monday the U.S. Senate confirmed former Deputy Attorney General James Comey to replace Mueller, who has led the bureau since shortly before the September 11, 2001, attacks on the United States. Also onstage with Mueller are Deputy U.S. Attorney General James Cole (FROM L), U.S. Attorney General Eric Holder, former CIA Director George Tenet and TSA Administrator John Pistole. REUTERS/Jonathan Ernst (UNITED STATES - Tags: POLITICS CRIME LAW) WASHINGTON, DC - MAY 15: (L-R) Rep. Steny Hoyer (D-MD), U.S. Attorney General Eric Holder, Homeland Security Secretary Janet Napolitano, FBI Director Robert Mueller and Immigration and Customs Enforcement Director John Morton attend the National Peace Officers' Memorial Service at the U.S. Capitol May 15, 2013 in Washington, DC. Holder and other members of the Obama administration are being criticized over reports of the Internal Revenue Services' scrutiny of conservative organization's tax exemption requests and the subpoena of two months worth of Associated Press journalists' phone records. (Photo by Chip Somodevilla/Getty Images) FBI Director Robert Mueller testifies before the House Judiciary Committee hearing on Federal Bureau of Investigation oversight on Capitol Hill in Washington June 13, 2013. Mueller said on Thursday that the U.S. government is doing everything it can to hold confessed leaker Edward Snowden accountable for splashing surveillance secrets across the pages of newspapers worldwide. REUTERS/Yuri Gripas (UNITED STATES - Tags: POLITICS CRIME LAW) Ukrainian President Viktor Yanukovych (L) welcomes FBI Director Robert Mueller during their meeting in Kiev June 5, 2013. REUTERS/Efrem Lukatsky/Pool (UKRAINE - Tags: POLITICS) FBI Director Robert Mueller (L) arrives for the Obama presidential inauguration on the West Front of the U.S. Capitol January 21, 2013 in Washington. President Barack Obama was re-elected for a second term as President of the United States. Woman at right is unidentified. REUTERS/Win McNamee-POOL (UNITED STATES) WASHINGTON, : FBI Director Robert Mueller answers questions before Congress 17 October 2002 on Capitol Hill in Washington. Mueller was testifying before the House and Senate Select Intelligence committees' final open hearing investigating events leading up to the September 11, 2001. AFP Photos/Stephen JAFFE (Photo credit should read STEPHEN JAFFE/AFP/Getty Images) (L-R) CIA Director Leon Panetta, Director of National Intelligence James Clapper and FBI Director Robert Mueller testify at a Senate Intelligence Committee hearing on Capitol Hill in Washington, February 16, 2011. REUTERS/Jason Reed (UNITED STATES - Tags: POLITICS) 399994 02: Federal Bureau of Investigation (FBI) Director Robert Mueller visits the American military compound at Kandahar Airport January 23, 2002 in Kandahar, Afghanistan. Mueller had lunch with FBI officials and Haji Gulali, commander of the Kandahar region. (Photo by Mario Tama/Getty Images) Federal Bureau of Investigation (FBI) Director Robert Mueller (L) stand during the National Anthem alongside Attorney General Eric Holder (R) and Deputy Attorney General James Cole (C) during a farewell ceremony in Mueller's honor at the Department of Justice on August 1, 2013. Mueller is retiring from the FBI after 12-years as Director. AFP PHOTO / Saul LOEB (Photo credit should read SAUL LOEB/AFP/Getty Images) 399994 01: Federal Bureau of Investigation (FBI) Director Robert Mueller greets American forces on the American military compound at Kandahar Airport January 23, 2002 in Kandahar, Afghanistan. Mueller had lunch with FBI officials and Haji Gulali, commander of the Kandahar region. (Photo by Mario Tama/Getty Images) UNITED STATES - JUNE 19: FBI Director Robert Mueller, center, talks with Chairman Pat Leahy, D-Vt., right, and Sen. Orrin Hatch, R-Utah, talk before a Senate Judiciary Committee hearing in Dirksen Building on oversight of the FBI. (Photo By Tom Williams/CQ Roll Call) UNITED STATES - JUNE 06: OVERSIGHT HEARING ON COUNTERTERRORISM--Sen. Richard J. Durbin, D-Ill., Senate Judiciary Chairman Patrick J. Leahy, D-Vt., FBI Director Robert S. Mueller III, and Sen. Charles E. Grassley, R-Iowa, before the hearing. (Photo by Scott J. Ferrell/Congressional Quarterly/Getty Images) Up Next See Gallery Discover More Like This HIDE CAPTION SHOW CAPTION of SEE ALL BACK TO SLIDE

Mueller issued a report in April that found Russia had interfered in the 2016 U.S. presidential election and that Republican President Donald Trump’s campaign team had had multiple contacts with Russian officials.

But the report found insufficient evidence to establish a criminal conspiracy between the campaign and Moscow.

Mueller, in his first public comments since starting the two-year investigation, said on May 29 his probe was never going to end with criminal charges against Trump, and indicated it was up to Congress to decide whether he should be impeached.

""If we had confidence that the president clearly did not commit a crime, we would have said so,"" Mueller said.

The Judiciary and Intelligence panels led by U.S. Representatives Jerrold Nadler and Adam Schiff are conducting their own investigations into Russian interference and possible obstruction. (Reporting by David Morgan and Doina Chiacu; Editing by Bernadette Baum)

More from :

Barr says he sees a legal path for census citizenship query

Trump says he's mulling executive order for census

Trump says officials working on holiday on census dispute"
Two deputy commissioners leaving DHS,https://blogs.mprnews.org,['Briana Bierschbach'],,,,https://blogs.mprnews.org/capitol-view/2019/07/two-deputy-commissioners-leaving-dhs/,"Two top officials in the Minnesota Department of Human Services are leaving the agency.

The departures of deputy commissioners Chuck Johnson and Claire Wilson were confirmed Thursday in an emailed statement from DHS Commissioner Tony Lourey.

“I am grateful for the decades of service from Deputy Commissioners Chuck Johnson and Claire Wilson, and for their willingness to stay in their positions through the transition from the Dayton to Walz Administration,” said Lourey. “Their guidance, leadership and wisdom was invaluable during the legislative session. We are working to identify an interim deputy commissioner of policy and hope to announce that information in the coming days.”

Wilson’s last day is Aug. 1 and Johnson will stay on for a month or two, according to the department. DHS did not say why the two deputy commissioners are leaving. The departures are happening seven months into the administration of DFL Gov. Tim Walz, who appointed a slew of new commissioners and retained others to run two dozen state agencies as part of the transition from the previous administration.

Johnson has worked for DHS in some capacity since 1989, working on early welfare reform efforts and eventually rose to deputy commissioner of operations, overseeing the agency’s budget development. DHS is the state’s largest agency and receives the second largest slice of the state budget. The department is in charge of overseeing a broad range of health care services, from welfare and economic assistance, to services for the elderly and people with disabilities.

Sen. Jim Abeler, R-Anoka, said the departures seem “unplanned” and “hasty.”

“I’m very concerned about this. It leaves a very big hole in the leadership of DHS,” said Abeler, who chairs the chamber’s Health and Human Services Policy Committee. “He takes a lot of institutional knowledge with him. It’s a big agency with all kinds of tentacles. He knows all of the ins and outs.”

Wilson has been with the department since 2016 and was appointed deputy commissioner for policy by Lourey this year. She oversees the department’s policy administration and equity work.

“She really has a lot of credentials in caring with people with disabilities and a lot of credibility with me,” Abeler said. “I don’t know how they replace that.”

Brian Bakst contributed to this report"
Attorney General Barr recuses himself from Boeing 737 MAX probe: Justice Dept.,https://www.reuters.com,"['Reuters Editorial', 'Min Read']",07-11-2019,2019,7,https://www.reuters.com/article/us-boeing-barr/attorney-general-barr-recuses-himself-from-boeing-737-max-probe-justice-dept-idUSKCN1U62RV,"U.S. Attorney General William Barr speaks at the FBI National Academy Graduation Ceremony in Quantico, Virginia, U.S., June 7, 2019 REUTERS/Tom Brenner

WASHINGTON (Reuters) - U.S. Attorney General William Barr has recused himself from the Justice Department’s investigation into Boeing Co (BA.N) after two 737 MAX airplane crashes killed 346 people, a spokeswoman for Barr said Thursday.

Bloomberg News reported on Thursday that Barr has recused himself because his former law firm is representing Boeing. Reuters and other outlets reported in March that federal prosecutors aided by the FBI were scrutinizing the development of the 737 MAX jetliners. Boeing did not immediately comment."
