"For Trump, keeping up the act must be exhausting",https://www.cnn.com,"[""Michael D'Antonio""]",08-26-2019,2019,8,https://www.cnn.com/2019/08/26/opinions/trump-g7-dantonio/index.html,"(CNN) The odd man out at the G7 gathering of the world's richest democracies, President Donald Trump cut a weary figure at a farewell press conference Monday, where he boosted the pariah Russian President Vladimir Putin, railed against Barack Obama, and once again bragged about the great relationship he and his wife, Melania, have with North Korean dictator Kim Jong Un.

In contrast, Emmanuel Macron emerged from the conference as an energetic leader who bypassed America to make a diplomatic outreach to Iran. The French President's deft conduct at the G7, which featured climate change as a main topic, was all the more notable because of Trump's clumsiness. As is his habit, Trump offered conflicting messages on the trade war he started with China, blamed his predecessors for the nation's troubles -- and failed to note that Melania Trump has never met Kim Jong Un.

Macron -- and the world -- are well aware of Trump's inability to work well with others. Indeed, at the last G7 Trump reneged on a commitment to affirm a pro-trade joint communique all the others had approved, and attacked the summit's host, Canadian Prime Minister Justin Trudeau, personally, calling him ""very dishonest and weak.""

And so as Macron planned to host this year's meeting, he decided there would be no communique at all to organize the proceedings, depriving Trump of the chance to repeat his skunk-in-the garden-party trick.

The French leader matched this defensive decision -- which freed him to set a more unpredictable agenda -- with an offense move of his own. To the surprise of many, he welcomed Iranian foreign minister Javad Zarif to Biarritz on Sunday, opening the door for him to discuss trade security with his counterparts.

France was one of the six countries that signed a deal that froze Iran's nuclear weapons program in 2015. (The others were the United Kingdom, Russia, France, China, Germany and the US). Under intense monitoring, Iran complied with its part of the bargain and received, in turn, more favorable trading arrangements with the rest of the world. However, Trump regards Iran as an enemy -- and the agreement was devised by Obama (also a Trump enemy). He alienated the other signatories by abandoning the agreement last year.

JUST WATCHED Melania Trump's moment with Trudeau goes viral Replay More Videos ... MUST WATCH Melania Trump's moment with Trudeau goes viral 02:02

Trump did not meet with Zarif in Biarritz, but Macron's move appeared to coax him into a more conciliatory posture toward Iran.

While Macron was deftly circumventing him on Iran, Trump was also outplayed by his erstwhile buddy Boris Johnson on the issue of climate change. Regarded by some as Britain's version of Trump, Prime Minister Johnson glad-handed his American counterpart, but reminded the world that he disagrees with the President on climate change. Johnson expressed concern about threats to biodiversity and he actually attended the G7 session on climate change, which Trump skipped.

The insult evident in Trump's absence from that meeting was amplified by the deceptive explanation offered for his failure to attend. According to the White House press secretary, ""The President had scheduled meetings and bilaterals with Germany and India, so a senior member of the Administration attended in his stead."" In fact, the two leaders who supposedly kept Trump away were in their assigned chairs at the climate session. All anyone had to do to determine the truthfulness of the Trump claim was check a photo of the meeting, which circulated widely in the press.

A telling photo also seemed to reveal Justin Trudeau practicing a little gamesmanship with First Lady Melania Trump. Thanks to the angle of Trudeau's approach as he greeted the First Lady, cameras appear to have caught Mrs. Trump about to plant a big kiss on the movie-star-handsome Trudeau. In fact, it was only an air kiss, but the internet was ablaze with commentary about the apparently smitten look on Melania Trump's face.

JUST WATCHED Trump and Iranian president open to meeting Replay More Videos ... MUST WATCH Trump and Iranian president open to meeting 03:45

Petty as it may seem -- and much of what is being said on social media about Trudeau and the First Lady is petty -- it's no surprise to see so much attention focused on the possible signals in photos. Much of the world is exhausted by President Trump's behavior and his attention seeking.

During the G7, China's foreign ministry joined the pushback against Trump, pouring cold water on the President's claim that recent contacts between Beijing and the administration suggested progress in the trade war Trump started. ""We've gotten two calls,"" over the weekend, Trump said on Monday. ""They want to be able to make a deal."" But a spokesman for the Chinese Foreign Ministry told a news briefing: ""Regarding the phone call in the weekend, I am not aware of that.""

Like the Chinese, the G7 leaders seem to have figured out Trump's methods, and have devised ways to quietly cope with them. Trump likes to present himself as a unique, even heroic figure who can do things others cannot. In Biarritz he even suggested that if he -- and not Barack Obama -- had been president when Russia invaded Crimea, it would have been stopped. He also vehemently urged leaders to bring Vladimir Putin, who was exiled from what was once the G8 because of his aggression, back into the great nations' club.

No other members of the group have proposed bringing Russia back into the fold, and as he suggested it -- and they resisted -- Trump underlined his isolated status.

Indeed, weak as the President seemed in contrast with Macron, his cravenly self-interested comments at the Monday press conference highlighted his scant relevance to the proceedings.

JUST WATCHED Trump considering hosting next G7 summit at Trump FL resort, says he won't make money Replay More Videos ... MUST WATCH Trump considering hosting next G7 summit at Trump FL resort, says he won't make money 00:32

He added a parting shot of venality as he prepared to leave Biarritz: Asked about next year's G7, he launched into a marketing pitch for the session to be held at his Doral resort in Florida where, he said, the acreage would provide lots of parking. He followed with an odd reference to the money he thinks he's lost while serving as President of the United States and not the chief executive of the Trump Organization.

""Probably it will cost me anywhere from $3 to $5 billion to be President,"" said Trump, citing the example of lost income from public speaking. ""I used to get a lot of money to make speeches, now I give speeches all the time. You know what I get? Zippo.""

Trump softened the complaint -- which he brought up himself -- by suggesting that he doesn't care about the lost money.

His bragging about Doral, along with his disrespectful absence from the climate change session, served only to draw attention to how much he deviates from accepted norms. Trump may still think he's a leader of mythic proportions, but every day it seems more clear that he's only a hero in his own mind."
Iranian president says he'll only meet Trump after U.S. drops sanctions,https://www.politico.com,['Quint Forgey'],08-27-2019,2019,8,https://www.politico.com/story/2019/08/27/iranian-president-meet-trump-sanctions-1475905,"“Without the U.S.’s withdrawal from sanctions, we will not witness any positive development,” Iranian President Hassan Rouhani said in a televised speech. | Spencer Platt/Getty Images foreign policy Iranian president says he'll only meet Trump after U.S. drops sanctions

Iranian President Hassan Rouhani on Tuesday said he would be willing to meet with President Donald Trump only if the United States lifts its crushing economic sanctions on Tehran.

“Without the U.S.’s withdrawal from sanctions, we will not witness any positive development,” Rouhani said in a televised speech, warning: “If someone intends to make it as just a photo op with Rouhani, that is not possible.”

Story Continued Below

Rouhani’s remarks, reported by The Associated Press, contrast with comments he made Monday, when he expressed a greater willingness to sit for talks with Trump and asserted that Tehran and Washington “should not miss opportunities” for engagement.

“If I knew that going to a meeting and visiting a person would help my country’s development and resolve the problems of the people, I would not miss it,” Rouhani said, according to the AP. “Even if the odds of success are not 90 percent but are 20 percent or 10 percent, we must move ahead with it.”

Trump on Monday signaled fresh optimism that he and Rouhani could get together within weeks to address the escalating tensions between the two countries, which have ramped up steadily since the U.S. withdrew from the 2015 multinational nuclear deal with Iran last year.

""The sanctions are absolutely hurting them horribly,"" Trump told reporters during a news conference at the G-7 summit in Biarritz, France. ""I don't want to see that. But we can't let them have a nuclear weapon. So, I think there is a really good chance we would meet.""

French President Emmanuel Macron has sought to salvage the nuclear agreement amid a diplomatic breakdown between the U.S. and Iran, inviting Iranian Foreign Minister Javad Zarif to the annual gathering of leaders of major industrial nations over the weekend.

""I want this meeting to happen, and I want there to be an agreement between the United States and Iran,"" Macron said on Monday of a potential gathering between Trump and Rouhani."
Justice Department asks Supreme Court to allow border asylum ban,https://www.cbsnews.com,['Camilo Montoya-Galvez'],,,,https://www.cbsnews.com/news/justice-department-asks-supreme-court-to-allow-border-asylum-ban/,"Washington — The Justice Department on Monday asked the Supreme Court to allow the Trump administration to implement its most sweeping effort yet to overhaul the asylum system along the border while a legal challenge plays out in court.

U.S. Solicitor General Noel Francisco, who represents the federal government before the court, urged the justices to issue an administrative stay on a ruling by a judge in San Francisco, who earlier in the summer blocked a regulation that would make most migrants from Central America and other countries ineligible for asylum at the U.S.-Mexico border.

The administration had already asked the 9th Circuit Court of Appeals to do so. Earlier this month, the appellate court did not grant the government's request, but it said the injunction blocking the near-total asylum ban only applies within the court's jurisdiction. The decision meant that administration could proceed with the policy in New Mexico and Texas, but not in California and Arizona, which fall within the purview of the 9th Circuit.

Through its filing on Monday, the administration is asking the high court to allow the government to implement the rule along the entire border. Francisco said the policy ""serves important public purposes"" and ""alleviates a crushing burden on the U.S. asylum system by prioritizing asylum seekers who most need asylum in the United States.""

Thirteen year-old Joseline and father Jose Luis, Guatemalan migrants, turn themselves in to U.S. Border Patrol with fellow asylum seekers after an illegal crossing of the Rio Grande in Hidalgo, Texas, U.S., August 23, 2019. Picture taken August 23, 2019. LOREN ELLIOTT / REUTERS

The rule, a joint effort by the Justice Department and the Department of Homeland Security, restricts access to the U.S. asylum system for non-Mexican migrants who traveled through Mexico and other countries to reach the southwestern border, but did not seek protection in those nations.

Although designed to stem the flow of Central American migrants journeying north, the regulation also would affect people from other parts of the world trying to reach the U.S. through Mexico, including Cubans, Venezuelans, Brazilians and central Africans, who have traveled to the U.S.-Mexico border in higher numbers this year.

Administration officials have maintained that the rule would help curb what they call ""forum shopping"" by migrants. They have repeatedly accused migrants of preferring to seek asylum in the U.S., rather than in the countries along their journey that might be able to offer them safe haven.

""The rule also screens out asylum claims that are less likely to be meritorious by denying asylum to aliens who refused to seek protection in third countries en route to the southern border,"" Francisco wrote Monday. ""In turn, the rule deters aliens without a genuine need for asylum from making the arduous and potentially dangerous journey from Central America to the United States.""

U.S. Border Patrol agent Carlos Ruiz helps asylum-seeking migrant families unload from a U.S. Border Patrol riverine unit after they were rescued during an attempted illegal crossing of the Rio Grande in Hidalgo, Texas, U.S., August 23, 2019. Picture taken August 23, 2019. Loren Elliott / REUTERS

But immigrant advocates have said the policy ignores U.S. and international refugee law and would force countless migrants and asylum seekers to return to places where they may face persecution.

When he approved a injunction against the ban in late July, Judge Jon Tigar of U.S. District Court in San Francisco seemed to agree with the concerns raised by the plaintiffs in one of two lawsuits. ""An injunction would vindicate the public's interest — which our existing immigration laws clearly articulate — in ensuring that we do not deliver aliens into the hands of their persecutors,"" he wrote in his ruling.

Late last year, Tigar halted a similar effort by the administration to prohibit migrants who cross the border illegally from being able to seek asylum. The Supreme Court, by a vote of 5 to 4, later rejected the administration's request to stay Tigar's ruling."
Biden campaign dismisses poll showing 13-point drop in support,https://www.washingtonexaminer.com,[],08-26-2019,2019,8,https://www.washingtonexaminer.com/news/biden-campaign-dismisses-poll-showing-13-point-drop-in-support,"Joe Biden's campaign is pushing back against a new Monmouth University poll, released on Monday, which shows the former vice president's support to be rapidly declining.

""This poll is an outlier that is contradicted by every measure of the national average,"" an individual from the former vice president's campaign told the Washington Examiner. ""Poll after poll also confirms that, because of the high stakes of this election, Democratic primary voters are the most energized about a nominee who can take-on and defeat Donald Trump and the atrocious values he represents, and win the battle we’re in for the soul of this nation. Joe Biden is by all accounts the candidate best positioned to make that happen.""

The rapid response from the Biden campaign reflects its sensitivity to perceptions that the former vice president and Delaware senator is the undisputed front-runner in the 2020 Democratic race. The RealClearPolitics average on Monday, including the Monmouth poll, has Biden leading the pack at 27.2%, followed by Sanders at 16.7% and Elizabeth Warren at 16.2%.

The Monmouth survey found Biden in a statistical three-way tie with Sens. Bernie Sanders of Vermont and Elizabeth Warren of Massachusetts. According to that poll, which has a margin of error of 5.7%, both Sanders and Warren are currently receiving 20 points of support from Democratic primary voters, while Biden is at 19.

A month earlier, Monmouth found Biden leading the pack at 32%. The poll also found Biden's favorability ratings drop eight points, to 66%."
Brighton water treatment plant out of compliance with EPA standards for 3 consecutive years,https://www.thedenverchannel.com,[],08-27-2019,2019,8,https://www.thedenverchannel.com/news/local-news/brighton-in-violation-of-epa-drinking-water-standards-for-3-consecutive-years-according-to-report,"BRIGHTON, Colo. -- We knew the water in Brighton was expensive, now - it turns out - it could be dangerous, too.

The same city that could see its mayor recalled over sky-high water bills now admits it was out of compliance with EPA water treatment standards for 3 years.

The water scandal continues to mystify even some who sit on the current council.

""The residents don't trust the city,"" said councilman Matt Johnston. ""I, as a city council representative, do not trust our city.""

The latest issue to surface is an EPA summary which concludes Brighton had ""Significant/Category 1"" violations for 12 consecutive quarters.

A city spokeswoman said late Monday those violations are for treated discharge that goes back into the river, not the drinking water.

But, Brighton's former city manager said late Monday that the reverse osmosis treatment facility also supplies Brighton with drinking water, so any violation at the plant should be concerning.

""Someone's at serious risk if the plant is that out of compliance,"" said former city manager Philip Rodriguez, who was fired in the midst of this scandal back in July. ""Either Brighton or its neighbors downstream.""

The city told Denver7 on Tuesday those issues were resolved and the treatment facility is now in compliance.

""We cannot say that 100% for sure all of our water is safe,"" Johnston said. ""We can't say that.""

And, in fact, just last week the Colorado Department of Public Health and Environment required Brighton to send a letter to residents warning them about a dangerous back flow issue that could impact the drinking water supply.

For homeowner's like Jeremy Torgerson, it's mind-boggling.

""You don't want to cook with it, give it to your kids, your dog or anything,"" Torgerson said. ""I don't know how many more punches the residents have to take from their own city before we finally decide that we've had enough.""

The ongoing scandal has resulted in a flood of problems at city hall including the discovery of a $70 million fund from possible water billing overcharges and the subsequent firing of the city manager.

And now – there will be a recall election of the current mayor who insists the water is safe.

""The water here in Brighton is safe,"" said Mayor Ken Kreutzer. ""I drink it. My children drink it. My grandson drinks it. This is another gross exaggeration.""

But Johnston and others, like Torgerson, are no longer going with the flow. They insist city hall is corrupt.

""I'm tired of the backroom,"" Johnston said. ""It's time for the public to know everything about our water system - if it's safe, if it's clean, where the money's at and what it's being spent for.""

And while the Colorado Department of Public Health and Environment hasn't issued a boil order, Johnston believes it's only a matter of time.

""This is a pre-boil warning type of scenario,"" Johnston said.

""The city government no longer functions,"" Torgerson said. ""This a basic function of a utility department to make sure the water that goes out is safe. They overcharge, and now we have to drink bottled water.""

Johnston says those who are sick should be particularly cautious.

""They're going through chemotherapy, and they do not know if they should be boiling their water at this point,"" Johnston said."
