Dems tee up new document fight with DOJ over Obamacare,https://www.politico.com,['Kyle Cheney'],05-14-2019,2019,5,https://www.politico.com/story/2019/05/14/democrats-doj-obamacare-1318932,"Attorney General William Barr's decision to stop defending the constitutionality of Obamacare has lead to heightened scrutiny from Democratic lawmakers. | Alex Wong/Getty Images Health care Dems tee up new document fight with DOJ over Obamacare

House Democrats are mounting yet another confrontation with the Justice Department that could lead to subpoenas, but this time it's not about special counsel Robert Mueller's report — it's about health care.

Five committee chairmen foreshadowed a possible subpoena as soon as May 24 if Attorney General William Barr declines to provide documents related to his decision to stop defending the constitutionality of the Affordable Care Act — the health care law signed by President Barack Obama in 2010.

Story Continued Below

In letters to Barr and White House counsel Pat Cipollone, the chairmen wrote they've been asking since April 8 for documents connected to the decision, as well as testimony from four key officials involved in the effort. The request, they said, sought a response by April 22 but that the reply fell short. Now, they've given the Justice Department two more weeks to meet the committees' demands. They've also asked the White House to make budget director Russ Vought available for an interview.

""If we do not receive a response by this date, we will have no choice but to consider alternative means of obtaining compliance,"" the lawmakers wrote.

The letters are signed by Oversight Chairman Elijah Cummings (D-Md.), Energy and Commerce Chairman Frank Pallone Jr. (D-N.J.), Ways and Means Chairman Richard Neal (D-Mass.), Education and Labor Chairman Bobby Scott (D-Va.) and Judiciary Chairman Jerry Nadler (D-N.Y.).

Morning eHealth A daily report on the intersection of health care and technology — in your inbox. Email Sign Up By signing up you agree to receive email newsletters or alerts from POLITICO. You can unsubscribe at any time.

Nadler's committee has already voted to hold Barr in contempt for refusing to provide an unredacted version of Mueller's report to Congress as well as Mueller's underlying evidence. But the full House has yet to consider the committee's effort. Speaker Nancy Pelosi indicated last week that other committees may want to combine similar contempt proceedings into one overarching floor vote that could come in the next few weeks.

Democrats are also locked in confrontations with the Trump administration over accessing Trump's tax returns — a request made by Neal's Ways and Means Committee. The House Intelligence Committee has demanded access to Mueller's report, as well, on national security grounds and has issued a subpoena for his files last week.

The new effort on health care could become part of Democrats' broader strategy if they continue to accuse the Justice Department of stonewalling by the time the new deadline arrives on May 24. But persuading other lawmakers to wait until June — after a weeklong Memorial Day recess — for a comprehensive contempt vote could be difficult. Rank-and-file Democrats have been clamoring for punitive measures against Barr for weeks for his handling of Mueller's report.

Democratic leaders believe that picking a fight on health care is better politics than other demands are — and the skirmish shows their efforts to confront the Trump administration have policy dimensions and aren't just Trump-focused investigations.

Democrats have attributed the Trump administration's efforts to overturn the health care law, known as Obamacare, to ""politically motivated forces"" in the White House. The Obama White House took a similar step in 2011 when the Justice Department, at Obama's urging, stopped defending the Defense of Marriage Act, which barred federal recognition of same-sex marriages — a move social conservatives denounced at the time.

The Department of Justice declined to comment.

"
"No, China Can’t Sink the U.S. Treasury Market",https://www.wsj.com,"['Jon Sindreu', 'Jon.Sindreu Wsj.Com']",,,,https://www.wsj.com/articles/no-china-cant-sink-the-u-s-treasury-market-11557826273,"China owns U.S. Treasurys worth $1.1 trillion, but threats that it could dump them and upend the bond market ring hollow. Potshots at corporate America have a better chance of getting through to President Trump.

On Monday, Chinese media reported that officials could use the country’s Treasurys as leverage in their response to the Trump administration’s new barrage of tariffs. They have already announced retaliatory taxes on $60 billion worth of U.S. goods.

..."
EPA moves to ease water-quality standards in Washington state; Inslee and Ferguson say that’s illegal,https://www.seattletimes.com,"['Hal Bernton', 'Seattle Times Staff Reporter']",05-13-2019,2019,5,https://www.seattletimes.com/seattle-news/inslee-ferguson-denounce-epa-move-to-ease-water-standards-for-washington-state/,"The Environmental Protection Agency proposes to ease Washington water-quality standards for chemicals discharged into state waterways, a move embraced by industry groups that sought the change and denounced as “illegal” by Gov. Jay Inslee and state Attorney General Bob Ferguson.

The action, disclosed Friday, reverses a 2016 decision by the EPA under the Obama administration that required the state to toughen the water-quality standard.

Chris Hladick, the EPA’s Seattle-based regional administrator, said his agency had “inherent authority” to reconsider the 2016 decision, according to a letter Hladick sent Friday to Maia Bellon, the director of the state Ecology Department.

Ferguson and Inslee, in a joint statement, said “by taking this unilateral action, the EPA will risk almost certain litigation and cause uncertainty for Washington businesses.”

A major point of contention is the water-quality standard for PCBs (polychlorinated biphenyls), a group of chemicals considered to be probable carcinogens. PCBs can be found in dyes, paint, building materials, coolants and other products. In trace amounts, they often are present in industry wastewater discharges as well as municipal utility plants that treat stormwater runoff. Once in Puget Sound and freshwater drainage, they accumulate in fish and shellfish, so ingesting this food in large volumes can increase cancer risks.

In Washington, the PCBs water standard has been subject of years of intense scrutiny.

Advertising

Tribal leaders pressed for tighter pollution limits to protect their members, who may eat far more fish and shellfish than other Washington residents. They were dismayed by the Trump administration’s EPA decision, which they said was done without the consultation required by the federal government’s treaties and trust responsibilities to tribes.

“This action is outrageous,” said Lorraine Loomis, chair of the Northwest Indian Fisheries Commission. “Like all federal agencies, the EPA has a legally binding trust responsibility to the tribes that requires government-to-government consultation and the protection of tribal treaty rights and resources. They are not living up to this responsibility that is rooted in the U.S. Constitution.”

Paper and pulp manufacturers and other industry groups applauded the Trump administration decision.

They had opposed the Obama administration standard, saying that there was no technology available to bring wastewater discharge of PCBs to the low levels that were required. In a written statement, Donna Harmon, president of the American Forest & Paper Association, said, “The earlier EPA rule represented costly and ineffective regulatory overreach — plain and simple.”

The clash over PCB standards has unfolded under the umbrella of the federal Clean Water Act, which creates a partnership between the state and federal government to protect and when necessary restore the nation’s waterways.

Under the act, states have authority to develop water-quality standards, and the EPA the power of review.

Advertising

During the Obama administration, the EPA partially disapproved of a state standard — developed by the Washington Department of Ecology while Inslee was governor. The EPA ruled the state standard for PCBs — 170 parts per quadrillion in wastewater discharges — did not go far enough in protecting the health of heavy consumers of Washington fish. Instead, the EPA sent a standard of 7 parts per quadrillion.

In February 2017, after the Trump administration took office, industry and water utility groups filed a petition to the EPA arguing that the action under the Obama administration unjustly overturned the state standard and that it should be pulled back.

Meanwhile, state officials accepted the EPA decision and went to work with stakeholders, including tribes and industry representatives, to find ways to implement new standards.

Colleen Keltz, an Ecology Department spokeswoman, acknowledged that the 7 parts per quadrillion standard may not be obtainable with current technology. But she said that the state is working under a new system that allows permitted discharges to have a variance that allows higher levels of discharges until technology is available to meet the standard.

But the EPA, under the Trump administration, dismissed the need to try to reach the lower standard. In a 32-page document released Friday, the EPA said the earlier state PCBs standard of 170 parts per quadrillion should be restored, saying that that standard was based on sound science.

Hladick’s criticisms of the 2016 EPA PCBs decision were rejected by Dennis McLerran, who served as regional administrator for the EPA under President Barack Obama. McLerran acknowledged that some standards are “aspirational” but said the earlier EPA action was based on the best science available and that the rule allowed for flexibility when dischargers could not meet the standard.

McLerran said it was “very unusual and inappropriate” to pull it back without first consulting with tribes and state officials.

“I think it is a very unfortunate thing. The state had made it clear that it was implementing the standards, and found them to be correct,” McLerran said.

State Sen. Doug Ericksen, R-Ferndale, disagrees with McLerran.

In a note sent this week to Ecology Department Director Bellon, Ericksen wrote that the initial state water-quality rule was the product of years of work by legislators, state officials and stakeholders. Ericksen said he was confused why Bellon would now oppose efforts to restore that rule, and urged that she reconsider that position."
U.S. State Department orders most government staff to leave Iraq,https://www.pressherald.com,['Email Writer'],05-15-2019,2019,5,https://www.pressherald.com/2019/05/15/us-embassy-in-iraq-says-the-state-department-has-ordered-all-non-emergency-government-staff-to-leave-iraq-right-away/,"BAGHDAD — The U.S. on Wednesday ordered all nonessential government staff to leave Iraq, and Germany and the Netherlands both suspended their military assistance programs in the country in the latest sign of tensions sweeping the Persian Gulf region over still-unspecified threats that the Trump administration says are linked to Iran.

Recent days have seen allegations of sabotage targeting oil tankers off the coast of the United Arab Emirates, a drone attack by Yemen’s Iranian-allied Houthi rebels, and the dispatch of U.S. warships and bombers to the region.

At the root of this appears to be President Donald Trump’s decision a year ago to pull the U.S. from Iran’s nuclear deal with world powers, embarking on a maximalist sanctions campaign against Tehran. In response, Iran’s supreme leader issued a veiled threat Tuesday, saying it wouldn’t be difficult for the Islamic Republic to enrich uranium to weapons-grade levels.

The movement of diplomatic personnel is often done in times of conflict, but what is driving the decisions from the White House remains unclear. A high-ranking British general said there was no new threat from Iran or its regional proxies, something immediately rebutted by the U.S. military’s Central Command, which said its troops were on high alert, without elaborating.

Last week, U.S. officials said they had detected signs of Iranian preparations for potential attacks on U.S. forces and interests in the Middle East, but Washington has not spelled out that threat, and an alert on the website of the U.S. Embassy in Baghdad said that all nonessential, nonemergency U.S. government staff were ordered to leave Iraq right away under State Department orders.

The U.S. in recent days has ordered the USS Abraham Lincoln aircraft carrier strike group to the Gulf region, plus four B-52 bombers.

Germany’s military said it was suspending training of Iraqi soldiers due to the tensions, although there was no specific threat to its own troops in Iraq. Defense Ministry spokesman Jens Flosdorff said Germany was “orienting itself toward our partner countries” though there are “no concrete warnings of attacks against German targets.”

German Chancellor Angela Merkel’s spokeswoman Ulrike Demmer expressed concern over the tensions and said it welcomes “any measure that is aimed at a peaceful solution.” Foreign Ministry spokeswoman Maria Adebahr said the German government has not reduced its embassy staff in Iraq or Iran.

In the Netherlands, state broadcaster NOS said its 50-person military mission in Iraq was halted “until further orders,” quoting a Defense Ministry spokesman as saying he couldn’t elaborate on the threats. It said the Dutch forces primarily train Kurdish forces fighting the Islamic State militants.

The remarks about Iran’s nuclear program by Supreme Leader Ayatollah Ali Khamenei came Tuesday night in Tehran at an iftar, the traditional dinner Muslims have when breaking their daily fast during Ramadan. His comments first focused on playing down the risk of a wider conflict with America.

He told senior officials that his country won’t negotiate with the U.S., calling such talks “poison,” but he also said, “Neither we, nor them is seeking war. They know that it is not to their benefit,” according to the state-run IRAN newspaper.

Tehran is threatening to resume higher enrichment on July 7 if no new nuclear deal is in place, beyond the 3.67% permitted by the current deal between Tehran and world powers.

Iranian officials have said that they could reach 20% enrichment within four days. Though Iran maintains its nuclear program is for peaceful purposes, scientists say the time needed to reach the 90% threshold for weapons-grade uranium is halved once uranium is enriched to around 20%.

“Achieving 20% enrichment is the most difficult part,” Khamenei said, according to the newspaper. “The next steps are easier than this step.”

It was a telling remark from the supreme leader — Iran is not known to have enriched beyond 20% previously and it’s unclear how far Tehran is willing to go in this process. Khamenei has final say on all matters of state in Iran.

On Tuesday, Yemen’s Iran-aligned Houthi rebels launched a coordinated drone attack on a critical oil pipeline in Saudi Arabia, Tehran’s biggest rival in the region. It was the latest incident to shake global energy markets, as authorities allege oil tankers anchored off the coast of the United Arab Emirates were targeted by sabotage. Benchmark Brent crude prices remained around $71 a barrel in early trading Wednesday.

Yemen’s Houthi rebels, who are at war with Saudi Arabia and are believed by the West to receive weapons from Iran, said they launched seven drones targeting vital Saudi installations. That included two pumping stations along its critical East-West Pipeline, which can carry nearly 5 million barrels of crude a day to the Red Sea.

Saudi Aramco, the government-controlled oil company, said it temporarily shut down the pipeline and contained a fire, which caused minor damage to one pumping station. It added that Saudi Aramco’s oil and gas supplies were unaffected.

An image from San Francisco-based Planet Labs Inc. that The Associated Press examined Wednesday shows Saudi Aramco’s Pumping Station No. 8 outside of the town of al-Duadmi, 330 kilometers (205 miles) west of the kingdom’s capital, Riyadh.

The photo, taken after the attack, shows two black marks near where the East-West Pipeline passes by the facility — marks that weren’t in images from Monday. The facility otherwise appeared intact, corroborating in part Saudi Arabia’s earlier comments. The website TankerTrackers.com, whose analysts monitor oil sales on the seas, first reported about the black marks.

Details remain unclear around alleged acts of sabotage to four oil tankers, including two belonging to Saudi Arabia, off the coast of the UAE’s port of Fujairah. Satellite images seen by the AP from Colorado-based Maxar Technologies showed no visible damage to the vessels, and Gulf officials have refused to say who might be responsible.

The MT Andrea Victory, one of the alleged targets, sustained a hole in its hull just above its waterline from “an unknown object,” its owner Thome Ship Management said in a statement. Images of the Norwegian ship, which the company said was “not in any danger of sinking,” showed damage similar to what the firm described.

A U.S. official, speaking on condition of anonymity to discuss an ongoing investigation, has said the other three showed damage as well.

The unspecified threats reported by U.S. last week from Iran and its proxy forces in the region targeting Americans and American interests contradicted remarks by British Maj. Gen. Chris Ghika, a senior officer in the U.S.-backed coalition fighting the Islamic State group. He said Tuesday that “there’s been no increased threat from Iranian-backed forces in Iraq and Syria.”

Later, in a rare public rebuttal of an allied military officer, U.S. Central Command said Ghika’s remarks “run counter to the identified credible threats” from Iranian-backed forces. In a statement, Central Command said the coalition in Baghdad has increased the alert level for all service members in Iraq and Syria.

Share

< Previous

Next >"
Marco Rubio Urges DOJ to Investigate John Kerry's Meetings With Iranian Officials,https://www.nationalreview.com,"['Jack Crowe', 'David French', 'Kyle Smith', 'John Fund', 'Katherine Timpf', 'Rich Lowry', 'Read More', 'The Week', 'The American Conservative', 'The Wall Street Journal']",05-13-2019,2019,5,https://www.nationalreview.com/news/marco-rubio-investigate-john-kerry-meetings-iranian-officials/,"Then-Secretary of State John Kerry in 2016. (David Mdzinarishvili/Reuters)

Senator Marco Rubio sent a letter Monday to Attorney General William Barr asking him to investigate whether former secretary of state John Kerry violated federal law by continuing to meet with Iranian officials after leaving office.

“The Department of Justice should therefore make a determination on whether or not former Secretary of State John F. Kerry’s recent actions related to the Joint Comprehensive Plan of Action with Iran potentially violate the Logan Act or the Foreign Agents Registration Act,” Rubio wrote.

Today I urged the DOJ to investigate whether former Secretary of State John F. Kerry’s actions since leaving office related to the #Iran nuclear deal violate the Logan Act or FARA –> https://t.co/yxq4O2bmke pic.twitter.com/V52wxcd5mL — Senator Rubio Press (@SenRubioPress) May 13, 2019

The letter, Rubio’s second urging an investigation into Kerry’s conduct, comes after President Trump suggested that Kerry should be prosecuted under the Logan Act, a 1799 statute that prohibits private citizens from negotiating with foreign governments without the permission of U.S. officials.

“What I’d like to see with Iran, I’d like to see them call me,” Trump told reporters last week. “John Kerry speaks to them a lot, and John Kerry tells them not to call. That’s a violation of the Logan Act, and frankly he should be prosecuted on that.”

Kerry’s camp pushed back on Trump’s assertion in a statement provided to CNN.

“Everything President Trump said today is simply wrong, end of story,” a spokesperson for Kerry told CNN. “He’s wrong about the facts, wrong about the law, and sadly he’s been wrong about how to use diplomacy to keep America safe.”

Rubio sent his first letter on the subject to then-attorney general Jeff Sessions in September 2018, after the Boston Globe reported that Kerry was “quietly seeking to salvage the Iran deal he helped craft” by engaging “in some unusual shadow diplomacy” with Iranian foreign minister Javad Zarif. Though he would not comment on what was discussed, Kerry did admit to meeting with Zarif “three or four” times since Trump took office. The Globe further reported that Kerry formed a team “of officials who were his top advisers at the State Department” to shape media coverage of Trump’s departure from the Iran deal."
