DOD identifies US Army casualty as Louisiana man,https://www.katc.com,[],08-19-2019,2019,8,https://www.katc.com/news/covering-louisiana/dod-identifies-us-army-casualty-as-louisiana-man,"The Department of Defense announced today the death of a soldier who was supporting Operation Inherent Resolve.

Specialist Clayton James Horne, 23, of Atlanta, Louisiana died August 17, 2019 in Riyadh, Saudi Arabia, as a result of wounds sustained by a noncombat related incident. The incident is currently under investigation, according to the defense officials.

Horne was assigned to the 351st Military Police Company, 160th Military Police Battalion, Ocala, Florida.

"
Sean Hannity: Sources say 'most explosive' part of DOJ review is about 'outsourcing of illegal intelligence-gathering',https://www.washingtonexaminer.com,[],08-16-2019,2019,8,https://www.washingtonexaminer.com/news/sean-hannity-sources-say-most-explosive-part-of-doj-review-about-outsourcing-of-illegal-intelligence-gathering,"Fox News host Sean Hannity said his sources are telling him the most ""explosive"" finding in the Justice Department review on the origins of the Russia investigation has to do with illegal intelligence-gathering on American citizens.

Hannity first mentioned this during his show Thursday evening while speaking to the Hill's John Solomon, who said DOJ Inspector General Michael Horowitz's soon-to-be-released report on alleged Foreign Intelligence Surveillance Act abuses will find ""a lot more wrong than right"" and will be ""difficult"" for former top FBI officials such as James Comey, Andrew McCabe, and Peter Strzok.

Hannity said there is some discrepancy between what he and Solomon expect in the watchdog report and the Justice Department inquiry being run by Attorney General William Barr and U.S. Attorney John Durham, who are examining the behavior of the FBI and Justice Department for possible wrongdoing.

""I want to know who's going to be held responsible. Because If I lie to a court, and I premeditated a fraud on the court, I have a funny feeling there’s not a lawyer in the country that is going to save my sorry ass from being sent to jail. I’m just guessing, but maybe — I’m Irish, I'm pessimistic,"" he said.

""Let me ask you this. So, we both agree on those. You think there might be an IG report alone on leaking?"" Hannity added, to which Solomon agreed.

""And I’m expecting, from what my sources are telling me, Durham, Barr, and everybody else, to get to the origins of what is a counterintelligence investigation, which Andy McCarthy rightly points out in his new book, would mean Obama knew because the president has to sign off on it but that origins of this counterintelligence investigation, what did Obama know, when did he know it?"" Hannity said.

He was referring to former U.S. Attorney Andrew McCarthy, who is promoting his new book, Ball of Collusion, and Thursday on Fox & Friends accused Obama of improperly using counterintelligence powers and law enforcement to assist Hillary Clinton's 2016 presidential campaign.

""But more importantly,"" Hannity continued, ""What will Barr, Durham, come out with in terms of — let's say the Barr-Durham report? ... Or whatever that ends up being. Because I hear that is where the single most explosive bit of information, outsourcing of illegal intelligence-gathering for the sake of circumventing American laws, took place, and a lot of people would be found in violation of spying on Americans against the law.""

Solomon warned that he did not want to get ahead of the Justice Department's findings, but did say that the Barr and Durham review will provide ""a much broader view"" of alleged spy tactics than what the IG report will show because they are not limited to what went on in the Justice Department.

Hannity later noted how there is ""a lot of activity"" in Europe tied to these investigative efforts, including the 16-hour interview conducted with British ex-spy Christopher Steele earlier this summer. He also suggested the United Kingdom, Italy, and Australia were roped into the inquiry.

Steele's anti-Trump dossier, which was funded by the Clinton campaign and the Democratic National Committee, was used by the FBI to obtain FISA warrants to surveil one-time Trump campaign adviser Carter Page, an American citizen who was never charged with any wrongdoing.

Republicans have argued the dossier's Democratic benefactors and its author's anti-Trump bias were left out of the FISA applications and have demanded accountability. Democrats countered that the FBI acted appropriately, saying the Justice Department and the FBI met the rigor, transparency, and evidentiary basis for probable cause."
“We’re the safety net.” Proposed USDA rule could increase food bank’s demand,https://kwwl.com,"['Taylor Vessel', 'Multimedia Reporter']",08-19-2019,2019,8,https://kwwl.com/news/2019/08/19/were-the-safety-net-proposed-usda-rule-could-increase-food-banks-demand/,"WATERLOO, Iowa (KWWL) – Millions of people across the country could lose food assistance benefits under a proposed rule by the USDA.

It could have a big impact on local food banks as those who would lose assistance would likely need to get food elsewhere.

“We rely on community donations,” said the Northeast Iowa Food Bank‘s Executive Director Barb Prather.

Prather says only a small portion of the product in the food bank comes from the federal government and the rest comes from the community.

However, the food bank could soon be asking for more help, if the USDA implements a new rule that would remove 3 point 1 million people from food assistance commonly called snap.

“The demand for the food that we get it is going to go up which means we’re going to be reaching out not only for food but also for funds to be able to help provide even more food to the community,” said Prather.

Right now, there’s a loophole that if families receive at least $50 of assistance from the government they’re eligible for food assistance. If that goes away, a family of 4 earning more than $34,000 a year will not qualify for food assistance.

While the USDA says the change could save 9.4 billion over the next five years, an unpublished version of the rule obtained by the Associated Press acknowledges it could “negatively impact food security.”

Prather says while they serve a lot of families they also serve people who have been laid off, injured at work, or just down on their luck.

“You never know when you’re going to need our help, we’re the safety net,” said Prather.

The food bank has been successfully lowering the number of food-insecure people in the state. Right now, about 43,000 are food insecure in eastern Iowa.

The proposed, new rule is still in its comment period. The food bank says they’ll help anyone who wants to weigh in.

The State of Iowa was recently sanctioned by the USDA to the tune of $1.79 million dollars for errors in the state’s payment process for SNAP.

A letter sent to Governor Kim Reynolds by Secretary of Agriculture Sonny Perdue says Iowa is “well above the national 2018 SNAP payment error rate of 6.80 percent.”

The governor’s office provided KWWL with that letter and documents that were included with it. They show that Iowa had an overpayment rate of 8.91% and an underpayment rate of 1.11%.

Governor Reynold’s office released the following statement:"
Trump aides look into U.S. purchasing Greenland after directives from president,https://www.washingtonpost.com,"['Damian Paletta', 'Reporter Covering Economic Policy', 'Congress', 'Campaigns', 'Health Policy', 'Pennsylvania Politics', 'Damian Paletta Is White House Economic Policy Reporter For The Washington Post. Before Joining The Post', 'He Covered The White House For The Wall Street Journal.', 'Colitkowitz Currently Covers Politics', 'Congress For The Washington Post. She Previously Covered Health Policy']",08-16-2019,2019,8,https://www.washingtonpost.com/business/2019/08/16/america-first-greenland-second-is-trumps-latest-white-house-directive/,"President Trump has pushed top aides to investigate whether the U.S. government can purchase the giant ice-smothered island of Greenland, two people with direct knowledge of the directive said.

The presidential request has bewildered aides, some of whom continue to believe it isn’t serious, but Trump has mentioned it for weeks. The two people with knowledge of the presidential demand spoke on the condition of anonymity because they weren’t authorized to reveal such White House planning.

As with many of Trump’s internal musings, aides are waiting for more direction before they decide how seriously they should look into it.

Among the things that have been discussed is whether it is even legal, what the process would be for acquiring an island that has its own government and population, and where any money to purchase a giant landmass would originate.

Trump’s interest in acquiring Greenland was first reported by the Wall Street Journal.

Greenland’s Ministry of Foreign Affairs said Friday that the island is not for sale.

“Greenland is rich in valuable resources such as minerals, the purest water and ice, fish stocks, seafood, renewable energy and is a new frontier for adventure tourism,” the ministry said in a tweet. “We’re open for business, not for sale.”

[‘Not for sale:’ How Greenland and Denmark are reacting to Trump’s apparent interest]

According to the CIA’s World Factbook, Greenland is 2.2 million square kilometers, with 1.7 million of that covered in ice. It has considerable natural resources, such as coal and uranium, but only 0.6 percent of the land is used for agriculture. It has about 58,000 residents, making it one of the world’s smallest countries by population.

It is a self-governing country that is part of the kingdom of Denmark. Trump is scheduled to visit Denmark in two weeks.

The idea of a sale to the United States was also ridiculed Friday by politicians in Denmark, including Lars Løkke Rasmussen, who was the country’s prime minister until June and now serves as the leader of the opposition party.

“It must be an April Fool’s Day joke ... but totally out of season!” he wrote on Twitter.

Trump had touted his career as a real estate developer during the 2016 presidential campaign and made clear that he has retained an eye for real estate opportunities during his tenure in the White House. For example, he has said that North Korea could build famous hotels and resorts along its oceanfront properties, even though many foreigners are afraid to visit the country out of fear for their lives.



An iceberg floats in Disko Bay behind houses during unseasonably warm weather on July 30 in Ilulissat, Greenland. (Sean Gallup/Getty Images)

Typically, Congress must appropriate money before the White House can use it, but Trump has already shown a willingness to get around those restrictions.

It was unclear why Trump might want the United States to buy Greenland, though his administration has identified the Arctic as an area of growing importance to U.S. national security interests.

“This is America’s moment to stand up as an Arctic nation,” Pompeo said in May during a speech in Finland. “The region has become an arena of global power and competition.”

With melting ice making the region more accessible, the United States has been firm in trying to counter any moves by Russia and China in the Arctic. China declared itself a “near-Arctic nation” last year and has defended its desire for a “Polar Silk Road” in which Chinese goods would be delivered by sea from Asia to Europe.

China recently sought to bankroll the construction of three airports in Greenland, drawing concern from then-Defense Secretary Jim Mattis and prompting the Pentagon to make the case to Denmark that it should fund the facilities itself rather than rely on Beijing.

“Countries should be wary of piling on monumental debt, particularly ‘loan to own’ projects, that undermines their freedom of political action and sovereign choices,” a Pentagon official, Johnny Michael, said previously. “Beijing’s lack of transparency in its polar research, expeditionary activities and approach to natural resource development is also of concern.”

Trump’s desire to buy Greenland wouldn’t be the first time an American president broached the idea.

The U.S. military had a presence on Greenland during World War II as a means to protect the continent if Germany ever tried to attack. After the war, the Truman administration offered Denmark $100 million to buy Greenland, according to the academic tome “Exploring Greenland: Cold War Science and Technology on Ice.”

Since then, the Danish people have been wary of the United States’ continued use of Greenland. The land was critical territory during the Cold War because of its location halfway between the United States and Northern Europe and its proximity to the former Soviet Union. The Pentagon built its northernmost military installation, Thule Air Base, on Greenland in 1951, as a means for missile defense.

“Exploring Greenland,” co-written by academics from Denmark and the United States, says that the U.S. military’s “extensive activities in northern Greenland” was seen by Danish citizens and some politicians as “a violation of their national sovereignty.""

Some on Thursday night responded to the news with incredulity; others, with support.

“This idea isn't as crazy as the headline makes it seem,” Rep. Mike Gallagher (R-Wis.) said in a tweet. “This a smart geopolitical move. The United States has a compelling strategic interest in Greenland, and this should absolutely be on the table.”

Most, however, responded with mockery.

Rep. Steve Cohen (D-Tenn.) shared a news story about Trump’s idea and mused: “A Great place for his ‘presidential’ library.”

And Jonah Goldberg, a fellow at the American Enterprise Institute, tweeted that MAGA — the acronym for Trump’s “Make America Great Again” campaign slogan — is “an anagram of Make Greenland American Already.”

Felicia Sonmez, Dan Lamothe and John Wagner contributed to this report."
"State Department officials berated staff, labeled some 'traitors,' report says",https://www.cnn.com,['Jennifer Hansler'],08-16-2019,2019,8,https://www.cnn.com/2019/08/16/politics/state-department-officials-watchdog-report-political-retaliation/index.html,"Washington (CNN) Top officials in the State Department's Bureau of International Organization Affairs subjected employees to ""disrespectful and hostile treatment,"" accusations of disloyalty, and retaliation, a long-awaited report from the department's watchdog agency found. The report also said the bureau's leadership ""did not take significant action"" to address these concerns.

""Nearly every employee interviewed by OIG raised concerns about the leadership of IO and the treatment of staff,"" according to the report released Thursday by the State Department Office of Inspector General.

The bureau's leaders labeled some employees ""traitors,"" if they felt they didn't support President Donald Trump. They berated others for following procedures, punished staff for not doing work the department's Office of the Legal Adviser had deemed ""inappropriate"" and targeted others for retaliation, in one case because of a staffer's ""relationship with the gay and lesbian community.""

'Six to eight hostile interactions per day'

""Although some IO employees reported that they had never witnessed Assistant Secretary Moley or Ms. Stull behave unprofessionally, the majority of employees OIG interviewed either directly experienced hostile treatment or witnessed such treatment directed at others,"" the report said. ""In fact, one IO employee told OIG that working with Ms. Stull involved 'six to eight hostile interactions per day.'""

Stull left the department in January 2019 ; Moley remains in his post. Moley participated in an interview with the OIG, but Stull declined.

The report cited numerous examples of Stull and Moley berating employees for following established department procedures for tasks ranging from sending briefings to booking travel accommodations.

'Inappropriate accusations of disloyalty'

Stull and Moley also ""made inappropriate accusations of disloyalty and made positive or negative comments about employees based on perceived political views,"" according to the report.

""For example, several career employees reported that throughout her tenure at the Department, Ms. Stull referred to them or to other career employees as 'Obama holdovers,' 'traitors,' or 'disloyal,'"" the report said. ""Other career employees told OIG that Ms. Stull accused them of being part of the 'Deep State' and that the Assistant Secretary accused them of 'undermining the President's agenda.'""

In one instance, the report noted, Stull ""expressed displeasure"" with a legislative affairs employee accompanying a delegation of the Congressional Black Caucus ""because it consisted of only Democratic members."" Stull accused the employee ""of trying to 'thwart' President Trump and undermine his agenda"" and many of the employee's job responsibilities were reassigned. That employee eventually left the State Department.

Retaliation

Moley and Stull retaliated against other employees as well, according to the report. Moley removed a principal deputy assistant secretary, a career diplomat, after she raised concerns about Stull's treatment of employees and conflict of interest.

Moley ""told the PDAS that he did not believe that her concerns about Ms. Stull were valid"" and ""it was obvious to him that she had problems working with Ms. Stull and that, therefore, the PDAS should be prepared to leave the bureau,"" according to the report.

In another instance, the OIG found that Moley had canceled the selection process for a deputy director position in order to support Stull's move to block the leading candidate for that post. Stull did not like the candidate's work with the UN agency that aids Palestinian refugees -- a point which Moley confirmed to the OIG. Stull also reportedly had a problem with that candidate's ""relationship with the gay and lesbian community,"" according to the report.

She criticized two career employees ""whom she believed had been insufficiently supportive of her position"" in a work dispute stemming from her time at the Food and Agriculture Organization of the UN. She also attempted to remove work responsibilities from one of those employees for failing to assist her, despite the fact that what she had asked them to do was deemed ""inappropriate"" by the Office of the Legal Adviser.

Failure to address concerns

Despite concerns raised by both IO employees and State Department management, Moley did little to address them, according to the report. Moley told OIG ""that no employees had 'ever' raised concerns with him regarding morale or treatment of employees.""

However, the report said he had conversations with two undersecretaries in April and on June 13, 2018, and with Deputy Secretary John Sullivan on June 25, 2018 regarding the issues raised about his bureau. In each, he was advised to address the misbehavior.

In the June 13 meeting, he was directed to take several steps -- let all IO employees know about his commitment to inclusion, develop a staffing plan to address two IO departures, ensure that Stull had recused herself from all activities related to her prior work at the UN, and direct her to stop ""all further public engagement"" criticizing State Department employees.

Although Moley took some of these steps, the misconduct continued. The report noted that OIG continued to receive reports about ""hostile treatment of employees, allegations of disloyalty, and conflicts of interest"" throughout the course of its review.

'We won't stop until this culture of impunity is ended'

The watchdog recommended in its report that the State Department ""develop a corrective action plan to address the leadership and management deficiencies"" in IO within 60 days. It also noted the department should consider whether to take disciplinary action for the conduct described in the 34-page document. The State Department agreed with both of these recommendations, the report said.

Thursday's report presented the findings of one of two OIG investigations into political retaliation at the department. It was opened in June 2018 after members of Congress expressed concern to the State Department about allegations of Stull's vetting of career employees were reported by Foreign Policy Magazine.

House Foreign Affairs Committee Chairman Rep. Eliot Engel said Thursday that the report ""confirms what we feared: 'disrespectful and hostile' treatment of career employees at the State Department."" The New York Democrat urged Secretary of State Mike Pompeo to fire Moley.

""There is more to come, and I hope it comes very soon. The delays from the Department on this matter have been frustrating. The House Foreign Affairs Committee, along with the House Committee on Oversight and Reform and the Senate Foreign Relations Committee, is conducting an independent inquiry on these matters, and we won't stop until this culture of impunity is ended and everyone responsible faces stiff consequences,"" Engel said in a statement."
