Department of Education not National School Board,https://www.nationalreview.com,"['Yuval Levin', 'Andrew C. Mccarthy', 'George Will', 'John Fund', 'Brian T. Allen', 'Madeleine Kearns', 'Jim Geraghty', 'Alec Dent', 'Jonah Goldberg', 'Jack Fowler']",07-08-2019,2019,7,https://www.nationalreview.com/corner/the-department-of-education-is-not-a-national-school-board/,"(Jonathan Alcorn/Reuters)

Last week, Joe Biden joined the bandwagon of Democrats (started by Elizabeth Warren this year) promising to name a public-school teacher to be Secretary of Education if he wins the presidency. It’s an easy commitment to make in front of a teachers’ union audience, and it wouldn’t be all that odd to do it—several past presidents of both parties have named former public-school teachers to the job.

Advertisement

Advertisement

But the promise is another example of a thoroughly bipartisan misconception about the work of the federal education department. Even if they haven’t been former teachers, nearly every education secretary since the Department of Education was created in the Carter years has been someone with expertise or experience in K-12 education—whether as an educator, administrator, reformer, or policymaker. But the Department of Education actually has a lot more say over higher education than primary or secondary schooling, and its work has suffered from the lack of focus on higher ed over the years. If we must have a Department of Education, it could at least be run by someone who knows something about higher education.

The American system of primary and secondary schools is gloriously decentralized. There are about 130,000 K-12 schools in America, about three-quarters of which are public schools. The latter are governed by about 13,000 different school districts across the 50 states. These districts have enormous power over curriculum and staffing decisions, and the states have most of the remaining power over education policy.

Advertisement

The federal role in K-12 education is strongest in circumstances where racial or other discrimination triggers legally-mandated responses. Otherwise, the federal government uses some levers of conditional funding under the Elementary and Secondary Education Act—a Great Society law that has been updated every few years since. Recent updates include the No Child Left Behind Act and the Every Student Succeeds Act. These have given the federal government more leverage over time, but its power is still greatest at the margins. Federal dollars are about 8 percent of K-12 education funding, and the Department of Education doesn’t really shape primary and secondary education policy.

We should all be glad about that. And a teacher who wants to influence education policy would be better advised to run for school board or for the state legislature than to go to Washington.

Advertisement

Advertisement

But unfortunately, the federal Department of Education does play a critical role in setting the direction of American higher education. Here too, its power comes mostly from the leverage created by federal dollars, but that leverage is immense, especially because of the student-loan system. And it has meant that the federal government has played a central role in driving the tuition inflation that plagues higher ed and in creating all manner of policy trouble besides.

Price inflation in higher education has been massively exacerbated by the basic structure of federal policy in this area, which might be best described as simultaneously subsidizing demand and restricting supply.

The subsidization of demand is done through student aid, which has been too open-ended and has risen with tuition, thereby creating upward pressure on costs. This leverage over funds has also given the Department of Education lots of informal power to drive policy through nudges and “suggestions” in a variety of areas. The Obama administration’s notorious “Dear Colleague” letters are a prominent example.

The restriction of supply, meanwhile, has been a function of accreditation, which the incumbent players in American higher education have used to restrict new entrants and new uses of technology. Accreditation is technically a private process, run by a group of NGOs, but because it is the means by which schools become eligible for students with federal loans and grants, the Department of Education has enormous power over it, essentially accrediting the accreditors.

Advertisement

Advertisement

All of this gives the Secretary of Education a lot of opportunities to improve (or to worsen) higher-ed policy—both by working with Congress to change the law and by working directly to change the department’s policies. Higher-ed policy is badly in need of reforms, getting those right could make a huge difference, and the Secretary of Education would be a key figure in making that happen. The Trump administration has taken some useful steps in this direction, but there is lots more to be done.

So a president who wanted to do something useful in education policy would be wise to appoint an education secretary who knows something about higher education, rather than just one who will say nice things about primary and secondary schools."
"DHS asks for 1,000 more National Guard troops at southern border",https://thehill.com,[],07-08-2019,2019,7,https://thehill.com/latino/452054-dhs-asks-for-1000-more-national-guard-troops-at-southern-border,"The Department of Homeland Security (DHS) is asking for 1,000 additional Texas National Guard troops ""to provide supplemental holding and port of entry enforcement support"" to Customs and Border Protection (CBP) in the state, the Department of Defense told The Hill on Monday.

The Pentagon has not yet approved the request, which was made last week.

ADVERTISEMENT

Texas Gov. Greg Abbott (R) has agreed to the use of the National Guard to assist CBP at the border, said Maj. Chris Mitchell, a Pentagon spokesperson.

""Supplemental holding support is requested for CBP holding facilities located at Donna and Tornillo, Texas,"" he said.

""These holding facilities house single adult migrants who have illegally entered the United States, been processed by CBP, and are awaiting transfer to Immigration and Customs Enforcement (ICE) detention facilities. These holding facilities will be owned, operated, and managed by CBP.""

DHS did not immediately respond to a request for comment.

There were 6,000 troops at the border as of April, 2,100 were members of the National Guard.

The DHS request comes as the Trump administration has received increasing criticism for the treatment of migrants detained at the border.

The Department of Homeland Security Office of Inspector General recently released two reports detailing conditions in El Paso, Texas, and Rio Grande, Texas, facilities. The government watchdog found severe overcrowding, migrants being held too long and dirty conditions at many of the facilities.

The administration has deflected the criticism, saying stemming the flow of immigrants is a priority.

Apprehensions at the U.S.-Mexico border plummeted by 28 percent from May to June, the DHS estimates."
James Comey’s daughter named to Jeffrey Epstein prosecution team,https://www.washingtonexaminer.com,['Ap Photo Richard Drew'],07-08-2019,2019,7,https://www.washingtonexaminer.com/news/comeys-daughter-named-to-epstein-prosecution-team,"The Justice Department team that is leading the prosecution of alleged child sex trafficker Jeffrey Epstein includes the daughter of former FBI Director James Comey.

Geoffrey Berman, the U.S. attorney for the Southern District of New York, said at a press conference Monday that Maurene Comey is part of the public corruption unit handling the case against the well-connected and wealthy businessman.

Assistant U.S. Attorney Maurene Comey, left, listens during a news conference, in New York, Monday, July 8, 2019. (AP Photo/Richard Drew)

Maurene Comey, an assistant U.S. attorney, was named alongside Alex Rossmiller and Alison Moe as the prosecutors assisting Berman with the case. James Comey, who was fired as FBI director in 2017 by President Trump, had been a U.S. attorney for the Southern District of New York before he became deputy attorney general under President George W. Bush.

Last year, James Comey said his wife Patrice “very much wanted Hillary Clinton to be the first woman president” and that he was pretty sure that his four daughters, if not all five of his children, had also wanted Clinton to defeat Trump in 2016.

“There was a lot of passion in this house for Hillary Clinton,” Comey said.

Comey also said his wife and daughters participated in the Women’s March the day after Trump’s inauguration.

Epstein was charged by prosecutors with conspiracy and with sex trafficking of underage girls, and faces up to 45 years behind bars. Prosecutors consider him a flight risk and have asked a judge to keep Epstein behind bars pending his trial.

During the raid on Epstein’s Manhattan mansion, investigators say they seized an “extraordinary volume” of photographs of apparently underage girls."
Reluctant witnesses in FISA abuse probe agree to talk to DOJ inspector general,https://www.foxnews.com,"['Catherine Herridge', 'Catherine Herridge Is An Award-Winning Chief Intelligence Correspondent For Fox News Channel', 'Fnc', 'Based In Washington', 'D.C. She Covers Intelligence', 'The Justice Department', 'The Department Of Homeland Security. Herridge Joined Fnc In As A London-Based Correspondent.']",,,,https://www.foxnews.com/politics/reluctant-witnesses-in-fisa-abuse-probe-agree-to-talk-to-doj-inspector-general,"Key witnesses sought for questioning by Justice Department Inspector General Michael E. Horowitz early in his investigation into alleged government surveillance abuse have come forward at the 11th hour, Fox News has learned.

Sources familiar with the matter said at least one witness outside the Justice Department and FBI started cooperating -- a breakthrough that came after Attorney General William Barr ordered U.S. Attorney John Durham to lead a separate investigation into the origins of the bureau’s 2016 Russia case that laid the foundation for Special Counsel Robert Mueller’s probe.

While the investigative phase of the inspector general’s long-running probe is said to be complete, the sources said recent developments required some witnesses to be reinterviewed. And while Barr testified that he expected the report into alleged Foreign Intelligence Surveillance Act (FISA) abuse to be ready in May or last month, multiple sources said the timeline has slipped.

""The wheels of inspector general investigations move very, very slowly,"" former senior DOJ official Tom Dupree told Fox News.

Dupree, who served as deputy assistant attorney general from 2007 to 2009, does not have firsthand knowledge of the current IG case but is familiar with the process. He added, ""Like any investigation, you talk to one person, something that person tells you sends you back … to the first person, so it can be a very extensive, exhaustive process, because you are constantly picking up leads, interviewing former sources and navigating complex questions of classified information.""

Late-breaking information is known to delay such investigations. Horowitz’s office similarly encountered new evidence late in the process of the IG review into law enforcement decisions during the 2016 Hillary Clinton email investigation. In this case, additional FISA information came to light late in the process – including October 2016 contact (first reported by The Hill and confirmed by Fox News) between a senior State Department official and a former British spy Christopher Steele, who authored the infamous and salacious anti-Trump dossier.

CLICK HERE FOR THE FOX NEWS APP

The State Department contact with Steele was relayed to a senior FBI official. The timeline matters because about two weeks later, the FBI and DOJ used Steele's unverified research, paid for by the DNC and Clinton campaign, to secure a surveillance warrant against former Trump campaign adviser Carter Page. At the very least, it's been argued, Steele's contact with another government agency should have been a red flag for the FBI because it may have violated his confidential human source agreement.

Steele was later fired by the FBI over his media contacts before the 2016 presidential election. The Page surveillance warrant is the central issue of the DOJ IG’s review.

With the timeline for Horowitz’s report not public, one of the wild cards is the final review by the FBI and DOJ, which includes classification issues and could take weeks.

A spokesman for Horowitz would not comment on the report's status. But during largely unrelated testimony in November, Horowitz offered some guidance for the timeline of the FISA abuse probe in response to questions from GOP Rep. Jim Jordan.

""What I can say is given the volume of documents we've had and the number of witnesses it looks like we'll need to interview, we are likely to be in the same sort of general range of documents and witnesses as the last report,"" Horowitz said, referring to his team's review of the Clinton email case. ""It wouldn't surprise me if we are in that million or so plus range of documents and a hundred-ish or so interviews. The last review, as you know, took us about … 16 months or so.""

If that same guidance holds, the window for completion would begin this month, though it remains unclear how much the DOJ/FBI review and the additional interviews could delay the process."
It's time to think more seriously about the implications of elderly presidents,https://www.washingtonexaminer.com,[],07-08-2019,2019,7,https://www.washingtonexaminer.com/opinion/its-time-to-think-more-seriously-about-the-implications-of-elderly-presidents,"Should he win reelection and complete his full second term, President Trump will surpass Ronald Reagan as the oldest person to ever hold the office. But Trump's age is hardly ever talked about, because leading Democrats Joe Biden and Bernie Sanders would be older than Reagan at the start of their presidencies.

As medical science improves and life expectancy increases, more and more candidates may be willing to test the limits of age. And there's nothing in the law that prevents them from running and winning. While one could argue that it should ultimately be up to the voters to decide whether somebody is fit to serve, there are clear issues with this test.

One is that the U.S. Constitution set the minimum age to be president at 35. Rep. Alexandria Ocasio-Cortez, one of the most influential voices in her party, is unable to join the two dozen other candidates seeking the party's nomination. Even if Democratic primary voters wanted to support her, they could not. So if she can't run simply because she's too young, is it stripping Americans of any more of a choice by saying they can not vote for somebody who would be in their 80s during a first term?

The second issue is that even if they wanted to, there's a lack of objective information available for voters to determine whether somebody is physically and mentally unfit to serve out a term in office. Candidates are not required to submit medical information, and both Trump (with his ridiculous doctor's note) and Hillary Clinton (with her pneumonia cover-up) were opaque about their health in 2016.

So, one other solution short of age limits would be to require a more specific set of medical information from candidates for office.

There also may need to be a more specific explanation, with measurable health metrics, of the circumstances under which the 25th Amendment can be invoked. Section 4 of the amendment reads, ""Whenever the Vice President and a majority of either the principal officers of the executive departments or of such other body as Congress may by law provide, transmit to the President pro tempore of the Senate and the Speaker of the House of Representatives their written declaration that the President is unable to discharge the powers and duties of his office, the Vice President shall immediately assume the powers and duties of the office as Acting President."" But that is incredibly open-ended and subject to interpretation.

None of these (age limits, medical disclosure requirements, revisiting the 25th Amendment) might really be a workable solution. But given that it's becoming more common for elderly candidates to run for president, we should be thinking about the problem in a serious matter. Even if a candidate looks vigorous on the campaign trail, a lot can happen within four years in a demanding job, and, in general, somebody in their 80s is going to be at a significantly greater risk of having some sort of adverse physical or mental health decline within that period. This should be a serious part of our political discourse at a time when so many elderly candidates are seeking office."
Trump shuts out British ambassador for high-level dinner,https://www.washingtontimes.com,"['The Washington Times Http', 'Dave Boyer']",07-08-2019,2019,7,https://www.washingtontimes.com/news/2019/jul/8/kim-darroch-disinvited-treasury-department-dinner-/,"The British ambassador to the U.S. was disinvited to a high-level dinner at the Treasury Department Monday night in honor of the emir of Qatar, as President Trump moved to freeze out the diplomat who wrote unflattering cables about his administration.

The move to pull the invitation for Ambassador Kim Darroch came after Mr. Trump tweeted that his government “will no longer deal with” the diplomat.

Mr. Darroch missed out on a glittering dinner in the ornate “Cash Room” at Treasury, adjacent to the White House, featuring a guest list of Fortune 500 CEOs and international financiers.

At the dinner, Mr. Trump called the Amir a great friend of the U.S. and thanked him for building a U.S. military base there.

“Better your money than ours,” the president joked.

“This is a who’s who of people in business,” Mr. Trump said of the attendees.

Treasury Secretary Steven T. Mnuchin hosted the dinner for Sheikh Tamim Bin Hamad Al Thani, on the night before the emir meets on Tuesday with Mr. Trump at the White House.

The president said Tuesday’s meeting will be big, “from defense to purchases and trade, and I know everything’s going to be very positive.”

Qatar has been embroiled in a public feud with Saudi Arabia, the United Arab Emirates, Bahrain and Egypt, who have accused Doha of backing Islamist militants and Iran.

Among the guests at the dinner were Boeing CEO Dennis Muilenberg; Trump confidante Thomas Barrack, chairman and CEO of Colony Northstar; Ron Burkle, co-founder of The Yucaipa Companies; Michael Corbat, CEO of Citigroup; Bob Kraft, owner of the New England Patriots and a Trump friend; Eli Miller, managing director of Blackstone Group; Brian Moynihan, chairman and CEO of Bank of America Corp.; Michael Ovitz, former president of Walt Disney Company; David Rubenstein, co-founder of The Carlyle Group; Edward Breen, chair and CEO of DowDuPont; John DeGioia, president of Georgetown University; Raytheon Chairman Tom Kennedy; Milken Institute Chairman Michael Milken; Steven Mollenkopf, CEO of Qualcomm Inc.; Lorenzo Simonelli, CEO of General Electric; Patrick Soon-Shiong, owner of the Los Angeles Times; Randall Stephenson, chairman and CEO of AT&T; Chevron chairman and CEO Michael Wirth; Christine Lagarde, managing director and chairman of the International Monetary Fund; and World Bank President David Malpass.

Several Cabinet members also attended, as well as presidential advisers Jared Kushner and Ivanka Trump.

Copyright © 2019 The Washington Times, LLC. Click here for reprint permission."
DHS Official Defends Conditions at Border Patrol Stations,https://www.snopes.com,['Associated Press'],07-08-2019,2019,7,https://www.snopes.com/ap/2019/07/08/dhs-official-defends-conditions-at-border-patrol-stations/,"WASHINGTON (AP) — Acting Homeland Security Secretary Kevin McAleenan on Sunday defended conditions at U.S. Border Patrol stations following reports of crowded and unsanitary conditions that have heightened debate about President Donald Trump’s immigration policy, a trademark issue for his reelection campaign.

“It’s an extraordinarily challenging situation,” McAleenan told ABC’s “This Week.”

The Homeland Security Department’s internal watchdog provided new details about the overcrowding in Texas’ Rio Grande Valley, the busiest corridor for illegal crossings. The report said children at three facilities had no access to showers and that some children under age 7 had been held in jammed centers for more than two weeks. Some cells were so cramped that adults were forced to stand for days on end.

Government inspectors described an increasingly dangerous situation, both for migrants and agents — a “ticking time bomb,” in the words of one facility manager. The report echoed findings in May by the department’s inspector general about holding centers in El Paso, Texas: 900 people crammed into a cell with a maximum capacity of 125; detainees standing on toilets to have room to breathe; others wearing soiled clothing for days or weeks.

In tweets, Trump went further than McAleenan in defending his administration’s response, accusing the news media of “phony and exaggerated accounts” but without providing evidence.

“Border Patrol, and others in Law Enforcement, have been doing a great job. We said there was a Crisis – the Fake News & the Dems said it was ‘manufactured,'” Trump wrote. Federal detention centers “are crowded (which we … brought up, not them) because the Dems won’t change the Loopholes and Asylum. Big Media Con Job!”

Democrats faulted Trump for not offering an immigration overhaul that could pass a divided Congress.

“The president is acting like we are some weak, pathetic country,” said Colorado Sen. Michael Bennet, a Democratic presidential candidate. “We have the ability to treat human beings humanely. We have the ability to lead our hemisphere in a discussion about how to deal with this refugee crisis,” he said on “Fox News Sunday.”

McAleenan said that since the first of the year, 200 medical providers have been added to facilities, including personnel from the U.S. Coast Guard and the Public Health Service Commission Corps.

“We have pediatricians in border patrol stations for the first time in history trying to help address conditions where children are coming across 300 a day in … April and May,” McAleenan said.

“We’ve built soft-sided temporary facilities. These are spaces that are much more appropriate — high ceilings, more room for children and families. We’ve put them both in Donna, Texas, in South Texas as well as in El Paso to provide additional space. … We’ve bought buses to transport people to better places.”

McAleenan disputed news reports, including those by The Associated Press, of especially troubling conditions at a border station in Clint, Texas, where a stench was coming from children’s clothing and some detainees were suffering from scabies and chickenpox.

“There’s adequate food and water,” he said. “The facility’s cleaned every day, because I know what our standards are and I know they’re been followed because we have tremendous levels of oversight. Five levels of oversight.

“Inadequate food, inadequate water and unclean cells. None of those have been substantiated.”

He said everyone in the chain of command is worried about the situation of children detained at the border. He said that on June 1, his department had 2,500 children in custody, including 1,200 who had been there for more than three days. As of Saturday, McAleenan said there were 350 children, and only 20 have been in the department’s custody for more than three days.

“So that’s huge improvement based on the resources we asked for from Congress and were finally given,” he said.

Sen. Jeff Merkley, D-Ore., told NBC’s “Meet the Press” that he is stunned when administration officials say that reports on the conditions are unsubstantiated.

“I’m just like, ‘What world are they living in?'” Merkley said, citing government and news reports. “From every direction you see that the children are being treated in a horrific manner. And there’s an underlying philosophy that it’s OK to treat refugees in this fashion. And that’s really the rot at the core of the administration’s policy.”

Separately, McAleenan addressed questions about U.S. Border Patrol agents who are under fire for posting offensive messages in a “secret” Facebook group that included sexually explicit posts about U.S. Rep. Alexandria Ocasio-Cortez and dismissive references to the deaths of migrants in U.S. custody. The existence of that group was reported Monday by ProPublica. Prior to that, few people outside the group had ever heard of it.

He said an allegation about such activity was investigated in 2016. “Discipline was meted out on an agent that made an offensive post on that website,” he said."
