Scientists Desert USDA As Agency Relocates To Kansas City Area,https://www.npr.org,['Merrit Kennedy'],07-17-2019,2019,7,https://www.npr.org/sections/thesalt/2019/07/17/742519999/future-of-key-farming-research-uncertain-as-2-3-of-usda-staff-say-they-wont-move,"Scientists Desert USDA As Agency Relocates To Kansas City Area

Enlarge this image toggle caption J. Scott Applewhite/AP J. Scott Applewhite/AP

Two vital research agencies at the U.S. Department of Agriculture are hemorrhaging staff as less than two-thirds of the researchers asked to relocate from Washington to the Kansas City area have agreed to do so.

When U.S. Secretary of Agriculture Sonny Perdue announced the planned new location of the research agencies last month, he said it ""will be placing important USDA resources closer to many stakeholders"" and ""increasing the probability of attracting highly-qualified staff with training and interests in agriculture.""

But groups such as the Union of Concerned Scientists call it a ""blatant attack on science"" that will ""especially hurt farmers, ranchers and eaters at a particularly vulnerable time.""

The American Federation of Government Employees, the union representing the USDA's Economic Research Service and the National Institute of Food and Agriculture, said the relocation ""has resulted in catastrophic attrition at USDA's top research agencies.""

""Evidence suggests that the relocation of these agencies is an attempt to hollow out and dismantle USDA science that helps farmers and protects our food supply,"" the union added.

The USDA gave employees until just before midnight on Monday to notify their employers whether they planned to accept the relocation.

On Tuesday, a USDA spokesperson told NPR that at ERS, 72 employees accepted relocation and 99 declined or did not respond. At NIFA, the spokesperson said 73 accepted and 151 declined or did not respond. That means the total number that accepted is about 36% of those reported.

The USDA spokesperson said that these numbers may fluctuate until Sept. 30, the date employees are expected to report to the area, and employees can change their statuses until then.

They added that the USDA is working ""to ensure separating employees have the resources they need as well as efforts to implement an aggressive hiring strategy to maintain the continuity of ERS and NIFA's work.""

Last month, the USDA said that of the 644 jobs in the two agencies, 544 would be relocated and 100 would remain in the D.C. area. The numbers reported on Tuesday by the USDA do not appear to account for some 150 positions that the USDA initially announced would be relocated.

The department did not immediately respond to explain the difference, though the employees' union has reported high rates of ""retirements, employees securing new jobs, and employees choosing to be terminated."" A statement last month from three Democratic senators said that ERS had a vacancy rate of 20% and NIFA had a vacancy rate of 26.4%.

NIFA provides grants for research on agriculture-related science, and the ERS conducts research and analysis on topics such as outlooks on major crops and livestock, how much food is going to cost and whether U.S. households will be food secure.

It's not yet clear whether the research agencies will be located in Kansas or Missouri, according to The Kansas City Star.

Lawmakers from both states, including Kansas Sen. Jerry Moran, have supported the move. ""My first thought was Kansas City would be the perfect place,"" the Republican said, as NPR's Frank Morris reported.

An ex-employee of ERS recently told Morris that ""efforts by the secretary ... have just destroyed morale."" He said the way the agency is run has become increasingly partisan, and he resigned after the surprise announcement about relocations.

""I think it's had its intended effect. People have left, morale is low. The agency will take a long time to recover from the damage that's been inflicted,"" the former employee told Morris.

Some of ERS' recent studies, as Morris noted, may be politically uncomfortable for the Trump administration:

""ERS studies, for instance, concluded that the 2017 tax cuts championed by the administration would most benefit the richest farmers, and that the Supplemental Nutrition Assistance Program, which Trump wants to cut, is good for the economy.""

Perdue said last month that the move would save the USDA some $300 million. That number has been met with skepticism by some analysts. The Agricultural & Applied Economics Association estimated the relocation would actually cost taxpayers between $83 million and $182 million, partially due to the lost value of the research from staffers who decide not to move."
Prosecutors weighed DOJ policy blocking indictment of a sitting president in closing Trump hush-money probe,https://www.usatoday.com,"['Kevin Johnson', 'Kristine Phillips', 'Published P.M. Et July']",07-18-2019,2019,7,https://www.usatoday.com/story/news/politics/2019/07/18/justice-department-weighed-rule-not-charging-president-ending-trump-hush-money-case/1769339001/,"CLOSE President Trump's former lawyer, Michael Cohen, paid money to women to be quiet about alleged affairs with Trump during his 2016 campaign. USA TODAY

WASHINGTON — Federal prosecutors' decision to end an investigation into hush money payments to women claiming affairs with Donald Trump relied at least in part on long-standing Justice Department policy that a sitting president cannot be charged with a crime, a person familiar with the matter said Thursday.

The Justice Department told a federal judge on Monday that it had ""effectively concluded"" its investigation into efforts to silence the women in the final months of the 2016 campaign, but did not explain why it had done so. Prosecutors have said the payoffs violated a federal law that restricts campaign donations.

A person familiar with the case, who was not authorized to discuss it publicly, said it was unclear whether prosecutors made a determination that they had sufficient evidence to bring a case against Trump or anyone other than his former personal lawyer, Michael Cohen, who pleaded guilty last year. But the Justice Department's opinion that a president cannot be indicted factored into the decision to end the probe, the person said.

Federal prosecutors had repeatedly placed Trump at the center of the effort to silence pornographic actress Stormy Daniels and former Playboy model Karen McDougal during the chaotic run-up to the 2016 election. Last year, they alleged in a court filing that Cohen had orchestrated illegal hush-money payments ""in coordination with and at the direction of"" Trump. And it revealed in unsealed court records on Friday that Trump participated in phone calls about the payments to Daniels.

The judgment by federal prosecutors in New York to take no further action in the wide-ranging inquiry tracks a decision earlier this year by former special counsel Robert Mueller, who cited the same Justice Department policy when he declined to make a determination about whether Trump's efforts to derail that investigation amounted to a crime.

The Justice Department's Office of Legal Counsel concluded in 2000 that ""a sitting President is constitutionally immune from indictment and criminal prosecution."" That view has never been tested in court but is binding on federal prosecutors.

April 16, 2018: Adult film actress Stormy Daniels, center, follows her attorney Michael Avenatti, right, as she leaves federal court in New York. A U.S. judge listened to more arguments about President Donald Trump's extraordinary request that he be allowed to review records seized from his lawyer, Michael Cohen, office as part of a criminal investigation before they are examined by prosecutors. The raid at Cohen's apartment, hotel room, office and safety deposit box sought bank records, records on Cohen's dealing in the taxi industry, Cohen's communications with the Trump campaign and information on payments made in 2016 to former Playboy model Karen McDougal and to Daniels. (Photo: Mary Altaffer, AP)

As in the Mueller inquiry, which outlined 10 instances in which Trump sought to thwart the special counsel's inquiry, documents revealed Thursday put then-candidate Trump in middle of a frantic effort to fend off damaging disclosures about his personal conduct just a month before the 2016 election.

In the documents, the FBI described a series of conversations in the days after a leaked Access Hollywood outtake showed Trump boasting about grabbing women by the genitals about preventing Daniels from airing her own claims of having had an affair with Trump years earlier.

Authorities laid out a timeline of emails, text messages and phone calls – some involving Trump himself – that ""concerned the need to prevent"" Daniels from going public with her story.

Trump denied knowledge of the payments after they became public. But the FBI told a judge it had obtained telephone records showing he participated in some of the first conversations about the scheme, which prosecutors have said violated federal campaign finance laws.

Federal prosecutors said in court filings last year that Cohen orchestrated payments to Daniels and McDougal, ""in coordination with and at the direction of"" Trump. The documents unsealed Thursday offer the first clear account of the extent of Trump's involvement in that effort, as the Republican nominee's campaign floundered just weeks before the election.

Ultimately, it was Cohen – not Trump – who was charged and convicted for the scheme. He is serving a three-year sentence in federal prison related to tax evasion and the hush-money scheme that amounted to illegal campaign finance violations. He also pleaded guilty to Congress about efforts to build a Trump Tower in Moscow during the 2016 campaign.

""Cohen's commission of two campaign finance crimes on the eve of the 2016 election for president of the United States struck a blow to one of the core goals of the federal campaign finance laws: transparency,"" prosecutors asserted prior to Cohen's sentencing.

In the same document, however, prosecutors indicated that Cohen was acting on behalf of Trump who they then-described in gauzy law enforcement vernacular as ""Individual 1.""

""The investigation is over,"" Trump attorney Jay Sekulow said Thursday. He declined to address whether the current Justice Department policy against prosecuting a sitting president blocked any further action contemplated by New York prosecutors.

The Justice Department did not respond to a request for comment.

But from a federal prison in upstate New York, Cohen continued to claim that his conviction should not mark the end of an investigation that has long shadowed the White House.

""I and members of The Trump Organization were directed by Mr. Trump to handle the Stormy Daniels matter; including making the hush money payment,” Cohen said in a statement Thursday. “The conclusion of the investigation exonerating The Trump Organization's role should be of great concern to the American people and investigated by Congress and the Department of Justice.”

House Intelligence Committee Chairman Adam Schiff, D-Calif., said the unsealed documents bolstered Cohen's assertions.

""The inescapable conclusion from all of the public materials available now is that there was ample evidence to charge Donald Trump with the same criminal election law violations for which Michael Cohen pled guilty,"" Schiff said.

Contributing: Nicholas Wu

More: FBI tied Donald Trump and top aides to 2016 effort to silence a porn star, new court files show

More: Michael Cohen, Trump's former lawyer, is sentenced to three years in prison for 'dirty deeds'

Read or Share this story: https://www.usatoday.com/story/news/politics/2019/07/18/justice-department-weighed-rule-not-charging-president-ending-trump-hush-money-case/1769339001/"
Treasury yields clinch weekly decline after Fed officials hint at rate cut in July,https://www.cnbc.com,['Thomas Franck'],07-19-2019,2019,7,https://www.cnbc.com/2019/07/19/us-bonds-traders-consider-a-fed-rate-cut.html,"U.S. government debt yields rose on Friday but notched weekly declines as fixed-income traders snapped up bonds in anticipation of a Federal Reserve rate cut later this month.

That belief that reinforced Thursday, when New York Fed President John Williams encouraged preemptive action from central banks when signs economic deceleration start to appear.

At around 4:02 p.m. ET, the yield on the benchmark 10-year Treasury note, which moves inversely to price, was higher at around 2.05%, while the yield on the 30-year Treasury bond was also higher at around 2.578%.

New York Federal Reserve President John Williams said Thursday that the central bank should ""act quickly"" when the economy loses some steam. ""It's better to take preventative measures than to wait for disaster to unfold,"" he said in a speech."
Alexandria Ocasio-Cortez confronts Kevin McAleenan over border agent Facebook group,https://www.cnn.com,[],07-18-2019,2019,7,https://www.cnn.com/videos/politics/2019/07/18/alexandria-ocasio-cortez-kevin-mcaleenan-border-patrol-facebook-group-vpx.cnn,"Acting Homeland Security Secretary Kevin McAleenan told lawmakers there is an ""aggressive"" ongoing investigation into the secret Facebook group of current and former Border Patrol agents that sparked outrage earlier this month, responding to a question from Rep. Alexandria Ocasio-Cortez (D-NY) during a contentious House Oversight Committee hearing."
EPA will not ban chlorpyrifos,https://www.politico.com,['Liz Crampton'],07-18-2019,2019,7,https://www.politico.com/story/2019/07/18/epa-will-not-ban-chlorpyrifos-1603479,"The EPA, in a notice that will be posted to the Federal Register, said further examination of epidemiological studies of health risks associated with chlorpyrifos is necessary before the agency can make a final decision on its safety. | AP Photo/Pablo Martinez Monsivais energy & environment EPA will not ban chlorpyrifos

The Environmental Protection Agency announced Thursday that it will not ban the use of chlorpyrifos, rejecting a request from environmental groups to prohibit the pesticide.

The action came in response to an appellate court decision earlier this year ordering the agency to respond to a petition from environmental groups that sought to ban the widely used pesticide. Research has shown that chlorpyrifos, which is commonly applied on fruit and vegetable crops, has the potential to damage brain development in children. Today was the final day EPA could respond under the court’s timeline.

Story Continued Below

The EPA, in a notice that will be posted to the Federal Register, said further examination of epidemiological studies of health risks associated with chlorpyrifos is necessary before the agency can make a final decision on its safety.

The agency said “there is good reason” to continue allowing farmers to use chlorpyrifos, “given the importance of this matter and the fact that critical questions remained regarding the significance of the data addressing neurodevelopmental effects.”

The EPA under the Obama administration was taking steps to ban the pesticide in 2015. But in March 2017 President Donald Trump's first EPA administrator, Scott Pruitt, denied a petition that sought to prohibit chlorpyrifos. It was an early move intended to further Trump's deregulatory agenda.

Pruitt declared EPA needed to ""provide regulatory certainty to the thousands of American farms that rely on chlorpyrifos"" and said the agency would conduct more research before determining whether the pesticide should be removed from the market.

Environmentalists then sued the agency. In April, the U.S. Court of Appeals for the Ninth Circuit ordered EPA to act within three months on the petition to ban chlorpyrifos, which was developed by Corteva.

Morning Energy newsletter The source for energy and environment news — weekday mornings, in your inbox. Email Sign Up By signing up you agree to receive email newsletters or alerts from POLITICO. You can unsubscribe at any time.

The debate over chlorpyrifos has divided green groups and the agriculture industry. Environmentalists, citing research linking pesticide exposure to neurological damage, have pushed for decades for the government to prohibit chlorpyrifos. But the farm lobby argues the pesticide is an important crop protection tool and commodity groups have resisted efforts to ban its use.

The environmental groups behind the lawsuit blasted EPA's decision.

“By allowing chlorpyrifos to stay in our fruits and vegetables, Trump’s EPA is breaking the law and neglecting the overwhelming scientific evidence that this pesticide harms children’s brains,” said Patti Goldman, an attorney for Earthjustice.

Erik Olson, senior director for health and food at the Natural Resources Defense Council, said in a statement that government “leaders have a responsibility to protect our most vulnerable residents — our kids — but this administration chooses instead to protect its deep-pocketed allies in the chemical industry. Until EPA gets this stuff out of our fields and off our food, this fight is not over.”

An EPA spokesperson said in a statement provided to POLITICO that the issues environmental groups raised will be addressed through the agency’s review of chlorpyrifos' registration, a process that will be expedited “in response to requests from the public.” That review “should be completed well before the 2022 statutory deadline.”

The spokesperson added that the agency “has also been engaged in discussions with the chlorpyrifos registrants that could result in further use limitations affecting the outcome of EPA’s assessment.”

In the absence of federal action, some states have implemented their own bans. Hawaii and New York have prohibited chlorpyrifos, and California Gov. Gavin Newsom announced in May that the state would move forward with a ban as well.

This is the second major pesticide action EPA has taken this month. The agency said last week it would expand use of the insecticide sulfoxaflor on a variety of crops for which it had previously been prohibited due to research showing the chemical is harmful to pollinators.

"
Why the V.A. Won’t Pay for Service Dogs to Treat PTSD,https://www.nytimes.com,['Jasper Craven'],07-17-2019,2019,7,https://www.nytimes.com/2019/07/17/magazine/service-dogs-veterans-ptsd.html,"[Sign up for the At War newsletter for more stories about veterans and V.A. policy.]

The V.A. is currently conducting research into the effectiveness of service dogs, but the process has been slow. Research started in 2011 was supposed to wrap up in 2015 but has repeatedly been stalled by problems with the study’s design and execution. In May, the V.A. said the findings of the study, which has cost $16 million to date, would be released to the public in 2020.

Meanwhile, some lawmakers are growing impatient with what they perceive as a lack of initiative at a time when there is a growing mental-health crisis in America’s veterans community. In June, Representative John Rutherford, a Florida Republican, reintroduced the PAWS Act, to establish a $10 million grant program through the V.A., which would give qualified nonprofit organizations up to $25,000 for each veteran they pair with a service dog. The stipend would cover the canine’s training, and the training of the recipient with his or her service dog. The bill is sponsored by both Democrats and Republicans, pitting lawmakers against the V.A., which is refusing to endorse any new stopgap service-dog program before its internal research is completed.

Stuck in the middle are the veterans themselves. Among those receiving disability benefits from the V.A., more than one in five suffers from PTSD. Veterans who have responded poorly to conventional treatments have had to improvise, sometimes by paying thousands of dollars up front to acquire service dogs, then covering the significant costs of feeding and caring for them. To make matters worse, veterans seeking service dogs without any support from the V.A. are forced to wade into a largely unregulated industry: Some end up with a dog that provides few benefits because it isn’t properly trained. Veterans advocates say access to a psychiatric service dog without the associated financial burden can’t come soon enough.

In January 2009, Al Franken, fresh off his winning campaign for a Senate seat, met Luis Montalván, a medically retired Army captain who had served two tours as an intelligence officer in Iraq, and his golden retriever named Tuesday. Montalván had returned home with a shattered leg, spinal damage, a brain injury and PTSD symptoms that included vivid nightmares, flashbacks, panic attacks and a fear of public spaces. The only therapy that eased Montalván’s symptoms was Tuesday, whom he received from a group called Educated Canines Assisting With Disabilities. Tuesday sensed if Montalván’s breathing sharpened or he began to perspire, and then intervened with a nuzzle. If Tuesday noticed Montalván thrashing while asleep in bed, he would wake the former soldier from his nightmare with a series of sloppy face-licks. Tuesday was even trained to direct the Army veteran from his bed to his pill bottles each morning."
