Dems accuse DOJ of trying to hobble Congress’ oversight to protect Trump,https://www.politico.com,"['Kyle Cheney', 'Andrew Desiderio']",08-20-2019,2019,8,https://www.politico.com/story/2019/08/20/dems-doj-congress-trump-1469789,"President Donald Trump sued the House Oversight and Reform Committee earlier this year, in his personal capacity. | Patrick Semansky/AP Photo Congress Dems accuse DOJ of trying to hobble Congress’ oversight to protect Trump

The Justice Department is ignoring centuries of investigations into presidents in an attempt to dramatically curtail Congress’ power to probe President Donald Trump, House Democrats argued Tuesday.

In a court filing, House lawyers said the Justice Department’s call to invalidate a subpoena for Trump’s financial records was so sweeping it would essentially inoculate presidents from congressional inquiry — reversing precedents that began with George Washington, who submitted to congressional inquiry.

Story Continued Below

“These arguments are fabricated out of whole cloth: they may represent what the department wishes the law were, but they are not the law,” House lawyers wrote, accusing the Justice Department of trying to rewrite Congress’ authority to investigate a sitting president.

Trump sued the House Oversight and Reform Committee earlier this year in his personal capacity after Chairman Elijah Cummings (D-Md.) issued a subpoena to accounting firm Mazars USA, seeking several years of the president’s financial records. The subpoena came after the president’s former personal attorney and fixer Michael Cohen accused Trump of artificially inflating and deflating the values of his assets in order to win approval for loans — including one in a bid to buy the Buffalo Bills — or reduce his overall tax burden.

District Judge Amit Mehta, an appointee of President Barack Obama, upheld the committee’s subpoena in May, but Trump’s attorneys appealed the decision. The case is being heard at the U.S. Court of Appeals for the District of Columbia Circuit

Trump’s personal lawyers contend the committee overstepped its authority by subpoenaing the president’s personal records, arguing the committee failed to identify a legitimate “legislative purpose” to support its demands. Last week, the Justice Department echoed those arguments, suggesting courts should look dubiously at any efforts by Congress to “regulate the president.”

Sign up here for POLITICO Huddle A daily play-by-play of congressional news in your inbox. Email Sign Up By signing up you agree to receive email newsletters or alerts from POLITICO. You can unsubscribe at any time.

Trump’s personal legal team endorsed the Justice Department’s argument in a separate filing Tuesday, urging the court to give great weight to DOJ’s claims.

“The lack of any historical support for a legislative subpoena from a standing committee of Congress for the president’s records — directed to a third-party custodian no less — raises constitutional red flags,” Trump’s lawyers wrote, calling the committee’s demands “blunderbuss” and unreasonably broad.

In response, House general counsel Douglas Letter and his deputies rejected that as “an astounding and novel theory of limited congressional power to conduct investigations and oversight.”

Letter invoked the St. Clair investigation of 1792, when Washington acknowledged that a House inquiry for presidential papers could be valid “as the public good would permit.” He went on to cite an 1861 investigation of Abraham Lincoln during the Civil War, the Pearl Harbor investigation of 1945, Congress’ access to Richard Nixon’s tax returns, the Iran-Contra investigation of 1987 and the Whitewater investigation that began in 1995 as examples of presidents being targeted by — and at times responsive to — congressional inquiries.

“Presidents from George Washington on (unlike Mr. Trump) have understood that Congress has the power to conduct investigations and oversight of the president as part of the constitutional design,” the attorneys added.

Letter also noted that the argument from Trump’s personal attorneys and the Justice Department suggest Congress must already know the legislation it wants to pass before it has gathered any facts in its investigation.

“The department’s test is at odds with the Supreme Court’s express recognition that legislatures need facts to legislate wisely—facts that are frequently obtained through investigations,” House lawyers wrote.

They argued, as they have in previous court filings, that Congress has broad investigative authority as a co-equal branch of government.

“The Oversight Committee’s subpoena is an exercise of the House’s Article I power and not an attempt to usurp Executive power,” the House attorneys wrote.

"
Byron Allen Rips Comcast & Donald Trump’s DOJ For “Institutionalized Racism” As SCOTUS Showdown Looms,https://deadline.com,"['Dominic Patten Mike Fleming Jr', 'Dominic Patten', 'Mike Fleming Jr']",08-19-2019,2019,8,https://deadline.com/2019/08/byron-allen-comcast-civil-rights-lawsuit-supreme-court-filing-reaction-doj-donald-trump-1202671369/,"With the nation's highest court aiming to look at the ongoing lawsuit between the NBCU owner & Entertainment Studios, the DOJ has now waded in

EXCLUSIVE: Heading towards a $20 billion showdown with Comcast at the U.S. Supreme Court this fall in his long running racial discrimination lawsuit against the media giant, Byron Allen today tore into the Brian Roberts-run behemoth and an 11th hour intervention by the Department of Justice

“This is historic,” the Entertainment Studios boss said of the August 15 brief filed by the feds seeking to tighten the definitions of a Reconstruction Era statute in Comcast’s favor. “Donald Trump’s DOJ and Comcast are working together to destroy a civil rights statute in the U.S. Supreme Court.”

“You have one of the biggest media companies in the world, which has been beating up Donald Trump for racism, and now they are saying, we will work together to maintain institutionalized racism in America, in this Amicus Brief they delivered last Thursday,” Allen asserted in the starkest of terms of the now William Barr-run DOJ and its move to tip the scales for Comcast as the parties await a November 13 hearing before the nine Justices.

Related Story Playboy White House Correspondent And CNN Contributor Brian Karem Sues Over Press Pass Suspension - Update

The newly declared emphasis by the DOJ now puts a more than 150-year law in a distinctly different light from how Allen’s lawyers have been reading it, as the Department’s filing openly says.

“Although the statute does not expressly describe the necessary causal link between a plaintiff ’s race and a defendant’s refusal to contract, the text is most naturally read to require but-for causation, and background common-law principles confirm that a but-for rule applies,” the incensory submission last week from Solicitor General Noel Francisco and Assistant AG Joseph Hunt argues (read it here).

“The court of appeals erred in concluding otherwise,” the DOJ brass state of lower court ruling in February in the huge money suit that Allen first filed in early 2015, along with a $10 billion suit against Charter Communications several months later. Comcast and Charter sought to have the matter dismissed. When they failed in that effort to end a case that they framed as a form of corporate expression, the MSNBC-owner took the battle to Chief Justice John Roberts and the Associate Justices.

The government detailed its POV by saying last week that “because ‘making’ a contract means entering a contract, a person does not enjoy ‘the same right’ guaranteed by Section 1981 if race prevents her from entering a contract that a similarly situated white person would have entered. And the inverse is also true.”

The feds’ brief leaning into the law to require that Entertainment Studios has to prove that race was not merely a motivating factor, as 9th Circuit interpreted the statute earlier this summer. Now, under the DOJ’s take of the stature, Allen’s lawyers could be required to prove that race was absolutely only reason that Comcast didn’t place the company’s channels on its distribution services and platforms.

For Allen, the result is a near impossible standard for Entertainment Studios or any other person or entity availing themselves of the statute as it presently stands.

“They said, we need to go to the Supreme Court and change the definition of the statute so African Americans cannot use it and we can compromise everyone’s civil rights,” Allen told Deadline of the sudden paperwork by the DOJ, offering the Comcast and their well-funded lobbyists in D.C. an advantage at the Supreme Court.

“Comcast, in the name of profits, is compromising everyone’s civil rights,” the CEO and Joe Biden-donor proclaimed. “If you think you have a good case, take me to court. Deal with me. Don’t jeopardize everybody’s civil rights.”

Contacted by Deadline, Comcast had no comment on the DOJ brief or Allen’s remarks about the filing. Entertainment Studios themselves have until next month to respond to the feds’ filing and Comcast’s own docket entry citing the Appeal Court reading of the post-Civil War statute as too broad.

Following a surprising reversal of fortune this winter where the 9th Circuit Court of Appeal essentially brought the case back to life, SCOTUS agreed in June that they would review the matter after a request by Philadelphia-based and very well politically connected Comcast.

With the initial filing of his cases in 2015 and 2016, Allen’s contention has been that both Comcast and Charter violated the Civil Rights Act after he attempted for years to get the cable giants to carry his networks, which were available to millions of television viewers through rival distributors including Verizon, the now AT&T-owned DirecTV and DISH. The African-American executive said he has been repeatedly rebuffed and jerked around and states clearly that he believes race played a factor because Entertainment Studios is a fully minority owned entity.

Both Comcast and Charter in their respective suits have said race was not a factor in the carriage deals or lack there of.

Allen and Entertainment Studios are represented in the case by a team from Miller Bardondess LLP and University of California Berkley School of Law’s Erwin Chemerinsky. Attorneys from Gibson Dunn & Crutcher LLP are working for Comcast in the matter."
Former US attorney expects 'blockbuster' FISA abuse report from DOJ inspector general,https://www.washingtonexaminer.com,[],08-19-2019,2019,8,https://www.washingtonexaminer.com/news/former-us-attorney-expects-blockbuster-fisa-abuse-report-from-doj-inspector-general,"Former U.S. Attorney Guy Lewis predicted the Justice Department inspector general's report on alleged Foreign Intelligence Surveillance Act abuses will be ""hard-hitting,"" with multiple recommendations for prosecution.

During an interview Monday on Fox News, Lewis said he used to work with Inspector General Michael Horowitz at the Justice Department and called him as ""tough as a nail."" Lewis added, ""He’s tough, he is smart, and I think the report will be a blockbuster."" He expects Horowitz's findings to make special counsel Robert Mueller's report on Russian interference in the 2016 election ""look like a sixth grade book report.""

Asked to explain why, Lewis said, ""It’s going to come out. It’s going to be hard-hitting. [Horowitz] spent almost two years interviewing various people — witnesses. Looking at what he describes [as] almost a million documents. And I think he’s going to make recommendations regarding prosecution and turn this whole FISA — this Foreign Intelligence Surveillance Act — the submissions, I think he will turn them on their head.""

British ex-spy Christopher Steele's anti-Trump dossier, which was funded by the Clinton campaign and the Democratic National Committee, was used by the FBI to obtain FISA warrants to surveil one-time Trump campaign adviser Carter Page, an American citizen who was never charged with any wrongdoing.

Republicans have argued the dossier's Democratic benefactors and its author's anti-Trump bias were left out of the FISA applications and have demanded accountability. Democrats countered that the FBI acted appropriately, saying the Justice Department and the FBI met the rigor, transparency, and evidentiary basis for probable cause.

[Analysis: Who and what the Horowitz report is likely to cover]

Although some Trump allies have expressed high expectations for Horowitz's report and Attorney General William Barr's review of the origins of the Russia investigation, others are preaching caution. ""Republicans usually set the bar so high that when we don't meet it, the media narrative then becomes Republicans don't even own their promises. Just promise a fair investigation that goes wherever the facts take us,"" former South Carolina Rep. Trey Gowdy said on Fox News last month.

Lewis, who served with Barr at the Justice Department under President George H.W. Bush, was reacting to an interview Senate Judiciary Committee Chairman Lindsey Graham did over the weekend in which he said he believes the IG report would be “ugly and damning” for the DOJ and its handling of the Russia investigation.

Graham said he wants ""as much as possible"" declassified from Horowitz's report as possible, but former New Hampshire Gov. John Sununu warned former FBI Director Christopher Wray might fight to keep its contents classified because he has been ""co-opted by the FBI bureaucracy.""

Lewis said he does not agree with Sununu's assessment, calling Wray a ""good, honest broker,"" but advised the FBI chief to ""err on the side of transparency"" because he suspects the FISA Court may have been used by the FBI to target President Trump's 2016 campaign.

Asked where the investigation is headed, Lewis said former FBI officials Peter Strzok and Andrew McCabe ought to be ""worried"" about submissions that were made to the FISA Court. Both Strzok and McCabe filed separate lawsuits against the DOJ and FBI claiming they were subject to politically motivated firings last year.

He also said former Trump campaign adviser George Papadopoulos and former national security adviser Michael Flynn should be be ""sort of happy"" because Horowitz's report might be used to help them overturn their convictions, stemming from Mueller's investigation, for lying to FBI investigators."
Justice Dept. again sides with Trump over House in personal financial records fight,https://www.cnn.com,['Katelyn Polantz'],08-19-2019,2019,8,https://www.cnn.com/2019/08/19/politics/justice-trump-financial-records/index.html,"Washington (CNN) The Trump administration's Justice Department has again taken President Donald Trump's side in a fight between him -- as a private citizen -- and the US House of Representatives over subpoenas for his personal financial records.

The Justice Department argues the two banks shouldn't have to hand over the subpoenaed information and accuses lawmakers of not taking the correct steps to seek the documents.

This is the first time the Justice Department has spoken up in this subpoena fight. Its foray into the case comes as House Democrats' attempts heat up to get Trump's financial records and to consider formal impeachment proceedings of the President.

On Friday, the 2nd US Circuit Court of Appeals is scheduled to consider whether two banks, Deutsche Bank and Capital One, will have to turn over Trump's information to House committees. Judge Jon Newman, a Jimmy Carter appointee, and Judges Debra Ann Livingston and Peter Hall, both appointed by President George W. Bush, will hear the arguments.

In its legal brief Monday, the Justice Department broadly criticizes how the House authorized the subpoenas before taking a full House vote. They also allege that House Democrats are unfairly targeting the President.

Read More"
Democrats push judge for quick action on Trump tax returns lawsuit,https://thehill.com,[],08-20-2019,2019,8,https://thehill.com/policy/finance/458147-democrats-push-judge-for-quick-action-on-trump-tax-returns-lawsuit,"House Democrats are looking to speed up their lawsuit against the Treasury Department and IRS over their refusal to turn over President Trump Donald John TrumpFacebook releases audit on conservative bias claims Harry Reid: 'Decriminalizing border crossings is not something that should be at the top of the list' Recessions happen when presidents overlook key problems MORE's tax returns.

The Democratic-led House Ways and Means Committee on Tuesday filed a motion in federal court in Washington, D.C., for summary judgment, asking Judge Trevor McFadden to direct Treasury and the IRS to comply with the committee's requests and subpoenas for six years of the president's federal tax returns.

The committee also asked McFadden, a Trump appointee, to consider the case on an expedited basis, proposing a schedule under which briefs on relevant issues would be filed by Oct. 25 with oral arguments taking place ""as soon as practicable"" after that.

In its own court filing Tuesday, Treasury and the IRS asked that the committee's summary judgment motion be put on hold until after McFadden resolves the administration's own forthcoming motion to dismiss the House lawsuit.

ADVERTISEMENT

The Ways and Means Committee filed the lawsuit in July, after Treasury Secretary Steven Mnuchin Steven Terner MnuchinFive key players in Trump's trade battles Pelosi warns Mnuchin to stop 'illegal' .3B cut to foreign aid Trump phoned bank CEOs as stock market plunged Wednesday: report MORE and IRS Commissioner Charles Rettig rejected the requests and subpoenas for Trump's tax returns.

In arguing on Tuesday that the judge should direct the administration to provide the tax returns, the committee said that the ""defendants’ defiance is an extraordinary departure from established principles of law.""

The committee said that its subpoenas are valid, and that the section of the tax code under which it requested Trump's tax returns doesn't give Treasury and the IRS any discretion.

Treasury has said that it thinks the committee's requests and subpoenas for Trump's tax returns lack a ""legitimate legislative purpose,"" and that Democrats' real purpose for seeking the documents is to expose the tax information of a political rival.

But the committee argues its requests and subpoenas do have a legitimate legislative purpose, because the panel is conducting oversight and considering legislative proposals relating to how the IRS enforces tax laws against a president.

The committee revealed in its new court filings that on July 29, it received an unsolicited communication from a federal employee it claims made credible allegations of possibly inappropriate efforts to influence the IRS's mandatory audit program of presidents.

Committee Chairman Richard Neal Richard Edmund NealTrump argues NY tax return case should take place in DC NY files motion to keep Trump tax returns lawsuit out of DC court Democrats give cold shoulder to Warren wealth tax MORE (D-Mass.) wrote to Mnuchin earlier this month, asking for records relating to those concerns. Mnuchin replied that the Treasury didn't have any records that were covered under the tax code section under which Neal made his request. Mnuchin also said that Neal should raise his concerns with the Treasury Inspector General for Tax Administration.

The administration argued that it plans to file a motion to dismiss the case that will raise issues about ""whether political conflicts between the elected Branches fall within the sphere of authority that the Constitution assigns to the Federal courts."" It asked McFadden to stay the committee's motion until the judge rules on its motion to dismiss.

The administration argued that its motion and the committee's motion will require the court to consider different issues. The administration is proposing a schedule under which oral arguments on its motion to dismiss would be held the week of Oct. 16 or soon after that.

But the committee, which argued that it has standing to sue, thinks that the judge should consider the administration's expected motion to dismiss and the panel's summary judgment motion concurrently, arguing the motions are likely to raise overlapping issues.

The House panel argued that ""time is of the essence"" in resolving the case, since the current Congress will end in January 2021.

""The Committee must obtain a prompt resolution of the issues in this case if it is to have enough time to investigate the tax issues implicated by President Trump’s tax returns and return information and propose and pass any legislation that it may deem appropriate in response,"" the panel argued.

The administration, however, said that the committee's concern about the speed of the case ""rings hollow,"" since Neal didn't request Trump's tax returns until several months after he became chairman, and the lawsuit wasn't filed until weeks after Treasury and the IRS rejected Neal's subpoenas.

Trump and several of his business entities also are being heard in the case as defendant-intervenors. They argued on Tuesday that the committee's motion for summary judgment should be postponed until after they can request information about Democrats' true motives for requesting Trump's tax returns.

Updated at 6 p.m."
"U.S. Corn, Soybean Crops Are Still Going Backward, USDA Says",https://www.agriculture.com,[],08-19-2019,2019,8,https://www.agriculture.com/news/crops/us-corn-soybean-crops-are-still-going-backwards-usda-says,"DES MOINES, Iowa -- The U.S. corn and soybean crops conditions deteriorate, according to the USDA’s weekly Crop Progress Report released Monday.

Corn

The overall condition of the corn crop is rated at 56% good to excellent in the top 18 corn producing states, lower than 57% a week ago and 68% a year ago.

The USDA pegged 95% of the corn crop was in the silk stage, compared with a 99% five-year average.

Also, 55% of the corn has entered the dough stage vs. a 76% five-year average.

USDA rated the crop in the dent stage at 15% vs. 30% five-year average.

For folks keeping track at home, the National Agricultural Statistics Service (NASS) reported, Monday, that Texas farmers have harvested 26% of their corn crop vs. 51% a year ago and a 44% five-year average.

Mississippi farmers have 8% of their corn crop picked vs. 19% a year ago and a 20% five-year average. Also, Arkansas farmers have harvested 4% of their 2019 corn vs. 5% a year ago and an 8% five-year average.

Soybeans

The nation’s crop is rated 53% good/excellent compared with 54% a week ago and 65% a year ago.

Also, 90% of the soybean crop is blooming vs. a 96% five-year average.

The USDA pegged the amount of soybeans setting pods at 68%, well below a five-year average of 85%.

Wheat

The U.S. winter wheat harvest is 93% complete vs. a 98% five-year average. Meanwhile, the U.S. spring wheat crop is rated as 70% good/excellent vs. 69% a week ago."
