"Trump’s proposed new rule would let government contractors fire LGBTQ employees base on employers’ religious beliefs, critics say",https://www.aol.com,"['Aol Staff', 'Muri Assunção']",08-15-2019,2019,8,https://www.aol.com/article/news/2019/08/15/trumps-proposed-new-rule-would-let-government-contractors-fire-lgbtq-employees-base-on-employers-religious-beliefs-critics-say/23793966/,"A new rule proposed by President Trump’s administration would allow businesses that receive federal contracts to discriminate against LGBTQ individuals according to employers’ religious beliefs, critics say.

According to the Department of Labor, the role of the proposal, which was announced Wednesday, is to “clarify the scope and application of the religious exemption.”

It’s ""intended to clarify the longstanding civil rights protections afforded to religious organizations that contract with the federal government,” one official said, according to Bloomberg Law. “The proposal would ensure the “religious protections are given the same federal recognition as all other civil rights.”

But critics say that the rule would essentially let federal contractors use religious objection excuses as a defense for discriminating against workers on the basis of their sexual orientation, gender identity and other characteristics, such as sex, race, color, ethnicity or national origin.

The 46-page proposal “would allow federal contractors to apply for broad exemptions to civil rights law after engaging in discriminatory behavior,” The National Center for Transgender Equality (NCTE) said in a statement.

BREAKING NEWS: Trump's Dept of Labor is encouraging discrimination under the guise of ""religious freedom.""



Reminder: Trump's Justice Dept will try to argue that firing Aimee Stephens, a trans woman, for being trans was legal at SCOTUS in October.https://t.co/uSqYU8yWI0 — National Center for Transgender Equality (@TransEquality) August 14, 2019

That behavior includes “firing or refusing to hire someone because of their sexual orientation or gender identity. It could also lead to federal contractors refusing to hire women or unmarried workers who are pregnant or parents, or even discrimination on the basis of race,” the statement continued.

26 PHOTOS Stars celebrate Pride 2019 See Gallery Stars celebrate Pride 2019 How you doin’, New York? 🌈 I’m blown away by the energy and the love in this city right now! Happy World Pride! #lgbtqia #worldprideday #lgbtally #itsamarchnotaparade #pride #pridemonth #pride2019 #nycpride Happy Pride Y’all! 🌈 #family #ally #worldpridenyc I couldn’t be more proud of every single person in that crowd and around the world today. This community inspires me so much. Your courage, your bravery, your relentless pursuit of kindness. Celebrate yourselves today, and hopefully every day. I love you. #PRIDE 📸 @gr8images @gettyentertainment A transcendent day today!! There was love everywhere! ♥️🏳️‍🌈♥️🏳️‍🌈 and our float was like a Fellini movie. HAPPY PRIDE! (📸: @charlessykes) ""Pose"" actresses and Pride Parade grand marshals MJ Rodriquez, Indya Moore and Dominique Jackson rode on a BMW M850i Convertible wrapped in a custom pride design by Jonathan Adler during WorldPride NYC on Sunday. (Photo by Theo Wargo/Getty Images) MY BOYS ❤️ Madame ❌ is a spy in the House of NYC................ WERK BITCHES............. 🌈🗽#nyc #worldpridenyc #stonewall50 #madamex🏳️‍🌈💛🏳️‍🌈💙🏳️‍🌈💚🏳️‍🌈🧡 MARINA performed a the inaugural Love Above All Ball benefiting the Born This Way Foundation at the Rainbow Room on Friday night. (Credit: BFA) We have to consciously study how to be tender with each other until it becomes a habit 💞- #audrelorde HAPPY FUCKING PRIDE!!!! from me and my fave straight! Olympian Gun Kenworthy did a meet-and-greet at the Barfoot Wine & Bubby activation on Pride Island. (Credit: Courtesy of Barefoot) #ad Judges Your Scores: The #LOVEYOURSELF @KetelOne_US 🍸 = 🔟🔟🔟🔟 across the board. Cheers to the family we make, the love we spread, and the acceptance we continue to fight for... oh and all while looking FIERCE doing it. Who’s with me? 📸 by: @christiantorresphoto Wearing Custom @csiriano Style by @sammyratelle Glam by @lasonyagunter #ketelonefamilymadevodka #familymade #ketelone #acceptanceforall Yes God #worldpride2019 Christian Siriano and Alicia Solo attended Ketel One Family-Made Vodka and The Misshapes' Pride Oasis Pool Party benefiting the Hetrick-Martin Institute at the 1 Hotel Brooklyn Bridge on Saturday. (Photo by Craig Barritt/Getty Images for Ketel One Family-Made Vodka) About to kick off World Pride Parade 🏳️‍🌈 @1035ktu float #worldpridenyc Fab rainbow coat by @adriennelandau 🙏🏽 @saulovillela Sir Richard Branson visited The Stonewall Inn to celebrate Pride and the announcement of Virgin Voyages LGBTQ+ charter with Atlantis Events on Saturday in New York City. (Photo by Noam Galai/Getty Images for Virgin Voyages) Betty Who performed a the inaugural Love Above All Ball benefiting the Born This Way Foundation at the Rainbow Room on Friday night. (Credit: BFA) ""13 Reasons Why"" actor Tommy Dorfman attended WorldPride in partnership with AXE to support the Anti-Violence program. (Credit: Unilever) Parade Begins! WOW! HAPPY PRIDE! Ready for the march!! #NYCPride #pride Nico Tortorella and #AerieREAL Role Model Samira Wiley attended a Pride celebration at American Eagle's Be You Studio on June 29, 2019 in New York City. (Photo by Gonzalo Marroquin/Getty Images for Aerie) NYC drag queen Rosé partnered with Trojan Condoms to celebrate all shapes and sizes with the brand's Conecocktions Ice Cream Truck, empowering guys to take #PrideinMine, at the NYC WorldPride March on June 30, 2019, in New York City. (Photo by Noam Galai/Getty Images for Trojan) Happy #PRIDE my friends! I know that some people reading this will have endured a lot of pain and struggle in their life purely for the freedom to be themselves. I’m full of respect and admiration for you, because it takes a type of bravery most of us may never have to summon. To have the courage to risk rejection from a family, community or society in order to be yourself - it’s soul damaging at the deepest level and it changes you irrevocably. We love you. Wherever you are in the world, there’s a global family out there just waiting for you!✨ . Special thanks to @olimastudio for the custom fit, @mercedesnatalia for next level styling, @alanawrightmakeup for makeup + @ivainsane for hair. Photos by @dxprutting #LoveAboveAllBall LOVE always come first. ................ Happy PRide!!! 🌈💙🌈💜🌈💚🌈💛 #whoa #worldpridenyc #stonewall50 #davidbanda #mercyjames Thx 4 having me @nycpride 🌈🌈🌈 📸 @leggomymeggoz Kim wore all Judith Leiber Jewelry for her 2019 Pride Island Concert in NYC. @itgetsbetter with @morphebrushes @americaneagle @thesims @thestandard #prideonthehorizon What colors represents you? Mine is always red!!! Comment below! Up Next See Gallery Discover More Like This HIDE CAPTION SHOW CAPTION of SEE ALL BACK TO SLIDE

With the new rule, businesses that claim a “religious purpose” can benefit from the protection. However, the proposal expands on the meaning of a religious corporation: “The contractor must be organized for a religious purpose, meaning that it was conceived with a self-identified religious purpose. This need not be the contractor’s only purpose.”

The proposal wants to make clear that “religious exemption covers not just churches but employers that are organized for a religious purpose, hold themselves out to the public as carrying out a religious purpose, and engage in exercise of religion consistent with, and in furtherance of, a religious purpose.”

The proposed rule frustrates human rights advocates, who see it as the latest move by Trump to undermine the rights of LGBTQ individuals in the name of religious freedom.

“Once again, the Trump administration is shamefully working to license taxpayer-funded discrimination in the name of religion. Nearly one-quarter of the employees in the U.S. work for an employer that has a contract with the federal government,” Ian Thompson, senior legislative counsel with the American Civil Liberties Union (ACLU), said in a statement. “We will work to stop this rule that seeks to undermine our civil rights protections and encourages discrimination in the workplace.”

Mara Keisling, NCTE’s founder executive director echoed that message. “Religious freedom must be a shield to protect the marginalized, not a sword to attack them. There are few values more sacred to the equality of all in this nation than the belief that nobody should be judged by an employer because of who they are or who they love, yet this administration continually seeks to undermine that value,” she said.

“Whether it’s our right to health care, our right to housing, or our right to equal employment, we are committed to fighting every action this administration takes against us,"" added Keisling.

More from :

Car traffic in Manhattan moving at slowest pace in decades: report

Rent laws are welfare for the rich: Time for New York to have a smart conversation over a costly housing regulatory system

Woodstock, after the haze: The festival was significant, but not for the reason you may think"
"Facing Opposition, E.P.A. Backtracks on Use of ‘Cyanide Bombs’ to Kill Wild Animals",https://www.nytimes.com,['Neil Vigdor'],08-16-2019,2019,8,https://www.nytimes.com/2019/08/16/us/epa-cyanide-bombs.html,"The federal Environmental Protection Agency on Thursday withdrew its support for the continued use of so-called cyanide bombs to protect livestock from predators, reversing course amid strong opposition to the practice.

The E.P.A. administrator, Andrew R. Wheeler, said he was withdrawing an interim reauthorization for the use of M-44 devices, which are used to kill coyotes, foxes and other animals that prey on livestock. The agency, he added, would re-evaluate the highly criticized practice.

“This issue warrants further analysis and additional discussions by E.P.A. with the registrants of this predacide,” Mr. Wheeler said in a statement on Thursday. “I look forward to continuing this dialogue to ensure U.S. livestock remain well protected from dangerous predators while simultaneously minimizing off-target impacts on both humans and nonpredatory animals.”

The federal Department of Agriculture, along with its state counterpart agencies in Montana, New Mexico, South Dakota, Texas and Wyoming, have relied on the M-44s for farming since the mid-1970s."
"Senior Trump officials, including the 'Vino Vixen,' harassed, abused, retaliated against career State Dept. employees: IG report",https://abcnews.go.com,['Abc News'],,,,https://abcnews.go.com/Politics/senior-trump-officials-harassed-abused-retaliated-career-state/story?id=65000738,"Career State Department employees in one of the agency's critical bureaus faced harassment, mistreatment and retaliation by its top Trump appointees, according to a new inspector general report.

Interested in Trump Administration? Add Trump Administration as an interest to stay up to date on the latest Trump Administration news, video, and analysis from ABC News. Add Interest

The report on the Bureau of International Organization Affairs centers around two senior officials, Mari Stull, a food and beverage lobbyist turned wine blogger under the name ""Vino Vixen,"" and the bureau's head, Assistant Secretary of State Kevin Moley.

According to the report, Stull harassed career employees who she thought were ""disloyal"" to President Donald Trump and, together with Moley, they removed some from their responsibilities and even one senior official from her post. Approximately 50, including senior officials, left on their own because of their management style.

Alastair Pike/AFP/Getty Images

In addition to the retaliation, the IG report found that Moley and Stull treated employees in a ""harsh and aggressive manner,"" engaged in ""disrespectful and hostile treatment,"" and created a ""negative and 'vindictive' environment."" Stull and Moley ""frequently berated employees, raised their voices, and generally engaged in unprofessional behavior toward staff.""

The report, rich in detail, is based on the 40-plus interviews that the IG office conducted. Stull initially asked the IG to investigate her own claims of fraud, waste and abuse in the office, but later declined to be interviewed. She left the State Department in January 2019, so she no longer has to comply or faces any penalty.

Moley is still serving as assistant secretary and denied several of the accusations, telling the IG office, ""The behavior attributed to me regarding raising my voice, berating employees and contributing to a hostile work environment does not represent the person I am or have ever been.""

The State Department told the IG that he has received counseling from department leadership ""on appropriate leadership and management of the bureau. Further discipline will be considered.""

It also accepted other recommendations, including developing a ""corrective action plan to address the leadership and management deficiencies"" within 60 days.

U.S. Department of State

The International Organization Affairs, or IO, bureau is a lesser known one within the State Department, but its critical function is to be the primary interlocutor with the United Nations and other important international bodies, covering human rights, nuclear issues, climate change, global health and more.

One of the more salacious details that has been reported in the news -- that Stull kept a loyalty list -- was not confirmed by the IG, but it seems in principle she kept one. Employees say in the report that she called them or others in the office ""traitors,"" ""Obama holdovers"" or ""disloyal.""

While working at a different agency, Stull sought an IO employee's help with a personal matter. On the advice of the State Department's legal team, he declined. But once at IO, Stull harassed both the employee and his manager for not helping, according to the report. That included bad-mouthing them to senior leaders, assigning a junior employee to ""monitor"" their phone calls, attempting to take away job responsibilities and barring the employee from traveling to important events like the U.N. General Assembly.

Chip Somodevilla/Getty Images

Another employee said working with Stull meant ""six to eight hostile interactions per day,"" per the report. In one instance, she called an employee's report on other nations' U.N. contributions ""garbage"" and threw it at another employee. In another, she and Moley berated a junior employee until she cried.

When the bureau's principle deputy assistant secretary, a career Foreign Service officer, raised concerns with Moley about Stull and his management, she was eventually removed by Moley -- which the IG report says was a retaliatory move that broke department policy.

Beyond this senior official, Moley dismissed concerns from other employees about Stull and his management, according to the report; Moley said no one ever raised any issues with him. Even when senior officials above Moley's rank raised concerns with him, he ""did not undertake any meaningful efforts to address these concerns."" In fact, some of the actions described in the report happened after an intervention in June 2018.

When concerns were raised with Stull, she said she was the real victim and told at least one employee that ""raising such concerns was pointless because the Trump administration 'has my back.'""

There is a second IG report on similar personnel issues that has yet to be released. That one deals with senior members of former Secretary of State Rex Tillerson's staff who allegedly retaliated against employees in the secretary's office, including one for being of Iranian descent. One of those staffers, Brian Hook, remains a top adviser to Secretary of State Mike Pompeo."
A DOJ employee is accused of helping her son and the Bloods intimidate informants,https://www.cnn.com,['Paul P. Murphy'],08-15-2019,2019,8,https://www.cnn.com/2019/08/15/us/bloods-gang-doj-employee-snitch-trnd-scn/index.html,"(CNN) The Department of Justice says one of its own ""repeatedly"" helped the Bloods street gang protect its interests by identifying and exposing informants and cooperating witnesses.

Tawanna Hilliard works in an administrative role for the US Attorney's Office for the District of New Jersey, court documents say. According to the US Attorney for the Eastern District of New York, over a period of more than two years, Hilliard used her access to information to help her son Tyquan Hilliard, 28, and his gang, the 5-9 Brims set of the Bloods.

Authorities have charged the Hilliards with six felony counts: witness tampering and harassment, obstruction of justice and conspiracy to tamper with a witness. Each carries a maximum 20-year prison sentence.

Tawanna Hilliard is also charged with illegally obtaining information from a protected government computer.

The Hilliards' lawyer has not responded to a request for comment.

Read More"
"Trump pressured Mnuchin to label China ‘currency manipulator,’ a move he had previously resisted",https://www.washingtonpost.com,"['Damian Paletta', 'Reporter Covering Economic Policy', 'Philip Rucker', 'White House Bureau Chief', 'August At Pm', 'Damian Paletta Is White House Economic Policy Reporter For The Washington Post. Before Joining The Post', 'He Covered The White House For The Wall Street Journal.', 'Philip Rucker Is The White House Bureau Chief For The Washington Post. He Previously Has Covered Congress', 'The Obama White House', 'The']",08-15-2019,2019,8,https://www.washingtonpost.com/business/economy/trump-pressured-mnuchin-to-label-china-currency-manipulator-a-move-he-had-previously-resisted/2019/08/15/b487bb2e-bf84-11e9-a5c6-1e74f7ec4a93_story.html,"President Trump personally pressed Treasury Secretary Steven Mnuchin to label China as a “currency manipulator” two weeks ago, a move Mnuchin had previously resisted, three people with direct knowledge of the push said.

The pressure from Trump revealed a more forceful West Wing role in the highly controversial decision. Mnuchin had repeatedly refused to designate China as a currency manipulator because China’s currency moves didn’t meet the Treasury Department’s established criteria for that action.

But Trump exerted immense pressure on Mnuchin earlier this month, after the Chinese let their currency, the yuan, cross a symbolic threshold that it had not passed in some time.

This came after an escalation in the U.S.-China trade conflict, with Trump announcing he would be putting a 10 percent tariff on $300 billion in additional Chinese exports and China pledging retaliation. (This week, Trump delayed some of those new tariffs out of concern for what they would to do the U.S. economy during the holiday period.)

[‘It could get very serious’: Why some analysts fear a U.S.-China currency war]

The Chinese yuan has been weakening this year, with differing explanations as to why. Trump has alleged that the Chinese government has intentionally weakened its currency to gain an advantage over U.S. companies. When a country weakens its currency, it makes its exports cheaper and more competitive.

But a number of international economic experts have said that the Chinese currency has weakened because of independent market forces, including a worsening of the Chinese economy. The Treasury Department had declined as recently as May to name China a currency manipulator, even though Trump has raised concerns since before he was president.

There are two federal laws that dictate the treasury secretary’s power to label certain countries as currency manipulators. Currency ma­nipu­la­tion often draws a strong international response, because it can skew currency and trade markets and create distortions in how goods flow around the world. The laws are meant to protect the process from political interference, and they set out specific criteria that must be met in order for the designations to occur.

In the Aug. 5 designation, Treasury Department officials did not specify what had changed after their May 28 announcement that cleared China. Instead, they pointed to public statements from the Chinese government as a way of affirming an active government role in controlling the currency.

“In recent days, China has taken concrete steps to devalue its currency, while maintaining substantial foreign exchange reserves despite active use of such tools in the past,” the Treasury Department said. “The context of these actions and the implausibility of China’s market stability rationale confirm that the purpose of China’s currency devaluation is to gain an unfair competitive advantage in international trade.”

White House and Treasury Department spokesmen declined to comment.

One of the people with knowledge of Trump’s pressure on Mnuchin said the White House wanted China labeled as a currency manipulator so that it might prod Chinese officials back to the negotiating table. This has proved unsuccessful so far. Instead, it has inflamed tensions between the countries.

The three people spoke to The Washington Post on condition of anonymity because they were not authorized to reveal the discussions.

As a practical matter, labeling China as a currency manipulator simply begins a process of discussions between the Treasury Department and the International Monetary Fund, though the IMF has declined to agree with the designation.

Trump has increasingly complained that the strong U.S. dollar is hurting the U.S. economy. He has blamed this dynamic both on the Chinese government and the Federal Reserve, though many businesses and investors have said it is a result of the White House’s adversarial trade agenda."
Brother called FBI to investigate State Department official over hate,https://www.cnn.com,['Mallory Simon'],08-15-2019,2019,8,https://www.cnn.com/2019/08/15/politics/state-dept-white-supremacist-brother-fbi/index.html,"(CNN) The brother of a State Department official linked to a white nationalist group by a civil rights organization tells CNN he reported his sibling to the FBI out of concern about his hateful views.

Matthew Gebert, the State Department employee, has been placed on administrative leave from his job as a foreign affairs officer in the Department's Bureau of Energy Resources after the civil rights organization's made the claim

Gebert's brother, Michael Gebert, told CNN on Thursday that details in the extensive report released last week by the Southern Poverty Law Center's Hatewatch initiative are accurate.

Hatewatch alleged that Matthew Gebert ""oversaw the Washington, DC-area chapter of a white nationalist organization, hosted white nationalists at his home and published white nationalist propaganda online."" According to the report, he used a pseudonym -- Coach Finstock -- to express ""a desire to build a country for whites only.""

'I was just so angry'

Read More"
