DOJ arrests Chicago man who allegedly threatened attack on women's reproductive clinic,https://abcnews.go.com,['Abc News'],,,,https://abcnews.go.com/Politics/doj-arrests-chicago-man-allegedly-threatened-attack-womens/story?id=65063192,"The Department of Justice has announced federal charges against a Chicago man who prosecutors say threatened an attack against a women's reproductive clinic, the latest in a string of potential mass attacks thwarted by law enforcement.

Farhan Sheikh, 19, was arrested last Friday evening after posting on the social media platform iFunny that he would attack a local clinic and ""proceed to slaughter and murder any doctor, patient, or visitor I see in the area and I will not back down,"" according to a criminal complaint filed in the U.S. District Court of Chicago,

""Consider this a warning for anyone visiting,"" Sheikh allegedly wrote.

The indictment does not list the clinic where Sheikh was allegedly threatening to carry out his attack, but said it is approximately 4 miles from his residence in Chicago.

In a post to the platform last week, Sheikh wrote he was ""done"" with Illinois' ""abortion laws and allowing innocrnt (sic) kids to be slaughtered for the so called 'womans right' [expletive].""

According to the complaint, when investigators confronted Sheikh at his residence about the posts he admitted they were his but sought to downplay the seriousness of his threats, despite accompanying posts that warned his threats weren't ""satirical.""

Sheikh was charged with transmitting a threat in interstate commerce, which is punishable by up to five years in prison.

Mark Wilson/Getty Images

The arrest follows at least three possible mass attacks thwarted by law enforcement over the weekend, with suspects arrested in Connecticut, Florida and Ohio.

The FBI directly assisted in two of the cases. In Connecticut, a 22-year-old man was charged with illegal possession of high-capacity ammunition magazines after authorities discovered a Facebook post where he expressed interest in carrying out a mass shooting.

In Ohio, police arrested a 20-year-old man who was a self-proclaimed white nationalist that had allegedly posted on Instagram what investigators believed was a threat to carry out an attack on a local Jewish center. He has pleaded not guilty to telecommunications harassment and aggravated menacing.

And in Florida, a 25-year-old man was arrested after allegedly sending text messages where he expressed interest in carrying out the ""longest confirmed kill ever"" and was strategizing about locations where to carry out his attack, officials said.

Last week, Attorney General William Barr said the DOJ was crafting a bill that would seek to expedite death penalty proceedings for mass shooters, following a directive from President Trump in the wake of the El Paso, Texas and Dayton, Ohio shootings."
"As Dicamba Injury Complaints Rise, States' Communication With EPA Declines",https://www.dtnpf.com,[],08-20-2019,2019,8,https://www.dtnpf.com/agriculture/web/ag/crops/article/2019/08/20/dicamba-injury-complaints-rise-epa,"Dicamba injury allegations are reaching new heights in some states this year, but -- unlike last year -- EPA is not regularly polling states on their dicamba investigations and experiences this summer. (DTN photo graphic)

ROCKVILLE, Md. (DTN) -- Once again, most major soybean states are dealing with a deluge of dicamba injury allegations this summer, with at least one already reporting a record level of complaints.

But, unlike last year, the EPA's Office of Pesticide Programs is not getting routine updates from state regulators on these injury reports. Last year, representatives from the federal agency participated in weekly conference calls with state pesticide regulators on dicamba injury complaints and investigative findings throughout the summer and fall. EPA officials also visited multiple states to tour dicamba injury and hold public forums on the topic.

This year, this regular communication and canvassing has dried up.

""We haven't been asked to provide any information to U.S. EPA headquarters,"" said Doug Owens, chief of the Bureau of Environmental Programs at the Illinois Department of Agriculture, which has fielded more than 450 alleged dicamba injury reports, up nearly 40% from last year and a record for the state. ""I know last year, we reported to them every week with weekly conference calls. We're not participating in that this year, and no information has been requested.""

This experience was echoed by other states, including Indiana, Iowa, Missouri and Minnesota. (State regulators from Nebraska did not respond to DTN's inquiries.) While most states are making informal reports on their experience with dicamba to the representatives in their regional office of the EPA, the national Office of Pesticide Programs, which oversees the dicamba registrations, has had little to no direct communications with most state regulators on this issue. Only the Arkansas Department of Agriculture reported sending 2019 injury statistics to EPA headquarters recently.

In an emailed statement to DTN on July 31, an EPA spokesperson said the agency was still working with states to ""determine the extent and frequency"" of communications on dicamba injury in 2019. But, with the spray season mostly behind them, state regulators told a different story.

Leo Reed, president-elect of the Association of American Pesticide Control Officials (AAPCO) and pesticide licensing manager for the Office of Indiana State Chemist, said the last time EPA communicated with the Indiana agency on dicamba injury was the previous crop season. ""They've not reached out to the state chemist office specifically on that topic since 2018,"" he said.

At a state regulator meeting in June, members of the State FIFRA Issues Research and Evaluation Group (SFIREG) said EPA had drafted a one-time dicamba survey for states to submit at the end of the 2019 season, in lieu of the weekly calls conducted in 2018. However, state regulators demanded more information on the purpose of the survey, noting that their efforts to communicate dicamba injury to EPA in 2018 had resulted in few substantial changes to the dicamba registrations. Since those concerns were voiced, EPA has been silent on the topic of a survey or any dicamba information-gathering. ""We were trying to determine what the results would be -- how will the information we collect be used?"" explained Reed. ""And no one at EPA responded. And that's the last we heard of that."""
"Some jail staffers not cooperating with DOJ investigation into Epstein suicide, source says",https://www.foxnews.com,"['Vandana Rambaran', 'Vandana Rambaran Is A Reporter Covering News', 'Politics At Foxnews.Com. She Can Be Found On Twitter']",,,,https://www.foxnews.com/us/prison-personnel-refuse-to-cooperate-with-doj-investigators-digging-into-epstein-suicide,"Personnel at the New York City prison where accused sex trafficker Jeffrey Epstein committed suicide last week have not been initially cooperative with investigators from the Department of Justice, a federal source told Fox News Friday.

Attorney General William Barr sent two senior DOJ officials to personally visit the Metropolitan Correctional Center and speak with staff from the Federal Bureau of Prisons (BOP) in order to gather information on Epstein's death after Barr said officials uncovered ""serious irregularities"" at the jail, a senior DOJ official told Fox News. The officials have been on site since Thursday and the FBI and the Justice Department's inspector general are investigating conditions at the MCC.

NEW YORK MEDICAL EXAMINER: JEFFREY EPSTEIN'S DEATH WAS A SUICIDE BY HANGING

BOP officials from various regional offices have also been sent to the Manhattan facility to lend their expertise and insight. In addition, a separate BOP ""After Action Team"" went to MCC earlier this week in an effort to examine what happened the night Epstein died. The use of the ""After Action Team"" is part of BOP protocol whenever a ""significant event takes place at a prison.

Epstein was found dead in his cell on Aug. 10. Earlier Friday, New York City's medical examiner officially ruled the 66-year-old's death a suicide by hanging.

Fox News has also learned that 20 of 21 prison staff posts were filled between the hours of 4 p.m. and 12 a.m. on Friday, Aug. 9, the day before Epstein was found. Of those prison workers, six of them were working voluntary overtime. Between 12 a.m. and 8 a.m. on Saturday, Aug. 10, 18 of 19 staff posts were filled. Of those 18 staffers, 10 were working overtime and all but one of those were doing so voluntarily.

Conspiracy theories swirled following Epstein's death, as many wondered how the wealthy financier could have been able to kill himself in a high-security facility just over two weeks after being placed on suicide watch, though officials later confirmed Epstein had been taken off suicide watch shortly before his death.

Correctional officers did not check in with Epstein for ""several hours"" before his death, despite being required to visit him every 30 minutes, a person familiar with the situation told Fox News earlier this week.

Jail guards on duty the night of Epstein's death are also suspected of falsifying log entries to show they were checking on inmates every half-hour as required, The Associated Press reported, citing several people familiar with the matter.

Two staffers have been placed on administrative leave and the MCC's warden has been reassigned pending an investigation.

CLICK HERE FOR THE FOX NEWS APP

Late Friday, Epstein's attorneys issued a statement decrying what they described as ""the harsh, even medieval conditions at the MCC.""

""It is indisputable that the authorities violated their own protocols,"" Martin Weinberg, Reid Weingarten and Michael Miller said. ""The defense team fully intends to conduct its own independent and complete investigation into the circumstances and cause of Mr. Epstein’s death including if necessary legal action to view the pivotal videos - if they exist as they should - of the area proximate to Mr. Epstein's cell during the time period leading to his death.

""We are not satisfied with the conclusions of the medical examiner,"" the statement concluded. "" We will have a more complete response in the coming days

Fox News' Samuel Chamberlain, Jake Gibson and Nicole Darrah contributed to this report."
Brother called FBI to investigate State Department official over hate,https://wtkr.com,['Cnn Wire'],08-20-2019,2019,8,https://wtkr.com/2019/08/20/brother-called-fbi-to-investigate-state-department-official-over-hate/,"The brother of a State Department official linked to a white nationalist group by a civil rights organization tells CNN he reported his sibling to the FBI out of concern about his hateful views.

Matthew Gebert, the State Department employee, has been placed on administrative leave from his job as a foreign affairs officer in the Department’s Bureau of Energy Resources after the civil rights organization’s made the claim.

Gebert’s brother, Michael Gebert, told CNN on Thursday that details in the extensive report released last week by the Southern Poverty Law Center’s Hatewatch initiative are accurate.

Hatewatch alleged that Matthew Gebert “oversaw the Washington, DC-area chapter of a white nationalist organization, hosted white nationalists at his home and published white nationalist propaganda online.” According to the report, he used a pseudonym — Coach Finstock — to express “a desire to build a country for whites only.”

‘I was just so angry’

Michael Gebert identified his older brother as the man in a photo Hatewatch posted of white nationalists gathering in Charlottesville, Virginia, months before the Unite the Right rally that resulted in the killing of a counter-protestor, 32-year-old Heather Heyer.

Michael Gebert also said it was his brother’s voice speaking as “Coach Finstock” on a white nationalist podcast and confirmed Hatewatch’s reporting that he had contacted the FBI about his brother last month through an electronic tip form on the bureau’s website.

“He’s had all this hate growing and accelerating under his skin,” the younger Gebert told CNN in a phone interview after Hatewatch released a report about his outreach to the FBI. “Everything else is keeping up good appearances.”

He told CNN he made the decision to contact the FBI out of concern for his brother’s children.

“It didn’t take courage to submit a tip to the FBI,” he said. “I was just so angry.”

Michael Gebert says he and his brother have long disagreed over politics.

‘So much evil’

Matters reached a head about a year ago at a family gathering in the Pocono Mountains in Pennsylvania, he said. After drinking some alcoholic beverages, he said his brother Matthew began using language about Jews, immigrants and minorities that concerned and frightened him.

Michael Gebert explained “it took everything in me” to not react in a violent manner. He said he told his brother, “Matt, I wanna smash your face in.”

He told Hatewatch of that evening: “I saw so much evil in my brother, I could not f**king deal with it.” Even so, Michael Gebert told CNN he still has some sympathy for his brother.

The State Department did not respond to CNN’s request for comment about Michael Gebert’s efforts to warn authorities about his brother’s activities.

The FBI said it does not comment on tips. The agency said it can’t investigate people for holding an ideology or belonging to certain US-based hate groups.

Attempts by CNN to reach Matthew Gebert have been unsuccessful. Hatewatch said in its report that the group’s investigators had been unable to speak to him.

Gebert joined the State Department in 2013, during President Barack Obama’s administration, as a “presidential management fellow,” according to an alumni magazine from his alma mater George Washington University. According to the program’s website, it “attracts and selects the best candidates possible, but is really designed with a more narrow focus – developing a cadre of potential government leaders.”"
It shouldn't be partisan or divisive to want a moral role model in the White House,https://www.usatoday.com,"['Robert Schmuhl', 'Opinion Contributor', 'Published A.M. Et Aug.']",08-20-2019,2019,8,https://www.usatoday.com/story/opinion/2019/08/20/presidents-should-be-moral-role-models-is-trump-new-normal-column/2054079001/,"FDR called the presidency 'a place of moral leadership.' That's what I've taught students for decades. Will we get that back after Donald Trump?

I received an overture the other day to compose a journalistic effusion on the consequences of presidents — well, to be specific, one president — trafficking in conspiracy theories and using the news media to amplify unverified, if not completely false, allegations. You can probably guess that an aging president-watcher would harbor a view or two on that subject. But, in a rare spasm of wordsmith reluctance, I declined.

In this political environment, to sound off about a commander in chief promoting baseless balderdash would undoubtedly lead to labeling by the officeholder’s base supporters as an “enemy” of those people or worse. We know where he stands, I could hear some readers say while rejecting the argument.

When this happens, the give-and-take of democratic conversation goes by the wayside amid a hyperpartisan atmosphere that pervades the media writ large and the public in general. Instead of the open-minded discussion of public problems a self-governing people deserves, it seems as though more and more citizens are wearing blinkers to focus their attention on party-identified differences they deem worthy of approbation or condemnation. With those blinkers firmly in place, they lose sight of the middle ground between extremes.

'Decent respect' should be the norm

At the same time polarizing partisanship has become so brass-knuckled and fierce, historic norms, conventions and traditions of the White House have of late either come under assault or been abandoned altogether. Having (in the phrase of the Declaration of Independence) “a decent respect” for the office of president and those who’ve occupied it should be natural. The genuine friendships between Gerald Ford and Jimmy Carter as well as between George H.W. Bush and Bill Clinton, rivals in the campaigns of 1976 and 1992, respectively, attest to that.

However, the recent suggestion sent via Twitter to over 63 million followers that one former president might be involved in murder gives new meaning to the word “unconventional” for anyone attempting to describe a successor to George Washington.

New York Gov. Franklin D. Roosevelt starting on a campaign speaking tour in Albany, New York, on Oct. 29, 1932. (Photo: AP)

When Franklin Roosevelt was campaigning for his first of four White House victories in 1932, he called the presidency “preeminently a place of moral leadership.” For nearly a half-century, through Democratic and Republican administrations, I’ve taught and written with Roosevelt’s insight as a lodestar or guiding principle of nonpartisan — and one always prays — fair analysis in assessing presidents, what they say and their actions.

How to define moral leadership

Though a precise definition of moral leadership is elusive for politically minded souls, some essential characteristics stand out, I’d emphasize for students or readers. From a foundation of integrity and honesty, the public figure needs to add inspiration, empathy and courage. Over time that amalgamation of attributes can develop into a full-fledged vision for governing that’s based on credibility and trust.

Individual political judgments about the merits of such leadership will differ, of course, but the reasons for pursuing one or another course are clear and usually revolve around fundamental questions. What’s the right course for the people and country? How can women and men across the nation come together to address problems? Who share these standards for governance and might be willing to help?

Unfortunately, when theory and practice collide like speeding trains, dispassionate evaluation goes off the tracks, throwing the neutral observer into a ditch of perilous surroundings. In this circumstance, even a tepid, wishy-washy explanation invariably gets interpreted as taking one side or another in whatever newsworthy matter might be playing out at the moment.

It's not partisan to want a role model

Looking beyond a particular moment looms the larger concern about the future. Put more starkly: Is what’s happening now an anomaly or an augury? Can we expect at some point to see a return to norms established by previous presidents, or will the spirit of “anything goes” continue for winners of the White House?

In sketching out traits of moral leadership on the blackboard for students, I would always include one other requirement in the inventory: emulation. Is the president (or the candidate who’s running for our highest office) someone possessing the character and temperament that other people can recognize and respect, no matter the person’s political affiliation?

Call me hopelessly old-fashioned, even deplorably die-hard, but wanting a role model in the Oval Office shouldn’t be too outlandish a dream for Americans, young, middle-age or elderly. That heartfelt wish chooses no partisan side — just the common, and national, good.

Robert Schmuhl is a professor emeritus of American studies and journalism at the University of Notre Dame and author of ""The Glory and the Burden: The American Presidency from FDR to Trump,"" which will be published Sept. 15.

You can read diverse opinions from our Board of Contributors and other writers on the Opinion front page, on Twitter @usatodayopinion and in our daily Opinion newsletter. To respond to a column, submit a comment to letters@usatoday.com.

Read or Share this story: https://www.usatoday.com/story/opinion/2019/08/20/presidents-should-be-moral-role-models-is-trump-new-normal-column/2054079001/"
"USDA finds religious exempt chicken, small operators have pathogen problems",https://www.foodsafetynews.com,"['Coral Beach', 'Guest Contributor', 'Dan Flynn', 'Bill Marler', 'August', 'Powered By']",08-20-2019,2019,8,https://www.foodsafetynews.com/2019/08/usda-finds-religious-exempt-chicken-small-operators-have-pathogen-problems/,"Tests showed a higher than average prevalence of Salmonella and Campylobacter in chicken that is produced under religious exemptions and at low-volume facilities, but the government is not going to propose rules for them.

In a process that began in June 2017, the USDA’s Food Safety and Inspection Service (FSIS) collected and tested more than 3,600 samples, according to an update this week. The sub-agency of the U.S. Department of Agriculture reported that it will no longer sample or test the specific products for Salmonella and Campylobacter.

“FSIS found that generally religious exempt poultry products and a subset of the low volume products sampled have a higher than national average rate of Salmonella and Campylobacter contamination,” the government reported.

But, saying those products make up a small portion of the country’s food supply, the USDA does not plan to take action toward regulation. A campaign to raise awareness is planned instead.

“The agency does not intend to propose performance standards for these products at this time,” according to the update.

“FSIS will use these results to conduct outreach with the industry and consumers to encourage the safe production and handling of these raw poultry products.”

The FSIS testing project specifically involved religious exempt chicken carcasses and low-volume poultry products. The agency “will no longer sample or test the products for Salmonella and Campylobacter.”

Neither religious exempt carcasses nor chicken products produced in low-volume operations are not subject to the government’s Salmonella contamination standards that apply to other chicken. Chicken carcasses that are religiously exempt from certain federal laws already do not receive the USDA inspection mark, which is printed inside the agency’s seal on non-exempt chicken.

Low-volume products are defined by federal code as being produced with an average daily volume of 1,000 pounds or less. The FSIS tested more than 3,600 samples of low-production chicken.

Beginning in June 2017, FSIS collected more than 150 samples from religious exempt chicken carcasses and tested them for Salmonella and Campylobacter contamination.

Both Salmonella and Campylobacter can cause serious illnesses and sometimes death in humans."
"Colorado area missed air quality deadline, plans to improve",https://www.thedenverchannel.com,[],08-19-2019,2019,8,https://www.thedenverchannel.com/news/local-news/colorado-area-missed-air-quality-deadline-plans-to-improve,"FORT COLLINS, Colo. (AP) — The Environmental Protection Agency has announced a Colorado region missed its air quality standards deadline.

The Coloradoan reports that the EPA is expected to mark the nine-county North Front Range region that includes Denver county in serious noncompliance with a federal standard.

Experts say this region has high concentrations of ground-level ozone and smog that could lead to respiratory health issues and heart disease.

Officials say the Air Quality Control Commission passed a zero-emission vehicle standard on Friday in the region to reduce the effects.

Experts say air quality improved on average over the last decade despite the announcement, and the region has plans to adopt more regulations for emission-producing industries.

Officials say the region withdrew an extension request to meet the deadline to better prioritize improvement plans.

___

Information from: Fort Collins Coloradoan, http://www.coloradoan.com"
"VA wrongfully denied $53 million in veterans' medical claims in one 6-month period, says report",https://www.nbcnews.com,"['Courtney Kube', 'Courtney Kube Is A Correspondent Covering National Security', 'The Military For The Nbc News Investigative Unit.', 'Adiel Kaplan', 'Adiel Kaplan Is A Reporter With The Nbc News Investigative Unit.', 'Mosheh Gains', 'Mosheh Gains Is A Pentagon Producer For Nbc News.', 'Carol Eggers']",08-17-2019,2019,8,https://www.nbcnews.com/news/military/va-wrongfully-denied-53-million-veterans-medical-claims-one-6-n1043086,"VA wrongfully denied $53 million in veterans' medical claims in one 6-month period, says report

In one recent six-month period, the VA left 17,400 veterans to pay out of pocket for emergency medical care the government should have covered."
